resnet18-ablation/final_results/resnet-18-curve.log
{"i": ["cuda -model=unknown", "topi_nn_conv2d", [["TENSOR", [1, 512, 7, 7], "float32"], ["TENSOR", [512, 512, 3, 3], "float32"], [1, 1], [1, 1], [1, 1], "NCHW", "float32"], {}, ["conv2d", [1, 512, 7, 7, "float32"], [512, 512, 3, 3, "float32"], [1, 1], [1, 1], [1, 1], "NCHW", "float32"], {"i": 343511, "t": "winograd", "c": null, "e": [["tile_b", "sp", [16, 1, 1, 1]], ["tile_y", "sp", [4, 2, 32, 2]], ["tile_x", "sp", [1, 4, 2, 2]], ["tile_rc", "sp", [32, 16]], ["auto_unroll_max_step", "ot", 128], ["unroll_explicit", "ot", 1]]}], "r": [[7.861215000000001e-05], 0, 1.998267412185669, 1543974428.275964], "v": 0.1}
{"i": ["cuda -model=unknown", "topi_nn_conv2d", [["TENSOR", [1, 256, 14, 14], "float32"], ["TENSOR", [512, 256, 1, 1], "float32"], [2, 2], [0, 0], [1, 1], "NCHW", "float32"], {}, ["conv2d", [1, 256, 14, 14, "float32"], [512, 256, 1, 1, "float32"], [2, 2], [0, 0], [1, 1], "NCHW", "float32"], {"i": 139068, "t": "direct", "c": null, "e": [["tile_f", "sp", [32, 2, 8, 1]], ["tile_y", "sp", [7, 1, 1, 1]], ["tile_x", "sp", [1, 1, 7, 1]], ["tile_rc", "sp", [32, 8]], ["tile_ry", "sp", [1, 1]], ["tile_rx", "sp", [1, 1]], ["auto_unroll_max_step", "ot", 512], ["unroll_explicit", "ot", 1]]}], "r": [[1.5982449999999998e-05], 0, 0.9471445083618164, 1543976440.713232], "v": 0.1}
{"i": ["cuda -model=unknown", "topi_nn_conv2d", [["TENSOR", [1, 256, 14, 14], "float32"], ["TENSOR", [512, 256, 3, 3], "float32"], [2, 2], [1, 1], [1, 1], "NCHW", "float32"], {}, ["conv2d", [1, 256, 14, 14, "float32"], [512, 256, 3, 3, "float32"], [2, 2], [1, 1], [1, 1], "NCHW", "float32"], {"i": 612940, "t": "direct", "c": null, "e": [["tile_f", "sp", [64, 2, 4, 1]], ["tile_y", "sp", [1, 1, 7, 1]], ["tile_x", "sp", [7, 1, 1, 1]], ["tile_rc", "sp", [32, 8]], ["tile_ry", "sp", [1, 3]], ["tile_rx", "sp", [1, 3]], ["auto_unroll_max_step", "ot", 512], ["unroll_explicit", "ot", 1]]}], "r": [[0.00010344684999999999], 0, 1.4494514465332031, 1543977590.953991], "v": 0.1}
{"i": ["cuda -model=unknown", "topi_nn_conv2d", [["TENSOR", [1, 256, 14, 14], "float32"], ["TENSOR", [256, 256, 3, 3], "float32"], [1, 1], [1, 1], [1, 1], "NCHW", "float32"], {}, ["conv2d", [1, 256, 14, 14, "float32"], [256, 256, 3, 3, "float32"], [1, 1], [1, 1], [1, 1], "NCHW", "float32"], {"i": 21693, "t": "winograd", "c": null, "e": [["tile_b", "sp", [16, 1, 1, 1]], ["tile_y", "sp", [2, 1, 64, 2]], ["tile_x", "sp", [7, 7, 1, 1]], ["tile_rc", "sp", [16, 16]], ["auto_unroll_max_step", "ot", 128], ["unroll_explicit", "ot", 0]]}], "r": [[5.36957e-05], 0, 1.3526523113250732, 1543978417.4005892], "v": 0.1}
{"i": ["cuda -model=unknown", "topi_nn_conv2d", [["TENSOR", [1, 128, 28, 28], "float32"], ["TENSOR", [256, 128, 1, 1], "float32"], [2, 2], [0, 0], [1, 1], "NCHW", "float32"], {}, ["conv2d", [1, 128, 28, 28, "float32"], [256, 128, 1, 1, "float32"], [2, 2], [0, 0], [1, 1], "NCHW", "float32"], {"i": 1496940, "t": "direct", "c": null, "e": [["tile_f", "sp", [32, 1, 4, 2]], ["tile_y", "sp", [14, 1, 1, 1]], ["tile_x", "sp", [1, 2, 7, 1]], ["tile_rc", "sp", [16, 8]], ["tile_ry", "sp", [1, 1]], ["tile_rx", "sp", [1, 1]], ["auto_unroll_max_step", "ot", 512], ["unroll_explicit", "ot", 1]]}], "r": [[1.4019900000000001e-05], 0, 1.1649181842803955, 1543979523.073885], "v": 0.1}
{"i": ["cuda -model=unknown", "topi_nn_conv2d", [["TENSOR", [1, 128, 28, 28], "float32"], ["TENSOR", [256, 128, 3, 3], "float32"], [2, 2], [1, 1], [1, 1], "NCHW", "float32"], {}, ["conv2d", [1, 128, 28, 28, "float32"], [256, 128, 3, 3, "float32"], [2, 2], [1, 1], [1, 1], "NCHW", "float32"], {"i": 7815738, "t": "direct", "c": null, "e": [["tile_f", "sp", [32, 2, 4, 1]], ["tile_y", "sp", [1, 1, 14, 1]], ["tile_x", "sp", [14, 1, 1, 1]], ["tile_rc", "sp", [64, 2]], ["tile_ry", "sp", [1, 3]], ["tile_rx", "sp", [1, 3]], ["auto_unroll_max_step", "ot", 1500], ["unroll_explicit", "ot", 1]]}], "r": [[7.41134e-05], 0, 1.2506608963012695, 1543981501.3990374], "v": 0.1}
{"i": ["cuda -model=unknown", "topi_nn_conv2d", [["TENSOR", [1, 128, 28, 28], "float32"], ["TENSOR", [128, 128, 3, 3], "float32"], [1, 1], [1, 1], [1, 1], "NCHW", "float32"], {}, ["conv2d", [1, 128, 28, 28, "float32"], [128, 128, 3, 3, "float32"], [1, 1], [1, 1], [1, 1], "NCHW", "float32"], {"i": 122002, "t": "winograd", "c": null, "e": [["tile_b", "sp", [16, 1, 1, 1]], ["tile_y", "sp", [2, 1, 16, 4]], ["tile_x", "sp", [7, 7, 4, 1]], ["tile_rc", "sp", [32, 4]], ["auto_unroll_max_step", "ot", 128], ["unroll_explicit", "ot", 0]]}], "r": [[3.65852e-05], 0, 1.275254726409912, 1543982458.1740825], "v": 0.1}
{"i": ["cuda -model=unknown", "topi_nn_conv2d", [["TENSOR", [1, 64, 56, 56], "float32"], ["TENSOR", [128, 64, 1, 1], "float32"], [2, 2], [0, 0], [1, 1], "NCHW", "float32"], {}, ["conv2d", [1, 64, 56, 56, "float32"], [128, 64, 1, 1, "float32"], [2, 2], [0, 0], [1, 1], "NCHW", "float32"], {"i": 120031, "t": "direct", "c": null, "e": [["tile_f", "sp", [2, 2, 32, 1]], ["tile_y", "sp", [28, 1, 1, 1]], ["tile_x", "sp", [1, 2, 7, 2]], ["tile_rc", "sp", [64, 1]], ["tile_ry", "sp", [1, 1]], ["tile_rx", "sp", [1, 1]], ["auto_unroll_max_step", "ot", 0], ["unroll_explicit", "ot", 0]]}], "r": [[1.90991e-05], 0, 0.9820103645324707, 1543984257.9364073], "v": 0.1}
{"i": ["cuda -model=unknown", "topi_nn_conv2d", [["TENSOR", [1, 64, 56, 56], "float32"], ["TENSOR", [128, 64, 3, 3], "float32"], [2, 2], [1, 1], [1, 1], "NCHW", "float32"], {}, ["conv2d", [1, 64, 56, 56, "float32"], [128, 64, 3, 3, "float32"], [2, 2], [1, 1], [1, 1], "NCHW", "float32"], {"i": 25786337, "t": "direct", "c": null, "e": [["tile_f", "sp", [8, 4, 4, 1]], ["tile_y", "sp", [14, 1, 2, 1]], ["tile_x", "sp", [4, 1, 7, 1]], ["tile_rc", "sp", [32, 2]], ["tile_ry", "sp", [1, 3]], ["tile_rx", "sp", [1, 3]], ["auto_unroll_max_step", "ot", 512], ["unroll_explicit", "ot", 1]]}], "r": [[5.93167e-05], 0, 1.4258615970611572, 1543985073.8367565], "v": 0.1}
{"i": ["cuda -model=unknown", "topi_nn_conv2d", [["TENSOR", [1, 64, 56, 56], "float32"], ["TENSOR", [64, 64, 1, 1], "float32"], [1, 1], [0, 0], [1, 1], "NCHW", "float32"], {}, ["conv2d", [1, 64, 56, 56, "float32"], [64, 64, 1, 1, "float32"], [1, 1], [0, 0], [1, 1], "NCHW", "float32"], {"i": 5645577, "t": "direct", "c": null, "e": [["tile_f", "sp", [1, 8, 8, 1]], ["tile_y", "sp", [14, 2, 2, 1]], ["tile_x", "sp", [7, 1, 4, 2]], ["tile_rc", "sp", [8, 8]], ["tile_ry", "sp", [1, 1]], ["tile_rx", "sp", [1, 1]], ["auto_unroll_max_step", "ot", 512], ["unroll_explicit", "ot", 0]]}], "r": [[1.53431e-05], 0, 1.2153453826904297, 1543987005.0471187], "v": 0.1}
{"i": ["cuda -model=unknown", "topi_nn_conv2d", [["TENSOR", [1, 64, 56, 56], "float32"], ["TENSOR", [64, 64, 3, 3], "float32"], [1, 1], [1, 1], [1, 1], "NCHW", "float32"], {}, ["conv2d", [1, 64, 56, 56, "float32"], [64, 64, 3, 3, "float32"], [1, 1], [1, 1], [1, 1], "NCHW", "float32"], {"i": 46384, "t": "winograd", "c": null, "e": [["tile_b", "sp", [36, 1, 1, 1]], ["tile_y", "sp", [2, 8, 4, 1]], ["tile_x", "sp", [1, 2, 49, 2]], ["tile_rc", "sp", [2, 32]], ["auto_unroll_max_step", "ot", 0], ["unroll_explicit", "ot", 0]]}], "r": [[4.523415e-05], 0, 2.853856086730957, 1543988247.0525634], "v": 0.1}
{"i": ["cuda -model=unknown", "topi_nn_conv2d", [["TENSOR", [1, 3, 224, 224], "float32"], ["TENSOR", [64, 3, 7, 7], "float32"], [2, 2], [3, 3], [1, 1], "NCHW", "float32"], {}, ["conv2d", [1, 3, 224, 224, "float32"], [64, 3, 7, 7, "float32"], [2, 2], [3, 3], [1, 1], "NCHW", "float32"], {"i": 32516445, "t": "direct", "c": null, "e": [["tile_f", "sp", [1, 4, 8, 2]], ["tile_y", "sp", [112, 1, 1, 1]], ["tile_x", "sp", [2, 1, 8, 7]], ["tile_rc", "sp", [1, 3]], ["tile_ry", "sp", [1, 7]], ["tile_rx", "sp", [7, 1]], ["auto_unroll_max_step", "ot", 1500], ["unroll_explicit", "ot", 0]]}], "r": [[8.60557e-05], 0, 1.5214028358459473, 1543989592.7124531], "v": 0.1}
