matmul.log
{"i": ["cuda", "matmul", [512, 512, 512], {}, ["matmul", 512, 512, 512], {"i": 0, "t": "", "c": null, "e": [["tile_y", "sp", [512, 1]], ["tile_x", "sp", [512, 1]]]}], "r": [[0.012837547999999999], 0, 1.0613353252410889, 1543862392.9689226], "v": 0.1}
