transfer-learning/conv2d_transfer_curve_c12_c7_0_1_2_3.log
{"i": ["cuda", "conv2d_no_batching", [1, 28, 28, 128, 256, 3, 3, [2, 2], [1, 1]], {}, ["conv2d_no_batching", 1, 28, 28, 128, 256, 3, 3, [2, 2], [1, 1]], {"i": 73268901, "t": "", "c": null, "e": [["tile_f", "sp", [16, 1, 8, 1]], ["tile_y", "sp", [1, 1, 2, 7]], ["tile_x", "sp", [14, 1, 1, 1]], ["tile_rc", "sp", [256, 1, 1]], ["tile_ry", "sp", [1, 1, 3]], ["tile_rx", "sp", [1, 1, 3]], ["auto_unroll_max_step", "ot", 1500], ["unroll_explicit", "ot", 1]]}], "r": [[0.00026053800325732897], 0, 1.5088021755218506, 1544131490.0375257], "v": 0.1}
{"i": ["cuda", "conv2d_no_batching", [1, 28, 28, 128, 256, 3, 3, [2, 2], [1, 1]], {}, ["conv2d_no_batching", 1, 28, 28, 128, 256, 3, 3, [2, 2], [1, 1]], {"i": 73330221, "t": "", "c": null, "e": [["tile_f", "sp", [16, 1, 8, 1]], ["tile_y", "sp", [1, 2, 1, 7]], ["tile_x", "sp", [14, 1, 1, 1]], ["tile_rc", "sp", [64, 4, 1]], ["tile_ry", "sp", [1, 1, 3]], ["tile_rx", "sp", [1, 1, 3]], ["auto_unroll_max_step", "ot", 1500], ["unroll_explicit", "ot", 1]]}], "r": [[0.00021245901465798044], 0, 2.3398706912994385, 1544131491.2841883], "v": 0.1}
{"i": ["cuda", "conv2d_no_batching", [1, 28, 28, 128, 256, 3, 3, [2, 2], [1, 1]], {}, ["conv2d_no_batching", 1, 28, 28, 128, 256, 3, 3, [2, 2], [1, 1]], {"i": 73270576, "t": "", "c": null, "e": [["tile_f", "sp", [16, 2, 4, 1]], ["tile_y", "sp", [2, 1, 1, 7]], ["tile_x", "sp", [7, 2, 1, 1]], ["tile_rc", "sp", [256, 1, 1]], ["tile_ry", "sp", [1, 1, 3]], ["tile_rx", "sp", [1, 1, 3]], ["auto_unroll_max_step", "ot", 1500], ["unroll_explicit", "ot", 1]]}], "r": [[0.0002645796205211726], 0, 1.7045984268188477, 1544131492.4840305], "v": 0.1}
{"i": ["cuda", "conv2d_no_batching", [1, 28, 28, 128, 256, 3, 3, [2, 2], [1, 1]], {}, ["conv2d_no_batching", 1, 28, 28, 128, 256, 3, 3, [2, 2], [1, 1]], {"i": 73360936, "t": "", "c": null, "e": [["tile_f", "sp", [16, 2, 4, 1]], ["tile_y", "sp", [1, 2, 1, 7]], ["tile_x", "sp", [14, 1, 1, 1]], ["tile_rc", "sp", [32, 8, 1]], ["tile_ry", "sp", [1, 1, 3]], ["tile_rx", "sp", [1, 1, 3]], ["auto_unroll_max_step", "ot", 1500], ["unroll_explicit", "ot", 1]]}], "r": [[0.00023294128664495115], 0, 2.1532704830169678, 1544131493.6677568], "v": 0.1}
{"i": ["cuda", "conv2d_no_batching", [1, 28, 28, 128, 256, 3, 3, [2, 2], [1, 1]], {}, ["conv2d_no_batching", 1, 28, 28, 128, 256, 3, 3, [2, 2], [1, 1]], {"i": 73361056, "t": "", "c": null, "e": [["tile_f", "sp", [16, 2, 4, 1]], ["tile_y", "sp", [1, 1, 2, 7]], ["tile_x", "sp", [14, 1, 1, 1]], ["tile_rc", "sp", [32, 8, 1]], ["tile_ry", "sp", [1, 1, 3]], ["tile_rx", "sp", [1, 1, 3]], ["auto_unroll_max_step", "ot", 1500], ["unroll_explicit", "ot", 1]]}], "r": [[0.00014347583475783475], 0, 1.5005757808685303, 1544131594.3786411], "v": 0.1}
{"i": ["cuda", "conv2d_no_batching", [1, 28, 28, 128, 256, 3, 3, [2, 2], [1, 1]], {}, ["conv2d_no_batching", 1, 28, 28, 128, 256, 3, 3, [2, 2], [1, 1]], {"i": 73332021, "t": "", "c": null, "e": [["tile_f", "sp", [16, 1, 8, 1]], ["tile_y", "sp", [2, 1, 1, 7]], ["tile_x", "sp", [7, 2, 1, 1]], ["tile_rc", "sp", [64, 4, 1]], ["tile_ry", "sp", [1, 1, 3]], ["tile_rx", "sp", [1, 1, 3]], ["auto_unroll_max_step", "ot", 1500], ["unroll_explicit", "ot", 1]]}], "r": [[0.0002171736596091205], 0, 2.3015873432159424, 1544131495.8638184], "v": 0.1}
{"i": ["cuda", "conv2d_no_batching", [1, 28, 28, 128, 256, 3, 3, [2, 2], [1, 1]], {}, ["conv2d_no_batching", 1, 28, 28, 128, 256, 3, 3, [2, 2], [1, 1]], {"i": 73332010, "t": "", "c": null, "e": [["tile_f", "sp", [16, 4, 2, 1]], ["tile_y", "sp", [2, 1, 1, 7]], ["tile_x", "sp", [7, 2, 1, 1]], ["tile_rc", "sp", [64, 4, 1]], ["tile_ry", "sp", [1, 1, 3]], ["tile_rx", "sp", [1, 1, 3]], ["auto_unroll_max_step", "ot", 1500], ["unroll_explicit", "ot", 1]]}], "r": [[0.0004354587068403909], 0, 2.825456380844116, 1544131497.4509196], "v": 0.1}
{"i": ["cuda", "conv2d_no_batching", [1, 28, 28, 128, 256, 3, 3, [2, 2], [1, 1]], {}, ["conv2d_no_batching", 1, 28, 28, 128, 256, 3, 3, [2, 2], [1, 1]], {"i": 73330336, "t": "", "c": null, "e": [["tile_f", "sp", [16, 2, 4, 1]], ["tile_y", "sp", [1, 1, 2, 7]], ["tile_x", "sp", [14, 1, 1, 1]], ["tile_rc", "sp", [64, 4, 1]], ["tile_ry", "sp", [1, 1, 3]], ["tile_rx", "sp", [1, 1, 3]], ["auto_unroll_max_step", "ot", 1500], ["unroll_explicit", "ot", 1]]}], "r": [[0.0001948723338762215], 0, 2.0315074920654297, 1544131498.5715754], "v": 0.1}
{"i": ["cuda", "conv2d_no_batching", [1, 28, 28, 128, 256, 3, 3, [2, 2], [1, 1]], {}, ["conv2d_no_batching", 1, 28, 28, 128, 256, 3, 3, [2, 2], [1, 1]], {"i": 73337776, "t": "", "c": null, "e": [["tile_f", "sp", [16, 2, 4, 1]], ["tile_y", "sp", [2, 1, 1, 7]], ["tile_x", "sp", [7, 1, 2, 1]], ["tile_rc", "sp", [64, 4, 1]], ["tile_ry", "sp", [1, 1, 3]], ["tile_rx", "sp", [1, 1, 3]], ["auto_unroll_max_step", "ot", 1500], ["unroll_explicit", "ot", 1]]}], "r": [[0.00021294016938110748], 0, 2.064150094985962, 1544131499.7288713], "v": 0.1}
{"i": ["cuda", "conv2d_no_batching", [1, 28, 28, 128, 256, 3, 3, [2, 2], [1, 1]], {}, ["conv2d_no_batching", 1, 28, 28, 128, 256, 3, 3, [2, 2], [1, 1]], {"i": 73460656, "t": "", "c": null, "e": [["tile_f", "sp", [16, 2, 4, 1]], ["tile_y", "sp", [2, 1, 1, 7]], ["tile_x", "sp", [7, 1, 2, 1]], ["tile_rc", "sp", [4, 64, 1]], ["tile_ry", "sp", [1, 1, 3]], ["tile_rx", "sp", [1, 1, 3]], ["auto_unroll_max_step", "ot", 1500], ["unroll_explicit", "ot", 1]]}], "r": [[0.0004817420114006515], 0, 5.123643636703491, 1544131501.5687454], "v": 0.1}
{"i": ["cuda", "conv2d_no_batching", [1, 28, 28, 128, 256, 3, 3, [2, 2], [1, 1]], {}, ["conv2d_no_batching", 1, 28, 28, 128, 256, 3, 3, [2, 2], [1, 1]], {"i": 73454896, "t": "", "c": null, "e": [["tile_f", "sp", [16, 2, 4, 1]], ["tile_y", "sp", [2, 1, 1, 7]], ["tile_x", "sp", [7, 2, 1, 1]], ["tile_rc", "sp", [4, 64, 1]], ["tile_ry", "sp", [1, 1, 3]], ["tile_rx", "sp", [1, 1, 3]], ["auto_unroll_max_step", "ot", 1500], ["unroll_explicit", "ot", 1]]}], "r": [[0.0008317594185667753], 0, 7.496467590332031, 1544131504.2745717], "v": 0.1}
{"i": ["cuda", "conv2d_no_batching", [1, 28, 28, 128, 256, 3, 3, [2, 2], [1, 1]], {}, ["conv2d_no_batching", 1, 28, 28, 128, 256, 3, 3, [2, 2], [1, 1]], {"i": 73453216, "t": "", "c": null, "e": [["tile_f", "sp", [16, 2, 4, 1]], ["tile_y", "sp", [1, 1, 2, 7]], ["tile_x", "sp", [14, 1, 1, 1]], ["tile_rc", "sp", [4, 64, 1]], ["tile_ry", "sp", [1, 1, 3]], ["tile_rx", "sp", [1, 1, 3]], ["auto_unroll_max_step", "ot", 1500], ["unroll_explicit", "ot", 1]]}], "r": [[0.0007802507833876222], 0, 6.1055145263671875, 1544131507.7131827], "v": 0.1}
{"i": ["cuda", "conv2d_no_batching", [1, 28, 28, 128, 256, 3, 3, [2, 2], [1, 1]], {}, ["conv2d_no_batching", 1, 28, 28, 128, 256, 3, 3, [2, 2], [1, 1]], {"i": 73391661, "t": "", "c": null, "e": [["tile_f", "sp", [16, 1, 8, 1]], ["tile_y", "sp", [1, 2, 1, 7]], ["tile_x", "sp", [14, 1, 1, 1]], ["tile_rc", "sp", [16, 16, 1]], ["tile_ry", "sp", [1, 1, 3]], ["tile_rx", "sp", [1, 1, 3]], ["auto_unroll_max_step", "ot", 1500], ["unroll_explicit", "ot", 1]]}], "r": [[0.00024066110749185668], 0, 2.064108371734619, 1544131508.886258], "v": 0.1}
{"i": ["cuda", "conv2d_no_batching", [1, 28, 28, 128, 256, 3, 3, [2, 2], [1, 1]], {}, ["conv2d_no_batching", 1, 28, 28, 128, 256, 3, 3, [2, 2], [1, 1]], {"i": 73270563, "t": "", "c": null, "e": [["tile_f", "sp", [16, 8, 1, 1]], ["tile_y", "sp", [2, 1, 1, 7]], ["tile_x", "sp", [7, 2, 1, 1]], ["tile_rc", "sp", [256, 1, 1]], ["tile_ry", "sp", [1, 1, 3]], ["tile_rx", "sp", [1, 1, 3]], ["auto_unroll_max_step", "ot", 1500], ["unroll_explicit", "ot", 1]]}], "r": [[0.000979472364820847], 0, 4.05040717124939, 1544131511.5223386], "v": 0.1}
{"i": ["cuda", "conv2d_no_batching", [1, 28, 28, 128, 256, 3, 3, [2, 2], [1, 1]], {}, ["conv2d_no_batching", 1, 28, 28, 128, 256, 3, 3, [2, 2], [1, 1]], {"i": 73268781, "t": "", "c": null, "e": [["tile_f", "sp", [16, 1, 8, 1]], ["tile_y", "sp", [1, 2, 1, 7]], ["tile_x", "sp", [14, 1, 1, 1]], ["tile_rc", "sp", [256, 1, 1]], ["tile_ry", "sp", [1, 1, 3]], ["tile_rx", "sp", [1, 1, 3]], ["auto_unroll_max_step", "ot", 1500], ["unroll_explicit", "ot", 1]]}], "r": [[0.0002442077361563518], 0, 1.516193151473999, 1544131512.6590376], "v": 0.1}
{"i": ["cuda", "conv2d_no_batching", [1, 28, 28, 128, 256, 3, 3, [2, 2], [1, 1]], {}, ["conv2d_no_batching", 1, 28, 28, 128, 256, 3, 3, [2, 2], [1, 1]], {"i": 73360930, "t": "", "c": null, "e": [["tile_f", "sp", [16, 4, 2, 1]], ["tile_y", "sp", [1, 2, 1, 7]], ["tile_x", "sp", [14, 1, 1, 1]], ["tile_rc", "sp", [32, 8, 1]], ["tile_ry", "sp", [1, 1, 3]], ["tile_rx", "sp", [1, 1, 3]], ["auto_unroll_max_step", "ot", 1500], ["unroll_explicit", "ot", 1]]}], "r": [[0.00041362611726384366], 0, 3.3176324367523193, 1544131514.2840545], "v": 0.1}
{"i": ["cuda", "conv2d_no_batching", [1, 28, 28, 128, 256, 3, 3, [2, 2], [1, 1]], {}, ["conv2d_no_batching", 1, 28, 28, 128, 256, 3, 3, [2, 2], [1, 1]], {"i": 73330216, "t": "", "c": null, "e": [["tile_f", "sp", [16, 2, 4, 1]], ["tile_y", "sp", [1, 2, 1, 7]], ["tile_x", "sp", [14, 1, 1, 1]], ["tile_rc", "sp", [64, 4, 1]], ["tile_ry", "sp", [1, 1, 3]], ["tile_rx", "sp", [1, 1, 3]], ["auto_unroll_max_step", "ot", 1500], ["unroll_explicit", "ot", 1]]}], "r": [[0.0002483514706840391], 0, 2.7942147254943848, 1544131515.5043292], "v": 0.1}
{"i": ["cuda", "conv2d_no_batching", [1, 28, 28, 128, 256, 3, 3, [2, 2], [1, 1]], {}, ["conv2d_no_batching", 1, 28, 28, 128, 256, 3, 3, [2, 2], [1, 1]], {"i": 73453096, "t": "", "c": null, "e": [["tile_f", "sp", [16, 2, 4, 1]], ["tile_y", "sp", [1, 2, 1, 7]], ["tile_x", "sp", [14, 1, 1, 1]], ["tile_rc", "sp", [4, 64, 1]], ["tile_ry", "sp", [1, 1, 3]], ["tile_rx", "sp", [1, 1, 3]], ["auto_unroll_max_step", "ot", 1500], ["unroll_explicit", "ot", 1]]}], "r": [[0.0007630691221498371], 0, 7.476964712142944, 1544131518.0875902], "v": 0.1}
{"i": ["cuda", "conv2d_no_batching", [1, 28, 28, 128, 256, 3, 3, [2, 2], [1, 1]], {}, ["conv2d_no_batching", 1, 28, 28, 128, 256, 3, 3, [2, 2], [1, 1]], {"i": 60865450, "t": "", "c": null, "e": [["tile_f", "sp", [16, 4, 2, 1]], ["tile_y", "sp", [2, 1, 1, 7]], ["tile_x", "sp", [7, 1, 2, 1]], ["tile_rc", "sp", [128, 2, 1]], ["tile_ry", "sp", [1, 1, 3]], ["tile_rx", "sp", [1, 1, 3]], ["auto_unroll_max_step", "ot", 512], ["unroll_explicit", "ot", 1]]}], "r": [[0.00038150019543973943], 0, 2.0304980278015137, 1544131519.5168772], "v": 0.1}
{"i": ["cuda", "conv2d_no_batching", [1, 28, 28, 128, 256, 3, 3, [2, 2], [1, 1]], {}, ["conv2d_no_batching", 1, 28, 28, 128, 256, 3, 3, [2, 2], [1, 1]], {"i": 60827301, "t": "", "c": null, "e": [["tile_f", "sp", [16, 1, 8, 1]], ["tile_y", "sp", [1, 1, 2, 7]], ["tile_x", "sp", [14, 1, 1, 1]], ["tile_rc", "sp", [256, 1, 1]], ["tile_ry", "sp", [1, 1, 3]], ["tile_rx", "sp", [1, 1, 3]], ["auto_unroll_max_step", "ot", 512], ["unroll_explicit", "ot", 1]]}], "r": [[0.00025819754397394135], 0, 1.507657766342163, 1544131520.6612964], "v": 0.1}
{"i": ["cuda", "conv2d_no_batching", [1, 28, 28, 128, 256, 3, 3, [2, 2], [1, 1]], {}, ["conv2d_no_batching", 1, 28, 28, 128, 256, 3, 3, [2, 2], [1, 1]], {"i": 60919330, "t": "", "c": null, "e": [["tile_f", "sp", [16, 4, 2, 1]], ["tile_y", "sp", [1, 2, 1, 7]], ["tile_x", "sp", [14, 1, 1, 1]], ["tile_rc", "sp", [32, 8, 1]], ["tile_ry", "sp", [1, 1, 3]], ["tile_rx", "sp", [1, 1, 3]], ["auto_unroll_max_step", "ot", 512], ["unroll_explicit", "ot", 1]]}], "r": [[0.00041351513355048863], 0, 3.300522565841675, 1544131522.2805264], "v": 0.1}
{"i": ["cuda", "conv2d_no_batching", [1, 28, 28, 128, 256, 3, 3, [2, 2], [1, 1]], {}, ["conv2d_no_batching", 1, 28, 28, 128, 256, 3, 3, [2, 2], [1, 1]], {"i": 61013301, "t": "", "c": null, "e": [["tile_f", "sp", [16, 1, 8, 1]], ["tile_y", "sp", [2, 1, 1, 7]], ["tile_x", "sp", [7, 2, 1, 1]], ["tile_rc", "sp", [4, 64, 1]], ["tile_ry", "sp", [1, 1, 3]], ["tile_rx", "sp", [1, 1, 3]], ["auto_unroll_max_step", "ot", 512], ["unroll_explicit", "ot", 1]]}], "r": [[0.002016011545602606], 0, 4.858350038528442, 1544131526.6754563], "v": 0.1}
{"i": ["cuda", "conv2d_no_batching", [1, 28, 28, 128, 256, 3, 3, [2, 2], [1, 1]], {}, ["conv2d_no_batching", 1, 28, 28, 128, 256, 3, 3, [2, 2], [1, 1]], {"i": 60828963, "t": "", "c": null, "e": [["tile_f", "sp", [16, 8, 1, 1]], ["tile_y", "sp", [2, 1, 1, 7]], ["tile_x", "sp", [7, 2, 1, 1]], ["tile_rc", "sp", [256, 1, 1]], ["tile_ry", "sp", [1, 1, 3]], ["tile_rx", "sp", [1, 1, 3]], ["auto_unroll_max_step", "ot", 512], ["unroll_explicit", "ot", 1]]}], "r": [[0.007924382146579804], 0, 16.146090269088745, 1544131542.05142], "v": 0.1}
{"i": ["cuda", "conv2d_no_batching", [1, 28, 28, 128, 256, 3, 3, [2, 2], [1, 1]], {}, ["conv2d_no_batching", 1, 28, 28, 128, 256, 3, 3, [2, 2], [1, 1]], {"i": 61011496, "t": "", "c": null, "e": [["tile_f", "sp", [16, 2, 4, 1]], ["tile_y", "sp", [1, 2, 1, 7]], ["tile_x", "sp", [14, 1, 1, 1]], ["tile_rc", "sp", [4, 64, 1]], ["tile_ry", "sp", [1, 1, 3]], ["tile_rx", "sp", [1, 1, 3]], ["auto_unroll_max_step", "ot", 512], ["unroll_explicit", "ot", 1]]}], "r": [[0.002500722667752443], 0, 5.865716934204102, 1544131547.371615], "v": 0.1}
{"i": ["cuda", "conv2d_no_batching", [1, 28, 28, 128, 256, 3, 3, [2, 2], [1, 1]], {}, ["conv2d_no_batching", 1, 28, 28, 128, 256, 3, 3, [2, 2], [1, 1]], {"i": 60888621, "t": "", "c": null, "e": [["tile_f", "sp", [16, 1, 8, 1]], ["tile_y", "sp", [1, 2, 1, 7]], ["tile_x", "sp", [14, 1, 1, 1]], ["tile_rc", "sp", [64, 4, 1]], ["tile_ry", "sp", [1, 1, 3]], ["tile_rx", "sp", [1, 1, 3]], ["auto_unroll_max_step", "ot", 512], ["unroll_explicit", "ot", 1]]}], "r": [[0.00021312721824104234], 0, 1.820831537246704, 1544131548.5144367], "v": 0.1}
{"i": ["cuda", "conv2d_no_batching", [1, 28, 28, 128, 256, 3, 3, [2, 2], [1, 1]], {}, ["conv2d_no_batching", 1, 28, 28, 128, 256, 3, 3, [2, 2], [1, 1]], {"i": 60890410, "t": "", "c": null, "e": [["tile_f", "sp", [16, 4, 2, 1]], ["tile_y", "sp", [2, 1, 1, 7]], ["tile_x", "sp", [7, 2, 1, 1]], ["tile_rc", "sp", [64, 4, 1]], ["tile_ry", "sp", [1, 1, 3]], ["tile_rx", "sp", [1, 1, 3]], ["auto_unroll_max_step", "ot", 512], ["unroll_explicit", "ot", 1]]}], "r": [[0.0004362936693811075], 0, 2.793566942214966, 1544131550.084353], "v": 0.1}
{"i": ["cuda", "conv2d_no_batching", [1, 28, 28, 128, 256, 3, 3, [2, 2], [1, 1]], {}, ["conv2d_no_batching", 1, 28, 28, 128, 256, 3, 3, [2, 2], [1, 1]], {"i": 60896176, "t": "", "c": null, "e": [["tile_f", "sp", [16, 2, 4, 1]], ["tile_y", "sp", [2, 1, 1, 7]], ["tile_x", "sp", [7, 1, 2, 1]], ["tile_rc", "sp", [64, 4, 1]], ["tile_ry", "sp", [1, 1, 3]], ["tile_rx", "sp", [1, 1, 3]], ["auto_unroll_max_step", "ot", 512], ["unroll_explicit", "ot", 1]]}], "r": [[0.00018666138925081433], 0, 1.6469480991363525, 1544131551.149602], "v": 0.1}
{"i": ["cuda", "conv2d_no_batching", [1, 28, 28, 128, 256, 3, 3, [2, 2], [1, 1]], {}, ["conv2d_no_batching", 1, 28, 28, 128, 256, 3, 3, [2, 2], [1, 1]], {"i": 61013296, "t": "", "c": null, "e": [["tile_f", "sp", [16, 2, 4, 1]], ["tile_y", "sp", [2, 1, 1, 7]], ["tile_x", "sp", [7, 2, 1, 1]], ["tile_rc", "sp", [4, 64, 1]], ["tile_ry", "sp", [1, 1, 3]], ["tile_rx", "sp", [1, 1, 3]], ["auto_unroll_max_step", "ot", 512], ["unroll_explicit", "ot", 1]]}], "r": [[0.002460834524429967], 0, 5.693247556686401, 1544131556.3691597], "v": 0.1}
{"i": ["cuda", "conv2d_no_batching", [1, 28, 28, 128, 256, 3, 3, [2, 2], [1, 1]], {}, ["conv2d_no_batching", 1, 28, 28, 128, 256, 3, 3, [2, 2], [1, 1]], {"i": 60859690, "t": "", "c": null, "e": [["tile_f", "sp", [16, 4, 2, 1]], ["tile_y", "sp", [2, 1, 1, 7]], ["tile_x", "sp", [7, 2, 1, 1]], ["tile_rc", "sp", [128, 2, 1]], ["tile_ry", "sp", [1, 1, 3]], ["tile_rx", "sp", [1, 1, 3]], ["auto_unroll_max_step", "ot", 512], ["unroll_explicit", "ot", 1]]}], "r": [[0.0004630850928338762], 0, 2.516894578933716, 1544131557.9548585], "v": 0.1}
{"i": ["cuda", "conv2d_no_batching", [1, 28, 28, 128, 256, 3, 3, [2, 2], [1, 1]], {}, ["conv2d_no_batching", 1, 28, 28, 128, 256, 3, 3, [2, 2], [1, 1]], {"i": 61011616, "t": "", "c": null, "e": [["tile_f", "sp", [16, 2, 4, 1]], ["tile_y", "sp", [1, 1, 2, 7]], ["tile_x", "sp", [14, 1, 1, 1]], ["tile_rc", "sp", [4, 64, 1]], ["tile_ry", "sp", [1, 1, 3]], ["tile_rx", "sp", [1, 1, 3]], ["auto_unroll_max_step", "ot", 512], ["unroll_explicit", "ot", 1]]}], "r": [[0.0013333357117263844], 0, 3.5145957469940186, 1544131561.10017], "v": 0.1}
{"i": ["cuda", "conv2d_no_batching", [1, 28, 28, 128, 256, 3, 3, [2, 2], [1, 1]], {}, ["conv2d_no_batching", 1, 28, 28, 128, 256, 3, 3, [2, 2], [1, 1]], {"i": 60890421, "t": "", "c": null, "e": [["tile_f", "sp", [16, 1, 8, 1]], ["tile_y", "sp", [2, 1, 1, 7]], ["tile_x", "sp", [7, 2, 1, 1]], ["tile_rc", "sp", [64, 4, 1]], ["tile_ry", "sp", [1, 1, 3]], ["tile_rx", "sp", [1, 1, 3]], ["auto_unroll_max_step", "ot", 512], ["unroll_explicit", "ot", 1]]}], "r": [[0.00021877262377850161], 0, 3.3195202350616455, 1544131563.7003274], "v": 0.1}
{"i": ["cuda", "conv2d_no_batching", [1, 28, 28, 128, 256, 3, 3, [2, 2], [1, 1]], {}, ["conv2d_no_batching", 1, 28, 28, 128, 256, 3, 3, [2, 2], [1, 1]], {"i": 60828976, "t": "", "c": null, "e": [["tile_f", "sp", [16, 2, 4, 1]], ["tile_y", "sp", [2, 1, 1, 7]], ["tile_x", "sp", [7, 2, 1, 1]], ["tile_rc", "sp", [256, 1, 1]], ["tile_ry", "sp", [1, 1, 3]], ["tile_rx", "sp", [1, 1, 3]], ["auto_unroll_max_step", "ot", 512], ["unroll_explicit", "ot", 1]]}], "r": [[0.0002665117377850163], 0, 1.959566354751587, 1544131565.0274413], "v": 0.1}
{"i": ["cuda", "conv2d_no_batching", [1, 28, 28, 128, 256, 3, 3, [2, 2], [1, 1]], {}, ["conv2d_no_batching", 1, 28, 28, 128, 256, 3, 3, [2, 2], [1, 1]], {"i": 60919456, "t": "", "c": null, "e": [["tile_f", "sp", [16, 2, 4, 1]], ["tile_y", "sp", [1, 1, 2, 7]], ["tile_x", "sp", [14, 1, 1, 1]], ["tile_rc", "sp", [32, 8, 1]], ["tile_ry", "sp", [1, 1, 3]], ["tile_rx", "sp", [1, 1, 3]], ["auto_unroll_max_step", "ot", 512], ["unroll_explicit", "ot", 1]]}], "r": [[0.00014336222364672363], 0, 1.579554557800293, 1544131595.3738437], "v": 0.1}
{"i": ["cuda", "conv2d_no_batching", [1, 28, 28, 128, 256, 3, 3, [2, 2], [1, 1]], {}, ["conv2d_no_batching", 1, 28, 28, 128, 256, 3, 3, [2, 2], [1, 1]], {"i": 60961581, "t": "", "c": null, "e": [["tile_f", "sp", [16, 1, 8, 1]], ["tile_y", "sp", [1, 2, 1, 7]], ["tile_x", "sp", [2, 1, 7, 1]], ["tile_rc", "sp", [16, 16, 1]], ["tile_ry", "sp", [1, 1, 3]], ["tile_rx", "sp", [1, 1, 3]], ["auto_unroll_max_step", "ot", 512], ["unroll_explicit", "ot", 1]]}], "r": [[0.0007535037052117263], 0, 4.146089792251587, 1544131568.3524256], "v": 0.1}
{"i": ["cuda", "conv2d_no_batching", [1, 28, 28, 128, 256, 3, 3, [2, 2], [1, 1]], {}, ["conv2d_no_batching", 1, 28, 28, 128, 256, 3, 3, [2, 2], [1, 1]], {"i": 60840483, "t": "", "c": null, "e": [["tile_f", "sp", [16, 8, 1, 1]], ["tile_y", "sp", [2, 1, 1, 7]], ["tile_x", "sp", [1, 2, 7, 1]], ["tile_rc", "sp", [256, 1, 1]], ["tile_ry", "sp", [1, 1, 3]], ["tile_rx", "sp", [1, 1, 3]], ["auto_unroll_max_step", "ot", 512], ["unroll_explicit", "ot", 1]]}], "r": [[0.0021753269462540716], 0, 6.083173036575317, 1544131573.2131133], "v": 0.1}
{"i": ["cuda", "conv2d_no_batching", [1, 28, 28, 128, 256, 3, 3, [2, 2], [1, 1]], {}, ["conv2d_no_batching", 1, 28, 28, 128, 256, 3, 3, [2, 2], [1, 1]], {"i": 60836661, "t": "", "c": null, "e": [["tile_f", "sp", [16, 1, 8, 1]], ["tile_y", "sp", [2, 1, 1, 7]], ["tile_x", "sp", [1, 7, 2, 1]], ["tile_rc", "sp", [256, 1, 1]], ["tile_ry", "sp", [1, 1, 3]], ["tile_rx", "sp", [1, 1, 3]], ["auto_unroll_max_step", "ot", 512], ["unroll_explicit", "ot", 1]]}], "r": [[0.000812713667752443], 0, 3.143045425415039, 1544131575.466563], "v": 0.1}
{"i": ["cuda", "conv2d_no_batching", [1, 28, 28, 128, 256, 3, 3, [2, 2], [1, 1]], {}, ["conv2d_no_batching", 1, 28, 28, 128, 256, 3, 3, [2, 2], [1, 1]], {"i": 60836643, "t": "", "c": null, "e": [["tile_f", "sp", [16, 8, 1, 1]], ["tile_y", "sp", [2, 1, 1, 7]], ["tile_x", "sp", [1, 7, 2, 1]], ["tile_rc", "sp", [256, 1, 1]], ["tile_ry", "sp", [1, 1, 3]], ["tile_rx", "sp", [1, 1, 3]], ["auto_unroll_max_step", "ot", 512], ["unroll_explicit", "ot", 1]]}], "r": [[0.0263185765], 0, 6.790795087814331, 1544131470.0577958], "v": 0.1}
{"i": ["cuda", "conv2d_no_batching", [1, 28, 28, 128, 256, 3, 3, [2, 2], [1, 1]], {}, ["conv2d_no_batching", 1, 28, 28, 128, 256, 3, 3, [2, 2], [1, 1]], {"i": 35943981, "t": "", "c": null, "e": [["tile_f", "sp", [16, 1, 8, 1]], ["tile_y", "sp", [1, 2, 1, 7]], ["tile_x", "sp", [14, 1, 1, 1]], ["tile_rc", "sp", [256, 1, 1]], ["tile_ry", "sp", [1, 1, 3]], ["tile_rx", "sp", [1, 1, 3]], ["auto_unroll_max_step", "ot", 1500], ["unroll_explicit", "ot", 0]]}], "r": [[0.0006250182638436483], 0, 2.263453483581543, 1544131577.3458858], "v": 0.1}
{"i": ["cuda", "conv2d_no_batching", [1, 28, 28, 128, 256, 3, 3, [2, 2], [1, 1]], {}, ["conv2d_no_batching", 1, 28, 28, 128, 256, 3, 3, [2, 2], [1, 1]], {"i": 36128416, "t": "", "c": null, "e": [["tile_f", "sp", [16, 2, 4, 1]], ["tile_y", "sp", [1, 1, 2, 7]], ["tile_x", "sp", [14, 1, 1, 1]], ["tile_rc", "sp", [4, 64, 1]], ["tile_ry", "sp", [1, 1, 3]], ["tile_rx", "sp", [1, 1, 3]], ["auto_unroll_max_step", "ot", 1500], ["unroll_explicit", "ot", 0]]}], "r": [[0.0007540938648208468], 0, 3.882512092590332, 1544131579.5924141], "v": 0.1}
{"i": ["cuda", "conv2d_no_batching", [1, 28, 28, 128, 256, 3, 3, [2, 2], [1, 1]], {}, ["conv2d_no_batching", 1, 28, 28, 128, 256, 3, 3, [2, 2], [1, 1]], {"i": 35945776, "t": "", "c": null, "e": [["tile_f", "sp", [16, 2, 4, 1]], ["tile_y", "sp", [2, 1, 1, 7]], ["tile_x", "sp", [7, 2, 1, 1]], ["tile_rc", "sp", [256, 1, 1]], ["tile_ry", "sp", [1, 1, 3]], ["tile_rx", "sp", [1, 1, 3]], ["auto_unroll_max_step", "ot", 1500], ["unroll_explicit", "ot", 0]]}], "r": [[0.0012307969299674268], 0, 3.4363176822662354, 1544131582.5901282], "v": 0.1}
{"i": ["cuda", "conv2d_no_batching", [1, 28, 28, 128, 256, 3, 3, [2, 2], [1, 1]], {}, ["conv2d_no_batching", 1, 28, 28, 128, 256, 3, 3, [2, 2], [1, 1]], {"i": 36012976, "t": "", "c": null, "e": [["tile_f", "sp", [16, 2, 4, 1]], ["tile_y", "sp", [2, 1, 1, 7]], ["tile_x", "sp", [7, 1, 2, 1]], ["tile_rc", "sp", [64, 4, 1]], ["tile_ry", "sp", [1, 1, 3]], ["tile_rx", "sp", [1, 1, 3]], ["auto_unroll_max_step", "ot", 1500], ["unroll_explicit", "ot", 0]]}], "r": [[0.0006993819364820847], 0, 2.7000603675842285, 1544131584.7375968], "v": 0.1}
{"i": ["cuda", "conv2d_no_batching", [1, 28, 28, 128, 256, 3, 3, [2, 2], [1, 1]], {}, ["conv2d_no_batching", 1, 28, 28, 128, 256, 3, 3, [2, 2], [1, 1]], {"i": 36130096, "t": "", "c": null, "e": [["tile_f", "sp", [16, 2, 4, 1]], ["tile_y", "sp", [2, 1, 1, 7]], ["tile_x", "sp", [7, 2, 1, 1]], ["tile_rc", "sp", [4, 64, 1]], ["tile_ry", "sp", [1, 1, 3]], ["tile_rx", "sp", [1, 1, 3]], ["auto_unroll_max_step", "ot", 1500], ["unroll_explicit", "ot", 0]]}], "r": [[0.0016350722882736157], 0, 12.844523429870605, 1544131589.2087488], "v": 0.1}
{"i": ["cuda", "conv2d_no_batching", [1, 28, 28, 128, 256, 3, 3, [2, 2], [1, 1]], {}, ["conv2d_no_batching", 1, 28, 28, 128, 256, 3, 3, [2, 2], [1, 1]], {"i": 35944101, "t": "", "c": null, "e": [["tile_f", "sp", [16, 1, 8, 1]], ["tile_y", "sp", [1, 1, 2, 7]], ["tile_x", "sp", [14, 1, 1, 1]], ["tile_rc", "sp", [256, 1, 1]], ["tile_ry", "sp", [1, 1, 3]], ["tile_rx", "sp", [1, 1, 3]], ["auto_unroll_max_step", "ot", 1500], ["unroll_explicit", "ot", 0]]}], "r": [[0.000405376509771987], 0, 1.7657873630523682, 1544131590.633891], "v": 0.1}
{"i": ["cuda", "conv2d_no_batching", [1, 28, 28, 128, 256, 3, 3, [2, 2], [1, 1]], {}, ["conv2d_no_batching", 1, 28, 28, 128, 256, 3, 3, [2, 2], [1, 1]], {"i": 36066861, "t": "", "c": null, "e": [["tile_f", "sp", [16, 1, 8, 1]], ["tile_y", "sp", [1, 2, 1, 7]], ["tile_x", "sp", [14, 1, 1, 1]], ["tile_rc", "sp", [16, 16, 1]], ["tile_ry", "sp", [1, 1, 3]], ["tile_rx", "sp", [1, 1, 3]], ["auto_unroll_max_step", "ot", 1500], ["unroll_explicit", "ot", 0]]}], "r": [[0.00025042165146579805], 0, 1.703430414199829, 1544131591.7774072], "v": 0.1}
{"i": ["cuda", "conv2d_no_batching", [1, 28, 28, 128, 256, 3, 3, [2, 2], [1, 1]], {}, ["conv2d_no_batching", 1, 28, 28, 128, 256, 3, 3, [2, 2], [1, 1]], {"i": 36036130, "t": "", "c": null, "e": [["tile_f", "sp", [16, 4, 2, 1]], ["tile_y", "sp", [1, 2, 1, 7]], ["tile_x", "sp", [14, 1, 1, 1]], ["tile_rc", "sp", [32, 8, 1]], ["tile_ry", "sp", [1, 1, 3]], ["tile_rx", "sp", [1, 1, 3]], ["auto_unroll_max_step", "ot", 1500], ["unroll_explicit", "ot", 0]]}], "r": [[0.00041466998045602604], 0, 2.729628086090088, 1544131593.4047067], "v": 0.1}
{"i": ["cuda", "conv2d_no_batching", [1, 28, 28, 128, 256, 3, 3, [2, 2], [1, 1]], {}, ["conv2d_no_batching", 1, 28, 28, 128, 256, 3, 3, [2, 2], [1, 1]], {"i": 36007210, "t": "", "c": null, "e": [["tile_f", "sp", [16, 4, 2, 1]], ["tile_y", "sp", [2, 1, 1, 7]], ["tile_x", "sp", [7, 2, 1, 1]], ["tile_rc", "sp", [64, 4, 1]], ["tile_ry", "sp", [1, 1, 3]], ["tile_rx", "sp", [1, 1, 3]], ["auto_unroll_max_step", "ot", 1500], ["unroll_explicit", "ot", 0]]}], "r": [[0.0012138742037037036], 0, 4.606726169586182, 1544131609.4895678], "v": 0.1}
{"i": ["cuda", "conv2d_no_batching", [1, 28, 28, 128, 256, 3, 3, [2, 2], [1, 1]], {}, ["conv2d_no_batching", 1, 28, 28, 128, 256, 3, 3, [2, 2], [1, 1]], {"i": 36128296, "t": "", "c": null, "e": [["tile_f", "sp", [16, 2, 4, 1]], ["tile_y", "sp", [1, 2, 1, 7]], ["tile_x", "sp", [14, 1, 1, 1]], ["tile_rc", "sp", [4, 64, 1]], ["tile_ry", "sp", [1, 1, 3]], ["tile_rx", "sp", [1, 1, 3]], ["auto_unroll_max_step", "ot", 1500], ["unroll_explicit", "ot", 0]]}], "r": [[0.0008011940170940171], 0, 7.5909082889556885, 1544131613.3370304], "v": 0.1}
{"i": ["cuda", "conv2d_no_batching", [1, 28, 28, 128, 256, 3, 3, [2, 2], [1, 1]], {}, ["conv2d_no_batching", 1, 28, 28, 128, 256, 3, 3, [2, 2], [1, 1]], {"i": 36005421, "t": "", "c": null, "e": [["tile_f", "sp", [16, 1, 8, 1]], ["tile_y", "sp", [1, 2, 1, 7]], ["tile_x", "sp", [14, 1, 1, 1]], ["tile_rc", "sp", [64, 4, 1]], ["tile_ry", "sp", [1, 1, 3]], ["tile_rx", "sp", [1, 1, 3]], ["auto_unroll_max_step", "ot", 1500], ["unroll_explicit", "ot", 0]]}], "r": [[0.0011475375213675213], 0, 4.813143253326416, 1544131617.4945889], "v": 0.1}
{"i": ["cuda", "conv2d_no_batching", [1, 28, 28, 128, 256, 3, 3, [2, 2], [1, 1]], {}, ["conv2d_no_batching", 1, 28, 28, 128, 256, 3, 3, [2, 2], [1, 1]], {"i": 73343523, "t": "", "c": null, "e": [["tile_f", "sp", [16, 8, 1, 1]], ["tile_y", "sp", [2, 1, 1, 7]], ["tile_x", "sp", [1, 2, 7, 1]], ["tile_rc", "sp", [64, 4, 1]], ["tile_ry", "sp", [1, 1, 3]], ["tile_rx", "sp", [1, 1, 3]], ["auto_unroll_max_step", "ot", 1500], ["unroll_explicit", "ot", 1]]}], "r": [[0.003773538698005698], 0, 18.243655920028687, 1544131629.4771962], "v": 0.1}
{"i": ["cuda", "conv2d_no_batching", [1, 28, 28, 128, 256, 3, 3, [2, 2], [1, 1]], {}, ["conv2d_no_batching", 1, 28, 28, 128, 256, 3, 3, [2, 2], [1, 1]], {"i": 73343541, "t": "", "c": null, "e": [["tile_f", "sp", [16, 1, 8, 1]], ["tile_y", "sp", [2, 1, 1, 7]], ["tile_x", "sp", [1, 2, 7, 1]], ["tile_rc", "sp", [64, 4, 1]], ["tile_ry", "sp", [1, 1, 3]], ["tile_rx", "sp", [1, 1, 3]], ["auto_unroll_max_step", "ot", 1500], ["unroll_explicit", "ot", 1]]}], "r": [[0.0002811221737891738], 0, 4.400898694992065, 1544131632.979745], "v": 0.1}
{"i": ["cuda", "conv2d_no_batching", [1, 28, 28, 128, 256, 3, 3, [2, 2], [1, 1]], {}, ["conv2d_no_batching", 1, 28, 28, 128, 256, 3, 3, [2, 2], [1, 1]], {"i": 73370410, "t": "", "c": null, "e": [["tile_f", "sp", [16, 4, 2, 1]], ["tile_y", "sp", [2, 1, 1, 7]], ["tile_x", "sp", [1, 7, 2, 1]], ["tile_rc", "sp", [32, 8, 1]], ["tile_ry", "sp", [1, 1, 3]], ["tile_rx", "sp", [1, 1, 3]], ["auto_unroll_max_step", "ot", 1500], ["unroll_explicit", "ot", 1]]}], "r": [[0.00240950942022792], 0, 10.75844144821167, 1544131639.8914173], "v": 0.1}
{"i": ["cuda", "conv2d_no_batching", [1, 28, 28, 128, 256, 3, 3, [2, 2], [1, 1]], {}, ["conv2d_no_batching", 1, 28, 28, 128, 256, 3, 3, [2, 2], [1, 1]], {"i": 73374250, "t": "", "c": null, "e": [["tile_f", "sp", [16, 4, 2, 1]], ["tile_y", "sp", [2, 1, 1, 7]], ["tile_x", "sp", [1, 2, 7, 1]], ["tile_rc", "sp", [32, 8, 1]], ["tile_ry", "sp", [1, 1, 3]], ["tile_rx", "sp", [1, 1, 3]], ["auto_unroll_max_step", "ot", 1500], ["unroll_explicit", "ot", 1]]}], "r": [[0.001664854935897436], 0, 11.896472692489624, 1544131647.5711546], "v": 0.1}
{"i": ["cuda", "conv2d_no_batching", [1, 28, 28, 128, 256, 3, 3, [2, 2], [1, 1]], {}, ["conv2d_no_batching", 1, 28, 28, 128, 256, 3, 3, [2, 2], [1, 1]], {"i": 42985415, "t": "", "c": null, "e": [["tile_f", "sp", [2, 2, 4, 8]], ["tile_y", "sp", [1, 14, 1, 1]], ["tile_x", "sp", [7, 1, 2, 1]], ["tile_rc", "sp", [16, 16, 1]], ["tile_ry", "sp", [1, 3, 1]], ["tile_rx", "sp", [1, 3, 1]], ["auto_unroll_max_step", "ot", 0], ["unroll_explicit", "ot", 1]]}], "r": [[0.004724936898860399], 0, 11.59494423866272, 1544131658.7875018], "v": 0.1}
{"i": ["cuda", "conv2d_no_batching", [1, 28, 28, 128, 256, 3, 3, [2, 2], [1, 1]], {}, ["conv2d_no_batching", 1, 28, 28, 128, 256, 3, 3, [2, 2], [1, 1]], {"i": 5076556, "t": "", "c": null, "e": [["tile_f", "sp", [4, 2, 4, 4]], ["tile_y", "sp", [14, 1, 1, 1]], ["tile_x", "sp", [7, 1, 2, 1]], ["tile_rc", "sp", [16, 1, 16]], ["tile_ry", "sp", [3, 1, 1]], ["tile_rx", "sp", [1, 3, 1]], ["auto_unroll_max_step", "ot", 0], ["unroll_explicit", "ot", 0]]}], "r": [[0.0010865857507122508], 0, 3.4763941764831543, 1544131661.8609982], "v": 0.1}
{"i": ["cuda", "conv2d_no_batching", [1, 28, 28, 128, 256, 3, 3, [2, 2], [1, 1]], {}, ["conv2d_no_batching", 1, 28, 28, 128, 256, 3, 3, [2, 2], [1, 1]], {"i": 61146314, "t": "", "c": null, "e": [["tile_f", "sp", [1, 16, 2, 4]], ["tile_y", "sp", [14, 1, 1, 1]], ["tile_x", "sp", [1, 2, 7, 1]], ["tile_rc", "sp", [64, 2, 2]], ["tile_ry", "sp", [1, 1, 3]], ["tile_rx", "sp", [1, 1, 3]], ["auto_unroll_max_step", "ot", 512], ["unroll_explicit", "ot", 1]]}], "r": [[0.006345402528490028], 0, 18.286524295806885, 1544131678.1074743], "v": 0.1}
{"i": ["cuda", "conv2d_no_batching", [1, 28, 28, 128, 256, 3, 3, [2, 2], [1, 1]], {}, ["conv2d_no_batching", 1, 28, 28, 128, 256, 3, 3, [2, 2], [1, 1]], {"i": 14686290, "t": "", "c": null, "e": [["tile_f", "sp", [8, 1, 2, 8]], ["tile_y", "sp", [7, 2, 1, 1]], ["tile_x", "sp", [7, 2, 1, 1]], ["tile_rc", "sp", [2, 16, 8]], ["tile_ry", "sp", [1, 3, 1]], ["tile_rx", "sp", [3, 1, 1]], ["auto_unroll_max_step", "ot", 512], ["unroll_explicit", "ot", 0]]}], "r": [[0.005636615126780627], 0, 13.04770803451538, 1544131690.821538], "v": 0.1}
{"i": ["cuda", "conv2d_no_batching", [1, 28, 28, 128, 256, 3, 3, [2, 2], [1, 1]], {}, ["conv2d_no_batching", 1, 28, 28, 128, 256, 3, 3, [2, 2], [1, 1]], {"i": 34838731, "t": "", "c": null, "e": [["tile_f", "sp", [4, 2, 2, 8]], ["tile_y", "sp", [2, 7, 1, 1]], ["tile_x", "sp", [7, 2, 1, 1]], ["tile_rc", "sp", [128, 1, 2]], ["tile_ry", "sp", [1, 3, 1]], ["tile_rx", "sp", [1, 1, 3]], ["auto_unroll_max_step", "ot", 1500], ["unroll_explicit", "ot", 0]]}], "r": [[0.003790500527065527], 0, 10.128766536712646, 1544131700.6734576], "v": 0.1}
{"i": ["cuda", "conv2d_no_batching", [1, 28, 28, 128, 256, 3, 3, [2, 2], [1, 1]], {}, ["conv2d_no_batching", 1, 28, 28, 128, 256, 3, 3, [2, 2], [1, 1]], {"i": 777754, "t": "", "c": null, "e": [["tile_f", "sp", [1, 2, 64, 1]], ["tile_y", "sp", [7, 2, 1, 1]], ["tile_x", "sp", [1, 7, 2, 1]], ["tile_rc", "sp", [16, 2, 8]], ["tile_ry", "sp", [3, 1, 1]], ["tile_rx", "sp", [3, 1, 1]], ["auto_unroll_max_step", "ot", 0], ["unroll_explicit", "ot", 0]]}], "r": [[0.0007383934871794872], 0, 2.601583242416382, 1544131765.8015888], "v": 0.1}
{"i": ["cuda", "conv2d_no_batching", [1, 28, 28, 128, 256, 3, 3, [2, 2], [1, 1]], {}, ["conv2d_no_batching", 1, 28, 28, 128, 256, 3, 3, [2, 2], [1, 1]], {"i": 37326753, "t": "", "c": null, "e": [["tile_f", "sp", [2, 1, 64, 1]], ["tile_y", "sp", [14, 1, 1, 1]], ["tile_x", "sp", [7, 2, 1, 1]], ["tile_rc", "sp", [256, 1, 1]], ["tile_ry", "sp", [3, 1, 1]], ["tile_rx", "sp", [3, 1, 1]], ["auto_unroll_max_step", "ot", 0], ["unroll_explicit", "ot", 1]]}], "r": [[0.0008724955626780626], 0, 2.865647554397583, 1544131786.5626183], "v": 0.1}
{"i": ["cuda", "conv2d_no_batching", [1, 28, 28, 128, 256, 3, 3, [2, 2], [1, 1]], {}, ["conv2d_no_batching", 1, 28, 28, 128, 256, 3, 3, [2, 2], [1, 1]], {"i": 37332962, "t": "", "c": null, "e": [["tile_f", "sp", [32, 4, 1, 1]], ["tile_y", "sp", [7, 1, 2, 1]], ["tile_x", "sp", [7, 1, 2, 1]], ["tile_rc", "sp", [256, 1, 1]], ["tile_ry", "sp", [3, 1, 1]], ["tile_rx", "sp", [3, 1, 1]], ["auto_unroll_max_step", "ot", 0], ["unroll_explicit", "ot", 1]]}], "r": [[0.002460660361823362], 0, 6.149108648300171, 1544131792.4634755], "v": 0.1}
{"i": ["cuda", "conv2d_no_batching", [1, 28, 28, 128, 256, 3, 3, [2, 2], [1, 1]], {}, ["conv2d_no_batching", 1, 28, 28, 128, 256, 3, 3, [2, 2], [1, 1]], {"i": 37332971, "t": "", "c": null, "e": [["tile_f", "sp", [8, 8, 2, 1]], ["tile_y", "sp", [7, 1, 2, 1]], ["tile_x", "sp", [7, 1, 2, 1]], ["tile_rc", "sp", [256, 1, 1]], ["tile_ry", "sp", [3, 1, 1]], ["tile_rx", "sp", [3, 1, 1]], ["auto_unroll_max_step", "ot", 0], ["unroll_explicit", "ot", 1]]}], "r": [[0.001031322472934473], 0, 3.9304745197296143, 1544131796.104763], "v": 0.1}
{"i": ["cuda", "conv2d_no_batching", [1, 28, 28, 128, 256, 3, 3, [2, 2], [1, 1]], {}, ["conv2d_no_batching", 1, 28, 28, 128, 256, 3, 3, [2, 2], [1, 1]], {"i": 37423699, "t": "", "c": null, "e": [["tile_f", "sp", [2, 16, 4, 1]], ["tile_y", "sp", [1, 1, 14, 1]], ["tile_x", "sp", [1, 14, 1, 1]], ["tile_rc", "sp", [32, 8, 1]], ["tile_ry", "sp", [3, 1, 1]], ["tile_rx", "sp", [3, 1, 1]], ["auto_unroll_max_step", "ot", 0], ["unroll_explicit", "ot", 1]]}], "r": [[0.011847005236467237], 0, 26.279743432998657, 1544131821.9185867], "v": 0.1}
{"i": ["cuda", "conv2d_no_batching", [1, 28, 28, 128, 256, 3, 3, [2, 2], [1, 1]], {}, ["conv2d_no_batching", 1, 28, 28, 128, 256, 3, 3, [2, 2], [1, 1]], {"i": 37338382, "t": "", "c": null, "e": [["tile_f", "sp", [8, 2, 8, 1]], ["tile_y", "sp", [7, 2, 1, 1]], ["tile_x", "sp", [1, 2, 7, 1]], ["tile_rc", "sp", [256, 1, 1]], ["tile_ry", "sp", [3, 1, 1]], ["tile_rx", "sp", [3, 1, 1]], ["auto_unroll_max_step", "ot", 0], ["unroll_explicit", "ot", 1]]}], "r": [[0.0008744465427350427], 0, 3.015357732772827, 1544131824.6805067], "v": 0.1}
{"i": ["cuda", "conv2d_no_batching", [1, 28, 28, 128, 256, 3, 3, [2, 2], [1, 1]], {}, ["conv2d_no_batching", 1, 28, 28, 128, 256, 3, 3, [2, 2], [1, 1]], {"i": 37390825, "t": "", "c": null, "e": [["tile_f", "sp", [1, 16, 8, 1]], ["tile_y", "sp", [2, 1, 7, 1]], ["tile_x", "sp", [2, 7, 1, 1]], ["tile_rc", "sp", [64, 4, 1]], ["tile_ry", "sp", [3, 1, 1]], ["tile_rx", "sp", [3, 1, 1]], ["auto_unroll_max_step", "ot", 0], ["unroll_explicit", "ot", 1]]}], "r": [[0.0022861011039886038], 0, 5.965757369995117, 1544131861.632662], "v": 0.1}
{"i": ["cuda", "conv2d_no_batching", [1, 28, 28, 128, 256, 3, 3, [2, 2], [1, 1]], {}, ["conv2d_no_batching", 1, 28, 28, 128, 256, 3, 3, [2, 2], [1, 1]], {"i": 37427539, "t": "", "c": null, "e": [["tile_f", "sp", [2, 16, 4, 1]], ["tile_y", "sp", [1, 1, 14, 1]], ["tile_x", "sp", [1, 7, 2, 1]], ["tile_rc", "sp", [32, 8, 1]], ["tile_ry", "sp", [3, 1, 1]], ["tile_rx", "sp", [3, 1, 1]], ["auto_unroll_max_step", "ot", 0], ["unroll_explicit", "ot", 1]]}], "r": [[0.004978433368945869], 0, 11.638136625289917, 1544131872.8756464], "v": 0.1}
{"i": ["cuda", "conv2d_no_batching", [1, 28, 28, 128, 256, 3, 3, [2, 2], [1, 1]], {}, ["conv2d_no_batching", 1, 28, 28, 128, 256, 3, 3, [2, 2], [1, 1]], {"i": 37511553, "t": "", "c": null, "e": [["tile_f", "sp", [2, 1, 64, 1]], ["tile_y", "sp", [7, 1, 2, 1]], ["tile_x", "sp", [7, 2, 1, 1]], ["tile_rc", "sp", [4, 64, 1]], ["tile_ry", "sp", [3, 1, 1]], ["tile_rx", "sp", [3, 1, 1]], ["auto_unroll_max_step", "ot", 0], ["unroll_explicit", "ot", 1]]}], "r": [[0.0005636930854700854], 0, 2.268533706665039, 1544131874.8107388], "v": 0.1}
{"i": ["cuda", "conv2d_no_batching", [1, 28, 28, 128, 256, 3, 3, [2, 2], [1, 1]], {}, ["conv2d_no_batching", 1, 28, 28, 128, 256, 3, 3, [2, 2], [1, 1]], {"i": 37390808, "t": "", "c": null, "e": [["tile_f", "sp", [64, 1, 2, 1]], ["tile_y", "sp", [2, 1, 7, 1]], ["tile_x", "sp", [2, 7, 1, 1]], ["tile_rc", "sp", [64, 4, 1]], ["tile_ry", "sp", [3, 1, 1]], ["tile_rx", "sp", [3, 1, 1]], ["auto_unroll_max_step", "ot", 0], ["unroll_explicit", "ot", 1]]}], "r": [[0.00702332548005698], 0, 15.774024963378906, 1544131890.4043717], "v": 0.1}
{"i": ["cuda", "conv2d_no_batching", [1, 28, 28, 128, 256, 3, 3, [2, 2], [1, 1]], {}, ["conv2d_no_batching", 1, 28, 28, 128, 256, 3, 3, [2, 2], [1, 1]], {"i": 37417939, "t": "", "c": null, "e": [["tile_f", "sp", [2, 16, 4, 1]], ["tile_y", "sp", [1, 1, 14, 1]], ["tile_x", "sp", [14, 1, 1, 1]], ["tile_rc", "sp", [32, 8, 1]], ["tile_ry", "sp", [3, 1, 1]], ["tile_rx", "sp", [3, 1, 1]], ["auto_unroll_max_step", "ot", 0], ["unroll_explicit", "ot", 1]]}], "r": [[0.0004768357279202279], 0, 2.2168023586273193, 1544131892.174975], "v": 0.1}
{"i": ["cuda", "conv2d_no_batching", [1, 28, 28, 128, 256, 3, 3, [2, 2], [1, 1]], {}, ["conv2d_no_batching", 1, 28, 28, 128, 256, 3, 3, [2, 2], [1, 1]], {"i": 37422742, "t": "", "c": null, "e": [["tile_f", "sp", [8, 2, 8, 1]], ["tile_y", "sp", [14, 1, 1, 1]], ["tile_x", "sp", [1, 14, 1, 1]], ["tile_rc", "sp", [32, 8, 1]], ["tile_ry", "sp", [3, 1, 1]], ["tile_rx", "sp", [3, 1, 1]], ["auto_unroll_max_step", "ot", 0], ["unroll_explicit", "ot", 1]]}], "r": [[0.00032490871794871795], 0, 1.7672345638275146, 1544131893.5517626], "v": 0.1}
{"i": ["cuda", "conv2d_no_batching", [1, 28, 28, 128, 256, 3, 3, [2, 2], [1, 1]], {}, ["conv2d_no_batching", 1, 28, 28, 128, 256, 3, 3, [2, 2], [1, 1]], {"i": 37432942, "t": "", "c": null, "e": [["tile_f", "sp", [8, 2, 8, 1]], ["tile_y", "sp", [1, 7, 2, 1]], ["tile_x", "sp", [1, 1, 14, 1]], ["tile_rc", "sp", [32, 8, 1]], ["tile_ry", "sp", [3, 1, 1]], ["tile_rx", "sp", [3, 1, 1]], ["auto_unroll_max_step", "ot", 0], ["unroll_explicit", "ot", 1]]}], "r": [[0.0019688818205128205], 0, 5.180597305297852, 1544131898.397367], "v": 0.1}
{"i": ["cuda", "conv2d_no_batching", [1, 28, 28, 128, 256, 3, 3, [2, 2], [1, 1]], {}, ["conv2d_no_batching", 1, 28, 28, 128, 256, 3, 3, [2, 2], [1, 1]], {"i": 38721133, "t": "", "c": null, "e": [["tile_f", "sp", [2, 32, 2, 1]], ["tile_y", "sp", [7, 1, 2, 1]], ["tile_x", "sp", [1, 2, 7, 1]], ["tile_rc", "sp", [256, 1, 1]], ["tile_ry", "sp", [1, 3, 1]], ["tile_rx", "sp", [3, 1, 1]], ["auto_unroll_max_step", "ot", 0], ["unroll_explicit", "ot", 1]]}], "r": [[0.0009537348817663818], 0, 3.0923097133636475, 1544131901.3068216], "v": 0.1}
{"i": ["cuda", "conv2d_no_batching", [1, 28, 28, 128, 256, 3, 3, [2, 2], [1, 1]], {}, ["conv2d_no_batching", 1, 28, 28, 128, 256, 3, 3, [2, 2], [1, 1]], {"i": 38715015, "t": "", "c": null, "e": [["tile_f", "sp", [32, 1, 4, 1]], ["tile_y", "sp", [7, 2, 1, 1]], ["tile_x", "sp", [7, 1, 2, 1]], ["tile_rc", "sp", [256, 1, 1]], ["tile_ry", "sp", [1, 3, 1]], ["tile_rx", "sp", [3, 1, 1]], ["auto_unroll_max_step", "ot", 0], ["unroll_explicit", "ot", 1]]}], "r": [[0.0008415318746438748], 0, 2.814473867416382, 1544131903.7872734], "v": 0.1}
{"i": ["cuda", "conv2d_no_batching", [1, 28, 28, 128, 256, 3, 3, [2, 2], [1, 1]], {}, ["conv2d_no_batching", 1, 28, 28, 128, 256, 3, 3, [2, 2], [1, 1]], {"i": 38808019, "t": "", "c": null, "e": [["tile_f", "sp", [2, 16, 4, 1]], ["tile_y", "sp", [1, 1, 14, 1]], ["tile_x", "sp", [7, 1, 2, 1]], ["tile_rc", "sp", [32, 8, 1]], ["tile_ry", "sp", [1, 3, 1]], ["tile_rx", "sp", [3, 1, 1]], ["auto_unroll_max_step", "ot", 0], ["unroll_explicit", "ot", 1]]}], "r": [[0.0006959458447293447], 0, 2.5179946422576904, 1544131905.974086], "v": 0.1}
{"i": ["cuda", "conv2d_no_batching", [1, 28, 28, 128, 256, 3, 3, [2, 2], [1, 1]], {}, ["conv2d_no_batching", 1, 28, 28, 128, 256, 3, 3, [2, 2], [1, 1]], {"i": 38715735, "t": "", "c": null, "e": [["tile_f", "sp", [32, 1, 4, 1]], ["tile_y", "sp", [1, 2, 7, 1]], ["tile_x", "sp", [7, 1, 2, 1]], ["tile_rc", "sp", [256, 1, 1]], ["tile_ry", "sp", [1, 3, 1]], ["tile_rx", "sp", [3, 1, 1]], ["auto_unroll_max_step", "ot", 0], ["unroll_explicit", "ot", 1]]}], "r": [[0.0005177346096866096], 0, 2.052910804748535, 1544131907.7259831], "v": 0.1}
{"i": ["cuda", "conv2d_no_batching", [1, 28, 28, 128, 256, 3, 3, [2, 2], [1, 1]], {}, ["conv2d_no_batching", 1, 28, 28, 128, 256, 3, 3, [2, 2], [1, 1]], {"i": 38715371, "t": "", "c": null, "e": [["tile_f", "sp", [8, 8, 2, 1]], ["tile_y", "sp", [7, 1, 2, 1]], ["tile_x", "sp", [7, 1, 2, 1]], ["tile_rc", "sp", [256, 1, 1]], ["tile_ry", "sp", [1, 3, 1]], ["tile_rx", "sp", [3, 1, 1]], ["auto_unroll_max_step", "ot", 0], ["unroll_explicit", "ot", 1]]}], "r": [[0.0005915825113960114], 0, 2.263897180557251, 1544131909.6773496], "v": 0.1}
{"i": ["cuda", "conv2d_no_batching", [1, 28, 28, 128, 256, 3, 3, [2, 2], [1, 1]], {}, ["conv2d_no_batching", 1, 28, 28, 128, 256, 3, 3, [2, 2], [1, 1]], {"i": 38751370, "t": "", "c": null, "e": [["tile_f", "sp", [16, 4, 2, 1]], ["tile_y", "sp", [14, 1, 1, 1]], ["tile_x", "sp", [1, 2, 7, 1]], ["tile_rc", "sp", [128, 2, 1]], ["tile_ry", "sp", [1, 3, 1]], ["tile_rx", "sp", [3, 1, 1]], ["auto_unroll_max_step", "ot", 0], ["unroll_explicit", "ot", 1]]}], "r": [[0.00038071941737891736], 0, 1.8392269611358643, 1544131942.5815532], "v": 0.1}
{"i": ["cuda", "conv2d_no_batching", [1, 28, 28, 128, 256, 3, 3, [2, 2], [1, 1]], {}, ["conv2d_no_batching", 1, 28, 28, 128, 256, 3, 3, [2, 2], [1, 1]], {"i": 41507423, "t": "", "c": null, "e": [["tile_f", "sp", [4, 4, 8, 1]], ["tile_y", "sp", [1, 2, 7, 1]], ["tile_x", "sp", [2, 7, 1, 1]], ["tile_rc", "sp", [128, 2, 1]], ["tile_ry", "sp", [3, 1, 1]], ["tile_rx", "sp", [1, 3, 1]], ["auto_unroll_max_step", "ot", 0], ["unroll_explicit", "ot", 1]]}], "r": [[0.0014616427492877494], 0, 4.226586103439331, 1544131946.7041295], "v": 0.1}
{"i": ["cuda", "conv2d_no_batching", [1, 28, 28, 128, 256, 3, 3, [2, 2], [1, 1]], {}, ["conv2d_no_batching", 1, 28, 28, 128, 256, 3, 3, [2, 2], [1, 1]], {"i": 38749445, "t": "", "c": null, "e": [["tile_f", "sp", [4, 32, 1, 1]], ["tile_y", "sp", [14, 1, 1, 1]], ["tile_x", "sp", [2, 1, 7, 1]], ["tile_rc", "sp", [128, 2, 1]], ["tile_ry", "sp", [1, 3, 1]], ["tile_rx", "sp", [3, 1, 1]], ["auto_unroll_max_step", "ot", 0], ["unroll_explicit", "ot", 1]]}], "r": [[0.0023319732193732194], 0, 5.993126153945923, 1544131952.4421651], "v": 0.1}
{"i": ["cuda", "conv2d_no_batching", [1, 28, 28, 128, 256, 3, 3, [2, 2], [1, 1]], {}, ["conv2d_no_batching", 1, 28, 28, 128, 256, 3, 3, [2, 2], [1, 1]], {"i": 42962542, "t": "", "c": null, "e": [["tile_f", "sp", [8, 2, 8, 1]], ["tile_y", "sp", [1, 7, 2, 1]], ["tile_x", "sp", [1, 1, 14, 1]], ["tile_rc", "sp", [32, 8, 1]], ["tile_ry", "sp", [1, 3, 1]], ["tile_rx", "sp", [1, 3, 1]], ["auto_unroll_max_step", "ot", 0], ["unroll_explicit", "ot", 1]]}], "r": [[0.00047761845584045584], 0, 2.0353775024414062, 1544131954.298164], "v": 0.1}
{"i": ["cuda", "conv2d_no_batching", [1, 28, 28, 128, 256, 3, 3, [2, 2], [1, 1]], {}, ["conv2d_no_batching", 1, 28, 28, 128, 256, 3, 3, [2, 2], [1, 1]], {"i": 38749925, "t": "", "c": null, "e": [["tile_f", "sp", [4, 32, 1, 1]], ["tile_y", "sp", [7, 1, 2, 1]], ["tile_x", "sp", [2, 1, 7, 1]], ["tile_rc", "sp", [128, 2, 1]], ["tile_ry", "sp", [1, 3, 1]], ["tile_rx", "sp", [3, 1, 1]], ["auto_unroll_max_step", "ot", 0], ["unroll_explicit", "ot", 1]]}], "r": [[0.0016067854971509974], 0, 4.3953773975372314, 1544131958.4465833], "v": 0.1}
{"i": ["cuda", "conv2d_no_batching", [1, 28, 28, 128, 256, 3, 3, [2, 2], [1, 1]], {}, ["conv2d_no_batching", 1, 28, 28, 128, 256, 3, 3, [2, 2], [1, 1]], {"i": 41580142, "t": "", "c": null, "e": [["tile_f", "sp", [8, 2, 8, 1]], ["tile_y", "sp", [1, 7, 2, 1]], ["tile_x", "sp", [1, 1, 14, 1]], ["tile_rc", "sp", [32, 8, 1]], ["tile_ry", "sp", [3, 1, 1]], ["tile_rx", "sp", [1, 3, 1]], ["auto_unroll_max_step", "ot", 0], ["unroll_explicit", "ot", 1]]}], "r": [[0.0008710310854700855], 0, 2.8539907932281494, 1544131961.0227375], "v": 0.1}
{"i": ["cuda", "conv2d_no_batching", [1, 28, 28, 128, 256, 3, 3, [2, 2], [1, 1]], {}, ["conv2d_no_batching", 1, 28, 28, 128, 256, 3, 3, [2, 2], [1, 1]], {"i": 42927746, "t": "", "c": null, "e": [["tile_f", "sp", [8, 1, 16, 1]], ["tile_y", "sp", [1, 14, 1, 1]], ["tile_x", "sp", [2, 1, 7, 1]], ["tile_rc", "sp", [64, 4, 1]], ["tile_ry", "sp", [1, 3, 1]], ["tile_rx", "sp", [1, 3, 1]], ["auto_unroll_max_step", "ot", 0], ["unroll_explicit", "ot", 1]]}], "r": [[0.00037898528347578346], 0, 1.821418285369873, 1544131962.540938], "v": 0.1}
{"i": ["cuda", "conv2d_no_batching", [1, 28, 28, 128, 256, 3, 3, [2, 2], [1, 1]], {}, ["conv2d_no_batching", 1, 28, 28, 128, 256, 3, 3, [2, 2], [1, 1]], {"i": 41545346, "t": "", "c": null, "e": [["tile_f", "sp", [8, 1, 16, 1]], ["tile_y", "sp", [1, 14, 1, 1]], ["tile_x", "sp", [2, 1, 7, 1]], ["tile_rc", "sp", [64, 4, 1]], ["tile_ry", "sp", [3, 1, 1]], ["tile_rx", "sp", [1, 3, 1]], ["auto_unroll_max_step", "ot", 0], ["unroll_explicit", "ot", 1]]}], "r": [[0.0008645581609686609], 0, 2.8313710689544678, 1544131965.0766857], "v": 0.1}
{"i": ["cuda", "conv2d_no_batching", [1, 28, 28, 128, 256, 3, 3, [2, 2], [1, 1]], {}, ["conv2d_no_batching", 1, 28, 28, 128, 256, 3, 3, [2, 2], [1, 1]], {"i": 41507063, "t": "", "c": null, "e": [["tile_f", "sp", [4, 4, 8, 1]], ["tile_y", "sp", [7, 1, 2, 1]], ["tile_x", "sp", [2, 7, 1, 1]], ["tile_rc", "sp", [128, 2, 1]], ["tile_ry", "sp", [3, 1, 1]], ["tile_rx", "sp", [1, 3, 1]], ["auto_unroll_max_step", "ot", 0], ["unroll_explicit", "ot", 1]]}], "r": [[0.0011623512863247864], 0, 3.5220067501068115, 1544131968.2578073], "v": 0.1}
{"i": ["cuda", "conv2d_no_batching", [1, 28, 28, 128, 256, 3, 3, [2, 2], [1, 1]], {}, ["conv2d_no_batching", 1, 28, 28, 128, 256, 3, 3, [2, 2], [1, 1]], {"i": 41474659, "t": "", "c": null, "e": [["tile_f", "sp", [2, 16, 4, 1]], ["tile_y", "sp", [2, 1, 7, 1]], ["tile_x", "sp", [7, 2, 1, 1]], ["tile_rc", "sp", [256, 1, 1]], ["tile_ry", "sp", [3, 1, 1]], ["tile_rx", "sp", [1, 3, 1]], ["auto_unroll_max_step", "ot", 0], ["unroll_explicit", "ot", 1]]}], "r": [[0.0007126748162393163], 0, 2.5552611351013184, 1544131970.6431677], "v": 0.1}
{"i": ["cuda", "conv2d_no_batching", [1, 28, 28, 128, 256, 3, 3, [2, 2], [1, 1]], {}, ["conv2d_no_batching", 1, 28, 28, 128, 256, 3, 3, [2, 2], [1, 1]], {"i": 42961947, "t": "", "c": null, "e": [["tile_f", "sp", [4, 2, 16, 1]], ["tile_y", "sp", [14, 1, 1, 1]], ["tile_x", "sp", [1, 1, 14, 1]], ["tile_rc", "sp", [32, 8, 1]], ["tile_ry", "sp", [1, 3, 1]], ["tile_rx", "sp", [1, 3, 1]], ["auto_unroll_max_step", "ot", 0], ["unroll_explicit", "ot", 1]]}], "r": [[0.00016487646581196582], 0, 1.325343132019043, 1544131971.68704], "v": 0.1}
{"i": ["cuda", "conv2d_no_batching", [1, 28, 28, 128, 256, 3, 3, [2, 2], [1, 1]], {}, ["conv2d_no_batching", 1, 28, 28, 128, 256, 3, 3, [2, 2], [1, 1]], {"i": 42961942, "t": "", "c": null, "e": [["tile_f", "sp", [8, 2, 8, 1]], ["tile_y", "sp", [14, 1, 1, 1]], ["tile_x", "sp", [1, 1, 14, 1]], ["tile_rc", "sp", [32, 8, 1]], ["tile_ry", "sp", [1, 3, 1]], ["tile_rx", "sp", [1, 3, 1]], ["auto_unroll_max_step", "ot", 0], ["unroll_explicit", "ot", 1]]}], "r": [[0.00017214846153846153], 0, 1.384075403213501, 1544131972.8545456], "v": 0.1}
{"i": ["cuda", "conv2d_no_batching", [1, 28, 28, 128, 256, 3, 3, [2, 2], [1, 1]], {}, ["conv2d_no_batching", 1, 28, 28, 128, 256, 3, 3, [2, 2], [1, 1]], {"i": 73270581, "t": "", "c": null, "e": [["tile_f", "sp", [16, 1, 8, 1]], ["tile_y", "sp", [2, 1, 1, 7]], ["tile_x", "sp", [7, 2, 1, 1]], ["tile_rc", "sp", [256, 1, 1]], ["tile_ry", "sp", [1, 1, 3]], ["tile_rx", "sp", [1, 1, 3]], ["auto_unroll_max_step", "ot", 1500], ["unroll_explicit", "ot", 1]]}], "r": [[0.00025911127635327633], 0, 1.9981274604797363, 1544132032.4767547], "v": 0.1}
{"i": ["cuda", "conv2d_no_batching", [1, 28, 28, 128, 256, 3, 3, [2, 2], [1, 1]], {}, ["conv2d_no_batching", 1, 28, 28, 128, 256, 3, 3, [2, 2], [1, 1]], {"i": 73362975, "t": "", "c": null, "e": [["tile_f", "sp", [32, 1, 4, 1]], ["tile_y", "sp", [1, 1, 2, 7]], ["tile_x", "sp", [7, 2, 1, 1]], ["tile_rc", "sp", [32, 8, 1]], ["tile_ry", "sp", [1, 1, 3]], ["tile_rx", "sp", [1, 1, 3]], ["auto_unroll_max_step", "ot", 1500], ["unroll_explicit", "ot", 1]]}], "r": [[0.00021046579487179486], 0, 2.045494318008423, 1544132033.9506474], "v": 0.1}
{"i": ["cuda", "conv2d_no_batching", [1, 28, 28, 128, 256, 3, 3, [2, 2], [1, 1]], {}, ["conv2d_no_batching", 1, 28, 28, 128, 256, 3, 3, [2, 2], [1, 1]], {"i": 73268644, "t": "", "c": null, "e": [["tile_f", "sp", [8, 16, 1, 1]], ["tile_y", "sp", [2, 1, 1, 7]], ["tile_x", "sp", [14, 1, 1, 1]], ["tile_rc", "sp", [256, 1, 1]], ["tile_ry", "sp", [1, 1, 3]], ["tile_rx", "sp", [1, 1, 3]], ["auto_unroll_max_step", "ot", 1500], ["unroll_explicit", "ot", 1]]}], "r": [[0.0010439088148148149], 0, 4.8168299198150635, 1544132037.115245], "v": 0.1}
{"i": ["cuda", "conv2d_no_batching", [1, 28, 28, 128, 256, 3, 3, [2, 2], [1, 1]], {}, ["conv2d_no_batching", 1, 28, 28, 128, 256, 3, 3, [2, 2], [1, 1]], {"i": 73299364, "t": "", "c": null, "e": [["tile_f", "sp", [8, 16, 1, 1]], ["tile_y", "sp", [2, 1, 1, 7]], ["tile_x", "sp", [14, 1, 1, 1]], ["tile_rc", "sp", [128, 2, 1]], ["tile_ry", "sp", [1, 1, 3]], ["tile_rx", "sp", [1, 1, 3]], ["auto_unroll_max_step", "ot", 1500], ["unroll_explicit", "ot", 1]]}], "r": [[0.0009652841752136752], 0, 5.14425802230835, 1544132040.30598], "v": 0.1}
{"i": ["cuda", "conv2d_no_batching", [1, 28, 28, 128, 256, 3, 3, [2, 2], [1, 1]], {}, ["conv2d_no_batching", 1, 28, 28, 128, 256, 3, 3, [2, 2], [1, 1]], {"i": 73276575, "t": "", "c": null, "e": [["tile_f", "sp", [32, 1, 4, 1]], ["tile_y", "sp", [1, 1, 2, 7]], ["tile_x", "sp", [7, 1, 2, 1]], ["tile_rc", "sp", [256, 1, 1]], ["tile_ry", "sp", [1, 1, 3]], ["tile_rx", "sp", [1, 1, 3]], ["auto_unroll_max_step", "ot", 1500], ["unroll_explicit", "ot", 1]]}], "r": [[0.00039916878774928777], 0, 1.9991309642791748, 1544132041.8973515], "v": 0.1}
{"i": ["cuda", "conv2d_no_batching", [1, 28, 28, 128, 256, 3, 3, [2, 2], [1, 1]], {}, ["conv2d_no_batching", 1, 28, 28, 128, 256, 3, 3, [2, 2], [1, 1]], {"i": 73270695, "t": "", "c": null, "e": [["tile_f", "sp", [32, 1, 4, 1]], ["tile_y", "sp", [1, 2, 1, 7]], ["tile_x", "sp", [7, 2, 1, 1]], ["tile_rc", "sp", [256, 1, 1]], ["tile_ry", "sp", [1, 1, 3]], ["tile_rx", "sp", [1, 1, 3]], ["auto_unroll_max_step", "ot", 1500], ["unroll_explicit", "ot", 1]]}], "r": [[0.0005396597264957265], 0, 2.6695713996887207, 1544132043.8811297], "v": 0.1}
{"i": ["cuda", "conv2d_no_batching", [1, 28, 28, 128, 256, 3, 3, [2, 2], [1, 1]], {}, ["conv2d_no_batching", 1, 28, 28, 128, 256, 3, 3, [2, 2], [1, 1]], {"i": 73399216, "t": "", "c": null, "e": [["tile_f", "sp", [16, 2, 4, 1]], ["tile_y", "sp", [2, 1, 1, 7]], ["tile_x", "sp", [7, 1, 2, 1]], ["tile_rc", "sp", [16, 16, 1]], ["tile_ry", "sp", [1, 1, 3]], ["tile_rx", "sp", [1, 1, 3]], ["auto_unroll_max_step", "ot", 1500], ["unroll_explicit", "ot", 1]]}], "r": [[0.00018265543162393163], 0, 2.0799005031585693, 1544132045.111163], "v": 0.1}
{"i": ["cuda", "conv2d_no_batching", [1, 28, 28, 128, 256, 3, 3, [2, 2], [1, 1]], {}, ["conv2d_no_batching", 1, 28, 28, 128, 256, 3, 3, [2, 2], [1, 1]], {"i": 73270815, "t": "", "c": null, "e": [["tile_f", "sp", [32, 1, 4, 1]], ["tile_y", "sp", [1, 1, 2, 7]], ["tile_x", "sp", [7, 2, 1, 1]], ["tile_rc", "sp", [256, 1, 1]], ["tile_ry", "sp", [1, 1, 3]], ["tile_rx", "sp", [1, 1, 3]], ["auto_unroll_max_step", "ot", 1500], ["unroll_explicit", "ot", 1]]}], "r": [[0.0004023231367521368], 0, 2.3070991039276123, 1544132046.7647746], "v": 0.1}
{"i": ["cuda", "conv2d_no_batching", [1, 28, 28, 128, 256, 3, 3, [2, 2], [1, 1]], {}, ["conv2d_no_batching", 1, 28, 28, 128, 256, 3, 3, [2, 2], [1, 1]], {"i": 73332016, "t": "", "c": null, "e": [["tile_f", "sp", [16, 2, 4, 1]], ["tile_y", "sp", [2, 1, 1, 7]], ["tile_x", "sp", [7, 2, 1, 1]], ["tile_rc", "sp", [64, 4, 1]], ["tile_ry", "sp", [1, 1, 3]], ["tile_rx", "sp", [1, 1, 3]], ["auto_unroll_max_step", "ot", 1500], ["unroll_explicit", "ot", 1]]}], "r": [[0.00022478982051282053], 0, 3.1473240852355957, 1544132048.1612055], "v": 0.1}
{"i": ["cuda", "conv2d_no_batching", [1, 28, 28, 128, 256, 3, 3, [2, 2], [1, 1]], {}, ["conv2d_no_batching", 1, 28, 28, 128, 256, 3, 3, [2, 2], [1, 1]], {"i": 73424415, "t": "", "c": null, "e": [["tile_f", "sp", [32, 1, 4, 1]], ["tile_y", "sp", [1, 1, 2, 7]], ["tile_x", "sp", [7, 2, 1, 1]], ["tile_rc", "sp", [8, 32, 1]], ["tile_ry", "sp", [1, 1, 3]], ["tile_rx", "sp", [1, 1, 3]], ["auto_unroll_max_step", "ot", 1500], ["unroll_explicit", "ot", 1]]}], "r": [[0.0003611243746438747], 0, 3.7682085037231445, 1544132050.1651545], "v": 0.1}
{"i": ["cuda", "conv2d_no_batching", [1, 28, 28, 128, 256, 3, 3, [2, 2], [1, 1]], {}, ["conv2d_no_batching", 1, 28, 28, 128, 256, 3, 3, [2, 2], [1, 1]], {"i": 73368602, "t": "", "c": null, "e": [["tile_f", "sp", [32, 4, 1, 1]], ["tile_y", "sp", [1, 2, 1, 7]], ["tile_x", "sp", [7, 1, 2, 1]], ["tile_rc", "sp", [32, 8, 1]], ["tile_ry", "sp", [1, 1, 3]], ["tile_rx", "sp", [1, 1, 3]], ["auto_unroll_max_step", "ot", 1500], ["unroll_explicit", "ot", 1]]}], "r": [[0.000467853349002849], 0, 4.75189733505249, 1544132052.6726732], "v": 0.1}
{"i": ["cuda", "conv2d_no_batching", [1, 28, 28, 128, 256, 3, 3, [2, 2], [1, 1]], {}, ["conv2d_no_batching", 1, 28, 28, 128, 256, 3, 3, [2, 2], [1, 1]], {"i": 73424176, "t": "", "c": null, "e": [["tile_f", "sp", [16, 2, 4, 1]], ["tile_y", "sp", [2, 1, 1, 7]], ["tile_x", "sp", [7, 2, 1, 1]], ["tile_rc", "sp", [8, 32, 1]], ["tile_ry", "sp", [1, 1, 3]], ["tile_rx", "sp", [1, 1, 3]], ["auto_unroll_max_step", "ot", 1500], ["unroll_explicit", "ot", 1]]}], "r": [[0.00042064971652421647], 0, 5.214879751205444, 1544132054.943309], "v": 0.1}
{"i": ["cuda", "conv2d_no_batching", [1, 28, 28, 128, 256, 3, 3, [2, 2], [1, 1]], {}, ["conv2d_no_batching", 1, 28, 28, 128, 256, 3, 3, [2, 2], [1, 1]], {"i": 73391524, "t": "", "c": null, "e": [["tile_f", "sp", [8, 16, 1, 1]], ["tile_y", "sp", [2, 1, 1, 7]], ["tile_x", "sp", [14, 1, 1, 1]], ["tile_rc", "sp", [16, 16, 1]], ["tile_ry", "sp", [1, 1, 3]], ["tile_rx", "sp", [1, 1, 3]], ["auto_unroll_max_step", "ot", 1500], ["unroll_explicit", "ot", 1]]}], "r": [[0.003329558837606838], 0, 11.610792636871338, 1544132063.5614974], "v": 0.1}
{"i": ["cuda", "conv2d_no_batching", [1, 28, 28, 128, 256, 3, 3, [2, 2], [1, 1]], {}, ["conv2d_no_batching", 1, 28, 28, 128, 256, 3, 3, [2, 2], [1, 1]], {"i": 73430042, "t": "", "c": null, "e": [["tile_f", "sp", [32, 4, 1, 1]], ["tile_y", "sp", [1, 2, 1, 7]], ["tile_x", "sp", [7, 1, 2, 1]], ["tile_rc", "sp", [8, 32, 1]], ["tile_ry", "sp", [1, 1, 3]], ["tile_rx", "sp", [1, 1, 3]], ["auto_unroll_max_step", "ot", 1500], ["unroll_explicit", "ot", 1]]}], "r": [[0.002414642678062678], 0, 7.809189081192017, 1544132069.7109036], "v": 0.1}
{"i": ["cuda", "conv2d_no_batching", [1, 28, 28, 128, 256, 3, 3, [2, 2], [1, 1]], {}, ["conv2d_no_batching", 1, 28, 28, 128, 256, 3, 3, [2, 2], [1, 1]], {"i": 73429936, "t": "", "c": null, "e": [["tile_f", "sp", [16, 2, 4, 1]], ["tile_y", "sp", [2, 1, 1, 7]], ["tile_x", "sp", [7, 1, 2, 1]], ["tile_rc", "sp", [8, 32, 1]], ["tile_ry", "sp", [1, 1, 3]], ["tile_rx", "sp", [1, 1, 3]], ["auto_unroll_max_step", "ot", 1500], ["unroll_explicit", "ot", 1]]}], "r": [[0.00029469807264957264], 0, 3.2002344131469727, 1544132071.3489208], "v": 0.1}
{"i": ["cuda", "conv2d_no_batching", [1, 28, 28, 128, 256, 3, 3, [2, 2], [1, 1]], {}, ["conv2d_no_batching", 1, 28, 28, 128, 256, 3, 3, [2, 2], [1, 1]], {"i": 73391531, "t": "", "c": null, "e": [["tile_f", "sp", [8, 8, 2, 1]], ["tile_y", "sp", [2, 1, 1, 7]], ["tile_x", "sp", [14, 1, 1, 1]], ["tile_rc", "sp", [16, 16, 1]], ["tile_ry", "sp", [1, 1, 3]], ["tile_rx", "sp", [1, 1, 3]], ["auto_unroll_max_step", "ot", 1500], ["unroll_explicit", "ot", 1]]}], "r": [[0.0004654218746438746], 0, 7.738539218902588, 1544132075.2610793], "v": 0.1}
{"i": ["cuda", "conv2d_no_batching", [1, 28, 28, 128, 256, 3, 3, [2, 2], [1, 1]], {}, ["conv2d_no_batching", 1, 28, 28, 128, 256, 3, 3, [2, 2], [1, 1]], {"i": 73393456, "t": "", "c": null, "e": [["tile_f", "sp", [16, 2, 4, 1]], ["tile_y", "sp", [2, 1, 1, 7]], ["tile_x", "sp", [7, 2, 1, 1]], ["tile_rc", "sp", [16, 16, 1]], ["tile_ry", "sp", [1, 1, 3]], ["tile_rx", "sp", [1, 1, 3]], ["auto_unroll_max_step", "ot", 1500], ["unroll_explicit", "ot", 1]]}], "r": [[0.00024243009686609684], 0, 3.0211188793182373, 1544132076.9769602], "v": 0.1}
{"i": ["cuda", "conv2d_no_batching", [1, 28, 28, 128, 256, 3, 3, [2, 2], [1, 1]], {}, ["conv2d_no_batching", 1, 28, 28, 128, 256, 3, 3, [2, 2], [1, 1]], {"i": 73393461, "t": "", "c": null, "e": [["tile_f", "sp", [16, 1, 8, 1]], ["tile_y", "sp", [2, 1, 1, 7]], ["tile_x", "sp", [7, 2, 1, 1]], ["tile_rc", "sp", [16, 16, 1]], ["tile_ry", "sp", [1, 1, 3]], ["tile_rx", "sp", [1, 1, 3]], ["auto_unroll_max_step", "ot", 1500], ["unroll_explicit", "ot", 1]]}], "r": [[0.00015649079344729345], 0, 2.202932357788086, 1544132078.235525], "v": 0.1}
{"i": ["cuda", "conv2d_no_batching", [1, 28, 28, 128, 256, 3, 3, [2, 2], [1, 1]], {}, ["conv2d_no_batching", 1, 28, 28, 128, 256, 3, 3, [2, 2], [1, 1]], {"i": 73368722, "t": "", "c": null, "e": [["tile_f", "sp", [32, 4, 1, 1]], ["tile_y", "sp", [1, 1, 2, 7]], ["tile_x", "sp", [7, 1, 2, 1]], ["tile_rc", "sp", [32, 8, 1]], ["tile_ry", "sp", [1, 1, 3]], ["tile_rx", "sp", [1, 1, 3]], ["auto_unroll_max_step", "ot", 1500], ["unroll_explicit", "ot", 1]]}], "r": [[0.00022984873646723648], 0, 2.6026830673217773, 1544132079.6905358], "v": 0.1}
{"i": ["cuda", "conv2d_no_batching", [1, 28, 28, 128, 256, 3, 3, [2, 2], [1, 1]], {}, ["conv2d_no_batching", 1, 28, 28, 128, 256, 3, 3, [2, 2], [1, 1]], {"i": 73452971, "t": "", "c": null, "e": [["tile_f", "sp", [8, 8, 2, 1]], ["tile_y", "sp", [2, 1, 1, 7]], ["tile_x", "sp", [14, 1, 1, 1]], ["tile_rc", "sp", [4, 64, 1]], ["tile_ry", "sp", [1, 1, 3]], ["tile_rx", "sp", [1, 1, 3]], ["auto_unroll_max_step", "ot", 1500], ["unroll_explicit", "ot", 1]]}], "r": [[0.00428907044017094], 0, 16.484696865081787, 1544132090.937565], "v": 0.1}
{"i": ["cuda", "conv2d_no_batching", [1, 28, 28, 128, 256, 3, 3, [2, 2], [1, 1]], {}, ["conv2d_no_batching", 1, 28, 28, 128, 256, 3, 3, [2, 2], [1, 1]], {"i": 73360941, "t": "", "c": null, "e": [["tile_f", "sp", [16, 1, 8, 1]], ["tile_y", "sp", [1, 2, 1, 7]], ["tile_x", "sp", [14, 1, 1, 1]], ["tile_rc", "sp", [32, 8, 1]], ["tile_ry", "sp", [1, 1, 3]], ["tile_rx", "sp", [1, 1, 3]], ["auto_unroll_max_step", "ot", 1500], ["unroll_explicit", "ot", 1]]}], "r": [[0.00021873337464387463], 0, 1.8560757637023926, 1544132092.3807507], "v": 0.1}
{"i": ["cuda", "conv2d_no_batching", [1, 28, 28, 128, 256, 3, 3, [2, 2], [1, 1]], {}, ["conv2d_no_batching", 1, 28, 28, 128, 256, 3, 3, [2, 2], [1, 1]], {"i": 69743523, "t": "", "c": null, "e": [["tile_f", "sp", [16, 8, 1, 1]], ["tile_y", "sp", [2, 1, 1, 7]], ["tile_x", "sp", [7, 1, 2, 1]], ["tile_rc", "sp", [8, 8, 4]], ["tile_ry", "sp", [1, 1, 3]], ["tile_rx", "sp", [1, 3, 1]], ["auto_unroll_max_step", "ot", 1500], ["unroll_explicit", "ot", 1]]}], "r": [[0.0012160215997150997], 0, 10.826776266098022, 1544132097.163114], "v": 0.1}
{"i": ["cuda", "conv2d_no_batching", [1, 28, 28, 128, 256, 3, 3, [2, 2], [1, 1]], {}, ["conv2d_no_batching", 1, 28, 28, 128, 256, 3, 3, [2, 2], [1, 1]], {"i": 69768615, "t": "", "c": null, "e": [["tile_f", "sp", [32, 1, 4, 1]], ["tile_y", "sp", [1, 2, 1, 7]], ["tile_x", "sp", [7, 2, 1, 1]], ["tile_rc", "sp", [4, 16, 4]], ["tile_ry", "sp", [1, 1, 3]], ["tile_rx", "sp", [1, 3, 1]], ["auto_unroll_max_step", "ot", 1500], ["unroll_explicit", "ot", 1]]}], "r": [[0.0033319407578347574], 0, 10.041676759719849, 1544132105.2996166], "v": 0.1}
{"i": ["cuda", "conv2d_no_batching", [1, 28, 28, 128, 256, 3, 3, [2, 2], [1, 1]], {}, ["conv2d_no_batching", 1, 28, 28, 128, 256, 3, 3, [2, 2], [1, 1]], {"i": 71034017, "t": "", "c": null, "e": [["tile_f", "sp", [8, 4, 4, 1]], ["tile_y", "sp", [1, 1, 2, 7]], ["tile_x", "sp", [7, 1, 2, 1]], ["tile_rc", "sp", [64, 1, 4]], ["tile_ry", "sp", [3, 1, 1]], ["tile_rx", "sp", [1, 1, 3]], ["auto_unroll_max_step", "ot", 1500], ["unroll_explicit", "ot", 1]]}], "r": [[0.0003520984472934473], 0, 3.3662357330322266, 1544132107.2766352], "v": 0.1}
{"i": ["cuda", "conv2d_no_batching", [1, 28, 28, 128, 256, 3, 3, [2, 2], [1, 1]], {}, ["conv2d_no_batching", 1, 28, 28, 128, 256, 3, 3, [2, 2], [1, 1]], {"i": 71028255, "t": "", "c": null, "e": [["tile_f", "sp", [32, 1, 4, 1]], ["tile_y", "sp", [1, 1, 2, 7]], ["tile_x", "sp", [7, 2, 1, 1]], ["tile_rc", "sp", [64, 1, 4]], ["tile_ry", "sp", [3, 1, 1]], ["tile_rx", "sp", [1, 1, 3]], ["auto_unroll_max_step", "ot", 1500], ["unroll_explicit", "ot", 1]]}], "r": [[0.0003352738404558405], 0, 2.8853304386138916, 1544132109.0582407], "v": 0.1}
{"i": ["cuda", "conv2d_no_batching", [1, 28, 28, 128, 256, 3, 3, [2, 2], [1, 1]], {}, ["conv2d_no_batching", 1, 28, 28, 128, 256, 3, 3, [2, 2], [1, 1]], {"i": 71126175, "t": "", "c": null, "e": [["tile_f", "sp", [32, 1, 4, 1]], ["tile_y", "sp", [1, 1, 2, 7]], ["tile_x", "sp", [7, 1, 2, 1]], ["tile_rc", "sp", [8, 8, 4]], ["tile_ry", "sp", [3, 1, 1]], ["tile_rx", "sp", [1, 1, 3]], ["auto_unroll_max_step", "ot", 1500], ["unroll_explicit", "ot", 1]]}], "r": [[0.0005272931809116809], 0, 4.208091497421265, 1544132111.7413406], "v": 0.1}
{"i": ["cuda", "conv2d_no_batching", [1, 28, 28, 128, 256, 3, 3, [2, 2], [1, 1]], {}, ["conv2d_no_batching", 1, 28, 28, 128, 256, 3, 3, [2, 2], [1, 1]], {"i": 71028137, "t": "", "c": null, "e": [["tile_f", "sp", [8, 4, 4, 1]], ["tile_y", "sp", [1, 2, 1, 7]], ["tile_x", "sp", [7, 2, 1, 1]], ["tile_rc", "sp", [64, 1, 4]], ["tile_ry", "sp", [3, 1, 1]], ["tile_rx", "sp", [1, 1, 3]], ["auto_unroll_max_step", "ot", 1500], ["unroll_explicit", "ot", 1]]}], "r": [[0.0008551580185185185], 0, 5.003766298294067, 1544132114.6059933], "v": 0.1}
{"i": ["cuda", "conv2d_no_batching", [1, 28, 28, 128, 256, 3, 3, [2, 2], [1, 1]], {}, ["conv2d_no_batching", 1, 28, 28, 128, 256, 3, 3, [2, 2], [1, 1]], {"i": 71034019, "t": "", "c": null, "e": [["tile_f", "sp", [2, 16, 4, 1]], ["tile_y", "sp", [1, 1, 2, 7]], ["tile_x", "sp", [7, 1, 2, 1]], ["tile_rc", "sp", [64, 1, 4]], ["tile_ry", "sp", [3, 1, 1]], ["tile_rx", "sp", [1, 1, 3]], ["auto_unroll_max_step", "ot", 1500], ["unroll_explicit", "ot", 1]]}], "r": [[0.001478511688034188], 0, 6.313754320144653, 1544132118.806791], "v": 0.1}
{"i": ["cuda", "conv2d_no_batching", [1, 28, 28, 128, 256, 3, 3, [2, 2], [1, 1]], {}, ["conv2d_no_batching", 1, 28, 28, 128, 256, 3, 3, [2, 2], [1, 1]], {"i": 71028257, "t": "", "c": null, "e": [["tile_f", "sp", [8, 4, 4, 1]], ["tile_y", "sp", [1, 1, 2, 7]], ["tile_x", "sp", [7, 2, 1, 1]], ["tile_rc", "sp", [64, 1, 4]], ["tile_ry", "sp", [3, 1, 1]], ["tile_rx", "sp", [1, 1, 3]], ["auto_unroll_max_step", "ot", 1500], ["unroll_explicit", "ot", 1]]}], "r": [[0.0015759440128205126], 0, 5.651122570037842, 1544132123.2309055], "v": 0.1}
{"i": ["cuda", "conv2d_no_batching", [1, 28, 28, 128, 256, 3, 3, [2, 2], [1, 1]], {}, ["conv2d_no_batching", 1, 28, 28, 128, 256, 3, 3, [2, 2], [1, 1]], {"i": 71089695, "t": "", "c": null, "e": [["tile_f", "sp", [32, 1, 4, 1]], ["tile_y", "sp", [1, 1, 2, 7]], ["tile_x", "sp", [7, 2, 1, 1]], ["tile_rc", "sp", [16, 4, 4]], ["tile_ry", "sp", [3, 1, 1]], ["tile_rx", "sp", [1, 1, 3]], ["auto_unroll_max_step", "ot", 1500], ["unroll_explicit", "ot", 1]]}], "r": [[0.0004506702649572649], 0, 3.491212844848633, 1544132125.4923406], "v": 0.1}
{"i": ["cuda", "conv2d_no_batching", [1, 28, 28, 128, 256, 3, 3, [2, 2], [1, 1]], {}, ["conv2d_no_batching", 1, 28, 28, 128, 256, 3, 3, [2, 2], [1, 1]], {"i": 71151138, "t": "", "c": null, "e": [["tile_f", "sp", [4, 8, 4, 1]], ["tile_y", "sp", [1, 1, 2, 7]], ["tile_x", "sp", [7, 2, 1, 1]], ["tile_rc", "sp", [4, 16, 4]], ["tile_ry", "sp", [3, 1, 1]], ["tile_rx", "sp", [1, 1, 3]], ["auto_unroll_max_step", "ot", 1500], ["unroll_explicit", "ot", 1]]}], "r": [[0.0009250410441595441], 0, 8.738197565078735, 1544132129.0201955], "v": 0.1}
{"i": ["cuda", "conv2d_no_batching", [1, 28, 28, 128, 256, 3, 3, [2, 2], [1, 1]], {}, ["conv2d_no_batching", 1, 28, 28, 128, 256, 3, 3, [2, 2], [1, 1]], {"i": 71089577, "t": "", "c": null, "e": [["tile_f", "sp", [8, 4, 4, 1]], ["tile_y", "sp", [1, 2, 1, 7]], ["tile_x", "sp", [7, 2, 1, 1]], ["tile_rc", "sp", [16, 4, 4]], ["tile_ry", "sp", [3, 1, 1]], ["tile_rx", "sp", [1, 1, 3]], ["auto_unroll_max_step", "ot", 1500], ["unroll_explicit", "ot", 1]]}], "r": [[0.0008595708475783476], 0, 6.122873306274414, 1544132132.099524], "v": 0.1}
