transfer-learning/conv2d_transfer_curve-fix_c12_c7.log
{"i": ["cuda", "conv2d_no_batching", [1, 28, 28, 128, 256, 3, 3, [2, 2], [1, 1]], {}, ["conv2d_no_batching", 1, 28, 28, 128, 256, 3, 3, [2, 2], [1, 1]], {"i": 25097423, "t": "", "c": null, "e": [["tile_f", "sp", [4, 4, 8, 1]], ["tile_y", "sp", [7, 1, 1, 2]], ["tile_x", "sp", [1, 1, 1, 14]], ["tile_rc", "sp", [4, 64, 1]], ["tile_ry", "sp", [3, 1, 1]], ["tile_rx", "sp", [3, 1, 1]], ["auto_unroll_max_step", "ot", 1500], ["unroll_explicit", "ot", 0]]}], "r": [[0.0008726308250428817], 0, 4.896499395370483, 1544100263.7570462], "v": 0.1}
{"i": ["cuda", "conv2d_no_batching", [1, 28, 28, 128, 256, 3, 3, [2, 2], [1, 1]], {}, ["conv2d_no_batching", 1, 28, 28, 128, 256, 3, 3, [2, 2], [1, 1]], {"i": 62422230, "t": "", "c": null, "e": [["tile_f", "sp", [4, 1, 32, 1]], ["tile_y", "sp", [7, 1, 1, 2]], ["tile_x", "sp", [1, 1, 1, 14]], ["tile_rc", "sp", [4, 64, 1]], ["tile_ry", "sp", [3, 1, 1]], ["tile_rx", "sp", [3, 1, 1]], ["auto_unroll_max_step", "ot", 1500], ["unroll_explicit", "ot", 1]]}], "r": [[0.0007426856089193826], 0, 2.770099639892578, 1544100265.7689664], "v": 0.1}
{"i": ["cuda", "conv2d_no_batching", [1, 28, 28, 128, 256, 3, 3, [2, 2], [1, 1]], {}, ["conv2d_no_batching", 1, 28, 28, 128, 256, 3, 3, [2, 2], [1, 1]], {"i": 62422205, "t": "", "c": null, "e": [["tile_f", "sp", [4, 32, 1, 1]], ["tile_y", "sp", [7, 1, 1, 2]], ["tile_x", "sp", [1, 1, 1, 14]], ["tile_rc", "sp", [4, 64, 1]], ["tile_ry", "sp", [3, 1, 1]], ["tile_rx", "sp", [3, 1, 1]], ["auto_unroll_max_step", "ot", 1500], ["unroll_explicit", "ot", 1]]}], "r": [[0.048456761], 0, 5.304291248321533, 1544100253.2422948], "v": 0.1}
{"i": ["cuda", "conv2d_no_batching", [1, 28, 28, 128, 256, 3, 3, [2, 2], [1, 1]], {}, ["conv2d_no_batching", 1, 28, 28, 128, 256, 3, 3, [2, 2], [1, 1]], {"i": 62422223, "t": "", "c": null, "e": [["tile_f", "sp", [4, 4, 8, 1]], ["tile_y", "sp", [7, 1, 1, 2]], ["tile_x", "sp", [1, 1, 1, 14]], ["tile_rc", "sp", [4, 64, 1]], ["tile_ry", "sp", [3, 1, 1]], ["tile_rx", "sp", [3, 1, 1]], ["auto_unroll_max_step", "ot", 1500], ["unroll_explicit", "ot", 1]]}], "r": [[0.0005814335574614066], 0, 5.208747863769531, 1544100267.6747096], "v": 0.1}
{"i": ["cuda", "conv2d_no_batching", [1, 28, 28, 128, 256, 3, 3, [2, 2], [1, 1]], {}, ["conv2d_no_batching", 1, 28, 28, 128, 256, 3, 3, [2, 2], [1, 1]], {"i": 62272335, "t": "", "c": null, "e": [["tile_f", "sp", [32, 1, 4, 1]], ["tile_y", "sp", [1, 1, 14, 1]], ["tile_x", "sp", [7, 2, 1, 1]], ["tile_rc", "sp", [64, 4, 1]], ["tile_ry", "sp", [3, 1, 1]], ["tile_rx", "sp", [3, 1, 1]], ["auto_unroll_max_step", "ot", 1500], ["unroll_explicit", "ot", 1]]}], "r": [[0.00026078665866209263], 0, 1.5186119079589844, 1544100268.791979], "v": 0.1}
{"i": ["cuda", "conv2d_no_batching", [1, 28, 28, 128, 256, 3, 3, [2, 2], [1, 1]], {}, ["conv2d_no_batching", 1, 28, 28, 128, 256, 3, 3, [2, 2], [1, 1]], {"i": 63667335, "t": "", "c": null, "e": [["tile_f", "sp", [32, 1, 4, 1]], ["tile_y", "sp", [7, 2, 1, 1]], ["tile_x", "sp", [1, 1, 14, 1]], ["tile_rc", "sp", [64, 4, 1]], ["tile_ry", "sp", [1, 3, 1]], ["tile_rx", "sp", [3, 1, 1]], ["auto_unroll_max_step", "ot", 1500], ["unroll_explicit", "ot", 1]]}], "r": [[0.00019792643910806175], 0, 1.3469502925872803, 1544100269.8180244], "v": 0.1}
{"i": ["cuda", "conv2d_no_batching", [1, 28, 28, 128, 256, 3, 3, [2, 2], [1, 1]], {}, ["conv2d_no_batching", 1, 28, 28, 128, 256, 3, 3, [2, 2], [1, 1]], {"i": 63654735, "t": "", "c": null, "e": [["tile_f", "sp", [32, 1, 4, 1]], ["tile_y", "sp", [1, 1, 14, 1]], ["tile_x", "sp", [7, 2, 1, 1]], ["tile_rc", "sp", [64, 4, 1]], ["tile_ry", "sp", [1, 3, 1]], ["tile_rx", "sp", [3, 1, 1]], ["auto_unroll_max_step", "ot", 1500], ["unroll_explicit", "ot", 1]]}], "r": [[0.00016932616666666669], 0, 1.3813250064849854, 1544100277.0649712], "v": 0.1}
{"i": ["cuda", "conv2d_no_batching", [1, 28, 28, 128, 256, 3, 3, [2, 2], [1, 1]], {}, ["conv2d_no_batching", 1, 28, 28, 128, 256, 3, 3, [2, 2], [1, 1]], {"i": 67814535, "t": "", "c": null, "e": [["tile_f", "sp", [32, 1, 4, 1]], ["tile_y", "sp", [7, 2, 1, 1]], ["tile_x", "sp", [1, 1, 14, 1]], ["tile_rc", "sp", [64, 4, 1]], ["tile_ry", "sp", [1, 3, 1]], ["tile_rx", "sp", [1, 3, 1]], ["auto_unroll_max_step", "ot", 1500], ["unroll_explicit", "ot", 1]]}], "r": [[0.00013041919401041667], 0, 1.2502202987670898, 1544100278.050279], "v": 0.1}
{"i": ["cuda", "conv2d_no_batching", [1, 28, 28, 128, 256, 3, 3, [2, 2], [1, 1]], {}, ["conv2d_no_batching", 1, 28, 28, 128, 256, 3, 3, [2, 2], [1, 1]], {"i": 62284935, "t": "", "c": null, "e": [["tile_f", "sp", [32, 1, 4, 1]], ["tile_y", "sp", [7, 2, 1, 1]], ["tile_x", "sp", [1, 1, 14, 1]], ["tile_rc", "sp", [64, 4, 1]], ["tile_ry", "sp", [3, 1, 1]], ["tile_rx", "sp", [3, 1, 1]], ["auto_unroll_max_step", "ot", 1500], ["unroll_explicit", "ot", 1]]}], "r": [[0.000303011295025729], 0, 1.8090322017669678, 1544100272.9143634], "v": 0.1}
{"i": ["cuda", "conv2d_no_batching", [1, 28, 28, 128, 256, 3, 3, [2, 2], [1, 1]], {}, ["conv2d_no_batching", 1, 28, 28, 128, 256, 3, 3, [2, 2], [1, 1]], {"i": 67801935, "t": "", "c": null, "e": [["tile_f", "sp", [32, 1, 4, 1]], ["tile_y", "sp", [1, 1, 14, 1]], ["tile_x", "sp", [7, 2, 1, 1]], ["tile_rc", "sp", [64, 4, 1]], ["tile_ry", "sp", [1, 3, 1]], ["tile_rx", "sp", [1, 3, 1]], ["auto_unroll_max_step", "ot", 1500], ["unroll_explicit", "ot", 1]]}], "r": [[0.0001742754631217839], 0, 1.2782907485961914, 1544100273.9002488], "v": 0.1}
{"i": ["cuda", "conv2d_no_batching", [1, 28, 28, 128, 256, 3, 3, [2, 2], [1, 1]], {}, ["conv2d_no_batching", 1, 28, 28, 128, 256, 3, 3, [2, 2], [1, 1]], {"i": 66432135, "t": "", "c": null, "e": [["tile_f", "sp", [32, 1, 4, 1]], ["tile_y", "sp", [7, 2, 1, 1]], ["tile_x", "sp", [1, 1, 14, 1]], ["tile_rc", "sp", [64, 4, 1]], ["tile_ry", "sp", [3, 1, 1]], ["tile_rx", "sp", [1, 3, 1]], ["auto_unroll_max_step", "ot", 1500], ["unroll_explicit", "ot", 1]]}], "r": [[0.0001775149193825043], 0, 1.3057200908660889, 1544100274.89697], "v": 0.1}
{"i": ["cuda", "conv2d_no_batching", [1, 28, 28, 128, 256, 3, 3, [2, 2], [1, 1]], {}, ["conv2d_no_batching", 1, 28, 28, 128, 256, 3, 3, [2, 2], [1, 1]], {"i": 66419535, "t": "", "c": null, "e": [["tile_f", "sp", [32, 1, 4, 1]], ["tile_y", "sp", [1, 1, 14, 1]], ["tile_x", "sp", [7, 2, 1, 1]], ["tile_rc", "sp", [64, 4, 1]], ["tile_ry", "sp", [3, 1, 1]], ["tile_rx", "sp", [1, 3, 1]], ["auto_unroll_max_step", "ot", 1500], ["unroll_explicit", "ot", 1]]}], "r": [[0.0002426409348198971], 0, 1.4612948894500732, 1544100276.0111148], "v": 0.1}
{"i": ["cuda", "conv2d_no_batching", [1, 28, 28, 128, 256, 3, 3, [2, 2], [1, 1]], {}, ["conv2d_no_batching", 1, 28, 28, 128, 256, 3, 3, [2, 2], [1, 1]], {"i": 25061910, "t": "", "c": null, "e": [["tile_f", "sp", [4, 1, 32, 1]], ["tile_y", "sp", [7, 2, 1, 1]], ["tile_x", "sp", [1, 2, 1, 7]], ["tile_rc", "sp", [8, 32, 1]], ["tile_ry", "sp", [3, 1, 1]], ["tile_rx", "sp", [3, 1, 1]], ["auto_unroll_max_step", "ot", 1500], ["unroll_explicit", "ot", 0]]}], "r": [[0.0007774985442708333], 0, 3.3260090351104736, 1544100291.279462], "v": 0.1}
{"i": ["cuda", "conv2d_no_batching", [1, 28, 28, 128, 256, 3, 3, [2, 2], [1, 1]], {}, ["conv2d_no_batching", 1, 28, 28, 128, 256, 3, 3, [2, 2], [1, 1]], {"i": 62331030, "t": "", "c": null, "e": [["tile_f", "sp", [4, 1, 32, 1]], ["tile_y", "sp", [7, 2, 1, 1]], ["tile_x", "sp", [14, 1, 1, 1]], ["tile_rc", "sp", [16, 16, 1]], ["tile_ry", "sp", [3, 1, 1]], ["tile_rx", "sp", [3, 1, 1]], ["auto_unroll_max_step", "ot", 1500], ["unroll_explicit", "ot", 1]]}], "r": [[0.0009576547942708333], 0, 3.629215955734253, 1544100294.321094], "v": 0.1}
{"i": ["cuda", "conv2d_no_batching", [1, 28, 28, 128, 256, 3, 3, [2, 2], [1, 1]], {}, ["conv2d_no_batching", 1, 28, 28, 128, 256, 3, 3, [2, 2], [1, 1]], {"i": 25097430, "t": "", "c": null, "e": [["tile_f", "sp", [4, 1, 32, 1]], ["tile_y", "sp", [7, 1, 1, 2]], ["tile_x", "sp", [1, 1, 1, 14]], ["tile_rc", "sp", [4, 64, 1]], ["tile_ry", "sp", [3, 1, 1]], ["tile_rx", "sp", [3, 1, 1]], ["auto_unroll_max_step", "ot", 1500], ["unroll_explicit", "ot", 0]]}], "r": [[0.0007519506171874999], 0, 3.369227647781372, 1544100328.7461653], "v": 0.1}
{"i": ["cuda", "conv2d_no_batching", [1, 28, 28, 128, 256, 3, 3, [2, 2], [1, 1]], {}, ["conv2d_no_batching", 1, 28, 28, 128, 256, 3, 3, [2, 2], [1, 1]], {"i": 25061790, "t": "", "c": null, "e": [["tile_f", "sp", [4, 1, 32, 1]], ["tile_y", "sp", [14, 1, 1, 1]], ["tile_x", "sp", [1, 2, 1, 7]], ["tile_rc", "sp", [8, 32, 1]], ["tile_ry", "sp", [3, 1, 1]], ["tile_rx", "sp", [3, 1, 1]], ["auto_unroll_max_step", "ot", 1500], ["unroll_explicit", "ot", 0]]}], "r": [[0.00031580863932291665], 0, 2.1955761909484863, 1544100330.5523458], "v": 0.1}
{"i": ["cuda", "conv2d_no_batching", [1, 28, 28, 128, 256, 3, 3, [2, 2], [1, 1]], {}, ["conv2d_no_batching", 1, 28, 28, 128, 256, 3, 3, [2, 2], [1, 1]], {"i": 25059870, "t": "", "c": null, "e": [["tile_f", "sp", [4, 1, 32, 1]], ["tile_y", "sp", [14, 1, 1, 1]], ["tile_x", "sp", [2, 1, 1, 7]], ["tile_rc", "sp", [8, 32, 1]], ["tile_ry", "sp", [3, 1, 1]], ["tile_rx", "sp", [3, 1, 1]], ["auto_unroll_max_step", "ot", 1500], ["unroll_explicit", "ot", 0]]}], "r": [[0.00029415268359375], 0, 1.881032943725586, 1544100332.019565], "v": 0.1}
{"i": ["cuda", "conv2d_no_batching", [1, 28, 28, 128, 256, 3, 3, [2, 2], [1, 1]], {}, ["conv2d_no_batching", 1, 28, 28, 128, 256, 3, 3, [2, 2], [1, 1]], {"i": 2158609, "t": "", "c": null, "e": [["tile_f", "sp", [16, 1, 4, 2]], ["tile_y", "sp", [7, 1, 2, 1]], ["tile_x", "sp", [7, 1, 2, 1]], ["tile_rc", "sp", [16, 2, 8]], ["tile_ry", "sp", [1, 3, 1]], ["tile_rx", "sp", [3, 1, 1]], ["auto_unroll_max_step", "ot", 0], ["unroll_explicit", "ot", 0]]}], "r": [[0.00029030820703125], 0, 1.6634316444396973, 1544100333.6330037], "v": 0.1}
{"i": ["cuda", "conv2d_no_batching", [1, 28, 28, 128, 256, 3, 3, [2, 2], [1, 1]], {}, ["conv2d_no_batching", 1, 28, 28, 128, 256, 3, 3, [2, 2], [1, 1]], {"i": 53314566, "t": "", "c": null, "e": [["tile_f", "sp", [2, 64, 1, 1]], ["tile_y", "sp", [14, 1, 1, 1]], ["tile_x", "sp", [1, 1, 14, 1]], ["tile_rc", "sp", [16, 2, 8]], ["tile_ry", "sp", [1, 1, 3]], ["tile_rx", "sp", [3, 1, 1]], ["auto_unroll_max_step", "ot", 512], ["unroll_explicit", "ot", 1]]}], "r": [[0.00878563570703125], 0, 26.57796859741211, 1544100357.369537], "v": 0.1}
{"i": ["cuda", "conv2d_no_batching", [1, 28, 28, 128, 256, 3, 3, [2, 2], [1, 1]], {}, ["conv2d_no_batching", 1, 28, 28, 128, 256, 3, 3, [2, 2], [1, 1]], {"i": 11413975, "t": "", "c": null, "e": [["tile_f", "sp", [4, 2, 8, 2]], ["tile_y", "sp", [2, 1, 1, 7]], ["tile_x", "sp", [1, 1, 14, 1]], ["tile_rc", "sp", [32, 4, 2]], ["tile_ry", "sp", [1, 1, 3]], ["tile_rx", "sp", [1, 1, 3]], ["auto_unroll_max_step", "ot", 0], ["unroll_explicit", "ot", 0]]}], "r": [[0.0010052934518229165], 0, 3.578589677810669, 1544100360.5049334], "v": 0.1}
{"i": ["cuda", "conv2d_no_batching", [1, 28, 28, 128, 256, 3, 3, [2, 2], [1, 1]], {}, ["conv2d_no_batching", 1, 28, 28, 128, 256, 3, 3, [2, 2], [1, 1]], {"i": 61617671, "t": "", "c": null, "e": [["tile_f", "sp", [8, 2, 2, 4]], ["tile_y", "sp", [1, 1, 14, 1]], ["tile_x", "sp", [2, 1, 1, 7]], ["tile_rc", "sp", [16, 2, 8]], ["tile_ry", "sp", [1, 1, 3]], ["tile_rx", "sp", [1, 1, 3]], ["auto_unroll_max_step", "ot", 512], ["unroll_explicit", "ot", 1]]}], "r": [[0.0021371834205729167], 0, 16.81627345085144, 1544100370.6667724], "v": 0.1}
{"i": ["cuda", "conv2d_no_batching", [1, 28, 28, 128, 256, 3, 3, [2, 2], [1, 1]], {}, ["conv2d_no_batching", 1, 28, 28, 128, 256, 3, 3, [2, 2], [1, 1]], {"i": 51210244, "t": "", "c": null, "e": [["tile_f", "sp", [8, 16, 1, 1]], ["tile_y", "sp", [14, 1, 1, 1]], ["tile_x", "sp", [14, 1, 1, 1]], ["tile_rc", "sp", [64, 4, 1]], ["tile_ry", "sp", [1, 3, 1]], ["tile_rx", "sp", [3, 1, 1]], ["auto_unroll_max_step", "ot", 512], ["unroll_explicit", "ot", 1]]}], "r": [[0.0024392688958333334], 0, 6.999903678894043, 1544100408.7738352], "v": 0.1}
{"i": ["cuda", "conv2d_no_batching", [1, 28, 28, 128, 256, 3, 3, [2, 2], [1, 1]], {}, ["conv2d_no_batching", 1, 28, 28, 128, 256, 3, 3, [2, 2], [1, 1]], {"i": 28005894, "t": "", "c": null, "e": [["tile_f", "sp", [8, 1, 8, 2]], ["tile_y", "sp", [2, 1, 7, 1]], ["tile_x", "sp", [1, 7, 1, 2]], ["tile_rc", "sp", [32, 4, 2]], ["tile_ry", "sp", [1, 1, 3]], ["tile_rx", "sp", [3, 1, 1]], ["auto_unroll_max_step", "ot", 1500], ["unroll_explicit", "ot", 0]]}], "r": [[0.0020143199153645833], 0, 7.210796117782593, 1544100509.8890283], "v": 0.1}
{"i": ["cuda", "conv2d_no_batching", [1, 28, 28, 128, 256, 3, 3, [2, 2], [1, 1]], {}, ["conv2d_no_batching", 1, 28, 28, 128, 256, 3, 3, [2, 2], [1, 1]], {"i": 62949369, "t": "", "c": null, "e": [["tile_f", "sp", [32, 2, 2, 1]], ["tile_y", "sp", [2, 7, 1, 1]], ["tile_x", "sp", [2, 7, 1, 1]], ["tile_rc", "sp", [32, 1, 8]], ["tile_ry", "sp", [3, 1, 1]], ["tile_rx", "sp", [3, 1, 1]], ["auto_unroll_max_step", "ot", 1500], ["unroll_explicit", "ot", 1]]}], "r": [[0.006635332610677083], 0, 23.66698408126831, 1544100656.590569], "v": 0.1}
{"i": ["cuda", "conv2d_no_batching", [1, 28, 28, 128, 256, 3, 3, [2, 2], [1, 1]], {}, ["conv2d_no_batching", 1, 28, 28, 128, 256, 3, 3, [2, 2], [1, 1]], {"i": 67096569, "t": "", "c": null, "e": [["tile_f", "sp", [32, 2, 2, 1]], ["tile_y", "sp", [2, 7, 1, 1]], ["tile_x", "sp", [2, 7, 1, 1]], ["tile_rc", "sp", [32, 1, 8]], ["tile_ry", "sp", [3, 1, 1]], ["tile_rx", "sp", [1, 3, 1]], ["auto_unroll_max_step", "ot", 1500], ["unroll_explicit", "ot", 1]]}], "r": [[0.008581301419270833], 0, 25.96389889717102, 1544100678.2306461], "v": 0.1}
{"i": ["cuda", "conv2d_no_batching", [1, 28, 28, 128, 256, 3, 3, [2, 2], [1, 1]], {}, ["conv2d_no_batching", 1, 28, 28, 128, 256, 3, 3, [2, 2], [1, 1]], {"i": 64331769, "t": "", "c": null, "e": [["tile_f", "sp", [32, 2, 2, 1]], ["tile_y", "sp", [2, 7, 1, 1]], ["tile_x", "sp", [2, 7, 1, 1]], ["tile_rc", "sp", [32, 1, 8]], ["tile_ry", "sp", [1, 3, 1]], ["tile_rx", "sp", [3, 1, 1]], ["auto_unroll_max_step", "ot", 1500], ["unroll_explicit", "ot", 1]]}], "r": [[0.0065784856523437504], 0, 21.034807682037354, 1544100694.9905052], "v": 0.1}
{"i": ["cuda", "conv2d_no_batching", [1, 28, 28, 128, 256, 3, 3, [2, 2], [1, 1]], {}, ["conv2d_no_batching", 1, 28, 28, 128, 256, 3, 3, [2, 2], [1, 1]], {"i": 68478969, "t": "", "c": null, "e": [["tile_f", "sp", [32, 2, 2, 1]], ["tile_y", "sp", [2, 7, 1, 1]], ["tile_x", "sp", [2, 7, 1, 1]], ["tile_rc", "sp", [32, 1, 8]], ["tile_ry", "sp", [1, 3, 1]], ["tile_rx", "sp", [1, 3, 1]], ["auto_unroll_max_step", "ot", 1500], ["unroll_explicit", "ot", 1]]}], "r": [[0.0038276609270833334], 0, 14.558755159378052, 1544100705.7607682], "v": 0.1}
{"i": ["cuda", "conv2d_no_batching", [1, 28, 28, 128, 256, 3, 3, [2, 2], [1, 1]], {}, ["conv2d_no_batching", 1, 28, 28, 128, 256, 3, 3, [2, 2], [1, 1]], {"i": 68509689, "t": "", "c": null, "e": [["tile_f", "sp", [32, 2, 2, 1]], ["tile_y", "sp", [2, 7, 1, 1]], ["tile_x", "sp", [2, 7, 1, 1]], ["tile_rc", "sp", [16, 2, 8]], ["tile_ry", "sp", [1, 3, 1]], ["tile_rx", "sp", [1, 3, 1]], ["auto_unroll_max_step", "ot", 1500], ["unroll_explicit", "ot", 1]]}], "r": [[0.007006609204427083], 0, 19.19880223274231, 1544100723.259261], "v": 0.1}
{"i": ["cuda", "conv2d_no_batching", [1, 28, 28, 128, 256, 3, 3, [2, 2], [1, 1]], {}, ["conv2d_no_batching", 1, 28, 28, 128, 256, 3, 3, [2, 2], [1, 1]], {"i": 68479322, "t": "", "c": null, "e": [["tile_f", "sp", [32, 4, 1, 1]], ["tile_y", "sp", [1, 7, 2, 1]], ["tile_x", "sp", [2, 7, 1, 1]], ["tile_rc", "sp", [32, 1, 8]], ["tile_ry", "sp", [1, 3, 1]], ["tile_rx", "sp", [1, 3, 1]], ["auto_unroll_max_step", "ot", 1500], ["unroll_explicit", "ot", 1]]}], "r": [[0.007019417888020833], 0, 18.751179218292236, 1544100803.270538], "v": 0.1}
{"i": ["cuda", "conv2d_no_batching", [1, 28, 28, 128, 256, 3, 3, [2, 2], [1, 1]], {}, ["conv2d_no_batching", 1, 28, 28, 128, 256, 3, 3, [2, 2], [1, 1]], {"i": 68484722, "t": "", "c": null, "e": [["tile_f", "sp", [32, 4, 1, 1]], ["tile_y", "sp", [2, 7, 1, 1]], ["tile_x", "sp", [1, 7, 2, 1]], ["tile_rc", "sp", [32, 1, 8]], ["tile_ry", "sp", [1, 3, 1]], ["tile_rx", "sp", [1, 3, 1]], ["auto_unroll_max_step", "ot", 1500], ["unroll_explicit", "ot", 1]]}], "r": [[0.009479238205729166], 0, 24.624156713485718, 1544100857.6329992], "v": 0.1}
{"i": ["cuda", "conv2d_no_batching", [1, 28, 28, 128, 256, 3, 3, [2, 2], [1, 1]], {}, ["conv2d_no_batching", 1, 28, 28, 128, 256, 3, 3, [2, 2], [1, 1]], {"i": 67814529, "t": "", "c": null, "e": [["tile_f", "sp", [32, 2, 2, 1]], ["tile_y", "sp", [7, 2, 1, 1]], ["tile_x", "sp", [1, 1, 14, 1]], ["tile_rc", "sp", [64, 4, 1]], ["tile_ry", "sp", [1, 3, 1]], ["tile_rx", "sp", [1, 3, 1]], ["auto_unroll_max_step", "ot", 1500], ["unroll_explicit", "ot", 1]]}], "r": [[0.00013853530208333332], 0, 1.7542941570281982, 1544100952.5983808], "v": 0.1}
{"i": ["cuda", "conv2d_no_batching", [1, 28, 28, 128, 256, 3, 3, [2, 2], [1, 1]], {}, ["conv2d_no_batching", 1, 28, 28, 128, 256, 3, 3, [2, 2], [1, 1]], {"i": 66432129, "t": "", "c": null, "e": [["tile_f", "sp", [32, 2, 2, 1]], ["tile_y", "sp", [7, 2, 1, 1]], ["tile_x", "sp", [1, 1, 14, 1]], ["tile_rc", "sp", [64, 4, 1]], ["tile_ry", "sp", [3, 1, 1]], ["tile_rx", "sp", [1, 3, 1]], ["auto_unroll_max_step", "ot", 1500], ["unroll_explicit", "ot", 1]]}], "r": [[0.00028943251822916667], 0, 2.2493350505828857, 1544100954.161316], "v": 0.1}
{"i": ["cuda", "conv2d_no_batching", [1, 28, 28, 128, 256, 3, 3, [2, 2], [1, 1]], {}, ["conv2d_no_batching", 1, 28, 28, 128, 256, 3, 3, [2, 2], [1, 1]], {"i": 63667329, "t": "", "c": null, "e": [["tile_f", "sp", [32, 2, 2, 1]], ["tile_y", "sp", [7, 2, 1, 1]], ["tile_x", "sp", [1, 1, 14, 1]], ["tile_rc", "sp", [64, 4, 1]], ["tile_ry", "sp", [1, 3, 1]], ["tile_rx", "sp", [3, 1, 1]], ["auto_unroll_max_step", "ot", 1500], ["unroll_explicit", "ot", 1]]}], "r": [[0.00023774926692708332], 0, 2.0032851696014404, 1544100955.5470676], "v": 0.1}
{"i": ["cuda", "conv2d_no_batching", [1, 28, 28, 128, 256, 3, 3, [2, 2], [1, 1]], {}, ["conv2d_no_batching", 1, 28, 28, 128, 256, 3, 3, [2, 2], [1, 1]], {"i": 67801929, "t": "", "c": null, "e": [["tile_f", "sp", [32, 2, 2, 1]], ["tile_y", "sp", [1, 1, 14, 1]], ["tile_x", "sp", [7, 2, 1, 1]], ["tile_rc", "sp", [64, 4, 1]], ["tile_ry", "sp", [1, 3, 1]], ["tile_rx", "sp", [1, 3, 1]], ["auto_unroll_max_step", "ot", 1500], ["unroll_explicit", "ot", 1]]}], "r": [[0.00013720786067708332], 0, 1.6880671977996826, 1544100956.742241], "v": 0.1}
{"i": ["cuda", "conv2d_no_batching", [1, 28, 28, 128, 256, 3, 3, [2, 2], [1, 1]], {}, ["conv2d_no_batching", 1, 28, 28, 128, 256, 3, 3, [2, 2], [1, 1]], {"i": 66432489, "t": "", "c": null, "e": [["tile_f", "sp", [32, 2, 2, 1]], ["tile_y", "sp", [7, 1, 2, 1]], ["tile_x", "sp", [1, 1, 14, 1]], ["tile_rc", "sp", [64, 4, 1]], ["tile_ry", "sp", [3, 1, 1]], ["tile_rx", "sp", [1, 3, 1]], ["auto_unroll_max_step", "ot", 1500], ["unroll_explicit", "ot", 1]]}], "r": [[0.00016371066927083335], 0, 1.7485895156860352, 1544100957.9233274], "v": 0.1}
{"i": ["cuda", "conv2d_no_batching", [1, 28, 28, 128, 256, 3, 3, [2, 2], [1, 1]], {}, ["conv2d_no_batching", 1, 28, 28, 128, 256, 3, 3, [2, 2], [1, 1]], {"i": 62285289, "t": "", "c": null, "e": [["tile_f", "sp", [32, 2, 2, 1]], ["tile_y", "sp", [7, 1, 2, 1]], ["tile_x", "sp", [1, 1, 14, 1]], ["tile_rc", "sp", [64, 4, 1]], ["tile_ry", "sp", [3, 1, 1]], ["tile_rx", "sp", [3, 1, 1]], ["auto_unroll_max_step", "ot", 1500], ["unroll_explicit", "ot", 1]]}], "r": [[0.00029956877734375], 0, 2.4586265087127686, 1544100959.4101255], "v": 0.1}
{"i": ["cuda", "conv2d_no_batching", [1, 28, 28, 128, 256, 3, 3, [2, 2], [1, 1]], {}, ["conv2d_no_batching", 1, 28, 28, 128, 256, 3, 3, [2, 2], [1, 1]], {"i": 62284929, "t": "", "c": null, "e": [["tile_f", "sp", [32, 2, 2, 1]], ["tile_y", "sp", [7, 2, 1, 1]], ["tile_x", "sp", [1, 1, 14, 1]], ["tile_rc", "sp", [64, 4, 1]], ["tile_ry", "sp", [3, 1, 1]], ["tile_rx", "sp", [3, 1, 1]], ["auto_unroll_max_step", "ot", 1500], ["unroll_explicit", "ot", 1]]}], "r": [[0.0004675843828125], 0, 3.3415777683258057, 1544100961.3659549], "v": 0.1}
{"i": ["cuda", "conv2d_no_batching", [1, 28, 28, 128, 256, 3, 3, [2, 2], [1, 1]], {}, ["conv2d_no_batching", 1, 28, 28, 128, 256, 3, 3, [2, 2], [1, 1]], {"i": 67814889, "t": "", "c": null, "e": [["tile_f", "sp", [32, 2, 2, 1]], ["tile_y", "sp", [7, 1, 2, 1]], ["tile_x", "sp", [1, 1, 14, 1]], ["tile_rc", "sp", [64, 4, 1]], ["tile_ry", "sp", [1, 3, 1]], ["tile_rx", "sp", [1, 3, 1]], ["auto_unroll_max_step", "ot", 1500], ["unroll_explicit", "ot", 1]]}], "r": [[0.00014843135807291667], 0, 1.5638375282287598, 1544100962.4865751], "v": 0.1}
{"i": ["cuda", "conv2d_no_batching", [1, 28, 28, 128, 256, 3, 3, [2, 2], [1, 1]], {}, ["conv2d_no_batching", 1, 28, 28, 128, 256, 3, 3, [2, 2], [1, 1]], {"i": 62272329, "t": "", "c": null, "e": [["tile_f", "sp", [32, 2, 2, 1]], ["tile_y", "sp", [1, 1, 14, 1]], ["tile_x", "sp", [7, 2, 1, 1]], ["tile_rc", "sp", [64, 4, 1]], ["tile_ry", "sp", [3, 1, 1]], ["tile_rx", "sp", [3, 1, 1]], ["auto_unroll_max_step", "ot", 1500], ["unroll_explicit", "ot", 1]]}], "r": [[0.00041818093880208337], 0, 2.6662485599517822, 1544100964.2613418], "v": 0.1}
{"i": ["cuda", "conv2d_no_batching", [1, 28, 28, 128, 256, 3, 3, [2, 2], [1, 1]], {}, ["conv2d_no_batching", 1, 28, 28, 128, 256, 3, 3, [2, 2], [1, 1]], {"i": 63654729, "t": "", "c": null, "e": [["tile_f", "sp", [32, 2, 2, 1]], ["tile_y", "sp", [1, 1, 14, 1]], ["tile_x", "sp", [7, 2, 1, 1]], ["tile_rc", "sp", [64, 4, 1]], ["tile_ry", "sp", [1, 3, 1]], ["tile_rx", "sp", [3, 1, 1]], ["auto_unroll_max_step", "ot", 1500], ["unroll_explicit", "ot", 1]]}], "r": [[0.00024302373828125], 0, 2.048823356628418, 1544100965.6054933], "v": 0.1}
{"i": ["cuda", "conv2d_no_batching", [1, 28, 28, 128, 256, 3, 3, [2, 2], [1, 1]], {}, ["conv2d_no_batching", 1, 28, 28, 128, 256, 3, 3, [2, 2], [1, 1]], {"i": 63667689, "t": "", "c": null, "e": [["tile_f", "sp", [32, 2, 2, 1]], ["tile_y", "sp", [7, 1, 2, 1]], ["tile_x", "sp", [1, 1, 14, 1]], ["tile_rc", "sp", [64, 4, 1]], ["tile_ry", "sp", [1, 3, 1]], ["tile_rx", "sp", [3, 1, 1]], ["auto_unroll_max_step", "ot", 1500], ["unroll_explicit", "ot", 1]]}], "r": [[0.000205048390625], 0, 1.7925574779510498, 1544100966.8607886], "v": 0.1}
{"i": ["cuda", "conv2d_no_batching", [1, 28, 28, 128, 256, 3, 3, [2, 2], [1, 1]], {}, ["conv2d_no_batching", 1, 28, 28, 128, 256, 3, 3, [2, 2], [1, 1]], {"i": 62957049, "t": "", "c": null, "e": [["tile_f", "sp", [32, 2, 2, 1]], ["tile_y", "sp", [2, 7, 1, 1]], ["tile_x", "sp", [2, 1, 7, 1]], ["tile_rc", "sp", [32, 1, 8]], ["tile_ry", "sp", [3, 1, 1]], ["tile_rx", "sp", [3, 1, 1]], ["auto_unroll_max_step", "ot", 1500], ["unroll_explicit", "ot", 1]]}], "r": [[0.006042253381510417], 0, 19.439631462097168, 1544101014.1168516], "v": 0.1}
{"i": ["cuda", "conv2d_no_batching", [1, 28, 28, 128, 256, 3, 3, [2, 2], [1, 1]], {}, ["conv2d_no_batching", 1, 28, 28, 128, 256, 3, 3, [2, 2], [1, 1]], {"i": 67104249, "t": "", "c": null, "e": [["tile_f", "sp", [32, 2, 2, 1]], ["tile_y", "sp", [2, 7, 1, 1]], ["tile_x", "sp", [2, 1, 7, 1]], ["tile_rc", "sp", [32, 1, 8]], ["tile_ry", "sp", [3, 1, 1]], ["tile_rx", "sp", [1, 3, 1]], ["auto_unroll_max_step", "ot", 1500], ["unroll_explicit", "ot", 1]]}], "r": [[0.006107379173177083], 0, 18.187005519866943, 1544101030.9611533], "v": 0.1}
{"i": ["cuda", "conv2d_no_batching", [1, 28, 28, 128, 256, 3, 3, [2, 2], [1, 1]], {}, ["conv2d_no_batching", 1, 28, 28, 128, 256, 3, 3, [2, 2], [1, 1]], {"i": 68486649, "t": "", "c": null, "e": [["tile_f", "sp", [32, 2, 2, 1]], ["tile_y", "sp", [2, 7, 1, 1]], ["tile_x", "sp", [2, 1, 7, 1]], ["tile_rc", "sp", [32, 1, 8]], ["tile_ry", "sp", [1, 3, 1]], ["tile_rx", "sp", [1, 3, 1]], ["auto_unroll_max_step", "ot", 1500], ["unroll_explicit", "ot", 1]]}], "r": [[0.0014595504661458333], 0, 6.498013257980347, 1544101036.15343], "v": 0.1}
{"i": ["cuda", "conv2d_no_batching", [1, 28, 28, 128, 256, 3, 3, [2, 2], [1, 1]], {}, ["conv2d_no_batching", 1, 28, 28, 128, 256, 3, 3, [2, 2], [1, 1]], {"i": 64339449, "t": "", "c": null, "e": [["tile_f", "sp", [32, 2, 2, 1]], ["tile_y", "sp", [2, 7, 1, 1]], ["tile_x", "sp", [2, 1, 7, 1]], ["tile_rc", "sp", [32, 1, 8]], ["tile_ry", "sp", [1, 3, 1]], ["tile_rx", "sp", [3, 1, 1]], ["auto_unroll_max_step", "ot", 1500], ["unroll_explicit", "ot", 1]]}], "r": [[0.0027842531744791663], 0, 10.363272428512573, 1544101045.2125044], "v": 0.1}
{"i": ["cuda", "conv2d_no_batching", [1, 28, 28, 128, 256, 3, 3, [2, 2], [1, 1]], {}, ["conv2d_no_batching", 1, 28, 28, 128, 256, 3, 3, [2, 2], [1, 1]], {"i": 62521117, "t": "", "c": null, "e": [["tile_f", "sp", [32, 2, 1, 2]], ["tile_y", "sp", [7, 2, 1, 1]], ["tile_x", "sp", [1, 14, 1, 1]], ["tile_rc", "sp", [64, 2, 2]], ["tile_ry", "sp", [3, 1, 1]], ["tile_rx", "sp", [3, 1, 1]], ["auto_unroll_max_step", "ot", 1500], ["unroll_explicit", "ot", 1]]}], "r": [[0.002749061528645833], 0, 8.961174011230469, 1544101052.6094613], "v": 0.1}
{"i": ["cuda", "conv2d_no_batching", [1, 28, 28, 128, 256, 3, 3, [2, 2], [1, 1]], {}, ["conv2d_no_batching", 1, 28, 28, 128, 256, 3, 3, [2, 2], [1, 1]], {"i": 66668317, "t": "", "c": null, "e": [["tile_f", "sp", [32, 2, 1, 2]], ["tile_y", "sp", [7, 2, 1, 1]], ["tile_x", "sp", [1, 14, 1, 1]], ["tile_rc", "sp", [64, 2, 2]], ["tile_ry", "sp", [3, 1, 1]], ["tile_rx", "sp", [1, 3, 1]], ["auto_unroll_max_step", "ot", 1500], ["unroll_explicit", "ot", 1]]}], "r": [[0.0029473639804687497], 0, 10.625012874603271, 1544101060.8420684], "v": 0.1}
{"i": ["cuda", "conv2d_no_batching", [1, 28, 28, 128, 256, 3, 3, [2, 2], [1, 1]], {}, ["conv2d_no_batching", 1, 28, 28, 128, 256, 3, 3, [2, 2], [1, 1]], {"i": 63903517, "t": "", "c": null, "e": [["tile_f", "sp", [32, 2, 1, 2]], ["tile_y", "sp", [7, 2, 1, 1]], ["tile_x", "sp", [1, 14, 1, 1]], ["tile_rc", "sp", [64, 2, 2]], ["tile_ry", "sp", [1, 3, 1]], ["tile_rx", "sp", [3, 1, 1]], ["auto_unroll_max_step", "ot", 1500], ["unroll_explicit", "ot", 1]]}], "r": [[0.0012534373033854167], 0, 5.784245491027832, 1544101064.8657613], "v": 0.1}
{"i": ["cuda", "conv2d_no_batching", [1, 28, 28, 128, 256, 3, 3, [2, 2], [1, 1]], {}, ["conv2d_no_batching", 1, 28, 28, 128, 256, 3, 3, [2, 2], [1, 1]], {"i": 49830729, "t": "", "c": null, "e": [["tile_f", "sp", [32, 2, 2, 1]], ["tile_y", "sp", [1, 1, 14, 1]], ["tile_x", "sp", [7, 2, 1, 1]], ["tile_rc", "sp", [64, 4, 1]], ["tile_ry", "sp", [3, 1, 1]], ["tile_rx", "sp", [3, 1, 1]], ["auto_unroll_max_step", "ot", 512], ["unroll_explicit", "ot", 1]]}], "r": [[0.0004189221067708333], 0, 2.537095069885254, 1544101066.5327737], "v": 0.1}
{"i": ["cuda", "conv2d_no_batching", [1, 28, 28, 128, 256, 3, 3, [2, 2], [1, 1]], {}, ["conv2d_no_batching", 1, 28, 28, 128, 256, 3, 3, [2, 2], [1, 1]], {"i": 49843329, "t": "", "c": null, "e": [["tile_f", "sp", [32, 2, 2, 1]], ["tile_y", "sp", [7, 2, 1, 1]], ["tile_x", "sp", [1, 1, 14, 1]], ["tile_rc", "sp", [64, 4, 1]], ["tile_ry", "sp", [3, 1, 1]], ["tile_rx", "sp", [3, 1, 1]], ["auto_unroll_max_step", "ot", 512], ["unroll_explicit", "ot", 1]]}], "r": [[0.00046874504166666666], 0, 3.0106863975524902, 1544101068.3759828], "v": 0.1}
{"i": ["cuda", "conv2d_no_batching", [1, 28, 28, 128, 256, 3, 3, [2, 2], [1, 1]], {}, ["conv2d_no_batching", 1, 28, 28, 128, 256, 3, 3, [2, 2], [1, 1]], {"i": 53990889, "t": "", "c": null, "e": [["tile_f", "sp", [32, 2, 2, 1]], ["tile_y", "sp", [7, 1, 2, 1]], ["tile_x", "sp", [1, 1, 14, 1]], ["tile_rc", "sp", [64, 4, 1]], ["tile_ry", "sp", [3, 1, 1]], ["tile_rx", "sp", [1, 3, 1]], ["auto_unroll_max_step", "ot", 512], ["unroll_explicit", "ot", 1]]}], "r": [[0.00016397882421874998], 0, 1.626826286315918, 1544101069.4453902], "v": 0.1}
{"i": ["cuda", "conv2d_no_batching", [1, 28, 28, 128, 256, 3, 3, [2, 2], [1, 1]], {}, ["conv2d_no_batching", 1, 28, 28, 128, 256, 3, 3, [2, 2], [1, 1]], {"i": 53990529, "t": "", "c": null, "e": [["tile_f", "sp", [32, 2, 2, 1]], ["tile_y", "sp", [7, 2, 1, 1]], ["tile_x", "sp", [1, 1, 14, 1]], ["tile_rc", "sp", [64, 4, 1]], ["tile_ry", "sp", [3, 1, 1]], ["tile_rx", "sp", [1, 3, 1]], ["auto_unroll_max_step", "ot", 512], ["unroll_explicit", "ot", 1]]}], "r": [[0.0002901092408854167], 0, 1.9926395416259766, 1544101070.873491], "v": 0.1}
{"i": ["cuda", "conv2d_no_batching", [1, 28, 28, 128, 256, 3, 3, [2, 2], [1, 1]], {}, ["conv2d_no_batching", 1, 28, 28, 128, 256, 3, 3, [2, 2], [1, 1]], {"i": 51226089, "t": "", "c": null, "e": [["tile_f", "sp", [32, 2, 2, 1]], ["tile_y", "sp", [7, 1, 2, 1]], ["tile_x", "sp", [1, 1, 14, 1]], ["tile_rc", "sp", [64, 4, 1]], ["tile_ry", "sp", [1, 3, 1]], ["tile_rx", "sp", [3, 1, 1]], ["auto_unroll_max_step", "ot", 512], ["unroll_explicit", "ot", 1]]}], "r": [[0.00020561164843749998], 0, 1.710205078125, 1544101072.0456452], "v": 0.1}
{"i": ["cuda", "conv2d_no_batching", [1, 28, 28, 128, 256, 3, 3, [2, 2], [1, 1]], {}, ["conv2d_no_batching", 1, 28, 28, 128, 256, 3, 3, [2, 2], [1, 1]], {"i": 51213129, "t": "", "c": null, "e": [["tile_f", "sp", [32, 2, 2, 1]], ["tile_y", "sp", [1, 1, 14, 1]], ["tile_x", "sp", [7, 2, 1, 1]], ["tile_rc", "sp", [64, 4, 1]], ["tile_ry", "sp", [1, 3, 1]], ["tile_rx", "sp", [3, 1, 1]], ["auto_unroll_max_step", "ot", 512], ["unroll_explicit", "ot", 1]]}], "r": [[0.00024355116536458333], 0, 2.0560410022735596, 1544101073.329347], "v": 0.1}
{"i": ["cuda", "conv2d_no_batching", [1, 28, 28, 128, 256, 3, 3, [2, 2], [1, 1]], {}, ["conv2d_no_batching", 1, 28, 28, 128, 256, 3, 3, [2, 2], [1, 1]], {"i": 49843689, "t": "", "c": null, "e": [["tile_f", "sp", [32, 2, 2, 1]], ["tile_y", "sp", [7, 1, 2, 1]], ["tile_x", "sp", [1, 1, 14, 1]], ["tile_rc", "sp", [64, 4, 1]], ["tile_ry", "sp", [3, 1, 1]], ["tile_rx", "sp", [3, 1, 1]], ["auto_unroll_max_step", "ot", 512], ["unroll_explicit", "ot", 1]]}], "r": [[0.00029979021484375], 0, 2.2034871578216553, 1544101074.7230904], "v": 0.1}
{"i": ["cuda", "conv2d_no_batching", [1, 28, 28, 128, 256, 3, 3, [2, 2], [1, 1]], {}, ["conv2d_no_batching", 1, 28, 28, 128, 256, 3, 3, [2, 2], [1, 1]], {"i": 55373289, "t": "", "c": null, "e": [["tile_f", "sp", [32, 2, 2, 1]], ["tile_y", "sp", [7, 1, 2, 1]], ["tile_x", "sp", [1, 1, 14, 1]], ["tile_rc", "sp", [64, 4, 1]], ["tile_ry", "sp", [1, 3, 1]], ["tile_rx", "sp", [1, 3, 1]], ["auto_unroll_max_step", "ot", 512], ["unroll_explicit", "ot", 1]]}], "r": [[0.000148644796875], 0, 1.4580144882202148, 1544101075.783019], "v": 0.1}
{"i": ["cuda", "conv2d_no_batching", [1, 28, 28, 128, 256, 3, 3, [2, 2], [1, 1]], {}, ["conv2d_no_batching", 1, 28, 28, 128, 256, 3, 3, [2, 2], [1, 1]], {"i": 55372929, "t": "", "c": null, "e": [["tile_f", "sp", [32, 2, 2, 1]], ["tile_y", "sp", [7, 2, 1, 1]], ["tile_x", "sp", [1, 1, 14, 1]], ["tile_rc", "sp", [64, 4, 1]], ["tile_ry", "sp", [1, 3, 1]], ["tile_rx", "sp", [1, 3, 1]], ["auto_unroll_max_step", "ot", 512], ["unroll_explicit", "ot", 1]]}], "r": [[0.00013883330859375002], 0, 1.7162909507751465, 1544101076.8697996], "v": 0.1}
{"i": ["cuda", "conv2d_no_batching", [1, 28, 28, 128, 256, 3, 3, [2, 2], [1, 1]], {}, ["conv2d_no_batching", 1, 28, 28, 128, 256, 3, 3, [2, 2], [1, 1]], {"i": 51225729, "t": "", "c": null, "e": [["tile_f", "sp", [32, 2, 2, 1]], ["tile_y", "sp", [7, 2, 1, 1]], ["tile_x", "sp", [1, 1, 14, 1]], ["tile_rc", "sp", [64, 4, 1]], ["tile_ry", "sp", [1, 3, 1]], ["tile_rx", "sp", [3, 1, 1]], ["auto_unroll_max_step", "ot", 512], ["unroll_explicit", "ot", 1]]}], "r": [[0.00023828585156249999], 0, 1.8857722282409668, 1544101078.1622314], "v": 0.1}
{"i": ["cuda", "conv2d_no_batching", [1, 28, 28, 128, 256, 3, 3, [2, 2], [1, 1]], {}, ["conv2d_no_batching", 1, 28, 28, 128, 256, 3, 3, [2, 2], [1, 1]], {"i": 55360329, "t": "", "c": null, "e": [["tile_f", "sp", [32, 2, 2, 1]], ["tile_y", "sp", [1, 1, 14, 1]], ["tile_x", "sp", [7, 2, 1, 1]], ["tile_rc", "sp", [64, 4, 1]], ["tile_ry", "sp", [1, 3, 1]], ["tile_rx", "sp", [1, 3, 1]], ["auto_unroll_max_step", "ot", 512], ["unroll_explicit", "ot", 1]]}], "r": [[0.00013736810677083332], 0, 1.606388807296753, 1544101079.203834], "v": 0.1}
{"i": ["cuda", "conv2d_no_batching", [1, 28, 28, 128, 256, 3, 3, [2, 2], [1, 1]], {}, ["conv2d_no_batching", 1, 28, 28, 128, 256, 3, 3, [2, 2], [1, 1]], {"i": 43595769, "t": "", "c": null, "e": [["tile_f", "sp", [32, 2, 2, 1]], ["tile_y", "sp", [2, 7, 1, 1]], ["tile_x", "sp", [2, 7, 1, 1]], ["tile_rc", "sp", [32, 1, 8]], ["tile_ry", "sp", [1, 3, 1]], ["tile_rx", "sp", [1, 3, 1]], ["auto_unroll_max_step", "ot", 0], ["unroll_explicit", "ot", 1]]}], "r": [[0.012643473359374999], 0, 30.595637559890747, 1544101171.965273], "v": 0.1}
{"i": ["cuda", "conv2d_no_batching", [1, 28, 28, 128, 256, 3, 3, [2, 2], [1, 1]], {}, ["conv2d_no_batching", 1, 28, 28, 128, 256, 3, 3, [2, 2], [1, 1]], {"i": 26342535, "t": "", "c": null, "e": [["tile_f", "sp", [32, 1, 4, 1]], ["tile_y", "sp", [7, 2, 1, 1]], ["tile_x", "sp", [1, 1, 14, 1]], ["tile_rc", "sp", [64, 4, 1]], ["tile_ry", "sp", [1, 3, 1]], ["tile_rx", "sp", [3, 1, 1]], ["auto_unroll_max_step", "ot", 1500], ["unroll_explicit", "ot", 0]]}], "r": [[0.00025956511067708334], 0, 1.6800117492675781, 1544101230.0413008], "v": 0.1}
{"i": ["cuda", "conv2d_no_batching", [1, 28, 28, 128, 256, 3, 3, [2, 2], [1, 1]], {}, ["conv2d_no_batching", 1, 28, 28, 128, 256, 3, 3, [2, 2], [1, 1]], {"i": 26329935, "t": "", "c": null, "e": [["tile_f", "sp", [32, 1, 4, 1]], ["tile_y", "sp", [1, 1, 14, 1]], ["tile_x", "sp", [7, 2, 1, 1]], ["tile_rc", "sp", [64, 4, 1]], ["tile_ry", "sp", [1, 3, 1]], ["tile_rx", "sp", [3, 1, 1]], ["auto_unroll_max_step", "ot", 1500], ["unroll_explicit", "ot", 0]]}], "r": [[0.00032027454296875], 0, 1.7927923202514648, 1544101231.5484645], "v": 0.1}
{"i": ["cuda", "conv2d_no_batching", [1, 28, 28, 128, 256, 3, 3, [2, 2], [1, 1]], {}, ["conv2d_no_batching", 1, 28, 28, 128, 256, 3, 3, [2, 2], [1, 1]], {"i": 30489735, "t": "", "c": null, "e": [["tile_f", "sp", [32, 1, 4, 1]], ["tile_y", "sp", [7, 2, 1, 1]], ["tile_x", "sp", [1, 1, 14, 1]], ["tile_rc", "sp", [64, 4, 1]], ["tile_ry", "sp", [1, 3, 1]], ["tile_rx", "sp", [1, 3, 1]], ["auto_unroll_max_step", "ot", 1500], ["unroll_explicit", "ot", 0]]}], "r": [[0.00014884923046875], 0, 1.456171989440918, 1544101232.69558], "v": 0.1}
{"i": ["cuda", "conv2d_no_batching", [1, 28, 28, 128, 256, 3, 3, [2, 2], [1, 1]], {}, ["conv2d_no_batching", 1, 28, 28, 128, 256, 3, 3, [2, 2], [1, 1]], {"i": 29107335, "t": "", "c": null, "e": [["tile_f", "sp", [32, 1, 4, 1]], ["tile_y", "sp", [7, 2, 1, 1]], ["tile_x", "sp", [1, 1, 14, 1]], ["tile_rc", "sp", [64, 4, 1]], ["tile_ry", "sp", [3, 1, 1]], ["tile_rx", "sp", [1, 3, 1]], ["auto_unroll_max_step", "ot", 1500], ["unroll_explicit", "ot", 0]]}], "r": [[0.00033315624609375], 0, 1.931741714477539, 1544101234.316886], "v": 0.1}
{"i": ["cuda", "conv2d_no_batching", [1, 28, 28, 128, 256, 3, 3, [2, 2], [1, 1]], {}, ["conv2d_no_batching", 1, 28, 28, 128, 256, 3, 3, [2, 2], [1, 1]], {"i": 24960135, "t": "", "c": null, "e": [["tile_f", "sp", [32, 1, 4, 1]], ["tile_y", "sp", [7, 2, 1, 1]], ["tile_x", "sp", [1, 1, 14, 1]], ["tile_rc", "sp", [64, 4, 1]], ["tile_ry", "sp", [3, 1, 1]], ["tile_rx", "sp", [3, 1, 1]], ["auto_unroll_max_step", "ot", 1500], ["unroll_explicit", "ot", 0]]}], "r": [[0.00051110103515625], 0, 2.273391008377075, 1544101236.3003907], "v": 0.1}
{"i": ["cuda", "conv2d_no_batching", [1, 28, 28, 128, 256, 3, 3, [2, 2], [1, 1]], {}, ["conv2d_no_batching", 1, 28, 28, 128, 256, 3, 3, [2, 2], [1, 1]], {"i": 24947535, "t": "", "c": null, "e": [["tile_f", "sp", [32, 1, 4, 1]], ["tile_y", "sp", [1, 1, 14, 1]], ["tile_x", "sp", [7, 2, 1, 1]], ["tile_rc", "sp", [64, 4, 1]], ["tile_ry", "sp", [3, 1, 1]], ["tile_rx", "sp", [3, 1, 1]], ["auto_unroll_max_step", "ot", 1500], ["unroll_explicit", "ot", 0]]}], "r": [[0.0005769095794270834], 0, 2.499528646469116, 1544101238.4866025], "v": 0.1}
{"i": ["cuda", "conv2d_no_batching", [1, 28, 28, 128, 256, 3, 3, [2, 2], [1, 1]], {}, ["conv2d_no_batching", 1, 28, 28, 128, 256, 3, 3, [2, 2], [1, 1]], {"i": 29094735, "t": "", "c": null, "e": [["tile_f", "sp", [32, 1, 4, 1]], ["tile_y", "sp", [1, 1, 14, 1]], ["tile_x", "sp", [7, 2, 1, 1]], ["tile_rc", "sp", [64, 4, 1]], ["tile_ry", "sp", [3, 1, 1]], ["tile_rx", "sp", [1, 3, 1]], ["auto_unroll_max_step", "ot", 1500], ["unroll_explicit", "ot", 0]]}], "r": [[0.0003069539583333333], 0, 1.7727816104888916, 1544101240.0120957], "v": 0.1}
{"i": ["cuda", "conv2d_no_batching", [1, 28, 28, 128, 256, 3, 3, [2, 2], [1, 1]], {}, ["conv2d_no_batching", 1, 28, 28, 128, 256, 3, 3, [2, 2], [1, 1]], {"i": 30477135, "t": "", "c": null, "e": [["tile_f", "sp", [32, 1, 4, 1]], ["tile_y", "sp", [1, 1, 14, 1]], ["tile_x", "sp", [7, 2, 1, 1]], ["tile_rc", "sp", [64, 4, 1]], ["tile_ry", "sp", [1, 3, 1]], ["tile_rx", "sp", [1, 3, 1]], ["auto_unroll_max_step", "ot", 1500], ["unroll_explicit", "ot", 0]]}], "r": [[0.00019297958854166668], 0, 1.5418791770935059, 1544101241.2776408], "v": 0.1}
{"i": ["cuda", "conv2d_no_batching", [1, 28, 28, 128, 256, 3, 3, [2, 2], [1, 1]], {}, ["conv2d_no_batching", 1, 28, 28, 128, 256, 3, 3, [2, 2], [1, 1]], {"i": 30459015, "t": "", "c": null, "e": [["tile_f", "sp", [32, 1, 4, 1]], ["tile_y", "sp", [7, 2, 1, 1]], ["tile_x", "sp", [1, 1, 14, 1]], ["tile_rc", "sp", [128, 2, 1]], ["tile_ry", "sp", [1, 3, 1]], ["tile_rx", "sp", [1, 3, 1]], ["auto_unroll_max_step", "ot", 1500], ["unroll_explicit", "ot", 0]]}], "r": [[0.00015830613802083333], 0, 1.397670030593872, 1544101242.4133658], "v": 0.1}
{"i": ["cuda", "conv2d_no_batching", [1, 28, 28, 128, 256, 3, 3, [2, 2], [1, 1]], {}, ["conv2d_no_batching", 1, 28, 28, 128, 256, 3, 3, [2, 2], [1, 1]], {"i": 24947529, "t": "", "c": null, "e": [["tile_f", "sp", [32, 2, 2, 1]], ["tile_y", "sp", [1, 1, 14, 1]], ["tile_x", "sp", [7, 2, 1, 1]], ["tile_rc", "sp", [64, 4, 1]], ["tile_ry", "sp", [3, 1, 1]], ["tile_rx", "sp", [3, 1, 1]], ["auto_unroll_max_step", "ot", 1500], ["unroll_explicit", "ot", 0]]}], "r": [[0.00082730316015625], 0, 3.470431327819824, 1544101245.3435812], "v": 0.1}
{"i": ["cuda", "conv2d_no_batching", [1, 28, 28, 128, 256, 3, 3, [2, 2], [1, 1]], {}, ["conv2d_no_batching", 1, 28, 28, 128, 256, 3, 3, [2, 2], [1, 1]], {"i": 24960129, "t": "", "c": null, "e": [["tile_f", "sp", [32, 2, 2, 1]], ["tile_y", "sp", [7, 2, 1, 1]], ["tile_x", "sp", [1, 1, 14, 1]], ["tile_rc", "sp", [64, 4, 1]], ["tile_ry", "sp", [3, 1, 1]], ["tile_rx", "sp", [3, 1, 1]], ["auto_unroll_max_step", "ot", 1500], ["unroll_explicit", "ot", 0]]}], "r": [[0.0010682595338541666], 0, 4.491827011108398, 1544101248.8599143], "v": 0.1}
{"i": ["cuda", "conv2d_no_batching", [1, 28, 28, 128, 256, 3, 3, [2, 2], [1, 1]], {}, ["conv2d_no_batching", 1, 28, 28, 128, 256, 3, 3, [2, 2], [1, 1]], {"i": 30490089, "t": "", "c": null, "e": [["tile_f", "sp", [32, 2, 2, 1]], ["tile_y", "sp", [7, 1, 2, 1]], ["tile_x", "sp", [1, 1, 14, 1]], ["tile_rc", "sp", [64, 4, 1]], ["tile_ry", "sp", [1, 3, 1]], ["tile_rx", "sp", [1, 3, 1]], ["auto_unroll_max_step", "ot", 1500], ["unroll_explicit", "ot", 0]]}], "r": [[0.00016183457682291668], 0, 1.5339984893798828, 1544101250.0511148], "v": 0.1}
{"i": ["cuda", "conv2d_no_batching", [1, 28, 28, 128, 256, 3, 3, [2, 2], [1, 1]], {}, ["conv2d_no_batching", 1, 28, 28, 128, 256, 3, 3, [2, 2], [1, 1]], {"i": 30477129, "t": "", "c": null, "e": [["tile_f", "sp", [32, 2, 2, 1]], ["tile_y", "sp", [1, 1, 14, 1]], ["tile_x", "sp", [7, 2, 1, 1]], ["tile_rc", "sp", [64, 4, 1]], ["tile_ry", "sp", [1, 3, 1]], ["tile_rx", "sp", [1, 3, 1]], ["auto_unroll_max_step", "ot", 1500], ["unroll_explicit", "ot", 0]]}], "r": [[0.0003721627317708333], 0, 2.148273468017578, 1544101251.8879168], "v": 0.1}
{"i": ["cuda", "conv2d_no_batching", [1, 28, 28, 128, 256, 3, 3, [2, 2], [1, 1]], {}, ["conv2d_no_batching", 1, 28, 28, 128, 256, 3, 3, [2, 2], [1, 1]], {"i": 26342529, "t": "", "c": null, "e": [["tile_f", "sp", [32, 2, 2, 1]], ["tile_y", "sp", [7, 2, 1, 1]], ["tile_x", "sp", [1, 1, 14, 1]], ["tile_rc", "sp", [64, 4, 1]], ["tile_ry", "sp", [1, 3, 1]], ["tile_rx", "sp", [3, 1, 1]], ["auto_unroll_max_step", "ot", 1500], ["unroll_explicit", "ot", 0]]}], "r": [[0.0004766841783854167], 0, 2.3653042316436768, 1544101253.9038136], "v": 0.1}
{"i": ["cuda", "conv2d_no_batching", [1, 28, 28, 128, 256, 3, 3, [2, 2], [1, 1]], {}, ["conv2d_no_batching", 1, 28, 28, 128, 256, 3, 3, [2, 2], [1, 1]], {"i": 26342889, "t": "", "c": null, "e": [["tile_f", "sp", [32, 2, 2, 1]], ["tile_y", "sp", [7, 1, 2, 1]], ["tile_x", "sp", [1, 1, 14, 1]], ["tile_rc", "sp", [64, 4, 1]], ["tile_ry", "sp", [1, 3, 1]], ["tile_rx", "sp", [3, 1, 1]], ["auto_unroll_max_step", "ot", 1500], ["unroll_explicit", "ot", 0]]}], "r": [[0.0002516885833333333], 0, 1.7493183612823486, 1544101255.2954106], "v": 0.1}
{"i": ["cuda", "conv2d_no_batching", [1, 28, 28, 128, 256, 3, 3, [2, 2], [1, 1]], {}, ["conv2d_no_batching", 1, 28, 28, 128, 256, 3, 3, [2, 2], [1, 1]], {"i": 26329929, "t": "", "c": null, "e": [["tile_f", "sp", [32, 2, 2, 1]], ["tile_y", "sp", [1, 1, 14, 1]], ["tile_x", "sp", [7, 2, 1, 1]], ["tile_rc", "sp", [64, 4, 1]], ["tile_ry", "sp", [1, 3, 1]], ["tile_rx", "sp", [3, 1, 1]], ["auto_unroll_max_step", "ot", 1500], ["unroll_explicit", "ot", 0]]}], "r": [[0.0005087128723958333], 0, 2.6183009147644043, 1544101257.3794186], "v": 0.1}
{"i": ["cuda", "conv2d_no_batching", [1, 28, 28, 128, 256, 3, 3, [2, 2], [1, 1]], {}, ["conv2d_no_batching", 1, 28, 28, 128, 256, 3, 3, [2, 2], [1, 1]], {"i": 29107689, "t": "", "c": null, "e": [["tile_f", "sp", [32, 2, 2, 1]], ["tile_y", "sp", [7, 1, 2, 1]], ["tile_x", "sp", [1, 1, 14, 1]], ["tile_rc", "sp", [64, 4, 1]], ["tile_ry", "sp", [3, 1, 1]], ["tile_rx", "sp", [1, 3, 1]], ["auto_unroll_max_step", "ot", 1500], ["unroll_explicit", "ot", 0]]}], "r": [[0.00035293406250000003], 0, 2.0482914447784424, 1544101259.0128958], "v": 0.1}
{"i": ["cuda", "conv2d_no_batching", [1, 28, 28, 128, 256, 3, 3, [2, 2], [1, 1]], {}, ["conv2d_no_batching", 1, 28, 28, 128, 256, 3, 3, [2, 2], [1, 1]], {"i": 24960489, "t": "", "c": null, "e": [["tile_f", "sp", [32, 2, 2, 1]], ["tile_y", "sp", [7, 1, 2, 1]], ["tile_x", "sp", [1, 1, 14, 1]], ["tile_rc", "sp", [64, 4, 1]], ["tile_ry", "sp", [3, 1, 1]], ["tile_rx", "sp", [3, 1, 1]], ["auto_unroll_max_step", "ot", 1500], ["unroll_explicit", "ot", 0]]}], "r": [[0.0005356384830729167], 0, 2.4162230491638184, 1544101261.1057358], "v": 0.1}
{"i": ["cuda", "conv2d_no_batching", [1, 28, 28, 128, 256, 3, 3, [2, 2], [1, 1]], {}, ["conv2d_no_batching", 1, 28, 28, 128, 256, 3, 3, [2, 2], [1, 1]], {"i": 30489729, "t": "", "c": null, "e": [["tile_f", "sp", [32, 2, 2, 1]], ["tile_y", "sp", [7, 2, 1, 1]], ["tile_x", "sp", [1, 1, 14, 1]], ["tile_rc", "sp", [64, 4, 1]], ["tile_ry", "sp", [1, 3, 1]], ["tile_rx", "sp", [1, 3, 1]], ["auto_unroll_max_step", "ot", 1500], ["unroll_explicit", "ot", 0]]}], "r": [[0.0003292216432291667], 0, 2.0139214992523193, 1544101262.7994897], "v": 0.1}
{"i": ["cuda", "conv2d_no_batching", [1, 28, 28, 128, 256, 3, 3, [2, 2], [1, 1]], {}, ["conv2d_no_batching", 1, 28, 28, 128, 256, 3, 3, [2, 2], [1, 1]], {"i": 29107329, "t": "", "c": null, "e": [["tile_f", "sp", [32, 2, 2, 1]], ["tile_y", "sp", [7, 2, 1, 1]], ["tile_x", "sp", [1, 1, 14, 1]], ["tile_rc", "sp", [64, 4, 1]], ["tile_ry", "sp", [3, 1, 1]], ["tile_rx", "sp", [1, 3, 1]], ["auto_unroll_max_step", "ot", 1500], ["unroll_explicit", "ot", 0]]}], "r": [[0.0006699278984375], 0, 3.002291440963745, 1544101265.3824222], "v": 0.1}
{"i": ["cuda", "conv2d_no_batching", [1, 28, 28, 128, 256, 3, 3, [2, 2], [1, 1]], {}, ["conv2d_no_batching", 1, 28, 28, 128, 256, 3, 3, [2, 2], [1, 1]], {"i": 29094729, "t": "", "c": null, "e": [["tile_f", "sp", [32, 2, 2, 1]], ["tile_y", "sp", [1, 1, 14, 1]], ["tile_x", "sp", [7, 2, 1, 1]], ["tile_rc", "sp", [64, 4, 1]], ["tile_ry", "sp", [3, 1, 1]], ["tile_rx", "sp", [1, 3, 1]], ["auto_unroll_max_step", "ot", 1500], ["unroll_explicit", "ot", 0]]}], "r": [[0.0004973036901041667], 0, 2.534067153930664, 1544101267.4262476], "v": 0.1}
{"i": ["cuda", "conv2d_no_batching", [1, 28, 28, 128, 256, 3, 3, [2, 2], [1, 1]], {}, ["conv2d_no_batching", 1, 28, 28, 128, 256, 3, 3, [2, 2], [1, 1]], {"i": 66432138, "t": "", "c": null, "e": [["tile_f", "sp", [4, 8, 4, 1]], ["tile_y", "sp", [7, 2, 1, 1]], ["tile_x", "sp", [1, 1, 14, 1]], ["tile_rc", "sp", [64, 4, 1]], ["tile_ry", "sp", [3, 1, 1]], ["tile_rx", "sp", [1, 3, 1]], ["auto_unroll_max_step", "ot", 1500], ["unroll_explicit", "ot", 1]]}], "r": [[0.00025281524739583335], 0, 2.397620916366577, 1544101268.958788], "v": 0.1}
{"i": ["cuda", "conv2d_no_batching", [1, 28, 28, 128, 256, 3, 3, [2, 2], [1, 1]], {}, ["conv2d_no_batching", 1, 28, 28, 128, 256, 3, 3, [2, 2], [1, 1]], {"i": 63667338, "t": "", "c": null, "e": [["tile_f", "sp", [4, 8, 4, 1]], ["tile_y", "sp", [7, 2, 1, 1]], ["tile_x", "sp", [1, 1, 14, 1]], ["tile_rc", "sp", [64, 4, 1]], ["tile_ry", "sp", [1, 3, 1]], ["tile_rx", "sp", [3, 1, 1]], ["auto_unroll_max_step", "ot", 1500], ["unroll_explicit", "ot", 1]]}], "r": [[0.00028827398697916666], 0, 2.4860928058624268, 1544101270.5501842], "v": 0.1}
{"i": ["cuda", "conv2d_no_batching", [1, 28, 28, 128, 256, 3, 3, [2, 2], [1, 1]], {}, ["conv2d_no_batching", 1, 28, 28, 128, 256, 3, 3, [2, 2], [1, 1]], {"i": 67814538, "t": "", "c": null, "e": [["tile_f", "sp", [4, 8, 4, 1]], ["tile_y", "sp", [7, 2, 1, 1]], ["tile_x", "sp", [1, 1, 14, 1]], ["tile_rc", "sp", [64, 4, 1]], ["tile_ry", "sp", [1, 3, 1]], ["tile_rx", "sp", [1, 3, 1]], ["auto_unroll_max_step", "ot", 1500], ["unroll_explicit", "ot", 1]]}], "r": [[0.00021627904166666667], 0, 2.215775728225708, 1544101271.9500537], "v": 0.1}
{"i": ["cuda", "conv2d_no_batching", [1, 28, 28, 128, 256, 3, 3, [2, 2], [1, 1]], {}, ["conv2d_no_batching", 1, 28, 28, 128, 256, 3, 3, [2, 2], [1, 1]], {"i": 66419538, "t": "", "c": null, "e": [["tile_f", "sp", [4, 8, 4, 1]], ["tile_y", "sp", [1, 1, 14, 1]], ["tile_x", "sp", [7, 2, 1, 1]], ["tile_rc", "sp", [64, 4, 1]], ["tile_ry", "sp", [3, 1, 1]], ["tile_rx", "sp", [1, 3, 1]], ["auto_unroll_max_step", "ot", 1500], ["unroll_explicit", "ot", 1]]}], "r": [[0.00031731100651041663], 0, 2.3462955951690674, 1544101273.5957382], "v": 0.1}
{"i": ["cuda", "conv2d_no_batching", [1, 28, 28, 128, 256, 3, 3, [2, 2], [1, 1]], {}, ["conv2d_no_batching", 1, 28, 28, 128, 256, 3, 3, [2, 2], [1, 1]], {"i": 63654738, "t": "", "c": null, "e": [["tile_f", "sp", [4, 8, 4, 1]], ["tile_y", "sp", [1, 1, 14, 1]], ["tile_x", "sp", [7, 2, 1, 1]], ["tile_rc", "sp", [64, 4, 1]], ["tile_ry", "sp", [1, 3, 1]], ["tile_rx", "sp", [3, 1, 1]], ["auto_unroll_max_step", "ot", 1500], ["unroll_explicit", "ot", 1]]}], "r": [[0.00020938956640624998], 0, 2.2037081718444824, 1544101274.9598231], "v": 0.1}
{"i": ["cuda", "conv2d_no_batching", [1, 28, 28, 128, 256, 3, 3, [2, 2], [1, 1]], {}, ["conv2d_no_batching", 1, 28, 28, 128, 256, 3, 3, [2, 2], [1, 1]], {"i": 67801938, "t": "", "c": null, "e": [["tile_f", "sp", [4, 8, 4, 1]], ["tile_y", "sp", [1, 1, 14, 1]], ["tile_x", "sp", [7, 2, 1, 1]], ["tile_rc", "sp", [64, 4, 1]], ["tile_ry", "sp", [1, 3, 1]], ["tile_rx", "sp", [1, 3, 1]], ["auto_unroll_max_step", "ot", 1500], ["unroll_explicit", "ot", 1]]}], "r": [[0.0002588448932291667], 0, 2.3923749923706055, 1544101276.487676], "v": 0.1}
{"i": ["cuda", "conv2d_no_batching", [1, 28, 28, 128, 256, 3, 3, [2, 2], [1, 1]], {}, ["conv2d_no_batching", 1, 28, 28, 128, 256, 3, 3, [2, 2], [1, 1]], {"i": 62284938, "t": "", "c": null, "e": [["tile_f", "sp", [4, 8, 4, 1]], ["tile_y", "sp", [7, 2, 1, 1]], ["tile_x", "sp", [1, 1, 14, 1]], ["tile_rc", "sp", [64, 4, 1]], ["tile_ry", "sp", [3, 1, 1]], ["tile_rx", "sp", [3, 1, 1]], ["auto_unroll_max_step", "ot", 1500], ["unroll_explicit", "ot", 1]]}], "r": [[0.00032583219140625003], 0, 2.5412609577178955, 1544101278.1435533], "v": 0.1}
{"i": ["cuda", "conv2d_no_batching", [1, 28, 28, 128, 256, 3, 3, [2, 2], [1, 1]], {}, ["conv2d_no_batching", 1, 28, 28, 128, 256, 3, 3, [2, 2], [1, 1]], {"i": 62272338, "t": "", "c": null, "e": [["tile_f", "sp", [4, 8, 4, 1]], ["tile_y", "sp", [1, 1, 14, 1]], ["tile_x", "sp", [7, 2, 1, 1]], ["tile_rc", "sp", [64, 4, 1]], ["tile_ry", "sp", [3, 1, 1]], ["tile_rx", "sp", [3, 1, 1]], ["auto_unroll_max_step", "ot", 1500], ["unroll_explicit", "ot", 1]]}], "r": [[0.00028561788541666663], 0, 2.474834442138672, 1544101279.6428795], "v": 0.1}
{"i": ["cuda", "conv2d_no_batching", [1, 28, 28, 128, 256, 3, 3, [2, 2], [1, 1]], {}, ["conv2d_no_batching", 1, 28, 28, 128, 256, 3, 3, [2, 2], [1, 1]], {"i": 24947538, "t": "", "c": null, "e": [["tile_f", "sp", [4, 8, 4, 1]], ["tile_y", "sp", [1, 1, 14, 1]], ["tile_x", "sp", [7, 2, 1, 1]], ["tile_rc", "sp", [64, 4, 1]], ["tile_ry", "sp", [3, 1, 1]], ["tile_rx", "sp", [3, 1, 1]], ["auto_unroll_max_step", "ot", 1500], ["unroll_explicit", "ot", 0]]}], "r": [[0.0005832694518229166], 0, 2.820826292037964, 1544101281.956317], "v": 0.1}
{"i": ["cuda", "conv2d_no_batching", [1, 28, 28, 128, 256, 3, 3, [2, 2], [1, 1]], {}, ["conv2d_no_batching", 1, 28, 28, 128, 256, 3, 3, [2, 2], [1, 1]], {"i": 30477138, "t": "", "c": null, "e": [["tile_f", "sp", [4, 8, 4, 1]], ["tile_y", "sp", [1, 1, 14, 1]], ["tile_x", "sp", [7, 2, 1, 1]], ["tile_rc", "sp", [64, 4, 1]], ["tile_ry", "sp", [1, 3, 1]], ["tile_rx", "sp", [1, 3, 1]], ["auto_unroll_max_step", "ot", 1500], ["unroll_explicit", "ot", 0]]}], "r": [[0.0003409599153645833], 0, 2.2484326362609863, 1544101283.7160013], "v": 0.1}
{"i": ["cuda", "conv2d_no_batching", [1, 28, 28, 128, 256, 3, 3, [2, 2], [1, 1]], {}, ["conv2d_no_batching", 1, 28, 28, 128, 256, 3, 3, [2, 2], [1, 1]], {"i": 26329938, "t": "", "c": null, "e": [["tile_f", "sp", [4, 8, 4, 1]], ["tile_y", "sp", [1, 1, 14, 1]], ["tile_x", "sp", [7, 2, 1, 1]], ["tile_rc", "sp", [64, 4, 1]], ["tile_ry", "sp", [1, 3, 1]], ["tile_rx", "sp", [3, 1, 1]], ["auto_unroll_max_step", "ot", 1500], ["unroll_explicit", "ot", 0]]}], "r": [[0.00040964454947916667], 0, 2.3747010231018066, 1544101285.6184514], "v": 0.1}
{"i": ["cuda", "conv2d_no_batching", [1, 28, 28, 128, 256, 3, 3, [2, 2], [1, 1]], {}, ["conv2d_no_batching", 1, 28, 28, 128, 256, 3, 3, [2, 2], [1, 1]], {"i": 29107338, "t": "", "c": null, "e": [["tile_f", "sp", [4, 8, 4, 1]], ["tile_y", "sp", [7, 2, 1, 1]], ["tile_x", "sp", [1, 1, 14, 1]], ["tile_rc", "sp", [64, 4, 1]], ["tile_ry", "sp", [3, 1, 1]], ["tile_rx", "sp", [1, 3, 1]], ["auto_unroll_max_step", "ot", 1500], ["unroll_explicit", "ot", 0]]}], "r": [[0.00044488156510416664], 0, 2.6282060146331787, 1544101287.6679344], "v": 0.1}
{"i": ["cuda", "conv2d_no_batching", [1, 28, 28, 128, 256, 3, 3, [2, 2], [1, 1]], {}, ["conv2d_no_batching", 1, 28, 28, 128, 256, 3, 3, [2, 2], [1, 1]], {"i": 30489738, "t": "", "c": null, "e": [["tile_f", "sp", [4, 8, 4, 1]], ["tile_y", "sp", [7, 2, 1, 1]], ["tile_x", "sp", [1, 1, 14, 1]], ["tile_rc", "sp", [64, 4, 1]], ["tile_ry", "sp", [1, 3, 1]], ["tile_rx", "sp", [1, 3, 1]], ["auto_unroll_max_step", "ot", 1500], ["unroll_explicit", "ot", 0]]}], "r": [[0.0002962700481770833], 0, 2.06223464012146, 1544101289.3315892], "v": 0.1}
{"i": ["cuda", "conv2d_no_batching", [1, 28, 28, 128, 256, 3, 3, [2, 2], [1, 1]], {}, ["conv2d_no_batching", 1, 28, 28, 128, 256, 3, 3, [2, 2], [1, 1]], {"i": 26342538, "t": "", "c": null, "e": [["tile_f", "sp", [4, 8, 4, 1]], ["tile_y", "sp", [7, 2, 1, 1]], ["tile_x", "sp", [1, 1, 14, 1]], ["tile_rc", "sp", [64, 4, 1]], ["tile_ry", "sp", [1, 3, 1]], ["tile_rx", "sp", [3, 1, 1]], ["auto_unroll_max_step", "ot", 1500], ["unroll_explicit", "ot", 0]]}], "r": [[0.0003176892591145833], 0, 2.102555751800537, 1544101291.0067194], "v": 0.1}
{"i": ["cuda", "conv2d_no_batching", [1, 28, 28, 128, 256, 3, 3, [2, 2], [1, 1]], {}, ["conv2d_no_batching", 1, 28, 28, 128, 256, 3, 3, [2, 2], [1, 1]], {"i": 29094738, "t": "", "c": null, "e": [["tile_f", "sp", [4, 8, 4, 1]], ["tile_y", "sp", [1, 1, 14, 1]], ["tile_x", "sp", [7, 2, 1, 1]], ["tile_rc", "sp", [64, 4, 1]], ["tile_ry", "sp", [3, 1, 1]], ["tile_rx", "sp", [1, 3, 1]], ["auto_unroll_max_step", "ot", 1500], ["unroll_explicit", "ot", 0]]}], "r": [[0.00035226080989583336], 0, 2.20896053314209, 1544101292.7412443], "v": 0.1}
{"i": ["cuda", "conv2d_no_batching", [1, 28, 28, 128, 256, 3, 3, [2, 2], [1, 1]], {}, ["conv2d_no_batching", 1, 28, 28, 128, 256, 3, 3, [2, 2], [1, 1]], {"i": 24960138, "t": "", "c": null, "e": [["tile_f", "sp", [4, 8, 4, 1]], ["tile_y", "sp", [7, 2, 1, 1]], ["tile_x", "sp", [1, 1, 14, 1]], ["tile_rc", "sp", [64, 4, 1]], ["tile_ry", "sp", [3, 1, 1]], ["tile_rx", "sp", [3, 1, 1]], ["auto_unroll_max_step", "ot", 1500], ["unroll_explicit", "ot", 0]]}], "r": [[0.0005853333502604166], 0, 2.8395133018493652, 1544101295.103071], "v": 0.1}
{"i": ["cuda", "conv2d_no_batching", [1, 28, 28, 128, 256, 3, 3, [2, 2], [1, 1]], {}, ["conv2d_no_batching", 1, 28, 28, 128, 256, 3, 3, [2, 2], [1, 1]], {"i": 67783815, "t": "", "c": null, "e": [["tile_f", "sp", [32, 1, 4, 1]], ["tile_y", "sp", [7, 2, 1, 1]], ["tile_x", "sp", [1, 1, 14, 1]], ["tile_rc", "sp", [128, 2, 1]], ["tile_ry", "sp", [1, 3, 1]], ["tile_rx", "sp", [1, 3, 1]], ["auto_unroll_max_step", "ot", 1500], ["unroll_explicit", "ot", 1]]}], "r": [[0.00015214386848958332], 0, 1.468306064605713, 1544101296.1633248], "v": 0.1}
{"i": ["cuda", "conv2d_no_batching", [1, 28, 28, 128, 256, 3, 3, [2, 2], [1, 1]], {}, ["conv2d_no_batching", 1, 28, 28, 128, 256, 3, 3, [2, 2], [1, 1]], {"i": 67771215, "t": "", "c": null, "e": [["tile_f", "sp", [32, 1, 4, 1]], ["tile_y", "sp", [1, 1, 14, 1]], ["tile_x", "sp", [7, 2, 1, 1]], ["tile_rc", "sp", [128, 2, 1]], ["tile_ry", "sp", [1, 3, 1]], ["tile_rx", "sp", [1, 3, 1]], ["auto_unroll_max_step", "ot", 1500], ["unroll_explicit", "ot", 1]]}], "r": [[0.000193706828125], 0, 1.5789756774902344, 1544101297.384773], "v": 0.1}
{"i": ["cuda", "conv2d_no_batching", [1, 28, 28, 128, 256, 3, 3, [2, 2], [1, 1]], {}, ["conv2d_no_batching", 1, 28, 28, 128, 256, 3, 3, [2, 2], [1, 1]], {"i": 30459018, "t": "", "c": null, "e": [["tile_f", "sp", [4, 8, 4, 1]], ["tile_y", "sp", [7, 2, 1, 1]], ["tile_x", "sp", [1, 1, 14, 1]], ["tile_rc", "sp", [128, 2, 1]], ["tile_ry", "sp", [1, 3, 1]], ["tile_rx", "sp", [1, 3, 1]], ["auto_unroll_max_step", "ot", 1500], ["unroll_explicit", "ot", 0]]}], "r": [[0.00023065617057291667], 0, 1.8943493366241455, 1544101298.849402], "v": 0.1}
{"i": ["cuda", "conv2d_no_batching", [1, 28, 28, 128, 256, 3, 3, [2, 2], [1, 1]], {}, ["conv2d_no_batching", 1, 28, 28, 128, 256, 3, 3, [2, 2], [1, 1]], {"i": 30446418, "t": "", "c": null, "e": [["tile_f", "sp", [4, 8, 4, 1]], ["tile_y", "sp", [1, 1, 14, 1]], ["tile_x", "sp", [7, 2, 1, 1]], ["tile_rc", "sp", [128, 2, 1]], ["tile_ry", "sp", [1, 3, 1]], ["tile_rx", "sp", [1, 3, 1]], ["auto_unroll_max_step", "ot", 1500], ["unroll_explicit", "ot", 0]]}], "r": [[0.00028049448567708335], 0, 1.721843957901001, 1544101300.282484], "v": 0.1}
{"i": ["cuda", "conv2d_no_batching", [1, 28, 28, 128, 256, 3, 3, [2, 2], [1, 1]], {}, ["conv2d_no_batching", 1, 28, 28, 128, 256, 3, 3, [2, 2], [1, 1]], {"i": 66419529, "t": "", "c": null, "e": [["tile_f", "sp", [32, 2, 2, 1]], ["tile_y", "sp", [1, 1, 14, 1]], ["tile_x", "sp", [7, 2, 1, 1]], ["tile_rc", "sp", [64, 4, 1]], ["tile_ry", "sp", [3, 1, 1]], ["tile_rx", "sp", [1, 3, 1]], ["auto_unroll_max_step", "ot", 1500], ["unroll_explicit", "ot", 1]]}], "r": [[0.0002593439583333333], 0, 1.904843807220459, 1544101301.7290058], "v": 0.1}
{"i": ["cuda", "conv2d_no_batching", [1, 28, 28, 128, 256, 3, 3, [2, 2], [1, 1]], {}, ["conv2d_no_batching", 1, 28, 28, 128, 256, 3, 3, [2, 2], [1, 1]], {"i": 24929415, "t": "", "c": null, "e": [["tile_f", "sp", [32, 1, 4, 1]], ["tile_y", "sp", [7, 2, 1, 1]], ["tile_x", "sp", [1, 1, 14, 1]], ["tile_rc", "sp", [128, 2, 1]], ["tile_ry", "sp", [3, 1, 1]], ["tile_rx", "sp", [3, 1, 1]], ["auto_unroll_max_step", "ot", 1500], ["unroll_explicit", "ot", 0]]}], "r": [[0.0006386427968749999], 0, 2.5984408855438232, 1544101303.9908106], "v": 0.1}
{"i": ["cuda", "conv2d_no_batching", [1, 28, 28, 128, 256, 3, 3, [2, 2], [1, 1]], {}, ["conv2d_no_batching", 1, 28, 28, 128, 256, 3, 3, [2, 2], [1, 1]], {"i": 24916815, "t": "", "c": null, "e": [["tile_f", "sp", [32, 1, 4, 1]], ["tile_y", "sp", [1, 1, 14, 1]], ["tile_x", "sp", [7, 2, 1, 1]], ["tile_rc", "sp", [128, 2, 1]], ["tile_ry", "sp", [3, 1, 1]], ["tile_rx", "sp", [3, 1, 1]], ["auto_unroll_max_step", "ot", 1500], ["unroll_explicit", "ot", 0]]}], "r": [[0.0006832443945312501], 0, 2.7291347980499268, 1544101306.3473022], "v": 0.1}
{"i": ["cuda", "conv2d_no_batching", [1, 28, 28, 128, 256, 3, 3, [2, 2], [1, 1]], {}, ["conv2d_no_batching", 1, 28, 28, 128, 256, 3, 3, [2, 2], [1, 1]], {"i": 30459369, "t": "", "c": null, "e": [["tile_f", "sp", [32, 2, 2, 1]], ["tile_y", "sp", [7, 1, 2, 1]], ["tile_x", "sp", [1, 1, 14, 1]], ["tile_rc", "sp", [128, 2, 1]], ["tile_ry", "sp", [1, 3, 1]], ["tile_rx", "sp", [1, 3, 1]], ["auto_unroll_max_step", "ot", 1500], ["unroll_explicit", "ot", 0]]}], "r": [[0.0001628271484375], 0, 1.4672553539276123, 1544101307.529065], "v": 0.1}
{"i": ["cuda", "conv2d_no_batching", [1, 28, 28, 128, 256, 3, 3, [2, 2], [1, 1]], {}, ["conv2d_no_batching", 1, 28, 28, 128, 256, 3, 3, [2, 2], [1, 1]], {"i": 30459009, "t": "", "c": null, "e": [["tile_f", "sp", [32, 2, 2, 1]], ["tile_y", "sp", [7, 2, 1, 1]], ["tile_x", "sp", [1, 1, 14, 1]], ["tile_rc", "sp", [128, 2, 1]], ["tile_ry", "sp", [1, 3, 1]], ["tile_rx", "sp", [1, 3, 1]], ["auto_unroll_max_step", "ot", 1500], ["unroll_explicit", "ot", 0]]}], "r": [[0.0002301653125], 0, 1.5340626239776611, 1544101308.8443806], "v": 0.1}
{"i": ["cuda", "conv2d_no_batching", [1, 28, 28, 128, 256, 3, 3, [2, 2], [1, 1]], {}, ["conv2d_no_batching", 1, 28, 28, 128, 256, 3, 3, [2, 2], [1, 1]], {"i": 67783818, "t": "", "c": null, "e": [["tile_f", "sp", [4, 8, 4, 1]], ["tile_y", "sp", [7, 2, 1, 1]], ["tile_x", "sp", [1, 1, 14, 1]], ["tile_rc", "sp", [128, 2, 1]], ["tile_ry", "sp", [1, 3, 1]], ["tile_rx", "sp", [1, 3, 1]], ["auto_unroll_max_step", "ot", 1500], ["unroll_explicit", "ot", 1]]}], "r": [[0.00019806168359375], 0, 1.7764759063720703, 1544101310.1615677], "v": 0.1}
{"i": ["cuda", "conv2d_no_batching", [1, 28, 28, 128, 256, 3, 3, [2, 2], [1, 1]], {}, ["conv2d_no_batching", 1, 28, 28, 128, 256, 3, 3, [2, 2], [1, 1]], {"i": 67771218, "t": "", "c": null, "e": [["tile_f", "sp", [4, 8, 4, 1]], ["tile_y", "sp", [1, 1, 14, 1]], ["tile_x", "sp", [7, 2, 1, 1]], ["tile_rc", "sp", [128, 2, 1]], ["tile_ry", "sp", [1, 3, 1]], ["tile_rx", "sp", [1, 3, 1]], ["auto_unroll_max_step", "ot", 1500], ["unroll_explicit", "ot", 1]]}], "r": [[0.0002460414466145833], 0, 1.8498029708862305, 1544101311.5912247], "v": 0.1}
{"i": ["cuda", "conv2d_no_batching", [1, 28, 28, 128, 256, 3, 3, [2, 2], [1, 1]], {}, ["conv2d_no_batching", 1, 28, 28, 128, 256, 3, 3, [2, 2], [1, 1]], {"i": 67771209, "t": "", "c": null, "e": [["tile_f", "sp", [32, 2, 2, 1]], ["tile_y", "sp", [1, 1, 14, 1]], ["tile_x", "sp", [7, 2, 1, 1]], ["tile_rc", "sp", [128, 2, 1]], ["tile_ry", "sp", [1, 3, 1]], ["tile_rx", "sp", [1, 3, 1]], ["auto_unroll_max_step", "ot", 1500], ["unroll_explicit", "ot", 1]]}], "r": [[0.00033603848697916666], 0, 1.836280345916748, 1544101370.909605], "v": 0.1}
{"i": ["cuda", "conv2d_no_batching", [1, 28, 28, 128, 256, 3, 3, [2, 2], [1, 1]], {}, ["conv2d_no_batching", 1, 28, 28, 128, 256, 3, 3, [2, 2], [1, 1]], {"i": 67784169, "t": "", "c": null, "e": [["tile_f", "sp", [32, 2, 2, 1]], ["tile_y", "sp", [7, 1, 2, 1]], ["tile_x", "sp", [1, 1, 14, 1]], ["tile_rc", "sp", [128, 2, 1]], ["tile_ry", "sp", [1, 3, 1]], ["tile_rx", "sp", [1, 3, 1]], ["auto_unroll_max_step", "ot", 1500], ["unroll_explicit", "ot", 1]]}], "r": [[0.00016707365104166665], 0, 1.44413161277771, 1544101372.072855], "v": 0.1}
{"i": ["cuda", "conv2d_no_batching", [1, 28, 28, 128, 256, 3, 3, [2, 2], [1, 1]], {}, ["conv2d_no_batching", 1, 28, 28, 128, 256, 3, 3, [2, 2], [1, 1]], {"i": 67783809, "t": "", "c": null, "e": [["tile_f", "sp", [32, 2, 2, 1]], ["tile_y", "sp", [7, 2, 1, 1]], ["tile_x", "sp", [1, 1, 14, 1]], ["tile_rc", "sp", [128, 2, 1]], ["tile_ry", "sp", [1, 3, 1]], ["tile_rx", "sp", [1, 3, 1]], ["auto_unroll_max_step", "ot", 1500], ["unroll_explicit", "ot", 1]]}], "r": [[0.00021223737500000001], 0, 1.5521478652954102, 1544101373.3404295], "v": 0.1}
{"i": ["cuda", "conv2d_no_batching", [1, 28, 28, 128, 256, 3, 3, [2, 2], [1, 1]], {}, ["conv2d_no_batching", 1, 28, 28, 128, 256, 3, 3, [2, 2], [1, 1]], {"i": 55342209, "t": "", "c": null, "e": [["tile_f", "sp", [32, 2, 2, 1]], ["tile_y", "sp", [7, 2, 1, 1]], ["tile_x", "sp", [1, 1, 14, 1]], ["tile_rc", "sp", [128, 2, 1]], ["tile_ry", "sp", [1, 3, 1]], ["tile_rx", "sp", [1, 3, 1]], ["auto_unroll_max_step", "ot", 512], ["unroll_explicit", "ot", 1]]}], "r": [[0.0002122278177083333], 0, 1.5902881622314453, 1544101374.5396974], "v": 0.1}
{"i": ["cuda", "conv2d_no_batching", [1, 28, 28, 128, 256, 3, 3, [2, 2], [1, 1]], {}, ["conv2d_no_batching", 1, 28, 28, 128, 256, 3, 3, [2, 2], [1, 1]], {"i": 55329609, "t": "", "c": null, "e": [["tile_f", "sp", [32, 2, 2, 1]], ["tile_y", "sp", [1, 1, 14, 1]], ["tile_x", "sp", [7, 2, 1, 1]], ["tile_rc", "sp", [128, 2, 1]], ["tile_ry", "sp", [1, 3, 1]], ["tile_rx", "sp", [1, 3, 1]], ["auto_unroll_max_step", "ot", 512], ["unroll_explicit", "ot", 1]]}], "r": [[0.0003146656015625], 0, 1.7778916358947754, 1544101375.9808917], "v": 0.1}
{"i": ["cuda", "conv2d_no_batching", [1, 28, 28, 128, 256, 3, 3, [2, 2], [1, 1]], {}, ["conv2d_no_batching", 1, 28, 28, 128, 256, 3, 3, [2, 2], [1, 1]], {"i": 55342569, "t": "", "c": null, "e": [["tile_f", "sp", [32, 2, 2, 1]], ["tile_y", "sp", [7, 1, 2, 1]], ["tile_x", "sp", [1, 1, 14, 1]], ["tile_rc", "sp", [128, 2, 1]], ["tile_ry", "sp", [1, 3, 1]], ["tile_rx", "sp", [1, 3, 1]], ["auto_unroll_max_step", "ot", 512], ["unroll_explicit", "ot", 1]]}], "r": [[0.00016782222135416667], 0, 1.4159579277038574, 1544101377.0565321], "v": 0.1}
{"i": ["cuda", "conv2d_no_batching", [1, 28, 28, 128, 256, 3, 3, [2, 2], [1, 1]], {}, ["conv2d_no_batching", 1, 28, 28, 128, 256, 3, 3, [2, 2], [1, 1]], {"i": 67769295, "t": "", "c": null, "e": [["tile_f", "sp", [32, 1, 4, 1]], ["tile_y", "sp", [1, 1, 14, 1]], ["tile_x", "sp", [14, 1, 1, 1]], ["tile_rc", "sp", [128, 2, 1]], ["tile_ry", "sp", [1, 3, 1]], ["tile_rx", "sp", [1, 3, 1]], ["auto_unroll_max_step", "ot", 1500], ["unroll_explicit", "ot", 1]]}], "r": [[0.00013609715885416667], 0, 1.3339488506317139, 1544101378.0604074], "v": 0.1}
{"i": ["cuda", "conv2d_no_batching", [1, 28, 28, 128, 256, 3, 3, [2, 2], [1, 1]], {}, ["conv2d_no_batching", 1, 28, 28, 128, 256, 3, 3, [2, 2], [1, 1]], {"i": 67784060, "t": "", "c": null, "e": [["tile_f", "sp", [1, 32, 4, 1]], ["tile_y", "sp", [1, 14, 1, 1]], ["tile_x", "sp", [1, 1, 14, 1]], ["tile_rc", "sp", [128, 2, 1]], ["tile_ry", "sp", [1, 3, 1]], ["tile_rx", "sp", [1, 3, 1]], ["auto_unroll_max_step", "ot", 1500], ["unroll_explicit", "ot", 1]]}], "r": [[0.011050354989583332], 0, 30.161245584487915, 1544101405.1933343], "v": 0.1}
{"i": ["cuda", "conv2d_no_batching", [1, 28, 28, 128, 256, 3, 3, [2, 2], [1, 1]], {}, ["conv2d_no_batching", 1, 28, 28, 128, 256, 3, 3, [2, 2], [1, 1]], {"i": 67769282, "t": "", "c": null, "e": [["tile_f", "sp", [32, 4, 1, 1]], ["tile_y", "sp", [1, 1, 14, 1]], ["tile_x", "sp", [14, 1, 1, 1]], ["tile_rc", "sp", [128, 2, 1]], ["tile_ry", "sp", [1, 3, 1]], ["tile_rx", "sp", [1, 3, 1]], ["auto_unroll_max_step", "ot", 1500], ["unroll_explicit", "ot", 1]]}], "r": [[0.00013620813671875], 0, 1.5375676155090332, 1544101406.321725], "v": 0.1}
{"i": ["cuda", "conv2d_no_batching", [1, 28, 28, 128, 256, 3, 3, [2, 2], [1, 1]], {}, ["conv2d_no_batching", 1, 28, 28, 128, 256, 3, 3, [2, 2], [1, 1]], {"i": 67775055, "t": "", "c": null, "e": [["tile_f", "sp", [32, 1, 4, 1]], ["tile_y", "sp", [1, 1, 14, 1]], ["tile_x", "sp", [1, 14, 1, 1]], ["tile_rc", "sp", [128, 2, 1]], ["tile_ry", "sp", [1, 3, 1]], ["tile_rx", "sp", [1, 3, 1]], ["auto_unroll_max_step", "ot", 1500], ["unroll_explicit", "ot", 1]]}], "r": [[0.0004618693671875], 0, 2.86108660697937, 1544101408.4314897], "v": 0.1}
