transfer-learning/conv2d_transfer_itervar_c12_c7_0_1_2_3.log
{"i": ["cuda", "conv2d_no_batching", [1, 28, 28, 128, 256, 3, 3, [2, 2], [1, 1]], {}, ["conv2d_no_batching", 1, 28, 28, 128, 256, 3, 3, [2, 2], [1, 1]], {"i": 67780341, "t": "", "c": null, "e": [["tile_f", "sp", [16, 1, 8, 1]], ["tile_y", "sp", [7, 1, 2, 1]], ["tile_x", "sp", [2, 1, 7, 1]], ["tile_rc", "sp", [128, 2, 1]], ["tile_ry", "sp", [1, 3, 1]], ["tile_rx", "sp", [1, 3, 1]], ["auto_unroll_max_step", "ot", 1500], ["unroll_explicit", "ot", 1]]}], "r": [[0.0001397411231028668], 0, 1.6688473224639893, 1544113129.0956671], "v": 0.1}
{"i": ["cuda", "conv2d_no_batching", [1, 28, 28, 128, 256, 3, 3, [2, 2], [1, 1]], {}, ["conv2d_no_batching", 1, 28, 28, 128, 256, 3, 3, [2, 2], [1, 1]], {"i": 68026101, "t": "", "c": null, "e": [["tile_f", "sp", [16, 1, 8, 1]], ["tile_y", "sp", [7, 1, 2, 1]], ["tile_x", "sp", [2, 1, 7, 1]], ["tile_rc", "sp", [128, 1, 2]], ["tile_ry", "sp", [1, 3, 1]], ["tile_rx", "sp", [1, 3, 1]], ["auto_unroll_max_step", "ot", 1500], ["unroll_explicit", "ot", 1]]}], "r": [[0.0001427675826306914], 0, 1.6972804069519043, 1544113130.493227], "v": 0.1}
{"i": ["cuda", "conv2d_no_batching", [1, 28, 28, 128, 256, 3, 3, [2, 2], [1, 1]], {}, ["conv2d_no_batching", 1, 28, 28, 128, 256, 3, 3, [2, 2], [1, 1]], {"i": 71927541, "t": "", "c": null, "e": [["tile_f", "sp", [16, 1, 8, 1]], ["tile_y", "sp", [7, 1, 2, 1]], ["tile_x", "sp", [2, 1, 7, 1]], ["tile_rc", "sp", [128, 2, 1]], ["tile_ry", "sp", [1, 3, 1]], ["tile_rx", "sp", [1, 1, 3]], ["auto_unroll_max_step", "ot", 1500], ["unroll_explicit", "ot", 1]]}], "r": [[0.00012766553625632378], 0, 1.5591151714324951, 1544113131.8468542], "v": 0.1}
{"i": ["cuda", "conv2d_no_batching", [1, 28, 28, 128, 256, 3, 3, [2, 2], [1, 1]], {}, ["conv2d_no_batching", 1, 28, 28, 128, 256, 3, 3, [2, 2], [1, 1]], {"i": 67783701, "t": "", "c": null, "e": [["tile_f", "sp", [16, 1, 8, 1]], ["tile_y", "sp", [14, 1, 1, 1]], ["tile_x", "sp", [1, 1, 14, 1]], ["tile_rc", "sp", [128, 2, 1]], ["tile_ry", "sp", [1, 3, 1]], ["tile_rx", "sp", [1, 3, 1]], ["auto_unroll_max_step", "ot", 1500], ["unroll_explicit", "ot", 1]]}], "r": [[8.83833844856661e-05], 0, 1.459001064300537, 1544113133.0567372], "v": 0.1}
{"i": ["cuda", "conv2d_no_batching", [1, 28, 28, 128, 256, 3, 3, [2, 2], [1, 1]], {}, ["conv2d_no_batching", 1, 28, 28, 128, 256, 3, 3, [2, 2], [1, 1]], {"i": 30455541, "t": "", "c": null, "e": [["tile_f", "sp", [16, 1, 8, 1]], ["tile_y", "sp", [7, 1, 2, 1]], ["tile_x", "sp", [2, 1, 7, 1]], ["tile_rc", "sp", [128, 2, 1]], ["tile_ry", "sp", [1, 3, 1]], ["tile_rx", "sp", [1, 3, 1]], ["auto_unroll_max_step", "ot", 1500], ["unroll_explicit", "ot", 0]]}], "r": [[0.0001259135126475548], 0, 1.6415290832519531, 1544113134.4261155], "v": 0.1}
{"i": ["cuda", "conv2d_no_batching", [1, 28, 28, 128, 256, 3, 3, [2, 2], [1, 1]], {}, ["conv2d_no_batching", 1, 28, 28, 128, 256, 3, 3, [2, 2], [1, 1]], {"i": 71930901, "t": "", "c": null, "e": [["tile_f", "sp", [16, 1, 8, 1]], ["tile_y", "sp", [14, 1, 1, 1]], ["tile_x", "sp", [1, 1, 14, 1]], ["tile_rc", "sp", [128, 2, 1]], ["tile_ry", "sp", [1, 3, 1]], ["tile_rx", "sp", [1, 1, 3]], ["auto_unroll_max_step", "ot", 1500], ["unroll_explicit", "ot", 1]]}], "r": [[8.872294519392918e-05], 0, 1.511918067932129, 1544113135.665903], "v": 0.1}
{"i": ["cuda", "conv2d_no_batching", [1, 28, 28, 128, 256, 3, 3, [2, 2], [1, 1]], {}, ["conv2d_no_batching", 1, 28, 28, 128, 256, 3, 3, [2, 2], [1, 1]], {"i": 67780336, "t": "", "c": null, "e": [["tile_f", "sp", [16, 2, 4, 1]], ["tile_y", "sp", [7, 1, 2, 1]], ["tile_x", "sp", [2, 1, 7, 1]], ["tile_rc", "sp", [128, 2, 1]], ["tile_ry", "sp", [1, 3, 1]], ["tile_rx", "sp", [1, 3, 1]], ["auto_unroll_max_step", "ot", 1500], ["unroll_explicit", "ot", 1]]}], "r": [[0.00012917801433389546], 0, 1.640228271484375, 1544113137.0540485], "v": 0.1}
{"i": ["cuda", "conv2d_no_batching", [1, 28, 28, 128, 256, 3, 3, [2, 2], [1, 1]], {}, ["conv2d_no_batching", 1, 28, 28, 128, 256, 3, 3, [2, 2], [1, 1]], {"i": 55338741, "t": "", "c": null, "e": [["tile_f", "sp", [16, 1, 8, 1]], ["tile_y", "sp", [7, 1, 2, 1]], ["tile_x", "sp", [2, 1, 7, 1]], ["tile_rc", "sp", [128, 2, 1]], ["tile_ry", "sp", [1, 3, 1]], ["tile_rx", "sp", [1, 3, 1]], ["auto_unroll_max_step", "ot", 512], ["unroll_explicit", "ot", 1]]}], "r": [[0.00012614627487352444], 0, 1.6827280521392822, 1544113138.3904974], "v": 0.1}
{"i": ["cuda", "conv2d_no_batching", [1, 28, 28, 128, 256, 3, 3, [2, 2], [1, 1]], {}, ["conv2d_no_batching", 1, 28, 28, 128, 256, 3, 3, [2, 2], [1, 1]], {"i": 67783706, "t": "", "c": null, "e": [["tile_f", "sp", [8, 1, 16, 1]], ["tile_y", "sp", [14, 1, 1, 1]], ["tile_x", "sp", [1, 1, 14, 1]], ["tile_rc", "sp", [128, 2, 1]], ["tile_ry", "sp", [1, 3, 1]], ["tile_rx", "sp", [1, 3, 1]], ["auto_unroll_max_step", "ot", 1500], ["unroll_explicit", "ot", 1]]}], "r": [[9.471258347386173e-05], 0, 1.5274426937103271, 1544113139.62776], "v": 0.1}
{"i": ["cuda", "conv2d_no_batching", [1, 28, 28, 128, 256, 3, 3, [2, 2], [1, 1]], {}, ["conv2d_no_batching", 1, 28, 28, 128, 256, 3, 3, [2, 2], [1, 1]], {"i": 67776736, "t": "", "c": null, "e": [["tile_f", "sp", [16, 2, 4, 1]], ["tile_y", "sp", [2, 1, 7, 1]], ["tile_x", "sp", [7, 1, 2, 1]], ["tile_rc", "sp", [128, 2, 1]], ["tile_ry", "sp", [1, 3, 1]], ["tile_rx", "sp", [1, 3, 1]], ["auto_unroll_max_step", "ot", 1500], ["unroll_explicit", "ot", 1]]}], "r": [[0.0001472418507588533], 0, 1.7185444831848145, 1544113141.0782244], "v": 0.1}
{"i": ["cuda", "conv2d_no_batching", [1, 28, 28, 128, 256, 3, 3, [2, 2], [1, 1]], {}, ["conv2d_no_batching", 1, 28, 28, 128, 256, 3, 3, [2, 2], [1, 1]], {"i": 67779981, "t": "", "c": null, "e": [["tile_f", "sp", [16, 1, 8, 1]], ["tile_y", "sp", [7, 2, 1, 1]], ["tile_x", "sp", [2, 1, 7, 1]], ["tile_rc", "sp", [128, 2, 1]], ["tile_ry", "sp", [1, 3, 1]], ["tile_rx", "sp", [1, 3, 1]], ["auto_unroll_max_step", "ot", 1500], ["unroll_explicit", "ot", 1]]}], "r": [[0.00012878865092748735], 0, 1.6758687496185303, 1544113142.4569416], "v": 0.1}
{"i": ["cuda", "conv2d_no_batching", [1, 28, 28, 128, 256, 3, 3, [2, 2], [1, 1]], {}, ["conv2d_no_batching", 1, 28, 28, 128, 256, 3, 3, [2, 2], [1, 1]], {"i": 72173301, "t": "", "c": null, "e": [["tile_f", "sp", [16, 1, 8, 1]], ["tile_y", "sp", [7, 1, 2, 1]], ["tile_x", "sp", [2, 1, 7, 1]], ["tile_rc", "sp", [128, 1, 2]], ["tile_ry", "sp", [1, 3, 1]], ["tile_rx", "sp", [1, 1, 3]], ["auto_unroll_max_step", "ot", 1500], ["unroll_explicit", "ot", 1]]}], "r": [[0.00013838980185497472], 0, 1.7236778736114502, 1544113143.8402174], "v": 0.1}
{"i": ["cuda", "conv2d_no_batching", [1, 28, 28, 128, 256, 3, 3, [2, 2], [1, 1]], {}, ["conv2d_no_batching", 1, 28, 28, 128, 256, 3, 3, [2, 2], [1, 1]], {"i": 67810582, "t": "", "c": null, "e": [["tile_f", "sp", [8, 2, 8, 1]], ["tile_y", "sp", [14, 1, 1, 1]], ["tile_x", "sp", [2, 1, 7, 1]], ["tile_rc", "sp", [64, 4, 1]], ["tile_ry", "sp", [1, 3, 1]], ["tile_rx", "sp", [1, 3, 1]], ["auto_unroll_max_step", "ot", 1500], ["unroll_explicit", "ot", 1]]}], "r": [[0.00010919501854974704], 0, 1.6502504348754883, 1544113145.1906538], "v": 0.1}
{"i": ["cuda", "conv2d_no_batching", [1, 28, 28, 128, 256, 3, 3, [2, 2], [1, 1]], {}, ["conv2d_no_batching", 1, 28, 28, 128, 256, 3, 3, [2, 2], [1, 1]], {"i": 67811061, "t": "", "c": null, "e": [["tile_f", "sp", [16, 1, 8, 1]], ["tile_y", "sp", [7, 1, 2, 1]], ["tile_x", "sp", [2, 1, 7, 1]], ["tile_rc", "sp", [64, 4, 1]], ["tile_ry", "sp", [1, 3, 1]], ["tile_rx", "sp", [1, 3, 1]], ["auto_unroll_max_step", "ot", 1500], ["unroll_explicit", "ot", 1]]}], "r": [[0.0001146141365935919], 0, 1.6488404273986816, 1544113146.5501657], "v": 0.1}
{"i": ["cuda", "conv2d_no_batching", [1, 28, 28, 128, 256, 3, 3, [2, 2], [1, 1]], {}, ["conv2d_no_batching", 1, 28, 28, 128, 256, 3, 3, [2, 2], [1, 1]], {"i": 67814422, "t": "", "c": null, "e": [["tile_f", "sp", [8, 2, 8, 1]], ["tile_y", "sp", [14, 1, 1, 1]], ["tile_x", "sp", [1, 1, 14, 1]], ["tile_rc", "sp", [64, 4, 1]], ["tile_ry", "sp", [1, 3, 1]], ["tile_rx", "sp", [1, 3, 1]], ["auto_unroll_max_step", "ot", 1500], ["unroll_explicit", "ot", 1]]}], "r": [[6.391795216836735e-05], 0, 1.5360064506530762, 1544113193.376071], "v": 0.1}
{"i": ["cuda", "conv2d_no_batching", [1, 28, 28, 128, 256, 3, 3, [2, 2], [1, 1]], {}, ["conv2d_no_batching", 1, 28, 28, 128, 256, 3, 3, [2, 2], [1, 1]], {"i": 30701301, "t": "", "c": null, "e": [["tile_f", "sp", [16, 1, 8, 1]], ["tile_y", "sp", [7, 1, 2, 1]], ["tile_x", "sp", [2, 1, 7, 1]], ["tile_rc", "sp", [128, 1, 2]], ["tile_ry", "sp", [1, 3, 1]], ["tile_rx", "sp", [1, 3, 1]], ["auto_unroll_max_step", "ot", 1500], ["unroll_explicit", "ot", 0]]}], "r": [[0.00014237811129848228], 0, 1.7397024631500244, 1544113149.1340678], "v": 0.1}
{"i": ["cuda", "conv2d_no_batching", [1, 28, 28, 128, 256, 3, 3, [2, 2], [1, 1]], {}, ["conv2d_no_batching", 1, 28, 28, 128, 256, 3, 3, [2, 2], [1, 1]], {"i": 67783702, "t": "", "c": null, "e": [["tile_f", "sp", [8, 2, 8, 1]], ["tile_y", "sp", [14, 1, 1, 1]], ["tile_x", "sp", [1, 1, 14, 1]], ["tile_rc", "sp", [128, 2, 1]], ["tile_ry", "sp", [1, 3, 1]], ["tile_rx", "sp", [1, 3, 1]], ["auto_unroll_max_step", "ot", 1500], ["unroll_explicit", "ot", 1]]}], "r": [[7.604759630102041e-05], 0, 1.5463452339172363, 1544113194.6251957], "v": 0.1}
{"i": ["cuda", "conv2d_no_batching", [1, 28, 28, 128, 256, 3, 3, [2, 2], [1, 1]], {}, ["conv2d_no_batching", 1, 28, 28, 128, 256, 3, 3, [2, 2], [1, 1]], {"i": 67752982, "t": "", "c": null, "e": [["tile_f", "sp", [8, 2, 8, 1]], ["tile_y", "sp", [14, 1, 1, 1]], ["tile_x", "sp", [1, 1, 14, 1]], ["tile_rc", "sp", [256, 1, 1]], ["tile_ry", "sp", [1, 3, 1]], ["tile_rx", "sp", [1, 3, 1]], ["auto_unroll_max_step", "ot", 1500], ["unroll_explicit", "ot", 1]]}], "r": [[0.0001570985202360877], 0, 1.7253453731536865, 1544113151.788512], "v": 0.1}
{"i": ["cuda", "conv2d_no_batching", [1, 28, 28, 128, 256, 3, 3, [2, 2], [1, 1]], {}, ["conv2d_no_batching", 1, 28, 28, 128, 256, 3, 3, [2, 2], [1, 1]], {"i": 67810702, "t": "", "c": null, "e": [["tile_f", "sp", [8, 2, 8, 1]], ["tile_y", "sp", [7, 2, 1, 1]], ["tile_x", "sp", [2, 1, 7, 1]], ["tile_rc", "sp", [64, 4, 1]], ["tile_ry", "sp", [1, 3, 1]], ["tile_rx", "sp", [1, 3, 1]], ["auto_unroll_max_step", "ot", 1500], ["unroll_explicit", "ot", 1]]}], "r": [[0.0001221617310286678], 0, 1.8040525913238525, 1544113153.1295393], "v": 0.1}
{"i": ["cuda", "conv2d_no_batching", [1, 28, 28, 128, 256, 3, 3, [2, 2], [1, 1]], {}, ["conv2d_no_batching", 1, 28, 28, 128, 256, 3, 3, [2, 2], [1, 1]], {"i": 71927536, "t": "", "c": null, "e": [["tile_f", "sp", [16, 2, 4, 1]], ["tile_y", "sp", [7, 1, 2, 1]], ["tile_x", "sp", [2, 1, 7, 1]], ["tile_rc", "sp", [128, 2, 1]], ["tile_ry", "sp", [1, 3, 1]], ["tile_rx", "sp", [1, 1, 3]], ["auto_unroll_max_step", "ot", 1500], ["unroll_explicit", "ot", 1]]}], "r": [[0.00012777310708263068], 0, 1.6895942687988281, 1544113154.4792414], "v": 0.1}
{"i": ["cuda", "conv2d_no_batching", [1, 28, 28, 128, 256, 3, 3, [2, 2], [1, 1]], {}, ["conv2d_no_batching", 1, 28, 28, 128, 256, 3, 3, [2, 2], [1, 1]], {"i": 67776741, "t": "", "c": null, "e": [["tile_f", "sp", [16, 1, 8, 1]], ["tile_y", "sp", [2, 1, 7, 1]], ["tile_x", "sp", [7, 1, 2, 1]], ["tile_rc", "sp", [128, 2, 1]], ["tile_ry", "sp", [1, 3, 1]], ["tile_rx", "sp", [1, 3, 1]], ["auto_unroll_max_step", "ot", 1500], ["unroll_explicit", "ot", 1]]}], "r": [[0.00014372957166947724], 0, 1.6860589981079102, 1544113155.8697357], "v": 0.1}
{"i": ["cuda", "conv2d_no_batching", [1, 28, 28, 128, 256, 3, 3, [2, 2], [1, 1]], {}, ["conv2d_no_batching", 1, 28, 28, 128, 256, 3, 3, [2, 2], [1, 1]], {"i": 67784176, "t": "", "c": null, "e": [["tile_f", "sp", [16, 2, 4, 1]], ["tile_y", "sp", [7, 1, 2, 1]], ["tile_x", "sp", [1, 1, 14, 1]], ["tile_rc", "sp", [128, 2, 1]], ["tile_ry", "sp", [1, 3, 1]], ["tile_rx", "sp", [1, 3, 1]], ["auto_unroll_max_step", "ot", 1500], ["unroll_explicit", "ot", 1]]}], "r": [[0.000115626652613828], 0, 1.591843605041504, 1544113157.2024825], "v": 0.1}
{"i": ["cuda", "conv2d_no_batching", [1, 28, 28, 128, 256, 3, 3, [2, 2], [1, 1]], {}, ["conv2d_no_batching", 1, 28, 28, 128, 256, 3, 3, [2, 2], [1, 1]], {"i": 69162741, "t": "", "c": null, "e": [["tile_f", "sp", [16, 1, 8, 1]], ["tile_y", "sp", [7, 1, 2, 1]], ["tile_x", "sp", [2, 1, 7, 1]], ["tile_rc", "sp", [128, 2, 1]], ["tile_ry", "sp", [1, 1, 3]], ["tile_rx", "sp", [1, 3, 1]], ["auto_unroll_max_step", "ot", 1500], ["unroll_explicit", "ot", 1]]}], "r": [[0.00012627673271500844], 0, 1.6547117233276367, 1544113158.5340898], "v": 0.1}
{"i": ["cuda", "conv2d_no_batching", [1, 28, 28, 128, 256, 3, 3, [2, 2], [1, 1]], {}, ["conv2d_no_batching", 1, 28, 28, 128, 256, 3, 3, [2, 2], [1, 1]], {"i": 69408501, "t": "", "c": null, "e": [["tile_f", "sp", [16, 1, 8, 1]], ["tile_y", "sp", [7, 1, 2, 1]], ["tile_x", "sp", [2, 1, 7, 1]], ["tile_rc", "sp", [128, 1, 2]], ["tile_ry", "sp", [1, 1, 3]], ["tile_rx", "sp", [1, 3, 1]], ["auto_unroll_max_step", "ot", 1500], ["unroll_explicit", "ot", 1]]}], "r": [[0.0001258707360876897], 0, 1.6104404926300049, 1544113159.8617163], "v": 0.1}
{"i": ["cuda", "conv2d_no_batching", [1, 28, 28, 128, 256, 3, 3, [2, 2], [1, 1]], {}, ["conv2d_no_batching", 1, 28, 28, 128, 256, 3, 3, [2, 2], [1, 1]], {"i": 68029461, "t": "", "c": null, "e": [["tile_f", "sp", [16, 1, 8, 1]], ["tile_y", "sp", [14, 1, 1, 1]], ["tile_x", "sp", [1, 1, 14, 1]], ["tile_rc", "sp", [128, 1, 2]], ["tile_ry", "sp", [1, 3, 1]], ["tile_rx", "sp", [1, 3, 1]], ["auto_unroll_max_step", "ot", 1500], ["unroll_explicit", "ot", 1]]}], "r": [[9.338454215851602e-05], 0, 1.5138239860534668, 1544113161.118148], "v": 0.1}
{"i": ["cuda", "conv2d_no_batching", [1, 28, 28, 128, 256, 3, 3, [2, 2], [1, 1]], {}, ["conv2d_no_batching", 1, 28, 28, 128, 256, 3, 3, [2, 2], [1, 1]], {"i": 71930896, "t": "", "c": null, "e": [["tile_f", "sp", [16, 2, 4, 1]], ["tile_y", "sp", [14, 1, 1, 1]], ["tile_x", "sp", [1, 1, 14, 1]], ["tile_rc", "sp", [128, 2, 1]], ["tile_ry", "sp", [1, 3, 1]], ["tile_rx", "sp", [1, 1, 3]], ["auto_unroll_max_step", "ot", 1500], ["unroll_explicit", "ot", 1]]}], "r": [[9.40049629005059e-05], 0, 1.5502116680145264, 1544113162.3563302], "v": 0.1}
{"i": ["cuda", "conv2d_no_batching", [1, 28, 28, 128, 256, 3, 3, [2, 2], [1, 1]], {}, ["conv2d_no_batching", 1, 28, 28, 128, 256, 3, 3, [2, 2], [1, 1]], {"i": 30458906, "t": "", "c": null, "e": [["tile_f", "sp", [8, 1, 16, 1]], ["tile_y", "sp", [14, 1, 1, 1]], ["tile_x", "sp", [1, 1, 14, 1]], ["tile_rc", "sp", [128, 2, 1]], ["tile_ry", "sp", [1, 3, 1]], ["tile_rx", "sp", [1, 3, 1]], ["auto_unroll_max_step", "ot", 1500], ["unroll_explicit", "ot", 0]]}], "r": [[9.580165092748735e-05], 0, 1.5805363655090332, 1544113163.6193535], "v": 0.1}
{"i": ["cuda", "conv2d_no_batching", [1, 28, 28, 128, 256, 3, 3, [2, 2], [1, 1]], {}, ["conv2d_no_batching", 1, 28, 28, 128, 256, 3, 3, [2, 2], [1, 1]], {"i": 30458901, "t": "", "c": null, "e": [["tile_f", "sp", [16, 1, 8, 1]], ["tile_y", "sp", [14, 1, 1, 1]], ["tile_x", "sp", [1, 1, 14, 1]], ["tile_rc", "sp", [128, 2, 1]], ["tile_ry", "sp", [1, 3, 1]], ["tile_rx", "sp", [1, 3, 1]], ["auto_unroll_max_step", "ot", 1500], ["unroll_explicit", "ot", 0]]}], "r": [[9.999738448566611e-05], 0, 1.536539077758789, 1544113164.9008353], "v": 0.1}
{"i": ["cuda", "conv2d_no_batching", [1, 28, 28, 128, 256, 3, 3, [2, 2], [1, 1]], {}, ["conv2d_no_batching", 1, 28, 28, 128, 256, 3, 3, [2, 2], [1, 1]], {"i": 71923936, "t": "", "c": null, "e": [["tile_f", "sp", [16, 2, 4, 1]], ["tile_y", "sp", [2, 1, 7, 1]], ["tile_x", "sp", [7, 1, 2, 1]], ["tile_rc", "sp", [128, 2, 1]], ["tile_ry", "sp", [1, 3, 1]], ["tile_rx", "sp", [1, 1, 3]], ["auto_unroll_max_step", "ot", 1500], ["unroll_explicit", "ot", 1]]}], "r": [[0.00014498514586846543], 0, 1.754390001296997, 1544113166.3338091], "v": 0.1}
{"i": ["cuda", "conv2d_no_batching", [1, 28, 28, 128, 256, 3, 3, [2, 2], [1, 1]], {}, ["conv2d_no_batching", 1, 28, 28, 128, 256, 3, 3, [2, 2], [1, 1]], {"i": 71927181, "t": "", "c": null, "e": [["tile_f", "sp", [16, 1, 8, 1]], ["tile_y", "sp", [7, 2, 1, 1]], ["tile_x", "sp", [2, 1, 7, 1]], ["tile_rc", "sp", [128, 2, 1]], ["tile_ry", "sp", [1, 3, 1]], ["tile_rx", "sp", [1, 1, 3]], ["auto_unroll_max_step", "ot", 1500], ["unroll_explicit", "ot", 1]]}], "r": [[0.00013553989797639122], 0, 1.645942211151123, 1544113167.6977298], "v": 0.1}
{"i": ["cuda", "conv2d_no_batching", [1, 28, 28, 128, 256, 3, 3, [2, 2], [1, 1]], {}, ["conv2d_no_batching", 1, 28, 28, 128, 256, 3, 3, [2, 2], [1, 1]], {"i": 67784175, "t": "", "c": null, "e": [["tile_f", "sp", [32, 1, 4, 1]], ["tile_y", "sp", [7, 1, 2, 1]], ["tile_x", "sp", [1, 1, 14, 1]], ["tile_rc", "sp", [128, 2, 1]], ["tile_ry", "sp", [1, 3, 1]], ["tile_rx", "sp", [1, 3, 1]], ["auto_unroll_max_step", "ot", 1500], ["unroll_explicit", "ot", 1]]}], "r": [[0.00012490796037099494], 0, 1.624840259552002, 1544113169.048784], "v": 0.1}
{"i": ["cuda", "conv2d_no_batching", [1, 28, 28, 128, 256, 3, 3, [2, 2], [1, 1]], {}, ["conv2d_no_batching", 1, 28, 28, 128, 256, 3, 3, [2, 2], [1, 1]], {"i": 67812502, "t": "", "c": null, "e": [["tile_f", "sp", [8, 2, 8, 1]], ["tile_y", "sp", [14, 1, 1, 1]], ["tile_x", "sp", [1, 2, 7, 1]], ["tile_rc", "sp", [64, 4, 1]], ["tile_ry", "sp", [1, 3, 1]], ["tile_rx", "sp", [1, 3, 1]], ["auto_unroll_max_step", "ot", 1500], ["unroll_explicit", "ot", 1]]}], "r": [[0.00012650462563237774], 0, 1.8278217315673828, 1544113170.4756603], "v": 0.1}
{"i": ["cuda", "conv2d_no_batching", [1, 28, 28, 128, 256, 3, 3, [2, 2], [1, 1]], {}, ["conv2d_no_batching", 1, 28, 28, 128, 256, 3, 3, [2, 2], [1, 1]], {"i": 67789936, "t": "", "c": null, "e": [["tile_f", "sp", [16, 2, 4, 1]], ["tile_y", "sp", [7, 1, 2, 1]], ["tile_x", "sp", [1, 1, 7, 2]], ["tile_rc", "sp", [128, 2, 1]], ["tile_ry", "sp", [1, 3, 1]], ["tile_rx", "sp", [1, 3, 1]], ["auto_unroll_max_step", "ot", 1500], ["unroll_explicit", "ot", 1]]}], "r": [[0.00016402467116357505], 0, 1.8564989566802979, 1544113171.9782503], "v": 0.1}
{"i": ["cuda", "conv2d_no_batching", [1, 28, 28, 128, 256, 3, 3, [2, 2], [1, 1]], {}, ["conv2d_no_batching", 1, 28, 28, 128, 256, 3, 3, [2, 2], [1, 1]], {"i": 72176661, "t": "", "c": null, "e": [["tile_f", "sp", [16, 1, 8, 1]], ["tile_y", "sp", [14, 1, 1, 1]], ["tile_x", "sp", [1, 1, 14, 1]], ["tile_rc", "sp", [128, 1, 2]], ["tile_ry", "sp", [1, 3, 1]], ["tile_rx", "sp", [1, 1, 3]], ["auto_unroll_max_step", "ot", 1500], ["unroll_explicit", "ot", 1]]}], "r": [[0.00010836938954468803], 0, 1.5391268730163574, 1544113173.2842205], "v": 0.1}
{"i": ["cuda", "conv2d_no_batching", [1, 28, 28, 128, 256, 3, 3, [2, 2], [1, 1]], {}, ["conv2d_no_batching", 1, 28, 28, 128, 256, 3, 3, [2, 2], [1, 1]], {"i": 55335136, "t": "", "c": null, "e": [["tile_f", "sp", [16, 2, 4, 1]], ["tile_y", "sp", [2, 1, 7, 1]], ["tile_x", "sp", [7, 1, 2, 1]], ["tile_rc", "sp", [128, 2, 1]], ["tile_ry", "sp", [1, 3, 1]], ["tile_rx", "sp", [1, 3, 1]], ["auto_unroll_max_step", "ot", 512], ["unroll_explicit", "ot", 1]]}], "r": [[0.00014793966273187183], 0, 1.7285912036895752, 1544113174.7236524], "v": 0.1}
{"i": ["cuda", "conv2d_no_batching", [1, 28, 28, 128, 256, 3, 3, [2, 2], [1, 1]], {}, ["conv2d_no_batching", 1, 28, 28, 128, 256, 3, 3, [2, 2], [1, 1]], {"i": 67782261, "t": "", "c": null, "e": [["tile_f", "sp", [16, 1, 8, 1]], ["tile_y", "sp", [7, 1, 2, 1]], ["tile_x", "sp", [1, 2, 7, 1]], ["tile_rc", "sp", [128, 2, 1]], ["tile_ry", "sp", [1, 3, 1]], ["tile_rx", "sp", [1, 3, 1]], ["auto_unroll_max_step", "ot", 1500], ["unroll_explicit", "ot", 1]]}], "r": [[0.0001399488271500843], 0, 1.6851727962493896, 1544113176.143989], "v": 0.1}
{"i": ["cuda", "conv2d_no_batching", [1, 28, 28, 128, 256, 3, 3, [2, 2], [1, 1]], {}, ["conv2d_no_batching", 1, 28, 28, 128, 256, 3, 3, [2, 2], [1, 1]], {"i": 30455181, "t": "", "c": null, "e": [["tile_f", "sp", [16, 1, 8, 1]], ["tile_y", "sp", [7, 2, 1, 1]], ["tile_x", "sp", [2, 1, 7, 1]], ["tile_rc", "sp", [128, 2, 1]], ["tile_ry", "sp", [1, 3, 1]], ["tile_rx", "sp", [1, 3, 1]], ["auto_unroll_max_step", "ot", 1500], ["unroll_explicit", "ot", 0]]}], "r": [[0.00013252343676222597], 0, 1.6910691261291504, 1544113177.5232565], "v": 0.1}
{"i": ["cuda", "conv2d_no_batching", [1, 28, 28, 128, 256, 3, 3, [2, 2], [1, 1]], {}, ["conv2d_no_batching", 1, 28, 28, 128, 256, 3, 3, [2, 2], [1, 1]], {"i": 30455536, "t": "", "c": null, "e": [["tile_f", "sp", [16, 2, 4, 1]], ["tile_y", "sp", [7, 1, 2, 1]], ["tile_x", "sp", [2, 1, 7, 1]], ["tile_rc", "sp", [128, 2, 1]], ["tile_ry", "sp", [1, 3, 1]], ["tile_rx", "sp", [1, 3, 1]], ["auto_unroll_max_step", "ot", 1500], ["unroll_explicit", "ot", 0]]}], "r": [[0.00013271006323777403], 0, 1.6531755924224854, 1544113178.9108832], "v": 0.1}
{"i": ["cuda", "conv2d_no_batching", [1, 28, 28, 128, 256, 3, 3, [2, 2], [1, 1]], {}, ["conv2d_no_batching", 1, 28, 28, 128, 256, 3, 3, [2, 2], [1, 1]], {"i": 68029466, "t": "", "c": null, "e": [["tile_f", "sp", [8, 1, 16, 1]], ["tile_y", "sp", [14, 1, 1, 1]], ["tile_x", "sp", [1, 1, 14, 1]], ["tile_rc", "sp", [128, 1, 2]], ["tile_ry", "sp", [1, 3, 1]], ["tile_rx", "sp", [1, 3, 1]], ["auto_unroll_max_step", "ot", 1500], ["unroll_explicit", "ot", 1]]}], "r": [[9.58566483979764e-05], 0, 1.5070972442626953, 1544113180.1911938], "v": 0.1}
{"i": ["cuda", "conv2d_no_batching", [1, 28, 28, 128, 256, 3, 3, [2, 2], [1, 1]], {}, ["conv2d_no_batching", 1, 28, 28, 128, 256, 3, 3, [2, 2], [1, 1]], {"i": 67781786, "t": "", "c": null, "e": [["tile_f", "sp", [8, 1, 16, 1]], ["tile_y", "sp", [14, 1, 1, 1]], ["tile_x", "sp", [1, 2, 7, 1]], ["tile_rc", "sp", [128, 2, 1]], ["tile_ry", "sp", [1, 3, 1]], ["tile_rx", "sp", [1, 3, 1]], ["auto_unroll_max_step", "ot", 1500], ["unroll_explicit", "ot", 1]]}], "r": [[9.593130016863406e-05], 0, 1.5128412246704102, 1544113181.4412434], "v": 0.1}
{"i": ["cuda", "conv2d_no_batching", [1, 28, 28, 128, 256, 3, 3, [2, 2], [1, 1]], {}, ["conv2d_no_batching", 1, 28, 28, 128, 256, 3, 3, [2, 2], [1, 1]], {"i": 34848501, "t": "", "c": null, "e": [["tile_f", "sp", [16, 1, 8, 1]], ["tile_y", "sp", [7, 1, 2, 1]], ["tile_x", "sp", [2, 1, 7, 1]], ["tile_rc", "sp", [128, 1, 2]], ["tile_ry", "sp", [1, 3, 1]], ["tile_rx", "sp", [1, 1, 3]], ["auto_unroll_max_step", "ot", 1500], ["unroll_explicit", "ot", 0]]}], "r": [[0.00013870035581787523], 0, 1.6645903587341309, 1544113182.8446517], "v": 0.1}
{"i": ["cuda", "conv2d_no_batching", [1, 28, 28, 128, 256, 3, 3, [2, 2], [1, 1]], {}, ["conv2d_no_batching", 1, 28, 28, 128, 256, 3, 3, [2, 2], [1, 1]], {"i": 55584501, "t": "", "c": null, "e": [["tile_f", "sp", [16, 1, 8, 1]], ["tile_y", "sp", [7, 1, 2, 1]], ["tile_x", "sp", [2, 1, 7, 1]], ["tile_rc", "sp", [128, 1, 2]], ["tile_ry", "sp", [1, 3, 1]], ["tile_rx", "sp", [1, 3, 1]], ["auto_unroll_max_step", "ot", 512], ["unroll_explicit", "ot", 1]]}], "r": [[0.00014294620741989883], 0, 1.6598589420318604, 1544113184.2688308], "v": 0.1}
{"i": ["cuda", "conv2d_no_batching", [1, 28, 28, 128, 256, 3, 3, [2, 2], [1, 1]], {}, ["conv2d_no_batching", 1, 28, 28, 128, 256, 3, 3, [2, 2], [1, 1]], {"i": 67814426, "t": "", "c": null, "e": [["tile_f", "sp", [8, 1, 16, 1]], ["tile_y", "sp", [14, 1, 1, 1]], ["tile_x", "sp", [1, 1, 14, 1]], ["tile_rc", "sp", [64, 4, 1]], ["tile_ry", "sp", [1, 3, 1]], ["tile_rx", "sp", [1, 3, 1]], ["auto_unroll_max_step", "ot", 1500], ["unroll_explicit", "ot", 1]]}], "r": [[7.645921173469387e-05], 0, 1.5458300113677979, 1544113195.8679075], "v": 0.1}
{"i": ["cuda", "conv2d_no_batching", [1, 28, 28, 128, 256, 3, 3, [2, 2], [1, 1]], {}, ["conv2d_no_batching", 1, 28, 28, 128, 256, 3, 3, [2, 2], [1, 1]], {"i": 55338736, "t": "", "c": null, "e": [["tile_f", "sp", [16, 2, 4, 1]], ["tile_y", "sp", [7, 1, 2, 1]], ["tile_x", "sp", [2, 1, 7, 1]], ["tile_rc", "sp", [128, 2, 1]], ["tile_ry", "sp", [1, 3, 1]], ["tile_rx", "sp", [1, 3, 1]], ["auto_unroll_max_step", "ot", 512], ["unroll_explicit", "ot", 1]]}], "r": [[0.00012792990303541314], 0, 1.655031442642212, 1544113186.7846303], "v": 0.1}
{"i": ["cuda", "conv2d_no_batching", [1, 28, 28, 128, 256, 3, 3, [2, 2], [1, 1]], {}, ["conv2d_no_batching", 1, 28, 28, 128, 256, 3, 3, [2, 2], [1, 1]], {"i": 34606101, "t": "", "c": null, "e": [["tile_f", "sp", [16, 1, 8, 1]], ["tile_y", "sp", [14, 1, 1, 1]], ["tile_x", "sp", [1, 1, 14, 1]], ["tile_rc", "sp", [128, 2, 1]], ["tile_ry", "sp", [1, 3, 1]], ["tile_rx", "sp", [1, 1, 3]], ["auto_unroll_max_step", "ot", 1500], ["unroll_explicit", "ot", 0]]}], "r": [[0.00010219340303541315], 0, 1.5244925022125244, 1544113188.0563157], "v": 0.1}
{"i": ["cuda", "conv2d_no_batching", [1, 28, 28, 128, 256, 3, 3, [2, 2], [1, 1]], {}, ["conv2d_no_batching", 1, 28, 28, 128, 256, 3, 3, [2, 2], [1, 1]], {"i": 68028021, "t": "", "c": null, "e": [["tile_f", "sp", [16, 1, 8, 1]], ["tile_y", "sp", [7, 1, 2, 1]], ["tile_x", "sp", [1, 2, 7, 1]], ["tile_rc", "sp", [128, 1, 2]], ["tile_ry", "sp", [1, 3, 1]], ["tile_rx", "sp", [1, 3, 1]], ["auto_unroll_max_step", "ot", 1500], ["unroll_explicit", "ot", 1]]}], "r": [[0.00014526584822934234], 0, 1.7218096256256104, 1544113189.5036402], "v": 0.1}
{"i": ["cuda", "conv2d_no_batching", [1, 28, 28, 128, 256, 3, 3, [2, 2], [1, 1]], {}, ["conv2d_no_batching", 1, 28, 28, 128, 256, 3, 3, [2, 2], [1, 1]], {"i": 55342106, "t": "", "c": null, "e": [["tile_f", "sp", [8, 1, 16, 1]], ["tile_y", "sp", [14, 1, 1, 1]], ["tile_x", "sp", [1, 1, 14, 1]], ["tile_rc", "sp", [128, 2, 1]], ["tile_ry", "sp", [1, 3, 1]], ["tile_rx", "sp", [1, 3, 1]], ["auto_unroll_max_step", "ot", 512], ["unroll_explicit", "ot", 1]]}], "r": [[9.541848397976391e-05], 0, 1.496345043182373, 1544113190.7175684], "v": 0.1}
{"i": ["cuda", "conv2d_no_batching", [1, 28, 28, 128, 256, 3, 3, [2, 2], [1, 1]], {}, ["conv2d_no_batching", 1, 28, 28, 128, 256, 3, 3, [2, 2], [1, 1]], {"i": 67781782, "t": "", "c": null, "e": [["tile_f", "sp", [8, 2, 8, 1]], ["tile_y", "sp", [14, 1, 1, 1]], ["tile_x", "sp", [1, 2, 7, 1]], ["tile_rc", "sp", [128, 2, 1]], ["tile_ry", "sp", [1, 3, 1]], ["tile_rx", "sp", [1, 3, 1]], ["auto_unroll_max_step", "ot", 1500], ["unroll_explicit", "ot", 1]]}], "r": [[0.0001402414713322091], 0, 1.7277395725250244, 1544113192.1427057], "v": 0.1}
{"i": ["cuda", "conv2d_no_batching", [1, 28, 28, 128, 256, 3, 3, [2, 2], [1, 1]], {}, ["conv2d_no_batching", 1, 28, 28, 128, 256, 3, 3, [2, 2], [1, 1]], {"i": 30451936, "t": "", "c": null, "e": [["tile_f", "sp", [16, 2, 4, 1]], ["tile_y", "sp", [2, 1, 7, 1]], ["tile_x", "sp", [7, 1, 2, 1]], ["tile_rc", "sp", [128, 2, 1]], ["tile_ry", "sp", [1, 3, 1]], ["tile_rx", "sp", [1, 3, 1]], ["auto_unroll_max_step", "ot", 1500], ["unroll_explicit", "ot", 0]]}], "r": [[0.00015331036160714286], 0, 2.0305428504943848, 1544113210.1759124], "v": 0.1}
{"i": ["cuda", "conv2d_no_batching", [1, 28, 28, 128, 256, 3, 3, [2, 2], [1, 1]], {}, ["conv2d_no_batching", 1, 28, 28, 128, 256, 3, 3, [2, 2], [1, 1]], {"i": 67801701, "t": "", "c": null, "e": [["tile_f", "sp", [16, 1, 8, 1]], ["tile_y", "sp", [2, 1, 7, 1]], ["tile_x", "sp", [7, 2, 1, 1]], ["tile_rc", "sp", [64, 4, 1]], ["tile_ry", "sp", [1, 3, 1]], ["tile_rx", "sp", [1, 3, 1]], ["auto_unroll_max_step", "ot", 1500], ["unroll_explicit", "ot", 1]]}], "r": [[0.00013348747704081633], 0, 1.8888494968414307, 1544113211.7187374], "v": 0.1}
{"i": ["cuda", "conv2d_no_batching", [1, 28, 28, 128, 256, 3, 3, [2, 2], [1, 1]], {}, ["conv2d_no_batching", 1, 28, 28, 128, 256, 3, 3, [2, 2], [1, 1]], {"i": 55311382, "t": "", "c": null, "e": [["tile_f", "sp", [8, 2, 8, 1]], ["tile_y", "sp", [14, 1, 1, 1]], ["tile_x", "sp", [1, 1, 14, 1]], ["tile_rc", "sp", [256, 1, 1]], ["tile_ry", "sp", [1, 3, 1]], ["tile_rx", "sp", [1, 3, 1]], ["auto_unroll_max_step", "ot", 512], ["unroll_explicit", "ot", 1]]}], "r": [[0.00015683535841836736], 0, 1.9523930549621582, 1544113213.3396688], "v": 0.1}
{"i": ["cuda", "conv2d_no_batching", [1, 28, 28, 128, 256, 3, 3, [2, 2], [1, 1]], {}, ["conv2d_no_batching", 1, 28, 28, 128, 256, 3, 3, [2, 2], [1, 1]], {"i": 67783696, "t": "", "c": null, "e": [["tile_f", "sp", [16, 2, 4, 1]], ["tile_y", "sp", [14, 1, 1, 1]], ["tile_x", "sp", [1, 1, 14, 1]], ["tile_rc", "sp", [128, 2, 1]], ["tile_ry", "sp", [1, 3, 1]], ["tile_rx", "sp", [1, 3, 1]], ["auto_unroll_max_step", "ot", 1500], ["unroll_explicit", "ot", 1]]}], "r": [[9.630958545918367e-05], 0, 1.7907965183258057, 1544113214.7686257], "v": 0.1}
{"i": ["cuda", "conv2d_no_batching", [1, 28, 28, 128, 256, 3, 3, [2, 2], [1, 1]], {}, ["conv2d_no_batching", 1, 28, 28, 128, 256, 3, 3, [2, 2], [1, 1]], {"i": 69166101, "t": "", "c": null, "e": [["tile_f", "sp", [16, 1, 8, 1]], ["tile_y", "sp", [14, 1, 1, 1]], ["tile_x", "sp", [1, 1, 14, 1]], ["tile_rc", "sp", [128, 2, 1]], ["tile_ry", "sp", [1, 1, 3]], ["tile_rx", "sp", [1, 3, 1]], ["auto_unroll_max_step", "ot", 1500], ["unroll_explicit", "ot", 1]]}], "r": [[8.861157015306123e-05], 0, 1.6553850173950195, 1544113216.0692196], "v": 0.1}
{"i": ["cuda", "conv2d_no_batching", [1, 28, 28, 128, 256, 3, 3, [2, 2], [1, 1]], {}, ["conv2d_no_batching", 1, 28, 28, 128, 256, 3, 3, [2, 2], [1, 1]], {"i": 30428182, "t": "", "c": null, "e": [["tile_f", "sp", [8, 2, 8, 1]], ["tile_y", "sp", [14, 1, 1, 1]], ["tile_x", "sp", [1, 1, 14, 1]], ["tile_rc", "sp", [256, 1, 1]], ["tile_ry", "sp", [1, 3, 1]], ["tile_rx", "sp", [1, 3, 1]], ["auto_unroll_max_step", "ot", 1500], ["unroll_explicit", "ot", 0]]}], "r": [[0.00015058096364795918], 0, 1.9379730224609375, 1544113217.7048957], "v": 0.1}
{"i": ["cuda", "conv2d_no_batching", [1, 28, 28, 128, 256, 3, 3, [2, 2], [1, 1]], {}, ["conv2d_no_batching", 1, 28, 28, 128, 256, 3, 3, [2, 2], [1, 1]], {"i": 68027546, "t": "", "c": null, "e": [["tile_f", "sp", [8, 1, 16, 1]], ["tile_y", "sp", [14, 1, 1, 1]], ["tile_x", "sp", [1, 2, 7, 1]], ["tile_rc", "sp", [128, 1, 2]], ["tile_ry", "sp", [1, 3, 1]], ["tile_rx", "sp", [1, 3, 1]], ["auto_unroll_max_step", "ot", 1500], ["unroll_explicit", "ot", 1]]}], "r": [[0.00010369433290816326], 0, 1.7289962768554688, 1544113219.146785], "v": 0.1}
{"i": ["cuda", "conv2d_no_batching", [1, 28, 28, 128, 256, 3, 3, [2, 2], [1, 1]], {}, ["conv2d_no_batching", 1, 28, 28, 128, 256, 3, 3, [2, 2], [1, 1]], {"i": 67789462, "t": "", "c": null, "e": [["tile_f", "sp", [8, 2, 8, 1]], ["tile_y", "sp", [14, 1, 1, 1]], ["tile_x", "sp", [1, 1, 7, 2]], ["tile_rc", "sp", [128, 2, 1]], ["tile_ry", "sp", [1, 3, 1]], ["tile_rx", "sp", [1, 3, 1]], ["auto_unroll_max_step", "ot", 1500], ["unroll_explicit", "ot", 1]]}], "r": [[0.00013125245216836736], 0, 1.920867681503296, 1544113220.7021542], "v": 0.1}
{"i": ["cuda", "conv2d_no_batching", [1, 28, 28, 128, 256, 3, 3, [2, 2], [1, 1]], {}, ["conv2d_no_batching", 1, 28, 28, 128, 256, 3, 3, [2, 2], [1, 1]], {"i": 67807461, "t": "", "c": null, "e": [["tile_f", "sp", [16, 1, 8, 1]], ["tile_y", "sp", [2, 1, 7, 1]], ["tile_x", "sp", [7, 1, 2, 1]], ["tile_rc", "sp", [64, 4, 1]], ["tile_ry", "sp", [1, 3, 1]], ["tile_rx", "sp", [1, 3, 1]], ["auto_unroll_max_step", "ot", 1500], ["unroll_explicit", "ot", 1]]}], "r": [[0.00011520592283163265], 0, 1.7630860805511475, 1544113222.1470935], "v": 0.1}
{"i": ["cuda", "conv2d_no_batching", [1, 28, 28, 128, 256, 3, 3, [2, 2], [1, 1]], {}, ["conv2d_no_batching", 1, 28, 28, 128, 256, 3, 3, [2, 2], [1, 1]], {"i": 67812506, "t": "", "c": null, "e": [["tile_f", "sp", [8, 1, 16, 1]], ["tile_y", "sp", [14, 1, 1, 1]], ["tile_x", "sp", [1, 2, 7, 1]], ["tile_rc", "sp", [64, 4, 1]], ["tile_ry", "sp", [1, 3, 1]], ["tile_rx", "sp", [1, 3, 1]], ["auto_unroll_max_step", "ot", 1500], ["unroll_explicit", "ot", 1]]}], "r": [[9.174282908163266e-05], 0, 1.749039649963379, 1544113223.5314832], "v": 0.1}
{"i": ["cuda", "conv2d_no_batching", [1, 28, 28, 128, 256, 3, 3, [2, 2], [1, 1]], {}, ["conv2d_no_batching", 1, 28, 28, 128, 256, 3, 3, [2, 2], [1, 1]], {"i": 30489622, "t": "", "c": null, "e": [["tile_f", "sp", [8, 2, 8, 1]], ["tile_y", "sp", [14, 1, 1, 1]], ["tile_x", "sp", [1, 1, 14, 1]], ["tile_rc", "sp", [64, 4, 1]], ["tile_ry", "sp", [1, 3, 1]], ["tile_rx", "sp", [1, 3, 1]], ["auto_unroll_max_step", "ot", 1500], ["unroll_explicit", "ot", 0]]}], "r": [[8.026589158163266e-05], 0, 1.6516144275665283, 1544113224.8360167], "v": 0.1}
{"i": ["cuda", "conv2d_no_batching", [1, 28, 28, 128, 256, 3, 3, [2, 2], [1, 1]], {}, ["conv2d_no_batching", 1, 28, 28, 128, 256, 3, 3, [2, 2], [1, 1]], {"i": 63667222, "t": "", "c": null, "e": [["tile_f", "sp", [8, 2, 8, 1]], ["tile_y", "sp", [14, 1, 1, 1]], ["tile_x", "sp", [1, 1, 14, 1]], ["tile_rc", "sp", [64, 4, 1]], ["tile_ry", "sp", [1, 3, 1]], ["tile_rx", "sp", [3, 1, 1]], ["auto_unroll_max_step", "ot", 1500], ["unroll_explicit", "ot", 1]]}], "r": [[0.00011689914604591837], 0, 1.7983684539794922, 1544113226.2920718], "v": 0.1}
{"i": ["cuda", "conv2d_no_batching", [1, 28, 28, 128, 256, 3, 3, [2, 2], [1, 1]], {}, ["conv2d_no_batching", 1, 28, 28, 128, 256, 3, 3, [2, 2], [1, 1]], {"i": 71936661, "t": "", "c": null, "e": [["tile_f", "sp", [16, 1, 8, 1]], ["tile_y", "sp", [14, 1, 1, 1]], ["tile_x", "sp", [1, 1, 7, 2]], ["tile_rc", "sp", [128, 2, 1]], ["tile_ry", "sp", [1, 3, 1]], ["tile_rx", "sp", [1, 1, 3]], ["auto_unroll_max_step", "ot", 1500], ["unroll_explicit", "ot", 1]]}], "r": [[0.0001317171862244898], 0, 1.8340377807617188, 1544113227.852632], "v": 0.1}
{"i": ["cuda", "conv2d_no_batching", [1, 28, 28, 128, 256, 3, 3, [2, 2], [1, 1]], {}, ["conv2d_no_batching", 1, 28, 28, 128, 256, 3, 3, [2, 2], [1, 1]], {"i": 48663433, "t": "", "c": null, "e": [["tile_f", "sp", [2, 8, 2, 4]], ["tile_y", "sp", [1, 1, 14, 1]], ["tile_x", "sp", [7, 2, 1, 1]], ["tile_rc", "sp", [128, 1, 2]], ["tile_ry", "sp", [1, 1, 3]], ["tile_rx", "sp", [1, 1, 3]], ["auto_unroll_max_step", "ot", 0], ["unroll_explicit", "ot", 1]]}], "r": [[0.0027278056116071428], 0, 14.269097566604614, 1544113242.0512419], "v": 0.1}
{"i": ["cuda", "conv2d_no_batching", [1, 28, 28, 128, 256, 3, 3, [2, 2], [1, 1]], {}, ["conv2d_no_batching", 1, 28, 28, 128, 256, 3, 3, [2, 2], [1, 1]], {"i": 66049046, "t": "", "c": null, "e": [["tile_f", "sp", [8, 2, 1, 8]], ["tile_y", "sp", [1, 1, 14, 1]], ["tile_x", "sp", [14, 1, 1, 1]], ["tile_rc", "sp", [8, 1, 32]], ["tile_ry", "sp", [1, 1, 3]], ["tile_rx", "sp", [3, 1, 1]], ["auto_unroll_max_step", "ot", 1500], ["unroll_explicit", "ot", 1]]}], "r": [[0.00430094943367347], 0, 27.646352291107178, 1544113267.96994], "v": 0.1}
{"i": ["cuda", "conv2d_no_batching", [1, 28, 28, 128, 256, 3, 3, [2, 2], [1, 1]], {}, ["conv2d_no_batching", 1, 28, 28, 128, 256, 3, 3, [2, 2], [1, 1]], {"i": 59482760, "t": "", "c": null, "e": [["tile_f", "sp", [2, 2, 8, 4]], ["tile_y", "sp", [7, 1, 1, 2]], ["tile_x", "sp", [7, 1, 2, 1]], ["tile_rc", "sp", [128, 2, 1]], ["tile_ry", "sp", [1, 3, 1]], ["tile_rx", "sp", [1, 1, 3]], ["auto_unroll_max_step", "ot", 512], ["unroll_explicit", "ot", 1]]}], "r": [[0.00031156372640306124], 0, 2.9486191272735596, 1544113270.7204254], "v": 0.1}
{"i": ["cuda", "conv2d_no_batching", [1, 28, 28, 128, 256, 3, 3, [2, 2], [1, 1]], {}, ["conv2d_no_batching", 1, 28, 28, 128, 256, 3, 3, [2, 2], [1, 1]], {"i": 65046272, "t": "", "c": null, "e": [["tile_f", "sp", [1, 4, 32, 1]], ["tile_y", "sp", [7, 1, 2, 1]], ["tile_x", "sp", [2, 1, 7, 1]], ["tile_rc", "sp", [64, 4, 1]], ["tile_ry", "sp", [1, 1, 3]], ["tile_rx", "sp", [3, 1, 1]], ["auto_unroll_max_step", "ot", 1500], ["unroll_explicit", "ot", 1]]}], "r": [[0.00021144794961734694], 0, 2.3399837017059326, 1544113336.8411705], "v": 0.1}
{"i": ["cuda", "conv2d_no_batching", [1, 28, 28, 128, 256, 3, 3, [2, 2], [1, 1]], {}, ["conv2d_no_batching", 1, 28, 28, 128, 256, 3, 3, [2, 2], [1, 1]], {"i": 7290217, "t": "", "c": null, "e": [["tile_f", "sp", [2, 1, 8, 8]], ["tile_y", "sp", [1, 1, 1, 14]], ["tile_x", "sp", [7, 1, 2, 1]], ["tile_rc", "sp", [16, 8, 2]], ["tile_ry", "sp", [1, 1, 3]], ["tile_rx", "sp", [1, 3, 1]], ["auto_unroll_max_step", "ot", 0], ["unroll_explicit", "ot", 0]]}], "r": [[0.0017810509942602043], 0, 9.907750606536865, 1544113347.1598043], "v": 0.1}
{"i": ["cuda", "conv2d_no_batching", [1, 28, 28, 128, 256, 3, 3, [2, 2], [1, 1]], {}, ["conv2d_no_batching", 1, 28, 28, 128, 256, 3, 3, [2, 2], [1, 1]], {"i": 33731745, "t": "", "c": null, "e": [["tile_f", "sp", [2, 2, 2, 16]], ["tile_y", "sp", [7, 1, 1, 2]], ["tile_x", "sp", [14, 1, 1, 1]], ["tile_rc", "sp", [32, 2, 4]], ["tile_ry", "sp", [3, 1, 1]], ["tile_rx", "sp", [1, 1, 3]], ["auto_unroll_max_step", "ot", 1500], ["unroll_explicit", "ot", 0]]}], "r": [[0.0010327453341836736], 0, 7.9282495975494385, 1544113387.3903785], "v": 0.1}
{"i": ["cuda", "conv2d_no_batching", [1, 28, 28, 128, 256, 3, 3, [2, 2], [1, 1]], {}, ["conv2d_no_batching", 1, 28, 28, 128, 256, 3, 3, [2, 2], [1, 1]], {"i": 67810586, "t": "", "c": null, "e": [["tile_f", "sp", [8, 1, 16, 1]], ["tile_y", "sp", [14, 1, 1, 1]], ["tile_x", "sp", [2, 1, 7, 1]], ["tile_rc", "sp", [64, 4, 1]], ["tile_ry", "sp", [1, 3, 1]], ["tile_rx", "sp", [1, 3, 1]], ["auto_unroll_max_step", "ot", 1500], ["unroll_explicit", "ot", 1]]}], "r": [[0.00011431672130102041], 0, 1.7845544815063477, 1544113482.6383755], "v": 0.1}
{"i": ["cuda", "conv2d_no_batching", [1, 28, 28, 128, 256, 3, 3, [2, 2], [1, 1]], {}, ["conv2d_no_batching", 1, 28, 28, 128, 256, 3, 3, [2, 2], [1, 1]], {"i": 55368986, "t": "", "c": null, "e": [["tile_f", "sp", [8, 1, 16, 1]], ["tile_y", "sp", [14, 1, 1, 1]], ["tile_x", "sp", [2, 1, 7, 1]], ["tile_rc", "sp", [64, 4, 1]], ["tile_ry", "sp", [1, 3, 1]], ["tile_rx", "sp", [1, 3, 1]], ["auto_unroll_max_step", "ot", 512], ["unroll_explicit", "ot", 1]]}], "r": [[0.00010076124298469388], 0, 1.7153356075286865, 1544113484.0214272], "v": 0.1}
{"i": ["cuda", "conv2d_no_batching", [1, 28, 28, 128, 256, 3, 3, [2, 2], [1, 1]], {}, ["conv2d_no_batching", 1, 28, 28, 128, 256, 3, 3, [2, 2], [1, 1]], {"i": 42927386, "t": "", "c": null, "e": [["tile_f", "sp", [8, 1, 16, 1]], ["tile_y", "sp", [14, 1, 1, 1]], ["tile_x", "sp", [2, 1, 7, 1]], ["tile_rc", "sp", [64, 4, 1]], ["tile_ry", "sp", [1, 3, 1]], ["tile_rx", "sp", [1, 3, 1]], ["auto_unroll_max_step", "ot", 0], ["unroll_explicit", "ot", 1]]}], "r": [[0.0001011845911989796], 0, 1.711043357849121, 1544113485.4726474], "v": 0.1}
{"i": ["cuda", "conv2d_no_batching", [1, 28, 28, 128, 256, 3, 3, [2, 2], [1, 1]], {}, ["conv2d_no_batching", 1, 28, 28, 128, 256, 3, 3, [2, 2], [1, 1]], {"i": 30485786, "t": "", "c": null, "e": [["tile_f", "sp", [8, 1, 16, 1]], ["tile_y", "sp", [14, 1, 1, 1]], ["tile_x", "sp", [2, 1, 7, 1]], ["tile_rc", "sp", [64, 4, 1]], ["tile_ry", "sp", [1, 3, 1]], ["tile_rx", "sp", [1, 3, 1]], ["auto_unroll_max_step", "ot", 1500], ["unroll_explicit", "ot", 0]]}], "r": [[0.00010118933801020409], 0, 1.669553279876709, 1544113486.8200753], "v": 0.1}
{"i": ["cuda", "conv2d_no_batching", [1, 28, 28, 128, 256, 3, 3, [2, 2], [1, 1]], {}, ["conv2d_no_batching", 1, 28, 28, 128, 256, 3, 3, [2, 2], [1, 1]], {"i": 18044186, "t": "", "c": null, "e": [["tile_f", "sp", [8, 1, 16, 1]], ["tile_y", "sp", [14, 1, 1, 1]], ["tile_x", "sp", [2, 1, 7, 1]], ["tile_rc", "sp", [64, 4, 1]], ["tile_ry", "sp", [1, 3, 1]], ["tile_rx", "sp", [1, 3, 1]], ["auto_unroll_max_step", "ot", 512], ["unroll_explicit", "ot", 0]]}], "r": [[0.00010118938073979592], 0, 1.7633352279663086, 1544113488.2096992], "v": 0.1}
{"i": ["cuda", "conv2d_no_batching", [1, 28, 28, 128, 256, 3, 3, [2, 2], [1, 1]], {}, ["conv2d_no_batching", 1, 28, 28, 128, 256, 3, 3, [2, 2], [1, 1]], {"i": 67779866, "t": "", "c": null, "e": [["tile_f", "sp", [8, 1, 16, 1]], ["tile_y", "sp", [14, 1, 1, 1]], ["tile_x", "sp", [2, 1, 7, 1]], ["tile_rc", "sp", [128, 2, 1]], ["tile_ry", "sp", [1, 3, 1]], ["tile_rx", "sp", [1, 3, 1]], ["auto_unroll_max_step", "ot", 1500], ["unroll_explicit", "ot", 1]]}], "r": [[9.935044260204081e-05], 0, 1.6901614665985107, 1544113489.5924888], "v": 0.1}
{"i": ["cuda", "conv2d_no_batching", [1, 28, 28, 128, 256, 3, 3, [2, 2], [1, 1]], {}, ["conv2d_no_batching", 1, 28, 28, 128, 256, 3, 3, [2, 2], [1, 1]], {"i": 55338266, "t": "", "c": null, "e": [["tile_f", "sp", [8, 1, 16, 1]], ["tile_y", "sp", [14, 1, 1, 1]], ["tile_x", "sp", [2, 1, 7, 1]], ["tile_rc", "sp", [128, 2, 1]], ["tile_ry", "sp", [1, 3, 1]], ["tile_rx", "sp", [1, 3, 1]], ["auto_unroll_max_step", "ot", 512], ["unroll_explicit", "ot", 1]]}], "r": [[9.937752168367347e-05], 0, 1.6384923458099365, 1544113490.964631], "v": 0.1}
{"i": ["cuda", "conv2d_no_batching", [1, 28, 28, 128, 256, 3, 3, [2, 2], [1, 1]], {}, ["conv2d_no_batching", 1, 28, 28, 128, 256, 3, 3, [2, 2], [1, 1]], {"i": 55372822, "t": "", "c": null, "e": [["tile_f", "sp", [8, 2, 8, 1]], ["tile_y", "sp", [14, 1, 1, 1]], ["tile_x", "sp", [1, 1, 14, 1]], ["tile_rc", "sp", [64, 4, 1]], ["tile_ry", "sp", [1, 3, 1]], ["tile_rx", "sp", [1, 3, 1]], ["auto_unroll_max_step", "ot", 512], ["unroll_explicit", "ot", 1]]}], "r": [[6.409780407124682e-05], 0, 1.5846600532531738, 1544113548.959221], "v": 0.1}
{"i": ["cuda", "conv2d_no_batching", [1, 28, 28, 128, 256, 3, 3, [2, 2], [1, 1]], {}, ["conv2d_no_batching", 1, 28, 28, 128, 256, 3, 3, [2, 2], [1, 1]], {"i": 42896666, "t": "", "c": null, "e": [["tile_f", "sp", [8, 1, 16, 1]], ["tile_y", "sp", [14, 1, 1, 1]], ["tile_x", "sp", [2, 1, 7, 1]], ["tile_rc", "sp", [128, 2, 1]], ["tile_ry", "sp", [1, 3, 1]], ["tile_rx", "sp", [1, 3, 1]], ["auto_unroll_max_step", "ot", 0], ["unroll_explicit", "ot", 1]]}], "r": [[9.81405038265306e-05], 0, 1.7142152786254883, 1544113493.55013], "v": 0.1}
{"i": ["cuda", "conv2d_no_batching", [1, 28, 28, 128, 256, 3, 3, [2, 2], [1, 1]], {}, ["conv2d_no_batching", 1, 28, 28, 128, 256, 3, 3, [2, 2], [1, 1]], {"i": 5602586, "t": "", "c": null, "e": [["tile_f", "sp", [8, 1, 16, 1]], ["tile_y", "sp", [14, 1, 1, 1]], ["tile_x", "sp", [2, 1, 7, 1]], ["tile_rc", "sp", [64, 4, 1]], ["tile_ry", "sp", [1, 3, 1]], ["tile_rx", "sp", [1, 3, 1]], ["auto_unroll_max_step", "ot", 0], ["unroll_explicit", "ot", 0]]}], "r": [[0.00010119086798469387], 0, 1.645928144454956, 1544113494.9320877], "v": 0.1}
{"i": ["cuda", "conv2d_no_batching", [1, 28, 28, 128, 256, 3, 3, [2, 2], [1, 1]], {}, ["conv2d_no_batching", 1, 28, 28, 128, 256, 3, 3, [2, 2], [1, 1]], {"i": 30455066, "t": "", "c": null, "e": [["tile_f", "sp", [8, 1, 16, 1]], ["tile_y", "sp", [14, 1, 1, 1]], ["tile_x", "sp", [2, 1, 7, 1]], ["tile_rc", "sp", [128, 2, 1]], ["tile_ry", "sp", [1, 3, 1]], ["tile_rx", "sp", [1, 3, 1]], ["auto_unroll_max_step", "ot", 1500], ["unroll_explicit", "ot", 0]]}], "r": [[9.81181581632653e-05], 0, 1.6144237518310547, 1544113496.2964418], "v": 0.1}
{"i": ["cuda", "conv2d_no_batching", [1, 28, 28, 128, 256, 3, 3, [2, 2], [1, 1]], {}, ["conv2d_no_batching", 1, 28, 28, 128, 256, 3, 3, [2, 2], [1, 1]], {"i": 18013466, "t": "", "c": null, "e": [["tile_f", "sp", [8, 1, 16, 1]], ["tile_y", "sp", [14, 1, 1, 1]], ["tile_x", "sp", [2, 1, 7, 1]], ["tile_rc", "sp", [128, 2, 1]], ["tile_ry", "sp", [1, 3, 1]], ["tile_rx", "sp", [1, 3, 1]], ["auto_unroll_max_step", "ot", 512], ["unroll_explicit", "ot", 0]]}], "r": [[9.813062946428572e-05], 0, 1.651611566543579, 1544113497.6466322], "v": 0.1}
{"i": ["cuda", "conv2d_no_batching", [1, 28, 28, 128, 256, 3, 3, [2, 2], [1, 1]], {}, ["conv2d_no_batching", 1, 28, 28, 128, 256, 3, 3, [2, 2], [1, 1]], {"i": 67789466, "t": "", "c": null, "e": [["tile_f", "sp", [8, 1, 16, 1]], ["tile_y", "sp", [14, 1, 1, 1]], ["tile_x", "sp", [1, 1, 7, 2]], ["tile_rc", "sp", [128, 2, 1]], ["tile_ry", "sp", [1, 3, 1]], ["tile_rx", "sp", [1, 3, 1]], ["auto_unroll_max_step", "ot", 1500], ["unroll_explicit", "ot", 1]]}], "r": [[9.83683131377551e-05], 0, 1.7266111373901367, 1544113499.0783637], "v": 0.1}
{"i": ["cuda", "conv2d_no_batching", [1, 28, 28, 128, 256, 3, 3, [2, 2], [1, 1]], {}, ["conv2d_no_batching", 1, 28, 28, 128, 256, 3, 3, [2, 2], [1, 1]], {"i": 42931222, "t": "", "c": null, "e": [["tile_f", "sp", [8, 2, 8, 1]], ["tile_y", "sp", [14, 1, 1, 1]], ["tile_x", "sp", [1, 1, 14, 1]], ["tile_rc", "sp", [64, 4, 1]], ["tile_ry", "sp", [1, 3, 1]], ["tile_rx", "sp", [1, 3, 1]], ["auto_unroll_max_step", "ot", 0], ["unroll_explicit", "ot", 1]]}], "r": [[8.478242920918367e-05], 0, 1.6498949527740479, 1544113500.4057262], "v": 0.1}
{"i": ["cuda", "conv2d_no_batching", [1, 28, 28, 128, 256, 3, 3, [2, 2], [1, 1]], {}, ["conv2d_no_batching", 1, 28, 28, 128, 256, 3, 3, [2, 2], [1, 1]], {"i": 55347866, "t": "", "c": null, "e": [["tile_f", "sp", [8, 1, 16, 1]], ["tile_y", "sp", [14, 1, 1, 1]], ["tile_x", "sp", [1, 1, 7, 2]], ["tile_rc", "sp", [128, 2, 1]], ["tile_ry", "sp", [1, 3, 1]], ["tile_rx", "sp", [1, 3, 1]], ["auto_unroll_max_step", "ot", 512], ["unroll_explicit", "ot", 1]]}], "r": [[9.818028571428571e-05], 0, 1.6026849746704102, 1544113501.7849867], "v": 0.1}
{"i": ["cuda", "conv2d_no_batching", [1, 28, 28, 128, 256, 3, 3, [2, 2], [1, 1]], {}, ["conv2d_no_batching", 1, 28, 28, 128, 256, 3, 3, [2, 2], [1, 1]], {"i": 5571866, "t": "", "c": null, "e": [["tile_f", "sp", [8, 1, 16, 1]], ["tile_y", "sp", [14, 1, 1, 1]], ["tile_x", "sp", [2, 1, 7, 1]], ["tile_rc", "sp", [128, 2, 1]], ["tile_ry", "sp", [1, 3, 1]], ["tile_rx", "sp", [1, 3, 1]], ["auto_unroll_max_step", "ot", 0], ["unroll_explicit", "ot", 0]]}], "r": [[9.812960650510204e-05], 0, 1.6459870338439941, 1544113503.119555], "v": 0.1}
{"i": ["cuda", "conv2d_no_batching", [1, 28, 28, 128, 256, 3, 3, [2, 2], [1, 1]], {}, ["conv2d_no_batching", 1, 28, 28, 128, 256, 3, 3, [2, 2], [1, 1]], {"i": 18048022, "t": "", "c": null, "e": [["tile_f", "sp", [8, 2, 8, 1]], ["tile_y", "sp", [14, 1, 1, 1]], ["tile_x", "sp", [1, 1, 14, 1]], ["tile_rc", "sp", [64, 4, 1]], ["tile_ry", "sp", [1, 3, 1]], ["tile_rx", "sp", [1, 3, 1]], ["auto_unroll_max_step", "ot", 512], ["unroll_explicit", "ot", 0]]}], "r": [[8.033425765306122e-05], 0, 1.6146631240844727, 1544113504.443275], "v": 0.1}
{"i": ["cuda", "conv2d_no_batching", [1, 28, 28, 128, 256, 3, 3, [2, 2], [1, 1]], {}, ["conv2d_no_batching", 1, 28, 28, 128, 256, 3, 3, [2, 2], [1, 1]], {"i": 67780946, "t": "", "c": null, "e": [["tile_f", "sp", [8, 1, 16, 1]], ["tile_y", "sp", [7, 1, 1, 2]], ["tile_x", "sp", [2, 1, 7, 1]], ["tile_rc", "sp", [128, 2, 1]], ["tile_ry", "sp", [1, 3, 1]], ["tile_rx", "sp", [1, 3, 1]], ["auto_unroll_max_step", "ot", 1500], ["unroll_explicit", "ot", 1]]}], "r": [[8.921276913265305e-05], 0, 1.6989009380340576, 1544113505.7982602], "v": 0.1}
{"i": ["cuda", "conv2d_no_batching", [1, 28, 28, 128, 256, 3, 3, [2, 2], [1, 1]], {}, ["conv2d_no_batching", 1, 28, 28, 128, 256, 3, 3, [2, 2], [1, 1]], {"i": 55340186, "t": "", "c": null, "e": [["tile_f", "sp", [8, 1, 16, 1]], ["tile_y", "sp", [14, 1, 1, 1]], ["tile_x", "sp", [1, 2, 7, 1]], ["tile_rc", "sp", [128, 2, 1]], ["tile_ry", "sp", [1, 3, 1]], ["tile_rx", "sp", [1, 3, 1]], ["auto_unroll_max_step", "ot", 512], ["unroll_explicit", "ot", 1]]}], "r": [[9.586601339285714e-05], 0, 1.6147491931915283, 1544113507.124708], "v": 0.1}
{"i": ["cuda", "conv2d_no_batching", [1, 28, 28, 128, 256, 3, 3, [2, 2], [1, 1]], {}, ["conv2d_no_batching", 1, 28, 28, 128, 256, 3, 3, [2, 2], [1, 1]], {"i": 55339346, "t": "", "c": null, "e": [["tile_f", "sp", [8, 1, 16, 1]], ["tile_y", "sp", [7, 1, 1, 2]], ["tile_x", "sp", [2, 1, 7, 1]], ["tile_rc", "sp", [128, 2, 1]], ["tile_ry", "sp", [1, 3, 1]], ["tile_rx", "sp", [1, 3, 1]], ["auto_unroll_max_step", "ot", 512], ["unroll_explicit", "ot", 1]]}], "r": [[8.910755484693878e-05], 0, 1.6601300239562988, 1544113508.4440093], "v": 0.1}
{"i": ["cuda", "conv2d_no_batching", [1, 28, 28, 128, 256, 3, 3, [2, 2], [1, 1]], {}, ["conv2d_no_batching", 1, 28, 28, 128, 256, 3, 3, [2, 2], [1, 1]], {"i": 42906266, "t": "", "c": null, "e": [["tile_f", "sp", [8, 1, 16, 1]], ["tile_y", "sp", [14, 1, 1, 1]], ["tile_x", "sp", [1, 1, 7, 2]], ["tile_rc", "sp", [128, 2, 1]], ["tile_ry", "sp", [1, 3, 1]], ["tile_rx", "sp", [1, 3, 1]], ["auto_unroll_max_step", "ot", 0], ["unroll_explicit", "ot", 1]]}], "r": [[0.00010369368813775511], 0, 1.7288150787353516, 1544113509.8784313], "v": 0.1}
{"i": ["cuda", "conv2d_no_batching", [1, 28, 28, 128, 256, 3, 3, [2, 2], [1, 1]], {}, ["conv2d_no_batching", 1, 28, 28, 128, 256, 3, 3, [2, 2], [1, 1]], {"i": 5606422, "t": "", "c": null, "e": [["tile_f", "sp", [8, 2, 8, 1]], ["tile_y", "sp", [14, 1, 1, 1]], ["tile_x", "sp", [1, 1, 14, 1]], ["tile_rc", "sp", [64, 4, 1]], ["tile_ry", "sp", [1, 3, 1]], ["tile_rx", "sp", [1, 3, 1]], ["auto_unroll_max_step", "ot", 0], ["unroll_explicit", "ot", 0]]}], "r": [[8.492455803571428e-05], 0, 1.5935325622558594, 1544113511.1911974], "v": 0.1}
{"i": ["cuda", "conv2d_no_batching", [1, 28, 28, 128, 256, 3, 3, [2, 2], [1, 1]], {}, ["conv2d_no_batching", 1, 28, 28, 128, 256, 3, 3, [2, 2], [1, 1]], {"i": 42898586, "t": "", "c": null, "e": [["tile_f", "sp", [8, 1, 16, 1]], ["tile_y", "sp", [14, 1, 1, 1]], ["tile_x", "sp", [1, 2, 7, 1]], ["tile_rc", "sp", [128, 2, 1]], ["tile_ry", "sp", [1, 3, 1]], ["tile_rx", "sp", [1, 3, 1]], ["auto_unroll_max_step", "ot", 0], ["unroll_explicit", "ot", 1]]}], "r": [[9.696072002551021e-05], 0, 1.5952603816986084, 1544113512.52202], "v": 0.1}
{"i": ["cuda", "conv2d_no_batching", [1, 28, 28, 128, 256, 3, 3, [2, 2], [1, 1]], {}, ["conv2d_no_batching", 1, 28, 28, 128, 256, 3, 3, [2, 2], [1, 1]], {"i": 42897746, "t": "", "c": null, "e": [["tile_f", "sp", [8, 1, 16, 1]], ["tile_y", "sp", [7, 1, 1, 2]], ["tile_x", "sp", [2, 1, 7, 1]], ["tile_rc", "sp", [128, 2, 1]], ["tile_ry", "sp", [1, 3, 1]], ["tile_rx", "sp", [1, 3, 1]], ["auto_unroll_max_step", "ot", 0], ["unroll_explicit", "ot", 1]]}], "r": [[0.00011336830293367346], 0, 1.7002484798431396, 1544113513.9396973], "v": 0.1}
{"i": ["cuda", "conv2d_no_batching", [1, 28, 28, 128, 256, 3, 3, [2, 2], [1, 1]], {}, ["conv2d_no_batching", 1, 28, 28, 128, 256, 3, 3, [2, 2], [1, 1]], {"i": 55372826, "t": "", "c": null, "e": [["tile_f", "sp", [8, 1, 16, 1]], ["tile_y", "sp", [14, 1, 1, 1]], ["tile_x", "sp", [1, 1, 14, 1]], ["tile_rc", "sp", [64, 4, 1]], ["tile_ry", "sp", [1, 3, 1]], ["tile_rx", "sp", [1, 3, 1]], ["auto_unroll_max_step", "ot", 512], ["unroll_explicit", "ot", 1]]}], "r": [[7.59911906887755e-05], 0, 1.5845375061035156, 1544113515.18788], "v": 0.1}
{"i": ["cuda", "conv2d_no_batching", [1, 28, 28, 128, 256, 3, 3, [2, 2], [1, 1]], {}, ["conv2d_no_batching", 1, 28, 28, 128, 256, 3, 3, [2, 2], [1, 1]], {"i": 30464666, "t": "", "c": null, "e": [["tile_f", "sp", [8, 1, 16, 1]], ["tile_y", "sp", [14, 1, 1, 1]], ["tile_x", "sp", [1, 1, 7, 2]], ["tile_rc", "sp", [128, 2, 1]], ["tile_ry", "sp", [1, 3, 1]], ["tile_rx", "sp", [1, 3, 1]], ["auto_unroll_max_step", "ot", 1500], ["unroll_explicit", "ot", 0]]}], "r": [[9.95035331632653e-05], 0, 1.674962043762207, 1544113516.604414], "v": 0.1}
{"i": ["cuda", "conv2d_no_batching", [1, 28, 28, 128, 256, 3, 3, [2, 2], [1, 1]], {}, ["conv2d_no_batching", 1, 28, 28, 128, 256, 3, 3, [2, 2], [1, 1]], {"i": 67810706, "t": "", "c": null, "e": [["tile_f", "sp", [8, 1, 16, 1]], ["tile_y", "sp", [7, 2, 1, 1]], ["tile_x", "sp", [2, 1, 7, 1]], ["tile_rc", "sp", [64, 4, 1]], ["tile_ry", "sp", [1, 3, 1]], ["tile_rx", "sp", [1, 3, 1]], ["auto_unroll_max_step", "ot", 1500], ["unroll_explicit", "ot", 1]]}], "r": [[9.925986096938776e-05], 0, 1.7691936492919922, 1544113518.0393975], "v": 0.1}
{"i": ["cuda", "conv2d_no_batching", [1, 28, 28, 128, 256, 3, 3, [2, 2], [1, 1]], {}, ["conv2d_no_batching", 1, 28, 28, 128, 256, 3, 3, [2, 2], [1, 1]], {"i": 18023066, "t": "", "c": null, "e": [["tile_f", "sp", [8, 1, 16, 1]], ["tile_y", "sp", [14, 1, 1, 1]], ["tile_x", "sp", [1, 1, 7, 2]], ["tile_rc", "sp", [128, 2, 1]], ["tile_ry", "sp", [1, 3, 1]], ["tile_rx", "sp", [1, 3, 1]], ["auto_unroll_max_step", "ot", 512], ["unroll_explicit", "ot", 0]]}], "r": [[9.950309630102042e-05], 0, 1.615612506866455, 1544113519.3497539], "v": 0.1}
{"i": ["cuda", "conv2d_no_batching", [1, 28, 28, 128, 256, 3, 3, [2, 2], [1, 1]], {}, ["conv2d_no_batching", 1, 28, 28, 128, 256, 3, 3, [2, 2], [1, 1]], {"i": 55369106, "t": "", "c": null, "e": [["tile_f", "sp", [8, 1, 16, 1]], ["tile_y", "sp", [7, 2, 1, 1]], ["tile_x", "sp", [2, 1, 7, 1]], ["tile_rc", "sp", [64, 4, 1]], ["tile_ry", "sp", [1, 3, 1]], ["tile_rx", "sp", [1, 3, 1]], ["auto_unroll_max_step", "ot", 512], ["unroll_explicit", "ot", 1]]}], "r": [[9.921527869897959e-05], 0, 1.7140867710113525, 1544113520.7091587], "v": 0.1}
{"i": ["cuda", "conv2d_no_batching", [1, 28, 28, 128, 256, 3, 3, [2, 2], [1, 1]], {}, ["conv2d_no_batching", 1, 28, 28, 128, 256, 3, 3, [2, 2], [1, 1]], {"i": 67841306, "t": "", "c": null, "e": [["tile_f", "sp", [8, 1, 16, 1]], ["tile_y", "sp", [14, 1, 1, 1]], ["tile_x", "sp", [2, 1, 7, 1]], ["tile_rc", "sp", [32, 8, 1]], ["tile_ry", "sp", [1, 3, 1]], ["tile_rx", "sp", [1, 3, 1]], ["auto_unroll_max_step", "ot", 1500], ["unroll_explicit", "ot", 1]]}], "r": [[0.00013409439158163265], 0, 2.0008716583251953, 1544113522.3513277], "v": 0.1}
{"i": ["cuda", "conv2d_no_batching", [1, 28, 28, 128, 256, 3, 3, [2, 2], [1, 1]], {}, ["conv2d_no_batching", 1, 28, 28, 128, 256, 3, 3, [2, 2], [1, 1]], {"i": 55399706, "t": "", "c": null, "e": [["tile_f", "sp", [8, 1, 16, 1]], ["tile_y", "sp", [14, 1, 1, 1]], ["tile_x", "sp", [2, 1, 7, 1]], ["tile_rc", "sp", [32, 8, 1]], ["tile_ry", "sp", [1, 3, 1]], ["tile_rx", "sp", [1, 3, 1]], ["auto_unroll_max_step", "ot", 512], ["unroll_explicit", "ot", 1]]}], "r": [[0.00013472148724489797], 0, 1.9137063026428223, 1544113523.877295], "v": 0.1}
{"i": ["cuda", "conv2d_no_batching", [1, 28, 28, 128, 256, 3, 3, [2, 2], [1, 1]], {}, ["conv2d_no_batching", 1, 28, 28, 128, 256, 3, 3, [2, 2], [1, 1]], {"i": 51252506, "t": "", "c": null, "e": [["tile_f", "sp", [8, 1, 16, 1]], ["tile_y", "sp", [14, 1, 1, 1]], ["tile_x", "sp", [2, 1, 7, 1]], ["tile_rc", "sp", [32, 8, 1]], ["tile_ry", "sp", [1, 3, 1]], ["tile_rx", "sp", [3, 1, 1]], ["auto_unroll_max_step", "ot", 512], ["unroll_explicit", "ot", 1]]}], "r": [[0.0001467618137755102], 0, 1.9933738708496094, 1544113525.5583725], "v": 0.1}
{"i": ["cuda", "conv2d_no_batching", [1, 28, 28, 128, 256, 3, 3, [2, 2], [1, 1]], {}, ["conv2d_no_batching", 1, 28, 28, 128, 256, 3, 3, [2, 2], [1, 1]], {"i": 30456146, "t": "", "c": null, "e": [["tile_f", "sp", [8, 1, 16, 1]], ["tile_y", "sp", [7, 1, 1, 2]], ["tile_x", "sp", [2, 1, 7, 1]], ["tile_rc", "sp", [128, 2, 1]], ["tile_ry", "sp", [1, 3, 1]], ["tile_rx", "sp", [1, 3, 1]], ["auto_unroll_max_step", "ot", 1500], ["unroll_explicit", "ot", 0]]}], "r": [[0.00010296939732142858], 0, 1.7301907539367676, 1544113526.949156], "v": 0.1}
{"i": ["cuda", "conv2d_no_batching", [1, 28, 28, 128, 256, 3, 3, [2, 2], [1, 1]], {}, ["conv2d_no_batching", 1, 28, 28, 128, 256, 3, 3, [2, 2], [1, 1]], {"i": 18014546, "t": "", "c": null, "e": [["tile_f", "sp", [8, 1, 16, 1]], ["tile_y", "sp", [7, 1, 1, 2]], ["tile_x", "sp", [2, 1, 7, 1]], ["tile_rc", "sp", [128, 2, 1]], ["tile_ry", "sp", [1, 3, 1]], ["tile_rx", "sp", [1, 3, 1]], ["auto_unroll_max_step", "ot", 512], ["unroll_explicit", "ot", 0]]}], "r": [[0.00010317342155612244], 0, 1.6040289402008057, 1544113528.2756207], "v": 0.1}
{"i": ["cuda", "conv2d_no_batching", [1, 28, 28, 128, 256, 3, 3, [2, 2], [1, 1]], {}, ["conv2d_no_batching", 1, 28, 28, 128, 256, 3, 3, [2, 2], [1, 1]], {"i": 63694106, "t": "", "c": null, "e": [["tile_f", "sp", [8, 1, 16, 1]], ["tile_y", "sp", [14, 1, 1, 1]], ["tile_x", "sp", [2, 1, 7, 1]], ["tile_rc", "sp", [32, 8, 1]], ["tile_ry", "sp", [1, 3, 1]], ["tile_rx", "sp", [3, 1, 1]], ["auto_unroll_max_step", "ot", 1500], ["unroll_explicit", "ot", 1]]}], "r": [[0.0001468141237244898], 0, 2.0187618732452393, 1544113529.9137425], "v": 0.1}
{"i": ["cuda", "conv2d_no_batching", [1, 28, 28, 128, 256, 3, 3, [2, 2], [1, 1]], {}, ["conv2d_no_batching", 1, 28, 28, 128, 256, 3, 3, [2, 2], [1, 1]], {"i": 5581466, "t": "", "c": null, "e": [["tile_f", "sp", [8, 1, 16, 1]], ["tile_y", "sp", [14, 1, 1, 1]], ["tile_x", "sp", [1, 1, 7, 2]], ["tile_rc", "sp", [128, 2, 1]], ["tile_ry", "sp", [1, 3, 1]], ["tile_rx", "sp", [1, 3, 1]], ["auto_unroll_max_step", "ot", 0], ["unroll_explicit", "ot", 0]]}], "r": [[0.00010415142984693878], 0, 1.6684801578521729, 1544113531.2500367], "v": 0.1}
{"i": ["cuda", "conv2d_no_batching", [1, 28, 28, 128, 256, 3, 3, [2, 2], [1, 1]], {}, ["conv2d_no_batching", 1, 28, 28, 128, 256, 3, 3, [2, 2], [1, 1]], {"i": 67811062, "t": "", "c": null, "e": [["tile_f", "sp", [8, 2, 8, 1]], ["tile_y", "sp", [7, 1, 2, 1]], ["tile_x", "sp", [2, 1, 7, 1]], ["tile_rc", "sp", [64, 4, 1]], ["tile_ry", "sp", [1, 3, 1]], ["tile_rx", "sp", [1, 3, 1]], ["auto_unroll_max_step", "ot", 1500], ["unroll_explicit", "ot", 1]]}], "r": [[9.34614368622449e-05], 0, 1.7255747318267822, 1544113532.6499116], "v": 0.1}
{"i": ["cuda", "conv2d_no_batching", [1, 28, 28, 128, 256, 3, 3, [2, 2], [1, 1]], {}, ["conv2d_no_batching", 1, 28, 28, 128, 256, 3, 3, [2, 2], [1, 1]], {"i": 55369018, "t": "", "c": null, "e": [["tile_f", "sp", [4, 1, 16, 2]], ["tile_y", "sp", [14, 1, 1, 1]], ["tile_x", "sp", [2, 1, 7, 1]], ["tile_rc", "sp", [64, 4, 1]], ["tile_ry", "sp", [1, 3, 1]], ["tile_rx", "sp", [1, 3, 1]], ["auto_unroll_max_step", "ot", 512], ["unroll_explicit", "ot", 1]]}], "r": [[0.00010649574362244897], 0, 1.9194209575653076, 1544113534.1919577], "v": 0.1}
{"i": ["cuda", "conv2d_no_batching", [1, 28, 28, 128, 256, 3, 3, [2, 2], [1, 1]], {}, ["conv2d_no_batching", 1, 28, 28, 128, 256, 3, 3, [2, 2], [1, 1]], {"i": 55369462, "t": "", "c": null, "e": [["tile_f", "sp", [8, 2, 8, 1]], ["tile_y", "sp", [7, 1, 2, 1]], ["tile_x", "sp", [2, 1, 7, 1]], ["tile_rc", "sp", [64, 4, 1]], ["tile_ry", "sp", [1, 3, 1]], ["tile_rx", "sp", [1, 3, 1]], ["auto_unroll_max_step", "ot", 512], ["unroll_explicit", "ot", 1]]}], "r": [[9.356235012755101e-05], 0, 1.6938486099243164, 1544113535.490177], "v": 0.1}
{"i": ["cuda", "conv2d_no_batching", [1, 28, 28, 128, 256, 3, 3, [2, 2], [1, 1]], {}, ["conv2d_no_batching", 1, 28, 28, 128, 256, 3, 3, [2, 2], [1, 1]], {"i": 67810618, "t": "", "c": null, "e": [["tile_f", "sp", [4, 1, 16, 2]], ["tile_y", "sp", [14, 1, 1, 1]], ["tile_x", "sp", [2, 1, 7, 1]], ["tile_rc", "sp", [64, 4, 1]], ["tile_ry", "sp", [1, 3, 1]], ["tile_rx", "sp", [1, 3, 1]], ["auto_unroll_max_step", "ot", 1500], ["unroll_explicit", "ot", 1]]}], "r": [[0.00010688148214285716], 0, 1.7973206043243408, 1544113536.9293718], "v": 0.1}
{"i": ["cuda", "conv2d_no_batching", [1, 28, 28, 128, 256, 3, 3, [2, 2], [1, 1]], {}, ["conv2d_no_batching", 1, 28, 28, 128, 256, 3, 3, [2, 2], [1, 1]], {"i": 42931226, "t": "", "c": null, "e": [["tile_f", "sp", [8, 1, 16, 1]], ["tile_y", "sp", [14, 1, 1, 1]], ["tile_x", "sp", [1, 1, 14, 1]], ["tile_rc", "sp", [64, 4, 1]], ["tile_ry", "sp", [1, 3, 1]], ["tile_rx", "sp", [1, 3, 1]], ["auto_unroll_max_step", "ot", 0], ["unroll_explicit", "ot", 1]]}], "r": [[8.105618176020407e-05], 0, 1.5573482513427734, 1544113538.228796], "v": 0.1}
{"i": ["cuda", "conv2d_no_batching", [1, 28, 28, 128, 256, 3, 3, [2, 2], [1, 1]], {}, ["conv2d_no_batching", 1, 28, 28, 128, 256, 3, 3, [2, 2], [1, 1]], {"i": 55342102, "t": "", "c": null, "e": [["tile_f", "sp", [8, 2, 8, 1]], ["tile_y", "sp", [14, 1, 1, 1]], ["tile_x", "sp", [1, 1, 14, 1]], ["tile_rc", "sp", [128, 2, 1]], ["tile_ry", "sp", [1, 3, 1]], ["tile_rx", "sp", [1, 3, 1]], ["auto_unroll_max_step", "ot", 512], ["unroll_explicit", "ot", 1]]}], "r": [[7.617191709183673e-05], 0, 1.5614070892333984, 1544113539.4983325], "v": 0.1}
{"i": ["cuda", "conv2d_no_batching", [1, 28, 28, 128, 256, 3, 3, [2, 2], [1, 1]], {}, ["conv2d_no_batching", 1, 28, 28, 128, 256, 3, 3, [2, 2], [1, 1]], {"i": 5572946, "t": "", "c": null, "e": [["tile_f", "sp", [8, 1, 16, 1]], ["tile_y", "sp", [7, 1, 1, 2]], ["tile_x", "sp", [2, 1, 7, 1]], ["tile_rc", "sp", [128, 2, 1]], ["tile_ry", "sp", [1, 3, 1]], ["tile_rx", "sp", [1, 3, 1]], ["auto_unroll_max_step", "ot", 0], ["unroll_explicit", "ot", 0]]}], "r": [[0.00011362050446428572], 0, 1.7133474349975586, 1544113540.9136384], "v": 0.1}
{"i": ["cuda", "conv2d_no_batching", [1, 28, 28, 128, 256, 3, 3, [2, 2], [1, 1]], {}, ["conv2d_no_batching", 1, 28, 28, 128, 256, 3, 3, [2, 2], [1, 1]], {"i": 42927506, "t": "", "c": null, "e": [["tile_f", "sp", [8, 1, 16, 1]], ["tile_y", "sp", [7, 2, 1, 1]], ["tile_x", "sp", [2, 1, 7, 1]], ["tile_rc", "sp", [64, 4, 1]], ["tile_ry", "sp", [1, 3, 1]], ["tile_rx", "sp", [1, 3, 1]], ["auto_unroll_max_step", "ot", 0], ["unroll_explicit", "ot", 1]]}], "r": [[9.413981505102041e-05], 0, 1.6748147010803223, 1544113542.3241403], "v": 0.1}
{"i": ["cuda", "conv2d_no_batching", [1, 28, 28, 128, 256, 3, 3, [2, 2], [1, 1]], {}, ["conv2d_no_batching", 1, 28, 28, 128, 256, 3, 3, [2, 2], [1, 1]], {"i": 38810906, "t": "", "c": null, "e": [["tile_f", "sp", [8, 1, 16, 1]], ["tile_y", "sp", [14, 1, 1, 1]], ["tile_x", "sp", [2, 1, 7, 1]], ["tile_rc", "sp", [32, 8, 1]], ["tile_ry", "sp", [1, 3, 1]], ["tile_rx", "sp", [3, 1, 1]], ["auto_unroll_max_step", "ot", 0], ["unroll_explicit", "ot", 1]]}], "r": [[0.0001342627774234694], 0, 1.876509666442871, 1544113543.923717], "v": 0.1}
{"i": ["cuda", "conv2d_no_batching", [1, 28, 28, 128, 256, 3, 3, [2, 2], [1, 1]], {}, ["conv2d_no_batching", 1, 28, 28, 128, 256, 3, 3, [2, 2], [1, 1]], {"i": 69166102, "t": "", "c": null, "e": [["tile_f", "sp", [8, 2, 8, 1]], ["tile_y", "sp", [14, 1, 1, 1]], ["tile_x", "sp", [1, 1, 14, 1]], ["tile_rc", "sp", [128, 2, 1]], ["tile_ry", "sp", [1, 1, 3]], ["tile_rx", "sp", [1, 3, 1]], ["auto_unroll_max_step", "ot", 1500], ["unroll_explicit", "ot", 1]]}], "r": [[7.605608673469388e-05], 0, 1.5041224956512451, 1544113545.1708236], "v": 0.1}
{"i": ["cuda", "conv2d_no_batching", [1, 28, 28, 128, 256, 3, 3, [2, 2], [1, 1]], {}, ["conv2d_no_batching", 1, 28, 28, 128, 256, 3, 3, [2, 2], [1, 1]], {"i": 56724502, "t": "", "c": null, "e": [["tile_f", "sp", [8, 2, 8, 1]], ["tile_y", "sp", [14, 1, 1, 1]], ["tile_x", "sp", [1, 1, 14, 1]], ["tile_rc", "sp", [128, 2, 1]], ["tile_ry", "sp", [1, 1, 3]], ["tile_rx", "sp", [1, 3, 1]], ["auto_unroll_max_step", "ot", 512], ["unroll_explicit", "ot", 1]]}], "r": [[7.620099170918367e-05], 0, 1.574852466583252, 1544113546.4144096], "v": 0.1}
{"i": ["cuda", "conv2d_no_batching", [1, 28, 28, 128, 256, 3, 3, [2, 2], [1, 1]], {}, ["conv2d_no_batching", 1, 28, 28, 128, 256, 3, 3, [2, 2], [1, 1]], {"i": 55342101, "t": "", "c": null, "e": [["tile_f", "sp", [16, 1, 8, 1]], ["tile_y", "sp", [14, 1, 1, 1]], ["tile_x", "sp", [1, 1, 14, 1]], ["tile_rc", "sp", [128, 2, 1]], ["tile_ry", "sp", [1, 3, 1]], ["tile_rx", "sp", [1, 3, 1]], ["auto_unroll_max_step", "ot", 512], ["unroll_explicit", "ot", 1]]}], "r": [[8.898288903061225e-05], 0, 1.6030678749084473, 1544113547.7121992], "v": 0.1}
{"i": ["cuda", "conv2d_no_batching", [1, 28, 28, 128, 256, 3, 3, [2, 2], [1, 1]], {}, ["conv2d_no_batching", 1, 28, 28, 128, 256, 3, 3, [2, 2], [1, 1]], {"i": 30489626, "t": "", "c": null, "e": [["tile_f", "sp", [8, 1, 16, 1]], ["tile_y", "sp", [14, 1, 1, 1]], ["tile_x", "sp", [1, 1, 14, 1]], ["tile_rc", "sp", [64, 4, 1]], ["tile_ry", "sp", [1, 3, 1]], ["tile_rx", "sp", [1, 3, 1]], ["auto_unroll_max_step", "ot", 1500], ["unroll_explicit", "ot", 0]]}], "r": [[9.124478435114504e-05], 0, 1.5801846981048584, 1544113573.3112807], "v": 0.1}
{"i": ["cuda", "conv2d_no_batching", [1, 28, 28, 128, 256, 3, 3, [2, 2], [1, 1]], {}, ["conv2d_no_batching", 1, 28, 28, 128, 256, 3, 3, [2, 2], [1, 1]], {"i": 18048026, "t": "", "c": null, "e": [["tile_f", "sp", [8, 1, 16, 1]], ["tile_y", "sp", [14, 1, 1, 1]], ["tile_x", "sp", [1, 1, 14, 1]], ["tile_rc", "sp", [64, 4, 1]], ["tile_ry", "sp", [1, 3, 1]], ["tile_rx", "sp", [1, 3, 1]], ["auto_unroll_max_step", "ot", 512], ["unroll_explicit", "ot", 0]]}], "r": [[8.073353244274808e-05], 0, 1.5385823249816895, 1544113574.6124227], "v": 0.1}
{"i": ["cuda", "conv2d_no_batching", [1, 28, 28, 128, 256, 3, 3, [2, 2], [1, 1]], {}, ["conv2d_no_batching", 1, 28, 28, 128, 256, 3, 3, [2, 2], [1, 1]], {"i": 31841302, "t": "", "c": null, "e": [["tile_f", "sp", [8, 2, 8, 1]], ["tile_y", "sp", [14, 1, 1, 1]], ["tile_x", "sp", [1, 1, 14, 1]], ["tile_rc", "sp", [128, 2, 1]], ["tile_ry", "sp", [1, 1, 3]], ["tile_rx", "sp", [1, 3, 1]], ["auto_unroll_max_step", "ot", 1500], ["unroll_explicit", "ot", 0]]}], "r": [[9.289593638676844e-05], 0, 1.6072676181793213, 1544113575.9676821], "v": 0.1}
