resnet18-n1000/resnet-18-curve-fix.log.tmp
{"i": ["cuda -model=unknown", "topi_nn_conv2d", [["TENSOR", [1, 512, 7, 7], "float32"], ["TENSOR", [512, 512, 3, 3], "float32"], [1, 1], [1, 1], [1, 1], "NCHW", "float32"], {}, ["conv2d", [1, 512, 7, 7, "float32"], [512, 512, 3, 3, "float32"], [1, 1], [1, 1], [1, 1], "NCHW", "float32"], {"i": 246935, "t": "winograd", "c": null, "e": [["tile_b", "sp", [16, 1, 1, 1]], ["tile_y", "sp", [2, 2, 64, 2]], ["tile_x", "sp", [4, 4, 1, 1]], ["tile_rc", "sp", [128, 4]], ["auto_unroll_max_step", "ot", 0], ["unroll_explicit", "ot", 1]]}], "r": [[0.00019417155], 0, 1.092320203781128, 1544017568.8454385], "v": 0.1}
{"i": ["cuda -model=unknown", "topi_nn_conv2d", [["TENSOR", [1, 512, 7, 7], "float32"], ["TENSOR", [512, 512, 3, 3], "float32"], [1, 1], [1, 1], [1, 1], "NCHW", "float32"], {}, ["conv2d", [1, 512, 7, 7, "float32"], [512, 512, 3, 3, "float32"], [1, 1], [1, 1], [1, 1], "NCHW", "float32"], {"i": 171489, "t": "winograd", "c": null, "e": [["tile_b", "sp", [16, 1, 1, 1]], ["tile_y", "sp", [32, 2, 2, 4]], ["tile_x", "sp", [4, 1, 4, 1]], ["tile_rc", "sp", [128, 4]], ["auto_unroll_max_step", "ot", 1500], ["unroll_explicit", "ot", 0]]}], "r": [[0.0003327387], 0, 1.1848323345184326, 1544017569.5580606], "v": 0.1}
{"i": ["cuda -model=unknown", "topi_nn_conv2d", [["TENSOR", [1, 512, 7, 7], "float32"], ["TENSOR", [512, 512, 3, 3], "float32"], [1, 1], [1, 1], [1, 1], "NCHW", "float32"], {}, ["conv2d", [1, 512, 7, 7, "float32"], [512, 512, 3, 3, "float32"], [1, 1], [1, 1], [1, 1], "NCHW", "float32"], {"i": 284535, "t": "winograd", "c": null, "e": [["tile_b", "sp", [16, 1, 1, 1]], ["tile_y", "sp", [8, 8, 4, 2]], ["tile_x", "sp", [1, 1, 2, 8]], ["tile_rc", "sp", [8, 64]], ["auto_unroll_max_step", "ot", 0], ["unroll_explicit", "ot", 1]]}], "r": [[0.0005864865000000001], 0, 1.144094705581665, 1544017579.7966523], "v": 0.1}
{"i": ["cuda -model=unknown", "topi_nn_conv2d", [["TENSOR", [1, 512, 7, 7], "float32"], ["TENSOR", [512, 512, 3, 3], "float32"], [1, 1], [1, 1], [1, 1], "NCHW", "float32"], {}, ["conv2d", [1, 512, 7, 7, "float32"], [512, 512, 3, 3, "float32"], [1, 1], [1, 1], [1, 1], "NCHW", "float32"], {"i": 21104, "t": "winograd", "c": null, "e": [["tile_b", "sp", [16, 1, 1, 1]], ["tile_y", "sp", [4, 1, 2, 64]], ["tile_x", "sp", [4, 1, 1, 4]], ["tile_rc", "sp", [128, 4]], ["auto_unroll_max_step", "ot", 0], ["unroll_explicit", "ot", 0]]}], "r": [[0.012798811949999999], 0, 2.0001590251922607, 1544017581.2823718], "v": 0.1}
{"i": ["cuda -model=unknown", "topi_nn_conv2d", [["TENSOR", [1, 512, 7, 7], "float32"], ["TENSOR", [512, 512, 3, 3], "float32"], [1, 1], [1, 1], [1, 1], "NCHW", "float32"], {}, ["conv2d", [1, 512, 7, 7, "float32"], [512, 512, 3, 3, "float32"], [1, 1], [1, 1], [1, 1], "NCHW", "float32"], {"i": 134096, "t": "winograd", "c": null, "e": [["tile_b", "sp", [16, 1, 1, 1]], ["tile_y", "sp", [16, 2, 4, 4]], ["tile_x", "sp", [1, 1, 16, 1]], ["tile_rc", "sp", [4, 128]], ["auto_unroll_max_step", "ot", 128], ["unroll_explicit", "ot", 0]]}], "r": [[0.00012503550000000002], 0, 1.2218141555786133, 1544017582.0358343], "v": 0.1}
{"i": ["cuda -model=unknown", "topi_nn_conv2d", [["TENSOR", [1, 512, 7, 7], "float32"], ["TENSOR", [512, 512, 3, 3], "float32"], [1, 1], [1, 1], [1, 1], "NCHW", "float32"], {}, ["conv2d", [1, 512, 7, 7, "float32"], [512, 512, 3, 3, "float32"], [1, 1], [1, 1], [1, 1], "NCHW", "float32"], {"i": 12809, "t": "winograd", "c": null, "e": [["tile_b", "sp", [16, 1, 1, 1]], ["tile_y", "sp", [4, 1, 128, 1]], ["tile_x", "sp", [1, 2, 4, 2]], ["tile_rc", "sp", [256, 2]], ["auto_unroll_max_step", "ot", 0], ["unroll_explicit", "ot", 0]]}], "r": [[0.00014100145], 0, 1.1122102737426758, 1544017582.8571613], "v": 0.1}
{"i": ["cuda -model=unknown", "topi_nn_conv2d", [["TENSOR", [1, 512, 7, 7], "float32"], ["TENSOR", [512, 512, 3, 3], "float32"], [1, 1], [1, 1], [1, 1], "NCHW", "float32"], {}, ["conv2d", [1, 512, 7, 7, "float32"], [512, 512, 3, 3, "float32"], [1, 1], [1, 1], [1, 1], "NCHW", "float32"], {"i": 267018, "t": "winograd", "c": null, "e": [["tile_b", "sp", [16, 1, 1, 1]], ["tile_y", "sp", [4, 1, 16, 8]], ["tile_x", "sp", [1, 2, 4, 2]], ["tile_rc", "sp", [32, 16]], ["auto_unroll_max_step", "ot", 0], ["unroll_explicit", "ot", 1]]}], "r": [[0.0001036524], 0, 1.075002670288086, 1544017583.5451555], "v": 0.1}
{"i": ["cuda -model=unknown", "topi_nn_conv2d", [["TENSOR", [1, 512, 7, 7], "float32"], ["TENSOR", [512, 512, 3, 3], "float32"], [1, 1], [1, 1], [1, 1], "NCHW", "float32"], {}, ["conv2d", [1, 512, 7, 7, "float32"], [512, 512, 3, 3, "float32"], [1, 1], [1, 1], [1, 1], "NCHW", "float32"], {"i": 264335, "t": "winograd", "c": null, "e": [["tile_b", "sp", [16, 1, 1, 1]], ["tile_y", "sp", [32, 1, 4, 4]], ["tile_x", "sp", [1, 4, 4, 1]], ["tile_rc", "sp", [32, 16]], ["auto_unroll_max_step", "ot", 0], ["unroll_explicit", "ot", 1]]}], "r": [[0.0001255383], 0, 1.022031545639038, 1544017584.2193186], "v": 0.1}
{"i": ["cuda -model=unknown", "topi_nn_conv2d", [["TENSOR", [1, 512, 7, 7], "float32"], ["TENSOR", [512, 512, 3, 3], "float32"], [1, 1], [1, 1], [1, 1], "NCHW", "float32"], {}, ["conv2d", [1, 512, 7, 7, "float32"], [512, 512, 3, 3, "float32"], [1, 1], [1, 1], [1, 1], "NCHW", "float32"], {"i": 445581, "t": "winograd", "c": null, "e": [["tile_b", "sp", [16, 1, 1, 1]], ["tile_y", "sp", [8, 4, 8, 2]], ["tile_x", "sp", [1, 1, 4, 4]], ["tile_rc", "sp", [4, 128]], ["auto_unroll_max_step", "ot", 1500], ["unroll_explicit", "ot", 1]]}], "r": [[0.00016129955], 0, 1.7129747867584229, 1544017589.4743984], "v": 0.1}
{"i": ["cuda -model=unknown", "topi_nn_conv2d", [["TENSOR", [1, 512, 7, 7], "float32"], ["TENSOR", [512, 512, 3, 3], "float32"], [1, 1], [1, 1], [1, 1], "NCHW", "float32"], {}, ["conv2d", [1, 512, 7, 7, "float32"], [512, 512, 3, 3, "float32"], [1, 1], [1, 1], [1, 1], "NCHW", "float32"], {"i": 318353, "t": "winograd", "c": null, "e": [["tile_b", "sp", [16, 1, 1, 1]], ["tile_y", "sp", [32, 8, 2, 1]], ["tile_x", "sp", [2, 1, 8, 1]], ["tile_rc", "sp", [256, 2]], ["auto_unroll_max_step", "ot", 128], ["unroll_explicit", "ot", 1]]}], "r": [[0.00019729525000000003], 0, 1.1707103252410889, 1544017590.1557972], "v": 0.1}
{"i": ["cuda -model=unknown", "topi_nn_conv2d", [["TENSOR", [1, 512, 7, 7], "float32"], ["TENSOR", [512, 512, 3, 3], "float32"], [1, 1], [1, 1], [1, 1], "NCHW", "float32"], {}, ["conv2d", [1, 512, 7, 7, "float32"], [512, 512, 3, 3, "float32"], [1, 1], [1, 1], [1, 1], "NCHW", "float32"], {"i": 267779, "t": "winograd", "c": null, "e": [["tile_b", "sp", [16, 1, 1, 1]], ["tile_y", "sp", [1, 32, 16, 1]], ["tile_x", "sp", [1, 4, 1, 4]], ["tile_rc", "sp", [32, 16]], ["auto_unroll_max_step", "ot", 0], ["unroll_explicit", "ot", 1]]}], "r": [[0.007511710150000001], 0, 1.9113872051239014, 1544017591.5961783], "v": 0.1}
{"i": ["cuda -model=unknown", "topi_nn_conv2d", [["TENSOR", [1, 512, 7, 7], "float32"], ["TENSOR", [512, 512, 3, 3], "float32"], [1, 1], [1, 1], [1, 1], "NCHW", "float32"], {}, ["conv2d", [1, 512, 7, 7, "float32"], [512, 512, 3, 3, "float32"], [1, 1], [1, 1], [1, 1], "NCHW", "float32"], {"i": 164487, "t": "winograd", "c": null, "e": [["tile_b", "sp", [16, 1, 1, 1]], ["tile_y", "sp", [2, 16, 2, 8]], ["tile_x", "sp", [2, 1, 8, 1]], ["tile_rc", "sp", [256, 2]], ["auto_unroll_max_step", "ot", 1500], ["unroll_explicit", "ot", 0]]}], "r": [[0.0002875719], 0, 1.202779769897461, 1544017596.7506473], "v": 0.1}
{"i": ["cuda -model=unknown", "topi_nn_conv2d", [["TENSOR", [1, 512, 7, 7], "float32"], ["TENSOR", [512, 512, 3, 3], "float32"], [1, 1], [1, 1], [1, 1], "NCHW", "float32"], {}, ["conv2d", [1, 512, 7, 7, "float32"], [512, 512, 3, 3, "float32"], [1, 1], [1, 1], [1, 1], "NCHW", "float32"], {"i": 24526, "t": "winograd", "c": null, "e": [["tile_b", "sp", [16, 1, 1, 1]], ["tile_y", "sp", [2, 64, 1, 4]], ["tile_x", "sp", [4, 2, 2, 1]], ["tile_rc", "sp", [64, 8]], ["auto_unroll_max_step", "ot", 0], ["unroll_explicit", "ot", 0]]}], "r": [[0.030860202250000003], 0, 3.4459428787231445, 1544017599.4373136], "v": 0.1}
{"i": ["cuda -model=unknown", "topi_nn_conv2d", [["TENSOR", [1, 512, 7, 7], "float32"], ["TENSOR", [512, 512, 3, 3], "float32"], [1, 1], [1, 1], [1, 1], "NCHW", "float32"], {}, ["conv2d", [1, 512, 7, 7, "float32"], [512, 512, 3, 3, "float32"], [1, 1], [1, 1], [1, 1], "NCHW", "float32"], {"i": 164886, "t": "winograd", "c": null, "e": [["tile_b", "sp", [16, 1, 1, 1]], ["tile_y", "sp", [2, 64, 1, 4]], ["tile_x", "sp", [1, 1, 16, 1]], ["tile_rc", "sp", [256, 2]], ["auto_unroll_max_step", "ot", 1500], ["unroll_explicit", "ot", 0]]}], "r": [[0.0016626935499999998], 0, 1.7365734577178955, 1544017600.4108133], "v": 0.1}
{"i": ["cuda -model=unknown", "topi_nn_conv2d", [["TENSOR", [1, 512, 7, 7], "float32"], ["TENSOR", [512, 512, 3, 3], "float32"], [1, 1], [1, 1], [1, 1], "NCHW", "float32"], {}, ["conv2d", [1, 512, 7, 7, "float32"], [512, 512, 3, 3, "float32"], [1, 1], [1, 1], [1, 1], "NCHW", "float32"], {"i": 253785, "t": "winograd", "c": null, "e": [["tile_b", "sp", [16, 1, 1, 1]], ["tile_y", "sp", [1, 16, 8, 4]], ["tile_x", "sp", [1, 1, 2, 8]], ["tile_rc", "sp", [128, 4]], ["auto_unroll_max_step", "ot", 0], ["unroll_explicit", "ot", 1]]}], "r": [[0.0027355200499999998], 0, 1.5205421447753906, 1544017601.3182411], "v": 0.1}
{"i": ["cuda -model=unknown", "topi_nn_conv2d", [["TENSOR", [1, 512, 7, 7], "float32"], ["TENSOR", [512, 512, 3, 3], "float32"], [1, 1], [1, 1], [1, 1], "NCHW", "float32"], {}, ["conv2d", [1, 512, 7, 7, "float32"], [512, 512, 3, 3, "float32"], [1, 1], [1, 1], [1, 1], "NCHW", "float32"], {"i": 432622, "t": "winograd", "c": null, "e": [["tile_b", "sp", [16, 1, 1, 1]], ["tile_y", "sp", [32, 4, 1, 4]], ["tile_x", "sp", [4, 2, 2, 1]], ["tile_rc", "sp", [8, 64]], ["auto_unroll_max_step", "ot", 1500], ["unroll_explicit", "ot", 1]]}], "r": [[0.0069356817500000004], 0, 3.666262626647949, 1544017602.795925], "v": 0.1}
{"i": ["cuda -model=unknown", "topi_nn_conv2d", [["TENSOR", [1, 512, 7, 7], "float32"], ["TENSOR", [512, 512, 3, 3], "float32"], [1, 1], [1, 1], [1, 1], "NCHW", "float32"], {}, ["conv2d", [1, 512, 7, 7, "float32"], [512, 512, 3, 3, "float32"], [1, 1], [1, 1], [1, 1], "NCHW", "float32"], {"i": 169161, "t": "winograd", "c": null, "e": [["tile_b", "sp", [16, 1, 1, 1]], ["tile_y", "sp", [4, 2, 1, 64]], ["tile_x", "sp", [1, 1, 2, 8]], ["tile_rc", "sp", [256, 2]], ["auto_unroll_max_step", "ot", 1500], ["unroll_explicit", "ot", 0]]}], "r": [[0.02744844595], 0, 4.7395641803741455, 1544017605.4696302], "v": 0.1}
{"i": ["cuda -model=unknown", "topi_nn_conv2d", [["TENSOR", [1, 512, 7, 7], "float32"], ["TENSOR", [512, 512, 3, 3], "float32"], [1, 1], [1, 1], [1, 1], "NCHW", "float32"], {}, ["conv2d", [1, 512, 7, 7, "float32"], [512, 512, 3, 3, "float32"], [1, 1], [1, 1], [1, 1], "NCHW", "float32"], {"i": 3457, "t": "winograd", "c": null, "e": [["tile_b", "sp", [16, 1, 1, 1]], ["tile_y", "sp", [1, 8, 8, 8]], ["tile_x", "sp", [8, 1, 1, 2]], ["tile_rc", "sp", [512, 1]], ["auto_unroll_max_step", "ot", 0], ["unroll_explicit", "ot", 0]]}], "r": [[0.0007612414], 0, 1.272806167602539, 1544017606.2224402], "v": 0.1}
{"i": ["cuda -model=unknown", "topi_nn_conv2d", [["TENSOR", [1, 512, 7, 7], "float32"], ["TENSOR", [512, 512, 3, 3], "float32"], [1, 1], [1, 1], [1, 1], "NCHW", "float32"], {}, ["conv2d", [1, 512, 7, 7, "float32"], [512, 512, 3, 3, "float32"], [1, 1], [1, 1], [1, 1], "NCHW", "float32"], {"i": 376712, "t": "winograd", "c": null, "e": [["tile_b", "sp", [16, 1, 1, 1]], ["tile_y", "sp", [64, 1, 4, 2]], ["tile_x", "sp", [1, 2, 1, 8]], ["tile_rc", "sp", [2, 256]], ["auto_unroll_max_step", "ot", 128], ["unroll_explicit", "ot", 1]]}], "r": [[0.0017447819], 0, 1.2692224979400635, 1544017607.1045752], "v": 0.1}
{"i": ["cuda -model=unknown", "topi_nn_conv2d", [["TENSOR", [1, 512, 7, 7], "float32"], ["TENSOR", [512, 512, 3, 3], "float32"], [1, 1], [1, 1], [1, 1], "NCHW", "float32"], {}, ["conv2d", [1, 512, 7, 7, "float32"], [512, 512, 3, 3, "float32"], [1, 1], [1, 1], [1, 1], "NCHW", "float32"], {"i": 248900, "t": "winograd", "c": null, "e": [["tile_b", "sp", [16, 1, 1, 1]], ["tile_y", "sp", [16, 2, 8, 2]], ["tile_x", "sp", [1, 4, 4, 1]], ["tile_rc", "sp", [128, 4]], ["auto_unroll_max_step", "ot", 0], ["unroll_explicit", "ot", 1]]}], "r": [[9.25541e-05], 0, 1.1084020137786865, 1544017607.773827], "v": 0.1}
{"i": ["cuda -model=unknown", "topi_nn_conv2d", [["TENSOR", [1, 512, 7, 7], "float32"], ["TENSOR", [512, 512, 3, 3], "float32"], [1, 1], [1, 1], [1, 1], "NCHW", "float32"], {}, ["conv2d", [1, 512, 7, 7, "float32"], [512, 512, 3, 3, "float32"], [1, 1], [1, 1], [1, 1], "NCHW", "float32"], {"i": 352615, "t": "winograd", "c": null, "e": [["tile_b", "sp", [16, 1, 1, 1]], ["tile_y", "sp", [8, 1, 4, 16]], ["tile_x", "sp", [1, 4, 1, 4]], ["tile_rc", "sp", [16, 32]], ["auto_unroll_max_step", "ot", 128], ["unroll_explicit", "ot", 1]]}], "r": [[0.0013443545499999998], 0, 1.832007884979248, 1544017608.651776], "v": 0.1}
{"i": ["cuda -model=unknown", "topi_nn_conv2d", [["TENSOR", [1, 512, 7, 7], "float32"], ["TENSOR", [512, 512, 3, 3], "float32"], [1, 1], [1, 1], [1, 1], "NCHW", "float32"], {}, ["conv2d", [1, 512, 7, 7, "float32"], [512, 512, 3, 3, "float32"], [1, 1], [1, 1], [1, 1], "NCHW", "float32"], {"i": 234457, "t": "winograd", "c": null, "e": [["tile_b", "sp", [16, 1, 1, 1]], ["tile_y", "sp", [1, 8, 8, 8]], ["tile_x", "sp", [8, 1, 1, 2]], ["tile_rc", "sp", [512, 1]], ["auto_unroll_max_step", "ot", 0], ["unroll_explicit", "ot", 1]]}], "r": [[0.0007637068], 0, 1.220841884613037, 1544017609.4888184], "v": 0.1}
{"i": ["cuda -model=unknown", "topi_nn_conv2d", [["TENSOR", [1, 512, 7, 7], "float32"], ["TENSOR", [512, 512, 3, 3], "float32"], [1, 1], [1, 1], [1, 1], "NCHW", "float32"], {}, ["conv2d", [1, 512, 7, 7, "float32"], [512, 512, 3, 3, "float32"], [1, 1], [1, 1], [1, 1], "NCHW", "float32"], {"i": 192837, "t": "winograd", "c": null, "e": [["tile_b", "sp", [16, 1, 1, 1]], ["tile_y", "sp", [8, 4, 4, 4]], ["tile_x", "sp", [8, 2, 1, 1]], ["tile_rc", "sp", [16, 32]], ["auto_unroll_max_step", "ot", 1500], ["unroll_explicit", "ot", 0]]}], "r": [[0.01286894985], 0, 4.398597717285156, 1544017611.5297549], "v": 0.1}
{"i": ["cuda -model=unknown", "topi_nn_conv2d", [["TENSOR", [1, 512, 7, 7], "float32"], ["TENSOR", [512, 512, 3, 3], "float32"], [1, 1], [1, 1], [1, 1], "NCHW", "float32"], {}, ["conv2d", [1, 512, 7, 7, "float32"], [512, 512, 3, 3, "float32"], [1, 1], [1, 1], [1, 1], "NCHW", "float32"], {"i": 248885, "t": "winograd", "c": null, "e": [["tile_b", "sp", [16, 1, 1, 1]], ["tile_y", "sp", [64, 2, 2, 2]], ["tile_x", "sp", [1, 4, 4, 1]], ["tile_rc", "sp", [128, 4]], ["auto_unroll_max_step", "ot", 0], ["unroll_explicit", "ot", 1]]}], "r": [[0.00024912839999999996], 0, 2.3117451667785645, 1544017613.4765441], "v": 0.1}
{"i": ["cuda -model=unknown", "topi_nn_conv2d", [["TENSOR", [1, 512, 7, 7], "float32"], ["TENSOR", [512, 512, 3, 3], "float32"], [1, 1], [1, 1], [1, 1], "NCHW", "float32"], {}, ["conv2d", [1, 512, 7, 7, "float32"], [512, 512, 3, 3, "float32"], [1, 1], [1, 1], [1, 1], "NCHW", "float32"], {"i": 31981, "t": "winograd", "c": null, "e": [["tile_b", "sp", [16, 1, 1, 1]], ["tile_y", "sp", [8, 4, 8, 2]], ["tile_x", "sp", [8, 1, 2, 1]], ["tile_rc", "sp", [32, 16]], ["auto_unroll_max_step", "ot", 0], ["unroll_explicit", "ot", 0]]}], "r": [[0.00056499825], 0, 1.4513249397277832, 1544017620.8983986], "v": 0.1}
{"i": ["cuda -model=unknown", "topi_nn_conv2d", [["TENSOR", [1, 512, 7, 7], "float32"], ["TENSOR", [512, 512, 3, 3], "float32"], [1, 1], [1, 1], [1, 1], "NCHW", "float32"], {}, ["conv2d", [1, 512, 7, 7, "float32"], [512, 512, 3, 3, "float32"], [1, 1], [1, 1], [1, 1], "NCHW", "float32"], {"i": 387249, "t": "winograd", "c": null, "e": [["tile_b", "sp", [16, 1, 1, 1]], ["tile_y", "sp", [4, 1, 128, 1]], ["tile_x", "sp", [2, 2, 4, 1]], ["tile_rc", "sp", [512, 1]], ["auto_unroll_max_step", "ot", 1500], ["unroll_explicit", "ot", 1]]}], "r": [[0.00026698974999999996], 0, 1.3331360816955566, 1544017621.5782707], "v": 0.1}
{"i": ["cuda -model=unknown", "topi_nn_conv2d", [["TENSOR", [1, 512, 7, 7], "float32"], ["TENSOR", [512, 512, 3, 3], "float32"], [1, 1], [1, 1], [1, 1], "NCHW", "float32"], {}, ["conv2d", [1, 512, 7, 7, "float32"], [512, 512, 3, 3, "float32"], [1, 1], [1, 1], [1, 1], "NCHW", "float32"], {"i": 6943, "t": "winograd", "c": null, "e": [["tile_b", "sp", [16, 1, 1, 1]], ["tile_y", "sp", [4, 4, 8, 4]], ["tile_x", "sp", [2, 1, 1, 8]], ["tile_rc", "sp", [512, 1]], ["auto_unroll_max_step", "ot", 0], ["unroll_explicit", "ot", 0]]}], "r": [[0.0002762519], 0, 1.424494981765747, 1544017622.3779945], "v": 0.1}
{"i": ["cuda -model=unknown", "topi_nn_conv2d", [["TENSOR", [1, 512, 7, 7], "float32"], ["TENSOR", [512, 512, 3, 3], "float32"], [1, 1], [1, 1], [1, 1], "NCHW", "float32"], {}, ["conv2d", [1, 512, 7, 7, "float32"], [512, 512, 3, 3, "float32"], [1, 1], [1, 1], [1, 1], "NCHW", "float32"], {"i": 163669, "t": "winograd", "c": null, "e": [["tile_b", "sp", [16, 1, 1, 1]], ["tile_y", "sp", [1, 1, 8, 64]], ["tile_x", "sp", [1, 8, 2, 1]], ["tile_rc", "sp", [256, 2]], ["auto_unroll_max_step", "ot", 1500], ["unroll_explicit", "ot", 0]]}], "r": [[0.0033711463], 0, 2.429922580718994, 1544017623.4680552], "v": 0.1}
{"i": ["cuda -model=unknown", "topi_nn_conv2d", [["TENSOR", [1, 512, 7, 7], "float32"], ["TENSOR", [512, 512, 3, 3], "float32"], [1, 1], [1, 1], [1, 1], "NCHW", "float32"], {}, ["conv2d", [1, 512, 7, 7, "float32"], [512, 512, 3, 3, "float32"], [1, 1], [1, 1], [1, 1], "NCHW", "float32"], {"i": 19434, "t": "winograd", "c": null, "e": [["tile_b", "sp", [16, 1, 1, 1]], ["tile_y", "sp", [16, 4, 4, 2]], ["tile_x", "sp", [1, 8, 1, 2]], ["tile_rc", "sp", [128, 4]], ["auto_unroll_max_step", "ot", 0], ["unroll_explicit", "ot", 0]]}], "r": [[0.0006323601], 0, 1.4098460674285889, 1544017624.224688], "v": 0.1}
{"i": ["cuda -model=unknown", "topi_nn_conv2d", [["TENSOR", [1, 512, 7, 7], "float32"], ["TENSOR", [512, 512, 3, 3], "float32"], [1, 1], [1, 1], [1, 1], "NCHW", "float32"], {}, ["conv2d", [1, 512, 7, 7, "float32"], [512, 512, 3, 3, "float32"], [1, 1], [1, 1], [1, 1], "NCHW", "float32"], {"i": 412169, "t": "winograd", "c": null, "e": [["tile_b", "sp", [16, 1, 1, 1]], ["tile_y", "sp", [32, 2, 2, 4]], ["tile_x", "sp", [1, 8, 1, 2]], ["tile_rc", "sp", [64, 8]], ["auto_unroll_max_step", "ot", 1500], ["unroll_explicit", "ot", 1]]}], "r": [[0.00103047555], 0, 2.7004833221435547, 1544017625.155379], "v": 0.1}
{"i": ["cuda -model=unknown", "topi_nn_conv2d", [["TENSOR", [1, 512, 7, 7], "float32"], ["TENSOR", [512, 512, 3, 3], "float32"], [1, 1], [1, 1], [1, 1], "NCHW", "float32"], {}, ["conv2d", [1, 512, 7, 7, "float32"], [512, 512, 3, 3, "float32"], [1, 1], [1, 1], [1, 1], "NCHW", "float32"], {"i": 96965, "t": "winograd", "c": null, "e": [["tile_b", "sp", [16, 1, 1, 1]], ["tile_y", "sp", [16, 2, 1, 16]], ["tile_x", "sp", [2, 2, 2, 2]], ["tile_rc", "sp", [128, 4]], ["auto_unroll_max_step", "ot", 128], ["unroll_explicit", "ot", 0]]}], "r": [[0.0016113532], 0, 1.6615943908691406, 1544017626.0180848], "v": 0.1}
{"i": ["cuda -model=unknown", "topi_nn_conv2d", [["TENSOR", [1, 512, 7, 7], "float32"], ["TENSOR", [512, 512, 3, 3], "float32"], [1, 1], [1, 1], [1, 1], "NCHW", "float32"], {}, ["conv2d", [1, 512, 7, 7, "float32"], [512, 512, 3, 3, "float32"], [1, 1], [1, 1], [1, 1], "NCHW", "float32"], {"i": 395167, "t": "winograd", "c": null, "e": [["tile_b", "sp", [16, 1, 1, 1]], ["tile_y", "sp", [2, 4, 64, 1]], ["tile_x", "sp", [1, 4, 4, 1]], ["tile_rc", "sp", [256, 2]], ["auto_unroll_max_step", "ot", 1500], ["unroll_explicit", "ot", 1]]}], "r": [[0.00014548225], 0, 1.1937360763549805, 1544017626.6900108], "v": 0.1}
{"i": ["cuda -model=unknown", "topi_nn_conv2d", [["TENSOR", [1, 512, 7, 7], "float32"], ["TENSOR", [512, 512, 3, 3], "float32"], [1, 1], [1, 1], [1, 1], "NCHW", "float32"], {}, ["conv2d", [1, 512, 7, 7, "float32"], [512, 512, 3, 3, "float32"], [1, 1], [1, 1], [1, 1], "NCHW", "float32"], {"i": 38985, "t": "winograd", "c": null, "e": [["tile_b", "sp", [16, 1, 1, 1]], ["tile_y", "sp", [8, 1, 64, 1]], ["tile_x", "sp", [4, 4, 1, 1]], ["tile_rc", "sp", [16, 32]], ["auto_unroll_max_step", "ot", 0], ["unroll_explicit", "ot", 0]]}], "r": [[0.0001631645], 0, 1.1762950420379639, 1544017631.6837404], "v": 0.1}
{"i": ["cuda -model=unknown", "topi_nn_conv2d", [["TENSOR", [1, 512, 7, 7], "float32"], ["TENSOR", [512, 512, 3, 3], "float32"], [1, 1], [1, 1], [1, 1], "NCHW", "float32"], {}, ["conv2d", [1, 512, 7, 7, "float32"], [512, 512, 3, 3, "float32"], [1, 1], [1, 1], [1, 1], "NCHW", "float32"], {"i": 398273, "t": "winograd", "c": null, "e": [["tile_b", "sp", [16, 1, 1, 1]], ["tile_y", "sp", [32, 2, 4, 2]], ["tile_x", "sp", [4, 1, 1, 4]], ["tile_rc", "sp", [256, 2]], ["auto_unroll_max_step", "ot", 1500], ["unroll_explicit", "ot", 1]]}], "r": [[0.00073959615], 0, 1.2660658359527588, 1544017636.7295852], "v": 0.1}
{"i": ["cuda -model=unknown", "topi_nn_conv2d", [["TENSOR", [1, 512, 7, 7], "float32"], ["TENSOR", [512, 512, 3, 3], "float32"], [1, 1], [1, 1], [1, 1], "NCHW", "float32"], {}, ["conv2d", [1, 512, 7, 7, "float32"], [512, 512, 3, 3, "float32"], [1, 1], [1, 1], [1, 1], "NCHW", "float32"], {"i": 227270, "t": "winograd", "c": null, "e": [["tile_b", "sp", [16, 1, 1, 1]], ["tile_y", "sp", [256, 1, 2, 1]], ["tile_x", "sp", [1, 8, 1, 2]], ["tile_rc", "sp", [1, 512]], ["auto_unroll_max_step", "ot", 1500], ["unroll_explicit", "ot", 0]]}], "r": [[0.0121482734], 0, 2.4669198989868164, 1544017638.2622356], "v": 0.1}
{"i": ["cuda -model=unknown", "topi_nn_conv2d", [["TENSOR", [1, 512, 7, 7], "float32"], ["TENSOR", [512, 512, 3, 3], "float32"], [1, 1], [1, 1], [1, 1], "NCHW", "float32"], {}, ["conv2d", [1, 512, 7, 7, "float32"], [512, 512, 3, 3, "float32"], [1, 1], [1, 1], [1, 1], "NCHW", "float32"], {"i": 189381, "t": "winograd", "c": null, "e": [["tile_b", "sp", [16, 1, 1, 1]], ["tile_y", "sp", [1, 4, 8, 16]], ["tile_x", "sp", [2, 2, 2, 2]], ["tile_rc", "sp", [32, 16]], ["auto_unroll_max_step", "ot", 1500], ["unroll_explicit", "ot", 0]]}], "r": [[0.0023058452], 0, 2.894798994064331, 1544017639.537244], "v": 0.1}
{"i": ["cuda -model=unknown", "topi_nn_conv2d", [["TENSOR", [1, 512, 7, 7], "float32"], ["TENSOR", [512, 512, 3, 3], "float32"], [1, 1], [1, 1], [1, 1], "NCHW", "float32"], {}, ["conv2d", [1, 512, 7, 7, "float32"], [512, 512, 3, 3, "float32"], [1, 1], [1, 1], [1, 1], "NCHW", "float32"], {"i": 364066, "t": "winograd", "c": null, "e": [["tile_b", "sp", [16, 1, 1, 1]], ["tile_y", "sp", [8, 2, 1, 32]], ["tile_x", "sp", [4, 1, 4, 1]], ["tile_rc", "sp", [4, 128]], ["auto_unroll_max_step", "ot", 128], ["unroll_explicit", "ot", 1]]}], "r": [[0.0045493812], 0, 1.6585156917572021, 1544017640.6954522], "v": 0.1}
{"i": ["cuda -model=unknown", "topi_nn_conv2d", [["TENSOR", [1, 512, 7, 7], "float32"], ["TENSOR", [512, 512, 3, 3], "float32"], [1, 1], [1, 1], [1, 1], "NCHW", "float32"], {}, ["conv2d", [1, 512, 7, 7, "float32"], [512, 512, 3, 3, "float32"], [1, 1], [1, 1], [1, 1], "NCHW", "float32"], {"i": 327815, "t": "winograd", "c": null, "e": [["tile_b", "sp", [16, 1, 1, 1]], ["tile_y", "sp", [8, 32, 2, 1]], ["tile_x", "sp", [2, 2, 2, 2]], ["tile_rc", "sp", [128, 4]], ["auto_unroll_max_step", "ot", 128], ["unroll_explicit", "ot", 1]]}], "r": [[0.0005825535500000001], 0, 1.56024169921875, 1544017641.4836257], "v": 0.1}
{"i": ["cuda -model=unknown", "topi_nn_conv2d", [["TENSOR", [1, 512, 7, 7], "float32"], ["TENSOR", [512, 512, 3, 3], "float32"], [1, 1], [1, 1], [1, 1], "NCHW", "float32"], {}, ["conv2d", [1, 512, 7, 7, "float32"], [512, 512, 3, 3, "float32"], [1, 1], [1, 1], [1, 1], "NCHW", "float32"], {"i": 352045, "t": "winograd", "c": null, "e": [["tile_b", "sp", [16, 1, 1, 1]], ["tile_y", "sp", [8, 1, 64, 1]], ["tile_x", "sp", [4, 1, 1, 4]], ["tile_rc", "sp", [16, 32]], ["auto_unroll_max_step", "ot", 128], ["unroll_explicit", "ot", 1]]}], "r": [[8.29098e-05], 0, 1.3455214500427246, 1544017642.1864433], "v": 0.1}
{"i": ["cuda -model=unknown", "topi_nn_conv2d", [["TENSOR", [1, 512, 7, 7], "float32"], ["TENSOR", [512, 512, 3, 3], "float32"], [1, 1], [1, 1], [1, 1], "NCHW", "float32"], {}, ["conv2d", [1, 512, 7, 7, "float32"], [512, 512, 3, 3, "float32"], [1, 1], [1, 1], [1, 1], "NCHW", "float32"], {"i": 21993, "t": "winograd", "c": null, "e": [["tile_b", "sp", [16, 1, 1, 1]], ["tile_y", "sp", [2, 1, 2, 128]], ["tile_x", "sp", [1, 2, 2, 4]], ["tile_rc", "sp", [128, 4]], ["auto_unroll_max_step", "ot", 0], ["unroll_explicit", "ot", 0]]}], "r": [[0.01471528225], 0, 2.1155805587768555, 1544017643.8182795], "v": 0.1}
{"i": ["cuda -model=unknown", "topi_nn_conv2d", [["TENSOR", [1, 512, 7, 7], "float32"], ["TENSOR", [512, 512, 3, 3], "float32"], [1, 1], [1, 1], [1, 1], "NCHW", "float32"], {}, ["conv2d", [1, 512, 7, 7, "float32"], [512, 512, 3, 3, "float32"], [1, 1], [1, 1], [1, 1], "NCHW", "float32"], {"i": 343511, "t": "winograd", "c": null, "e": [["tile_b", "sp", [16, 1, 1, 1]], ["tile_y", "sp", [4, 2, 32, 2]], ["tile_x", "sp", [1, 4, 2, 2]], ["tile_rc", "sp", [32, 16]], ["auto_unroll_max_step", "ot", 128], ["unroll_explicit", "ot", 1]]}], "r": [[8.251419999999999e-05], 0, 1.2659988403320312, 1544017648.9762719], "v": 0.1}
{"i": ["cuda -model=unknown", "topi_nn_conv2d", [["TENSOR", [1, 512, 7, 7], "float32"], ["TENSOR", [512, 512, 3, 3], "float32"], [1, 1], [1, 1], [1, 1], "NCHW", "float32"], {}, ["conv2d", [1, 512, 7, 7, "float32"], [512, 512, 3, 3, "float32"], [1, 1], [1, 1], [1, 1], "NCHW", "float32"], {"i": 157477, "t": "winograd", "c": null, "e": [["tile_b", "sp", [16, 1, 1, 1]], ["tile_y", "sp", [2, 4, 4, 16]], ["tile_x", "sp", [8, 1, 1, 2]], ["tile_rc", "sp", [512, 1]], ["auto_unroll_max_step", "ot", 1500], ["unroll_explicit", "ot", 0]]}], "r": [[0.0008779215], 0, 1.3351497650146484, 1544017649.809282], "v": 0.1}
{"i": ["cuda -model=unknown", "topi_nn_conv2d", [["TENSOR", [1, 512, 7, 7], "float32"], ["TENSOR", [512, 512, 3, 3], "float32"], [1, 1], [1, 1], [1, 1], "NCHW", "float32"], {}, ["conv2d", [1, 512, 7, 7, "float32"], [512, 512, 3, 3, "float32"], [1, 1], [1, 1], [1, 1], "NCHW", "float32"], {"i": 18351, "t": "winograd", "c": null, "e": [["tile_b", "sp", [16, 1, 1, 1]], ["tile_y", "sp", [4, 2, 32, 2]], ["tile_x", "sp", [1, 2, 8, 1]], ["tile_rc", "sp", [128, 4]], ["auto_unroll_max_step", "ot", 0], ["unroll_explicit", "ot", 0]]}], "r": [[8.76395e-05], 0, 1.1713268756866455, 1544017650.5868967], "v": 0.1}
{"i": ["cuda -model=unknown", "topi_nn_conv2d", [["TENSOR", [1, 512, 7, 7], "float32"], ["TENSOR", [512, 512, 3, 3], "float32"], [1, 1], [1, 1], [1, 1], "NCHW", "float32"], {}, ["conv2d", [1, 512, 7, 7, "float32"], [512, 512, 3, 3, "float32"], [1, 1], [1, 1], [1, 1], "NCHW", "float32"], {"i": 51951, "t": "winograd", "c": null, "e": [["tile_b", "sp", [16, 1, 1, 1]], ["tile_y", "sp", [4, 16, 8, 1]], ["tile_x", "sp", [2, 2, 1, 4]], ["tile_rc", "sp", [8, 64]], ["auto_unroll_max_step", "ot", 0], ["unroll_explicit", "ot", 0]]}], "r": [[0.0011786298], 0, 1.3392579555511475, 1544017651.3611906], "v": 0.1}
{"i": ["cuda -model=unknown", "topi_nn_conv2d", [["TENSOR", [1, 512, 7, 7], "float32"], ["TENSOR", [512, 512, 3, 3], "float32"], [1, 1], [1, 1], [1, 1], "NCHW", "float32"], {}, ["conv2d", [1, 512, 7, 7, "float32"], [512, 512, 3, 3, "float32"], [1, 1], [1, 1], [1, 1], "NCHW", "float32"], {"i": 327067, "t": "winograd", "c": null, "e": [["tile_b", "sp", [16, 1, 1, 1]], ["tile_y", "sp", [2, 16, 2, 8]], ["tile_x", "sp", [4, 2, 1, 2]], ["tile_rc", "sp", [128, 4]], ["auto_unroll_max_step", "ot", 128], ["unroll_explicit", "ot", 1]]}], "r": [[0.01802038085], 0, 2.5582542419433594, 1544017653.1610825], "v": 0.1}
{"i": ["cuda -model=unknown", "topi_nn_conv2d", [["TENSOR", [1, 512, 7, 7], "float32"], ["TENSOR", [512, 512, 3, 3], "float32"], [1, 1], [1, 1], [1, 1], "NCHW", "float32"], {}, ["conv2d", [1, 512, 7, 7, "float32"], [512, 512, 3, 3, "float32"], [1, 1], [1, 1], [1, 1], "NCHW", "float32"], {"i": 240962, "t": "winograd", "c": null, "e": [["tile_b", "sp", [16, 1, 1, 1]], ["tile_y", "sp", [2, 128, 1, 2]], ["tile_x", "sp", [2, 2, 4, 1]], ["tile_rc", "sp", [256, 2]], ["auto_unroll_max_step", "ot", 0], ["unroll_explicit", "ot", 1]]}], "r": [[0.0225061745], 0, 2.700101375579834, 1544017655.284618], "v": 0.1}
{"i": ["cuda -model=unknown", "topi_nn_conv2d", [["TENSOR", [1, 512, 7, 7], "float32"], ["TENSOR", [512, 512, 3, 3], "float32"], [1, 1], [1, 1], [1, 1], "NCHW", "float32"], {}, ["conv2d", [1, 512, 7, 7, "float32"], [512, 512, 3, 3, "float32"], [1, 1], [1, 1], [1, 1], "NCHW", "float32"], {"i": 333722, "t": "winograd", "c": null, "e": [["tile_b", "sp", [16, 1, 1, 1]], ["tile_y", "sp", [2, 4, 1, 64]], ["tile_x", "sp", [1, 4, 4, 1]], ["tile_rc", "sp", [64, 8]], ["auto_unroll_max_step", "ot", 128], ["unroll_explicit", "ot", 1]]}], "r": [[0.02649920135], 0, 2.9234678745269775, 1544017657.5692332], "v": 0.1}
{"i": ["cuda -model=unknown", "topi_nn_conv2d", [["TENSOR", [1, 512, 7, 7], "float32"], ["TENSOR", [512, 512, 3, 3], "float32"], [1, 1], [1, 1], [1, 1], "NCHW", "float32"], {}, ["conv2d", [1, 512, 7, 7, "float32"], [512, 512, 3, 3, "float32"], [1, 1], [1, 1], [1, 1], "NCHW", "float32"], {"i": 237897, "t": "winograd", "c": null, "e": [["tile_b", "sp", [16, 1, 1, 1]], ["tile_y", "sp", [2, 32, 4, 2]], ["tile_x", "sp", [2, 1, 1, 8]], ["tile_rc", "sp", [512, 1]], ["auto_unroll_max_step", "ot", 0], ["unroll_explicit", "ot", 1]]}], "r": [[0.0207178564], 0, 2.630089521408081, 1544017659.481508], "v": 0.1}
{"i": ["cuda -model=unknown", "topi_nn_conv2d", [["TENSOR", [1, 512, 7, 7], "float32"], ["TENSOR", [512, 512, 3, 3], "float32"], [1, 1], [1, 1], [1, 1], "NCHW", "float32"], {}, ["conv2d", [1, 512, 7, 7, "float32"], [512, 512, 3, 3, "float32"], [1, 1], [1, 1], [1, 1], "NCHW", "float32"], {"i": 24575, "t": "winograd", "c": null, "e": [["tile_b", "sp", [16, 1, 1, 1]], ["tile_y", "sp", [4, 2, 8, 8]], ["tile_x", "sp", [4, 2, 2, 1]], ["tile_rc", "sp", [64, 8]], ["auto_unroll_max_step", "ot", 0], ["unroll_explicit", "ot", 0]]}], "r": [[0.00030768045], 0, 1.2283878326416016, 1544017660.1891544], "v": 0.1}
{"i": ["cuda -model=unknown", "topi_nn_conv2d", [["TENSOR", [1, 512, 7, 7], "float32"], ["TENSOR", [512, 512, 3, 3], "float32"], [1, 1], [1, 1], [1, 1], "NCHW", "float32"], {}, ["conv2d", [1, 512, 7, 7, "float32"], [512, 512, 3, 3, "float32"], [1, 1], [1, 1], [1, 1], "NCHW", "float32"], {"i": 136430, "t": "winograd", "c": null, "e": [["tile_b", "sp", [16, 1, 1, 1]], ["tile_y", "sp", [8, 8, 8, 1]], ["tile_x", "sp", [4, 1, 1, 4]], ["tile_rc", "sp", [4, 128]], ["auto_unroll_max_step", "ot", 128], ["unroll_explicit", "ot", 0]]}], "r": [[0.0022006262499999997], 0, 1.3631260395050049, 1544017661.008054], "v": 0.1}
{"i": ["cuda -model=unknown", "topi_nn_conv2d", [["TENSOR", [1, 512, 7, 7], "float32"], ["TENSOR", [512, 512, 3, 3], "float32"], [1, 1], [1, 1], [1, 1], "NCHW", "float32"], {}, ["conv2d", [1, 512, 7, 7, "float32"], [512, 512, 3, 3, "float32"], [1, 1], [1, 1], [1, 1], "NCHW", "float32"], {"i": 141575, "t": "winograd", "c": null, "e": [["tile_b", "sp", [16, 1, 1, 1]], ["tile_y", "sp", [32, 1, 4, 4]], ["tile_x", "sp", [1, 2, 8, 1]], ["tile_rc", "sp", [2, 256]], ["auto_unroll_max_step", "ot", 128], ["unroll_explicit", "ot", 0]]}], "r": [[0.0007612652], 0, 1.8262662887573242, 1544017661.9091718], "v": 0.1}
{"i": ["cuda -model=unknown", "topi_nn_conv2d", [["TENSOR", [1, 512, 7, 7], "float32"], ["TENSOR", [512, 512, 3, 3], "float32"], [1, 1], [1, 1], [1, 1], "NCHW", "float32"], {}, ["conv2d", [1, 512, 7, 7, "float32"], [512, 512, 3, 3, "float32"], [1, 1], [1, 1], [1, 1], "NCHW", "float32"], {"i": 25986, "t": "winograd", "c": null, "e": [["tile_b", "sp", [16, 1, 1, 1]], ["tile_y", "sp", [1, 128, 4, 1]], ["tile_x", "sp", [1, 2, 8, 1]], ["tile_rc", "sp", [64, 8]], ["auto_unroll_max_step", "ot", 0], ["unroll_explicit", "ot", 0]]}], "r": [[0.00422330345], 0, 1.589350700378418, 1544017662.8934789], "v": 0.1}
{"i": ["cuda -model=unknown", "topi_nn_conv2d", [["TENSOR", [1, 512, 7, 7], "float32"], ["TENSOR", [512, 512, 3, 3], "float32"], [1, 1], [1, 1], [1, 1], "NCHW", "float32"], {}, ["conv2d", [1, 512, 7, 7, "float32"], [512, 512, 3, 3, "float32"], [1, 1], [1, 1], [1, 1], "NCHW", "float32"], {"i": 324810, "t": "winograd", "c": null, "e": [["tile_b", "sp", [16, 1, 1, 1]], ["tile_y", "sp", [8, 1, 32, 2]], ["tile_x", "sp", [4, 2, 2, 1]], ["tile_rc", "sp", [128, 4]], ["auto_unroll_max_step", "ot", 128], ["unroll_explicit", "ot", 1]]}], "r": [[0.0001074843], 0, 1.1935679912567139, 1544017762.2118661], "v": 0.1}
{"i": ["cuda -model=unknown", "topi_nn_conv2d", [["TENSOR", [1, 512, 7, 7], "float32"], ["TENSOR", [512, 512, 3, 3], "float32"], [1, 1], [1, 1], [1, 1], "NCHW", "float32"], {}, ["conv2d", [1, 512, 7, 7, "float32"], [512, 512, 3, 3, "float32"], [1, 1], [1, 1], [1, 1], "NCHW", "float32"], {"i": 247810, "t": "winograd", "c": null, "e": [["tile_b", "sp", [16, 1, 1, 1]], ["tile_y", "sp", [8, 1, 32, 2]], ["tile_x", "sp", [4, 2, 2, 1]], ["tile_rc", "sp", [128, 4]], ["auto_unroll_max_step", "ot", 0], ["unroll_explicit", "ot", 1]]}], "r": [[0.00010493799999999999], 0, 1.2583732604980469, 1544017762.9234855], "v": 0.1}
{"i": ["cuda -model=unknown", "topi_nn_conv2d", [["TENSOR", [1, 512, 7, 7], "float32"], ["TENSOR", [512, 512, 3, 3], "float32"], [1, 1], [1, 1], [1, 1], "NCHW", "float32"], {}, ["conv2d", [1, 512, 7, 7, "float32"], [512, 512, 3, 3, "float32"], [1, 1], [1, 1], [1, 1], "NCHW", "float32"], {"i": 401810, "t": "winograd", "c": null, "e": [["tile_b", "sp", [16, 1, 1, 1]], ["tile_y", "sp", [8, 1, 32, 2]], ["tile_x", "sp", [4, 2, 2, 1]], ["tile_rc", "sp", [128, 4]], ["auto_unroll_max_step", "ot", 1500], ["unroll_explicit", "ot", 1]]}], "r": [[0.00010702785], 0, 1.1429965496063232, 1544017763.580634], "v": 0.1}
{"i": ["cuda -model=unknown", "topi_nn_conv2d", [["TENSOR", [1, 512, 7, 7], "float32"], ["TENSOR", [512, 512, 3, 3], "float32"], [1, 1], [1, 1], [1, 1], "NCHW", "float32"], {}, ["conv2d", [1, 512, 7, 7, "float32"], [512, 512, 3, 3, "float32"], [1, 1], [1, 1], [1, 1], "NCHW", "float32"], {"i": 247806, "t": "winograd", "c": null, "e": [["tile_b", "sp", [16, 1, 1, 1]], ["tile_y", "sp", [8, 2, 16, 2]], ["tile_x", "sp", [4, 2, 2, 1]], ["tile_rc", "sp", [128, 4]], ["auto_unroll_max_step", "ot", 0], ["unroll_explicit", "ot", 1]]}], "r": [[0.00010377525], 0, 1.3707659244537354, 1544017764.305905], "v": 0.1}
{"i": ["cuda -model=unknown", "topi_nn_conv2d", [["TENSOR", [1, 512, 7, 7], "float32"], ["TENSOR", [512, 512, 3, 3], "float32"], [1, 1], [1, 1], [1, 1], "NCHW", "float32"], {}, ["conv2d", [1, 512, 7, 7, "float32"], [512, 512, 3, 3, "float32"], [1, 1], [1, 1], [1, 1], "NCHW", "float32"], {"i": 401806, "t": "winograd", "c": null, "e": [["tile_b", "sp", [16, 1, 1, 1]], ["tile_y", "sp", [8, 2, 16, 2]], ["tile_x", "sp", [4, 2, 2, 1]], ["tile_rc", "sp", [128, 4]], ["auto_unroll_max_step", "ot", 1500], ["unroll_explicit", "ot", 1]]}], "r": [[0.00017017440000000002], 0, 1.3759675025939941, 1544017765.0304036], "v": 0.1}
{"i": ["cuda -model=unknown", "topi_nn_conv2d", [["TENSOR", [1, 512, 7, 7], "float32"], ["TENSOR", [512, 512, 3, 3], "float32"], [1, 1], [1, 1], [1, 1], "NCHW", "float32"], {}, ["conv2d", [1, 512, 7, 7, "float32"], [512, 512, 3, 3, "float32"], [1, 1], [1, 1], [1, 1], "NCHW", "float32"], {"i": 324806, "t": "winograd", "c": null, "e": [["tile_b", "sp", [16, 1, 1, 1]], ["tile_y", "sp", [8, 2, 16, 2]], ["tile_x", "sp", [4, 2, 2, 1]], ["tile_rc", "sp", [128, 4]], ["auto_unroll_max_step", "ot", 128], ["unroll_explicit", "ot", 1]]}], "r": [[0.00017027905], 0, 1.3511104583740234, 1544017765.6974797], "v": 0.1}
{"i": ["cuda -model=unknown", "topi_nn_conv2d", [["TENSOR", [1, 512, 7, 7], "float32"], ["TENSOR", [512, 512, 3, 3], "float32"], [1, 1], [1, 1], [1, 1], "NCHW", "float32"], {}, ["conv2d", [1, 512, 7, 7, "float32"], [512, 512, 3, 3, "float32"], [1, 1], [1, 1], [1, 1], "NCHW", "float32"], {"i": 402026, "t": "winograd", "c": null, "e": [["tile_b", "sp", [16, 1, 1, 1]], ["tile_y", "sp", [8, 2, 16, 2]], ["tile_x", "sp", [2, 4, 2, 1]], ["tile_rc", "sp", [128, 4]], ["auto_unroll_max_step", "ot", 1500], ["unroll_explicit", "ot", 1]]}], "r": [[0.00014815785000000002], 0, 1.4033937454223633, 1544017766.4247372], "v": 0.1}
{"i": ["cuda -model=unknown", "topi_nn_conv2d", [["TENSOR", [1, 512, 7, 7], "float32"], ["TENSOR", [512, 512, 3, 3], "float32"], [1, 1], [1, 1], [1, 1], "NCHW", "float32"], {}, ["conv2d", [1, 512, 7, 7, "float32"], [512, 512, 3, 3, "float32"], [1, 1], [1, 1], [1, 1], "NCHW", "float32"], {"i": 325026, "t": "winograd", "c": null, "e": [["tile_b", "sp", [16, 1, 1, 1]], ["tile_y", "sp", [8, 2, 16, 2]], ["tile_x", "sp", [2, 4, 2, 1]], ["tile_rc", "sp", [128, 4]], ["auto_unroll_max_step", "ot", 128], ["unroll_explicit", "ot", 1]]}], "r": [[0.00014774515], 0, 1.346787452697754, 1544017767.1058245], "v": 0.1}
{"i": ["cuda -model=unknown", "topi_nn_conv2d", [["TENSOR", [1, 512, 7, 7], "float32"], ["TENSOR", [512, 512, 3, 3], "float32"], [1, 1], [1, 1], [1, 1], "NCHW", "float32"], {}, ["conv2d", [1, 512, 7, 7, "float32"], [512, 512, 3, 3, "float32"], [1, 1], [1, 1], [1, 1], "NCHW", "float32"], {"i": 248026, "t": "winograd", "c": null, "e": [["tile_b", "sp", [16, 1, 1, 1]], ["tile_y", "sp", [8, 2, 16, 2]], ["tile_x", "sp", [2, 4, 2, 1]], ["tile_rc", "sp", [128, 4]], ["auto_unroll_max_step", "ot", 0], ["unroll_explicit", "ot", 1]]}], "r": [[0.00014397365], 0, 1.3581721782684326, 1544017767.8347738], "v": 0.1}
{"i": ["cuda -model=unknown", "topi_nn_conv2d", [["TENSOR", [1, 512, 7, 7], "float32"], ["TENSOR", [512, 512, 3, 3], "float32"], [1, 1], [1, 1], [1, 1], "NCHW", "float32"], {}, ["conv2d", [1, 512, 7, 7, "float32"], [512, 512, 3, 3, "float32"], [1, 1], [1, 1], [1, 1], "NCHW", "float32"], {"i": 16810, "t": "winograd", "c": null, "e": [["tile_b", "sp", [16, 1, 1, 1]], ["tile_y", "sp", [8, 1, 32, 2]], ["tile_x", "sp", [4, 2, 2, 1]], ["tile_rc", "sp", [128, 4]], ["auto_unroll_max_step", "ot", 0], ["unroll_explicit", "ot", 0]]}], "r": [[0.00010517685], 0, 1.1905920505523682, 1544017768.4869304], "v": 0.1}
{"i": ["cuda -model=unknown", "topi_nn_conv2d", [["TENSOR", [1, 512, 7, 7], "float32"], ["TENSOR", [512, 512, 3, 3], "float32"], [1, 1], [1, 1], [1, 1], "NCHW", "float32"], {}, ["conv2d", [1, 512, 7, 7, "float32"], [512, 512, 3, 3, "float32"], [1, 1], [1, 1], [1, 1], "NCHW", "float32"], {"i": 170810, "t": "winograd", "c": null, "e": [["tile_b", "sp", [16, 1, 1, 1]], ["tile_y", "sp", [8, 1, 32, 2]], ["tile_x", "sp", [4, 2, 2, 1]], ["tile_rc", "sp", [128, 4]], ["auto_unroll_max_step", "ot", 1500], ["unroll_explicit", "ot", 0]]}], "r": [[0.00010540154999999999], 0, 1.2767162322998047, 1544017769.1464458], "v": 0.1}
{"i": ["cuda -model=unknown", "topi_nn_conv2d", [["TENSOR", [1, 512, 7, 7], "float32"], ["TENSOR", [512, 512, 3, 3], "float32"], [1, 1], [1, 1], [1, 1], "NCHW", "float32"], {}, ["conv2d", [1, 512, 7, 7, "float32"], [512, 512, 3, 3, "float32"], [1, 1], [1, 1], [1, 1], "NCHW", "float32"], {"i": 93810, "t": "winograd", "c": null, "e": [["tile_b", "sp", [16, 1, 1, 1]], ["tile_y", "sp", [8, 1, 32, 2]], ["tile_x", "sp", [4, 2, 2, 1]], ["tile_rc", "sp", [128, 4]], ["auto_unroll_max_step", "ot", 128], ["unroll_explicit", "ot", 0]]}], "r": [[0.00010471275000000001], 0, 1.2575929164886475, 1544017769.8006284], "v": 0.1}
{"i": ["cuda -model=unknown", "topi_nn_conv2d", [["TENSOR", [1, 512, 7, 7], "float32"], ["TENSOR", [512, 512, 3, 3], "float32"], [1, 1], [1, 1], [1, 1], "NCHW", "float32"], {}, ["conv2d", [1, 512, 7, 7, "float32"], [512, 512, 3, 3, "float32"], [1, 1], [1, 1], [1, 1], "NCHW", "float32"], {"i": 93806, "t": "winograd", "c": null, "e": [["tile_b", "sp", [16, 1, 1, 1]], ["tile_y", "sp", [8, 2, 16, 2]], ["tile_x", "sp", [4, 2, 2, 1]], ["tile_rc", "sp", [128, 4]], ["auto_unroll_max_step", "ot", 128], ["unroll_explicit", "ot", 0]]}], "r": [[0.00010346220000000001], 0, 1.2696707248687744, 1544017770.4694188], "v": 0.1}
{"i": ["cuda -model=unknown", "topi_nn_conv2d", [["TENSOR", [1, 512, 7, 7], "float32"], ["TENSOR", [512, 512, 3, 3], "float32"], [1, 1], [1, 1], [1, 1], "NCHW", "float32"], {}, ["conv2d", [1, 512, 7, 7, "float32"], [512, 512, 3, 3, "float32"], [1, 1], [1, 1], [1, 1], "NCHW", "float32"], {"i": 16806, "t": "winograd", "c": null, "e": [["tile_b", "sp", [16, 1, 1, 1]], ["tile_y", "sp", [8, 2, 16, 2]], ["tile_x", "sp", [4, 2, 2, 1]], ["tile_rc", "sp", [128, 4]], ["auto_unroll_max_step", "ot", 0], ["unroll_explicit", "ot", 0]]}], "r": [[0.0001046434], 0, 1.2512919902801514, 1544017771.1397307], "v": 0.1}
{"i": ["cuda -model=unknown", "topi_nn_conv2d", [["TENSOR", [1, 512, 7, 7], "float32"], ["TENSOR", [512, 512, 3, 3], "float32"], [1, 1], [1, 1], [1, 1], "NCHW", "float32"], {}, ["conv2d", [1, 512, 7, 7, "float32"], [512, 512, 3, 3, "float32"], [1, 1], [1, 1], [1, 1], "NCHW", "float32"], {"i": 170806, "t": "winograd", "c": null, "e": [["tile_b", "sp", [16, 1, 1, 1]], ["tile_y", "sp", [8, 2, 16, 2]], ["tile_x", "sp", [4, 2, 2, 1]], ["tile_rc", "sp", [128, 4]], ["auto_unroll_max_step", "ot", 1500], ["unroll_explicit", "ot", 0]]}], "r": [[0.00010461685000000001], 0, 1.2485179901123047, 1544017771.8146472], "v": 0.1}
{"i": ["cuda -model=unknown", "topi_nn_conv2d", [["TENSOR", [1, 512, 7, 7], "float32"], ["TENSOR", [512, 512, 3, 3], "float32"], [1, 1], [1, 1], [1, 1], "NCHW", "float32"], {}, ["conv2d", [1, 512, 7, 7, "float32"], [512, 512, 3, 3, "float32"], [1, 1], [1, 1], [1, 1], "NCHW", "float32"], {"i": 94026, "t": "winograd", "c": null, "e": [["tile_b", "sp", [16, 1, 1, 1]], ["tile_y", "sp", [8, 2, 16, 2]], ["tile_x", "sp", [2, 4, 2, 1]], ["tile_rc", "sp", [128, 4]], ["auto_unroll_max_step", "ot", 128], ["unroll_explicit", "ot", 0]]}], "r": [[9.76068e-05], 0, 1.2984280586242676, 1544017772.5515347], "v": 0.1}
{"i": ["cuda -model=unknown", "topi_nn_conv2d", [["TENSOR", [1, 512, 7, 7], "float32"], ["TENSOR", [512, 512, 3, 3], "float32"], [1, 1], [1, 1], [1, 1], "NCHW", "float32"], {}, ["conv2d", [1, 512, 7, 7, "float32"], [512, 512, 3, 3, "float32"], [1, 1], [1, 1], [1, 1], "NCHW", "float32"], {"i": 171026, "t": "winograd", "c": null, "e": [["tile_b", "sp", [16, 1, 1, 1]], ["tile_y", "sp", [8, 2, 16, 2]], ["tile_x", "sp", [2, 4, 2, 1]], ["tile_rc", "sp", [128, 4]], ["auto_unroll_max_step", "ot", 1500], ["unroll_explicit", "ot", 0]]}], "r": [[9.760545e-05], 0, 1.2554759979248047, 1544017773.21651], "v": 0.1}
{"i": ["cuda -model=unknown", "topi_nn_conv2d", [["TENSOR", [1, 512, 7, 7], "float32"], ["TENSOR", [512, 512, 3, 3], "float32"], [1, 1], [1, 1], [1, 1], "NCHW", "float32"], {}, ["conv2d", [1, 512, 7, 7, "float32"], [512, 512, 3, 3, "float32"], [1, 1], [1, 1], [1, 1], "NCHW", "float32"], {"i": 17026, "t": "winograd", "c": null, "e": [["tile_b", "sp", [16, 1, 1, 1]], ["tile_y", "sp", [8, 2, 16, 2]], ["tile_x", "sp", [2, 4, 2, 1]], ["tile_rc", "sp", [128, 4]], ["auto_unroll_max_step", "ot", 0], ["unroll_explicit", "ot", 0]]}], "r": [[0.00014511315], 0, 1.2737345695495605, 1544017773.8679168], "v": 0.1}
{"i": ["cuda -model=unknown", "topi_nn_conv2d", [["TENSOR", [1, 512, 7, 7], "float32"], ["TENSOR", [512, 512, 3, 3], "float32"], [1, 1], [1, 1], [1, 1], "NCHW", "float32"], {}, ["conv2d", [1, 512, 7, 7, "float32"], [512, 512, 3, 3, "float32"], [1, 1], [1, 1], [1, 1], "NCHW", "float32"], {"i": 323926, "t": "winograd", "c": null, "e": [["tile_b", "sp", [16, 1, 1, 1]], ["tile_y", "sp", [8, 2, 16, 2]], ["tile_x", "sp", [4, 4, 1, 1]], ["tile_rc", "sp", [128, 4]], ["auto_unroll_max_step", "ot", 128], ["unroll_explicit", "ot", 1]]}], "r": [[0.00016869785], 0, 1.3113853931427002, 1544017774.622849], "v": 0.1}
{"i": ["cuda -model=unknown", "topi_nn_conv2d", [["TENSOR", [1, 512, 7, 7], "float32"], ["TENSOR", [512, 512, 3, 3], "float32"], [1, 1], [1, 1], [1, 1], "NCHW", "float32"], {}, ["conv2d", [1, 512, 7, 7, "float32"], [512, 512, 3, 3, "float32"], [1, 1], [1, 1], [1, 1], "NCHW", "float32"], {"i": 246926, "t": "winograd", "c": null, "e": [["tile_b", "sp", [16, 1, 1, 1]], ["tile_y", "sp", [8, 2, 16, 2]], ["tile_x", "sp", [4, 4, 1, 1]], ["tile_rc", "sp", [128, 4]], ["auto_unroll_max_step", "ot", 0], ["unroll_explicit", "ot", 1]]}], "r": [[0.00019994425], 0, 1.2951586246490479, 1544017775.356687], "v": 0.1}
{"i": ["cuda -model=unknown", "topi_nn_conv2d", [["TENSOR", [1, 512, 7, 7], "float32"], ["TENSOR", [512, 512, 3, 3], "float32"], [1, 1], [1, 1], [1, 1], "NCHW", "float32"], {}, ["conv2d", [1, 512, 7, 7, "float32"], [512, 512, 3, 3, "float32"], [1, 1], [1, 1], [1, 1], "NCHW", "float32"], {"i": 400926, "t": "winograd", "c": null, "e": [["tile_b", "sp", [16, 1, 1, 1]], ["tile_y", "sp", [8, 2, 16, 2]], ["tile_x", "sp", [4, 4, 1, 1]], ["tile_rc", "sp", [128, 4]], ["auto_unroll_max_step", "ot", 1500], ["unroll_explicit", "ot", 1]]}], "r": [[0.000168784], 0, 1.2873966693878174, 1544017776.0426495], "v": 0.1}
{"i": ["cuda -model=unknown", "topi_nn_conv2d", [["TENSOR", [1, 512, 7, 7], "float32"], ["TENSOR", [512, 512, 3, 3], "float32"], [1, 1], [1, 1], [1, 1], "NCHW", "float32"], {}, ["conv2d", [1, 512, 7, 7, "float32"], [512, 512, 3, 3, "float32"], [1, 1], [1, 1], [1, 1], "NCHW", "float32"], {"i": 325031, "t": "winograd", "c": null, "e": [["tile_b", "sp", [16, 1, 1, 1]], ["tile_y", "sp", [4, 2, 32, 2]], ["tile_x", "sp", [2, 4, 2, 1]], ["tile_rc", "sp", [128, 4]], ["auto_unroll_max_step", "ot", 128], ["unroll_explicit", "ot", 1]]}], "r": [[0.00015931775], 0, 1.3395142555236816, 1544017776.781415], "v": 0.1}
{"i": ["cuda -model=unknown", "topi_nn_conv2d", [["TENSOR", [1, 512, 7, 7], "float32"], ["TENSOR", [512, 512, 3, 3], "float32"], [1, 1], [1, 1], [1, 1], "NCHW", "float32"], {}, ["conv2d", [1, 512, 7, 7, "float32"], [512, 512, 3, 3, "float32"], [1, 1], [1, 1], [1, 1], "NCHW", "float32"], {"i": 402031, "t": "winograd", "c": null, "e": [["tile_b", "sp", [16, 1, 1, 1]], ["tile_y", "sp", [4, 2, 32, 2]], ["tile_x", "sp", [2, 4, 2, 1]], ["tile_rc", "sp", [128, 4]], ["auto_unroll_max_step", "ot", 1500], ["unroll_explicit", "ot", 1]]}], "r": [[0.00016186519999999998], 0, 1.2458221912384033, 1544017777.4556549], "v": 0.1}
{"i": ["cuda -model=unknown", "topi_nn_conv2d", [["TENSOR", [1, 512, 7, 7], "float32"], ["TENSOR", [512, 512, 3, 3], "float32"], [1, 1], [1, 1], [1, 1], "NCHW", "float32"], {}, ["conv2d", [1, 512, 7, 7, "float32"], [512, 512, 3, 3, "float32"], [1, 1], [1, 1], [1, 1], "NCHW", "float32"], {"i": 248031, "t": "winograd", "c": null, "e": [["tile_b", "sp", [16, 1, 1, 1]], ["tile_y", "sp", [4, 2, 32, 2]], ["tile_x", "sp", [2, 4, 2, 1]], ["tile_rc", "sp", [128, 4]], ["auto_unroll_max_step", "ot", 0], ["unroll_explicit", "ot", 1]]}], "r": [[9.920199999999999e-05], 0, 1.3105401992797852, 1544017778.203503], "v": 0.1}
{"i": ["cuda -model=unknown", "topi_nn_conv2d", [["TENSOR", [1, 512, 7, 7], "float32"], ["TENSOR", [512, 512, 3, 3], "float32"], [1, 1], [1, 1], [1, 1], "NCHW", "float32"], {}, ["conv2d", [1, 512, 7, 7, "float32"], [512, 512, 3, 3, "float32"], [1, 1], [1, 1], [1, 1], "NCHW", "float32"], {"i": 325027, "t": "winograd", "c": null, "e": [["tile_b", "sp", [16, 1, 1, 1]], ["tile_y", "sp", [4, 4, 16, 2]], ["tile_x", "sp", [2, 4, 2, 1]], ["tile_rc", "sp", [128, 4]], ["auto_unroll_max_step", "ot", 128], ["unroll_explicit", "ot", 1]]}], "r": [[0.00022290374999999997], 0, 1.427225112915039, 1544017778.9678357], "v": 0.1}
{"i": ["cuda -model=unknown", "topi_nn_conv2d", [["TENSOR", [1, 512, 7, 7], "float32"], ["TENSOR", [512, 512, 3, 3], "float32"], [1, 1], [1, 1], [1, 1], "NCHW", "float32"], {}, ["conv2d", [1, 512, 7, 7, "float32"], [512, 512, 3, 3, "float32"], [1, 1], [1, 1], [1, 1], "NCHW", "float32"], {"i": 402027, "t": "winograd", "c": null, "e": [["tile_b", "sp", [16, 1, 1, 1]], ["tile_y", "sp", [4, 4, 16, 2]], ["tile_x", "sp", [2, 4, 2, 1]], ["tile_rc", "sp", [128, 4]], ["auto_unroll_max_step", "ot", 1500], ["unroll_explicit", "ot", 1]]}], "r": [[0.0002237778], 0, 1.3243358135223389, 1544017779.655382], "v": 0.1}
{"i": ["cuda -model=unknown", "topi_nn_conv2d", [["TENSOR", [1, 512, 7, 7], "float32"], ["TENSOR", [512, 512, 3, 3], "float32"], [1, 1], [1, 1], [1, 1], "NCHW", "float32"], {}, ["conv2d", [1, 512, 7, 7, "float32"], [512, 512, 3, 3, "float32"], [1, 1], [1, 1], [1, 1], "NCHW", "float32"], {"i": 248027, "t": "winograd", "c": null, "e": [["tile_b", "sp", [16, 1, 1, 1]], ["tile_y", "sp", [4, 4, 16, 2]], ["tile_x", "sp", [2, 4, 2, 1]], ["tile_rc", "sp", [128, 4]], ["auto_unroll_max_step", "ot", 0], ["unroll_explicit", "ot", 1]]}], "r": [[0.0001258494], 0, 1.2946820259094238, 1544017780.4160576], "v": 0.1}
{"i": ["cuda -model=unknown", "topi_nn_conv2d", [["TENSOR", [1, 512, 7, 7], "float32"], ["TENSOR", [512, 512, 3, 3], "float32"], [1, 1], [1, 1], [1, 1], "NCHW", "float32"], {}, ["conv2d", [1, 512, 7, 7, "float32"], [512, 512, 3, 3, "float32"], [1, 1], [1, 1], [1, 1], "NCHW", "float32"], {"i": 324146, "t": "winograd", "c": null, "e": [["tile_b", "sp", [16, 1, 1, 1]], ["tile_y", "sp", [8, 2, 16, 2]], ["tile_x", "sp", [2, 8, 1, 1]], ["tile_rc", "sp", [128, 4]], ["auto_unroll_max_step", "ot", 128], ["unroll_explicit", "ot", 1]]}], "r": [[0.00014568745000000002], 0, 1.427819013595581, 1544017781.1748886], "v": 0.1}
{"i": ["cuda -model=unknown", "topi_nn_conv2d", [["TENSOR", [1, 512, 7, 7], "float32"], ["TENSOR", [512, 512, 3, 3], "float32"], [1, 1], [1, 1], [1, 1], "NCHW", "float32"], {}, ["conv2d", [1, 512, 7, 7, "float32"], [512, 512, 3, 3, "float32"], [1, 1], [1, 1], [1, 1], "NCHW", "float32"], {"i": 247146, "t": "winograd", "c": null, "e": [["tile_b", "sp", [16, 1, 1, 1]], ["tile_y", "sp", [8, 2, 16, 2]], ["tile_x", "sp", [2, 8, 1, 1]], ["tile_rc", "sp", [128, 4]], ["auto_unroll_max_step", "ot", 0], ["unroll_explicit", "ot", 1]]}], "r": [[0.0001409332], 0, 1.2934036254882812, 1544017781.9266293], "v": 0.1}
{"i": ["cuda -model=unknown", "topi_nn_conv2d", [["TENSOR", [1, 512, 7, 7], "float32"], ["TENSOR", [512, 512, 3, 3], "float32"], [1, 1], [1, 1], [1, 1], "NCHW", "float32"], {}, ["conv2d", [1, 512, 7, 7, "float32"], [512, 512, 3, 3, "float32"], [1, 1], [1, 1], [1, 1], "NCHW", "float32"], {"i": 401146, "t": "winograd", "c": null, "e": [["tile_b", "sp", [16, 1, 1, 1]], ["tile_y", "sp", [8, 2, 16, 2]], ["tile_x", "sp", [2, 8, 1, 1]], ["tile_rc", "sp", [128, 4]], ["auto_unroll_max_step", "ot", 1500], ["unroll_explicit", "ot", 1]]}], "r": [[0.0001439786], 0, 1.3102812767028809, 1544017782.6125436], "v": 0.1}
{"i": ["cuda -model=unknown", "topi_nn_conv2d", [["TENSOR", [1, 512, 7, 7], "float32"], ["TENSOR", [512, 512, 3, 3], "float32"], [1, 1], [1, 1], [1, 1], "NCHW", "float32"], {}, ["conv2d", [1, 512, 7, 7, "float32"], [512, 512, 3, 3, "float32"], [1, 1], [1, 1], [1, 1], "NCHW", "float32"], {"i": 92926, "t": "winograd", "c": null, "e": [["tile_b", "sp", [16, 1, 1, 1]], ["tile_y", "sp", [8, 2, 16, 2]], ["tile_x", "sp", [4, 4, 1, 1]], ["tile_rc", "sp", [128, 4]], ["auto_unroll_max_step", "ot", 128], ["unroll_explicit", "ot", 0]]}], "r": [[0.0001684268], 0, 1.3710145950317383, 1544017783.3656676], "v": 0.1}
{"i": ["cuda -model=unknown", "topi_nn_conv2d", [["TENSOR", [1, 512, 7, 7], "float32"], ["TENSOR", [512, 512, 3, 3], "float32"], [1, 1], [1, 1], [1, 1], "NCHW", "float32"], {}, ["conv2d", [1, 512, 7, 7, "float32"], [512, 512, 3, 3, "float32"], [1, 1], [1, 1], [1, 1], "NCHW", "float32"], {"i": 169926, "t": "winograd", "c": null, "e": [["tile_b", "sp", [16, 1, 1, 1]], ["tile_y", "sp", [8, 2, 16, 2]], ["tile_x", "sp", [4, 4, 1, 1]], ["tile_rc", "sp", [128, 4]], ["auto_unroll_max_step", "ot", 1500], ["unroll_explicit", "ot", 0]]}], "r": [[0.00016567275], 0, 1.2421131134033203, 1544017784.0473948], "v": 0.1}
{"i": ["cuda -model=unknown", "topi_nn_conv2d", [["TENSOR", [1, 512, 7, 7], "float32"], ["TENSOR", [512, 512, 3, 3], "float32"], [1, 1], [1, 1], [1, 1], "NCHW", "float32"], {}, ["conv2d", [1, 512, 7, 7, "float32"], [512, 512, 3, 3, "float32"], [1, 1], [1, 1], [1, 1], "NCHW", "float32"], {"i": 15926, "t": "winograd", "c": null, "e": [["tile_b", "sp", [16, 1, 1, 1]], ["tile_y", "sp", [8, 2, 16, 2]], ["tile_x", "sp", [4, 4, 1, 1]], ["tile_rc", "sp", [128, 4]], ["auto_unroll_max_step", "ot", 0], ["unroll_explicit", "ot", 0]]}], "r": [[0.00020013505], 0, 1.24289870262146, 1544017784.7231793], "v": 0.1}
{"i": ["cuda -model=unknown", "topi_nn_conv2d", [["TENSOR", [1, 512, 7, 7], "float32"], ["TENSOR", [512, 512, 3, 3], "float32"], [1, 1], [1, 1], [1, 1], "NCHW", "float32"], {}, ["conv2d", [1, 512, 7, 7, "float32"], [512, 512, 3, 3, "float32"], [1, 1], [1, 1], [1, 1], "NCHW", "float32"], {"i": 171031, "t": "winograd", "c": null, "e": [["tile_b", "sp", [16, 1, 1, 1]], ["tile_y", "sp", [4, 2, 32, 2]], ["tile_x", "sp", [2, 4, 2, 1]], ["tile_rc", "sp", [128, 4]], ["auto_unroll_max_step", "ot", 1500], ["unroll_explicit", "ot", 0]]}], "r": [[0.00010044400000000002], 0, 1.1842215061187744, 1544017785.4102607], "v": 0.1}
{"i": ["cuda -model=unknown", "topi_nn_conv2d", [["TENSOR", [1, 512, 7, 7], "float32"], ["TENSOR", [512, 512, 3, 3], "float32"], [1, 1], [1, 1], [1, 1], "NCHW", "float32"], {}, ["conv2d", [1, 512, 7, 7, "float32"], [512, 512, 3, 3, "float32"], [1, 1], [1, 1], [1, 1], "NCHW", "float32"], {"i": 17031, "t": "winograd", "c": null, "e": [["tile_b", "sp", [16, 1, 1, 1]], ["tile_y", "sp", [4, 2, 32, 2]], ["tile_x", "sp", [2, 4, 2, 1]], ["tile_rc", "sp", [128, 4]], ["auto_unroll_max_step", "ot", 0], ["unroll_explicit", "ot", 0]]}], "r": [[0.00010109489999999999], 0, 1.2597413063049316, 1544017786.0739455], "v": 0.1}
{"i": ["cuda -model=unknown", "topi_nn_conv2d", [["TENSOR", [1, 512, 7, 7], "float32"], ["TENSOR", [512, 512, 3, 3], "float32"], [1, 1], [1, 1], [1, 1], "NCHW", "float32"], {}, ["conv2d", [1, 512, 7, 7, "float32"], [512, 512, 3, 3, "float32"], [1, 1], [1, 1], [1, 1], "NCHW", "float32"], {"i": 94031, "t": "winograd", "c": null, "e": [["tile_b", "sp", [16, 1, 1, 1]], ["tile_y", "sp", [4, 2, 32, 2]], ["tile_x", "sp", [2, 4, 2, 1]], ["tile_rc", "sp", [128, 4]], ["auto_unroll_max_step", "ot", 128], ["unroll_explicit", "ot", 0]]}], "r": [[0.0001010903], 0, 1.2346746921539307, 1544017786.7552228], "v": 0.1}
{"i": ["cuda -model=unknown", "topi_nn_conv2d", [["TENSOR", [1, 512, 7, 7], "float32"], ["TENSOR", [512, 512, 3, 3], "float32"], [1, 1], [1, 1], [1, 1], "NCHW", "float32"], {}, ["conv2d", [1, 512, 7, 7, "float32"], [512, 512, 3, 3, "float32"], [1, 1], [1, 1], [1, 1], "NCHW", "float32"], {"i": 94027, "t": "winograd", "c": null, "e": [["tile_b", "sp", [16, 1, 1, 1]], ["tile_y", "sp", [4, 4, 16, 2]], ["tile_x", "sp", [2, 4, 2, 1]], ["tile_rc", "sp", [128, 4]], ["auto_unroll_max_step", "ot", 128], ["unroll_explicit", "ot", 0]]}], "r": [[0.0001466274], 0, 1.3358819484710693, 1544017787.527259], "v": 0.1}
{"i": ["cuda -model=unknown", "topi_nn_conv2d", [["TENSOR", [1, 512, 7, 7], "float32"], ["TENSOR", [512, 512, 3, 3], "float32"], [1, 1], [1, 1], [1, 1], "NCHW", "float32"], {}, ["conv2d", [1, 512, 7, 7, "float32"], [512, 512, 3, 3, "float32"], [1, 1], [1, 1], [1, 1], "NCHW", "float32"], {"i": 17027, "t": "winograd", "c": null, "e": [["tile_b", "sp", [16, 1, 1, 1]], ["tile_y", "sp", [4, 4, 16, 2]], ["tile_x", "sp", [2, 4, 2, 1]], ["tile_rc", "sp", [128, 4]], ["auto_unroll_max_step", "ot", 0], ["unroll_explicit", "ot", 0]]}], "r": [[0.00012533234999999998], 0, 1.2393486499786377, 1544017788.196131], "v": 0.1}
{"i": ["cuda -model=unknown", "topi_nn_conv2d", [["TENSOR", [1, 512, 7, 7], "float32"], ["TENSOR", [512, 512, 3, 3], "float32"], [1, 1], [1, 1], [1, 1], "NCHW", "float32"], {}, ["conv2d", [1, 512, 7, 7, "float32"], [512, 512, 3, 3, "float32"], [1, 1], [1, 1], [1, 1], "NCHW", "float32"], {"i": 171027, "t": "winograd", "c": null, "e": [["tile_b", "sp", [16, 1, 1, 1]], ["tile_y", "sp", [4, 4, 16, 2]], ["tile_x", "sp", [2, 4, 2, 1]], ["tile_rc", "sp", [128, 4]], ["auto_unroll_max_step", "ot", 1500], ["unroll_explicit", "ot", 0]]}], "r": [[0.00015004325000000002], 0, 1.238987922668457, 1544017788.8882759], "v": 0.1}
{"i": ["cuda -model=unknown", "topi_nn_conv2d", [["TENSOR", [1, 512, 7, 7], "float32"], ["TENSOR", [512, 512, 3, 3], "float32"], [1, 1], [1, 1], [1, 1], "NCHW", "float32"], {}, ["conv2d", [1, 512, 7, 7, "float32"], [512, 512, 3, 3, "float32"], [1, 1], [1, 1], [1, 1], "NCHW", "float32"], {"i": 16146, "t": "winograd", "c": null, "e": [["tile_b", "sp", [16, 1, 1, 1]], ["tile_y", "sp", [8, 2, 16, 2]], ["tile_x", "sp", [2, 8, 1, 1]], ["tile_rc", "sp", [128, 4]], ["auto_unroll_max_step", "ot", 0], ["unroll_explicit", "ot", 0]]}], "r": [[0.00014025415], 0, 1.1994163990020752, 1544017789.572835], "v": 0.1}
{"i": ["cuda -model=unknown", "topi_nn_conv2d", [["TENSOR", [1, 512, 7, 7], "float32"], ["TENSOR", [512, 512, 3, 3], "float32"], [1, 1], [1, 1], [1, 1], "NCHW", "float32"], {}, ["conv2d", [1, 512, 7, 7, "float32"], [512, 512, 3, 3, "float32"], [1, 1], [1, 1], [1, 1], "NCHW", "float32"], {"i": 170146, "t": "winograd", "c": null, "e": [["tile_b", "sp", [16, 1, 1, 1]], ["tile_y", "sp", [8, 2, 16, 2]], ["tile_x", "sp", [2, 8, 1, 1]], ["tile_rc", "sp", [128, 4]], ["auto_unroll_max_step", "ot", 1500], ["unroll_explicit", "ot", 0]]}], "r": [[0.0001782756], 0, 1.326845407485962, 1544017790.343115], "v": 0.1}
{"i": ["cuda -model=unknown", "topi_nn_conv2d", [["TENSOR", [1, 512, 7, 7], "float32"], ["TENSOR", [512, 512, 3, 3], "float32"], [1, 1], [1, 1], [1, 1], "NCHW", "float32"], {}, ["conv2d", [1, 512, 7, 7, "float32"], [512, 512, 3, 3, "float32"], [1, 1], [1, 1], [1, 1], "NCHW", "float32"], {"i": 93146, "t": "winograd", "c": null, "e": [["tile_b", "sp", [16, 1, 1, 1]], ["tile_y", "sp", [8, 2, 16, 2]], ["tile_x", "sp", [2, 8, 1, 1]], ["tile_rc", "sp", [128, 4]], ["auto_unroll_max_step", "ot", 128], ["unroll_explicit", "ot", 0]]}], "r": [[0.0001774796], 0, 1.2533113956451416, 1544017791.0427015], "v": 0.1}
{"i": ["cuda -model=unknown", "topi_nn_conv2d", [["TENSOR", [1, 512, 7, 7], "float32"], ["TENSOR", [512, 512, 3, 3], "float32"], [1, 1], [1, 1], [1, 1], "NCHW", "float32"], {}, ["conv2d", [1, 512, 7, 7, "float32"], [512, 512, 3, 3, "float32"], [1, 1], [1, 1], [1, 1], "NCHW", "float32"], {"i": 246930, "t": "winograd", "c": null, "e": [["tile_b", "sp", [16, 1, 1, 1]], ["tile_y", "sp", [8, 1, 32, 2]], ["tile_x", "sp", [4, 4, 1, 1]], ["tile_rc", "sp", [128, 4]], ["auto_unroll_max_step", "ot", 0], ["unroll_explicit", "ot", 1]]}], "r": [[0.00018588175], 0, 1.2214491367340088, 1544017791.7647853], "v": 0.1}
{"i": ["cuda -model=unknown", "topi_nn_conv2d", [["TENSOR", [1, 512, 7, 7], "float32"], ["TENSOR", [512, 512, 3, 3], "float32"], [1, 1], [1, 1], [1, 1], "NCHW", "float32"], {}, ["conv2d", [1, 512, 7, 7, "float32"], [512, 512, 3, 3, "float32"], [1, 1], [1, 1], [1, 1], "NCHW", "float32"], {"i": 323930, "t": "winograd", "c": null, "e": [["tile_b", "sp", [16, 1, 1, 1]], ["tile_y", "sp", [8, 1, 32, 2]], ["tile_x", "sp", [4, 4, 1, 1]], ["tile_rc", "sp", [128, 4]], ["auto_unroll_max_step", "ot", 128], ["unroll_explicit", "ot", 1]]}], "r": [[0.00015091760000000002], 0, 1.2119836807250977, 1544017792.4901462], "v": 0.1}
{"i": ["cuda -model=unknown", "topi_nn_conv2d", [["TENSOR", [1, 512, 7, 7], "float32"], ["TENSOR", [512, 512, 3, 3], "float32"], [1, 1], [1, 1], [1, 1], "NCHW", "float32"], {}, ["conv2d", [1, 512, 7, 7, "float32"], [512, 512, 3, 3, "float32"], [1, 1], [1, 1], [1, 1], "NCHW", "float32"], {"i": 400930, "t": "winograd", "c": null, "e": [["tile_b", "sp", [16, 1, 1, 1]], ["tile_y", "sp", [8, 1, 32, 2]], ["tile_x", "sp", [4, 4, 1, 1]], ["tile_rc", "sp", [128, 4]], ["auto_unroll_max_step", "ot", 1500], ["unroll_explicit", "ot", 1]]}], "r": [[0.0001484472], 0, 1.2026076316833496, 1544017793.1617286], "v": 0.1}
{"i": ["cuda -model=unknown", "topi_nn_conv2d", [["TENSOR", [1, 512, 7, 7], "float32"], ["TENSOR", [512, 512, 3, 3], "float32"], [1, 1], [1, 1], [1, 1], "NCHW", "float32"], {}, ["conv2d", [1, 512, 7, 7, "float32"], [512, 512, 3, 3, "float32"], [1, 1], [1, 1], [1, 1], "NCHW", "float32"], {"i": 248034, "t": "winograd", "c": null, "e": [["tile_b", "sp", [16, 1, 1, 1]], ["tile_y", "sp", [4, 1, 64, 2]], ["tile_x", "sp", [2, 4, 2, 1]], ["tile_rc", "sp", [128, 4]], ["auto_unroll_max_step", "ot", 0], ["unroll_explicit", "ot", 1]]}], "r": [[9.692435e-05], 0, 1.1975693702697754, 1544017793.9022083], "v": 0.1}
{"i": ["cuda -model=unknown", "topi_nn_conv2d", [["TENSOR", [1, 512, 7, 7], "float32"], ["TENSOR", [512, 512, 3, 3], "float32"], [1, 1], [1, 1], [1, 1], "NCHW", "float32"], {}, ["conv2d", [1, 512, 7, 7, "float32"], [512, 512, 3, 3, "float32"], [1, 1], [1, 1], [1, 1], "NCHW", "float32"], {"i": 402034, "t": "winograd", "c": null, "e": [["tile_b", "sp", [16, 1, 1, 1]], ["tile_y", "sp", [4, 1, 64, 2]], ["tile_x", "sp", [2, 4, 2, 1]], ["tile_rc", "sp", [128, 4]], ["auto_unroll_max_step", "ot", 1500], ["unroll_explicit", "ot", 1]]}], "r": [[9.73774e-05], 0, 1.2034764289855957, 1544017794.6224859], "v": 0.1}
{"i": ["cuda -model=unknown", "topi_nn_conv2d", [["TENSOR", [1, 512, 7, 7], "float32"], ["TENSOR", [512, 512, 3, 3], "float32"], [1, 1], [1, 1], [1, 1], "NCHW", "float32"], {}, ["conv2d", [1, 512, 7, 7, "float32"], [512, 512, 3, 3, "float32"], [1, 1], [1, 1], [1, 1], "NCHW", "float32"], {"i": 325034, "t": "winograd", "c": null, "e": [["tile_b", "sp", [16, 1, 1, 1]], ["tile_y", "sp", [4, 1, 64, 2]], ["tile_x", "sp", [2, 4, 2, 1]], ["tile_rc", "sp", [128, 4]], ["auto_unroll_max_step", "ot", 128], ["unroll_explicit", "ot", 1]]}], "r": [[9.639355000000001e-05], 0, 1.1646265983581543, 1544017795.286641], "v": 0.1}
{"i": ["cuda -model=unknown", "topi_nn_conv2d", [["TENSOR", [1, 512, 7, 7], "float32"], ["TENSOR", [512, 512, 3, 3], "float32"], [1, 1], [1, 1], [1, 1], "NCHW", "float32"], {}, ["conv2d", [1, 512, 7, 7, "float32"], [512, 512, 3, 3, "float32"], [1, 1], [1, 1], [1, 1], "NCHW", "float32"], {"i": 266291, "t": "winograd", "c": null, "e": [["tile_b", "sp", [16, 1, 1, 1]], ["tile_y", "sp", [4, 2, 32, 2]], ["tile_x", "sp", [2, 2, 2, 2]], ["tile_rc", "sp", [32, 16]], ["auto_unroll_max_step", "ot", 0], ["unroll_explicit", "ot", 1]]}], "r": [[0.00011344314999999999], 0, 1.2762157917022705, 1544017844.070838], "v": 0.1}
{"i": ["cuda -model=unknown", "topi_nn_conv2d", [["TENSOR", [1, 512, 7, 7], "float32"], ["TENSOR", [512, 512, 3, 3], "float32"], [1, 1], [1, 1], [1, 1], "NCHW", "float32"], {}, ["conv2d", [1, 512, 7, 7, "float32"], [512, 512, 3, 3, "float32"], [1, 1], [1, 1], [1, 1], "NCHW", "float32"], {"i": 16814, "t": "winograd", "c": null, "e": [["tile_b", "sp", [16, 1, 1, 1]], ["tile_y", "sp", [4, 1, 64, 2]], ["tile_x", "sp", [4, 2, 2, 1]], ["tile_rc", "sp", [128, 4]], ["auto_unroll_max_step", "ot", 0], ["unroll_explicit", "ot", 0]]}], "r": [[0.00010523925], 0, 1.261786699295044, 1544017844.790768], "v": 0.1}
{"i": ["cuda -model=unknown", "topi_nn_conv2d", [["TENSOR", [1, 512, 7, 7], "float32"], ["TENSOR", [512, 512, 3, 3], "float32"], [1, 1], [1, 1], [1, 1], "NCHW", "float32"], {}, ["conv2d", [1, 512, 7, 7, "float32"], [512, 512, 3, 3, "float32"], [1, 1], [1, 1], [1, 1], "NCHW", "float32"], {"i": 17034, "t": "winograd", "c": null, "e": [["tile_b", "sp", [16, 1, 1, 1]], ["tile_y", "sp", [4, 1, 64, 2]], ["tile_x", "sp", [2, 4, 2, 1]], ["tile_rc", "sp", [128, 4]], ["auto_unroll_max_step", "ot", 0], ["unroll_explicit", "ot", 0]]}], "r": [[9.740270000000001e-05], 0, 1.2289166450500488, 1544017845.455073], "v": 0.1}
{"i": ["cuda -model=unknown", "topi_nn_conv2d", [["TENSOR", [1, 512, 7, 7], "float32"], ["TENSOR", [512, 512, 3, 3], "float32"], [1, 1], [1, 1], [1, 1], "NCHW", "float32"], {}, ["conv2d", [1, 512, 7, 7, "float32"], [512, 512, 3, 3, "float32"], [1, 1], [1, 1], [1, 1], "NCHW", "float32"], {"i": 35291, "t": "winograd", "c": null, "e": [["tile_b", "sp", [16, 1, 1, 1]], ["tile_y", "sp", [4, 2, 32, 2]], ["tile_x", "sp", [2, 2, 2, 2]], ["tile_rc", "sp", [32, 16]], ["auto_unroll_max_step", "ot", 0], ["unroll_explicit", "ot", 0]]}], "r": [[0.00011210485000000001], 0, 1.2212188243865967, 1544017846.1211252], "v": 0.1}
