feature_experiments_resnet18/final_results2/resnet-18-curve.log
{"i": ["cuda -model=unknown", "topi_nn_conv2d", [["TENSOR", [1, 512, 7, 7], "float32"], ["TENSOR", [512, 512, 3, 3], "float32"], [1, 1], [1, 1], [1, 1], "NCHW", "float32"], {}, ["conv2d", [1, 512, 7, 7, "float32"], [512, 512, 3, 3, "float32"], [1, 1], [1, 1], [1, 1], "NCHW", "float32"], {"i": 343511, "t": "winograd", "c": null, "e": [["tile_b", "sp", [16, 1, 1, 1]], ["tile_y", "sp", [4, 2, 32, 2]], ["tile_x", "sp", [1, 4, 2, 2]], ["tile_rc", "sp", [32, 16]], ["auto_unroll_max_step", "ot", 128], ["unroll_explicit", "ot", 1]]}], "r": [[7.92069e-05], 0, 1.2854061126708984, 1543979800.1331627], "v": 0.1}
{"i": ["cuda -model=unknown", "topi_nn_conv2d", [["TENSOR", [1, 256, 14, 14], "float32"], ["TENSOR", [512, 256, 1, 1], "float32"], [2, 2], [0, 0], [1, 1], "NCHW", "float32"], {}, ["conv2d", [1, 256, 14, 14, "float32"], [512, 256, 1, 1, "float32"], [2, 2], [0, 0], [1, 1], "NCHW", "float32"], {"i": 107400, "t": "direct", "c": null, "e": [["tile_f", "sp", [16, 1, 32, 1]], ["tile_y", "sp", [7, 1, 1, 1]], ["tile_x", "sp", [1, 1, 7, 1]], ["tile_rc", "sp", [32, 8]], ["tile_ry", "sp", [1, 1]], ["tile_rx", "sp", [1, 1]], ["auto_unroll_max_step", "ot", 0], ["unroll_explicit", "ot", 1]]}], "r": [[1.726145e-05], 0, 0.8434979915618896, 1543981143.428488], "v": 0.1}
{"i": ["cuda -model=unknown", "topi_nn_conv2d", [["TENSOR", [1, 256, 14, 14], "float32"], ["TENSOR", [512, 256, 3, 3], "float32"], [2, 2], [1, 1], [1, 1], "NCHW", "float32"], {}, ["conv2d", [1, 256, 14, 14, "float32"], [512, 256, 3, 3, "float32"], [2, 2], [1, 1], [1, 1], "NCHW", "float32"], {"i": 704705, "t": "direct", "c": null, "e": [["tile_f", "sp", [8, 1, 64, 1]], ["tile_y", "sp", [1, 1, 1, 7]], ["tile_x", "sp", [7, 1, 1, 1]], ["tile_rc", "sp", [64, 4]], ["tile_ry", "sp", [3, 1]], ["tile_rx", "sp", [1, 3]], ["auto_unroll_max_step", "ot", 1500], ["unroll_explicit", "ot", 1]]}], "r": [[0.00017460004999999998], 0, 1.191493034362793, 1543982250.1683955], "v": 0.1}
{"i": ["cuda -model=unknown", "topi_nn_conv2d", [["TENSOR", [1, 256, 14, 14], "float32"], ["TENSOR", [256, 256, 3, 3], "float32"], [1, 1], [1, 1], [1, 1], "NCHW", "float32"], {}, ["conv2d", [1, 256, 14, 14, "float32"], [256, 256, 3, 3, "float32"], [1, 1], [1, 1], [1, 1], "NCHW", "float32"], {"i": 7951, "t": "winograd", "c": null, "e": [["tile_b", "sp", [16, 1, 1, 1]], ["tile_y", "sp", [8, 2, 16, 1]], ["tile_x", "sp", [1, 1, 7, 7]], ["tile_rc", "sp", [16, 16]], ["auto_unroll_max_step", "ot", 0], ["unroll_explicit", "ot", 0]]}], "r": [[4.574375e-05], 0, 1.131363868713379, 1543982411.945531], "v": 0.1}
{"i": ["cuda -model=unknown", "topi_nn_conv2d", [["TENSOR", [1, 128, 28, 28], "float32"], ["TENSOR", [256, 128, 1, 1], "float32"], [2, 2], [0, 0], [1, 1], "NCHW", "float32"], {}, ["conv2d", [1, 128, 28, 28, "float32"], [256, 128, 1, 1, "float32"], [2, 2], [0, 0], [1, 1], "NCHW", "float32"], {"i": 1457335, "t": "direct", "c": null, "e": [["tile_f", "sp", [16, 4, 2, 2]], ["tile_y", "sp", [14, 1, 1, 1]], ["tile_x", "sp", [1, 1, 14, 1]], ["tile_rc", "sp", [32, 4]], ["tile_ry", "sp", [1, 1]], ["tile_rx", "sp", [1, 1]], ["auto_unroll_max_step", "ot", 512], ["unroll_explicit", "ot", 1]]}], "r": [[1.3661549999999998e-05], 0, 1.0351982116699219, 1543983795.4308565], "v": 0.1}
{"i": ["cuda -model=unknown", "topi_nn_conv2d", [["TENSOR", [1, 128, 28, 28], "float32"], ["TENSOR", [256, 128, 3, 3], "float32"], [2, 2], [1, 1], [1, 1], "NCHW", "float32"], {}, ["conv2d", [1, 128, 28, 28, "float32"], [256, 128, 3, 3, "float32"], [2, 2], [1, 1], [1, 1], "NCHW", "float32"], {"i": 3775959, "t": "direct", "c": null, "e": [["tile_f", "sp", [8, 1, 8, 4]], ["tile_y", "sp", [7, 1, 2, 1]], ["tile_x", "sp", [2, 1, 7, 1]], ["tile_rc", "sp", [64, 2]], ["tile_ry", "sp", [1, 3]], ["tile_rx", "sp", [1, 3]], ["auto_unroll_max_step", "ot", 1500], ["unroll_explicit", "ot", 0]]}], "r": [[6.50744e-05], 0, 1.105055809020996, 1543984695.496824], "v": 0.1}
{"i": ["cuda -model=unknown", "topi_nn_conv2d", [["TENSOR", [1, 128, 28, 28], "float32"], ["TENSOR", [128, 128, 3, 3], "float32"], [1, 1], [1, 1], [1, 1], "NCHW", "float32"], {}, ["conv2d", [1, 128, 28, 28, "float32"], [128, 128, 3, 3, "float32"], [1, 1], [1, 1], [1, 1], "NCHW", "float32"], {"i": 411766, "t": "winograd", "c": null, "e": [["tile_b", "sp", [16, 1, 1, 1]], ["tile_y", "sp", [4, 8, 2, 2]], ["tile_x", "sp", [2, 2, 49, 1]], ["tile_rc", "sp", [32, 4]], ["auto_unroll_max_step", "ot", 128], ["unroll_explicit", "ot", 1]]}], "r": [[4.326075e-05], 0, 1.248641014099121, 1543985860.325553], "v": 0.1}
{"i": ["cuda -model=unknown", "topi_nn_conv2d", [["TENSOR", [1, 64, 56, 56], "float32"], ["TENSOR", [128, 64, 1, 1], "float32"], [2, 2], [0, 0], [1, 1], "NCHW", "float32"], {}, ["conv2d", [1, 64, 56, 56, "float32"], [128, 64, 1, 1, "float32"], [2, 2], [0, 0], [1, 1], "NCHW", "float32"], {"i": 4488766, "t": "direct", "c": null, "e": [["tile_f", "sp", [4, 8, 2, 2]], ["tile_y", "sp", [14, 1, 2, 1]], ["tile_x", "sp", [2, 1, 14, 1]], ["tile_rc", "sp", [16, 4]], ["tile_ry", "sp", [1, 1]], ["tile_rx", "sp", [1, 1]], ["auto_unroll_max_step", "ot", 0], ["unroll_explicit", "ot", 1]]}], "r": [[1.18485e-05], 0, 1.0239543914794922, 1543987478.5885472], "v": 0.1}
{"i": ["cuda -model=unknown", "topi_nn_conv2d", [["TENSOR", [1, 64, 56, 56], "float32"], ["TENSOR", [128, 64, 3, 3], "float32"], [2, 2], [1, 1], [1, 1], "NCHW", "float32"], {}, ["conv2d", [1, 64, 56, 56, "float32"], [128, 64, 3, 3, "float32"], [2, 2], [1, 1], [1, 1], "NCHW", "float32"], {"i": 31180995, "t": "direct", "c": null, "e": [["tile_f", "sp", [8, 1, 4, 4]], ["tile_y", "sp", [14, 2, 1, 1]], ["tile_x", "sp", [1, 2, 14, 1]], ["tile_rc", "sp", [32, 2]], ["tile_ry", "sp", [1, 3]], ["tile_rx", "sp", [1, 3]], ["auto_unroll_max_step", "ot", 1500], ["unroll_explicit", "ot", 1]]}], "r": [[4.314235e-05], 0, 1.414419174194336, 1543987992.4405465], "v": 0.1}
{"i": ["cuda -model=unknown", "topi_nn_conv2d", [["TENSOR", [1, 64, 56, 56], "float32"], ["TENSOR", [64, 64, 1, 1], "float32"], [1, 1], [0, 0], [1, 1], "NCHW", "float32"], {}, ["conv2d", [1, 64, 56, 56, "float32"], [64, 64, 1, 1, "float32"], [1, 1], [0, 0], [1, 1], "NCHW", "float32"], {"i": 8702616, "t": "direct", "c": null, "e": [["tile_f", "sp", [1, 1, 32, 2]], ["tile_y", "sp", [14, 4, 1, 1]], ["tile_x", "sp", [7, 2, 4, 1]], ["tile_rc", "sp", [16, 4]], ["tile_ry", "sp", [1, 1]], ["tile_rx", "sp", [1, 1]], ["auto_unroll_max_step", "ot", 1500], ["unroll_explicit", "ot", 0]]}], "r": [[1.3108e-05], 0, 1.3149471282958984, 1543989678.7209344], "v": 0.1}
{"i": ["cuda -model=unknown", "topi_nn_conv2d", [["TENSOR", [1, 64, 56, 56], "float32"], ["TENSOR", [64, 64, 3, 3], "float32"], [1, 1], [1, 1], [1, 1], "NCHW", "float32"], {}, ["conv2d", [1, 64, 56, 56, "float32"], [64, 64, 3, 3, "float32"], [1, 1], [1, 1], [1, 1], "NCHW", "float32"], {"i": 262856, "t": "winograd", "c": null, "e": [["tile_b", "sp", [36, 1, 1, 1]], ["tile_y", "sp", [2, 4, 8, 1]], ["tile_x", "sp", [1, 7, 28, 1]], ["tile_rc", "sp", [8, 8]], ["auto_unroll_max_step", "ot", 128], ["unroll_explicit", "ot", 1]]}], "r": [[3.6718500000000004e-05], 0, 2.5487759113311768, 1543990102.0284712], "v": 0.1}
{"i": ["cuda -model=unknown", "topi_nn_conv2d", [["TENSOR", [1, 3, 224, 224], "float32"], ["TENSOR", [64, 3, 7, 7], "float32"], [2, 2], [3, 3], [1, 1], "NCHW", "float32"], {}, ["conv2d", [1, 3, 224, 224, "float32"], [64, 3, 7, 7, "float32"], [2, 2], [3, 3], [1, 1], "NCHW", "float32"], {"i": 11984381, "t": "direct", "c": null, "e": [["tile_f", "sp", [1, 16, 4, 1]], ["tile_y", "sp", [28, 2, 2, 1]], ["tile_x", "sp", [4, 1, 28, 1]], ["tile_rc", "sp", [1, 3]], ["tile_ry", "sp", [1, 7]], ["tile_rx", "sp", [1, 7]], ["auto_unroll_max_step", "ot", 0], ["unroll_explicit", "ot", 0]]}], "r": [[7.317410000000001e-05], 0, 1.089707851409912, 1543991964.5134382], "v": 0.1}
