resnet18-ablation/final_results2/resnet-18-curve-fix.log
{"i": ["cuda -model=unknown", "topi_nn_conv2d", [["TENSOR", [1, 512, 7, 7], "float32"], ["TENSOR", [512, 512, 3, 3], "float32"], [1, 1], [1, 1], [1, 1], "NCHW", "float32"], {}, ["conv2d", [1, 512, 7, 7, "float32"], [512, 512, 3, 3, "float32"], [1, 1], [1, 1], [1, 1], "NCHW", "float32"], {"i": 336026, "t": "winograd", "c": null, "e": [["tile_b", "sp", [16, 1, 1, 1]], ["tile_y", "sp", [8, 2, 16, 2]], ["tile_x", "sp", [2, 1, 4, 2]], ["tile_rc", "sp", [64, 8]], ["auto_unroll_max_step", "ot", 128], ["unroll_explicit", "ot", 1]]}], "r": [[6.759325e-05], 0, 1.3040657043457031, 1544017033.4855838], "v": 0.1}
{"i": ["cuda -model=unknown", "topi_nn_conv2d", [["TENSOR", [1, 256, 14, 14], "float32"], ["TENSOR", [512, 256, 1, 1], "float32"], [2, 2], [0, 0], [1, 1], "NCHW", "float32"], {}, ["conv2d", [1, 256, 14, 14, "float32"], [512, 256, 1, 1, "float32"], [2, 2], [0, 0], [1, 1], "NCHW", "float32"], {"i": 106068, "t": "direct", "c": null, "e": [["tile_f", "sp", [32, 2, 8, 1]], ["tile_y", "sp", [1, 1, 7, 1]], ["tile_x", "sp", [7, 1, 1, 1]], ["tile_rc", "sp", [32, 8]], ["tile_ry", "sp", [1, 1]], ["tile_rx", "sp", [1, 1]], ["auto_unroll_max_step", "ot", 0], ["unroll_explicit", "ot", 1]]}], "r": [[1.7770500000000002e-05], 0, 1.0309233665466309, 1544018139.9077613], "v": 0.1}
{"i": ["cuda -model=unknown", "topi_nn_conv2d", [["TENSOR", [1, 256, 14, 14], "float32"], ["TENSOR", [512, 256, 3, 3], "float32"], [2, 2], [1, 1], [1, 1], "NCHW", "float32"], {}, ["conv2d", [1, 256, 14, 14, "float32"], [512, 256, 3, 3, "float32"], [2, 2], [1, 1], [1, 1], "NCHW", "float32"], {"i": 297480, "t": "direct", "c": null, "e": [["tile_f", "sp", [16, 1, 32, 1]], ["tile_y", "sp", [7, 1, 1, 1]], ["tile_x", "sp", [1, 1, 7, 1]], ["tile_rc", "sp", [32, 8]], ["tile_ry", "sp", [1, 3]], ["tile_rx", "sp", [3, 1]], ["auto_unroll_max_step", "ot", 1500], ["unroll_explicit", "ot", 0]]}], "r": [[0.0001395372], 0, 1.2613496780395508, 1544019171.621786], "v": 0.1}
{"i": ["cuda -model=unknown", "topi_nn_conv2d", [["TENSOR", [1, 256, 14, 14], "float32"], ["TENSOR", [256, 256, 3, 3], "float32"], [1, 1], [1, 1], [1, 1], "NCHW", "float32"], {}, ["conv2d", [1, 256, 14, 14, "float32"], [256, 256, 3, 3, "float32"], [1, 1], [1, 1], [1, 1], "NCHW", "float32"], {"i": 66881, "t": "winograd", "c": null, "e": [["tile_b", "sp", [16, 1, 1, 1]], ["tile_y", "sp", [8, 8, 2, 2]], ["tile_x", "sp", [1, 1, 49, 1]], ["tile_rc", "sp", [16, 16]], ["auto_unroll_max_step", "ot", 128], ["unroll_explicit", "ot", 1]]}], "r": [[5.9951700000000004e-05], 0, 1.1027557849884033, 1544020438.258743], "v": 0.1}
{"i": ["cuda -model=unknown", "topi_nn_conv2d", [["TENSOR", [1, 128, 28, 28], "float32"], ["TENSOR", [256, 128, 1, 1], "float32"], [2, 2], [0, 0], [1, 1], "NCHW", "float32"], {}, ["conv2d", [1, 128, 28, 28, "float32"], [256, 128, 1, 1, "float32"], [2, 2], [0, 0], [1, 1], "NCHW", "float32"], {"i": 489416, "t": "direct", "c": null, "e": [["tile_f", "sp", [8, 4, 8, 1]], ["tile_y", "sp", [2, 1, 7, 1]], ["tile_x", "sp", [7, 1, 1, 2]], ["tile_rc", "sp", [16, 8]], ["tile_ry", "sp", [1, 1]], ["tile_rx", "sp", [1, 1]], ["auto_unroll_max_step", "ot", 512], ["unroll_explicit", "ot", 0]]}], "r": [[1.52152e-05], 0, 1.0764174461364746, 1544021208.9717681], "v": 0.1}
{"i": ["cuda -model=unknown", "topi_nn_conv2d", [["TENSOR", [1, 128, 28, 28], "float32"], ["TENSOR", [256, 128, 3, 3], "float32"], [2, 2], [1, 1], [1, 1], "NCHW", "float32"], {}, ["conv2d", [1, 128, 28, 28, "float32"], [256, 128, 3, 3, "float32"], [2, 2], [1, 1], [1, 1], "NCHW", "float32"], {"i": 3780511, "t": "direct", "c": null, "e": [["tile_f", "sp", [8, 2, 16, 1]], ["tile_y", "sp", [14, 1, 1, 1]], ["tile_x", "sp", [1, 1, 14, 1]], ["tile_rc", "sp", [64, 2]], ["tile_ry", "sp", [1, 3]], ["tile_rx", "sp", [1, 3]], ["auto_unroll_max_step", "ot", 1500], ["unroll_explicit", "ot", 0]]}], "r": [[6.354945e-05], 0, 1.095933437347412, 1544023297.7165842], "v": 0.1}
{"i": ["cuda -model=unknown", "topi_nn_conv2d", [["TENSOR", [1, 128, 28, 28], "float32"], ["TENSOR", [128, 128, 3, 3], "float32"], [1, 1], [1, 1], [1, 1], "NCHW", "float32"], {}, ["conv2d", [1, 128, 28, 28, "float32"], [128, 128, 3, 3, "float32"], [1, 1], [1, 1], [1, 1], "NCHW", "float32"], {"i": 435891, "t": "winograd", "c": null, "e": [["tile_b", "sp", [16, 1, 1, 1]], ["tile_y", "sp", [4, 4, 4, 2]], ["tile_x", "sp", [1, 4, 49, 1]], ["tile_rc", "sp", [8, 16]], ["auto_unroll_max_step", "ot", 128], ["unroll_explicit", "ot", 1]]}], "r": [[3.964005e-05], 0, 1.3529372215270996, 1544024532.4575481], "v": 0.1}
{"i": ["cuda -model=unknown", "topi_nn_conv2d", [["TENSOR", [1, 64, 56, 56], "float32"], ["TENSOR", [128, 64, 1, 1], "float32"], [2, 2], [0, 0], [1, 1], "NCHW", "float32"], {}, ["conv2d", [1, 64, 56, 56, "float32"], [128, 64, 1, 1, "float32"], [2, 2], [0, 0], [1, 1], "NCHW", "float32"], {"i": 6024051, "t": "direct", "c": null, "e": [["tile_f", "sp", [4, 4, 4, 2]], ["tile_y", "sp", [28, 1, 1, 1]], ["tile_x", "sp", [2, 1, 14, 1]], ["tile_rc", "sp", [8, 8]], ["tile_ry", "sp", [1, 1]], ["tile_rx", "sp", [1, 1]], ["auto_unroll_max_step", "ot", 512], ["unroll_explicit", "ot", 1]]}], "r": [[8.075550000000001e-06], 0, 0.9778318405151367, 1544026827.71087], "v": 0.1}
{"i": ["cuda -model=unknown", "topi_nn_conv2d", [["TENSOR", [1, 64, 56, 56], "float32"], ["TENSOR", [128, 64, 3, 3], "float32"], [2, 2], [1, 1], [1, 1], "NCHW", "float32"], {}, ["conv2d", [1, 64, 56, 56, "float32"], [128, 64, 3, 3, "float32"], [2, 2], [1, 1], [1, 1], "NCHW", "float32"], {"i": 9674187, "t": "direct", "c": null, "e": [["tile_f", "sp", [4, 2, 16, 1]], ["tile_y", "sp", [14, 1, 1, 2]], ["tile_x", "sp", [2, 1, 14, 1]], ["tile_rc", "sp", [32, 2]], ["tile_ry", "sp", [1, 3]], ["tile_rx", "sp", [1, 3]], ["auto_unroll_max_step", "ot", 512], ["unroll_explicit", "ot", 0]]}], "r": [[3.876385e-05], 0, 0.9995436668395996, 1544027915.1219144], "v": 0.1}
{"i": ["cuda -model=unknown", "topi_nn_conv2d", [["TENSOR", [1, 64, 56, 56], "float32"], ["TENSOR", [64, 64, 1, 1], "float32"], [1, 1], [0, 0], [1, 1], "NCHW", "float32"], {}, ["conv2d", [1, 64, 56, 56, "float32"], [64, 64, 1, 1, "float32"], [1, 1], [0, 0], [1, 1], "NCHW", "float32"], {"i": 5560005, "t": "direct", "c": null, "e": [["tile_f", "sp", [1, 4, 8, 2]], ["tile_y", "sp", [28, 1, 1, 2]], ["tile_x", "sp", [2, 1, 28, 1]], ["tile_rc", "sp", [8, 8]], ["tile_ry", "sp", [1, 1]], ["tile_rx", "sp", [1, 1]], ["auto_unroll_max_step", "ot", 512], ["unroll_explicit", "ot", 0]]}], "r": [[1.003065e-05], 0, 1.0483012199401855, 1544028491.5263643], "v": 0.1}
{"i": ["cuda -model=unknown", "topi_nn_conv2d", [["TENSOR", [1, 64, 56, 56], "float32"], ["TENSOR", [64, 64, 3, 3], "float32"], [1, 1], [1, 1], [1, 1], "NCHW", "float32"], {}, ["conv2d", [1, 64, 56, 56, "float32"], [64, 64, 3, 3, "float32"], [1, 1], [1, 1], [1, 1], "NCHW", "float32"], {"i": 321446, "t": "winograd", "c": null, "e": [["tile_b", "sp", [36, 1, 1, 1]], ["tile_y", "sp", [1, 2, 8, 4]], ["tile_x", "sp", [2, 7, 14, 1]], ["tile_rc", "sp", [8, 8]], ["auto_unroll_max_step", "ot", 1500], ["unroll_explicit", "ot", 1]]}], "r": [[3.38306e-05], 0, 2.784911870956421, 1544030595.850199], "v": 0.1}
{"i": ["cuda -model=unknown", "topi_nn_conv2d", [["TENSOR", [1, 3, 224, 224], "float32"], ["TENSOR", [64, 3, 7, 7], "float32"], [2, 2], [3, 3], [1, 1], "NCHW", "float32"], {}, ["conv2d", [1, 3, 224, 224, "float32"], [64, 3, 7, 7, "float32"], [2, 2], [3, 3], [1, 1], "NCHW", "float32"], {"i": 60058620, "t": "direct", "c": null, "e": [["tile_f", "sp", [1, 1, 32, 2]], ["tile_y", "sp", [16, 7, 1, 1]], ["tile_x", "sp", [7, 1, 8, 2]], ["tile_rc", "sp", [3, 1]], ["tile_ry", "sp", [7, 1]], ["tile_rx", "sp", [1, 7]], ["auto_unroll_max_step", "ot", 512], ["unroll_explicit", "ot", 1]]}], "r": [[6.442095000000001e-05], 0, 1.2472574710845947, 1544031319.8082612], "v": 0.1}
