feature_experiments_c7/final_results/conv2d_knob_c7.log
{"i": ["cuda", "conv2d_no_batching", [1, 28, 28, 128, 256, 3, 3, [2, 2], [1, 1]], {}, ["conv2d_no_batching", 1, 28, 28, 128, 256, 3, 3, [2, 2], [1, 1]], {"i": 32105944, "t": "", "c": null, "e": [["tile_f", "sp", [32, 1, 1, 4]], ["tile_y", "sp", [1, 2, 1, 7]], ["tile_x", "sp", [7, 2, 1, 1]], ["tile_rc", "sp", [64, 2, 2]], ["tile_ry", "sp", [1, 1, 3]], ["tile_rx", "sp", [1, 3, 1]], ["auto_unroll_max_step", "ot", 1500], ["unroll_explicit", "ot", 0]]}], "r": [[0.003951239118918919], 0, 4.457117319107056, 1543981872.1812735], "v": 0.1}
{"i": ["cuda", "conv2d_no_batching", [1, 28, 28, 128, 256, 3, 3, [2, 2], [1, 1]], {}, ["conv2d_no_batching", 1, 28, 28, 128, 256, 3, 3, [2, 2], [1, 1]], {"i": 19686422, "t": "", "c": null, "e": [["tile_f", "sp", [1, 2, 32, 2]], ["tile_y", "sp", [1, 7, 2, 1]], ["tile_x", "sp", [1, 2, 1, 7]], ["tile_rc", "sp", [64, 2, 2]], ["tile_ry", "sp", [1, 1, 3]], ["tile_rx", "sp", [1, 3, 1]], ["auto_unroll_max_step", "ot", 512], ["unroll_explicit", "ot", 0]]}], "r": [[0.012123267794594595], 0, 9.114351034164429, 1543981879.8623009], "v": 0.1}
{"i": ["cuda", "conv2d_no_batching", [1, 28, 28, 128, 256, 3, 3, [2, 2], [1, 1]], {}, ["conv2d_no_batching", 1, 28, 28, 128, 256, 3, 3, [2, 2], [1, 1]], {"i": 41576411, "t": "", "c": null, "e": [["tile_f", "sp", [8, 8, 2, 1]], ["tile_y", "sp", [2, 1, 7, 1]], ["tile_x", "sp", [2, 1, 7, 1]], ["tile_rc", "sp", [32, 8, 1]], ["tile_ry", "sp", [3, 1, 1]], ["tile_rx", "sp", [1, 3, 1]], ["auto_unroll_max_step", "ot", 0], ["unroll_explicit", "ot", 1]]}], "r": [[0.0005545215520833334], 0, 1.213651180267334, 1543981898.3677258], "v": 0.1}
{"i": ["cuda", "conv2d_no_batching", [1, 28, 28, 128, 256, 3, 3, [2, 2], [1, 1]], {}, ["conv2d_no_batching", 1, 28, 28, 128, 256, 3, 3, [2, 2], [1, 1]], {"i": 13855797, "t": "", "c": null, "e": [["tile_f", "sp", [1, 2, 1, 64]], ["tile_y", "sp", [1, 1, 14, 1]], ["tile_x", "sp", [14, 1, 1, 1]], ["tile_rc", "sp", [128, 2, 1]], ["tile_ry", "sp", [1, 3, 1]], ["tile_rx", "sp", [3, 1, 1]], ["auto_unroll_max_step", "ot", 512], ["unroll_explicit", "ot", 0]]}], "r": [[0.006827631189189189], 0, 5.179024696350098, 1543981885.4539998], "v": 0.1}
{"i": ["cuda", "conv2d_no_batching", [1, 28, 28, 128, 256, 3, 3, [2, 2], [1, 1]], {}, ["conv2d_no_batching", 1, 28, 28, 128, 256, 3, 3, [2, 2], [1, 1]], {"i": 13890421, "t": "", "c": null, "e": [["tile_f", "sp", [2, 1, 32, 2]], ["tile_y", "sp", [7, 1, 1, 2]], ["tile_x", "sp", [2, 7, 1, 1]], ["tile_rc", "sp", [64, 4, 1]], ["tile_ry", "sp", [1, 3, 1]], ["tile_rx", "sp", [3, 1, 1]], ["auto_unroll_max_step", "ot", 512], ["unroll_explicit", "ot", 0]]}], "r": [[0.0005230086822916667], 0, 1.1987426280975342, 1543981899.3391886], "v": 0.1}
{"i": ["cuda", "conv2d_no_batching", [1, 28, 28, 128, 256, 3, 3, [2, 2], [1, 1]], {}, ["conv2d_no_batching", 1, 28, 28, 128, 256, 3, 3, [2, 2], [1, 1]], {"i": 4168741, "t": "", "c": null, "e": [["tile_f", "sp", [2, 1, 32, 2]], ["tile_y", "sp", [1, 14, 1, 1]], ["tile_x", "sp", [1, 1, 7, 2]], ["tile_rc", "sp", [256, 1, 1]], ["tile_ry", "sp", [3, 1, 1]], ["tile_rx", "sp", [1, 3, 1]], ["auto_unroll_max_step", "ot", 0], ["unroll_explicit", "ot", 0]]}], "r": [[0.0009685543513513513], 0, 1.4825677871704102, 1543981887.6051397], "v": 0.1}
{"i": ["cuda", "conv2d_no_batching", [1, 28, 28, 128, 256, 3, 3, [2, 2], [1, 1]], {}, ["conv2d_no_batching", 1, 28, 28, 128, 256, 3, 3, [2, 2], [1, 1]], {"i": 63316998, "t": "", "c": null, "e": [["tile_f", "sp", [1, 8, 4, 4]], ["tile_y", "sp", [7, 1, 1, 2]], ["tile_x", "sp", [7, 2, 1, 1]], ["tile_rc", "sp", [4, 2, 32]], ["tile_ry", "sp", [3, 1, 1]], ["tile_rx", "sp", [3, 1, 1]], ["auto_unroll_max_step", "ot", 1500], ["unroll_explicit", "ot", 1]]}], "r": [[0.005985878518918918], 0, 8.53131651878357, 1543981891.7888858], "v": 0.1}
{"i": ["cuda", "conv2d_no_batching", [1, 28, 28, 128, 256, 3, 3, [2, 2], [1, 1]], {}, ["conv2d_no_batching", 1, 28, 28, 128, 256, 3, 3, [2, 2], [1, 1]], {"i": 32575750, "t": "", "c": null, "e": [["tile_f", "sp", [16, 1, 2, 4]], ["tile_y", "sp", [1, 1, 14, 1]], ["tile_x", "sp", [2, 1, 7, 1]], ["tile_rc", "sp", [16, 2, 8]], ["tile_ry", "sp", [1, 1, 3]], ["tile_rx", "sp", [1, 3, 1]], ["auto_unroll_max_step", "ot", 1500], ["unroll_explicit", "ot", 0]]}], "r": [[0.0009709696918918919], 0, 2.039409637451172, 1543981893.2357993], "v": 0.1}
{"i": ["cuda", "conv2d_no_batching", [1, 28, 28, 128, 256, 3, 3, [2, 2], [1, 1]], {}, ["conv2d_no_batching", 1, 28, 28, 128, 256, 3, 3, [2, 2], [1, 1]], {"i": 62326437, "t": "", "c": null, "e": [["tile_f", "sp", [1, 2, 1, 64]], ["tile_y", "sp", [1, 7, 1, 2]], ["tile_x", "sp", [1, 2, 1, 7]], ["tile_rc", "sp", [32, 8, 1]], ["tile_ry", "sp", [3, 1, 1]], ["tile_rx", "sp", [3, 1, 1]], ["auto_unroll_max_step", "ot", 1500], ["unroll_explicit", "ot", 1]]}], "r": [[0.64622658625], 0, 15.691835641860962, 1543981866.1862526], "v": 0.1}
{"i": ["cuda", "conv2d_no_batching", [1, 28, 28, 128, 256, 3, 3, [2, 2], [1, 1]], {}, ["conv2d_no_batching", 1, 28, 28, 128, 256, 3, 3, [2, 2], [1, 1]], {"i": 38876236, "t": "", "c": null, "e": [["tile_f", "sp", [4, 2, 4, 4]], ["tile_y", "sp", [14, 1, 1, 1]], ["tile_x", "sp", [1, 1, 14, 1]], ["tile_rc", "sp", [8, 32, 1]], ["tile_ry", "sp", [1, 3, 1]], ["tile_rx", "sp", [3, 1, 1]], ["auto_unroll_max_step", "ot", 0], ["unroll_explicit", "ot", 1]]}], "r": [[0.0005356476458333333], 0, 1.1889958381652832, 1543981900.2909062], "v": 0.1}
{"i": ["cuda", "conv2d_no_batching", [1, 28, 28, 128, 256, 3, 3, [2, 2], [1, 1]], {}, ["conv2d_no_batching", 1, 28, 28, 128, 256, 3, 3, [2, 2], [1, 1]], {"i": 14193783, "t": "", "c": null, "e": [["tile_f", "sp", [1, 1, 64, 2]], ["tile_y", "sp", [7, 1, 1, 2]], ["tile_x", "sp", [14, 1, 1, 1]], ["tile_rc", "sp", [16, 8, 2]], ["tile_ry", "sp", [1, 3, 1]], ["tile_rx", "sp", [3, 1, 1]], ["auto_unroll_max_step", "ot", 512], ["unroll_explicit", "ot", 0]]}], "r": [[0.0005775153567567567], 0, 1.3701739311218262, 1543981895.2315276], "v": 0.1}
{"i": ["cuda", "conv2d_no_batching", [1, 28, 28, 128, 256, 3, 3, [2, 2], [1, 1]], {}, ["conv2d_no_batching", 1, 28, 28, 128, 256, 3, 3, [2, 2], [1, 1]], {"i": 9048320, "t": "", "c": null, "e": [["tile_f", "sp", [2, 2, 8, 4]], ["tile_y", "sp", [1, 7, 1, 2]], ["tile_x", "sp", [1, 1, 14, 1]], ["tile_rc", "sp", [32, 1, 8]], ["tile_ry", "sp", [3, 1, 1]], ["tile_rx", "sp", [1, 1, 3]], ["auto_unroll_max_step", "ot", 0], ["unroll_explicit", "ot", 0]]}], "r": [[0.0025894538], 0, 3.6244351863861084, 1543981897.4210732], "v": 0.1}
{"i": ["cuda", "conv2d_no_batching", [1, 28, 28, 128, 256, 3, 3, [2, 2], [1, 1]], {}, ["conv2d_no_batching", 1, 28, 28, 128, 256, 3, 3, [2, 2], [1, 1]], {"i": 51478967, "t": "", "c": null, "e": [["tile_f", "sp", [2, 16, 2, 2]], ["tile_y", "sp", [1, 1, 1, 14]], ["tile_x", "sp", [1, 1, 7, 2]], ["tile_rc", "sp", [64, 2, 2]], ["tile_ry", "sp", [1, 3, 1]], ["tile_rx", "sp", [3, 1, 1]], ["auto_unroll_max_step", "ot", 512], ["unroll_explicit", "ot", 1]]}], "r": [[0.03332033001041667], 0, 30.930471658706665, 1543981934.7652433], "v": 0.1}
{"i": ["cuda", "conv2d_no_batching", [1, 28, 28, 128, 256, 3, 3, [2, 2], [1, 1]], {}, ["conv2d_no_batching", 1, 28, 28, 128, 256, 3, 3, [2, 2], [1, 1]], {"i": 4549150, "t": "", "c": null, "e": [["tile_f", "sp", [16, 1, 2, 4]], ["tile_y", "sp", [1, 7, 2, 1]], ["tile_x", "sp", [7, 2, 1, 1]], ["tile_rc", "sp", [8, 16, 2]], ["tile_ry", "sp", [3, 1, 1]], ["tile_rx", "sp", [1, 3, 1]], ["auto_unroll_max_step", "ot", 0], ["unroll_explicit", "ot", 0]]}], "r": [[0.0014553238333333334], 0, 1.8986790180206299, 1543981936.3954968], "v": 0.1}
{"i": ["cuda", "conv2d_no_batching", [1, 28, 28, 128, 256, 3, 3, [2, 2], [1, 1]], {}, ["conv2d_no_batching", 1, 28, 28, 128, 256, 3, 3, [2, 2], [1, 1]], {"i": 39071941, "t": "", "c": null, "e": [["tile_f", "sp", [2, 1, 32, 2]], ["tile_y", "sp", [1, 1, 1, 14]], ["tile_x", "sp", [1, 2, 1, 7]], ["tile_rc", "sp", [32, 4, 2]], ["tile_ry", "sp", [1, 3, 1]], ["tile_rx", "sp", [3, 1, 1]], ["auto_unroll_max_step", "ot", 0], ["unroll_explicit", "ot", 1]]}], "r": [[0.020966626520833333], 0, 14.071212530136108, 1543981949.4092543], "v": 0.1}
{"i": ["cuda", "conv2d_no_batching", [1, 28, 28, 128, 256, 3, 3, [2, 2], [1, 1]], {}, ["conv2d_no_batching", 1, 28, 28, 128, 256, 3, 3, [2, 2], [1, 1]], {"i": 15558160, "t": "", "c": null, "e": [["tile_f", "sp", [4, 16, 1, 2]], ["tile_y", "sp", [1, 14, 1, 1]], ["tile_x", "sp", [1, 2, 7, 1]], ["tile_rc", "sp", [32, 4, 2]], ["tile_ry", "sp", [1, 1, 3]], ["tile_rx", "sp", [3, 1, 1]], ["auto_unroll_max_step", "ot", 512], ["unroll_explicit", "ot", 0]]}], "r": [[0.04651155490104167], 0, 33.035948514938354, 1543981979.7322617], "v": 0.1}
{"i": ["cuda", "conv2d_no_batching", [1, 28, 28, 128, 256, 3, 3, [2, 2], [1, 1]], {}, ["conv2d_no_batching", 1, 28, 28, 128, 256, 3, 3, [2, 2], [1, 1]], {"i": 61767526, "t": "", "c": null, "e": [["tile_f", "sp", [4, 8, 2, 2]], ["tile_y", "sp", [7, 1, 1, 2]], ["tile_x", "sp", [1, 7, 1, 2]], ["tile_rc", "sp", [16, 1, 16]], ["tile_ry", "sp", [1, 1, 3]], ["tile_rx", "sp", [1, 1, 3]], ["auto_unroll_max_step", "ot", 512], ["unroll_explicit", "ot", 1]]}], "r": [[0.020262736453125], 0, 15.282817840576172, 1543981992.5977147], "v": 0.1}
{"i": ["cuda", "conv2d_no_batching", [1, 28, 28, 128, 256, 3, 3, [2, 2], [1, 1]], {}, ["conv2d_no_batching", 1, 28, 28, 128, 256, 3, 3, [2, 2], [1, 1]], {"i": 46203996, "t": "", "c": null, "e": [["tile_f", "sp", [64, 1, 1, 2]], ["tile_y", "sp", [7, 1, 1, 2]], ["tile_x", "sp", [14, 1, 1, 1]], ["tile_rc", "sp", [16, 4, 4]], ["tile_ry", "sp", [3, 1, 1]], ["tile_rx", "sp", [1, 1, 3]], ["auto_unroll_max_step", "ot", 0], ["unroll_explicit", "ot", 1]]}], "r": [[0.0036012336875], 0, 3.090651273727417, 1543981995.5253756], "v": 0.1}
{"i": ["cuda", "conv2d_no_batching", [1, 28, 28, 128, 256, 3, 3, [2, 2], [1, 1]], {}, ["conv2d_no_batching", 1, 28, 28, 128, 256, 3, 3, [2, 2], [1, 1]], {"i": 56818882, "t": "", "c": null, "e": [["tile_f", "sp", [2, 1, 16, 4]], ["tile_y", "sp", [2, 7, 1, 1]], ["tile_x", "sp", [7, 1, 1, 2]], ["tile_rc", "sp", [16, 16, 1]], ["tile_ry", "sp", [1, 1, 3]], ["tile_rx", "sp", [1, 3, 1]], ["auto_unroll_max_step", "ot", 512], ["unroll_explicit", "ot", 1]]}], "r": [[0.0007335794270833334], 0, 1.7286462783813477, 1543981996.78113], "v": 0.1}
{"i": ["cuda", "conv2d_no_batching", [1, 28, 28, 128, 256, 3, 3, [2, 2], [1, 1]], {}, ["conv2d_no_batching", 1, 28, 28, 128, 256, 3, 3, [2, 2], [1, 1]], {"i": 4529083, "t": "", "c": null, "e": [["tile_f", "sp", [32, 1, 2, 2]], ["tile_y", "sp", [1, 1, 2, 7]], ["tile_x", "sp", [2, 1, 7, 1]], ["tile_rc", "sp", [16, 8, 2]], ["tile_ry", "sp", [3, 1, 1]], ["tile_rx", "sp", [1, 3, 1]], ["auto_unroll_max_step", "ot", 0], ["unroll_explicit", "ot", 0]]}], "r": [[0.002788902140625], 0, 2.6896846294403076, 1543982030.8904238], "v": 0.1}
{"i": ["cuda", "conv2d_no_batching", [1, 28, 28, 128, 256, 3, 3, [2, 2], [1, 1]], {}, ["conv2d_no_batching", 1, 28, 28, 128, 256, 3, 3, [2, 2], [1, 1]], {"i": 25837232, "t": "", "c": null, "e": [["tile_f", "sp", [1, 4, 32, 1]], ["tile_y", "sp", [1, 1, 2, 7]], ["tile_x", "sp", [14, 1, 1, 1]], ["tile_rc", "sp", [8, 2, 16]], ["tile_ry", "sp", [3, 1, 1]], ["tile_rx", "sp", [3, 1, 1]], ["auto_unroll_max_step", "ot", 1500], ["unroll_explicit", "ot", 0]]}], "r": [[0.0007789686718750001], 0, 2.0215439796447754, 1543982032.5148976], "v": 0.1}
{"i": ["cuda", "conv2d_no_batching", [1, 28, 28, 128, 256, 3, 3, [2, 2], [1, 1]], {}, ["conv2d_no_batching", 1, 28, 28, 128, 256, 3, 3, [2, 2], [1, 1]], {"i": 24035951, "t": "", "c": null, "e": [["tile_f", "sp", [8, 2, 2, 4]], ["tile_y", "sp", [1, 1, 7, 2]], ["tile_x", "sp", [2, 1, 7, 1]], ["tile_rc", "sp", [64, 1, 4]], ["tile_ry", "sp", [1, 1, 3]], ["tile_rx", "sp", [1, 1, 3]], ["auto_unroll_max_step", "ot", 512], ["unroll_explicit", "ot", 0]]}], "r": [[0.0009935704791666667], 0, 2.206648588180542, 1543982034.3027358], "v": 0.1}
{"i": ["cuda", "conv2d_no_batching", [1, 28, 28, 128, 256, 3, 3, [2, 2], [1, 1]], {}, ["conv2d_no_batching", 1, 28, 28, 128, 256, 3, 3, [2, 2], [1, 1]], {"i": 61218250, "t": "", "c": null, "e": [["tile_f", "sp", [16, 4, 2, 1]], ["tile_y", "sp", [1, 1, 14, 1]], ["tile_x", "sp", [2, 1, 1, 7]], ["tile_rc", "sp", [16, 8, 2]], ["tile_ry", "sp", [1, 1, 3]], ["tile_rx", "sp", [1, 1, 3]], ["auto_unroll_max_step", "ot", 512], ["unroll_explicit", "ot", 1]]}], "r": [[0.0007806922135416666], 0, 6.2581586837768555, 1543982038.640009], "v": 0.1}
{"i": ["cuda", "conv2d_no_batching", [1, 28, 28, 128, 256, 3, 3, [2, 2], [1, 1]], {}, ["conv2d_no_batching", 1, 28, 28, 128, 256, 3, 3, [2, 2], [1, 1]], {"i": 21260749, "t": "", "c": null, "e": [["tile_f", "sp", [1, 1, 8, 16]], ["tile_y", "sp", [7, 1, 2, 1]], ["tile_x", "sp", [7, 2, 1, 1]], ["tile_rc", "sp", [64, 1, 4]], ["tile_ry", "sp", [3, 1, 1]], ["tile_rx", "sp", [1, 1, 3]], ["auto_unroll_max_step", "ot", 512], ["unroll_explicit", "ot", 0]]}], "r": [[0.000681952828125], 0, 1.6436409950256348, 1543982039.9345515], "v": 0.1}
{"i": ["cuda", "conv2d_no_batching", [1, 28, 28, 128, 256, 3, 3, [2, 2], [1, 1]], {}, ["conv2d_no_batching", 1, 28, 28, 128, 256, 3, 3, [2, 2], [1, 1]], {"i": 10204563, "t": "", "c": null, "e": [["tile_f", "sp", [16, 8, 1, 1]], ["tile_y", "sp", [1, 1, 2, 7]], ["tile_x", "sp", [2, 7, 1, 1]], ["tile_rc", "sp", [64, 1, 4]], ["tile_ry", "sp", [1, 3, 1]], ["tile_rx", "sp", [1, 1, 3]], ["auto_unroll_max_step", "ot", 0], ["unroll_explicit", "ot", 0]]}], "r": [[0.03702334986458333], 0, 22.97386121749878, 1543982062.2827482], "v": 0.1}
{"i": ["cuda", "conv2d_no_batching", [1, 28, 28, 128, 256, 3, 3, [2, 2], [1, 1]], {}, ["conv2d_no_batching", 1, 28, 28, 128, 256, 3, 3, [2, 2], [1, 1]], {"i": 30044564, "t": "", "c": null, "e": [["tile_f", "sp", [16, 2, 2, 2]], ["tile_y", "sp", [1, 14, 1, 1]], ["tile_x", "sp", [14, 1, 1, 1]], ["tile_rc", "sp", [2, 8, 16]], ["tile_ry", "sp", [3, 1, 1]], ["tile_rx", "sp", [1, 3, 1]], ["auto_unroll_max_step", "ot", 1500], ["unroll_explicit", "ot", 0]]}], "r": [[0.0050784212812499995], 0, 4.619908571243286, 1543982066.4506946], "v": 0.1}
{"i": ["cuda", "conv2d_no_batching", [1, 28, 28, 128, 256, 3, 3, [2, 2], [1, 1]], {}, ["conv2d_no_batching", 1, 28, 28, 128, 256, 3, 3, [2, 2], [1, 1]], {"i": 12533840, "t": "", "c": null, "e": [["tile_f", "sp", [2, 2, 8, 4]], ["tile_y", "sp", [14, 1, 1, 1]], ["tile_x", "sp", [14, 1, 1, 1]], ["tile_rc", "sp", [32, 8, 1]], ["tile_ry", "sp", [3, 1, 1]], ["tile_rx", "sp", [3, 1, 1]], ["auto_unroll_max_step", "ot", 512], ["unroll_explicit", "ot", 0]]}], "r": [[0.0014808020729166667], 0, 1.9829661846160889, 1543982077.058046], "v": 0.1}
{"i": ["cuda", "conv2d_no_batching", [1, 28, 28, 128, 256, 3, 3, [2, 2], [1, 1]], {}, ["conv2d_no_batching", 1, 28, 28, 128, 256, 3, 3, [2, 2], [1, 1]], {"i": 12533839, "t": "", "c": null, "e": [["tile_f", "sp", [4, 1, 8, 4]], ["tile_y", "sp", [14, 1, 1, 1]], ["tile_x", "sp", [14, 1, 1, 1]], ["tile_rc", "sp", [32, 8, 1]], ["tile_ry", "sp", [3, 1, 1]], ["tile_rx", "sp", [3, 1, 1]], ["auto_unroll_max_step", "ot", 512], ["unroll_explicit", "ot", 0]]}], "r": [[0.0013242376979166668], 0, 1.8266451358795166, 1543982078.551987], "v": 0.1}
{"i": ["cuda", "conv2d_no_batching", [1, 28, 28, 128, 256, 3, 3, [2, 2], [1, 1]], {}, ["conv2d_no_batching", 1, 28, 28, 128, 256, 3, 3, [2, 2], [1, 1]], {"i": 12533842, "t": "", "c": null, "e": [["tile_f", "sp", [2, 1, 16, 4]], ["tile_y", "sp", [14, 1, 1, 1]], ["tile_x", "sp", [14, 1, 1, 1]], ["tile_rc", "sp", [32, 8, 1]], ["tile_ry", "sp", [3, 1, 1]], ["tile_rx", "sp", [3, 1, 1]], ["auto_unroll_max_step", "ot", 512], ["unroll_explicit", "ot", 0]]}], "r": [[0.0014962464895833334], 0, 2.008330821990967, 1543982080.1443048], "v": 0.1}
{"i": ["cuda", "conv2d_no_batching", [1, 28, 28, 128, 256, 3, 3, [2, 2], [1, 1]], {}, ["conv2d_no_batching", 1, 28, 28, 128, 256, 3, 3, [2, 2], [1, 1]], {"i": 12534320, "t": "", "c": null, "e": [["tile_f", "sp", [2, 2, 8, 4]], ["tile_y", "sp", [7, 1, 2, 1]], ["tile_x", "sp", [14, 1, 1, 1]], ["tile_rc", "sp", [32, 8, 1]], ["tile_ry", "sp", [3, 1, 1]], ["tile_rx", "sp", [3, 1, 1]], ["auto_unroll_max_step", "ot", 512], ["unroll_explicit", "ot", 0]]}], "r": [[0.0008610152239583333], 0, 1.6397294998168945, 1543982081.4155881], "v": 0.1}
{"i": ["cuda", "conv2d_no_batching", [1, 28, 28, 128, 256, 3, 3, [2, 2], [1, 1]], {}, ["conv2d_no_batching", 1, 28, 28, 128, 256, 3, 3, [2, 2], [1, 1]], {"i": 12472400, "t": "", "c": null, "e": [["tile_f", "sp", [2, 2, 8, 4]], ["tile_y", "sp", [14, 1, 1, 1]], ["tile_x", "sp", [14, 1, 1, 1]], ["tile_rc", "sp", [128, 2, 1]], ["tile_ry", "sp", [3, 1, 1]], ["tile_rx", "sp", [3, 1, 1]], ["auto_unroll_max_step", "ot", 512], ["unroll_explicit", "ot", 0]]}], "r": [[0.0010817105], 0, 1.7229716777801514, 1543982082.7787166], "v": 0.1}
{"i": ["cuda", "conv2d_no_batching", [1, 28, 28, 128, 256, 3, 3, [2, 2], [1, 1]], {}, ["conv2d_no_batching", 1, 28, 28, 128, 256, 3, 3, [2, 2], [1, 1]], {"i": 92240, "t": "", "c": null, "e": [["tile_f", "sp", [2, 2, 8, 4]], ["tile_y", "sp", [14, 1, 1, 1]], ["tile_x", "sp", [14, 1, 1, 1]], ["tile_rc", "sp", [32, 8, 1]], ["tile_ry", "sp", [3, 1, 1]], ["tile_rx", "sp", [3, 1, 1]], ["auto_unroll_max_step", "ot", 0], ["unroll_explicit", "ot", 0]]}], "r": [[0.0013149168645833333], 0, 1.9129188060760498, 1543982084.4060152], "v": 0.1}
{"i": ["cuda", "conv2d_no_batching", [1, 28, 28, 128, 256, 3, 3, [2, 2], [1, 1]], {}, ["conv2d_no_batching", 1, 28, 28, 128, 256, 3, 3, [2, 2], [1, 1]], {"i": 12533836, "t": "", "c": null, "e": [["tile_f", "sp", [4, 2, 4, 4]], ["tile_y", "sp", [14, 1, 1, 1]], ["tile_x", "sp", [14, 1, 1, 1]], ["tile_rc", "sp", [32, 8, 1]], ["tile_ry", "sp", [3, 1, 1]], ["tile_rx", "sp", [3, 1, 1]], ["auto_unroll_max_step", "ot", 512], ["unroll_explicit", "ot", 0]]}], "r": [[0.0013624161770833332], 0, 1.8828527927398682, 1543982085.9411917], "v": 0.1}
{"i": ["cuda", "conv2d_no_batching", [1, 28, 28, 128, 256, 3, 3, [2, 2], [1, 1]], {}, ["conv2d_no_batching", 1, 28, 28, 128, 256, 3, 3, [2, 2], [1, 1]], {"i": 12503120, "t": "", "c": null, "e": [["tile_f", "sp", [2, 2, 8, 4]], ["tile_y", "sp", [14, 1, 1, 1]], ["tile_x", "sp", [14, 1, 1, 1]], ["tile_rc", "sp", [64, 4, 1]], ["tile_ry", "sp", [3, 1, 1]], ["tile_rx", "sp", [3, 1, 1]], ["auto_unroll_max_step", "ot", 512], ["unroll_explicit", "ot", 0]]}], "r": [[0.0012480152916666666], 0, 1.7767455577850342, 1543982087.3701537], "v": 0.1}
{"i": ["cuda", "conv2d_no_batching", [1, 28, 28, 128, 256, 3, 3, [2, 2], [1, 1]], {}, ["conv2d_no_batching", 1, 28, 28, 128, 256, 3, 3, [2, 2], [1, 1]], {"i": 12534319, "t": "", "c": null, "e": [["tile_f", "sp", [4, 1, 8, 4]], ["tile_y", "sp", [7, 1, 2, 1]], ["tile_x", "sp", [14, 1, 1, 1]], ["tile_rc", "sp", [32, 8, 1]], ["tile_ry", "sp", [3, 1, 1]], ["tile_rx", "sp", [3, 1, 1]], ["auto_unroll_max_step", "ot", 512], ["unroll_explicit", "ot", 0]]}], "r": [[0.0009725163020833333], 0, 1.6245243549346924, 1543982088.658555], "v": 0.1}
{"i": ["cuda", "conv2d_no_batching", [1, 28, 28, 128, 256, 3, 3, [2, 2], [1, 1]], {}, ["conv2d_no_batching", 1, 28, 28, 128, 256, 3, 3, [2, 2], [1, 1]], {"i": 12534322, "t": "", "c": null, "e": [["tile_f", "sp", [2, 1, 16, 4]], ["tile_y", "sp", [7, 1, 2, 1]], ["tile_x", "sp", [14, 1, 1, 1]], ["tile_rc", "sp", [32, 8, 1]], ["tile_ry", "sp", [3, 1, 1]], ["tile_rx", "sp", [3, 1, 1]], ["auto_unroll_max_step", "ot", 512], ["unroll_explicit", "ot", 0]]}], "r": [[0.0009764667083333333], 0, 1.621401071548462, 1543982089.9471173], "v": 0.1}
{"i": ["cuda", "conv2d_no_batching", [1, 28, 28, 128, 256, 3, 3, [2, 2], [1, 1]], {}, ["conv2d_no_batching", 1, 28, 28, 128, 256, 3, 3, [2, 2], [1, 1]], {"i": 12535760, "t": "", "c": null, "e": [["tile_f", "sp", [2, 2, 8, 4]], ["tile_y", "sp", [14, 1, 1, 1]], ["tile_x", "sp", [7, 2, 1, 1]], ["tile_rc", "sp", [32, 8, 1]], ["tile_ry", "sp", [3, 1, 1]], ["tile_rx", "sp", [3, 1, 1]], ["auto_unroll_max_step", "ot", 512], ["unroll_explicit", "ot", 0]]}], "r": [[0.0008272582864583333], 0, 1.6440789699554443, 1543982091.2220445], "v": 0.1}
{"i": ["cuda", "conv2d_no_batching", [1, 28, 28, 128, 256, 3, 3, [2, 2], [1, 1]], {}, ["conv2d_no_batching", 1, 28, 28, 128, 256, 3, 3, [2, 2], [1, 1]], {"i": 12537679, "t": "", "c": null, "e": [["tile_f", "sp", [4, 1, 8, 4]], ["tile_y", "sp", [14, 1, 1, 1]], ["tile_x", "sp", [2, 7, 1, 1]], ["tile_rc", "sp", [32, 8, 1]], ["tile_ry", "sp", [3, 1, 1]], ["tile_rx", "sp", [3, 1, 1]], ["auto_unroll_max_step", "ot", 512], ["unroll_explicit", "ot", 0]]}], "r": [[0.0006237808906250001], 0, 1.5705938339233398, 1543982092.4465492], "v": 0.1}
{"i": ["cuda", "conv2d_no_batching", [1, 28, 28, 128, 256, 3, 3, [2, 2], [1, 1]], {}, ["conv2d_no_batching", 1, 28, 28, 128, 256, 3, 3, [2, 2], [1, 1]], {"i": 12533809, "t": "", "c": null, "e": [["tile_f", "sp", [16, 1, 4, 2]], ["tile_y", "sp", [14, 1, 1, 1]], ["tile_x", "sp", [14, 1, 1, 1]], ["tile_rc", "sp", [32, 8, 1]], ["tile_ry", "sp", [3, 1, 1]], ["tile_rx", "sp", [3, 1, 1]], ["auto_unroll_max_step", "ot", 512], ["unroll_explicit", "ot", 0]]}], "r": [[0.00102358828125], 0, 1.6243064403533936, 1543982093.7391944], "v": 0.1}
{"i": ["cuda", "conv2d_no_batching", [1, 28, 28, 128, 256, 3, 3, [2, 2], [1, 1]], {}, ["conv2d_no_batching", 1, 28, 28, 128, 256, 3, 3, [2, 2], [1, 1]], {"i": 12472402, "t": "", "c": null, "e": [["tile_f", "sp", [2, 1, 16, 4]], ["tile_y", "sp", [14, 1, 1, 1]], ["tile_x", "sp", [14, 1, 1, 1]], ["tile_rc", "sp", [128, 2, 1]], ["tile_ry", "sp", [3, 1, 1]], ["tile_rx", "sp", [3, 1, 1]], ["auto_unroll_max_step", "ot", 512], ["unroll_explicit", "ot", 0]]}], "r": [[0.00120272440625], 0, 1.724165439605713, 1543982095.135048], "v": 0.1}
{"i": ["cuda", "conv2d_no_batching", [1, 28, 28, 128, 256, 3, 3, [2, 2], [1, 1]], {}, ["conv2d_no_batching", 1, 28, 28, 128, 256, 3, 3, [2, 2], [1, 1]], {"i": 12472399, "t": "", "c": null, "e": [["tile_f", "sp", [4, 1, 8, 4]], ["tile_y", "sp", [14, 1, 1, 1]], ["tile_x", "sp", [14, 1, 1, 1]], ["tile_rc", "sp", [128, 2, 1]], ["tile_ry", "sp", [3, 1, 1]], ["tile_rx", "sp", [3, 1, 1]], ["auto_unroll_max_step", "ot", 512], ["unroll_explicit", "ot", 0]]}], "r": [[0.0009780313229166666], 0, 1.6398873329162598, 1543982096.42614], "v": 0.1}
{"i": ["cuda", "conv2d_no_batching", [1, 28, 28, 128, 256, 3, 3, [2, 2], [1, 1]], {}, ["conv2d_no_batching", 1, 28, 28, 128, 256, 3, 3, [2, 2], [1, 1]], {"i": 12537680, "t": "", "c": null, "e": [["tile_f", "sp", [2, 2, 8, 4]], ["tile_y", "sp", [14, 1, 1, 1]], ["tile_x", "sp", [2, 7, 1, 1]], ["tile_rc", "sp", [32, 8, 1]], ["tile_ry", "sp", [3, 1, 1]], ["tile_rx", "sp", [3, 1, 1]], ["auto_unroll_max_step", "ot", 512], ["unroll_explicit", "ot", 0]]}], "r": [[0.0006659618958333334], 0, 1.5790162086486816, 1543982097.6280599], "v": 0.1}
{"i": ["cuda", "conv2d_no_batching", [1, 28, 28, 128, 256, 3, 3, [2, 2], [1, 1]], {}, ["conv2d_no_batching", 1, 28, 28, 128, 256, 3, 3, [2, 2], [1, 1]], {"i": 92239, "t": "", "c": null, "e": [["tile_f", "sp", [4, 1, 8, 4]], ["tile_y", "sp", [14, 1, 1, 1]], ["tile_x", "sp", [14, 1, 1, 1]], ["tile_rc", "sp", [32, 8, 1]], ["tile_ry", "sp", [3, 1, 1]], ["tile_rx", "sp", [3, 1, 1]], ["auto_unroll_max_step", "ot", 0], ["unroll_explicit", "ot", 0]]}], "r": [[0.00133124890625], 0, 1.8120524883270264, 1543982099.161006], "v": 0.1}
{"i": ["cuda", "conv2d_no_batching", [1, 28, 28, 128, 256, 3, 3, [2, 2], [1, 1]], {}, ["conv2d_no_batching", 1, 28, 28, 128, 256, 3, 3, [2, 2], [1, 1]], {"i": 92242, "t": "", "c": null, "e": [["tile_f", "sp", [2, 1, 16, 4]], ["tile_y", "sp", [14, 1, 1, 1]], ["tile_x", "sp", [14, 1, 1, 1]], ["tile_rc", "sp", [32, 8, 1]], ["tile_ry", "sp", [3, 1, 1]], ["tile_rx", "sp", [3, 1, 1]], ["auto_unroll_max_step", "ot", 0], ["unroll_explicit", "ot", 0]]}], "r": [[0.0014340138697916665], 0, 1.8642559051513672, 1543982100.737941], "v": 0.1}
{"i": ["cuda", "conv2d_no_batching", [1, 28, 28, 128, 256, 3, 3, [2, 2], [1, 1]], {}, ["conv2d_no_batching", 1, 28, 28, 128, 256, 3, 3, [2, 2], [1, 1]], {"i": 12472880, "t": "", "c": null, "e": [["tile_f", "sp", [2, 2, 8, 4]], ["tile_y", "sp", [7, 1, 2, 1]], ["tile_x", "sp", [14, 1, 1, 1]], ["tile_rc", "sp", [128, 2, 1]], ["tile_ry", "sp", [3, 1, 1]], ["tile_rx", "sp", [3, 1, 1]], ["auto_unroll_max_step", "ot", 512], ["unroll_explicit", "ot", 0]]}], "r": [[0.0006347776354166667], 0, 1.4125840663909912, 1543982101.799132], "v": 0.1}
{"i": ["cuda", "conv2d_no_batching", [1, 28, 28, 128, 256, 3, 3, [2, 2], [1, 1]], {}, ["conv2d_no_batching", 1, 28, 28, 128, 256, 3, 3, [2, 2], [1, 1]], {"i": 92720, "t": "", "c": null, "e": [["tile_f", "sp", [2, 2, 8, 4]], ["tile_y", "sp", [7, 1, 2, 1]], ["tile_x", "sp", [14, 1, 1, 1]], ["tile_rc", "sp", [32, 8, 1]], ["tile_ry", "sp", [3, 1, 1]], ["tile_rx", "sp", [3, 1, 1]], ["auto_unroll_max_step", "ot", 0], ["unroll_explicit", "ot", 0]]}], "r": [[0.0008571813333333333], 0, 1.58587646484375, 1543982103.081157], "v": 0.1}
{"i": ["cuda", "conv2d_no_batching", [1, 28, 28, 128, 256, 3, 3, [2, 2], [1, 1]], {}, ["conv2d_no_batching", 1, 28, 28, 128, 256, 3, 3, [2, 2], [1, 1]], {"i": 12474320, "t": "", "c": null, "e": [["tile_f", "sp", [2, 2, 8, 4]], ["tile_y", "sp", [14, 1, 1, 1]], ["tile_x", "sp", [7, 2, 1, 1]], ["tile_rc", "sp", [128, 2, 1]], ["tile_ry", "sp", [3, 1, 1]], ["tile_rx", "sp", [3, 1, 1]], ["auto_unroll_max_step", "ot", 512], ["unroll_explicit", "ot", 0]]}], "r": [[0.0007752415260416667], 0, 1.5005955696105957, 1543982104.2499552], "v": 0.1}
{"i": ["cuda", "conv2d_no_batching", [1, 28, 28, 128, 256, 3, 3, [2, 2], [1, 1]], {}, ["conv2d_no_batching", 1, 28, 28, 128, 256, 3, 3, [2, 2], [1, 1]], {"i": 12534316, "t": "", "c": null, "e": [["tile_f", "sp", [4, 2, 4, 4]], ["tile_y", "sp", [7, 1, 2, 1]], ["tile_x", "sp", [14, 1, 1, 1]], ["tile_rc", "sp", [32, 8, 1]], ["tile_ry", "sp", [3, 1, 1]], ["tile_rx", "sp", [3, 1, 1]], ["auto_unroll_max_step", "ot", 512], ["unroll_explicit", "ot", 0]]}], "r": [[0.0009768700364583334], 0, 1.5766582489013672, 1543982105.5141048], "v": 0.1}
{"i": ["cuda", "conv2d_no_batching", [1, 28, 28, 128, 256, 3, 3, [2, 2], [1, 1]], {}, ["conv2d_no_batching", 1, 28, 28, 128, 256, 3, 3, [2, 2], [1, 1]], {"i": 12476239, "t": "", "c": null, "e": [["tile_f", "sp", [4, 1, 8, 4]], ["tile_y", "sp", [14, 1, 1, 1]], ["tile_x", "sp", [2, 7, 1, 1]], ["tile_rc", "sp", [128, 2, 1]], ["tile_ry", "sp", [3, 1, 1]], ["tile_rx", "sp", [3, 1, 1]], ["auto_unroll_max_step", "ot", 512], ["unroll_explicit", "ot", 0]]}], "r": [[0.0008503232135416666], 0, 1.5526785850524902, 1543982106.6944387], "v": 0.1}
{"i": ["cuda", "conv2d_no_batching", [1, 28, 28, 128, 256, 3, 3, [2, 2], [1, 1]], {}, ["conv2d_no_batching", 1, 28, 28, 128, 256, 3, 3, [2, 2], [1, 1]], {"i": 12503119, "t": "", "c": null, "e": [["tile_f", "sp", [4, 1, 8, 4]], ["tile_y", "sp", [14, 1, 1, 1]], ["tile_x", "sp", [14, 1, 1, 1]], ["tile_rc", "sp", [64, 4, 1]], ["tile_ry", "sp", [3, 1, 1]], ["tile_rx", "sp", [3, 1, 1]], ["auto_unroll_max_step", "ot", 512], ["unroll_explicit", "ot", 0]]}], "r": [[0.001273323578125], 0, 1.8356873989105225, 1543982108.1286185], "v": 0.1}
{"i": ["cuda", "conv2d_no_batching", [1, 28, 28, 128, 256, 3, 3, [2, 2], [1, 1]], {}, ["conv2d_no_batching", 1, 28, 28, 128, 256, 3, 3, [2, 2], [1, 1]], {"i": 12503122, "t": "", "c": null, "e": [["tile_f", "sp", [2, 1, 16, 4]], ["tile_y", "sp", [14, 1, 1, 1]], ["tile_x", "sp", [14, 1, 1, 1]], ["tile_rc", "sp", [64, 4, 1]], ["tile_ry", "sp", [3, 1, 1]], ["tile_rx", "sp", [3, 1, 1]], ["auto_unroll_max_step", "ot", 512], ["unroll_explicit", "ot", 0]]}], "r": [[0.0014134368593749999], 0, 1.947253704071045, 1543982109.670261], "v": 0.1}
{"i": ["cuda", "conv2d_no_batching", [1, 28, 28, 128, 256, 3, 3, [2, 2], [1, 1]], {}, ["conv2d_no_batching", 1, 28, 28, 128, 256, 3, 3, [2, 2], [1, 1]], {"i": 12503600, "t": "", "c": null, "e": [["tile_f", "sp", [2, 2, 8, 4]], ["tile_y", "sp", [7, 1, 2, 1]], ["tile_x", "sp", [14, 1, 1, 1]], ["tile_rc", "sp", [64, 4, 1]], ["tile_ry", "sp", [3, 1, 1]], ["tile_rx", "sp", [3, 1, 1]], ["auto_unroll_max_step", "ot", 512], ["unroll_explicit", "ot", 0]]}], "r": [[0.0007799095156249999], 0, 1.507037878036499, 1543982110.8102605], "v": 0.1}
{"i": ["cuda", "conv2d_no_batching", [1, 28, 28, 128, 256, 3, 3, [2, 2], [1, 1]], {}, ["conv2d_no_batching", 1, 28, 28, 128, 256, 3, 3, [2, 2], [1, 1]], {"i": 12537676, "t": "", "c": null, "e": [["tile_f", "sp", [4, 2, 4, 4]], ["tile_y", "sp", [14, 1, 1, 1]], ["tile_x", "sp", [2, 7, 1, 1]], ["tile_rc", "sp", [32, 8, 1]], ["tile_ry", "sp", [3, 1, 1]], ["tile_rx", "sp", [3, 1, 1]], ["auto_unroll_max_step", "ot", 512], ["unroll_explicit", "ot", 0]]}], "r": [[0.0005623809479166666], 0, 1.5454280376434326, 1543982111.9549584], "v": 0.1}
{"i": ["cuda", "conv2d_no_batching", [1, 28, 28, 128, 256, 3, 3, [2, 2], [1, 1]], {}, ["conv2d_no_batching", 1, 28, 28, 128, 256, 3, 3, [2, 2], [1, 1]], {"i": 12476240, "t": "", "c": null, "e": [["tile_f", "sp", [2, 2, 8, 4]], ["tile_y", "sp", [14, 1, 1, 1]], ["tile_x", "sp", [2, 7, 1, 1]], ["tile_rc", "sp", [128, 2, 1]], ["tile_ry", "sp", [3, 1, 1]], ["tile_rx", "sp", [3, 1, 1]], ["auto_unroll_max_step", "ot", 512], ["unroll_explicit", "ot", 0]]}], "r": [[0.0011502497760416668], 0, 1.8811652660369873, 1543982113.447764], "v": 0.1}
{"i": ["cuda", "conv2d_no_batching", [1, 28, 28, 128, 256, 3, 3, [2, 2], [1, 1]], {}, ["conv2d_no_batching", 1, 28, 28, 128, 256, 3, 3, [2, 2], [1, 1]], {"i": 30800, "t": "", "c": null, "e": [["tile_f", "sp", [2, 2, 8, 4]], ["tile_y", "sp", [14, 1, 1, 1]], ["tile_x", "sp", [14, 1, 1, 1]], ["tile_rc", "sp", [128, 2, 1]], ["tile_ry", "sp", [3, 1, 1]], ["tile_rx", "sp", [3, 1, 1]], ["auto_unroll_max_step", "ot", 0], ["unroll_explicit", "ot", 0]]}], "r": [[0.0011451574583333333], 0, 1.637202501296997, 1543982114.789977], "v": 0.1}
{"i": ["cuda", "conv2d_no_batching", [1, 28, 28, 128, 256, 3, 3, [2, 2], [1, 1]], {}, ["conv2d_no_batching", 1, 28, 28, 128, 256, 3, 3, [2, 2], [1, 1]], {"i": 94160, "t": "", "c": null, "e": [["tile_f", "sp", [2, 2, 8, 4]], ["tile_y", "sp", [14, 1, 1, 1]], ["tile_x", "sp", [7, 2, 1, 1]], ["tile_rc", "sp", [32, 8, 1]], ["tile_ry", "sp", [3, 1, 1]], ["tile_rx", "sp", [3, 1, 1]], ["auto_unroll_max_step", "ot", 0], ["unroll_explicit", "ot", 0]]}], "r": [[0.00079815565625], 0, 1.508352279663086, 1543982115.995915], "v": 0.1}
{"i": ["cuda", "conv2d_no_batching", [1, 28, 28, 128, 256, 3, 3, [2, 2], [1, 1]], {}, ["conv2d_no_batching", 1, 28, 28, 128, 256, 3, 3, [2, 2], [1, 1]], {"i": 12505040, "t": "", "c": null, "e": [["tile_f", "sp", [2, 2, 8, 4]], ["tile_y", "sp", [14, 1, 1, 1]], ["tile_x", "sp", [7, 2, 1, 1]], ["tile_rc", "sp", [64, 4, 1]], ["tile_ry", "sp", [3, 1, 1]], ["tile_rx", "sp", [3, 1, 1]], ["auto_unroll_max_step", "ot", 512], ["unroll_explicit", "ot", 0]]}], "r": [[0.0007750687239583333], 0, 1.5590319633483887, 1543982117.197407], "v": 0.1}
{"i": ["cuda", "conv2d_no_batching", [1, 28, 28, 128, 256, 3, 3, [2, 2], [1, 1]], {}, ["conv2d_no_batching", 1, 28, 28, 128, 256, 3, 3, [2, 2], [1, 1]], {"i": 12472396, "t": "", "c": null, "e": [["tile_f", "sp", [4, 2, 4, 4]], ["tile_y", "sp", [14, 1, 1, 1]], ["tile_x", "sp", [14, 1, 1, 1]], ["tile_rc", "sp", [128, 2, 1]], ["tile_ry", "sp", [3, 1, 1]], ["tile_rx", "sp", [3, 1, 1]], ["auto_unroll_max_step", "ot", 512], ["unroll_explicit", "ot", 0]]}], "r": [[0.0010947268177083334], 0, 1.7482435703277588, 1543982118.5780988], "v": 0.1}
{"i": ["cuda", "conv2d_no_batching", [1, 28, 28, 128, 256, 3, 3, [2, 2], [1, 1]], {}, ["conv2d_no_batching", 1, 28, 28, 128, 256, 3, 3, [2, 2], [1, 1]], {"i": 96079, "t": "", "c": null, "e": [["tile_f", "sp", [4, 1, 8, 4]], ["tile_y", "sp", [14, 1, 1, 1]], ["tile_x", "sp", [2, 7, 1, 1]], ["tile_rc", "sp", [32, 8, 1]], ["tile_ry", "sp", [3, 1, 1]], ["tile_rx", "sp", [3, 1, 1]], ["auto_unroll_max_step", "ot", 0], ["unroll_explicit", "ot", 0]]}], "r": [[0.000733178171875], 0, 1.639814853668213, 1543982119.898082], "v": 0.1}
{"i": ["cuda", "conv2d_no_batching", [1, 28, 28, 128, 256, 3, 3, [2, 2], [1, 1]], {}, ["conv2d_no_batching", 1, 28, 28, 128, 256, 3, 3, [2, 2], [1, 1]], {"i": 12506959, "t": "", "c": null, "e": [["tile_f", "sp", [4, 1, 8, 4]], ["tile_y", "sp", [14, 1, 1, 1]], ["tile_x", "sp", [2, 7, 1, 1]], ["tile_rc", "sp", [64, 4, 1]], ["tile_ry", "sp", [3, 1, 1]], ["tile_rx", "sp", [3, 1, 1]], ["auto_unroll_max_step", "ot", 512], ["unroll_explicit", "ot", 0]]}], "r": [[0.0007709759687500001], 0, 1.5828664302825928, 1543982121.1456468], "v": 0.1}
{"i": ["cuda", "conv2d_no_batching", [1, 28, 28, 128, 256, 3, 3, [2, 2], [1, 1]], {}, ["conv2d_no_batching", 1, 28, 28, 128, 256, 3, 3, [2, 2], [1, 1]], {"i": 92236, "t": "", "c": null, "e": [["tile_f", "sp", [4, 2, 4, 4]], ["tile_y", "sp", [14, 1, 1, 1]], ["tile_x", "sp", [14, 1, 1, 1]], ["tile_rc", "sp", [32, 8, 1]], ["tile_ry", "sp", [3, 1, 1]], ["tile_rx", "sp", [3, 1, 1]], ["auto_unroll_max_step", "ot", 0], ["unroll_explicit", "ot", 0]]}], "r": [[0.0014290013385416668], 0, 1.9791340827941895, 1543982122.8372533], "v": 0.1}
{"i": ["cuda", "conv2d_no_batching", [1, 28, 28, 128, 256, 3, 3, [2, 2], [1, 1]], {}, ["conv2d_no_batching", 1, 28, 28, 128, 256, 3, 3, [2, 2], [1, 1]], {"i": 96080, "t": "", "c": null, "e": [["tile_f", "sp", [2, 2, 8, 4]], ["tile_y", "sp", [14, 1, 1, 1]], ["tile_x", "sp", [2, 7, 1, 1]], ["tile_rc", "sp", [32, 8, 1]], ["tile_ry", "sp", [3, 1, 1]], ["tile_rx", "sp", [3, 1, 1]], ["auto_unroll_max_step", "ot", 0], ["unroll_explicit", "ot", 0]]}], "r": [[0.0007577383958333334], 0, 1.6279640197753906, 1543982124.118696], "v": 0.1}
{"i": ["cuda", "conv2d_no_batching", [1, 28, 28, 128, 256, 3, 3, [2, 2], [1, 1]], {}, ["conv2d_no_batching", 1, 28, 28, 128, 256, 3, 3, [2, 2], [1, 1]], {"i": 12506960, "t": "", "c": null, "e": [["tile_f", "sp", [2, 2, 8, 4]], ["tile_y", "sp", [14, 1, 1, 1]], ["tile_x", "sp", [2, 7, 1, 1]], ["tile_rc", "sp", [64, 4, 1]], ["tile_ry", "sp", [3, 1, 1]], ["tile_rx", "sp", [3, 1, 1]], ["auto_unroll_max_step", "ot", 512], ["unroll_explicit", "ot", 0]]}], "r": [[0.0014336529114583332], 0, 2.070887804031372, 1543982125.8462274], "v": 0.1}
{"i": ["cuda", "conv2d_no_batching", [1, 28, 28, 128, 256, 3, 3, [2, 2], [1, 1]], {}, ["conv2d_no_batching", 1, 28, 28, 128, 256, 3, 3, [2, 2], [1, 1]], {"i": 61520, "t": "", "c": null, "e": [["tile_f", "sp", [2, 2, 8, 4]], ["tile_y", "sp", [14, 1, 1, 1]], ["tile_x", "sp", [14, 1, 1, 1]], ["tile_rc", "sp", [64, 4, 1]], ["tile_ry", "sp", [3, 1, 1]], ["tile_rx", "sp", [3, 1, 1]], ["auto_unroll_max_step", "ot", 0], ["unroll_explicit", "ot", 0]]}], "r": [[0.001183419328125], 0, 1.7492296695709229, 1543982127.287665], "v": 0.1}
{"i": ["cuda", "conv2d_no_batching", [1, 28, 28, 128, 256, 3, 3, [2, 2], [1, 1]], {}, ["conv2d_no_batching", 1, 28, 28, 128, 256, 3, 3, [2, 2], [1, 1]], {"i": 12476236, "t": "", "c": null, "e": [["tile_f", "sp", [4, 2, 4, 4]], ["tile_y", "sp", [14, 1, 1, 1]], ["tile_x", "sp", [2, 7, 1, 1]], ["tile_rc", "sp", [128, 2, 1]], ["tile_ry", "sp", [3, 1, 1]], ["tile_rx", "sp", [3, 1, 1]], ["auto_unroll_max_step", "ot", 512], ["unroll_explicit", "ot", 0]]}], "r": [[0.001334219109375], 0, 2.082797050476074, 1543982128.9313545], "v": 0.1}
{"i": ["cuda", "conv2d_no_batching", [1, 28, 28, 128, 256, 3, 3, [2, 2], [1, 1]], {}, ["conv2d_no_batching", 1, 28, 28, 128, 256, 3, 3, [2, 2], [1, 1]], {"i": 12503116, "t": "", "c": null, "e": [["tile_f", "sp", [4, 2, 4, 4]], ["tile_y", "sp", [14, 1, 1, 1]], ["tile_x", "sp", [14, 1, 1, 1]], ["tile_rc", "sp", [64, 4, 1]], ["tile_ry", "sp", [3, 1, 1]], ["tile_rx", "sp", [3, 1, 1]], ["auto_unroll_max_step", "ot", 512], ["unroll_explicit", "ot", 0]]}], "r": [[0.0012548091093750001], 0, 1.809077501296997, 1543982130.4151783], "v": 0.1}
{"i": ["cuda", "conv2d_no_batching", [1, 28, 28, 128, 256, 3, 3, [2, 2], [1, 1]], {}, ["conv2d_no_batching", 1, 28, 28, 128, 256, 3, 3, [2, 2], [1, 1]], {"i": 12533821, "t": "", "c": null, "e": [["tile_f", "sp", [2, 1, 32, 2]], ["tile_y", "sp", [14, 1, 1, 1]], ["tile_x", "sp", [14, 1, 1, 1]], ["tile_rc", "sp", [32, 8, 1]], ["tile_ry", "sp", [3, 1, 1]], ["tile_rx", "sp", [3, 1, 1]], ["auto_unroll_max_step", "ot", 512], ["unroll_explicit", "ot", 0]]}], "r": [[0.0016944969999999999], 0, 1.9880924224853516, 1543982132.0861688], "v": 0.1}
{"i": ["cuda", "conv2d_no_batching", [1, 28, 28, 128, 256, 3, 3, [2, 2], [1, 1]], {}, ["conv2d_no_batching", 1, 28, 28, 128, 256, 3, 3, [2, 2], [1, 1]], {"i": 32720, "t": "", "c": null, "e": [["tile_f", "sp", [2, 2, 8, 4]], ["tile_y", "sp", [14, 1, 1, 1]], ["tile_x", "sp", [7, 2, 1, 1]], ["tile_rc", "sp", [128, 2, 1]], ["tile_ry", "sp", [3, 1, 1]], ["tile_rx", "sp", [3, 1, 1]], ["auto_unroll_max_step", "ot", 0], ["unroll_explicit", "ot", 0]]}], "r": [[0.0007595307760416667], 0, 1.4243712425231934, 1543982133.2053895], "v": 0.1}
{"i": ["cuda", "conv2d_no_batching", [1, 28, 28, 128, 256, 3, 3, [2, 2], [1, 1]], {}, ["conv2d_no_batching", 1, 28, 28, 128, 256, 3, 3, [2, 2], [1, 1]], {"i": 12535759, "t": "", "c": null, "e": [["tile_f", "sp", [4, 1, 8, 4]], ["tile_y", "sp", [14, 1, 1, 1]], ["tile_x", "sp", [7, 2, 1, 1]], ["tile_rc", "sp", [32, 8, 1]], ["tile_ry", "sp", [3, 1, 1]], ["tile_rx", "sp", [3, 1, 1]], ["auto_unroll_max_step", "ot", 512], ["unroll_explicit", "ot", 0]]}], "r": [[0.0009075139218749999], 0, 1.6229581832885742, 1543982134.4763403], "v": 0.1}
{"i": ["cuda", "conv2d_no_batching", [1, 28, 28, 128, 256, 3, 3, [2, 2], [1, 1]], {}, ["conv2d_no_batching", 1, 28, 28, 128, 256, 3, 3, [2, 2], [1, 1]], {"i": 12535762, "t": "", "c": null, "e": [["tile_f", "sp", [2, 1, 16, 4]], ["tile_y", "sp", [14, 1, 1, 1]], ["tile_x", "sp", [7, 2, 1, 1]], ["tile_rc", "sp", [32, 8, 1]], ["tile_ry", "sp", [3, 1, 1]], ["tile_rx", "sp", [3, 1, 1]], ["auto_unroll_max_step", "ot", 512], ["unroll_explicit", "ot", 0]]}], "r": [[0.0008187604218750001], 0, 1.5776927471160889, 1543982135.6954796], "v": 0.1}
{"i": ["cuda", "conv2d_no_batching", [1, 28, 28, 128, 256, 3, 3, [2, 2], [1, 1]], {}, ["conv2d_no_batching", 1, 28, 28, 128, 256, 3, 3, [2, 2], [1, 1]], {"i": 12533835, "t": "", "c": null, "e": [["tile_f", "sp", [8, 1, 4, 4]], ["tile_y", "sp", [14, 1, 1, 1]], ["tile_x", "sp", [14, 1, 1, 1]], ["tile_rc", "sp", [32, 8, 1]], ["tile_ry", "sp", [3, 1, 1]], ["tile_rx", "sp", [3, 1, 1]], ["auto_unroll_max_step", "ot", 512], ["unroll_explicit", "ot", 0]]}], "r": [[0.001437610640625], 0, 1.9033663272857666, 1543982137.263739], "v": 0.1}
{"i": ["cuda", "conv2d_no_batching", [1, 28, 28, 128, 256, 3, 3, [2, 2], [1, 1]], {}, ["conv2d_no_batching", 1, 28, 28, 128, 256, 3, 3, [2, 2], [1, 1]], {"i": 34639, "t": "", "c": null, "e": [["tile_f", "sp", [4, 1, 8, 4]], ["tile_y", "sp", [14, 1, 1, 1]], ["tile_x", "sp", [2, 7, 1, 1]], ["tile_rc", "sp", [128, 2, 1]], ["tile_ry", "sp", [3, 1, 1]], ["tile_rx", "sp", [3, 1, 1]], ["auto_unroll_max_step", "ot", 0], ["unroll_explicit", "ot", 0]]}], "r": [[0.0008634300572916667], 0, 1.5091145038604736, 1543982138.4652693], "v": 0.1}
{"i": ["cuda", "conv2d_no_batching", [1, 28, 28, 128, 256, 3, 3, [2, 2], [1, 1]], {}, ["conv2d_no_batching", 1, 28, 28, 128, 256, 3, 3, [2, 2], [1, 1]], {"i": 12536240, "t": "", "c": null, "e": [["tile_f", "sp", [2, 2, 8, 4]], ["tile_y", "sp", [7, 1, 2, 1]], ["tile_x", "sp", [7, 2, 1, 1]], ["tile_rc", "sp", [32, 8, 1]], ["tile_ry", "sp", [3, 1, 1]], ["tile_rx", "sp", [3, 1, 1]], ["auto_unroll_max_step", "ot", 512], ["unroll_explicit", "ot", 0]]}], "r": [[0.0008067581666666668], 0, 1.7054238319396973, 1543982139.8245633], "v": 0.1}
{"i": ["cuda", "conv2d_no_batching", [1, 28, 28, 128, 256, 3, 3, [2, 2], [1, 1]], {}, ["conv2d_no_batching", 1, 28, 28, 128, 256, 3, 3, [2, 2], [1, 1]], {"i": 12538159, "t": "", "c": null, "e": [["tile_f", "sp", [4, 1, 8, 4]], ["tile_y", "sp", [7, 1, 2, 1]], ["tile_x", "sp", [2, 7, 1, 1]], ["tile_rc", "sp", [32, 8, 1]], ["tile_ry", "sp", [3, 1, 1]], ["tile_rx", "sp", [3, 1, 1]], ["auto_unroll_max_step", "ot", 512], ["unroll_explicit", "ot", 0]]}], "r": [[0.0021710499114583333], 0, 2.756700277328491, 1543982142.160958], "v": 0.1}
{"i": ["cuda", "conv2d_no_batching", [1, 28, 28, 128, 256, 3, 3, [2, 2], [1, 1]], {}, ["conv2d_no_batching", 1, 28, 28, 128, 256, 3, 3, [2, 2], [1, 1]], {"i": 58072821, "t": "", "c": null, "e": [["tile_f", "sp", [16, 1, 8, 1]], ["tile_y", "sp", [7, 1, 2, 1]], ["tile_x", "sp", [2, 1, 7, 1]], ["tile_rc", "sp", [256, 1, 1]], ["tile_ry", "sp", [3, 1, 1]], ["tile_rx", "sp", [1, 1, 3]], ["auto_unroll_max_step", "ot", 512], ["unroll_explicit", "ot", 1]]}], "r": [[0.00030373098715203426], 0, 1.3495972156524658, 1543982187.4296126], "v": 0.1}
{"i": ["cuda", "conv2d_no_batching", [1, 28, 28, 128, 256, 3, 3, [2, 2], [1, 1]], {}, ["conv2d_no_batching", 1, 28, 28, 128, 256, 3, 3, [2, 2], [1, 1]], {"i": 58072830, "t": "", "c": null, "e": [["tile_f", "sp", [4, 1, 32, 1]], ["tile_y", "sp", [7, 1, 2, 1]], ["tile_x", "sp", [2, 1, 7, 1]], ["tile_rc", "sp", [256, 1, 1]], ["tile_ry", "sp", [3, 1, 1]], ["tile_rx", "sp", [1, 1, 3]], ["auto_unroll_max_step", "ot", 512], ["unroll_explicit", "ot", 1]]}], "r": [[0.0003519480877944325], 0, 1.3534421920776367, 1543982188.5764813], "v": 0.1}
{"i": ["cuda", "conv2d_no_batching", [1, 28, 28, 128, 256, 3, 3, [2, 2], [1, 1]], {}, ["conv2d_no_batching", 1, 28, 28, 128, 256, 3, 3, [2, 2], [1, 1]], {"i": 58072833, "t": "", "c": null, "e": [["tile_f", "sp", [2, 1, 64, 1]], ["tile_y", "sp", [7, 1, 2, 1]], ["tile_x", "sp", [2, 1, 7, 1]], ["tile_rc", "sp", [256, 1, 1]], ["tile_ry", "sp", [3, 1, 1]], ["tile_rx", "sp", [1, 1, 3]], ["auto_unroll_max_step", "ot", 512], ["unroll_explicit", "ot", 1]]}], "r": [[0.0004092125460385439], 0, 1.476348638534546, 1543982189.8051503], "v": 0.1}
{"i": ["cuda", "conv2d_no_batching", [1, 28, 28, 128, 256, 3, 3, [2, 2], [1, 1]], {}, ["conv2d_no_batching", 1, 28, 28, 128, 256, 3, 3, [2, 2], [1, 1]], {"i": 45631689, "t": "", "c": null, "e": [["tile_f", "sp", [32, 2, 2, 1]], ["tile_y", "sp", [1, 1, 14, 1]], ["tile_x", "sp", [2, 1, 7, 1]], ["tile_rc", "sp", [256, 1, 1]], ["tile_ry", "sp", [3, 1, 1]], ["tile_rx", "sp", [1, 1, 3]], ["auto_unroll_max_step", "ot", 0], ["unroll_explicit", "ot", 1]]}], "r": [[0.0004467111777301927], 0, 1.500157117843628, 1543982191.0864933], "v": 0.1}
{"i": ["cuda", "conv2d_no_batching", [1, 28, 28, 128, 256, 3, 3, [2, 2], [1, 1]], {}, ["conv2d_no_batching", 1, 28, 28, 128, 256, 3, 3, [2, 2], [1, 1]], {"i": 53914111, "t": "", "c": null, "e": [["tile_f", "sp", [2, 2, 32, 1]], ["tile_y", "sp", [7, 1, 2, 1]], ["tile_x", "sp", [14, 1, 1, 1]], ["tile_rc", "sp", [256, 1, 1]], ["tile_ry", "sp", [3, 1, 1]], ["tile_rx", "sp", [1, 3, 1]], ["auto_unroll_max_step", "ot", 512], ["unroll_explicit", "ot", 1]]}], "r": [[0.00037913802355460385], 0, 1.4338083267211914, 1543982192.2416346], "v": 0.1}
{"i": ["cuda", "conv2d_no_batching", [1, 28, 28, 128, 256, 3, 3, [2, 2], [1, 1]], {}, ["conv2d_no_batching", 1, 28, 28, 128, 256, 3, 3, [2, 2], [1, 1]], {"i": 58061311, "t": "", "c": null, "e": [["tile_f", "sp", [2, 2, 32, 1]], ["tile_y", "sp", [7, 1, 2, 1]], ["tile_x", "sp", [14, 1, 1, 1]], ["tile_rc", "sp", [256, 1, 1]], ["tile_ry", "sp", [3, 1, 1]], ["tile_rx", "sp", [1, 1, 3]], ["auto_unroll_max_step", "ot", 512], ["unroll_explicit", "ot", 1]]}], "r": [[0.0003788953618843683], 0, 1.4017107486724854, 1543982193.4143827], "v": 0.1}
{"i": ["cuda", "conv2d_no_batching", [1, 28, 28, 128, 256, 3, 3, [2, 2], [1, 1]], {}, ["conv2d_no_batching", 1, 28, 28, 128, 256, 3, 3, [2, 2], [1, 1]], {"i": 58072831, "t": "", "c": null, "e": [["tile_f", "sp", [2, 2, 32, 1]], ["tile_y", "sp", [7, 1, 2, 1]], ["tile_x", "sp", [2, 1, 7, 1]], ["tile_rc", "sp", [256, 1, 1]], ["tile_ry", "sp", [3, 1, 1]], ["tile_rx", "sp", [1, 1, 3]], ["auto_unroll_max_step", "ot", 512], ["unroll_explicit", "ot", 1]]}], "r": [[0.0003529585802997859], 0, 1.3758947849273682, 1543982194.529046], "v": 0.1}
{"i": ["cuda", "conv2d_no_batching", [1, 28, 28, 128, 256, 3, 3, [2, 2], [1, 1]], {}, ["conv2d_no_batching", 1, 28, 28, 128, 256, 3, 3, [2, 2], [1, 1]], {"i": 58073061, "t": "", "c": null, "e": [["tile_f", "sp", [16, 1, 8, 1]], ["tile_y", "sp", [2, 1, 7, 1]], ["tile_x", "sp", [2, 1, 7, 1]], ["tile_rc", "sp", [256, 1, 1]], ["tile_ry", "sp", [3, 1, 1]], ["tile_rx", "sp", [1, 1, 3]], ["auto_unroll_max_step", "ot", 512], ["unroll_explicit", "ot", 1]]}], "r": [[0.0004154369122055674], 0, 1.4709160327911377, 1543982195.735792], "v": 0.1}
{"i": ["cuda", "conv2d_no_batching", [1, 28, 28, 128, 256, 3, 3, [2, 2], [1, 1]], {}, ["conv2d_no_batching", 1, 28, 28, 128, 256, 3, 3, [2, 2], [1, 1]], {"i": 53914113, "t": "", "c": null, "e": [["tile_f", "sp", [2, 1, 64, 1]], ["tile_y", "sp", [7, 1, 2, 1]], ["tile_x", "sp", [14, 1, 1, 1]], ["tile_rc", "sp", [256, 1, 1]], ["tile_ry", "sp", [3, 1, 1]], ["tile_rx", "sp", [1, 3, 1]], ["auto_unroll_max_step", "ot", 512], ["unroll_explicit", "ot", 1]]}], "r": [[0.0003721045588865096], 0, 1.4285888671875, 1543982196.8941019], "v": 0.1}
{"i": ["cuda", "conv2d_no_batching", [1, 28, 28, 128, 256, 3, 3, [2, 2], [1, 1]], {}, ["conv2d_no_batching", 1, 28, 28, 128, 256, 3, 3, [2, 2], [1, 1]], {"i": 58061314, "t": "", "c": null, "e": [["tile_f", "sp", [1, 2, 64, 1]], ["tile_y", "sp", [7, 1, 2, 1]], ["tile_x", "sp", [14, 1, 1, 1]], ["tile_rc", "sp", [256, 1, 1]], ["tile_ry", "sp", [3, 1, 1]], ["tile_rx", "sp", [1, 1, 3]], ["auto_unroll_max_step", "ot", 512], ["unroll_explicit", "ot", 1]]}], "r": [[0.00042409442612419704], 0, 1.4773228168487549, 1543982198.136044], "v": 0.1}
{"i": ["cuda", "conv2d_no_batching", [1, 28, 28, 128, 256, 3, 3, [2, 2], [1, 1]], {}, ["conv2d_no_batching", 1, 28, 28, 128, 256, 3, 3, [2, 2], [1, 1]], {"i": 58072834, "t": "", "c": null, "e": [["tile_f", "sp", [1, 2, 64, 1]], ["tile_y", "sp", [7, 1, 2, 1]], ["tile_x", "sp", [2, 1, 7, 1]], ["tile_rc", "sp", [256, 1, 1]], ["tile_ry", "sp", [3, 1, 1]], ["tile_rx", "sp", [1, 1, 3]], ["auto_unroll_max_step", "ot", 512], ["unroll_explicit", "ot", 1]]}], "r": [[0.00045502745610278373], 0, 1.5074293613433838, 1543982199.421805], "v": 0.1}
{"i": ["cuda", "conv2d_no_batching", [1, 28, 28, 128, 256, 3, 3, [2, 2], [1, 1]], {}, ["conv2d_no_batching", 1, 28, 28, 128, 256, 3, 3, [2, 2], [1, 1]], {"i": 58061313, "t": "", "c": null, "e": [["tile_f", "sp", [2, 1, 64, 1]], ["tile_y", "sp", [7, 1, 2, 1]], ["tile_x", "sp", [14, 1, 1, 1]], ["tile_rc", "sp", [256, 1, 1]], ["tile_ry", "sp", [3, 1, 1]], ["tile_rx", "sp", [1, 1, 3]], ["auto_unroll_max_step", "ot", 512], ["unroll_explicit", "ot", 1]]}], "r": [[0.00037215321841541755], 0, 1.445831537246704, 1543982200.601231], "v": 0.1}
{"i": ["cuda", "conv2d_no_batching", [1, 28, 28, 128, 256, 3, 3, [2, 2], [1, 1]], {}, ["conv2d_no_batching", 1, 28, 28, 128, 256, 3, 3, [2, 2], [1, 1]], {"i": 45908169, "t": "", "c": null, "e": [["tile_f", "sp", [32, 2, 2, 1]], ["tile_y", "sp", [1, 1, 14, 1]], ["tile_x", "sp", [2, 1, 7, 1]], ["tile_rc", "sp", [128, 1, 2]], ["tile_ry", "sp", [3, 1, 1]], ["tile_rx", "sp", [1, 1, 3]], ["auto_unroll_max_step", "ot", 0], ["unroll_explicit", "ot", 1]]}], "r": [[0.00036879062312633837], 0, 1.4666948318481445, 1543982201.8004546], "v": 0.1}
{"i": ["cuda", "conv2d_no_batching", [1, 28, 28, 128, 256, 3, 3, [2, 2], [1, 1]], {}, ["conv2d_no_batching", 1, 28, 28, 128, 256, 3, 3, [2, 2], [1, 1]], {"i": 53925630, "t": "", "c": null, "e": [["tile_f", "sp", [4, 1, 32, 1]], ["tile_y", "sp", [7, 1, 2, 1]], ["tile_x", "sp", [2, 1, 7, 1]], ["tile_rc", "sp", [256, 1, 1]], ["tile_ry", "sp", [3, 1, 1]], ["tile_rx", "sp", [1, 3, 1]], ["auto_unroll_max_step", "ot", 512], ["unroll_explicit", "ot", 1]]}], "r": [[0.00035223285867237687], 0, 1.4135942459106445, 1543982202.950263], "v": 0.1}
{"i": ["cuda", "conv2d_no_batching", [1, 28, 28, 128, 256, 3, 3, [2, 2], [1, 1]], {}, ["conv2d_no_batching", 1, 28, 28, 128, 256, 3, 3, [2, 2], [1, 1]], {"i": 58072861, "t": "", "c": null, "e": [["tile_f", "sp", [2, 1, 32, 2]], ["tile_y", "sp", [7, 1, 2, 1]], ["tile_x", "sp", [2, 1, 7, 1]], ["tile_rc", "sp", [256, 1, 1]], ["tile_ry", "sp", [3, 1, 1]], ["tile_rx", "sp", [1, 1, 3]], ["auto_unroll_max_step", "ot", 512], ["unroll_explicit", "ot", 1]]}], "r": [[0.00035388320556745183], 0, 1.4365191459655762, 1543982204.1139455], "v": 0.1}
{"i": ["cuda", "conv2d_no_batching", [1, 28, 28, 128, 256, 3, 3, [2, 2], [1, 1]], {}, ["conv2d_no_batching", 1, 28, 28, 128, 256, 3, 3, [2, 2], [1, 1]], {"i": 58349541, "t": "", "c": null, "e": [["tile_f", "sp", [16, 1, 8, 1]], ["tile_y", "sp", [2, 1, 7, 1]], ["tile_x", "sp", [2, 1, 7, 1]], ["tile_rc", "sp", [128, 1, 2]], ["tile_ry", "sp", [3, 1, 1]], ["tile_rx", "sp", [1, 1, 3]], ["auto_unroll_max_step", "ot", 512], ["unroll_explicit", "ot", 1]]}], "r": [[0.0002876646102783726], 0, 1.3155429363250732, 1543982205.1844084], "v": 0.1}
{"i": ["cuda", "conv2d_no_batching", [1, 28, 28, 128, 256, 3, 3, [2, 2], [1, 1]], {}, ["conv2d_no_batching", 1, 28, 28, 128, 256, 3, 3, [2, 2], [1, 1]], {"i": 16589311, "t": "", "c": null, "e": [["tile_f", "sp", [2, 2, 32, 1]], ["tile_y", "sp", [7, 1, 2, 1]], ["tile_x", "sp", [14, 1, 1, 1]], ["tile_rc", "sp", [256, 1, 1]], ["tile_ry", "sp", [3, 1, 1]], ["tile_rx", "sp", [1, 3, 1]], ["auto_unroll_max_step", "ot", 512], ["unroll_explicit", "ot", 0]]}], "r": [[0.00037621596573875806], 0, 1.4227921962738037, 1543982206.3677926], "v": 0.1}
{"i": ["cuda", "conv2d_no_batching", [1, 28, 28, 128, 256, 3, 3, [2, 2], [1, 1]], {}, ["conv2d_no_batching", 1, 28, 28, 128, 256, 3, 3, [2, 2], [1, 1]], {"i": 20736511, "t": "", "c": null, "e": [["tile_f", "sp", [2, 2, 32, 1]], ["tile_y", "sp", [7, 1, 2, 1]], ["tile_x", "sp", [14, 1, 1, 1]], ["tile_rc", "sp", [256, 1, 1]], ["tile_ry", "sp", [3, 1, 1]], ["tile_rx", "sp", [1, 1, 3]], ["auto_unroll_max_step", "ot", 512], ["unroll_explicit", "ot", 0]]}], "r": [[0.0003751616745182013], 0, 1.4327476024627686, 1543982207.5597172], "v": 0.1}
{"i": ["cuda", "conv2d_no_batching", [1, 28, 28, 128, 256, 3, 3, [2, 2], [1, 1]], {}, ["conv2d_no_batching", 1, 28, 28, 128, 256, 3, 3, [2, 2], [1, 1]], {"i": 58349301, "t": "", "c": null, "e": [["tile_f", "sp", [16, 1, 8, 1]], ["tile_y", "sp", [7, 1, 2, 1]], ["tile_x", "sp", [2, 1, 7, 1]], ["tile_rc", "sp", [128, 1, 2]], ["tile_ry", "sp", [3, 1, 1]], ["tile_rx", "sp", [1, 1, 3]], ["auto_unroll_max_step", "ot", 512], ["unroll_explicit", "ot", 1]]}], "r": [[0.00021423693790149892], 0, 1.2549467086791992, 1543982208.5450137], "v": 0.1}
{"i": ["cuda", "conv2d_no_batching", [1, 28, 28, 128, 256, 3, 3, [2, 2], [1, 1]], {}, ["conv2d_no_batching", 1, 28, 28, 128, 256, 3, 3, [2, 2], [1, 1]], {"i": 53925621, "t": "", "c": null, "e": [["tile_f", "sp", [16, 1, 8, 1]], ["tile_y", "sp", [7, 1, 2, 1]], ["tile_x", "sp", [2, 1, 7, 1]], ["tile_rc", "sp", [256, 1, 1]], ["tile_ry", "sp", [3, 1, 1]], ["tile_rx", "sp", [1, 3, 1]], ["auto_unroll_max_step", "ot", 512], ["unroll_explicit", "ot", 1]]}], "r": [[0.00030369707708779444], 0, 1.3173396587371826, 1543982209.6144428], "v": 0.1}
{"i": ["cuda", "conv2d_no_batching", [1, 28, 28, 128, 256, 3, 3, [2, 2], [1, 1]], {}, ["conv2d_no_batching", 1, 28, 28, 128, 256, 3, 3, [2, 2], [1, 1]], {"i": 58073301, "t": "", "c": null, "e": [["tile_f", "sp", [16, 1, 8, 1]], ["tile_y", "sp", [1, 1, 14, 1]], ["tile_x", "sp", [2, 1, 7, 1]], ["tile_rc", "sp", [256, 1, 1]], ["tile_ry", "sp", [3, 1, 1]], ["tile_rx", "sp", [1, 1, 3]], ["auto_unroll_max_step", "ot", 512], ["unroll_explicit", "ot", 1]]}], "r": [[0.0004918068137044968], 0, 1.5865235328674316, 1543982210.9562833], "v": 0.1}
{"i": ["cuda", "conv2d_no_batching", [1, 28, 28, 128, 256, 3, 3, [2, 2], [1, 1]], {}, ["conv2d_no_batching", 1, 28, 28, 128, 256, 3, 3, [2, 2], [1, 1]], {"i": 53925633, "t": "", "c": null, "e": [["tile_f", "sp", [2, 1, 64, 1]], ["tile_y", "sp", [7, 1, 2, 1]], ["tile_x", "sp", [2, 1, 7, 1]], ["tile_rc", "sp", [256, 1, 1]], ["tile_ry", "sp", [3, 1, 1]], ["tile_rx", "sp", [1, 3, 1]], ["auto_unroll_max_step", "ot", 512], ["unroll_explicit", "ot", 1]]}], "r": [[0.0004096499850107066], 0, 1.4692456722259521, 1543982212.182017], "v": 0.1}
{"i": ["cuda", "conv2d_no_batching", [1, 28, 28, 128, 256, 3, 3, [2, 2], [1, 1]], {}, ["conv2d_no_batching", 1, 28, 28, 128, 256, 3, 3, [2, 2], [1, 1]], {"i": 58073421, "t": "", "c": null, "e": [["tile_f", "sp", [16, 1, 8, 1]], ["tile_y", "sp", [7, 1, 1, 2]], ["tile_x", "sp", [2, 1, 7, 1]], ["tile_rc", "sp", [256, 1, 1]], ["tile_ry", "sp", [3, 1, 1]], ["tile_rx", "sp", [1, 1, 3]], ["auto_unroll_max_step", "ot", 512], ["unroll_explicit", "ot", 1]]}], "r": [[0.0003288353597430407], 0, 1.3874175548553467, 1543982213.303139], "v": 0.1}
{"i": ["cuda", "conv2d_no_batching", [1, 28, 28, 128, 256, 3, 3, [2, 2], [1, 1]], {}, ["conv2d_no_batching", 1, 28, 28, 128, 256, 3, 3, [2, 2], [1, 1]], {"i": 45662409, "t": "", "c": null, "e": [["tile_f", "sp", [32, 2, 2, 1]], ["tile_y", "sp", [1, 1, 14, 1]], ["tile_x", "sp", [2, 1, 7, 1]], ["tile_rc", "sp", [128, 2, 1]], ["tile_ry", "sp", [3, 1, 1]], ["tile_rx", "sp", [1, 1, 3]], ["auto_unroll_max_step", "ot", 0], ["unroll_explicit", "ot", 1]]}], "r": [[0.0003685636638115632], 0, 1.4256539344787598, 1543982214.4715848], "v": 0.1}
{"i": ["cuda", "conv2d_no_batching", [1, 28, 28, 128, 256, 3, 3, [2, 2], [1, 1]], {}, ["conv2d_no_batching", 1, 28, 28, 128, 256, 3, 3, [2, 2], [1, 1]], {"i": 16589313, "t": "", "c": null, "e": [["tile_f", "sp", [2, 1, 64, 1]], ["tile_y", "sp", [7, 1, 2, 1]], ["tile_x", "sp", [14, 1, 1, 1]], ["tile_rc", "sp", [256, 1, 1]], ["tile_ry", "sp", [3, 1, 1]], ["tile_rx", "sp", [1, 3, 1]], ["auto_unroll_max_step", "ot", 512], ["unroll_explicit", "ot", 0]]}], "r": [[0.00037168501927194864], 0, 1.3967435359954834, 1543982215.6403916], "v": 0.1}
{"i": ["cuda", "conv2d_no_batching", [1, 28, 28, 128, 256, 3, 3, [2, 2], [1, 1]], {}, ["conv2d_no_batching", 1, 28, 28, 128, 256, 3, 3, [2, 2], [1, 1]], {"i": 58073289, "t": "", "c": null, "e": [["tile_f", "sp", [32, 2, 2, 1]], ["tile_y", "sp", [1, 1, 14, 1]], ["tile_x", "sp", [2, 1, 7, 1]], ["tile_rc", "sp", [256, 1, 1]], ["tile_ry", "sp", [3, 1, 1]], ["tile_rx", "sp", [1, 1, 3]], ["auto_unroll_max_step", "ot", 512], ["unroll_explicit", "ot", 1]]}], "r": [[0.000448392443254818], 0, 1.543501377105713, 1543982216.9061518], "v": 0.1}
{"i": ["cuda", "conv2d_no_batching", [1, 28, 28, 128, 256, 3, 3, [2, 2], [1, 1]], {}, ["conv2d_no_batching", 1, 28, 28, 128, 256, 3, 3, [2, 2], [1, 1]], {"i": 70514421, "t": "", "c": null, "e": [["tile_f", "sp", [16, 1, 8, 1]], ["tile_y", "sp", [7, 1, 2, 1]], ["tile_x", "sp", [2, 1, 7, 1]], ["tile_rc", "sp", [256, 1, 1]], ["tile_ry", "sp", [3, 1, 1]], ["tile_rx", "sp", [1, 1, 3]], ["auto_unroll_max_step", "ot", 1500], ["unroll_explicit", "ot", 1]]}], "r": [[0.0003037766059957173], 0, 1.3102176189422607, 1543982217.9789767], "v": 0.1}
{"i": ["cuda", "conv2d_no_batching", [1, 28, 28, 128, 256, 3, 3, [2, 2], [1, 1]], {}, ["conv2d_no_batching", 1, 28, 28, 128, 256, 3, 3, [2, 2], [1, 1]], {"i": 45631696, "t": "", "c": null, "e": [["tile_f", "sp", [16, 2, 4, 1]], ["tile_y", "sp", [1, 1, 14, 1]], ["tile_x", "sp", [2, 1, 7, 1]], ["tile_rc", "sp", [256, 1, 1]], ["tile_ry", "sp", [3, 1, 1]], ["tile_rx", "sp", [1, 1, 3]], ["auto_unroll_max_step", "ot", 0], ["unroll_explicit", "ot", 1]]}], "r": [[0.0004172144496788008], 0, 1.4598698616027832, 1543982219.212272], "v": 0.1}
{"i": ["cuda", "conv2d_no_batching", [1, 28, 28, 128, 256, 3, 3, [2, 2], [1, 1]], {}, ["conv2d_no_batching", 1, 28, 28, 128, 256, 3, 3, [2, 2], [1, 1]], {"i": 20736514, "t": "", "c": null, "e": [["tile_f", "sp", [1, 2, 64, 1]], ["tile_y", "sp", [7, 1, 2, 1]], ["tile_x", "sp", [14, 1, 1, 1]], ["tile_rc", "sp", [256, 1, 1]], ["tile_ry", "sp", [3, 1, 1]], ["tile_rx", "sp", [1, 1, 3]], ["auto_unroll_max_step", "ot", 512], ["unroll_explicit", "ot", 0]]}], "r": [[0.00041213175374732333], 0, 1.445035457611084, 1543982220.4105823], "v": 0.1}
{"i": ["cuda", "conv2d_no_batching", [1, 28, 28, 128, 256, 3, 3, [2, 2], [1, 1]], {}, ["conv2d_no_batching", 1, 28, 28, 128, 256, 3, 3, [2, 2], [1, 1]], {"i": 70514430, "t": "", "c": null, "e": [["tile_f", "sp", [4, 1, 32, 1]], ["tile_y", "sp", [7, 1, 2, 1]], ["tile_x", "sp", [2, 1, 7, 1]], ["tile_rc", "sp", [256, 1, 1]], ["tile_ry", "sp", [3, 1, 1]], ["tile_rx", "sp", [1, 1, 3]], ["auto_unroll_max_step", "ot", 1500], ["unroll_explicit", "ot", 1]]}], "r": [[0.0003531816359743041], 0, 1.357372760772705, 1543982221.5112762], "v": 0.1}
{"i": ["cuda", "conv2d_no_batching", [1, 28, 28, 128, 256, 3, 3, [2, 2], [1, 1]], {}, ["conv2d_no_batching", 1, 28, 28, 128, 256, 3, 3, [2, 2], [1, 1]], {"i": 20736513, "t": "", "c": null, "e": [["tile_f", "sp", [2, 1, 64, 1]], ["tile_y", "sp", [7, 1, 2, 1]], ["tile_x", "sp", [14, 1, 1, 1]], ["tile_rc", "sp", [256, 1, 1]], ["tile_ry", "sp", [3, 1, 1]], ["tile_rx", "sp", [1, 1, 3]], ["auto_unroll_max_step", "ot", 512], ["unroll_explicit", "ot", 0]]}], "r": [[0.00037168899571734474], 0, 1.3625078201293945, 1543982222.6787906], "v": 0.1}
{"i": ["cuda", "conv2d_no_batching", [1, 28, 28, 128, 256, 3, 3, [2, 2], [1, 1]], {}, ["conv2d_no_batching", 1, 28, 28, 128, 256, 3, 3, [2, 2], [1, 1]], {"i": 58073430, "t": "", "c": null, "e": [["tile_f", "sp", [4, 1, 32, 1]], ["tile_y", "sp", [7, 1, 1, 2]], ["tile_x", "sp", [2, 1, 7, 1]], ["tile_rc", "sp", [256, 1, 1]], ["tile_ry", "sp", [3, 1, 1]], ["tile_rx", "sp", [1, 1, 3]], ["auto_unroll_max_step", "ot", 512], ["unroll_explicit", "ot", 1]]}], "r": [[0.0002946380214132762], 0, 1.270205020904541, 1543982223.7381635], "v": 0.1}
{"i": ["cuda", "conv2d_no_batching", [1, 28, 28, 128, 256, 3, 3, [2, 2], [1, 1]], {}, ["conv2d_no_batching", 1, 28, 28, 128, 256, 3, 3, [2, 2], [1, 1]], {"i": 53914141, "t": "", "c": null, "e": [["tile_f", "sp", [2, 1, 32, 2]], ["tile_y", "sp", [7, 1, 2, 1]], ["tile_x", "sp", [14, 1, 1, 1]], ["tile_rc", "sp", [256, 1, 1]], ["tile_ry", "sp", [3, 1, 1]], ["tile_rx", "sp", [1, 3, 1]], ["auto_unroll_max_step", "ot", 512], ["unroll_explicit", "ot", 1]]}], "r": [[0.0003783484368308351], 0, 1.3624365329742432, 1543982224.9268398], "v": 0.1}
{"i": ["cuda", "conv2d_no_batching", [1, 28, 28, 128, 256, 3, 3, [2, 2], [1, 1]], {}, ["conv2d_no_batching", 1, 28, 28, 128, 256, 3, 3, [2, 2], [1, 1]], {"i": 54190591, "t": "", "c": null, "e": [["tile_f", "sp", [2, 2, 32, 1]], ["tile_y", "sp", [7, 1, 2, 1]], ["tile_x", "sp", [14, 1, 1, 1]], ["tile_rc", "sp", [128, 1, 2]], ["tile_ry", "sp", [3, 1, 1]], ["tile_rx", "sp", [1, 3, 1]], ["auto_unroll_max_step", "ot", 512], ["unroll_explicit", "ot", 1]]}], "r": [[0.00034957339828693793], 0, 1.4290754795074463, 1543982226.090781], "v": 0.1}
{"i": ["cuda", "conv2d_no_batching", [1, 28, 28, 128, 256, 3, 3, [2, 2], [1, 1]], {}, ["conv2d_no_batching", 1, 28, 28, 128, 256, 3, 3, [2, 2], [1, 1]], {"i": 58072822, "t": "", "c": null, "e": [["tile_f", "sp", [8, 2, 8, 1]], ["tile_y", "sp", [7, 1, 2, 1]], ["tile_x", "sp", [2, 1, 7, 1]], ["tile_rc", "sp", [256, 1, 1]], ["tile_ry", "sp", [3, 1, 1]], ["tile_rx", "sp", [1, 1, 3]], ["auto_unroll_max_step", "ot", 512], ["unroll_explicit", "ot", 1]]}], "r": [[0.0002945129100642398], 0, 1.2741637229919434, 1543982227.173863], "v": 0.1}
{"i": ["cuda", "conv2d_no_batching", [1, 28, 28, 128, 256, 3, 3, [2, 2], [1, 1]], {}, ["conv2d_no_batching", 1, 28, 28, 128, 256, 3, 3, [2, 2], [1, 1]], {"i": 53925631, "t": "", "c": null, "e": [["tile_f", "sp", [2, 2, 32, 1]], ["tile_y", "sp", [7, 1, 2, 1]], ["tile_x", "sp", [2, 1, 7, 1]], ["tile_rc", "sp", [256, 1, 1]], ["tile_ry", "sp", [3, 1, 1]], ["tile_rx", "sp", [1, 3, 1]], ["auto_unroll_max_step", "ot", 512], ["unroll_explicit", "ot", 1]]}], "r": [[0.0003538247237687366], 0, 1.382563829421997, 1543982228.3346696], "v": 0.1}
{"i": ["cuda", "conv2d_no_batching", [1, 28, 28, 128, 256, 3, 3, [2, 2], [1, 1]], {}, ["conv2d_no_batching", 1, 28, 28, 128, 256, 3, 3, [2, 2], [1, 1]], {"i": 58061341, "t": "", "c": null, "e": [["tile_f", "sp", [2, 1, 32, 2]], ["tile_y", "sp", [7, 1, 2, 1]], ["tile_x", "sp", [14, 1, 1, 1]], ["tile_rc", "sp", [256, 1, 1]], ["tile_ry", "sp", [3, 1, 1]], ["tile_rx", "sp", [1, 1, 3]], ["auto_unroll_max_step", "ot", 512], ["unroll_explicit", "ot", 1]]}], "r": [[0.0003776536295503212], 0, 1.4028501510620117, 1543982229.5273333], "v": 0.1}
{"i": ["cuda", "conv2d_no_batching", [1, 28, 28, 128, 256, 3, 3, [2, 2], [1, 1]], {}, ["conv2d_no_batching", 1, 28, 28, 128, 256, 3, 3, [2, 2], [1, 1]], {"i": 49766913, "t": "", "c": null, "e": [["tile_f", "sp", [2, 1, 64, 1]], ["tile_y", "sp", [7, 1, 2, 1]], ["tile_x", "sp", [14, 1, 1, 1]], ["tile_rc", "sp", [256, 1, 1]], ["tile_ry", "sp", [3, 1, 1]], ["tile_rx", "sp", [3, 1, 1]], ["auto_unroll_max_step", "ot", 512], ["unroll_explicit", "ot", 1]]}], "r": [[0.0009121281718749999], 0, 1.5087409019470215, 1543982185.3295114], "v": 0.1}
{"i": ["cuda", "conv2d_no_batching", [1, 28, 28, 128, 256, 3, 3, [2, 2], [1, 1]], {}, ["conv2d_no_batching", 1, 28, 28, 128, 256, 3, 3, [2, 2], [1, 1]], {"i": 58337791, "t": "", "c": null, "e": [["tile_f", "sp", [2, 2, 32, 1]], ["tile_y", "sp", [7, 1, 2, 1]], ["tile_x", "sp", [14, 1, 1, 1]], ["tile_rc", "sp", [128, 1, 2]], ["tile_ry", "sp", [3, 1, 1]], ["tile_rx", "sp", [1, 1, 3]], ["auto_unroll_max_step", "ot", 512], ["unroll_explicit", "ot", 1]]}], "r": [[0.00034726973447537476], 0, 1.3614163398742676, 1543982230.6700833], "v": 0.1}
{"i": ["cuda", "conv2d_no_batching", [1, 28, 28, 128, 256, 3, 3, [2, 2], [1, 1]], {}, ["conv2d_no_batching", 1, 28, 28, 128, 256, 3, 3, [2, 2], [1, 1]], {"i": 66367222, "t": "", "c": null, "e": [["tile_f", "sp", [8, 2, 8, 1]], ["tile_y", "sp", [7, 1, 2, 1]], ["tile_x", "sp", [2, 1, 7, 1]], ["tile_rc", "sp", [256, 1, 1]], ["tile_ry", "sp", [3, 1, 1]], ["tile_rx", "sp", [1, 3, 1]], ["auto_unroll_max_step", "ot", 1500], ["unroll_explicit", "ot", 1]]}], "r": [[0.00032562637259100647], 0, 1.3189468383789062, 1543982240.8425674], "v": 0.1}
{"i": ["cuda", "conv2d_no_batching", [1, 28, 28, 128, 256, 3, 3, [2, 2], [1, 1]], {}, ["conv2d_no_batching", 1, 28, 28, 128, 256, 3, 3, [2, 2], [1, 1]], {"i": 66397928, "t": "", "c": null, "e": [["tile_f", "sp", [64, 1, 2, 1]], ["tile_y", "sp", [7, 1, 2, 1]], ["tile_x", "sp", [2, 1, 7, 1]], ["tile_rc", "sp", [128, 2, 1]], ["tile_ry", "sp", [3, 1, 1]], ["tile_rx", "sp", [1, 3, 1]], ["auto_unroll_max_step", "ot", 1500], ["unroll_explicit", "ot", 1]]}], "r": [[0.0002800420620985011], 0, 1.433140516281128, 1543982241.9529774], "v": 0.1}
{"i": ["cuda", "conv2d_no_batching", [1, 28, 28, 128, 256, 3, 3, [2, 2], [1, 1]], {}, ["conv2d_no_batching", 1, 28, 28, 128, 256, 3, 3, [2, 2], [1, 1]], {"i": 66397935, "t": "", "c": null, "e": [["tile_f", "sp", [32, 1, 4, 1]], ["tile_y", "sp", [7, 1, 2, 1]], ["tile_x", "sp", [2, 1, 7, 1]], ["tile_rc", "sp", [128, 2, 1]], ["tile_ry", "sp", [3, 1, 1]], ["tile_rx", "sp", [1, 3, 1]], ["auto_unroll_max_step", "ot", 1500], ["unroll_explicit", "ot", 1]]}], "r": [[0.00026033071520342613], 0, 1.425438404083252, 1543982243.028248], "v": 0.1}
{"i": ["cuda", "conv2d_no_batching", [1, 28, 28, 128, 256, 3, 3, [2, 2], [1, 1]], {}, ["conv2d_no_batching", 1, 28, 28, 128, 256, 3, 3, [2, 2], [1, 1]], {"i": 53956328, "t": "", "c": null, "e": [["tile_f", "sp", [64, 1, 2, 1]], ["tile_y", "sp", [7, 1, 2, 1]], ["tile_x", "sp", [2, 1, 7, 1]], ["tile_rc", "sp", [128, 2, 1]], ["tile_ry", "sp", [3, 1, 1]], ["tile_rx", "sp", [1, 3, 1]], ["auto_unroll_max_step", "ot", 512], ["unroll_explicit", "ot", 1]]}], "r": [[0.00028008058672376873], 0, 1.4036438465118408, 1543982244.0768747], "v": 0.1}
{"i": ["cuda", "conv2d_no_batching", [1, 28, 28, 128, 256, 3, 3, [2, 2], [1, 1]], {}, ["conv2d_no_batching", 1, 28, 28, 128, 256, 3, 3, [2, 2], [1, 1]], {"i": 53956335, "t": "", "c": null, "e": [["tile_f", "sp", [32, 1, 4, 1]], ["tile_y", "sp", [7, 1, 2, 1]], ["tile_x", "sp", [2, 1, 7, 1]], ["tile_rc", "sp", [128, 2, 1]], ["tile_ry", "sp", [3, 1, 1]], ["tile_rx", "sp", [1, 3, 1]], ["auto_unroll_max_step", "ot", 512], ["unroll_explicit", "ot", 1]]}], "r": [[0.0002602126745182013], 0, 1.369917392730713, 1543982245.0926883], "v": 0.1}
{"i": ["cuda", "conv2d_no_batching", [1, 28, 28, 128, 256, 3, 3, [2, 2], [1, 1]], {}, ["conv2d_no_batching", 1, 28, 28, 128, 256, 3, 3, [2, 2], [1, 1]], {"i": 68026706, "t": "", "c": null, "e": [["tile_f", "sp", [8, 1, 16, 1]], ["tile_y", "sp", [7, 1, 1, 2]], ["tile_x", "sp", [2, 1, 7, 1]], ["tile_rc", "sp", [128, 1, 2]], ["tile_ry", "sp", [1, 3, 1]], ["tile_rx", "sp", [1, 3, 1]], ["auto_unroll_max_step", "ot", 1500], ["unroll_explicit", "ot", 1]]}], "r": [[0.00010269938056680161], 0, 1.2233967781066895, 1543982303.286232], "v": 0.1}
