baseline/conv2d_c12_itervar_n100_4.log
{"i": ["cuda", "conv2d_no_batching", [1, 7, 7, 512, 512, 3, 3, [1, 1], [1, 1]], {}, ["conv2d_no_batching", 1, 7, 7, 512, 512, 3, 3, [1, 1], [1, 1]], {"i": 4355525, "t": "", "c": null, "e": [["tile_f", "sp", [16, 1, 1, 32]], ["tile_y", "sp", [1, 7, 1, 1]], ["tile_x", "sp", [1, 7, 1, 1]], ["tile_rc", "sp", [64, 1, 8]], ["tile_ry", "sp", [1, 3, 1]], ["tile_rx", "sp", [1, 3, 1]], ["auto_unroll_max_step", "ot", 1500], ["unroll_explicit", "ot", 0]]}], "r": [[0.493975007], 0, 9.514254331588745, 1544134771.8692756], "v": 0.1}
{"i": ["cuda", "conv2d_no_batching", [1, 7, 7, 512, 512, 3, 3, [1, 1], [1, 1]], {}, ["conv2d_no_batching", 1, 7, 7, 512, 512, 3, 3, [1, 1], [1, 1]], {"i": 5905621, "t": "", "c": null, "e": [["tile_f", "sp", [2, 1, 32, 8]], ["tile_y", "sp", [1, 1, 1, 7]], ["tile_x", "sp", [1, 1, 7, 1]], ["tile_rc", "sp", [64, 1, 8]], ["tile_ry", "sp", [3, 1, 1]], ["tile_rx", "sp", [1, 3, 1]], ["auto_unroll_max_step", "ot", 0], ["unroll_explicit", "ot", 1]]}], "r": [[0.0066921378], 0, 3.209798812866211, 1544134813.3455958], "v": 0.1}
{"i": ["cuda", "conv2d_no_batching", [1, 7, 7, 512, 512, 3, 3, [1, 1], [1, 1]], {}, ["conv2d_no_batching", 1, 7, 7, 512, 512, 3, 3, [1, 1], [1, 1]], {"i": 3913404, "t": "", "c": null, "e": [["tile_f", "sp", [1, 16, 32, 1]], ["tile_y", "sp", [7, 1, 1, 1]], ["tile_x", "sp", [1, 1, 1, 7]], ["tile_rc", "sp", [128, 2, 2]], ["tile_ry", "sp", [1, 1, 3]], ["tile_rx", "sp", [3, 1, 1]], ["auto_unroll_max_step", "ot", 1500], ["unroll_explicit", "ot", 0]]}], "r": [[0.00241775473], 0, 3.726379871368408, 1544134816.579296], "v": 0.1}
{"i": ["cuda", "conv2d_no_batching", [1, 7, 7, 512, 512, 3, 3, [1, 1], [1, 1]], {}, ["conv2d_no_batching", 1, 7, 7, 512, 512, 3, 3, [1, 1], [1, 1]], {"i": 1557106, "t": "", "c": null, "e": [["tile_f", "sp", [8, 4, 1, 16]], ["tile_y", "sp", [1, 7, 1, 1]], ["tile_x", "sp", [1, 7, 1, 1]], ["tile_rc", "sp", [128, 4, 1]], ["tile_ry", "sp", [1, 1, 3]], ["tile_rx", "sp", [1, 1, 3]], ["auto_unroll_max_step", "ot", 0], ["unroll_explicit", "ot", 0]]}], "r": [[0.5513504225], 0, 9.541257858276367, 1544134784.7131371], "v": 0.1}
{"i": ["cuda", "conv2d_no_batching", [1, 7, 7, 512, 512, 3, 3, [1, 1], [1, 1]], {}, ["conv2d_no_batching", 1, 7, 7, 512, 512, 3, 3, [1, 1], [1, 1]], {"i": 9243669, "t": "", "c": null, "e": [["tile_f", "sp", [16, 1, 4, 8]], ["tile_y", "sp", [7, 1, 1, 1]], ["tile_x", "sp", [7, 1, 1, 1]], ["tile_rc", "sp", [8, 2, 32]], ["tile_ry", "sp", [1, 1, 3]], ["tile_rx", "sp", [3, 1, 1]], ["auto_unroll_max_step", "ot", 1500], ["unroll_explicit", "ot", 1]]}], "r": [[0.021580774950000003], 0, 9.202920198440552, 1544134824.0217972], "v": 0.1}
{"i": ["cuda", "conv2d_no_batching", [1, 7, 7, 512, 512, 3, 3, [1, 1], [1, 1]], {}, ["conv2d_no_batching", 1, 7, 7, 512, 512, 3, 3, [1, 1], [1, 1]], {"i": 1013446, "t": "", "c": null, "e": [["tile_f", "sp", [8, 1, 16, 4]], ["tile_y", "sp", [1, 1, 7, 1]], ["tile_x", "sp", [1, 1, 1, 7]], ["tile_rc", "sp", [64, 4, 2]], ["tile_ry", "sp", [1, 1, 3]], ["tile_rx", "sp", [1, 3, 1]], ["auto_unroll_max_step", "ot", 0], ["unroll_explicit", "ot", 0]]}], "r": [[0.0010027852399999999], 0, 1.4634840488433838, 1544134825.1235845], "v": 0.1}
{"i": ["cuda", "conv2d_no_batching", [1, 7, 7, 512, 512, 3, 3, [1, 1], [1, 1]], {}, ["conv2d_no_batching", 1, 7, 7, 512, 512, 3, 3, [1, 1], [1, 1]], {"i": 5424194, "t": "", "c": null, "e": [["tile_f", "sp", [4, 1, 64, 2]], ["tile_y", "sp", [1, 1, 1, 7]], ["tile_x", "sp", [1, 1, 1, 7]], ["tile_rc", "sp", [512, 1, 1]], ["tile_ry", "sp", [1, 3, 1]], ["tile_rx", "sp", [3, 1, 1]], ["auto_unroll_max_step", "ot", 0], ["unroll_explicit", "ot", 1]]}], "r": [[0.00195571367], 0, 1.6799943447113037, 1544134826.5423682], "v": 0.1}
{"i": ["cuda", "conv2d_no_batching", [1, 7, 7, 512, 512, 3, 3, [1, 1], [1, 1]], {}, ["conv2d_no_batching", 1, 7, 7, 512, 512, 3, 3, [1, 1], [1, 1]], {"i": 1167726, "t": "", "c": null, "e": [["tile_f", "sp", [8, 2, 1, 32]], ["tile_y", "sp", [1, 1, 1, 7]], ["tile_x", "sp", [1, 1, 7, 1]], ["tile_rc", "sp", [256, 2, 1]], ["tile_ry", "sp", [3, 1, 1]], ["tile_rx", "sp", [1, 1, 3]], ["auto_unroll_max_step", "ot", 0], ["unroll_explicit", "ot", 0]]}], "r": [[0.04244473475], 0, 2.0275449752807617, 1544134791.526349], "v": 0.1}
{"i": ["cuda", "conv2d_no_batching", [1, 7, 7, 512, 512, 3, 3, [1, 1], [1, 1]], {}, ["conv2d_no_batching", 1, 7, 7, 512, 512, 3, 3, [1, 1], [1, 1]], {"i": 9102738, "t": "", "c": null, "e": [["tile_f", "sp", [1, 256, 2, 1]], ["tile_y", "sp", [7, 1, 1, 1]], ["tile_x", "sp", [7, 1, 1, 1]], ["tile_rc", "sp", [256, 2, 1]], ["tile_ry", "sp", [1, 1, 3]], ["tile_rx", "sp", [3, 1, 1]], ["auto_unroll_max_step", "ot", 1500], ["unroll_explicit", "ot", 1]]}], "r": [[0.11540948175], 0, 4.901918411254883, 1544134794.9274118], "v": 0.1}
{"i": ["cuda", "conv2d_no_batching", [1, 7, 7, 512, 512, 3, 3, [1, 1], [1, 1]], {}, ["conv2d_no_batching", 1, 7, 7, 512, 512, 3, 3, [1, 1], [1, 1]], {"i": 337816, "t": "", "c": null, "e": [["tile_f", "sp", [16, 2, 4, 4]], ["tile_y", "sp", [1, 1, 1, 7]], ["tile_x", "sp", [1, 1, 1, 7]], ["tile_rc", "sp", [16, 1, 32]], ["tile_ry", "sp", [1, 3, 1]], ["tile_rx", "sp", [3, 1, 1]], ["auto_unroll_max_step", "ot", 0], ["unroll_explicit", "ot", 0]]}], "r": [[0.02451363888], 0, 9.024796962738037, 1544134834.893767], "v": 0.1}
{"i": ["cuda", "conv2d_no_batching", [1, 7, 7, 512, 512, 3, 3, [1, 1], [1, 1]], {}, ["conv2d_no_batching", 1, 7, 7, 512, 512, 3, 3, [1, 1], [1, 1]], {"i": 4186848, "t": "", "c": null, "e": [["tile_f", "sp", [32, 2, 8, 1]], ["tile_y", "sp", [1, 1, 1, 7]], ["tile_x", "sp", [1, 7, 1, 1]], ["tile_rc", "sp", [32, 1, 16]], ["tile_ry", "sp", [3, 1, 1]], ["tile_rx", "sp", [1, 3, 1]], ["auto_unroll_max_step", "ot", 1500], ["unroll_explicit", "ot", 0]]}], "r": [[0.00692302152], 0, 5.066197156906128, 1544134837.9835997], "v": 0.1}
{"i": ["cuda", "conv2d_no_batching", [1, 7, 7, 512, 512, 3, 3, [1, 1], [1, 1]], {}, ["conv2d_no_batching", 1, 7, 7, 512, 512, 3, 3, [1, 1], [1, 1]], {"i": 2155661, "t": "", "c": null, "e": [["tile_f", "sp", [64, 2, 1, 4]], ["tile_y", "sp", [1, 1, 7, 1]], ["tile_x", "sp", [1, 7, 1, 1]], ["tile_rc", "sp", [4, 128, 1]], ["tile_ry", "sp", [1, 1, 3]], ["tile_rx", "sp", [3, 1, 1]], ["auto_unroll_max_step", "ot", 512], ["unroll_explicit", "ot", 0]]}], "r": [[0.0058772206], 0, 11.195928573608398, 1544134841.5986292], "v": 0.1}
{"i": ["cuda", "conv2d_no_batching", [1, 7, 7, 512, 512, 3, 3, [1, 1], [1, 1]], {}, ["conv2d_no_batching", 1, 7, 7, 512, 512, 3, 3, [1, 1], [1, 1]], {"i": 8524329, "t": "", "c": null, "e": [["tile_f", "sp", [1, 1, 8, 64]], ["tile_y", "sp", [1, 1, 7, 1]], ["tile_x", "sp", [1, 1, 7, 1]], ["tile_rc", "sp", [256, 2, 1]], ["tile_ry", "sp", [1, 1, 3]], ["tile_rx", "sp", [1, 1, 3]], ["auto_unroll_max_step", "ot", 512], ["unroll_explicit", "ot", 1]]}], "r": [[0.01324749089], 0, 5.292360544204712, 1544134846.4640126], "v": 0.1}
