baseline/conv2d_c12_curve-fix_n2000_4.log
{"i": ["cuda", "conv2d_no_batching", [1, 7, 7, 512, 512, 3, 3, [1, 1], [1, 1]], {}, ["conv2d_no_batching", 1, 7, 7, 512, 512, 3, 3, [1, 1], [1, 1]], {"i": 7072687, "t": "", "c": null, "e": [["tile_f", "sp", [4, 2, 16, 4]], ["tile_y", "sp", [7, 1, 1, 1]], ["tile_x", "sp", [1, 7, 1, 1]], ["tile_rc", "sp", [16, 4, 8]], ["tile_ry", "sp", [3, 1, 1]], ["tile_rx", "sp", [3, 1, 1]], ["auto_unroll_max_step", "ot", 512], ["unroll_explicit", "ot", 1]]}], "r": [[0.0008427138709677419], 0, 1.8778014183044434, 1544139909.31101], "v": 0.1}
{"i": ["cuda", "conv2d_no_batching", [1, 7, 7, 512, 512, 3, 3, [1, 1], [1, 1]], {}, ["conv2d_no_batching", 1, 7, 7, 512, 512, 3, 3, [1, 1], [1, 1]], {"i": 7983901, "t": "", "c": null, "e": [["tile_f", "sp", [64, 2, 1, 4]], ["tile_y", "sp", [1, 1, 7, 1]], ["tile_x", "sp", [7, 1, 1, 1]], ["tile_rc", "sp", [32, 8, 2]], ["tile_ry", "sp", [1, 1, 3]], ["tile_rx", "sp", [1, 3, 1]], ["auto_unroll_max_step", "ot", 512], ["unroll_explicit", "ot", 1]]}], "r": [[0.0020607477822580647], 0, 3.498542547225952, 1544139910.9860854], "v": 0.1}
{"i": ["cuda", "conv2d_no_batching", [1, 7, 7, 512, 512, 3, 3, [1, 1], [1, 1]], {}, ["conv2d_no_batching", 1, 7, 7, 512, 512, 3, 3, [1, 1], [1, 1]], {"i": 2383701, "t": "", "c": null, "e": [["tile_f", "sp", [256, 2, 1, 1]], ["tile_y", "sp", [1, 1, 1, 7]], ["tile_x", "sp", [7, 1, 1, 1]], ["tile_rc", "sp", [2, 128, 2]], ["tile_ry", "sp", [3, 1, 1]], ["tile_rx", "sp", [1, 3, 1]], ["auto_unroll_max_step", "ot", 512], ["unroll_explicit", "ot", 0]]}], "r": [[0.011878077201612902], 0, 5.33974552154541, 1544139916.0933647], "v": 0.1}
{"i": ["cuda", "conv2d_no_batching", [1, 7, 7, 512, 512, 3, 3, [1, 1], [1, 1]], {}, ["conv2d_no_batching", 1, 7, 7, 512, 512, 3, 3, [1, 1], [1, 1]], {"i": 1947372, "t": "", "c": null, "e": [["tile_f", "sp", [2, 8, 4, 8]], ["tile_y", "sp", [1, 1, 1, 7]], ["tile_x", "sp", [7, 1, 1, 1]], ["tile_rc", "sp", [64, 8, 1]], ["tile_ry", "sp", [1, 3, 1]], ["tile_rx", "sp", [3, 1, 1]], ["auto_unroll_max_step", "ot", 512], ["unroll_explicit", "ot", 0]]}], "r": [[0.05285914325], 0, 2.6403086185455322, 1544139892.253749], "v": 0.1}
{"i": ["cuda", "conv2d_no_batching", [1, 7, 7, 512, 512, 3, 3, [1, 1], [1, 1]], {}, ["conv2d_no_batching", 1, 7, 7, 512, 512, 3, 3, [1, 1], [1, 1]], {"i": 1009418, "t": "", "c": null, "e": [["tile_f", "sp", [32, 8, 1, 2]], ["tile_y", "sp", [7, 1, 1, 1]], ["tile_x", "sp", [1, 1, 1, 7]], ["tile_rc", "sp", [128, 2, 2]], ["tile_ry", "sp", [1, 1, 3]], ["tile_rx", "sp", [1, 3, 1]], ["auto_unroll_max_step", "ot", 0], ["unroll_explicit", "ot", 0]]}], "r": [[0.00789448568548387], 0, 4.001985788345337, 1544139919.7595506], "v": 0.1}
{"i": ["cuda", "conv2d_no_batching", [1, 7, 7, 512, 512, 3, 3, [1, 1], [1, 1]], {}, ["conv2d_no_batching", 1, 7, 7, 512, 512, 3, 3, [1, 1], [1, 1]], {"i": 7983971, "t": "", "c": null, "e": [["tile_f", "sp", [8, 2, 2, 16]], ["tile_y", "sp", [1, 1, 7, 1]], ["tile_x", "sp", [7, 1, 1, 1]], ["tile_rc", "sp", [32, 8, 2]], ["tile_ry", "sp", [1, 1, 3]], ["tile_rx", "sp", [1, 3, 1]], ["auto_unroll_max_step", "ot", 512], ["unroll_explicit", "ot", 1]]}], "r": [[0.0075956348145161294], 0, 4.157737970352173, 1544139923.3226707], "v": 0.1}
{"i": ["cuda", "conv2d_no_batching", [1, 7, 7, 512, 512, 3, 3, [1, 1], [1, 1]], {}, ["conv2d_no_batching", 1, 7, 7, 512, 512, 3, 3, [1, 1], [1, 1]], {"i": 8810630, "t": "", "c": null, "e": [["tile_f", "sp", [2, 64, 2, 2]], ["tile_y", "sp", [7, 1, 1, 1]], ["tile_x", "sp", [7, 1, 1, 1]], ["tile_rc", "sp", [32, 2, 8]], ["tile_ry", "sp", [3, 1, 1]], ["tile_rx", "sp", [3, 1, 1]], ["auto_unroll_max_step", "ot", 1500], ["unroll_explicit", "ot", 1]]}], "r": [[0.021198645387096777], 0, 11.213592290878296, 1544139932.0680742], "v": 0.1}
{"i": ["cuda", "conv2d_no_batching", [1, 7, 7, 512, 512, 3, 3, [1, 1], [1, 1]], {}, ["conv2d_no_batching", 1, 7, 7, 512, 512, 3, 3, [1, 1], [1, 1]], {"i": 2623062, "t": "", "c": null, "e": [["tile_f", "sp", [128, 4, 1, 1]], ["tile_y", "sp", [1, 1, 1, 7]], ["tile_x", "sp", [7, 1, 1, 1]], ["tile_rc", "sp", [8, 8, 8]], ["tile_ry", "sp", [1, 3, 1]], ["tile_rx", "sp", [1, 3, 1]], ["auto_unroll_max_step", "ot", 512], ["unroll_explicit", "ot", 0]]}], "r": [[0.02173660576612903], 0, 9.157352685928345, 1544139940.889982], "v": 0.1}
{"i": ["cuda", "conv2d_no_batching", [1, 7, 7, 512, 512, 3, 3, [1, 1], [1, 1]], {}, ["conv2d_no_batching", 1, 7, 7, 512, 512, 3, 3, [1, 1], [1, 1]], {"i": 2924406, "t": "", "c": null, "e": [["tile_f", "sp", [8, 4, 1, 16]], ["tile_y", "sp", [7, 1, 1, 1]], ["tile_x", "sp", [1, 1, 1, 7]], ["tile_rc", "sp", [16, 32, 1]], ["tile_ry", "sp", [3, 1, 1]], ["tile_rx", "sp", [1, 1, 3]], ["auto_unroll_max_step", "ot", 512], ["unroll_explicit", "ot", 0]]}], "r": [[0.0582075455], 0, 2.638137102127075, 1544139900.3574538], "v": 0.1}
{"i": ["cuda", "conv2d_no_batching", [1, 7, 7, 512, 512, 3, 3, [1, 1], [1, 1]], {}, ["conv2d_no_batching", 1, 7, 7, 512, 512, 3, 3, [1, 1], [1, 1]], {"i": 4260775, "t": "", "c": null, "e": [["tile_f", "sp", [16, 2, 16, 1]], ["tile_y", "sp", [1, 1, 1, 7]], ["tile_x", "sp", [1, 7, 1, 1]], ["tile_rc", "sp", [512, 1, 1]], ["tile_ry", "sp", [1, 3, 1]], ["tile_rx", "sp", [1, 3, 1]], ["auto_unroll_max_step", "ot", 1500], ["unroll_explicit", "ot", 0]]}], "r": [[0.0018660778870967741], 0, 1.7900943756103516, 1544139942.3403769], "v": 0.1}
{"i": ["cuda", "conv2d_no_batching", [1, 7, 7, 512, 512, 3, 3, [1, 1], [1, 1]], {}, ["conv2d_no_batching", 1, 7, 7, 512, 512, 3, 3, [1, 1], [1, 1]], {"i": 4504741, "t": "", "c": null, "e": [["tile_f", "sp", [32, 4, 4, 1]], ["tile_y", "sp", [7, 1, 1, 1]], ["tile_x", "sp", [1, 1, 1, 7]], ["tile_rc", "sp", [16, 16, 2]], ["tile_ry", "sp", [1, 1, 3]], ["tile_rx", "sp", [1, 3, 1]], ["auto_unroll_max_step", "ot", 1500], ["unroll_explicit", "ot", 0]]}], "r": [[0.0008092863225806451], 0, 3.395465135574341, 1544139943.534159], "v": 0.1}
{"i": ["cuda", "conv2d_no_batching", [1, 7, 7, 512, 512, 3, 3, [1, 1], [1, 1]], {}, ["conv2d_no_batching", 1, 7, 7, 512, 512, 3, 3, [1, 1], [1, 1]], {"i": 1809718, "t": "", "c": null, "e": [["tile_f", "sp", [1, 1, 2, 256]], ["tile_y", "sp", [1, 7, 1, 1]], ["tile_x", "sp", [7, 1, 1, 1]], ["tile_rc", "sp", [128, 1, 4]], ["tile_ry", "sp", [3, 1, 1]], ["tile_rx", "sp", [3, 1, 1]], ["auto_unroll_max_step", "ot", 512], ["unroll_explicit", "ot", 0]]}], "r": [[0.19430724225], 0, 3.655078887939453, 1544139906.66362], "v": 0.1}
{"i": ["cuda", "conv2d_no_batching", [1, 7, 7, 512, 512, 3, 3, [1, 1], [1, 1]], {}, ["conv2d_no_batching", 1, 7, 7, 512, 512, 3, 3, [1, 1], [1, 1]], {"i": 9505128, "t": "", "c": null, "e": [["tile_f", "sp", [32, 2, 8, 1]], ["tile_y", "sp", [1, 7, 1, 1]], ["tile_x", "sp", [1, 7, 1, 1]], ["tile_rc", "sp", [16, 32, 1]], ["tile_ry", "sp", [1, 3, 1]], ["tile_rx", "sp", [1, 3, 1]], ["auto_unroll_max_step", "ot", 1500], ["unroll_explicit", "ot", 1]]}], "r": [[0.0013013561693548388], 0, 3.384334087371826, 1544139944.9042058], "v": 0.1}
{"i": ["cuda", "conv2d_no_batching", [1, 7, 7, 512, 512, 3, 3, [1, 1], [1, 1]], {}, ["conv2d_no_batching", 1, 7, 7, 512, 512, 3, 3, [1, 1], [1, 1]], {"i": 5851484, "t": "", "c": null, "e": [["tile_f", "sp", [16, 2, 2, 8]], ["tile_y", "sp", [1, 7, 1, 1]], ["tile_x", "sp", [1, 7, 1, 1]], ["tile_rc", "sp", [64, 4, 2]], ["tile_ry", "sp", [3, 1, 1]], ["tile_rx", "sp", [1, 3, 1]], ["auto_unroll_max_step", "ot", 0], ["unroll_explicit", "ot", 1]]}], "r": [[0.04443036830645161], 0, 18.177984952926636, 1544139965.6404436], "v": 0.1}
{"i": ["cuda", "conv2d_no_batching", [1, 7, 7, 512, 512, 3, 3, [1, 1], [1, 1]], {}, ["conv2d_no_batching", 1, 7, 7, 512, 512, 3, 3, [1, 1], [1, 1]], {"i": 7589502, "t": "", "c": null, "e": [["tile_f", "sp", [1, 2, 32, 8]], ["tile_y", "sp", [1, 7, 1, 1]], ["tile_x", "sp", [7, 1, 1, 1]], ["tile_rc", "sp", [128, 2, 2]], ["tile_ry", "sp", [3, 1, 1]], ["tile_rx", "sp", [1, 3, 1]], ["auto_unroll_max_step", "ot", 512], ["unroll_explicit", "ot", 1]]}], "r": [[0.002967223370967742], 0, 2.5842854976654053, 1544139967.8622353], "v": 0.1}
{"i": ["cuda", "conv2d_no_batching", [1, 7, 7, 512, 512, 3, 3, [1, 1], [1, 1]], {}, ["conv2d_no_batching", 1, 7, 7, 512, 512, 3, 3, [1, 1], [1, 1]], {"i": 5545762, "t": "", "c": null, "e": [["tile_f", "sp", [128, 4, 1, 1]], ["tile_y", "sp", [7, 1, 1, 1]], ["tile_x", "sp", [1, 1, 7, 1]], ["tile_rc", "sp", [16, 2, 16]], ["tile_ry", "sp", [1, 3, 1]], ["tile_rx", "sp", [3, 1, 1]], ["auto_unroll_max_step", "ot", 0], ["unroll_explicit", "ot", 1]]}], "r": [[0.004130729072580645], 0, 2.6471025943756104, 1544139972.1804066], "v": 0.1}
{"i": ["cuda", "conv2d_no_batching", [1, 7, 7, 512, 512, 3, 3, [1, 1], [1, 1]], {}, ["conv2d_no_batching", 1, 7, 7, 512, 512, 3, 3, [1, 1], [1, 1]], {"i": 6210605, "t": "", "c": null, "e": [["tile_f", "sp", [16, 32, 1, 1]], ["tile_y", "sp", [1, 1, 7, 1]], ["tile_x", "sp", [1, 7, 1, 1]], ["tile_rc", "sp", [32, 16, 1]], ["tile_ry", "sp", [1, 1, 3]], ["tile_rx", "sp", [1, 3, 1]], ["auto_unroll_max_step", "ot", 0], ["unroll_explicit", "ot", 1]]}], "r": [[0.011683698395161292], 0, 5.710332155227661, 1544139977.4130452], "v": 0.1}
{"i": ["cuda", "conv2d_no_batching", [1, 7, 7, 512, 512, 3, 3, [1, 1], [1, 1]], {}, ["conv2d_no_batching", 1, 7, 7, 512, 512, 3, 3, [1, 1], [1, 1]], {"i": 4594507, "t": "", "c": null, "e": [["tile_f", "sp", [64, 1, 8, 1]], ["tile_y", "sp", [7, 1, 1, 1]], ["tile_x", "sp", [1, 7, 1, 1]], ["tile_rc", "sp", [16, 1, 32]], ["tile_ry", "sp", [1, 1, 3]], ["tile_rx", "sp", [1, 3, 1]], ["auto_unroll_max_step", "ot", 1500], ["unroll_explicit", "ot", 0]]}], "r": [[0.0009653242338709678], 0, 2.0811822414398193, 1544139978.9284046], "v": 0.1}
{"i": ["cuda", "conv2d_no_batching", [1, 7, 7, 512, 512, 3, 3, [1, 1], [1, 1]], {}, ["conv2d_no_batching", 1, 7, 7, 512, 512, 3, 3, [1, 1], [1, 1]], {"i": 233036, "t": "", "c": null, "e": [["tile_f", "sp", [128, 2, 1, 2]], ["tile_y", "sp", [1, 1, 1, 7]], ["tile_x", "sp", [7, 1, 1, 1]], ["tile_rc", "sp", [128, 2, 2]], ["tile_ry", "sp", [1, 3, 1]], ["tile_rx", "sp", [3, 1, 1]], ["auto_unroll_max_step", "ot", 0], ["unroll_explicit", "ot", 0]]}], "r": [[0.004612416935483871], 0, 3.2709341049194336, 1544139982.6920946], "v": 0.1}
{"i": ["cuda", "conv2d_no_batching", [1, 7, 7, 512, 512, 3, 3, [1, 1], [1, 1]], {}, ["conv2d_no_batching", 1, 7, 7, 512, 512, 3, 3, [1, 1], [1, 1]], {"i": 1780889, "t": "", "c": null, "e": [["tile_f", "sp", [1, 1, 8, 64]], ["tile_y", "sp", [1, 1, 7, 1]], ["tile_x", "sp", [1, 1, 1, 7]], ["tile_rc", "sp", [256, 1, 2]], ["tile_ry", "sp", [3, 1, 1]], ["tile_rx", "sp", [3, 1, 1]], ["auto_unroll_max_step", "ot", 512], ["unroll_explicit", "ot", 0]]}], "r": [[0.0244131052016129], 0, 11.001845121383667, 1544139993.0043216], "v": 0.1}
{"i": ["cuda", "conv2d_no_batching", [1, 7, 7, 512, 512, 3, 3, [1, 1], [1, 1]], {}, ["conv2d_no_batching", 1, 7, 7, 512, 512, 3, 3, [1, 1], [1, 1]], {"i": 4144695, "t": "", "c": null, "e": [["tile_f", "sp", [32, 1, 4, 4]], ["tile_y", "sp", [1, 1, 1, 7]], ["tile_x", "sp", [1, 7, 1, 1]], ["tile_rc", "sp", [16, 8, 4]], ["tile_ry", "sp", [3, 1, 1]], ["tile_rx", "sp", [1, 3, 1]], ["auto_unroll_max_step", "ot", 1500], ["unroll_explicit", "ot", 0]]}], "r": [[0.003534094427419355], 0, 4.4494688510894775, 1544139996.4936914], "v": 0.1}
{"i": ["cuda", "conv2d_no_batching", [1, 7, 7, 512, 512, 3, 3, [1, 1], [1, 1]], {}, ["conv2d_no_batching", 1, 7, 7, 512, 512, 3, 3, [1, 1], [1, 1]], {"i": 1129068, "t": "", "c": null, "e": [["tile_f", "sp", [32, 2, 8, 1]], ["tile_y", "sp", [7, 1, 1, 1]], ["tile_x", "sp", [1, 1, 1, 7]], ["tile_rc", "sp", [8, 1, 64]], ["tile_ry", "sp", [1, 1, 3]], ["tile_rx", "sp", [1, 3, 1]], ["auto_unroll_max_step", "ot", 0], ["unroll_explicit", "ot", 0]]}], "r": [[0.006529698153225806], 0, 3.6252222061157227, 1544139999.7774887], "v": 0.1}
{"i": ["cuda", "conv2d_no_batching", [1, 7, 7, 512, 512, 3, 3, [1, 1], [1, 1]], {}, ["conv2d_no_batching", 1, 7, 7, 512, 512, 3, 3, [1, 1], [1, 1]], {"i": 3062402, "t": "", "c": null, "e": [["tile_f", "sp", [128, 4, 1, 1]], ["tile_y", "sp", [7, 1, 1, 1]], ["tile_x", "sp", [7, 1, 1, 1]], ["tile_rc", "sp", [8, 1, 64]], ["tile_ry", "sp", [3, 1, 1]], ["tile_rx", "sp", [1, 1, 3]], ["auto_unroll_max_step", "ot", 512], ["unroll_explicit", "ot", 0]]}], "r": [[0.0721759968548387], 0, 28.51297402381897, 1544140027.7229846], "v": 0.1}
{"i": ["cuda", "conv2d_no_batching", [1, 7, 7, 512, 512, 3, 3, [1, 1], [1, 1]], {}, ["conv2d_no_batching", 1, 7, 7, 512, 512, 3, 3, [1, 1], [1, 1]], {"i": 7744294, "t": "", "c": null, "e": [["tile_f", "sp", [16, 4, 4, 2]], ["tile_y", "sp", [1, 7, 1, 1]], ["tile_x", "sp", [7, 1, 1, 1]], ["tile_rc", "sp", [512, 1, 1]], ["tile_ry", "sp", [1, 3, 1]], ["tile_rx", "sp", [1, 3, 1]], ["auto_unroll_max_step", "ot", 512], ["unroll_explicit", "ot", 1]]}], "r": [[0.0013114734838709677], 0, 1.6715974807739258, 1544140029.5922432], "v": 0.1}
{"i": ["cuda", "conv2d_no_batching", [1, 7, 7, 512, 512, 3, 3, [1, 1], [1, 1]], {}, ["conv2d_no_batching", 1, 7, 7, 512, 512, 3, 3, [1, 1], [1, 1]], {"i": 1824710, "t": "", "c": null, "e": [["tile_f", "sp", [8, 8, 8, 1]], ["tile_y", "sp", [1, 1, 7, 1]], ["tile_x", "sp", [1, 7, 1, 1]], ["tile_rc", "sp", [8, 16, 4]], ["tile_ry", "sp", [3, 1, 1]], ["tile_rx", "sp", [3, 1, 1]], ["auto_unroll_max_step", "ot", 512], ["unroll_explicit", "ot", 0]]}], "r": [[0.0009968842580645161], 0, 2.4351272583007812, 1544140031.2254827], "v": 0.1}
{"i": ["cuda", "conv2d_no_batching", [1, 7, 7, 512, 512, 3, 3, [1, 1], [1, 1]], {}, ["conv2d_no_batching", 1, 7, 7, 512, 512, 3, 3, [1, 1], [1, 1]], {"i": 3728343, "t": "", "c": null, "e": [["tile_f", "sp", [64, 8, 1, 1]], ["tile_y", "sp", [1, 1, 1, 7]], ["tile_x", "sp", [7, 1, 1, 1]], ["tile_rc", "sp", [16, 16, 2]], ["tile_ry", "sp", [1, 3, 1]], ["tile_rx", "sp", [3, 1, 1]], ["auto_unroll_max_step", "ot", 1500], ["unroll_explicit", "ot", 0]]}], "r": [[0.003526233467741935], 0, 6.056591033935547, 1544140131.5706797], "v": 0.1}
{"i": ["cuda", "conv2d_no_batching", [1, 7, 7, 512, 512, 3, 3, [1, 1], [1, 1]], {}, ["conv2d_no_batching", 1, 7, 7, 512, 512, 3, 3, [1, 1], [1, 1]], {"i": 4115543, "t": "", "c": null, "e": [["tile_f", "sp", [64, 8, 1, 1]], ["tile_y", "sp", [1, 1, 1, 7]], ["tile_x", "sp", [7, 1, 1, 1]], ["tile_rc", "sp", [16, 16, 2]], ["tile_ry", "sp", [3, 1, 1]], ["tile_rx", "sp", [1, 3, 1]], ["auto_unroll_max_step", "ot", 1500], ["unroll_explicit", "ot", 0]]}], "r": [[0.0011611487419354838], 0, 3.956798553466797, 1544140133.1679878], "v": 0.1}
{"i": ["cuda", "conv2d_no_batching", [1, 7, 7, 512, 512, 3, 3, [1, 1], [1, 1]], {}, ["conv2d_no_batching", 1, 7, 7, 512, 512, 3, 3, [1, 1], [1, 1]], {"i": 4116447, "t": "", "c": null, "e": [["tile_f", "sp", [64, 1, 8, 1]], ["tile_y", "sp", [1, 1, 1, 7]], ["tile_x", "sp", [1, 7, 1, 1]], ["tile_rc", "sp", [16, 16, 2]], ["tile_ry", "sp", [3, 1, 1]], ["tile_rx", "sp", [1, 3, 1]], ["auto_unroll_max_step", "ot", 1500], ["unroll_explicit", "ot", 0]]}], "r": [[0.0006476991262135923], 0, 2.3238368034362793, 1544140283.4613352], "v": 0.1}
{"i": ["cuda", "conv2d_no_batching", [1, 7, 7, 512, 512, 3, 3, [1, 1], [1, 1]], {}, ["conv2d_no_batching", 1, 7, 7, 512, 512, 3, 3, [1, 1], [1, 1]], {"i": 4115567, "t": "", "c": null, "e": [["tile_f", "sp", [64, 1, 8, 1]], ["tile_y", "sp", [1, 1, 1, 7]], ["tile_x", "sp", [7, 1, 1, 1]], ["tile_rc", "sp", [16, 16, 2]], ["tile_ry", "sp", [3, 1, 1]], ["tile_rx", "sp", [1, 3, 1]], ["auto_unroll_max_step", "ot", 1500], ["unroll_explicit", "ot", 0]]}], "r": [[0.00033897466019417474], 0, 1.6750388145446777, 1544140284.6612399], "v": 0.1}
{"i": ["cuda", "conv2d_no_batching", [1, 7, 7, 512, 512, 3, 3, [1, 1], [1, 1]], {}, ["conv2d_no_batching", 1, 7, 7, 512, 512, 3, 3, [1, 1], [1, 1]], {"i": 3729247, "t": "", "c": null, "e": [["tile_f", "sp", [64, 1, 8, 1]], ["tile_y", "sp", [1, 1, 1, 7]], ["tile_x", "sp", [1, 7, 1, 1]], ["tile_rc", "sp", [16, 16, 2]], ["tile_ry", "sp", [1, 3, 1]], ["tile_rx", "sp", [3, 1, 1]], ["auto_unroll_max_step", "ot", 1500], ["unroll_explicit", "ot", 0]]}], "r": [[0.0005130939417475728], 0, 2.3163628578186035, 1544140286.0580978], "v": 0.1}
{"i": ["cuda", "conv2d_no_batching", [1, 7, 7, 512, 512, 3, 3, [1, 1], [1, 1]], {}, ["conv2d_no_batching", 1, 7, 7, 512, 512, 3, 3, [1, 1], [1, 1]], {"i": 3728367, "t": "", "c": null, "e": [["tile_f", "sp", [64, 1, 8, 1]], ["tile_y", "sp", [1, 1, 1, 7]], ["tile_x", "sp", [7, 1, 1, 1]], ["tile_rc", "sp", [16, 16, 2]], ["tile_ry", "sp", [1, 3, 1]], ["tile_rx", "sp", [3, 1, 1]], ["auto_unroll_max_step", "ot", 1500], ["unroll_explicit", "ot", 0]]}], "r": [[0.0005412809514563107], 0, 2.4307758808135986, 1544140287.582289], "v": 0.1}
{"i": ["cuda", "conv2d_no_batching", [1, 7, 7, 512, 512, 3, 3, [1, 1], [1, 1]], {}, ["conv2d_no_batching", 1, 7, 7, 512, 512, 3, 3, [1, 1], [1, 1]], {"i": 3728360, "t": "", "c": null, "e": [["tile_f", "sp", [64, 2, 4, 1]], ["tile_y", "sp", [1, 1, 1, 7]], ["tile_x", "sp", [7, 1, 1, 1]], ["tile_rc", "sp", [16, 16, 2]], ["tile_ry", "sp", [1, 3, 1]], ["tile_rx", "sp", [3, 1, 1]], ["auto_unroll_max_step", "ot", 1500], ["unroll_explicit", "ot", 0]]}], "r": [[0.0006220275291262136], 0, 2.1001267433166504, 1544140289.088885], "v": 0.1}
{"i": ["cuda", "conv2d_no_batching", [1, 7, 7, 512, 512, 3, 3, [1, 1], [1, 1]], {}, ["conv2d_no_batching", 1, 7, 7, 512, 512, 3, 3, [1, 1], [1, 1]], {"i": 4115560, "t": "", "c": null, "e": [["tile_f", "sp", [64, 2, 4, 1]], ["tile_y", "sp", [1, 1, 1, 7]], ["tile_x", "sp", [7, 1, 1, 1]], ["tile_rc", "sp", [16, 16, 2]], ["tile_ry", "sp", [3, 1, 1]], ["tile_rx", "sp", [1, 3, 1]], ["auto_unroll_max_step", "ot", 1500], ["unroll_explicit", "ot", 0]]}], "r": [[0.0004768648179611651], 0, 1.7765841484069824, 1544140290.363273], "v": 0.1}
{"i": ["cuda", "conv2d_no_batching", [1, 7, 7, 512, 512, 3, 3, [1, 1], [1, 1]], {}, ["conv2d_no_batching", 1, 7, 7, 512, 512, 3, 3, [1, 1], [1, 1]], {"i": 4116423, "t": "", "c": null, "e": [["tile_f", "sp", [64, 8, 1, 1]], ["tile_y", "sp", [1, 1, 1, 7]], ["tile_x", "sp", [1, 7, 1, 1]], ["tile_rc", "sp", [16, 16, 2]], ["tile_ry", "sp", [3, 1, 1]], ["tile_rx", "sp", [1, 3, 1]], ["auto_unroll_max_step", "ot", 1500], ["unroll_explicit", "ot", 0]]}], "r": [[0.03199384258064516], 0, 15.687956809997559, 1544140153.3774252], "v": 0.1}
{"i": ["cuda", "conv2d_no_batching", [1, 7, 7, 512, 512, 3, 3, [1, 1], [1, 1]], {}, ["conv2d_no_batching", 1, 7, 7, 512, 512, 3, 3, [1, 1], [1, 1]], {"i": 3729223, "t": "", "c": null, "e": [["tile_f", "sp", [64, 8, 1, 1]], ["tile_y", "sp", [1, 1, 1, 7]], ["tile_x", "sp", [1, 7, 1, 1]], ["tile_rc", "sp", [16, 16, 2]], ["tile_ry", "sp", [1, 3, 1]], ["tile_rx", "sp", [3, 1, 1]], ["auto_unroll_max_step", "ot", 1500], ["unroll_explicit", "ot", 0]]}], "r": [[0.03223088663709677], 0, 16.01484513282776, 1544140167.0359874], "v": 0.1}
{"i": ["cuda", "conv2d_no_batching", [1, 7, 7, 512, 512, 3, 3, [1, 1], [1, 1]], {}, ["conv2d_no_batching", 1, 7, 7, 512, 512, 3, 3, [1, 1], [1, 1]], {"i": 3728352, "t": "", "c": null, "e": [["tile_f", "sp", [64, 4, 2, 1]], ["tile_y", "sp", [1, 1, 1, 7]], ["tile_x", "sp", [7, 1, 1, 1]], ["tile_rc", "sp", [16, 16, 2]], ["tile_ry", "sp", [1, 3, 1]], ["tile_rx", "sp", [3, 1, 1]], ["auto_unroll_max_step", "ot", 1500], ["unroll_explicit", "ot", 0]]}], "r": [[0.0009579818306451613], 0, 2.993157386779785, 1544140168.480934], "v": 0.1}
{"i": ["cuda", "conv2d_no_batching", [1, 7, 7, 512, 512, 3, 3, [1, 1], [1, 1]], {}, ["conv2d_no_batching", 1, 7, 7, 512, 512, 3, 3, [1, 1], [1, 1]], {"i": 4115552, "t": "", "c": null, "e": [["tile_f", "sp", [64, 4, 2, 1]], ["tile_y", "sp", [1, 1, 1, 7]], ["tile_x", "sp", [7, 1, 1, 1]], ["tile_rc", "sp", [16, 16, 2]], ["tile_ry", "sp", [3, 1, 1]], ["tile_rx", "sp", [1, 3, 1]], ["auto_unroll_max_step", "ot", 1500], ["unroll_explicit", "ot", 0]]}], "r": [[0.0006272788519417476], 0, 2.697636604309082, 1544140291.880573], "v": 0.1}
{"i": ["cuda", "conv2d_no_batching", [1, 7, 7, 512, 512, 3, 3, [1, 1], [1, 1]], {}, ["conv2d_no_batching", 1, 7, 7, 512, 512, 3, 3, [1, 1], [1, 1]], {"i": 3730103, "t": "", "c": null, "e": [["tile_f", "sp", [64, 8, 1, 1]], ["tile_y", "sp", [1, 1, 1, 7]], ["tile_x", "sp", [1, 1, 7, 1]], ["tile_rc", "sp", [16, 16, 2]], ["tile_ry", "sp", [1, 3, 1]], ["tile_rx", "sp", [3, 1, 1]], ["auto_unroll_max_step", "ot", 1500], ["unroll_explicit", "ot", 0]]}], "r": [[0.0020036175725806453], 0, 6.888821601867676, 1544140172.655315], "v": 0.1}
{"i": ["cuda", "conv2d_no_batching", [1, 7, 7, 512, 512, 3, 3, [1, 1], [1, 1]], {}, ["conv2d_no_batching", 1, 7, 7, 512, 512, 3, 3, [1, 1], [1, 1]], {"i": 1985943, "t": "", "c": null, "e": [["tile_f", "sp", [64, 8, 1, 1]], ["tile_y", "sp", [1, 1, 1, 7]], ["tile_x", "sp", [7, 1, 1, 1]], ["tile_rc", "sp", [16, 16, 2]], ["tile_ry", "sp", [1, 3, 1]], ["tile_rx", "sp", [3, 1, 1]], ["auto_unroll_max_step", "ot", 512], ["unroll_explicit", "ot", 0]]}], "r": [[0.00983076691935484], 0, 4.8583245277404785, 1544140177.1246881], "v": 0.1}
{"i": ["cuda", "conv2d_no_batching", [1, 7, 7, 512, 512, 3, 3, [1, 1], [1, 1]], {}, ["conv2d_no_batching", 1, 7, 7, 512, 512, 3, 3, [1, 1], [1, 1]], {"i": 2373143, "t": "", "c": null, "e": [["tile_f", "sp", [64, 8, 1, 1]], ["tile_y", "sp", [1, 1, 1, 7]], ["tile_x", "sp", [7, 1, 1, 1]], ["tile_rc", "sp", [16, 16, 2]], ["tile_ry", "sp", [3, 1, 1]], ["tile_rx", "sp", [1, 3, 1]], ["auto_unroll_max_step", "ot", 512], ["unroll_explicit", "ot", 0]]}], "r": [[0.004267456], 0, 3.2305006980895996, 1544140179.6253335], "v": 0.1}
{"i": ["cuda", "conv2d_no_batching", [1, 7, 7, 512, 512, 3, 3, [1, 1], [1, 1]], {}, ["conv2d_no_batching", 1, 7, 7, 512, 512, 3, 3, [1, 1], [1, 1]], {"i": 1986847, "t": "", "c": null, "e": [["tile_f", "sp", [64, 1, 8, 1]], ["tile_y", "sp", [1, 1, 1, 7]], ["tile_x", "sp", [1, 7, 1, 1]], ["tile_rc", "sp", [16, 16, 2]], ["tile_ry", "sp", [1, 3, 1]], ["tile_rx", "sp", [3, 1, 1]], ["auto_unroll_max_step", "ot", 512], ["unroll_explicit", "ot", 0]]}], "r": [[0.0005237534805825243], 0, 2.2582790851593018, 1544140293.2578986], "v": 0.1}
{"i": ["cuda", "conv2d_no_batching", [1, 7, 7, 512, 512, 3, 3, [1, 1], [1, 1]], {}, ["conv2d_no_batching", 1, 7, 7, 512, 512, 3, 3, [1, 1], [1, 1]], {"i": 2374047, "t": "", "c": null, "e": [["tile_f", "sp", [64, 1, 8, 1]], ["tile_y", "sp", [1, 1, 1, 7]], ["tile_x", "sp", [1, 7, 1, 1]], ["tile_rc", "sp", [16, 16, 2]], ["tile_ry", "sp", [3, 1, 1]], ["tile_rx", "sp", [1, 3, 1]], ["auto_unroll_max_step", "ot", 512], ["unroll_explicit", "ot", 0]]}], "r": [[0.0006758400606796117], 0, 2.3103320598602295, 1544140294.812054], "v": 0.1}
{"i": ["cuda", "conv2d_no_batching", [1, 7, 7, 512, 512, 3, 3, [1, 1], [1, 1]], {}, ["conv2d_no_batching", 1, 7, 7, 512, 512, 3, 3, [1, 1], [1, 1]], {"i": 2373167, "t": "", "c": null, "e": [["tile_f", "sp", [64, 1, 8, 1]], ["tile_y", "sp", [1, 1, 1, 7]], ["tile_x", "sp", [7, 1, 1, 1]], ["tile_rc", "sp", [16, 16, 2]], ["tile_ry", "sp", [3, 1, 1]], ["tile_rx", "sp", [1, 3, 1]], ["auto_unroll_max_step", "ot", 512], ["unroll_explicit", "ot", 0]]}], "r": [[0.000424405359223301], 0, 1.5170011520385742, 1544140296.000866], "v": 0.1}
{"i": ["cuda", "conv2d_no_batching", [1, 7, 7, 512, 512, 3, 3, [1, 1], [1, 1]], {}, ["conv2d_no_batching", 1, 7, 7, 512, 512, 3, 3, [1, 1], [1, 1]], {"i": 1985967, "t": "", "c": null, "e": [["tile_f", "sp", [64, 1, 8, 1]], ["tile_y", "sp", [1, 1, 1, 7]], ["tile_x", "sp", [7, 1, 1, 1]], ["tile_rc", "sp", [16, 16, 2]], ["tile_ry", "sp", [1, 3, 1]], ["tile_rx", "sp", [3, 1, 1]], ["auto_unroll_max_step", "ot", 512], ["unroll_explicit", "ot", 0]]}], "r": [[0.0005180726990291262], 0, 1.767683744430542, 1544140297.33651], "v": 0.1}
{"i": ["cuda", "conv2d_no_batching", [1, 7, 7, 512, 512, 3, 3, [1, 1], [1, 1]], {}, ["conv2d_no_batching", 1, 7, 7, 512, 512, 3, 3, [1, 1], [1, 1]], {"i": 4302103, "t": "", "c": null, "e": [["tile_f", "sp", [64, 8, 1, 1]], ["tile_y", "sp", [1, 1, 1, 7]], ["tile_x", "sp", [7, 1, 1, 1]], ["tile_rc", "sp", [64, 4, 2]], ["tile_ry", "sp", [1, 3, 1]], ["tile_rx", "sp", [1, 3, 1]], ["auto_unroll_max_step", "ot", 1500], ["unroll_explicit", "ot", 0]]}], "r": [[0.0020219612903225803], 0, 3.598994493484497, 1544140185.62698], "v": 0.1}
{"i": ["cuda", "conv2d_no_batching", [1, 7, 7, 512, 512, 3, 3, [1, 1], [1, 1]], {}, ["conv2d_no_batching", 1, 7, 7, 512, 512, 3, 3, [1, 1], [1, 1]], {"i": 4116448, "t": "", "c": null, "e": [["tile_f", "sp", [32, 2, 8, 1]], ["tile_y", "sp", [1, 1, 1, 7]], ["tile_x", "sp", [1, 7, 1, 1]], ["tile_rc", "sp", [16, 16, 2]], ["tile_ry", "sp", [3, 1, 1]], ["tile_rx", "sp", [1, 3, 1]], ["auto_unroll_max_step", "ot", 1500], ["unroll_explicit", "ot", 0]]}], "r": [[0.0008100982258064516], 0, 2.366523265838623, 1544140186.9331186], "v": 0.1}
{"i": ["cuda", "conv2d_no_batching", [1, 7, 7, 512, 512, 3, 3, [1, 1], [1, 1]], {}, ["conv2d_no_batching", 1, 7, 7, 512, 512, 3, 3, [1, 1], [1, 1]], {"i": 1985960, "t": "", "c": null, "e": [["tile_f", "sp", [64, 2, 4, 1]], ["tile_y", "sp", [1, 1, 1, 7]], ["tile_x", "sp", [7, 1, 1, 1]], ["tile_rc", "sp", [16, 16, 2]], ["tile_ry", "sp", [1, 3, 1]], ["tile_rx", "sp", [3, 1, 1]], ["auto_unroll_max_step", "ot", 512], ["unroll_explicit", "ot", 0]]}], "r": [[0.0006238512621359223], 0, 2.406608819961548, 1544140298.8569267], "v": 0.1}
{"i": ["cuda", "conv2d_no_batching", [1, 7, 7, 512, 512, 3, 3, [1, 1], [1, 1]], {}, ["conv2d_no_batching", 1, 7, 7, 512, 512, 3, 3, [1, 1], [1, 1]], {"i": 2373160, "t": "", "c": null, "e": [["tile_f", "sp", [64, 2, 4, 1]], ["tile_y", "sp", [1, 1, 1, 7]], ["tile_x", "sp", [7, 1, 1, 1]], ["tile_rc", "sp", [16, 16, 2]], ["tile_ry", "sp", [3, 1, 1]], ["tile_rx", "sp", [1, 3, 1]], ["auto_unroll_max_step", "ot", 512], ["unroll_explicit", "ot", 0]]}], "r": [[0.00047677463106796114], 0, 1.8307013511657715, 1544140300.1330755], "v": 0.1}
{"i": ["cuda", "conv2d_no_batching", [1, 7, 7, 512, 512, 3, 3, [1, 1], [1, 1]], {}, ["conv2d_no_batching", 1, 7, 7, 512, 512, 3, 3, [1, 1], [1, 1]], {"i": 9342743, "t": "", "c": null, "e": [["tile_f", "sp", [64, 8, 1, 1]], ["tile_y", "sp", [1, 1, 1, 7]], ["tile_x", "sp", [7, 1, 1, 1]], ["tile_rc", "sp", [16, 16, 2]], ["tile_ry", "sp", [3, 1, 1]], ["tile_rx", "sp", [1, 3, 1]], ["auto_unroll_max_step", "ot", 1500], ["unroll_explicit", "ot", 1]]}], "r": [[0.0013094808306451612], 0, 4.8996522426605225, 1544140190.5052626], "v": 0.1}
{"i": ["cuda", "conv2d_no_batching", [1, 7, 7, 512, 512, 3, 3, [1, 1], [1, 1]], {}, ["conv2d_no_batching", 1, 7, 7, 512, 512, 3, 3, [1, 1], [1, 1]], {"i": 8955543, "t": "", "c": null, "e": [["tile_f", "sp", [64, 8, 1, 1]], ["tile_y", "sp", [1, 1, 1, 7]], ["tile_x", "sp", [7, 1, 1, 1]], ["tile_rc", "sp", [16, 16, 2]], ["tile_ry", "sp", [1, 3, 1]], ["tile_rx", "sp", [3, 1, 1]], ["auto_unroll_max_step", "ot", 1500], ["unroll_explicit", "ot", 1]]}], "r": [[0.002067294443548387], 0, 5.662445068359375, 1544140192.7653174], "v": 0.1}
{"i": ["cuda", "conv2d_no_batching", [1, 7, 7, 512, 512, 3, 3, [1, 1], [1, 1]], {}, ["conv2d_no_batching", 1, 7, 7, 512, 512, 3, 3, [1, 1], [1, 1]], {"i": 8956447, "t": "", "c": null, "e": [["tile_f", "sp", [64, 1, 8, 1]], ["tile_y", "sp", [1, 1, 1, 7]], ["tile_x", "sp", [1, 7, 1, 1]], ["tile_rc", "sp", [16, 16, 2]], ["tile_ry", "sp", [1, 3, 1]], ["tile_rx", "sp", [3, 1, 1]], ["auto_unroll_max_step", "ot", 1500], ["unroll_explicit", "ot", 1]]}], "r": [[0.0005211662038834951], 0, 2.57625412940979, 1544140301.5199733], "v": 0.1}
{"i": ["cuda", "conv2d_no_batching", [1, 7, 7, 512, 512, 3, 3, [1, 1], [1, 1]], {}, ["conv2d_no_batching", 1, 7, 7, 512, 512, 3, 3, [1, 1], [1, 1]], {"i": 9343647, "t": "", "c": null, "e": [["tile_f", "sp", [64, 1, 8, 1]], ["tile_y", "sp", [1, 1, 1, 7]], ["tile_x", "sp", [1, 7, 1, 1]], ["tile_rc", "sp", [16, 16, 2]], ["tile_ry", "sp", [3, 1, 1]], ["tile_rx", "sp", [1, 3, 1]], ["auto_unroll_max_step", "ot", 1500], ["unroll_explicit", "ot", 1]]}], "r": [[0.0006493063543689321], 0, 2.7166683673858643, 1544140303.0544105], "v": 0.1}
{"i": ["cuda", "conv2d_no_batching", [1, 7, 7, 512, 512, 3, 3, [1, 1], [1, 1]], {}, ["conv2d_no_batching", 1, 7, 7, 512, 512, 3, 3, [1, 1], [1, 1]], {"i": 9342767, "t": "", "c": null, "e": [["tile_f", "sp", [64, 1, 8, 1]], ["tile_y", "sp", [1, 1, 1, 7]], ["tile_x", "sp", [7, 1, 1, 1]], ["tile_rc", "sp", [16, 16, 2]], ["tile_ry", "sp", [3, 1, 1]], ["tile_rx", "sp", [1, 3, 1]], ["auto_unroll_max_step", "ot", 1500], ["unroll_explicit", "ot", 1]]}], "r": [[0.0003812140946601942], 0, 2.3492813110351562, 1544140304.3064225], "v": 0.1}
{"i": ["cuda", "conv2d_no_batching", [1, 7, 7, 512, 512, 3, 3, [1, 1], [1, 1]], {}, ["conv2d_no_batching", 1, 7, 7, 512, 512, 3, 3, [1, 1], [1, 1]], {"i": 8955567, "t": "", "c": null, "e": [["tile_f", "sp", [64, 1, 8, 1]], ["tile_y", "sp", [1, 1, 1, 7]], ["tile_x", "sp", [7, 1, 1, 1]], ["tile_rc", "sp", [16, 16, 2]], ["tile_ry", "sp", [1, 3, 1]], ["tile_rx", "sp", [3, 1, 1]], ["auto_unroll_max_step", "ot", 1500], ["unroll_explicit", "ot", 1]]}], "r": [[0.0005253783810679612], 0, 2.91367506980896, 1544140305.8097649], "v": 0.1}
{"i": ["cuda", "conv2d_no_batching", [1, 7, 7, 512, 512, 3, 3, [1, 1], [1, 1]], {}, ["conv2d_no_batching", 1, 7, 7, 512, 512, 3, 3, [1, 1], [1, 1]], {"i": 8955560, "t": "", "c": null, "e": [["tile_f", "sp", [64, 2, 4, 1]], ["tile_y", "sp", [1, 1, 1, 7]], ["tile_x", "sp", [7, 1, 1, 1]], ["tile_rc", "sp", [16, 16, 2]], ["tile_ry", "sp", [1, 3, 1]], ["tile_rx", "sp", [3, 1, 1]], ["auto_unroll_max_step", "ot", 1500], ["unroll_explicit", "ot", 1]]}], "r": [[0.0006158748131067961], 0, 2.615633726119995, 1544140307.2805305], "v": 0.1}
{"i": ["cuda", "conv2d_no_batching", [1, 7, 7, 512, 512, 3, 3, [1, 1], [1, 1]], {}, ["conv2d_no_batching", 1, 7, 7, 512, 512, 3, 3, [1, 1], [1, 1]], {"i": 9342760, "t": "", "c": null, "e": [["tile_f", "sp", [64, 2, 4, 1]], ["tile_y", "sp", [1, 1, 1, 7]], ["tile_x", "sp", [7, 1, 1, 1]], ["tile_rc", "sp", [16, 16, 2]], ["tile_ry", "sp", [3, 1, 1]], ["tile_rx", "sp", [1, 3, 1]], ["auto_unroll_max_step", "ot", 1500], ["unroll_explicit", "ot", 1]]}], "r": [[0.000504712468446602], 0, 2.0119853019714355, 1544140308.6092026], "v": 0.1}
{"i": ["cuda", "conv2d_no_batching", [1, 7, 7, 512, 512, 3, 3, [1, 1], [1, 1]], {}, ["conv2d_no_batching", 1, 7, 7, 512, 512, 3, 3, [1, 1], [1, 1]], {"i": 2559703, "t": "", "c": null, "e": [["tile_f", "sp", [64, 8, 1, 1]], ["tile_y", "sp", [1, 1, 1, 7]], ["tile_x", "sp", [7, 1, 1, 1]], ["tile_rc", "sp", [64, 4, 2]], ["tile_ry", "sp", [1, 3, 1]], ["tile_rx", "sp", [1, 3, 1]], ["auto_unroll_max_step", "ot", 512], ["unroll_explicit", "ot", 0]]}], "r": [[0.007706872975806451], 0, 4.654966831207275, 1544140203.3523138], "v": 0.1}
{"i": ["cuda", "conv2d_no_batching", [1, 7, 7, 512, 512, 3, 3, [1, 1], [1, 1]], {}, ["conv2d_no_batching", 1, 7, 7, 512, 512, 3, 3, [1, 1], [1, 1]], {"i": 2374023, "t": "", "c": null, "e": [["tile_f", "sp", [64, 8, 1, 1]], ["tile_y", "sp", [1, 1, 1, 7]], ["tile_x", "sp", [1, 7, 1, 1]], ["tile_rc", "sp", [16, 16, 2]], ["tile_ry", "sp", [3, 1, 1]], ["tile_rx", "sp", [1, 3, 1]], ["auto_unroll_max_step", "ot", 512], ["unroll_explicit", "ot", 0]]}], "r": [[0.0381908075967742], 0, 16.175100803375244, 1544140218.696603], "v": 0.1}
{"i": ["cuda", "conv2d_no_batching", [1, 7, 7, 512, 512, 3, 3, [1, 1], [1, 1]], {}, ["conv2d_no_batching", 1, 7, 7, 512, 512, 3, 3, [1, 1], [1, 1]], {"i": 1986823, "t": "", "c": null, "e": [["tile_f", "sp", [64, 8, 1, 1]], ["tile_y", "sp", [1, 1, 1, 7]], ["tile_x", "sp", [1, 7, 1, 1]], ["tile_rc", "sp", [16, 16, 2]], ["tile_ry", "sp", [1, 3, 1]], ["tile_rx", "sp", [3, 1, 1]], ["auto_unroll_max_step", "ot", 512], ["unroll_explicit", "ot", 0]]}], "r": [[0.03807590807258064], 0, 16.179903984069824, 1544140233.982744], "v": 0.1}
{"i": ["cuda", "conv2d_no_batching", [1, 7, 7, 512, 512, 3, 3, [1, 1], [1, 1]], {}, ["conv2d_no_batching", 1, 7, 7, 512, 512, 3, 3, [1, 1], [1, 1]], {"i": 4302983, "t": "", "c": null, "e": [["tile_f", "sp", [64, 8, 1, 1]], ["tile_y", "sp", [1, 1, 1, 7]], ["tile_x", "sp", [1, 7, 1, 1]], ["tile_rc", "sp", [64, 4, 2]], ["tile_ry", "sp", [1, 3, 1]], ["tile_rx", "sp", [1, 3, 1]], ["auto_unroll_max_step", "ot", 1500], ["unroll_explicit", "ot", 0]]}], "r": [[0.01808739997580645], 0, 10.779786348342896, 1544140242.4302247], "v": 0.1}
{"i": ["cuda", "conv2d_no_batching", [1, 7, 7, 512, 512, 3, 3, [1, 1], [1, 1]], {}, ["conv2d_no_batching", 1, 7, 7, 512, 512, 3, 3, [1, 1], [1, 1]], {"i": 9343623, "t": "", "c": null, "e": [["tile_f", "sp", [64, 8, 1, 1]], ["tile_y", "sp", [1, 1, 1, 7]], ["tile_x", "sp", [1, 7, 1, 1]], ["tile_rc", "sp", [16, 16, 2]], ["tile_ry", "sp", [3, 1, 1]], ["tile_rx", "sp", [1, 3, 1]], ["auto_unroll_max_step", "ot", 1500], ["unroll_explicit", "ot", 1]]}], "r": [[0.029861114032258065], 0, 15.498661041259766, 1544140255.170735], "v": 0.1}
{"i": ["cuda", "conv2d_no_batching", [1, 7, 7, 512, 512, 3, 3, [1, 1], [1, 1]], {}, ["conv2d_no_batching", 1, 7, 7, 512, 512, 3, 3, [1, 1], [1, 1]], {"i": 8956423, "t": "", "c": null, "e": [["tile_f", "sp", [64, 8, 1, 1]], ["tile_y", "sp", [1, 1, 1, 7]], ["tile_x", "sp", [1, 7, 1, 1]], ["tile_rc", "sp", [16, 16, 2]], ["tile_ry", "sp", [1, 3, 1]], ["tile_rx", "sp", [3, 1, 1]], ["auto_unroll_max_step", "ot", 1500], ["unroll_explicit", "ot", 1]]}], "r": [[0.03038988581451613], 0, 15.901502847671509, 1544140268.1223822], "v": 0.1}
{"i": ["cuda", "conv2d_no_batching", [1, 7, 7, 512, 512, 3, 3, [1, 1], [1, 1]], {}, ["conv2d_no_batching", 1, 7, 7, 512, 512, 3, 3, [1, 1], [1, 1]], {"i": 4117320, "t": "", "c": null, "e": [["tile_f", "sp", [64, 2, 4, 1]], ["tile_y", "sp", [1, 1, 1, 7]], ["tile_x", "sp", [1, 1, 7, 1]], ["tile_rc", "sp", [16, 16, 2]], ["tile_ry", "sp", [3, 1, 1]], ["tile_rx", "sp", [1, 3, 1]], ["auto_unroll_max_step", "ot", 1500], ["unroll_explicit", "ot", 0]]}], "r": [[0.0021700388467741933], 0, 5.640984773635864, 1544140271.978214], "v": 0.1}
{"i": ["cuda", "conv2d_no_batching", [1, 7, 7, 512, 512, 3, 3, [1, 1], [1, 1]], {}, ["conv2d_no_batching", 1, 7, 7, 512, 512, 3, 3, [1, 1], [1, 1]], {"i": 3730120, "t": "", "c": null, "e": [["tile_f", "sp", [64, 2, 4, 1]], ["tile_y", "sp", [1, 1, 1, 7]], ["tile_x", "sp", [1, 1, 7, 1]], ["tile_rc", "sp", [16, 16, 2]], ["tile_ry", "sp", [1, 3, 1]], ["tile_rx", "sp", [3, 1, 1]], ["auto_unroll_max_step", "ot", 1500], ["unroll_explicit", "ot", 0]]}], "r": [[0.000291452713592233], 0, 1.9832086563110352, 1544140309.7367299], "v": 0.1}
{"i": ["cuda", "conv2d_no_batching", [1, 7, 7, 512, 512, 3, 3, [1, 1], [1, 1]], {}, ["conv2d_no_batching", 1, 7, 7, 512, 512, 3, 3, [1, 1], [1, 1]], {"i": 2373152, "t": "", "c": null, "e": [["tile_f", "sp", [64, 4, 2, 1]], ["tile_y", "sp", [1, 1, 1, 7]], ["tile_x", "sp", [7, 1, 1, 1]], ["tile_rc", "sp", [16, 16, 2]], ["tile_ry", "sp", [3, 1, 1]], ["tile_rx", "sp", [1, 3, 1]], ["auto_unroll_max_step", "ot", 512], ["unroll_explicit", "ot", 0]]}], "r": [[0.0006274226165048543], 0, 2.6879048347473145, 1544140311.2532647], "v": 0.1}
{"i": ["cuda", "conv2d_no_batching", [1, 7, 7, 512, 512, 3, 3, [1, 1], [1, 1]], {}, ["conv2d_no_batching", 1, 7, 7, 512, 512, 3, 3, [1, 1], [1, 1]], {"i": 1985952, "t": "", "c": null, "e": [["tile_f", "sp", [64, 4, 2, 1]], ["tile_y", "sp", [1, 1, 1, 7]], ["tile_x", "sp", [7, 1, 1, 1]], ["tile_rc", "sp", [16, 16, 2]], ["tile_ry", "sp", [1, 3, 1]], ["tile_rx", "sp", [3, 1, 1]], ["auto_unroll_max_step", "ot", 512], ["unroll_explicit", "ot", 0]]}], "r": [[0.0009639109193548387], 0, 2.5400264263153076, 1544140275.2267158], "v": 0.1}
{"i": ["cuda", "conv2d_no_batching", [1, 7, 7, 512, 512, 3, 3, [1, 1], [1, 1]], {}, ["conv2d_no_batching", 1, 7, 7, 512, 512, 3, 3, [1, 1], [1, 1]], {"i": 4303007, "t": "", "c": null, "e": [["tile_f", "sp", [64, 1, 8, 1]], ["tile_y", "sp", [1, 1, 1, 7]], ["tile_x", "sp", [1, 7, 1, 1]], ["tile_rc", "sp", [64, 4, 2]], ["tile_ry", "sp", [1, 3, 1]], ["tile_rx", "sp", [1, 3, 1]], ["auto_unroll_max_step", "ot", 1500], ["unroll_explicit", "ot", 0]]}], "r": [[0.0011817680241935483], 0, 1.8456389904022217, 1544140276.6468608], "v": 0.1}
{"i": ["cuda", "conv2d_no_batching", [1, 7, 7, 512, 512, 3, 3, [1, 1], [1, 1]], {}, ["conv2d_no_batching", 1, 7, 7, 512, 512, 3, 3, [1, 1], [1, 1]], {"i": 4302127, "t": "", "c": null, "e": [["tile_f", "sp", [64, 1, 8, 1]], ["tile_y", "sp", [1, 1, 1, 7]], ["tile_x", "sp", [7, 1, 1, 1]], ["tile_rc", "sp", [64, 4, 2]], ["tile_ry", "sp", [1, 3, 1]], ["tile_rx", "sp", [1, 3, 1]], ["auto_unroll_max_step", "ot", 1500], ["unroll_explicit", "ot", 0]]}], "r": [[0.00024464462621359224], 0, 1.6093688011169434, 1544140312.3002393], "v": 0.1}
{"i": ["cuda", "conv2d_no_batching", [1, 7, 7, 512, 512, 3, 3, [1, 1], [1, 1]], {}, ["conv2d_no_batching", 1, 7, 7, 512, 512, 3, 3, [1, 1], [1, 1]], {"i": 1987703, "t": "", "c": null, "e": [["tile_f", "sp", [64, 8, 1, 1]], ["tile_y", "sp", [1, 1, 1, 7]], ["tile_x", "sp", [1, 1, 7, 1]], ["tile_rc", "sp", [16, 16, 2]], ["tile_ry", "sp", [1, 3, 1]], ["tile_rx", "sp", [3, 1, 1]], ["auto_unroll_max_step", "ot", 512], ["unroll_explicit", "ot", 0]]}], "r": [[0.0020361174758064516], 0, 5.210969686508179, 1544140279.5018218], "v": 0.1}
{"i": ["cuda", "conv2d_no_batching", [1, 7, 7, 512, 512, 3, 3, [1, 1], [1, 1]], {}, ["conv2d_no_batching", 1, 7, 7, 512, 512, 3, 3, [1, 1], [1, 1]], {"i": 2374048, "t": "", "c": null, "e": [["tile_f", "sp", [32, 2, 8, 1]], ["tile_y", "sp", [1, 1, 1, 7]], ["tile_x", "sp", [1, 7, 1, 1]], ["tile_rc", "sp", [16, 16, 2]], ["tile_ry", "sp", [3, 1, 1]], ["tile_rx", "sp", [1, 3, 1]], ["auto_unroll_max_step", "ot", 512], ["unroll_explicit", "ot", 0]]}], "r": [[0.0008090977281553398], 0, 2.7302558422088623, 1544140314.0439582], "v": 0.1}
{"i": ["cuda", "conv2d_no_batching", [1, 7, 7, 512, 512, 3, 3, [1, 1], [1, 1]], {}, ["conv2d_no_batching", 1, 7, 7, 512, 512, 3, 3, [1, 1], [1, 1]], {"i": 9342752, "t": "", "c": null, "e": [["tile_f", "sp", [64, 4, 2, 1]], ["tile_y", "sp", [1, 1, 1, 7]], ["tile_x", "sp", [7, 1, 1, 1]], ["tile_rc", "sp", [16, 16, 2]], ["tile_ry", "sp", [3, 1, 1]], ["tile_rx", "sp", [1, 3, 1]], ["auto_unroll_max_step", "ot", 1500], ["unroll_explicit", "ot", 1]]}], "r": [[0.0006555561237864077], 0, 2.779393434524536, 1544140315.6015966], "v": 0.1}
{"i": ["cuda", "conv2d_no_batching", [1, 7, 7, 512, 512, 3, 3, [1, 1], [1, 1]], {}, ["conv2d_no_batching", 1, 7, 7, 512, 512, 3, 3, [1, 1], [1, 1]], {"i": 3729232, "t": "", "c": null, "e": [["tile_f", "sp", [64, 4, 2, 1]], ["tile_y", "sp", [1, 1, 1, 7]], ["tile_x", "sp", [1, 7, 1, 1]], ["tile_rc", "sp", [16, 16, 2]], ["tile_ry", "sp", [1, 3, 1]], ["tile_rx", "sp", [3, 1, 1]], ["auto_unroll_max_step", "ot", 1500], ["unroll_explicit", "ot", 0]]}], "r": [[0.0030270221626213594], 0, 9.032047748565674, 1544140426.0463345], "v": 0.1}
{"i": ["cuda", "conv2d_no_batching", [1, 7, 7, 512, 512, 3, 3, [1, 1], [1, 1]], {}, ["conv2d_no_batching", 1, 7, 7, 512, 512, 3, 3, [1, 1], [1, 1]], {"i": 4116432, "t": "", "c": null, "e": [["tile_f", "sp", [64, 4, 2, 1]], ["tile_y", "sp", [1, 1, 1, 7]], ["tile_x", "sp", [1, 7, 1, 1]], ["tile_rc", "sp", [16, 16, 2]], ["tile_ry", "sp", [3, 1, 1]], ["tile_rx", "sp", [1, 3, 1]], ["auto_unroll_max_step", "ot", 1500], ["unroll_explicit", "ot", 0]]}], "r": [[0.003515555939320388], 0, 9.778036832809448, 1544140432.0552144], "v": 0.1}
{"i": ["cuda", "conv2d_no_batching", [1, 7, 7, 512, 512, 3, 3, [1, 1], [1, 1]], {}, ["conv2d_no_batching", 1, 7, 7, 512, 512, 3, 3, [1, 1], [1, 1]], {"i": 3533493, "t": "", "c": null, "e": [["tile_f", "sp", [32, 2, 4, 2]], ["tile_y", "sp", [1, 7, 1, 1]], ["tile_x", "sp", [1, 1, 1, 7]], ["tile_rc", "sp", [32, 8, 2]], ["tile_ry", "sp", [3, 1, 1]], ["tile_rx", "sp", [3, 1, 1]], ["auto_unroll_max_step", "ot", 1500], ["unroll_explicit", "ot", 0]]}], "r": [[0.0015622360072815534], 0, 3.8745510578155518, 1544140434.9654813], "v": 0.1}
{"i": ["cuda", "conv2d_no_batching", [1, 7, 7, 512, 512, 3, 3, [1, 1], [1, 1]], {}, ["conv2d_no_batching", 1, 7, 7, 512, 512, 3, 3, [1, 1], [1, 1]], {"i": 2374032, "t": "", "c": null, "e": [["tile_f", "sp", [64, 4, 2, 1]], ["tile_y", "sp", [1, 1, 1, 7]], ["tile_x", "sp", [1, 7, 1, 1]], ["tile_rc", "sp", [16, 16, 2]], ["tile_ry", "sp", [3, 1, 1]], ["tile_rx", "sp", [1, 3, 1]], ["auto_unroll_max_step", "ot", 512], ["unroll_explicit", "ot", 0]]}], "r": [[0.00884422124514563], 0, 12.971770286560059, 1544140446.9861345], "v": 0.1}
{"i": ["cuda", "conv2d_no_batching", [1, 7, 7, 512, 512, 3, 3, [1, 1], [1, 1]], {}, ["conv2d_no_batching", 1, 7, 7, 512, 512, 3, 3, [1, 1], [1, 1]], {"i": 1986832, "t": "", "c": null, "e": [["tile_f", "sp", [64, 4, 2, 1]], ["tile_y", "sp", [1, 1, 1, 7]], ["tile_x", "sp", [1, 7, 1, 1]], ["tile_rc", "sp", [16, 16, 2]], ["tile_ry", "sp", [1, 3, 1]], ["tile_rx", "sp", [3, 1, 1]], ["auto_unroll_max_step", "ot", 512], ["unroll_explicit", "ot", 0]]}], "r": [[0.0054442404053398055], 0, 8.955086708068848, 1544140454.794008], "v": 0.1}
{"i": ["cuda", "conv2d_no_batching", [1, 7, 7, 512, 512, 3, 3, [1, 1], [1, 1]], {}, ["conv2d_no_batching", 1, 7, 7, 512, 512, 3, 3, [1, 1], [1, 1]], {"i": 4310032, "t": "", "c": null, "e": [["tile_f", "sp", [64, 4, 2, 1]], ["tile_y", "sp", [1, 1, 1, 7]], ["tile_x", "sp", [1, 7, 1, 1]], ["tile_rc", "sp", [16, 16, 2]], ["tile_ry", "sp", [1, 3, 1]], ["tile_rx", "sp", [1, 3, 1]], ["auto_unroll_max_step", "ot", 1500], ["unroll_explicit", "ot", 0]]}], "r": [[0.002553272233009709], 0, 10.369613647460938, 1544140459.6063898], "v": 0.1}
{"i": ["cuda", "conv2d_no_batching", [1, 7, 7, 512, 512, 3, 3, [1, 1], [1, 1]], {}, ["conv2d_no_batching", 1, 7, 7, 512, 512, 3, 3, [1, 1], [1, 1]], {"i": 4299472, "t": "", "c": null, "e": [["tile_f", "sp", [64, 4, 2, 1]], ["tile_y", "sp", [1, 1, 1, 7]], ["tile_x", "sp", [1, 7, 1, 1]], ["tile_rc", "sp", [128, 2, 2]], ["tile_ry", "sp", [1, 3, 1]], ["tile_rx", "sp", [1, 3, 1]], ["auto_unroll_max_step", "ot", 1500], ["unroll_explicit", "ot", 0]]}], "r": [[0.0026332440242718444], 0, 5.099551677703857, 1544140463.9584856], "v": 0.1}
{"i": ["cuda", "conv2d_no_batching", [1, 7, 7, 512, 512, 3, 3, [1, 1], [1, 1]], {}, ["conv2d_no_batching", 1, 7, 7, 512, 512, 3, 3, [1, 1], [1, 1]], {"i": 3729240, "t": "", "c": null, "e": [["tile_f", "sp", [64, 2, 4, 1]], ["tile_y", "sp", [1, 1, 1, 7]], ["tile_x", "sp", [1, 7, 1, 1]], ["tile_rc", "sp", [16, 16, 2]], ["tile_ry", "sp", [1, 3, 1]], ["tile_rx", "sp", [3, 1, 1]], ["auto_unroll_max_step", "ot", 1500], ["unroll_explicit", "ot", 0]]}], "r": [[0.0011579152839805826], 0, 4.209936857223511, 1544140466.54794], "v": 0.1}
{"i": ["cuda", "conv2d_no_batching", [1, 7, 7, 512, 512, 3, 3, [1, 1], [1, 1]], {}, ["conv2d_no_batching", 1, 7, 7, 512, 512, 3, 3, [1, 1], [1, 1]], {"i": 4116440, "t": "", "c": null, "e": [["tile_f", "sp", [64, 2, 4, 1]], ["tile_y", "sp", [1, 1, 1, 7]], ["tile_x", "sp", [1, 7, 1, 1]], ["tile_rc", "sp", [16, 16, 2]], ["tile_ry", "sp", [3, 1, 1]], ["tile_rx", "sp", [1, 3, 1]], ["auto_unroll_max_step", "ot", 1500], ["unroll_explicit", "ot", 0]]}], "r": [[0.000901919322815534], 0, 3.8564674854278564, 1544140468.7293994], "v": 0.1}
{"i": ["cuda", "conv2d_no_batching", [1, 7, 7, 512, 512, 3, 3, [1, 1], [1, 1]], {}, ["conv2d_no_batching", 1, 7, 7, 512, 512, 3, 3, [1, 1], [1, 1]], {"i": 8956440, "t": "", "c": null, "e": [["tile_f", "sp", [64, 2, 4, 1]], ["tile_y", "sp", [1, 1, 1, 7]], ["tile_x", "sp", [1, 7, 1, 1]], ["tile_rc", "sp", [16, 16, 2]], ["tile_ry", "sp", [1, 3, 1]], ["tile_rx", "sp", [3, 1, 1]], ["auto_unroll_max_step", "ot", 1500], ["unroll_explicit", "ot", 1]]}], "r": [[0.0011209162572815533], 0, 4.647549629211426, 1544140471.1742766], "v": 0.1}
{"i": ["cuda", "conv2d_no_batching", [1, 7, 7, 512, 512, 3, 3, [1, 1], [1, 1]], {}, ["conv2d_no_batching", 1, 7, 7, 512, 512, 3, 3, [1, 1], [1, 1]], {"i": 9343640, "t": "", "c": null, "e": [["tile_f", "sp", [64, 2, 4, 1]], ["tile_y", "sp", [1, 1, 1, 7]], ["tile_x", "sp", [1, 7, 1, 1]], ["tile_rc", "sp", [16, 16, 2]], ["tile_ry", "sp", [3, 1, 1]], ["tile_rx", "sp", [1, 3, 1]], ["auto_unroll_max_step", "ot", 1500], ["unroll_explicit", "ot", 1]]}], "r": [[0.0008424861067961165], 0, 4.050905704498291, 1544140473.255151], "v": 0.1}
{"i": ["cuda", "conv2d_no_batching", [1, 7, 7, 512, 512, 3, 3, [1, 1], [1, 1]], {}, ["conv2d_no_batching", 1, 7, 7, 512, 512, 3, 3, [1, 1], [1, 1]], {"i": 4298607, "t": "", "c": null, "e": [["tile_f", "sp", [64, 1, 8, 1]], ["tile_y", "sp", [1, 1, 1, 7]], ["tile_x", "sp", [7, 1, 1, 1]], ["tile_rc", "sp", [128, 2, 2]], ["tile_ry", "sp", [1, 3, 1]], ["tile_rx", "sp", [1, 3, 1]], ["auto_unroll_max_step", "ot", 1500], ["unroll_explicit", "ot", 0]]}], "r": [[0.0009541693786407768], 0, 2.4525744915008545, 1544140475.2832818], "v": 0.1}
{"i": ["cuda", "conv2d_no_batching", [1, 7, 7, 512, 512, 3, 3, [1, 1], [1, 1]], {}, ["conv2d_no_batching", 1, 7, 7, 512, 512, 3, 3, [1, 1], [1, 1]], {"i": 4310040, "t": "", "c": null, "e": [["tile_f", "sp", [64, 2, 4, 1]], ["tile_y", "sp", [1, 1, 1, 7]], ["tile_x", "sp", [1, 7, 1, 1]], ["tile_rc", "sp", [16, 16, 2]], ["tile_ry", "sp", [1, 3, 1]], ["tile_rx", "sp", [1, 3, 1]], ["auto_unroll_max_step", "ot", 1500], ["unroll_explicit", "ot", 0]]}], "r": [[0.0011682547427184467], 0, 5.198690891265869, 1544140477.867744], "v": 0.1}
{"i": ["cuda", "conv2d_no_batching", [1, 7, 7, 512, 512, 3, 3, [1, 1], [1, 1]], {}, ["conv2d_no_batching", 1, 7, 7, 512, 512, 3, 3, [1, 1], [1, 1]], {"i": 2567632, "t": "", "c": null, "e": [["tile_f", "sp", [64, 4, 2, 1]], ["tile_y", "sp", [1, 1, 1, 7]], ["tile_x", "sp", [1, 7, 1, 1]], ["tile_rc", "sp", [16, 16, 2]], ["tile_ry", "sp", [1, 3, 1]], ["tile_rx", "sp", [1, 3, 1]], ["auto_unroll_max_step", "ot", 512], ["unroll_explicit", "ot", 0]]}], "r": [[0.007875100199029126], 0, 11.52516770362854, 1544140488.849444], "v": 0.1}
{"i": ["cuda", "conv2d_no_batching", [1, 7, 7, 512, 512, 3, 3, [1, 1], [1, 1]], {}, ["conv2d_no_batching", 1, 7, 7, 512, 512, 3, 3, [1, 1], [1, 1]], {"i": 2566767, "t": "", "c": null, "e": [["tile_f", "sp", [64, 1, 8, 1]], ["tile_y", "sp", [1, 1, 1, 7]], ["tile_x", "sp", [7, 1, 1, 1]], ["tile_rc", "sp", [16, 16, 2]], ["tile_ry", "sp", [1, 3, 1]], ["tile_rx", "sp", [1, 3, 1]], ["auto_unroll_max_step", "ot", 512], ["unroll_explicit", "ot", 0]]}], "r": [[0.0005944647791262136], 0, 2.2980597019195557, 1544140490.40324], "v": 0.1}
{"i": ["cuda", "conv2d_no_batching", [1, 7, 7, 512, 512, 3, 3, [1, 1], [1, 1]], {}, ["conv2d_no_batching", 1, 7, 7, 512, 512, 3, 3, [1, 1], [1, 1]], {"i": 8956432, "t": "", "c": null, "e": [["tile_f", "sp", [64, 4, 2, 1]], ["tile_y", "sp", [1, 1, 1, 7]], ["tile_x", "sp", [1, 7, 1, 1]], ["tile_rc", "sp", [16, 16, 2]], ["tile_ry", "sp", [1, 3, 1]], ["tile_rx", "sp", [3, 1, 1]], ["auto_unroll_max_step", "ot", 1500], ["unroll_explicit", "ot", 1]]}], "r": [[0.002874121487864078], 0, 9.739787340164185, 1544140495.4270382], "v": 0.1}
{"i": ["cuda", "conv2d_no_batching", [1, 7, 7, 512, 512, 3, 3, [1, 1], [1, 1]], {}, ["conv2d_no_batching", 1, 7, 7, 512, 512, 3, 3, [1, 1], [1, 1]], {"i": 9343632, "t": "", "c": null, "e": [["tile_f", "sp", [64, 4, 2, 1]], ["tile_y", "sp", [1, 1, 1, 7]], ["tile_x", "sp", [1, 7, 1, 1]], ["tile_rc", "sp", [16, 16, 2]], ["tile_ry", "sp", [3, 1, 1]], ["tile_rx", "sp", [1, 3, 1]], ["auto_unroll_max_step", "ot", 1500], ["unroll_explicit", "ot", 1]]}], "r": [[0.0030837106480582524], 0, 10.258133888244629, 1544140500.7347264], "v": 0.1}
{"i": ["cuda", "conv2d_no_batching", [1, 7, 7, 512, 512, 3, 3, [1, 1], [1, 1]], {}, ["conv2d_no_batching", 1, 7, 7, 512, 512, 3, 3, [1, 1], [1, 1]], {"i": 2557072, "t": "", "c": null, "e": [["tile_f", "sp", [64, 4, 2, 1]], ["tile_y", "sp", [1, 1, 1, 7]], ["tile_x", "sp", [1, 7, 1, 1]], ["tile_rc", "sp", [128, 2, 2]], ["tile_ry", "sp", [1, 3, 1]], ["tile_rx", "sp", [1, 3, 1]], ["auto_unroll_max_step", "ot", 512], ["unroll_explicit", "ot", 0]]}], "r": [[0.004873745766990291], 0, 8.141633033752441, 1544140508.03507], "v": 0.1}
{"i": ["cuda", "conv2d_no_batching", [1, 7, 7, 512, 512, 3, 3, [1, 1], [1, 1]], {}, ["conv2d_no_batching", 1, 7, 7, 512, 512, 3, 3, [1, 1], [1, 1]], {"i": 2556207, "t": "", "c": null, "e": [["tile_f", "sp", [64, 1, 8, 1]], ["tile_y", "sp", [1, 1, 1, 7]], ["tile_x", "sp", [7, 1, 1, 1]], ["tile_rc", "sp", [128, 2, 2]], ["tile_ry", "sp", [1, 3, 1]], ["tile_rx", "sp", [1, 3, 1]], ["auto_unroll_max_step", "ot", 512], ["unroll_explicit", "ot", 0]]}], "r": [[0.0009967279830097088], 0, 2.5319881439208984, 1544140510.1078491], "v": 0.1}
{"i": ["cuda", "conv2d_no_batching", [1, 7, 7, 512, 512, 3, 3, [1, 1], [1, 1]], {}, ["conv2d_no_batching", 1, 7, 7, 512, 512, 3, 3, [1, 1], [1, 1]], {"i": 4309167, "t": "", "c": null, "e": [["tile_f", "sp", [64, 1, 8, 1]], ["tile_y", "sp", [1, 1, 1, 7]], ["tile_x", "sp", [7, 1, 1, 1]], ["tile_rc", "sp", [16, 16, 2]], ["tile_ry", "sp", [1, 3, 1]], ["tile_rx", "sp", [1, 3, 1]], ["auto_unroll_max_step", "ot", 1500], ["unroll_explicit", "ot", 0]]}], "r": [[0.0005950670509708738], 0, 2.258439779281616, 1544140511.5758817], "v": 0.1}
{"i": ["cuda", "conv2d_no_batching", [1, 7, 7, 512, 512, 3, 3, [1, 1], [1, 1]], {}, ["conv2d_no_batching", 1, 7, 7, 512, 512, 3, 3, [1, 1], [1, 1]], {"i": 3535632, "t": "", "c": null, "e": [["tile_f", "sp", [64, 4, 2, 1]], ["tile_y", "sp", [1, 1, 1, 7]], ["tile_x", "sp", [1, 7, 1, 1]], ["tile_rc", "sp", [16, 16, 2]], ["tile_ry", "sp", [3, 1, 1]], ["tile_rx", "sp", [3, 1, 1]], ["auto_unroll_max_step", "ot", 1500], ["unroll_explicit", "ot", 0]]}], "r": [[0.0038983211189320384], 0, 10.15925121307373, 1544140517.8794487], "v": 0.1}
{"i": ["cuda", "conv2d_no_batching", [1, 7, 7, 512, 512, 3, 3, [1, 1], [1, 1]], {}, ["conv2d_no_batching", 1, 7, 7, 512, 512, 3, 3, [1, 1], [1, 1]], {"i": 814672, "t": "", "c": null, "e": [["tile_f", "sp", [64, 4, 2, 1]], ["tile_y", "sp", [1, 1, 1, 7]], ["tile_x", "sp", [1, 7, 1, 1]], ["tile_rc", "sp", [128, 2, 2]], ["tile_ry", "sp", [1, 3, 1]], ["tile_rx", "sp", [1, 3, 1]], ["auto_unroll_max_step", "ot", 0], ["unroll_explicit", "ot", 0]]}], "r": [[0.005698272733009708], 0, 9.033848762512207, 1544140526.3020291], "v": 0.1}
{"i": ["cuda", "conv2d_no_batching", [1, 7, 7, 512, 512, 3, 3, [1, 1], [1, 1]], {}, ["conv2d_no_batching", 1, 7, 7, 512, 512, 3, 3, [1, 1], [1, 1]], {"i": 813807, "t": "", "c": null, "e": [["tile_f", "sp", [64, 1, 8, 1]], ["tile_y", "sp", [1, 1, 1, 7]], ["tile_x", "sp", [7, 1, 1, 1]], ["tile_rc", "sp", [128, 2, 2]], ["tile_ry", "sp", [1, 3, 1]], ["tile_rx", "sp", [1, 3, 1]], ["auto_unroll_max_step", "ot", 0], ["unroll_explicit", "ot", 0]]}], "r": [[0.0007010788737864078], 0, 1.945669174194336, 1544140527.883], "v": 0.1}
{"i": ["cuda", "conv2d_no_batching", [1, 7, 7, 512, 512, 3, 3, [1, 1], [1, 1]], {}, ["conv2d_no_batching", 1, 7, 7, 512, 512, 3, 3, [1, 1], [1, 1]], {"i": 4306512, "t": "", "c": null, "e": [["tile_f", "sp", [64, 4, 2, 1]], ["tile_y", "sp", [1, 1, 1, 7]], ["tile_x", "sp", [1, 7, 1, 1]], ["tile_rc", "sp", [32, 8, 2]], ["tile_ry", "sp", [1, 3, 1]], ["tile_rx", "sp", [1, 3, 1]], ["auto_unroll_max_step", "ot", 1500], ["unroll_explicit", "ot", 0]]}], "r": [[0.002576320325242718], 0, 7.0799078941345215, 1544140532.3267026], "v": 0.1}
{"i": ["cuda", "conv2d_no_batching", [1, 7, 7, 512, 512, 3, 3, [1, 1], [1, 1]], {}, ["conv2d_no_batching", 1, 7, 7, 512, 512, 3, 3, [1, 1], [1, 1]], {"i": 9537240, "t": "", "c": null, "e": [["tile_f", "sp", [64, 2, 4, 1]], ["tile_y", "sp", [1, 1, 1, 7]], ["tile_x", "sp", [1, 7, 1, 1]], ["tile_rc", "sp", [16, 16, 2]], ["tile_ry", "sp", [1, 3, 1]], ["tile_rx", "sp", [1, 3, 1]], ["auto_unroll_max_step", "ot", 1500], ["unroll_explicit", "ot", 1]]}], "r": [[0.0011593273398058253], 0, 5.591084241867065, 1544140535.045373], "v": 0.1}
{"i": ["cuda", "conv2d_no_batching", [1, 7, 7, 512, 512, 3, 3, [1, 1], [1, 1]], {}, ["conv2d_no_batching", 1, 7, 7, 512, 512, 3, 3, [1, 1], [1, 1]], {"i": 631632, "t": "", "c": null, "e": [["tile_f", "sp", [64, 4, 2, 1]], ["tile_y", "sp", [1, 1, 1, 7]], ["tile_x", "sp", [1, 7, 1, 1]], ["tile_rc", "sp", [16, 16, 2]], ["tile_ry", "sp", [3, 1, 1]], ["tile_rx", "sp", [1, 3, 1]], ["auto_unroll_max_step", "ot", 0], ["unroll_explicit", "ot", 0]]}], "r": [[0.009688834121359223], 0, 13.561117172241211, 1544140547.9518044], "v": 0.1}
{"i": ["cuda", "conv2d_no_batching", [1, 7, 7, 512, 512, 3, 3, [1, 1], [1, 1]], {}, ["conv2d_no_batching", 1, 7, 7, 512, 512, 3, 3, [1, 1], [1, 1]], {"i": 244432, "t": "", "c": null, "e": [["tile_f", "sp", [64, 4, 2, 1]], ["tile_y", "sp", [1, 1, 1, 7]], ["tile_x", "sp", [1, 7, 1, 1]], ["tile_rc", "sp", [16, 16, 2]], ["tile_ry", "sp", [1, 3, 1]], ["tile_rx", "sp", [3, 1, 1]], ["auto_unroll_max_step", "ot", 0], ["unroll_explicit", "ot", 0]]}], "r": [[0.006387453985436893], 0, 9.340858697891235, 1544140556.8387325], "v": 0.1}
{"i": ["cuda", "conv2d_no_batching", [1, 7, 7, 512, 512, 3, 3, [1, 1], [1, 1]], {}, ["conv2d_no_batching", 1, 7, 7, 512, 512, 3, 3, [1, 1], [1, 1]], {"i": 3727093, "t": "", "c": null, "e": [["tile_f", "sp", [32, 2, 4, 2]], ["tile_y", "sp", [1, 7, 1, 1]], ["tile_x", "sp", [1, 1, 1, 7]], ["tile_rc", "sp", [32, 8, 2]], ["tile_ry", "sp", [1, 3, 1]], ["tile_rx", "sp", [3, 1, 1]], ["auto_unroll_max_step", "ot", 1500], ["unroll_explicit", "ot", 0]]}], "r": [[0.003019194800970874], 0, 6.1219775676727295, 1544140561.7897081], "v": 0.1}
{"i": ["cuda", "conv2d_no_batching", [1, 7, 7, 512, 512, 3, 3, [1, 1], [1, 1]], {}, ["conv2d_no_batching", 1, 7, 7, 512, 512, 3, 3, [1, 1], [1, 1]], {"i": 9526672, "t": "", "c": null, "e": [["tile_f", "sp", [64, 4, 2, 1]], ["tile_y", "sp", [1, 1, 1, 7]], ["tile_x", "sp", [1, 7, 1, 1]], ["tile_rc", "sp", [128, 2, 2]], ["tile_ry", "sp", [1, 3, 1]], ["tile_rx", "sp", [1, 3, 1]], ["auto_unroll_max_step", "ot", 1500], ["unroll_explicit", "ot", 1]]}], "r": [[0.0026560894757281556], 0, 6.579348087310791, 1544140566.0716293], "v": 0.1}
{"i": ["cuda", "conv2d_no_batching", [1, 7, 7, 512, 512, 3, 3, [1, 1], [1, 1]], {}, ["conv2d_no_batching", 1, 7, 7, 512, 512, 3, 3, [1, 1], [1, 1]], {"i": 2564112, "t": "", "c": null, "e": [["tile_f", "sp", [64, 4, 2, 1]], ["tile_y", "sp", [1, 1, 1, 7]], ["tile_x", "sp", [1, 7, 1, 1]], ["tile_rc", "sp", [32, 8, 2]], ["tile_ry", "sp", [1, 3, 1]], ["tile_rx", "sp", [1, 3, 1]], ["auto_unroll_max_step", "ot", 512], ["unroll_explicit", "ot", 0]]}], "r": [[0.007920393949029126], 0, 11.631133794784546, 1544140577.1291714], "v": 0.1}
{"i": ["cuda", "conv2d_no_batching", [1, 7, 7, 512, 512, 3, 3, [1, 1], [1, 1]], {}, ["conv2d_no_batching", 1, 7, 7, 512, 512, 3, 3, [1, 1], [1, 1]], {"i": 3535640, "t": "", "c": null, "e": [["tile_f", "sp", [64, 2, 4, 1]], ["tile_y", "sp", [1, 1, 1, 7]], ["tile_x", "sp", [1, 7, 1, 1]], ["tile_rc", "sp", [16, 16, 2]], ["tile_ry", "sp", [3, 1, 1]], ["tile_rx", "sp", [3, 1, 1]], ["auto_unroll_max_step", "ot", 1500], ["unroll_explicit", "ot", 0]]}], "r": [[0.003653210953883495], 0, 7.67101263999939, 1544140582.960334], "v": 0.1}
{"i": ["cuda", "conv2d_no_batching", [1, 7, 7, 512, 512, 3, 3, [1, 1], [1, 1]], {}, ["conv2d_no_batching", 1, 7, 7, 512, 512, 3, 3, [1, 1], [1, 1]], {"i": 1986840, "t": "", "c": null, "e": [["tile_f", "sp", [64, 2, 4, 1]], ["tile_y", "sp", [1, 1, 1, 7]], ["tile_x", "sp", [1, 7, 1, 1]], ["tile_rc", "sp", [16, 16, 2]], ["tile_ry", "sp", [1, 3, 1]], ["tile_rx", "sp", [3, 1, 1]], ["auto_unroll_max_step", "ot", 512], ["unroll_explicit", "ot", 0]]}], "r": [[0.0010002161553398059], 0, 3.5988166332244873, 1544140585.2398198], "v": 0.1}
{"i": ["cuda", "conv2d_no_batching", [1, 7, 7, 512, 512, 3, 3, [1, 1], [1, 1]], {}, ["conv2d_no_batching", 1, 7, 7, 512, 512, 3, 3, [1, 1], [1, 1]], {"i": 2374040, "t": "", "c": null, "e": [["tile_f", "sp", [64, 2, 4, 1]], ["tile_y", "sp", [1, 1, 1, 7]], ["tile_x", "sp", [1, 7, 1, 1]], ["tile_rc", "sp", [16, 16, 2]], ["tile_ry", "sp", [3, 1, 1]], ["tile_rx", "sp", [1, 3, 1]], ["auto_unroll_max_step", "ot", 512], ["unroll_explicit", "ot", 0]]}], "r": [[0.0009087363228155339], 0, 3.7721569538116455, 1544140587.4630303], "v": 0.1}
{"i": ["cuda", "conv2d_no_batching", [1, 7, 7, 512, 512, 3, 3, [1, 1], [1, 1]], {}, ["conv2d_no_batching", 1, 7, 7, 512, 512, 3, 3, [1, 1], [1, 1]], {"i": 3526453, "t": "", "c": null, "e": [["tile_f", "sp", [32, 2, 4, 2]], ["tile_y", "sp", [1, 7, 1, 1]], ["tile_x", "sp", [1, 1, 1, 7]], ["tile_rc", "sp", [128, 2, 2]], ["tile_ry", "sp", [3, 1, 1]], ["tile_rx", "sp", [3, 1, 1]], ["auto_unroll_max_step", "ot", 1500], ["unroll_explicit", "ot", 0]]}], "r": [[0.0035299575631067962], 0, 6.041196584701538, 1544140592.8232844], "v": 0.1}
{"i": ["cuda", "conv2d_no_batching", [1, 7, 7, 512, 512, 3, 3, [1, 1], [1, 1]], {}, ["conv2d_no_batching", 1, 7, 7, 512, 512, 3, 3, [1, 1], [1, 1]], {"i": 9537232, "t": "", "c": null, "e": [["tile_f", "sp", [64, 4, 2, 1]], ["tile_y", "sp", [1, 1, 1, 7]], ["tile_x", "sp", [1, 7, 1, 1]], ["tile_rc", "sp", [16, 16, 2]], ["tile_ry", "sp", [1, 3, 1]], ["tile_rx", "sp", [1, 3, 1]], ["auto_unroll_max_step", "ot", 1500], ["unroll_explicit", "ot", 1]]}], "r": [[0.0025971791019417474], 0, 12.004923105239868, 1544140597.7164252], "v": 0.1}
{"i": ["cuda", "conv2d_no_batching", [1, 7, 7, 512, 512, 3, 3, [1, 1], [1, 1]], {}, ["conv2d_no_batching", 1, 7, 7, 512, 512, 3, 3, [1, 1], [1, 1]], {"i": 821712, "t": "", "c": null, "e": [["tile_f", "sp", [64, 4, 2, 1]], ["tile_y", "sp", [1, 1, 1, 7]], ["tile_x", "sp", [1, 7, 1, 1]], ["tile_rc", "sp", [32, 8, 2]], ["tile_ry", "sp", [1, 3, 1]], ["tile_rx", "sp", [1, 3, 1]], ["auto_unroll_max_step", "ot", 0], ["unroll_explicit", "ot", 0]]}], "r": [[0.007925765055825243], 0, 11.758984088897705, 1544140608.82138], "v": 0.1}
{"i": ["cuda", "conv2d_no_batching", [1, 7, 7, 512, 512, 3, 3, [1, 1], [1, 1]], {}, ["conv2d_no_batching", 1, 7, 7, 512, 512, 3, 3, [1, 1], [1, 1]], {"i": 4107253, "t": "", "c": null, "e": [["tile_f", "sp", [32, 2, 4, 2]], ["tile_y", "sp", [1, 7, 1, 1]], ["tile_x", "sp", [1, 1, 1, 7]], ["tile_rc", "sp", [128, 2, 2]], ["tile_ry", "sp", [3, 1, 1]], ["tile_rx", "sp", [1, 3, 1]], ["auto_unroll_max_step", "ot", 1500], ["unroll_explicit", "ot", 0]]}], "r": [[0.0026116381383495145], 0, 5.128104209899902, 1544140613.2491167], "v": 0.1}
{"i": ["cuda", "conv2d_no_batching", [1, 7, 7, 512, 512, 3, 3, [1, 1], [1, 1]], {}, ["conv2d_no_batching", 1, 7, 7, 512, 512, 3, 3, [1, 1], [1, 1]], {"i": 7214040, "t": "", "c": null, "e": [["tile_f", "sp", [64, 2, 4, 1]], ["tile_y", "sp", [1, 1, 1, 7]], ["tile_x", "sp", [1, 7, 1, 1]], ["tile_rc", "sp", [16, 16, 2]], ["tile_ry", "sp", [1, 3, 1]], ["tile_rx", "sp", [3, 1, 1]], ["auto_unroll_max_step", "ot", 512], ["unroll_explicit", "ot", 1]]}], "r": [[0.0011409555849514563], 0, 3.949021339416504, 1544140615.6362844], "v": 0.1}
{"i": ["cuda", "conv2d_no_batching", [1, 7, 7, 512, 512, 3, 3, [1, 1], [1, 1]], {}, ["conv2d_no_batching", 1, 7, 7, 512, 512, 3, 3, [1, 1], [1, 1]], {"i": 7601240, "t": "", "c": null, "e": [["tile_f", "sp", [64, 2, 4, 1]], ["tile_y", "sp", [1, 1, 1, 7]], ["tile_x", "sp", [1, 7, 1, 1]], ["tile_rc", "sp", [16, 16, 2]], ["tile_ry", "sp", [3, 1, 1]], ["tile_rx", "sp", [1, 3, 1]], ["auto_unroll_max_step", "ot", 512], ["unroll_explicit", "ot", 1]]}], "r": [[0.0008305056747572816], 0, 3.473245859146118, 1544140617.69357], "v": 0.1}
{"i": ["cuda", "conv2d_no_batching", [1, 7, 7, 512, 512, 3, 3, [1, 1], [1, 1]], {}, ["conv2d_no_batching", 1, 7, 7, 512, 512, 3, 3, [1, 1], [1, 1]], {"i": 3533494, "t": "", "c": null, "e": [["tile_f", "sp", [16, 4, 4, 2]], ["tile_y", "sp", [1, 7, 1, 1]], ["tile_x", "sp", [1, 1, 1, 7]], ["tile_rc", "sp", [32, 8, 2]], ["tile_ry", "sp", [3, 1, 1]], ["tile_rx", "sp", [3, 1, 1]], ["auto_unroll_max_step", "ot", 1500], ["unroll_explicit", "ot", 0]]}], "r": [[0.013789764286407767], 0, 19.60475516319275, 1544140636.0243492], "v": 0.1}
{"i": ["cuda", "conv2d_no_batching", [1, 7, 7, 512, 512, 3, 3, [1, 1], [1, 1]], {}, ["conv2d_no_batching", 1, 7, 7, 512, 512, 3, 3, [1, 1], [1, 1]], {"i": 3532173, "t": "", "c": null, "e": [["tile_f", "sp", [32, 2, 4, 2]], ["tile_y", "sp", [1, 1, 1, 7]], ["tile_x", "sp", [1, 7, 1, 1]], ["tile_rc", "sp", [32, 8, 2]], ["tile_ry", "sp", [3, 1, 1]], ["tile_rx", "sp", [3, 1, 1]], ["auto_unroll_max_step", "ot", 1500], ["unroll_explicit", "ot", 0]]}], "r": [[0.0015556788203883495], 0, 4.008812665939331, 1544140638.9521215], "v": 0.1}
{"i": ["cuda", "conv2d_no_batching", [1, 7, 7, 512, 512, 3, 3, [1, 1], [1, 1]], {}, ["conv2d_no_batching", 1, 7, 7, 512, 512, 3, 3, [1, 1], [1, 1]], {"i": 1793232, "t": "", "c": null, "e": [["tile_f", "sp", [64, 4, 2, 1]], ["tile_y", "sp", [1, 1, 1, 7]], ["tile_x", "sp", [1, 7, 1, 1]], ["tile_rc", "sp", [16, 16, 2]], ["tile_ry", "sp", [3, 1, 1]], ["tile_rx", "sp", [3, 1, 1]], ["auto_unroll_max_step", "ot", 512], ["unroll_explicit", "ot", 0]]}], "r": [[0.01732816725485437], 0, 23.036985397338867, 1544140661.2538948], "v": 0.1}
{"i": ["cuda", "conv2d_no_batching", [1, 7, 7, 512, 512, 3, 3, [1, 1], [1, 1]], {}, ["conv2d_no_batching", 1, 7, 7, 512, 512, 3, 3, [1, 1], [1, 1]], {"i": 3521552, "t": "", "c": null, "e": [["tile_f", "sp", [64, 4, 2, 1]], ["tile_y", "sp", [1, 1, 1, 7]], ["tile_x", "sp", [1, 7, 1, 1]], ["tile_rc", "sp", [256, 1, 2]], ["tile_ry", "sp", [3, 1, 1]], ["tile_rx", "sp", [3, 1, 1]], ["auto_unroll_max_step", "ot", 1500], ["unroll_explicit", "ot", 0]]}], "r": [[0.012112654623786408], 0, 16.496413707733154, 1544140677.2542627], "v": 0.1}
{"i": ["cuda", "conv2d_no_batching", [1, 7, 7, 512, 512, 3, 3, [1, 1], [1, 1]], {}, ["conv2d_no_batching", 1, 7, 7, 512, 512, 3, 3, [1, 1], [1, 1]], {"i": 3715152, "t": "", "c": null, "e": [["tile_f", "sp", [64, 4, 2, 1]], ["tile_y", "sp", [1, 1, 1, 7]], ["tile_x", "sp", [1, 7, 1, 1]], ["tile_rc", "sp", [256, 1, 2]], ["tile_ry", "sp", [1, 3, 1]], ["tile_rx", "sp", [3, 1, 1]], ["auto_unroll_max_step", "ot", 1500], ["unroll_explicit", "ot", 0]]}], "r": [[0.0025644511407766986], 0, 4.723064184188843, 1544140681.4400604], "v": 0.1}
{"i": ["cuda", "conv2d_no_batching", [1, 7, 7, 512, 512, 3, 3, [1, 1], [1, 1]], {}, ["conv2d_no_batching", 1, 7, 7, 512, 512, 3, 3, [1, 1], [1, 1]], {"i": 4295952, "t": "", "c": null, "e": [["tile_f", "sp", [64, 4, 2, 1]], ["tile_y", "sp", [1, 1, 1, 7]], ["tile_x", "sp", [1, 7, 1, 1]], ["tile_rc", "sp", [256, 1, 2]], ["tile_ry", "sp", [1, 3, 1]], ["tile_rx", "sp", [1, 3, 1]], ["auto_unroll_max_step", "ot", 1500], ["unroll_explicit", "ot", 0]]}], "r": [[0.002655765832524272], 0, 4.9982147216796875, 1544140685.7188568], "v": 0.1}
{"i": ["cuda", "conv2d_no_batching", [1, 7, 7, 512, 512, 3, 3, [1, 1], [1, 1]], {}, ["conv2d_no_batching", 1, 7, 7, 512, 512, 3, 3, [1, 1], [1, 1]], {"i": 4102352, "t": "", "c": null, "e": [["tile_f", "sp", [64, 4, 2, 1]], ["tile_y", "sp", [1, 1, 1, 7]], ["tile_x", "sp", [1, 7, 1, 1]], ["tile_rc", "sp", [256, 1, 2]], ["tile_ry", "sp", [3, 1, 1]], ["tile_rx", "sp", [1, 3, 1]], ["auto_unroll_max_step", "ot", 1500], ["unroll_explicit", "ot", 0]]}], "r": [[0.002557992235436893], 0, 4.883959054946899, 1544140689.996844], "v": 0.1}
{"i": ["cuda", "conv2d_no_batching", [1, 7, 7, 512, 512, 3, 3, [1, 1], [1, 1]], {}, ["conv2d_no_batching", 1, 7, 7, 512, 512, 3, 3, [1, 1], [1, 1]], {"i": 7601232, "t": "", "c": null, "e": [["tile_f", "sp", [64, 4, 2, 1]], ["tile_y", "sp", [1, 1, 1, 7]], ["tile_x", "sp", [1, 7, 1, 1]], ["tile_rc", "sp", [16, 16, 2]], ["tile_ry", "sp", [3, 1, 1]], ["tile_rx", "sp", [1, 3, 1]], ["auto_unroll_max_step", "ot", 512], ["unroll_explicit", "ot", 1]]}], "r": [[0.008848408791262136], 0, 13.358612060546875, 1544140701.97929], "v": 0.1}
{"i": ["cuda", "conv2d_no_batching", [1, 7, 7, 512, 512, 3, 3, [1, 1], [1, 1]], {}, ["conv2d_no_batching", 1, 7, 7, 512, 512, 3, 3, [1, 1], [1, 1]], {"i": 4305648, "t": "", "c": null, "e": [["tile_f", "sp", [32, 2, 8, 1]], ["tile_y", "sp", [1, 1, 1, 7]], ["tile_x", "sp", [7, 1, 1, 1]], ["tile_rc", "sp", [32, 8, 2]], ["tile_ry", "sp", [1, 3, 1]], ["tile_rx", "sp", [1, 3, 1]], ["auto_unroll_max_step", "ot", 1500], ["unroll_explicit", "ot", 0]]}], "r": [[0.00032423709708737867], 0, 1.7489252090454102, 1544140792.8333364], "v": 0.1}
{"i": ["cuda", "conv2d_no_batching", [1, 7, 7, 512, 512, 3, 3, [1, 1], [1, 1]], {}, ["conv2d_no_batching", 1, 7, 7, 512, 512, 3, 3, [1, 1], [1, 1]], {"i": 4307628, "t": "", "c": null, "e": [["tile_f", "sp", [32, 2, 8, 1]], ["tile_y", "sp", [7, 1, 1, 1]], ["tile_x", "sp", [1, 1, 1, 7]], ["tile_rc", "sp", [32, 8, 2]], ["tile_ry", "sp", [1, 3, 1]], ["tile_rx", "sp", [1, 3, 1]], ["auto_unroll_max_step", "ot", 1500], ["unroll_explicit", "ot", 0]]}], "r": [[0.0003187895922330097], 0, 1.9676635265350342, 1544140794.0709457], "v": 0.1}
