baseline/conv2d_c12_itervar_n100_2.log
{"i": ["cuda", "conv2d_no_batching", [1, 7, 7, 512, 512, 3, 3, [1, 1], [1, 1]], {}, ["conv2d_no_batching", 1, 7, 7, 512, 512, 3, 3, [1, 1], [1, 1]], {"i": 7232904, "t": "", "c": null, "e": [["tile_f", "sp", [1, 1, 32, 16]], ["tile_y", "sp", [7, 1, 1, 1]], ["tile_x", "sp", [1, 1, 1, 7]], ["tile_rc", "sp", [128, 1, 4]], ["tile_ry", "sp", [1, 3, 1]], ["tile_rx", "sp", [3, 1, 1]], ["auto_unroll_max_step", "ot", 512], ["unroll_explicit", "ot", 1]]}], "r": [[0.004181535120300752], 0, 3.1187450885772705, 1544133931.2755108], "v": 0.1}
{"i": ["cuda", "conv2d_no_batching", [1, 7, 7, 512, 512, 3, 3, [1, 1], [1, 1]], {}, ["conv2d_no_batching", 1, 7, 7, 512, 512, 3, 3, [1, 1], [1, 1]], {"i": 8616705, "t": "", "c": null, "e": [["tile_f", "sp", [16, 1, 1, 32]], ["tile_y", "sp", [1, 1, 7, 1]], ["tile_x", "sp", [1, 1, 1, 7]], ["tile_rc", "sp", [64, 1, 8]], ["tile_ry", "sp", [1, 1, 3]], ["tile_rx", "sp", [1, 1, 3]], ["auto_unroll_max_step", "ot", 512], ["unroll_explicit", "ot", 1]]}], "r": [[0.008817444578947368], 0, 9.148797273635864, 1544133935.9281902], "v": 0.1}
{"i": ["cuda", "conv2d_no_batching", [1, 7, 7, 512, 512, 3, 3, [1, 1], [1, 1]], {}, ["conv2d_no_batching", 1, 7, 7, 512, 512, 3, 3, [1, 1], [1, 1]], {"i": 2712488, "t": "", "c": null, "e": [["tile_f", "sp", [64, 1, 2, 4]], ["tile_y", "sp", [1, 7, 1, 1]], ["tile_x", "sp", [1, 1, 7, 1]], ["tile_rc", "sp", [512, 1, 1]], ["tile_ry", "sp", [1, 1, 3]], ["tile_rx", "sp", [1, 3, 1]], ["auto_unroll_max_step", "ot", 512], ["unroll_explicit", "ot", 0]]}], "r": [[0.0007563544360902256], 0, 1.3981177806854248, 1544133937.0361214], "v": 0.1}
{"i": ["cuda", "conv2d_no_batching", [1, 7, 7, 512, 512, 3, 3, [1, 1], [1, 1]], {}, ["conv2d_no_batching", 1, 7, 7, 512, 512, 3, 3, [1, 1], [1, 1]], {"i": 7723202, "t": "", "c": null, "e": [["tile_f", "sp", [32, 4, 1, 4]], ["tile_y", "sp", [1, 7, 1, 1]], ["tile_x", "sp", [7, 1, 1, 1]], ["tile_rc", "sp", [4, 1, 128]], ["tile_ry", "sp", [3, 1, 1]], ["tile_rx", "sp", [1, 3, 1]], ["auto_unroll_max_step", "ot", 512], ["unroll_explicit", "ot", 1]]}], "r": [[0.02701565625], 0, 3.1560559272766113, 1544133904.0783873], "v": 0.1}
{"i": ["cuda", "conv2d_no_batching", [1, 7, 7, 512, 512, 3, 3, [1, 1], [1, 1]], {}, ["conv2d_no_batching", 1, 7, 7, 512, 512, 3, 3, [1, 1], [1, 1]], {"i": 5286245, "t": "", "c": null, "e": [["tile_f", "sp", [16, 1, 16, 2]], ["tile_y", "sp", [7, 1, 1, 1]], ["tile_x", "sp", [1, 1, 1, 7]], ["tile_rc", "sp", [4, 64, 2]], ["tile_ry", "sp", [3, 1, 1]], ["tile_rx", "sp", [3, 1, 1]], ["auto_unroll_max_step", "ot", 0], ["unroll_explicit", "ot", 1]]}], "r": [[0.0009993551729323307], 0, 1.3801913261413574, 1544133938.1963756], "v": 0.1}
{"i": ["cuda", "conv2d_no_batching", [1, 7, 7, 512, 512, 3, 3, [1, 1], [1, 1]], {}, ["conv2d_no_batching", 1, 7, 7, 512, 512, 3, 3, [1, 1], [1, 1]], {"i": 8950621, "t": "", "c": null, "e": [["tile_f", "sp", [2, 32, 1, 8]], ["tile_y", "sp", [7, 1, 1, 1]], ["tile_x", "sp", [1, 1, 1, 7]], ["tile_rc", "sp", [64, 4, 2]], ["tile_ry", "sp", [1, 3, 1]], ["tile_rx", "sp", [3, 1, 1]], ["auto_unroll_max_step", "ot", 1500], ["unroll_explicit", "ot", 1]]}], "r": [[0.167457931], 0, 5.802668333053589, 1544133908.817121], "v": 0.1}
{"i": ["cuda", "conv2d_no_batching", [1, 7, 7, 512, 512, 3, 3, [1, 1], [1, 1]], {}, ["conv2d_no_batching", 1, 7, 7, 512, 512, 3, 3, [1, 1], [1, 1]], {"i": 8229048, "t": "", "c": null, "e": [["tile_f", "sp", [2, 16, 1, 16]], ["tile_y", "sp", [7, 1, 1, 1]], ["tile_x", "sp", [1, 1, 1, 7]], ["tile_rc", "sp", [64, 1, 8]], ["tile_ry", "sp", [3, 1, 1]], ["tile_rx", "sp", [1, 1, 3]], ["auto_unroll_max_step", "ot", 512], ["unroll_explicit", "ot", 1]]}], "r": [[0.29310666125], 0, 6.802874326705933, 1544133915.5967588], "v": 0.1}
{"i": ["cuda", "conv2d_no_batching", [1, 7, 7, 512, 512, 3, 3, [1, 1], [1, 1]], {}, ["conv2d_no_batching", 1, 7, 7, 512, 512, 3, 3, [1, 1], [1, 1]], {"i": 5469379, "t": "", "c": null, "e": [["tile_f", "sp", [4, 1, 8, 16]], ["tile_y", "sp", [7, 1, 1, 1]], ["tile_x", "sp", [1, 1, 1, 7]], ["tile_rc", "sp", [32, 8, 2]], ["tile_ry", "sp", [1, 3, 1]], ["tile_rx", "sp", [3, 1, 1]], ["auto_unroll_max_step", "ot", 0], ["unroll_explicit", "ot", 1]]}], "r": [[0.004135055458646617], 0, 2.733760118484497, 1544133940.670066], "v": 0.1}
{"i": ["cuda", "conv2d_no_batching", [1, 7, 7, 512, 512, 3, 3, [1, 1], [1, 1]], {}, ["conv2d_no_batching", 1, 7, 7, 512, 512, 3, 3, [1, 1], [1, 1]], {"i": 8788409, "t": "", "c": null, "e": [["tile_f", "sp", [4, 32, 2, 2]], ["tile_y", "sp", [1, 1, 1, 7]], ["tile_x", "sp", [1, 1, 7, 1]], ["tile_rc", "sp", [32, 4, 4]], ["tile_ry", "sp", [3, 1, 1]], ["tile_rx", "sp", [3, 1, 1]], ["auto_unroll_max_step", "ot", 1500], ["unroll_explicit", "ot", 1]]}], "r": [[0.02334980232330827], 0, 12.63156509399414, 1544133951.009519], "v": 0.1}
{"i": ["cuda", "conv2d_no_batching", [1, 7, 7, 512, 512, 3, 3, [1, 1], [1, 1]], {}, ["conv2d_no_batching", 1, 7, 7, 512, 512, 3, 3, [1, 1], [1, 1]], {"i": 10071136, "t": "", "c": null, "e": [["tile_f", "sp", [1, 4, 4, 32]], ["tile_y", "sp", [1, 7, 1, 1]], ["tile_x", "sp", [7, 1, 1, 1]], ["tile_rc", "sp", [256, 2, 1]], ["tile_ry", "sp", [1, 3, 1]], ["tile_rx", "sp", [1, 1, 3]], ["auto_unroll_max_step", "ot", 1500], ["unroll_explicit", "ot", 1]]}], "r": [[0.12119935725], 0, 7.645149230957031, 1544133922.9228084], "v": 0.1}
{"i": ["cuda", "conv2d_no_batching", [1, 7, 7, 512, 512, 3, 3, [1, 1], [1, 1]], {}, ["conv2d_no_batching", 1, 7, 7, 512, 512, 3, 3, [1, 1], [1, 1]], {"i": 2805452, "t": "", "c": null, "e": [["tile_f", "sp", [64, 4, 2, 1]], ["tile_y", "sp", [7, 1, 1, 1]], ["tile_x", "sp", [7, 1, 1, 1]], ["tile_rc", "sp", [64, 1, 8]], ["tile_ry", "sp", [1, 1, 3]], ["tile_rx", "sp", [1, 3, 1]], ["auto_unroll_max_step", "ot", 512], ["unroll_explicit", "ot", 0]]}], "r": [[0.00439629015037594], 0, 3.050269603729248, 1544133953.5906417], "v": 0.1}
{"i": ["cuda", "conv2d_no_batching", [1, 7, 7, 512, 512, 3, 3, [1, 1], [1, 1]], {}, ["conv2d_no_batching", 1, 7, 7, 512, 512, 3, 3, [1, 1], [1, 1]], {"i": 8363260, "t": "", "c": null, "e": [["tile_f", "sp", [2, 2, 8, 16]], ["tile_y", "sp", [1, 1, 7, 1]], ["tile_x", "sp", [1, 1, 1, 7]], ["tile_rc", "sp", [256, 1, 2]], ["tile_ry", "sp", [1, 3, 1]], ["tile_rx", "sp", [1, 1, 3]], ["auto_unroll_max_step", "ot", 512], ["unroll_explicit", "ot", 1]]}], "r": [[0.007318667293233083], 0, 4.964888095855713, 1544133957.5338163], "v": 0.1}
{"i": ["cuda", "conv2d_no_batching", [1, 7, 7, 512, 512, 3, 3, [1, 1], [1, 1]], {}, ["conv2d_no_batching", 1, 7, 7, 512, 512, 3, 3, [1, 1], [1, 1]], {"i": 4101586, "t": "", "c": null, "e": [["tile_f", "sp", [8, 1, 16, 4]], ["tile_y", "sp", [1, 1, 1, 7]], ["tile_x", "sp", [7, 1, 1, 1]], ["tile_rc", "sp", [256, 1, 2]], ["tile_ry", "sp", [3, 1, 1]], ["tile_rx", "sp", [1, 3, 1]], ["auto_unroll_max_step", "ot", 1500], ["unroll_explicit", "ot", 0]]}], "r": [[0.0008288487443609022], 0, 1.4767825603485107, 1544133958.6757123], "v": 0.1}
{"i": ["cuda", "conv2d_no_batching", [1, 7, 7, 512, 512, 3, 3, [1, 1], [1, 1]], {}, ["conv2d_no_batching", 1, 7, 7, 512, 512, 3, 3, [1, 1], [1, 1]], {"i": 1977939, "t": "", "c": null, "e": [["tile_f", "sp", [8, 8, 1, 8]], ["tile_y", "sp", [1, 1, 7, 1]], ["tile_x", "sp", [1, 1, 1, 7]], ["tile_rc", "sp", [128, 2, 2]], ["tile_ry", "sp", [1, 3, 1]], ["tile_rx", "sp", [3, 1, 1]], ["auto_unroll_max_step", "ot", 512], ["unroll_explicit", "ot", 0]]}], "r": [[0.023963132857142855], 0, 13.883056163787842, 1544133974.4807854], "v": 0.1}
{"i": ["cuda", "conv2d_no_batching", [1, 7, 7, 512, 512, 3, 3, [1, 1], [1, 1]], {}, ["conv2d_no_batching", 1, 7, 7, 512, 512, 3, 3, [1, 1], [1, 1]], {"i": 5371890, "t": "", "c": null, "e": [["tile_f", "sp", [8, 2, 4, 8]], ["tile_y", "sp", [1, 7, 1, 1]], ["tile_x", "sp", [7, 1, 1, 1]], ["tile_rc", "sp", [8, 2, 32]], ["tile_ry", "sp", [3, 1, 1]], ["tile_rx", "sp", [3, 1, 1]], ["auto_unroll_max_step", "ot", 0], ["unroll_explicit", "ot", 1]]}], "r": [[0.008118954969924812], 0, 4.729596138000488, 1544133978.6293173], "v": 0.1}
{"i": ["cuda", "conv2d_no_batching", [1, 7, 7, 512, 512, 3, 3, [1, 1], [1, 1]], {}, ["conv2d_no_batching", 1, 7, 7, 512, 512, 3, 3, [1, 1], [1, 1]], {"i": 1855800, "t": "", "c": null, "e": [["tile_f", "sp", [128, 1, 1, 4]], ["tile_y", "sp", [1, 1, 1, 7]], ["tile_x", "sp", [7, 1, 1, 1]], ["tile_rc", "sp", [2, 32, 8]], ["tile_ry", "sp", [3, 1, 1]], ["tile_rx", "sp", [3, 1, 1]], ["auto_unroll_max_step", "ot", 512], ["unroll_explicit", "ot", 0]]}], "r": [[0.008277869984962405], 0, 4.607311010360718, 1544133982.9289515], "v": 0.1}
{"i": ["cuda", "conv2d_no_batching", [1, 7, 7, 512, 512, 3, 3, [1, 1], [1, 1]], {}, ["conv2d_no_batching", 1, 7, 7, 512, 512, 3, 3, [1, 1], [1, 1]], {"i": 8147105, "t": "", "c": null, "e": [["tile_f", "sp", [64, 2, 2, 2]], ["tile_y", "sp", [7, 1, 1, 1]], ["tile_x", "sp", [1, 1, 7, 1]], ["tile_rc", "sp", [32, 16, 1]], ["tile_ry", "sp", [3, 1, 1]], ["tile_rx", "sp", [1, 1, 3]], ["auto_unroll_max_step", "ot", 512], ["unroll_explicit", "ot", 1]]}], "r": [[0.0008359968721804512], 0, 4.192263126373291, 1544134049.6842113], "v": 0.1}
{"i": ["cuda", "conv2d_no_batching", [1, 7, 7, 512, 512, 3, 3, [1, 1], [1, 1]], {}, ["conv2d_no_batching", 1, 7, 7, 512, 512, 3, 3, [1, 1], [1, 1]], {"i": 7022620, "t": "", "c": null, "e": [["tile_f", "sp", [512, 1, 1, 1]], ["tile_y", "sp", [1, 7, 1, 1]], ["tile_x", "sp", [7, 1, 1, 1]], ["tile_rc", "sp", [8, 32, 2]], ["tile_ry", "sp", [3, 1, 1]], ["tile_rx", "sp", [3, 1, 1]], ["auto_unroll_max_step", "ot", 512], ["unroll_explicit", "ot", 1]]}], "r": [[0.006066871571428571], 0, 4.853071212768555, 1544134053.3664532], "v": 0.1}
{"i": ["cuda", "conv2d_no_batching", [1, 7, 7, 512, 512, 3, 3, [1, 1], [1, 1]], {}, ["conv2d_no_batching", 1, 7, 7, 512, 512, 3, 3, [1, 1], [1, 1]], {"i": 6200943, "t": "", "c": null, "e": [["tile_f", "sp", [8, 16, 4, 1]], ["tile_y", "sp", [1, 1, 7, 1]], ["tile_x", "sp", [1, 1, 7, 1]], ["tile_rc", "sp", [256, 2, 1]], ["tile_ry", "sp", [1, 1, 3]], ["tile_rx", "sp", [1, 3, 1]], ["auto_unroll_max_step", "ot", 0], ["unroll_explicit", "ot", 1]]}], "r": [[0.0006274726397515527], 0, 1.3498883247375488, 1544134175.169028], "v": 0.1}
{"i": ["cuda", "conv2d_no_batching", [1, 7, 7, 512, 512, 3, 3, [1, 1], [1, 1]], {}, ["conv2d_no_batching", 1, 7, 7, 512, 512, 3, 3, [1, 1], [1, 1]], {"i": 7209283, "t": "", "c": null, "e": [["tile_f", "sp", [16, 8, 1, 4]], ["tile_y", "sp", [1, 7, 1, 1]], ["tile_x", "sp", [7, 1, 1, 1]], ["tile_rc", "sp", [32, 8, 2]], ["tile_ry", "sp", [1, 3, 1]], ["tile_rx", "sp", [3, 1, 1]], ["auto_unroll_max_step", "ot", 512], ["unroll_explicit", "ot", 1]]}], "r": [[0.01894369562406015], 0, 10.469534158706665, 1544134063.443178], "v": 0.1}
{"i": ["cuda", "conv2d_no_batching", [1, 7, 7, 512, 512, 3, 3, [1, 1], [1, 1]], {}, ["conv2d_no_batching", 1, 7, 7, 512, 512, 3, 3, [1, 1], [1, 1]], {"i": 1812951, "t": "", "c": null, "e": [["tile_f", "sp", [4, 4, 4, 8]], ["tile_y", "sp", [7, 1, 1, 1]], ["tile_x", "sp", [7, 1, 1, 1]], ["tile_rc", "sp", [64, 2, 4]], ["tile_ry", "sp", [3, 1, 1]], ["tile_rx", "sp", [3, 1, 1]], ["auto_unroll_max_step", "ot", 512], ["unroll_explicit", "ot", 0]]}], "r": [[0.00351999907518797], 0, 3.2455050945281982, 1544134163.0771687], "v": 0.1}
{"i": ["cuda", "conv2d_no_batching", [1, 7, 7, 512, 512, 3, 3, [1, 1], [1, 1]], {}, ["conv2d_no_batching", 1, 7, 7, 512, 512, 3, 3, [1, 1], [1, 1]], {"i": 3172104, "t": "", "c": null, "e": [["tile_f", "sp", [16, 2, 2, 8]], ["tile_y", "sp", [1, 1, 7, 1]], ["tile_x", "sp", [7, 1, 1, 1]], ["tile_rc", "sp", [32, 4, 4]], ["tile_ry", "sp", [1, 3, 1]], ["tile_rx", "sp", [1, 1, 3]], ["auto_unroll_max_step", "ot", 512], ["unroll_explicit", "ot", 0]]}], "r": [[0.004798446616541353], 0, 6.7575178146362305, 1544134168.6362348], "v": 0.1}
{"i": ["cuda", "conv2d_no_batching", [1, 7, 7, 512, 512, 3, 3, [1, 1], [1, 1]], {}, ["conv2d_no_batching", 1, 7, 7, 512, 512, 3, 3, [1, 1], [1, 1]], {"i": 7973824, "t": "", "c": null, "e": [["tile_f", "sp", [16, 2, 2, 8]], ["tile_y", "sp", [7, 1, 1, 1]], ["tile_x", "sp", [1, 7, 1, 1]], ["tile_rc", "sp", [256, 1, 2]], ["tile_ry", "sp", [1, 1, 3]], ["tile_rx", "sp", [1, 3, 1]], ["auto_unroll_max_step", "ot", 512], ["unroll_explicit", "ot", 1]]}], "r": [[0.0032736433458646617], 0, 3.095027446746826, 1544134171.2553759], "v": 0.1}
{"i": ["cuda", "conv2d_no_batching", [1, 7, 7, 512, 512, 3, 3, [1, 1], [1, 1]], {}, ["conv2d_no_batching", 1, 7, 7, 512, 512, 3, 3, [1, 1], [1, 1]], {"i": 213564, "t": "", "c": null, "e": [["tile_f", "sp", [32, 1, 1, 16]], ["tile_y", "sp", [1, 1, 7, 1]], ["tile_x", "sp", [1, 1, 7, 1]], ["tile_rc", "sp", [16, 32, 1]], ["tile_ry", "sp", [1, 3, 1]], ["tile_rx", "sp", [3, 1, 1]], ["auto_unroll_max_step", "ot", 0], ["unroll_explicit", "ot", 0]]}], "r": [[0.0011107945714285716], 0, 1.6319975852966309, 1544134172.6412468], "v": 0.1}
{"i": ["cuda", "conv2d_no_batching", [1, 7, 7, 512, 512, 3, 3, [1, 1], [1, 1]], {}, ["conv2d_no_batching", 1, 7, 7, 512, 512, 3, 3, [1, 1], [1, 1]], {"i": 7939416, "t": "", "c": null, "e": [["tile_f", "sp", [128, 2, 1, 2]], ["tile_y", "sp", [7, 1, 1, 1]], ["tile_x", "sp", [1, 1, 7, 1]], ["tile_rc", "sp", [512, 1, 1]], ["tile_ry", "sp", [1, 1, 3]], ["tile_rx", "sp", [1, 3, 1]], ["auto_unroll_max_step", "ot", 512], ["unroll_explicit", "ot", 1]]}], "r": [[0.00042618965957446806], 0, 1.3824505805969238, 1544134247.1176505], "v": 0.1}
{"i": ["cuda", "conv2d_no_batching", [1, 7, 7, 512, 512, 3, 3, [1, 1], [1, 1]], {}, ["conv2d_no_batching", 1, 7, 7, 512, 512, 3, 3, [1, 1], [1, 1]], {"i": 7939417, "t": "", "c": null, "e": [["tile_f", "sp", [64, 4, 1, 2]], ["tile_y", "sp", [7, 1, 1, 1]], ["tile_x", "sp", [1, 1, 7, 1]], ["tile_rc", "sp", [512, 1, 1]], ["tile_ry", "sp", [1, 1, 3]], ["tile_rx", "sp", [1, 3, 1]], ["auto_unroll_max_step", "ot", 512], ["unroll_explicit", "ot", 1]]}], "r": [[0.000580511514423077], 0, 1.5441293716430664, 1544134244.8261263], "v": 0.1}
{"i": ["cuda", "conv2d_no_batching", [1, 7, 7, 512, 512, 3, 3, [1, 1], [1, 1]], {}, ["conv2d_no_batching", 1, 7, 7, 512, 512, 3, 3, [1, 1], [1, 1]], {"i": 9681817, "t": "", "c": null, "e": [["tile_f", "sp", [64, 4, 1, 2]], ["tile_y", "sp", [7, 1, 1, 1]], ["tile_x", "sp", [1, 1, 7, 1]], ["tile_rc", "sp", [512, 1, 1]], ["tile_ry", "sp", [1, 1, 3]], ["tile_rx", "sp", [1, 3, 1]], ["auto_unroll_max_step", "ot", 1500], ["unroll_explicit", "ot", 1]]}], "r": [[0.0005806907884615385], 0, 1.5432696342468262, 1544134246.0137653], "v": 0.1}
{"i": ["cuda", "conv2d_no_batching", [1, 7, 7, 512, 512, 3, 3, [1, 1], [1, 1]], {}, ["conv2d_no_batching", 1, 7, 7, 512, 512, 3, 3, [1, 1], [1, 1]], {"i": 6197017, "t": "", "c": null, "e": [["tile_f", "sp", [64, 4, 1, 2]], ["tile_y", "sp", [7, 1, 1, 1]], ["tile_x", "sp", [1, 1, 7, 1]], ["tile_rc", "sp", [512, 1, 1]], ["tile_ry", "sp", [1, 1, 3]], ["tile_rx", "sp", [1, 3, 1]], ["auto_unroll_max_step", "ot", 0], ["unroll_explicit", "ot", 1]]}], "r": [[0.001168272211180124], 0, 1.7959074974060059, 1544134242.5229208], "v": 0.1}
