baseline/conv2d_c7_itervar_n100_2.log
{"i": ["cuda", "conv2d_no_batching", [1, 28, 28, 128, 256, 3, 3, [2, 2], [1, 1]], {}, ["conv2d_no_batching", 1, 28, 28, 128, 256, 3, 3, [2, 2], [1, 1]], {"i": 7544247, "t": "", "c": null, "e": [["tile_f", "sp", [4, 4, 1, 8]], ["tile_y", "sp", [7, 1, 2, 1]], ["tile_x", "sp", [7, 1, 1, 2]], ["tile_rc", "sp", [8, 8, 4]], ["tile_ry", "sp", [1, 1, 3]], ["tile_rx", "sp", [1, 3, 1]], ["auto_unroll_max_step", "ot", 0], ["unroll_explicit", "ot", 0]]}], "r": [[0.016567998407725323], 0, 12.727384805679321, 1544136009.3852687], "v": 0.1}
{"i": ["cuda", "conv2d_no_batching", [1, 28, 28, 128, 256, 3, 3, [2, 2], [1, 1]], {}, ["conv2d_no_batching", 1, 28, 28, 128, 256, 3, 3, [2, 2], [1, 1]], {"i": 650892, "t": "", "c": null, "e": [["tile_f", "sp", [4, 16, 2, 1]], ["tile_y", "sp", [14, 1, 1, 1]], ["tile_x", "sp", [1, 14, 1, 1]], ["tile_rc", "sp", [4, 16, 4]], ["tile_ry", "sp", [3, 1, 1]], ["tile_rx", "sp", [3, 1, 1]], ["auto_unroll_max_step", "ot", 0], ["unroll_explicit", "ot", 0]]}], "r": [[0.005472716849785408], 0, 5.174574136734009, 1544136014.074074], "v": 0.1}
{"i": ["cuda", "conv2d_no_batching", [1, 28, 28, 128, 256, 3, 3, [2, 2], [1, 1]], {}, ["conv2d_no_batching", 1, 28, 28, 128, 256, 3, 3, [2, 2], [1, 1]], {"i": 58656812, "t": "", "c": null, "e": [["tile_f", "sp", [2, 4, 2, 8]], ["tile_y", "sp", [2, 1, 7, 1]], ["tile_x", "sp", [2, 1, 7, 1]], ["tile_rc", "sp", [16, 4, 4]], ["tile_ry", "sp", [3, 1, 1]], ["tile_rx", "sp", [1, 1, 3]], ["auto_unroll_max_step", "ot", 512], ["unroll_explicit", "ot", 1]]}], "r": [[0.0006731332103004291], 0, 2.62172269821167, 1544136015.541755], "v": 0.1}
{"i": ["cuda", "conv2d_no_batching", [1, 28, 28, 128, 256, 3, 3, [2, 2], [1, 1]], {}, ["conv2d_no_batching", 1, 28, 28, 128, 256, 3, 3, [2, 2], [1, 1]], {"i": 72638587, "t": "", "c": null, "e": [["tile_f", "sp", [4, 8, 1, 4]], ["tile_y", "sp", [7, 1, 1, 2]], ["tile_x", "sp", [1, 1, 14, 1]], ["tile_rc", "sp", [32, 1, 8]], ["tile_ry", "sp", [1, 3, 1]], ["tile_rx", "sp", [1, 1, 3]], ["auto_unroll_max_step", "ot", 1500], ["unroll_explicit", "ot", 1]]}], "r": [[0.0035622105193133047], 0, 7.429327487945557, 1544136019.2934248], "v": 0.1}
{"i": ["cuda", "conv2d_no_batching", [1, 28, 28, 128, 256, 3, 3, [2, 2], [1, 1]], {}, ["conv2d_no_batching", 1, 28, 28, 128, 256, 3, 3, [2, 2], [1, 1]], {"i": 3510050, "t": "", "c": null, "e": [["tile_f", "sp", [8, 2, 4, 2]], ["tile_y", "sp", [2, 7, 1, 1]], ["tile_x", "sp", [7, 1, 2, 1]], ["tile_rc", "sp", [32, 1, 8]], ["tile_ry", "sp", [1, 1, 3]], ["tile_rx", "sp", [3, 1, 1]], ["auto_unroll_max_step", "ot", 0], ["unroll_explicit", "ot", 0]]}], "r": [[0.0011365191244635192], 0, 2.065099000930786, 1544136020.9259696], "v": 0.1}
{"i": ["cuda", "conv2d_no_batching", [1, 28, 28, 128, 256, 3, 3, [2, 2], [1, 1]], {}, ["conv2d_no_batching", 1, 28, 28, 128, 256, 3, 3, [2, 2], [1, 1]], {"i": 18267388, "t": "", "c": null, "e": [["tile_f", "sp", [2, 4, 16, 1]], ["tile_y", "sp", [7, 1, 2, 1]], ["tile_x", "sp", [1, 7, 1, 2]], ["tile_rc", "sp", [128, 1, 2]], ["tile_ry", "sp", [1, 3, 1]], ["tile_rx", "sp", [1, 3, 1]], ["auto_unroll_max_step", "ot", 512], ["unroll_explicit", "ot", 0]]}], "r": [[0.00047896321888412014], 0, 1.5208320617675781, 1544136022.1104481], "v": 0.1}
{"i": ["cuda", "conv2d_no_batching", [1, 28, 28, 128, 256, 3, 3, [2, 2], [1, 1]], {}, ["conv2d_no_batching", 1, 28, 28, 128, 256, 3, 3, [2, 2], [1, 1]], {"i": 45961720, "t": "", "c": null, "e": [["tile_f", "sp", [4, 16, 1, 2]], ["tile_y", "sp", [2, 1, 7, 1]], ["tile_x", "sp", [2, 7, 1, 1]], ["tile_rc", "sp", [32, 4, 2]], ["tile_ry", "sp", [3, 1, 1]], ["tile_rx", "sp", [1, 1, 3]], ["auto_unroll_max_step", "ot", 0], ["unroll_explicit", "ot", 1]]}], "r": [[0.015771686583690988], 0, 12.578734159469604, 1544136034.046465], "v": 0.1}
{"i": ["cuda", "conv2d_no_batching", [1, 28, 28, 128, 256, 3, 3, [2, 2], [1, 1]], {}, ["conv2d_no_batching", 1, 28, 28, 128, 256, 3, 3, [2, 2], [1, 1]], {"i": 40127798, "t": "", "c": null, "e": [["tile_f", "sp", [16, 4, 1, 2]], ["tile_y", "sp", [1, 1, 2, 7]], ["tile_x", "sp", [1, 14, 1, 1]], ["tile_rc", "sp", [128, 2, 1]], ["tile_ry", "sp", [1, 1, 3]], ["tile_rx", "sp", [3, 1, 1]], ["auto_unroll_max_step", "ot", 0], ["unroll_explicit", "ot", 1]]}], "r": [[0.062722219], 0, 2.45351505279541, 1544135985.9019175], "v": 0.1}
{"i": ["cuda", "conv2d_no_batching", [1, 28, 28, 128, 256, 3, 3, [2, 2], [1, 1]], {}, ["conv2d_no_batching", 1, 28, 28, 128, 256, 3, 3, [2, 2], [1, 1]], {"i": 49852494, "t": "", "c": null, "e": [["tile_f", "sp", [8, 1, 8, 2]], ["tile_y", "sp", [1, 2, 1, 7]], ["tile_x", "sp", [2, 1, 1, 7]], ["tile_rc", "sp", [64, 4, 1]], ["tile_ry", "sp", [3, 1, 1]], ["tile_rx", "sp", [3, 1, 1]], ["auto_unroll_max_step", "ot", 512], ["unroll_explicit", "ot", 1]]}], "r": [[0.034816305], 0, 9.348560571670532, 1544135990.4934185], "v": 0.1}
{"i": ["cuda", "conv2d_no_batching", [1, 28, 28, 128, 256, 3, 3, [2, 2], [1, 1]], {}, ["conv2d_no_batching", 1, 28, 28, 128, 256, 3, 3, [2, 2], [1, 1]], {"i": 25469113, "t": "", "c": null, "e": [["tile_f", "sp", [2, 8, 2, 4]], ["tile_y", "sp", [2, 7, 1, 1]], ["tile_x", "sp", [7, 2, 1, 1]], ["tile_rc", "sp", [16, 4, 4]], ["tile_ry", "sp", [3, 1, 1]], ["tile_rx", "sp", [3, 1, 1]], ["auto_unroll_max_step", "ot", 1500], ["unroll_explicit", "ot", 0]]}], "r": [[0.012301328673819743], 0, 12.751855611801147, 1544136043.814815], "v": 0.1}
{"i": ["cuda", "conv2d_no_batching", [1, 28, 28, 128, 256, 3, 3, [2, 2], [1, 1]], {}, ["conv2d_no_batching", 1, 28, 28, 128, 256, 3, 3, [2, 2], [1, 1]], {"i": 45036076, "t": "", "c": null, "e": [["tile_f", "sp", [4, 2, 4, 4]], ["tile_y", "sp", [7, 1, 2, 1]], ["tile_x", "sp", [14, 1, 1, 1]], ["tile_rc", "sp", [8, 4, 8]], ["tile_ry", "sp", [1, 1, 3]], ["tile_rx", "sp", [1, 3, 1]], ["auto_unroll_max_step", "ot", 0], ["unroll_explicit", "ot", 1]]}], "r": [[0.004714438257510729], 0, 4.43341064453125, 1544136047.953567], "v": 0.1}
{"i": ["cuda", "conv2d_no_batching", [1, 28, 28, 128, 256, 3, 3, [2, 2], [1, 1]], {}, ["conv2d_no_batching", 1, 28, 28, 128, 256, 3, 3, [2, 2], [1, 1]], {"i": 30973519, "t": "", "c": null, "e": [["tile_f", "sp", [4, 1, 8, 4]], ["tile_y", "sp", [14, 1, 1, 1]], ["tile_x", "sp", [7, 1, 2, 1]], ["tile_rc", "sp", [32, 2, 4]], ["tile_ry", "sp", [1, 3, 1]], ["tile_rx", "sp", [1, 3, 1]], ["auto_unroll_max_step", "ot", 1500], ["unroll_explicit", "ot", 0]]}], "r": [[0.00042705902127659575], 0, 1.543626070022583, 1544136050.270844], "v": 0.1}
{"i": ["cuda", "conv2d_no_batching", [1, 28, 28, 128, 256, 3, 3, [2, 2], [1, 1]], {}, ["conv2d_no_batching", 1, 28, 28, 128, 256, 3, 3, [2, 2], [1, 1]], {"i": 45724842, "t": "", "c": null, "e": [["tile_f", "sp", [1, 64, 1, 2]], ["tile_y", "sp", [14, 1, 1, 1]], ["tile_x", "sp", [1, 2, 7, 1]], ["tile_rc", "sp", [32, 8, 1]], ["tile_ry", "sp", [3, 1, 1]], ["tile_rx", "sp", [1, 1, 3]], ["auto_unroll_max_step", "ot", 0], ["unroll_explicit", "ot", 1]]}], "r": [[0.01857342114468085], 0, 14.903048992156982, 1544136072.9633536], "v": 0.1}
{"i": ["cuda", "conv2d_no_batching", [1, 28, 28, 128, 256, 3, 3, [2, 2], [1, 1]], {}, ["conv2d_no_batching", 1, 28, 28, 128, 256, 3, 3, [2, 2], [1, 1]], {"i": 40849531, "t": "", "c": null, "e": [["tile_f", "sp", [4, 2, 2, 8]], ["tile_y", "sp", [2, 1, 1, 7]], ["tile_x", "sp", [1, 1, 7, 2]], ["tile_rc", "sp", [32, 1, 8]], ["tile_ry", "sp", [1, 1, 3]], ["tile_rx", "sp", [3, 1, 1]], ["auto_unroll_max_step", "ot", 0], ["unroll_explicit", "ot", 1]]}], "r": [[0.009077601663829787], 0, 8.047744274139404, 1544136112.5035603], "v": 0.1}
{"i": ["cuda", "conv2d_no_batching", [1, 28, 28, 128, 256, 3, 3, [2, 2], [1, 1]], {}, ["conv2d_no_batching", 1, 28, 28, 128, 256, 3, 3, [2, 2], [1, 1]], {"i": 47394163, "t": "", "c": null, "e": [["tile_f", "sp", [32, 1, 2, 2]], ["tile_y", "sp", [1, 2, 7, 1]], ["tile_x", "sp", [2, 1, 1, 7]], ["tile_rc", "sp", [16, 8, 2]], ["tile_ry", "sp", [1, 3, 1]], ["tile_rx", "sp", [1, 1, 3]], ["auto_unroll_max_step", "ot", 0], ["unroll_explicit", "ot", 1]]}], "r": [[0.0021828276595744684], 0, 2.769395351409912, 1544136115.977667], "v": 0.1}
{"i": ["cuda", "conv2d_no_batching", [1, 28, 28, 128, 256, 3, 3, [2, 2], [1, 1]], {}, ["conv2d_no_batching", 1, 28, 28, 128, 256, 3, 3, [2, 2], [1, 1]], {"i": 59801781, "t": "", "c": null, "e": [["tile_f", "sp", [16, 1, 8, 1]], ["tile_y", "sp", [2, 1, 1, 7]], ["tile_x", "sp", [1, 7, 1, 2]], ["tile_rc", "sp", [32, 4, 2]], ["tile_ry", "sp", [1, 3, 1]], ["tile_rx", "sp", [1, 1, 3]], ["auto_unroll_max_step", "ot", 512], ["unroll_explicit", "ot", 1]]}], "r": [[0.0034272653276595745], 0, 5.8727545738220215, 1544136119.744528], "v": 0.1}
{"i": ["cuda", "conv2d_no_batching", [1, 28, 28, 128, 256, 3, 3, [2, 2], [1, 1]], {}, ["conv2d_no_batching", 1, 28, 28, 128, 256, 3, 3, [2, 2], [1, 1]], {"i": 66395669, "t": "", "c": null, "e": [["tile_f", "sp", [1, 8, 16, 1]], ["tile_y", "sp", [7, 2, 1, 1]], ["tile_x", "sp", [1, 7, 2, 1]], ["tile_rc", "sp", [128, 2, 1]], ["tile_ry", "sp", [3, 1, 1]], ["tile_rx", "sp", [1, 3, 1]], ["auto_unroll_max_step", "ot", 1500], ["unroll_explicit", "ot", 1]]}], "r": [[0.0014316304340425533], 0, 2.8468017578125, 1544136185.3074453], "v": 0.1}
{"i": ["cuda", "conv2d_no_batching", [1, 28, 28, 128, 256, 3, 3, [2, 2], [1, 1]], {}, ["conv2d_no_batching", 1, 28, 28, 128, 256, 3, 3, [2, 2], [1, 1]], {"i": 58592788, "t": "", "c": null, "e": [["tile_f", "sp", [2, 4, 16, 1]], ["tile_y", "sp", [7, 2, 1, 1]], ["tile_x", "sp", [1, 7, 2, 1]], ["tile_rc", "sp", [64, 1, 4]], ["tile_ry", "sp", [3, 1, 1]], ["tile_rx", "sp", [1, 1, 3]], ["auto_unroll_max_step", "ot", 512], ["unroll_explicit", "ot", 1]]}], "r": [[0.0007375117021276596], 0, 2.1648857593536377, 1544136186.8459072], "v": 0.1}
{"i": ["cuda", "conv2d_no_batching", [1, 28, 28, 128, 256, 3, 3, [2, 2], [1, 1]], {}, ["conv2d_no_batching", 1, 28, 28, 128, 256, 3, 3, [2, 2], [1, 1]], {"i": 14142180, "t": "", "c": null, "e": [["tile_f", "sp", [1, 4, 16, 2]], ["tile_y", "sp", [1, 1, 7, 2]], ["tile_x", "sp", [1, 7, 2, 1]], ["tile_rc", "sp", [64, 2, 2]], ["tile_ry", "sp", [1, 3, 1]], ["tile_rx", "sp", [3, 1, 1]], ["auto_unroll_max_step", "ot", 512], ["unroll_explicit", "ot", 0]]}], "r": [[0.001063149114893617], 0, 2.300765037536621, 1544136189.0876515], "v": 0.1}
{"i": ["cuda", "conv2d_no_batching", [1, 28, 28, 128, 256, 3, 3, [2, 2], [1, 1]], {}, ["conv2d_no_batching", 1, 28, 28, 128, 256, 3, 3, [2, 2], [1, 1]], {"i": 18551537, "t": "", "c": null, "e": [["tile_f", "sp", [8, 4, 4, 1]], ["tile_y", "sp", [7, 1, 2, 1]], ["tile_x", "sp", [1, 1, 2, 7]], ["tile_rc", "sp", [32, 2, 4]], ["tile_ry", "sp", [1, 3, 1]], ["tile_rx", "sp", [1, 3, 1]], ["auto_unroll_max_step", "ot", 512], ["unroll_explicit", "ot", 0]]}], "r": [[0.002144188174468085], 0, 4.3897669315338135, 1544136192.619377], "v": 0.1}
{"i": ["cuda", "conv2d_no_batching", [1, 28, 28, 128, 256, 3, 3, [2, 2], [1, 1]], {}, ["conv2d_no_batching", 1, 28, 28, 128, 256, 3, 3, [2, 2], [1, 1]], {"i": 40640040, "t": "", "c": null, "e": [["tile_f", "sp", [128, 1, 1, 1]], ["tile_y", "sp", [1, 1, 7, 2]], ["tile_x", "sp", [1, 1, 2, 7]], ["tile_rc", "sp", [64, 1, 4]], ["tile_ry", "sp", [1, 1, 3]], ["tile_rx", "sp", [3, 1, 1]], ["auto_unroll_max_step", "ot", 0], ["unroll_explicit", "ot", 1]]}], "r": [[0.009880867280851064], 0, 8.136547565460205, 1544136201.0211349], "v": 0.1}
{"i": ["cuda", "conv2d_no_batching", [1, 28, 28, 128, 256, 3, 3, [2, 2], [1, 1]], {}, ["conv2d_no_batching", 1, 28, 28, 128, 256, 3, 3, [2, 2], [1, 1]], {"i": 54547775, "t": "", "c": null, "e": [["tile_f", "sp", [2, 2, 4, 8]], ["tile_y", "sp", [7, 1, 2, 1]], ["tile_x", "sp", [1, 7, 1, 2]], ["tile_rc", "sp", [8, 8, 4]], ["tile_ry", "sp", [3, 1, 1]], ["tile_rx", "sp", [1, 3, 1]], ["auto_unroll_max_step", "ot", 512], ["unroll_explicit", "ot", 1]]}], "r": [[0.004600031259574468], 0, 5.002125024795532, 1544136205.4825375], "v": 0.1}
{"i": ["cuda", "conv2d_no_batching", [1, 28, 28, 128, 256, 3, 3, [2, 2], [1, 1]], {}, ["conv2d_no_batching", 1, 28, 28, 128, 256, 3, 3, [2, 2], [1, 1]], {"i": 49866867, "t": "", "c": null, "e": [["tile_f", "sp", [4, 2, 16, 1]], ["tile_y", "sp", [1, 7, 2, 1]], ["tile_x", "sp", [7, 1, 2, 1]], ["tile_rc", "sp", [32, 8, 1]], ["tile_ry", "sp", [3, 1, 1]], ["tile_rx", "sp", [3, 1, 1]], ["auto_unroll_max_step", "ot", 512], ["unroll_explicit", "ot", 1]]}], "r": [[0.0009445667531914893], 0, 2.054487466812134, 1544136208.9767141], "v": 0.1}
{"i": ["cuda", "conv2d_no_batching", [1, 28, 28, 128, 256, 3, 3, [2, 2], [1, 1]], {}, ["conv2d_no_batching", 1, 28, 28, 128, 256, 3, 3, [2, 2], [1, 1]], {"i": 29856488, "t": "", "c": null, "e": [["tile_f", "sp", [64, 1, 2, 1]], ["tile_y", "sp", [7, 1, 2, 1]], ["tile_x", "sp", [1, 1, 2, 7]], ["tile_rc", "sp", [8, 4, 8]], ["tile_ry", "sp", [3, 1, 1]], ["tile_rx", "sp", [1, 3, 1]], ["auto_unroll_max_step", "ot", 1500], ["unroll_explicit", "ot", 0]]}], "r": [[0.0016920142553191488], 0, 3.9162237644195557, 1544136211.4089658], "v": 0.1}
{"i": ["cuda", "conv2d_no_batching", [1, 28, 28, 128, 256, 3, 3, [2, 2], [1, 1]], {}, ["conv2d_no_batching", 1, 28, 28, 128, 256, 3, 3, [2, 2], [1, 1]], {"i": 20801854, "t": "", "c": null, "e": [["tile_f", "sp", [4, 1, 4, 8]], ["tile_y", "sp", [7, 1, 2, 1]], ["tile_x", "sp", [2, 7, 1, 1]], ["tile_rc", "sp", [64, 4, 1]], ["tile_ry", "sp", [3, 1, 1]], ["tile_rx", "sp", [1, 1, 3]], ["auto_unroll_max_step", "ot", 512], ["unroll_explicit", "ot", 0]]}], "r": [[0.0018139329361702128], 0, 3.147188901901245, 1544136278.2341194], "v": 0.1}
{"i": ["cuda", "conv2d_no_batching", [1, 28, 28, 128, 256, 3, 3, [2, 2], [1, 1]], {}, ["conv2d_no_batching", 1, 28, 28, 128, 256, 3, 3, [2, 2], [1, 1]], {"i": 58126654, "t": "", "c": null, "e": [["tile_f", "sp", [4, 1, 4, 8]], ["tile_y", "sp", [7, 1, 2, 1]], ["tile_x", "sp", [2, 7, 1, 1]], ["tile_rc", "sp", [64, 4, 1]], ["tile_ry", "sp", [3, 1, 1]], ["tile_rx", "sp", [1, 1, 3]], ["auto_unroll_max_step", "ot", 512], ["unroll_explicit", "ot", 1]]}], "r": [[0.0010546416765957448], 0, 2.2608933448791504, 1544136279.9800885], "v": 0.1}
{"i": ["cuda", "conv2d_no_batching", [1, 28, 28, 128, 256, 3, 3, [2, 2], [1, 1]], {}, ["conv2d_no_batching", 1, 28, 28, 128, 256, 3, 3, [2, 2], [1, 1]], {"i": 58130014, "t": "", "c": null, "e": [["tile_f", "sp", [4, 1, 4, 8]], ["tile_y", "sp", [14, 1, 1, 1]], ["tile_x", "sp", [7, 1, 2, 1]], ["tile_rc", "sp", [64, 4, 1]], ["tile_ry", "sp", [3, 1, 1]], ["tile_rx", "sp", [1, 1, 3]], ["auto_unroll_max_step", "ot", 512], ["unroll_explicit", "ot", 1]]}], "r": [[0.0004946360425531915], 0, 1.606520652770996, 1544136281.2029037], "v": 0.1}
{"i": ["cuda", "conv2d_no_batching", [1, 28, 28, 128, 256, 3, 3, [2, 2], [1, 1]], {}, ["conv2d_no_batching", 1, 28, 28, 128, 256, 3, 3, [2, 2], [1, 1]], {"i": 20805214, "t": "", "c": null, "e": [["tile_f", "sp", [4, 1, 4, 8]], ["tile_y", "sp", [14, 1, 1, 1]], ["tile_x", "sp", [7, 1, 2, 1]], ["tile_rc", "sp", [64, 4, 1]], ["tile_ry", "sp", [3, 1, 1]], ["tile_rx", "sp", [1, 1, 3]], ["auto_unroll_max_step", "ot", 512], ["unroll_explicit", "ot", 0]]}], "r": [[0.0005701994212765957], 0, 1.6255180835723877, 1544136282.508006], "v": 0.1}
