baseline/conv2d_c7_itervar_n100_4.log
{"i": ["cuda", "conv2d_no_batching", [1, 28, 28, 128, 256, 3, 3, [2, 2], [1, 1]], {}, ["conv2d_no_batching", 1, 28, 28, 128, 256, 3, 3, [2, 2], [1, 1]], {"i": 56994683, "t": "", "c": null, "e": [["tile_f", "sp", [1, 2, 16, 4]], ["tile_y", "sp", [1, 1, 7, 2]], ["tile_x", "sp", [7, 1, 2, 1]], ["tile_rc", "sp", [64, 2, 2]], ["tile_ry", "sp", [1, 1, 3]], ["tile_rx", "sp", [1, 3, 1]], ["auto_unroll_max_step", "ot", 512], ["unroll_explicit", "ot", 1]]}], "r": [[0.00021148301041666668], 0, 1.55527925491333, 1544136787.369383], "v": 0.1}
{"i": ["cuda", "conv2d_no_batching", [1, 28, 28, 128, 256, 3, 3, [2, 2], [1, 1]], {}, ["conv2d_no_batching", 1, 28, 28, 128, 256, 3, 3, [2, 2], [1, 1]], {"i": 7048251, "t": "", "c": null, "e": [["tile_f", "sp", [4, 4, 4, 2]], ["tile_y", "sp", [1, 1, 1, 14]], ["tile_x", "sp", [2, 1, 7, 1]], ["tile_rc", "sp", [16, 16, 1]], ["tile_ry", "sp", [1, 1, 3]], ["tile_rx", "sp", [1, 3, 1]], ["auto_unroll_max_step", "ot", 0], ["unroll_explicit", "ot", 0]]}], "r": [[0.0023750032055137845], 0, 3.99841046333313, 1544136712.4226336], "v": 0.1}
{"i": ["cuda", "conv2d_no_batching", [1, 28, 28, 128, 256, 3, 3, [2, 2], [1, 1]], {}, ["conv2d_no_batching", 1, 28, 28, 128, 256, 3, 3, [2, 2], [1, 1]], {"i": 4902509, "t": "", "c": null, "e": [["tile_f", "sp", [1, 8, 16, 1]], ["tile_y", "sp", [2, 1, 7, 1]], ["tile_x", "sp", [7, 1, 1, 2]], ["tile_rc", "sp", [32, 1, 8]], ["tile_ry", "sp", [3, 1, 1]], ["tile_rx", "sp", [1, 3, 1]], ["auto_unroll_max_step", "ot", 0], ["unroll_explicit", "ot", 0]]}], "r": [[0.0007673953258145363], 0, 2.0678086280822754, 1544136714.1686313], "v": 0.1}
{"i": ["cuda", "conv2d_no_batching", [1, 28, 28, 128, 256, 3, 3, [2, 2], [1, 1]], {}, ["conv2d_no_batching", 1, 28, 28, 128, 256, 3, 3, [2, 2], [1, 1]], {"i": 1727522, "t": "", "c": null, "e": [["tile_f", "sp", [32, 4, 1, 1]], ["tile_y", "sp", [2, 1, 1, 7]], ["tile_x", "sp", [1, 14, 1, 1]], ["tile_rc", "sp", [32, 4, 2]], ["tile_ry", "sp", [1, 3, 1]], ["tile_rx", "sp", [3, 1, 1]], ["auto_unroll_max_step", "ot", 0], ["unroll_explicit", "ot", 0]]}], "r": [[0.08504803925], 0, 2.837693214416504, 1544136675.0471299], "v": 0.1}
{"i": ["cuda", "conv2d_no_batching", [1, 28, 28, 128, 256, 3, 3, [2, 2], [1, 1]], {}, ["conv2d_no_batching", 1, 28, 28, 128, 256, 3, 3, [2, 2], [1, 1]], {"i": 73814324, "t": "", "c": null, "e": [["tile_f", "sp", [16, 2, 2, 2]], ["tile_y", "sp", [1, 1, 1, 14]], ["tile_x", "sp", [2, 1, 1, 7]], ["tile_rc", "sp", [64, 1, 4]], ["tile_ry", "sp", [1, 1, 3]], ["tile_rx", "sp", [1, 1, 3]], ["auto_unroll_max_step", "ot", 1500], ["unroll_explicit", "ot", 1]]}], "r": [[0.016346380669172933], 0, 27.393765926361084, 1544136734.99988], "v": 0.1}
{"i": ["cuda", "conv2d_no_batching", [1, 28, 28, 128, 256, 3, 3, [2, 2], [1, 1]], {}, ["conv2d_no_batching", 1, 28, 28, 128, 256, 3, 3, [2, 2], [1, 1]], {"i": 29084089, "t": "", "c": null, "e": [["tile_f", "sp", [16, 1, 4, 2]], ["tile_y", "sp", [1, 1, 1, 14]], ["tile_x", "sp", [1, 1, 7, 2]], ["tile_rc", "sp", [128, 2, 1]], ["tile_ry", "sp", [3, 1, 1]], ["tile_rx", "sp", [1, 3, 1]], ["auto_unroll_max_step", "ot", 1500], ["unroll_explicit", "ot", 0]]}], "r": [[0.006222066528822056], 0, 9.145936250686646, 1544136743.4098802], "v": 0.1}
{"i": ["cuda", "conv2d_no_batching", [1, 28, 28, 128, 256, 3, 3, [2, 2], [1, 1]], {}, ["conv2d_no_batching", 1, 28, 28, 128, 256, 3, 3, [2, 2], [1, 1]], {"i": 39661577, "t": "", "c": null, "e": [["tile_f", "sp", [8, 4, 4, 1]], ["tile_y", "sp", [7, 2, 1, 1]], ["tile_x", "sp", [7, 2, 1, 1]], ["tile_rc", "sp", [8, 2, 16]], ["tile_ry", "sp", [1, 3, 1]], ["tile_rx", "sp", [3, 1, 1]], ["auto_unroll_max_step", "ot", 0], ["unroll_explicit", "ot", 1]]}], "r": [[0.0015539204511278196], 0, 2.984186887741089, 1544136746.1055887], "v": 0.1}
{"i": ["cuda", "conv2d_no_batching", [1, 28, 28, 128, 256, 3, 3, [2, 2], [1, 1]], {}, ["conv2d_no_batching", 1, 28, 28, 128, 256, 3, 3, [2, 2], [1, 1]], {"i": 41568716, "t": "", "c": null, "e": [["tile_f", "sp", [2, 1, 1, 64]], ["tile_y", "sp", [1, 7, 2, 1]], ["tile_x", "sp", [2, 7, 1, 1]], ["tile_rc", "sp", [32, 8, 1]], ["tile_ry", "sp", [3, 1, 1]], ["tile_rx", "sp", [1, 3, 1]], ["auto_unroll_max_step", "ot", 0], ["unroll_explicit", "ot", 1]]}], "r": [[0.2524020115], 0, 6.2209649085998535, 1544136688.1128664], "v": 0.1}
{"i": ["cuda", "conv2d_no_batching", [1, 28, 28, 128, 256, 3, 3, [2, 2], [1, 1]], {}, ["conv2d_no_batching", 1, 28, 28, 128, 256, 3, 3, [2, 2], [1, 1]], {"i": 72472193, "t": "", "c": null, "e": [["tile_f", "sp", [2, 1, 2, 32]], ["tile_y", "sp", [1, 1, 2, 7]], ["tile_x", "sp", [7, 2, 1, 1]], ["tile_rc", "sp", [16, 4, 4]], ["tile_ry", "sp", [1, 3, 1]], ["tile_rx", "sp", [1, 1, 3]], ["auto_unroll_max_step", "ot", 1500], ["unroll_explicit", "ot", 1]]}], "r": [[0.01779023571177945], 0, 28.393506288528442, 1544136768.5444336], "v": 0.1}
{"i": ["cuda", "conv2d_no_batching", [1, 28, 28, 128, 256, 3, 3, [2, 2], [1, 1]], {}, ["conv2d_no_batching", 1, 28, 28, 128, 256, 3, 3, [2, 2], [1, 1]], {"i": 13190050, "t": "", "c": null, "e": [["tile_f", "sp", [16, 4, 2, 1]], ["tile_y", "sp", [1, 2, 1, 7]], ["tile_x", "sp", [1, 7, 2, 1]], ["tile_rc", "sp", [32, 1, 8]], ["tile_ry", "sp", [3, 1, 1]], ["tile_rx", "sp", [3, 1, 1]], ["auto_unroll_max_step", "ot", 512], ["unroll_explicit", "ot", 0]]}], "r": [[0.088810056], 0, 3.0443460941314697, 1544136694.392537], "v": 0.1}
{"i": ["cuda", "conv2d_no_batching", [1, 28, 28, 128, 256, 3, 3, [2, 2], [1, 1]], {}, ["conv2d_no_batching", 1, 28, 28, 128, 256, 3, 3, [2, 2], [1, 1]], {"i": 45981570, "t": "", "c": null, "e": [["tile_f", "sp", [8, 1, 2, 8]], ["tile_y", "sp", [1, 1, 7, 2]], ["tile_x", "sp", [2, 1, 1, 7]], ["tile_rc", "sp", [32, 4, 2]], ["tile_ry", "sp", [3, 1, 1]], ["tile_rx", "sp", [1, 1, 3]], ["auto_unroll_max_step", "ot", 0], ["unroll_explicit", "ot", 1]]}], "r": [[0.006819245771929825], 0, 9.425965070724487, 1544136777.5787003], "v": 0.1}
{"i": ["cuda", "conv2d_no_batching", [1, 28, 28, 128, 256, 3, 3, [2, 2], [1, 1]], {}, ["conv2d_no_batching", 1, 28, 28, 128, 256, 3, 3, [2, 2], [1, 1]], {"i": 26582477, "t": "", "c": null, "e": [["tile_f", "sp", [2, 4, 4, 4]], ["tile_y", "sp", [14, 1, 1, 1]], ["tile_x", "sp", [1, 7, 2, 1]], ["tile_rc", "sp", [64, 2, 2]], ["tile_ry", "sp", [1, 3, 1]], ["tile_rx", "sp", [3, 1, 1]], ["auto_unroll_max_step", "ot", 1500], ["unroll_explicit", "ot", 0]]}], "r": [[0.0010815037769423559], 0, 2.6885550022125244, 1544136779.7578478], "v": 0.1}
{"i": ["cuda", "conv2d_no_batching", [1, 28, 28, 128, 256, 3, 3, [2, 2], [1, 1]], {}, ["conv2d_no_batching", 1, 28, 28, 128, 256, 3, 3, [2, 2], [1, 1]], {"i": 63683191, "t": "", "c": null, "e": [["tile_f", "sp", [2, 2, 32, 1]], ["tile_y", "sp", [1, 7, 2, 1]], ["tile_x", "sp", [14, 1, 1, 1]], ["tile_rc", "sp", [32, 8, 1]], ["tile_ry", "sp", [1, 3, 1]], ["tile_rx", "sp", [3, 1, 1]], ["auto_unroll_max_step", "ot", 1500], ["unroll_explicit", "ot", 1]]}], "r": [[0.0005558443107769424], 0, 1.982093095779419, 1544136781.2844021], "v": 0.1}
{"i": ["cuda", "conv2d_no_batching", [1, 28, 28, 128, 256, 3, 3, [2, 2], [1, 1]], {}, ["conv2d_no_batching", 1, 28, 28, 128, 256, 3, 3, [2, 2], [1, 1]], {"i": 19660669, "t": "", "c": null, "e": [["tile_f", "sp", [1, 1, 8, 16]], ["tile_y", "sp", [1, 1, 2, 7]], ["tile_x", "sp", [1, 1, 1, 14]], ["tile_rc", "sp", [128, 1, 2]], ["tile_ry", "sp", [1, 1, 3]], ["tile_rx", "sp", [1, 3, 1]], ["auto_unroll_max_step", "ot", 512], ["unroll_explicit", "ot", 0]]}], "r": [[0.07794236075], 0, 6.0870444774627686, 1544136703.2409852], "v": 0.1}
{"i": ["cuda", "conv2d_no_batching", [1, 28, 28, 128, 256, 3, 3, [2, 2], [1, 1]], {}, ["conv2d_no_batching", 1, 28, 28, 128, 256, 3, 3, [2, 2], [1, 1]], {"i": 63073969, "t": "", "c": null, "e": [["tile_f", "sp", [16, 1, 4, 2]], ["tile_y", "sp", [14, 1, 1, 1]], ["tile_x", "sp", [1, 14, 1, 1]], ["tile_rc", "sp", [2, 16, 8]], ["tile_ry", "sp", [3, 1, 1]], ["tile_rx", "sp", [3, 1, 1]], ["auto_unroll_max_step", "ot", 1500], ["unroll_explicit", "ot", 1]]}], "r": [[0.0009834554536340852], 0, 5.2043516635894775, 1544136783.5990906], "v": 0.1}
{"i": ["cuda", "conv2d_no_batching", [1, 28, 28, 128, 256, 3, 3, [2, 2], [1, 1]], {}, ["conv2d_no_batching", 1, 28, 28, 128, 256, 3, 3, [2, 2], [1, 1]], {"i": 30999506, "t": "", "c": null, "e": [["tile_f", "sp", [8, 1, 16, 1]], ["tile_y", "sp", [7, 1, 1, 2]], ["tile_x", "sp", [7, 2, 1, 1]], ["tile_rc", "sp", [16, 4, 4]], ["tile_ry", "sp", [1, 3, 1]], ["tile_rx", "sp", [1, 3, 1]], ["auto_unroll_max_step", "ot", 1500], ["unroll_explicit", "ot", 0]]}], "r": [[0.0002560181754385965], 0, 1.517197847366333, 1544136784.7500863], "v": 0.1}
{"i": ["cuda", "conv2d_no_batching", [1, 28, 28, 128, 256, 3, 3, [2, 2], [1, 1]], {}, ["conv2d_no_batching", 1, 28, 28, 128, 256, 3, 3, [2, 2], [1, 1]], {"i": 33584809, "t": "", "c": null, "e": [["tile_f", "sp", [16, 1, 4, 2]], ["tile_y", "sp", [7, 2, 1, 1]], ["tile_x", "sp", [7, 1, 2, 1]], ["tile_rc", "sp", [8, 16, 2]], ["tile_ry", "sp", [3, 1, 1]], ["tile_rx", "sp", [1, 1, 3]], ["auto_unroll_max_step", "ot", 1500], ["unroll_explicit", "ot", 0]]}], "r": [[0.00048303446616541353], 0, 1.9350576400756836, 1544136786.2319343], "v": 0.1}
{"i": ["cuda", "conv2d_no_batching", [1, 28, 28, 128, 256, 3, 3, [2, 2], [1, 1]], {}, ["conv2d_no_batching", 1, 28, 28, 128, 256, 3, 3, [2, 2], [1, 1]], {"i": 32094017, "t": "", "c": null, "e": [["tile_f", "sp", [8, 4, 4, 1]], ["tile_y", "sp", [1, 7, 1, 2]], ["tile_x", "sp", [1, 1, 7, 2]], ["tile_rc", "sp", [128, 1, 2]], ["tile_ry", "sp", [1, 1, 3]], ["tile_rx", "sp", [1, 3, 1]], ["auto_unroll_max_step", "ot", 1500], ["unroll_explicit", "ot", 0]]}], "r": [[0.004018781797916667], 0, 9.428196907043457, 1544136809.21365], "v": 0.1}
{"i": ["cuda", "conv2d_no_batching", [1, 28, 28, 128, 256, 3, 3, [2, 2], [1, 1]], {}, ["conv2d_no_batching", 1, 28, 28, 128, 256, 3, 3, [2, 2], [1, 1]], {"i": 67878878, "t": "", "c": null, "e": [["tile_f", "sp", [16, 4, 1, 2]], ["tile_y", "sp", [7, 1, 1, 2]], ["tile_x", "sp", [7, 1, 1, 2]], ["tile_rc", "sp", [16, 16, 1]], ["tile_ry", "sp", [1, 3, 1]], ["tile_rx", "sp", [1, 3, 1]], ["auto_unroll_max_step", "ot", 1500], ["unroll_explicit", "ot", 1]]}], "r": [[0.001299089675], 0, 6.702907085418701, 1544136813.3661234], "v": 0.1}
{"i": ["cuda", "conv2d_no_batching", [1, 28, 28, 128, 256, 3, 3, [2, 2], [1, 1]], {}, ["conv2d_no_batching", 1, 28, 28, 128, 256, 3, 3, [2, 2], [1, 1]], {"i": 40860165, "t": "", "c": null, "e": [["tile_f", "sp", [8, 4, 2, 2]], ["tile_y", "sp", [1, 7, 2, 1]], ["tile_x", "sp", [7, 2, 1, 1]], ["tile_rc", "sp", [16, 2, 8]], ["tile_ry", "sp", [1, 1, 3]], ["tile_rx", "sp", [3, 1, 1]], ["auto_unroll_max_step", "ot", 0], ["unroll_explicit", "ot", 1]]}], "r": [[0.004332120641666667], 0, 7.806061506271362, 1544136820.801904], "v": 0.1}
{"i": ["cuda", "conv2d_no_batching", [1, 28, 28, 128, 256, 3, 3, [2, 2], [1, 1]], {}, ["conv2d_no_batching", 1, 28, 28, 128, 256, 3, 3, [2, 2], [1, 1]], {"i": 7517630, "t": "", "c": null, "e": [["tile_f", "sp", [4, 1, 1, 32]], ["tile_y", "sp", [2, 1, 7, 1]], ["tile_x", "sp", [1, 1, 7, 2]], ["tile_rc", "sp", [16, 4, 4]], ["tile_ry", "sp", [1, 1, 3]], ["tile_rx", "sp", [1, 3, 1]], ["auto_unroll_max_step", "ot", 0], ["unroll_explicit", "ot", 0]]}], "r": [[0.0024471599979166664], 0, 4.896478891372681, 1544136858.9752297], "v": 0.1}
{"i": ["cuda", "conv2d_no_batching", [1, 28, 28, 128, 256, 3, 3, [2, 2], [1, 1]], {}, ["conv2d_no_batching", 1, 28, 28, 128, 256, 3, 3, [2, 2], [1, 1]], {"i": 27664631, "t": "", "c": null, "e": [["tile_f", "sp", [8, 2, 2, 4]], ["tile_y", "sp", [1, 7, 1, 2]], ["tile_x", "sp", [1, 1, 14, 1]], ["tile_rc", "sp", [256, 1, 1]], ["tile_ry", "sp", [1, 1, 3]], ["tile_rx", "sp", [3, 1, 1]], ["auto_unroll_max_step", "ot", 1500], ["unroll_explicit", "ot", 0]]}], "r": [[0.004544188485416667], 0, 8.7109375, 1544136867.3616102], "v": 0.1}
{"i": ["cuda", "conv2d_no_batching", [1, 28, 28, 128, 256, 3, 3, [2, 2], [1, 1]], {}, ["conv2d_no_batching", 1, 28, 28, 128, 256, 3, 3, [2, 2], [1, 1]], {"i": 56054459, "t": "", "c": null, "e": [["tile_f", "sp", [2, 2, 16, 2]], ["tile_y", "sp", [14, 1, 1, 1]], ["tile_x", "sp", [1, 1, 7, 2]], ["tile_rc", "sp", [32, 1, 8]], ["tile_ry", "sp", [1, 3, 1]], ["tile_rx", "sp", [1, 3, 1]], ["auto_unroll_max_step", "ot", 512], ["unroll_explicit", "ot", 1]]}], "r": [[0.0001388932152777778], 0, 1.6594147682189941, 1544136949.260944], "v": 0.1}
{"i": ["cuda", "conv2d_no_batching", [1, 28, 28, 128, 256, 3, 3, [2, 2], [1, 1]], {}, ["conv2d_no_batching", 1, 28, 28, 128, 256, 3, 3, [2, 2], [1, 1]], {"i": 67826453, "t": "", "c": null, "e": [["tile_f", "sp", [1, 16, 4, 2]], ["tile_y", "sp", [7, 1, 2, 1]], ["tile_x", "sp", [1, 1, 2, 7]], ["tile_rc", "sp", [64, 4, 1]], ["tile_ry", "sp", [1, 3, 1]], ["tile_rx", "sp", [1, 3, 1]], ["auto_unroll_max_step", "ot", 1500], ["unroll_explicit", "ot", 1]]}], "r": [[0.0030421879479166666], 0, 7.487665176391602, 1544136907.8628893], "v": 0.1}
{"i": ["cuda", "conv2d_no_batching", [1, 28, 28, 128, 256, 3, 3, [2, 2], [1, 1]], {}, ["conv2d_no_batching", 1, 28, 28, 128, 256, 3, 3, [2, 2], [1, 1]], {"i": 3941797, "t": "", "c": null, "e": [["tile_f", "sp", [32, 2, 1, 2]], ["tile_y", "sp", [14, 1, 1, 1]], ["tile_x", "sp", [1, 7, 2, 1]], ["tile_rc", "sp", [1, 8, 32]], ["tile_ry", "sp", [1, 1, 3]], ["tile_rx", "sp", [3, 1, 1]], ["auto_unroll_max_step", "ot", 0], ["unroll_explicit", "ot", 0]]}], "r": [[0.016612127129166668], 0, 25.338424682617188, 1544136933.1629176], "v": 0.1}
{"i": ["cuda", "conv2d_no_batching", [1, 28, 28, 128, 256, 3, 3, [2, 2], [1, 1]], {}, ["conv2d_no_batching", 1, 28, 28, 128, 256, 3, 3, [2, 2], [1, 1]], {"i": 46709996, "t": "", "c": null, "e": [["tile_f", "sp", [2, 1, 1, 64]], ["tile_y", "sp", [7, 2, 1, 1]], ["tile_x", "sp", [1, 1, 14, 1]], ["tile_rc", "sp", [8, 1, 32]], ["tile_ry", "sp", [3, 1, 1]], ["tile_rx", "sp", [1, 1, 3]], ["auto_unroll_max_step", "ot", 0], ["unroll_explicit", "ot", 1]]}], "r": [[0.009121504764583333], 0, 14.681714057922363, 1544136947.90247], "v": 0.1}
{"i": ["cuda", "conv2d_no_batching", [1, 28, 28, 128, 256, 3, 3, [2, 2], [1, 1]], {}, ["conv2d_no_batching", 1, 28, 28, 128, 256, 3, 3, [2, 2], [1, 1]], {"i": 5563974, "t": "", "c": null, "e": [["tile_f", "sp", [8, 1, 8, 2]], ["tile_y", "sp", [1, 1, 2, 7]], ["tile_x", "sp", [7, 2, 1, 1]], ["tile_rc", "sp", [128, 2, 1]], ["tile_ry", "sp", [1, 3, 1]], ["tile_rx", "sp", [1, 3, 1]], ["auto_unroll_max_step", "ot", 0], ["unroll_explicit", "ot", 0]]}], "r": [[0.0007952850597222222], 0, 3.0419647693634033, 1544137017.9111583], "v": 0.1}
{"i": ["cuda", "conv2d_no_batching", [1, 28, 28, 128, 256, 3, 3, [2, 2], [1, 1]], {}, ["conv2d_no_batching", 1, 28, 28, 128, 256, 3, 3, [2, 2], [1, 1]], {"i": 18251334, "t": "", "c": null, "e": [["tile_f", "sp", [8, 1, 8, 2]], ["tile_y", "sp", [1, 1, 2, 7]], ["tile_x", "sp", [7, 2, 1, 1]], ["tile_rc", "sp", [128, 1, 2]], ["tile_ry", "sp", [1, 3, 1]], ["tile_rx", "sp", [1, 3, 1]], ["auto_unroll_max_step", "ot", 512], ["unroll_explicit", "ot", 0]]}], "r": [[0.0006995009902777778], 0, 2.99318528175354, 1544137020.5113742], "v": 0.1}
{"i": ["cuda", "conv2d_no_batching", [1, 28, 28, 128, 256, 3, 3, [2, 2], [1, 1]], {}, ["conv2d_no_batching", 1, 28, 28, 128, 256, 3, 3, [2, 2], [1, 1]], {"i": 30692934, "t": "", "c": null, "e": [["tile_f", "sp", [8, 1, 8, 2]], ["tile_y", "sp", [1, 1, 2, 7]], ["tile_x", "sp", [7, 2, 1, 1]], ["tile_rc", "sp", [128, 1, 2]], ["tile_ry", "sp", [1, 3, 1]], ["tile_rx", "sp", [1, 3, 1]], ["auto_unroll_max_step", "ot", 1500], ["unroll_explicit", "ot", 0]]}], "r": [[0.000747357848611111], 0, 3.1819233894348145, 1544137023.284235], "v": 0.1}
{"i": ["cuda", "conv2d_no_batching", [1, 28, 28, 128, 256, 3, 3, [2, 2], [1, 1]], {}, ["conv2d_no_batching", 1, 28, 28, 128, 256, 3, 3, [2, 2], [1, 1]], {"i": 67771974, "t": "", "c": null, "e": [["tile_f", "sp", [8, 1, 8, 2]], ["tile_y", "sp", [1, 1, 2, 7]], ["tile_x", "sp", [7, 2, 1, 1]], ["tile_rc", "sp", [128, 2, 1]], ["tile_ry", "sp", [1, 3, 1]], ["tile_rx", "sp", [1, 3, 1]], ["auto_unroll_max_step", "ot", 1500], ["unroll_explicit", "ot", 1]]}], "r": [[0.0004322037208333334], 0, 2.7348973751068115, 1544137025.3036892], "v": 0.1}
