baseline/conv2d_c7_itervar_n2000_3.log
{"i": ["cuda", "conv2d_no_batching", [1, 28, 28, 128, 256, 3, 3, [2, 2], [1, 1]], {}, ["conv2d_no_batching", 1, 28, 28, 128, 256, 3, 3, [2, 2], [1, 1]], {"i": 33487059, "t": "", "c": null, "e": [["tile_f", "sp", [1, 1, 16, 8]], ["tile_y", "sp", [2, 7, 1, 1]], ["tile_x", "sp", [7, 2, 1, 1]], ["tile_rc", "sp", [64, 2, 2]], ["tile_ry", "sp", [3, 1, 1]], ["tile_rx", "sp", [1, 1, 3]], ["auto_unroll_max_step", "ot", 1500], ["unroll_explicit", "ot", 0]]}], "r": [[0.001236635966442953], 0, 2.608893871307373, 1544143175.3481328], "v": 0.1}
{"i": ["cuda", "conv2d_no_batching", [1, 28, 28, 128, 256, 3, 3, [2, 2], [1, 1]], {}, ["conv2d_no_batching", 1, 28, 28, 128, 256, 3, 3, [2, 2], [1, 1]], {"i": 47360144, "t": "", "c": null, "e": [["tile_f", "sp", [4, 1, 2, 16]], ["tile_y", "sp", [1, 1, 7, 2]], ["tile_x", "sp", [1, 7, 1, 2]], ["tile_rc", "sp", [32, 4, 2]], ["tile_ry", "sp", [1, 3, 1]], ["tile_rx", "sp", [1, 1, 3]], ["auto_unroll_max_step", "ot", 0], ["unroll_explicit", "ot", 1]]}], "r": [[0.014260888402684564], 0, 14.412364959716797, 1544143189.171884], "v": 0.1}
{"i": ["cuda", "conv2d_no_batching", [1, 28, 28, 128, 256, 3, 3, [2, 2], [1, 1]], {}, ["conv2d_no_batching", 1, 28, 28, 128, 256, 3, 3, [2, 2], [1, 1]], {"i": 8879818, "t": "", "c": null, "e": [["tile_f", "sp", [4, 1, 16, 2]], ["tile_y", "sp", [1, 1, 2, 7]], ["tile_x", "sp", [14, 1, 1, 1]], ["tile_rc", "sp", [16, 4, 4]], ["tile_ry", "sp", [3, 1, 1]], ["tile_rx", "sp", [1, 1, 3]], ["auto_unroll_max_step", "ot", 0], ["unroll_explicit", "ot", 0]]}], "r": [[0.0003122541308411215], 0, 1.6341052055358887, 1544143234.4157145], "v": 0.1}
{"i": ["cuda", "conv2d_no_batching", [1, 28, 28, 128, 256, 3, 3, [2, 2], [1, 1]], {}, ["conv2d_no_batching", 1, 28, 28, 128, 256, 3, 3, [2, 2], [1, 1]], {"i": 35091152, "t": "", "c": null, "e": [["tile_f", "sp", [1, 4, 32, 1]], ["tile_y", "sp", [1, 7, 1, 2]], ["tile_x", "sp", [7, 1, 2, 1]], ["tile_rc", "sp", [64, 1, 4]], ["tile_ry", "sp", [1, 3, 1]], ["tile_rx", "sp", [1, 1, 3]], ["auto_unroll_max_step", "ot", 1500], ["unroll_explicit", "ot", 0]]}], "r": [[0.0005891810872483221], 0, 2.0168886184692383, 1544143192.0038824], "v": 0.1}
{"i": ["cuda", "conv2d_no_batching", [1, 28, 28, 128, 256, 3, 3, [2, 2], [1, 1]], {}, ["conv2d_no_batching", 1, 28, 28, 128, 256, 3, 3, [2, 2], [1, 1]], {"i": 51253909, "t": "", "c": null, "e": [["tile_f", "sp", [1, 1, 8, 16]], ["tile_y", "sp", [1, 1, 7, 2]], ["tile_x", "sp", [2, 1, 7, 1]], ["tile_rc", "sp", [32, 8, 1]], ["tile_ry", "sp", [1, 3, 1]], ["tile_rx", "sp", [3, 1, 1]], ["auto_unroll_max_step", "ot", 512], ["unroll_explicit", "ot", 1]]}], "r": [[0.0007534743825503356], 0, 2.094615936279297, 1544143193.733138], "v": 0.1}
{"i": ["cuda", "conv2d_no_batching", [1, 28, 28, 128, 256, 3, 3, [2, 2], [1, 1]], {}, ["conv2d_no_batching", 1, 28, 28, 128, 256, 3, 3, [2, 2], [1, 1]], {"i": 54342913, "t": "", "c": null, "e": [["tile_f", "sp", [2, 8, 2, 4]], ["tile_y", "sp", [7, 1, 1, 2]], ["tile_x", "sp", [1, 1, 1, 14]], ["tile_rc", "sp", [8, 16, 2]], ["tile_ry", "sp", [3, 1, 1]], ["tile_rx", "sp", [1, 3, 1]], ["auto_unroll_max_step", "ot", 512], ["unroll_explicit", "ot", 1]]}], "r": [[0.021459519523489932], 0, 21.94972515106201, 1544143214.0831745], "v": 0.1}
{"i": ["cuda", "conv2d_no_batching", [1, 28, 28, 128, 256, 3, 3, [2, 2], [1, 1]], {}, ["conv2d_no_batching", 1, 28, 28, 128, 256, 3, 3, [2, 2], [1, 1]], {"i": 48665748, "t": "", "c": null, "e": [["tile_f", "sp", [1, 2, 4, 16]], ["tile_y", "sp", [1, 1, 7, 2]], ["tile_x", "sp", [2, 7, 1, 1]], ["tile_rc", "sp", [128, 1, 2]], ["tile_ry", "sp", [1, 1, 3]], ["tile_rx", "sp", [1, 1, 3]], ["auto_unroll_max_step", "ot", 0], ["unroll_explicit", "ot", 1]]}], "r": [[0.0251254995], 0, 2.1985373497009277, 1544143151.8640924], "v": 0.1}
{"i": ["cuda", "conv2d_no_batching", [1, 28, 28, 128, 256, 3, 3, [2, 2], [1, 1]], {}, ["conv2d_no_batching", 1, 28, 28, 128, 256, 3, 3, [2, 2], [1, 1]], {"i": 8593679, "t": "", "c": null, "e": [["tile_f", "sp", [1, 1, 1, 128]], ["tile_y", "sp", [1, 2, 1, 7]], ["tile_x", "sp", [1, 1, 7, 2]], ["tile_rc", "sp", [128, 1, 2]], ["tile_ry", "sp", [3, 1, 1]], ["tile_rx", "sp", [1, 1, 3]], ["auto_unroll_max_step", "ot", 0], ["unroll_explicit", "ot", 0]]}], "r": [[0.09446153625], 0, 2.8871405124664307, 1544143155.379721], "v": 0.1}
{"i": ["cuda", "conv2d_no_batching", [1, 28, 28, 128, 256, 3, 3, [2, 2], [1, 1]], {}, ["conv2d_no_batching", 1, 28, 28, 128, 256, 3, 3, [2, 2], [1, 1]], {"i": 49900832, "t": "", "c": null, "e": [["tile_f", "sp", [1, 4, 32, 1]], ["tile_y", "sp", [14, 1, 1, 1]], ["tile_x", "sp", [2, 1, 7, 1]], ["tile_rc", "sp", [16, 16, 1]], ["tile_ry", "sp", [3, 1, 1]], ["tile_rx", "sp", [3, 1, 1]], ["auto_unroll_max_step", "ot", 512], ["unroll_explicit", "ot", 1]]}], "r": [[0.00033214640498442367], 0, 1.7872185707092285, 1544143235.7893734], "v": 0.1}
{"i": ["cuda", "conv2d_no_batching", [1, 28, 28, 128, 256, 3, 3, [2, 2], [1, 1]], {}, ["conv2d_no_batching", 1, 28, 28, 128, 256, 3, 3, [2, 2], [1, 1]], {"i": 4184341, "t": "", "c": null, "e": [["tile_f", "sp", [2, 1, 32, 2]], ["tile_y", "sp", [1, 7, 2, 1]], ["tile_x", "sp", [1, 14, 1, 1]], ["tile_rc", "sp", [128, 2, 1]], ["tile_ry", "sp", [3, 1, 1]], ["tile_rx", "sp", [1, 3, 1]], ["auto_unroll_max_step", "ot", 0], ["unroll_explicit", "ot", 0]]}], "r": [[0.003347844318791946], 0, 4.571055173873901, 1544143219.3520865], "v": 0.1}
{"i": ["cuda", "conv2d_no_batching", [1, 28, 28, 128, 256, 3, 3, [2, 2], [1, 1]], {}, ["conv2d_no_batching", 1, 28, 28, 128, 256, 3, 3, [2, 2], [1, 1]], {"i": 38266382, "t": "", "c": null, "e": [["tile_f", "sp", [1, 2, 32, 2]], ["tile_y", "sp", [2, 1, 7, 1]], ["tile_x", "sp", [1, 7, 1, 2]], ["tile_rc", "sp", [16, 1, 16]], ["tile_ry", "sp", [3, 1, 1]], ["tile_rx", "sp", [3, 1, 1]], ["auto_unroll_max_step", "ot", 0], ["unroll_explicit", "ot", 1]]}], "r": [[0.002571945489932886], 0, 3.7048511505126953, 1544143222.6331854], "v": 0.1}
{"i": ["cuda", "conv2d_no_batching", [1, 28, 28, 128, 256, 3, 3, [2, 2], [1, 1]], {}, ["conv2d_no_batching", 1, 28, 28, 128, 256, 3, 3, [2, 2], [1, 1]], {"i": 18735622, "t": "", "c": null, "e": [["tile_f", "sp", [8, 2, 8, 1]], ["tile_y", "sp", [2, 7, 1, 1]], ["tile_x", "sp", [1, 1, 2, 7]], ["tile_rc", "sp", [32, 1, 8]], ["tile_ry", "sp", [1, 3, 1]], ["tile_rx", "sp", [1, 3, 1]], ["auto_unroll_max_step", "ot", 512], ["unroll_explicit", "ot", 0]]}], "r": [[0.009733680130872484], 0, 15.828278541564941, 1544143233.090879], "v": 0.1}
{"i": ["cuda", "conv2d_no_batching", [1, 28, 28, 128, 256, 3, 3, [2, 2], [1, 1]], {}, ["conv2d_no_batching", 1, 28, 28, 128, 256, 3, 3, [2, 2], [1, 1]], {"i": 18031465, "t": "", "c": null, "e": [["tile_f", "sp", [1, 16, 8, 1]], ["tile_y", "sp", [2, 1, 7, 1]], ["tile_x", "sp", [1, 1, 1, 14]], ["tile_rc", "sp", [128, 2, 1]], ["tile_ry", "sp", [1, 3, 1]], ["tile_rx", "sp", [1, 3, 1]], ["auto_unroll_max_step", "ot", 512], ["unroll_explicit", "ot", 0]]}], "r": [[0.004391895370716511], 0, 6.546348571777344, 1544143321.1853764], "v": 0.1}
{"i": ["cuda", "conv2d_no_batching", [1, 28, 28, 128, 256, 3, 3, [2, 2], [1, 1]], {}, ["conv2d_no_batching", 1, 28, 28, 128, 256, 3, 3, [2, 2], [1, 1]], {"i": 39026092, "t": "", "c": null, "e": [["tile_f", "sp", [2, 8, 4, 2]], ["tile_y", "sp", [7, 2, 1, 1]], ["tile_x", "sp", [2, 1, 7, 1]], ["tile_rc", "sp", [64, 2, 2]], ["tile_ry", "sp", [1, 3, 1]], ["tile_rx", "sp", [3, 1, 1]], ["auto_unroll_max_step", "ot", 0], ["unroll_explicit", "ot", 1]]}], "r": [[0.0014535083457943925], 0, 2.82009220123291, 1544143323.9895632], "v": 0.1}
{"i": ["cuda", "conv2d_no_batching", [1, 28, 28, 128, 256, 3, 3, [2, 2], [1, 1]], {}, ["conv2d_no_batching", 1, 28, 28, 128, 256, 3, 3, [2, 2], [1, 1]], {"i": 28591485, "t": "", "c": null, "e": [["tile_f", "sp", [8, 4, 2, 2]], ["tile_y", "sp", [2, 1, 7, 1]], ["tile_x", "sp", [1, 1, 7, 2]], ["tile_rc", "sp", [16, 1, 16]], ["tile_ry", "sp", [1, 1, 3]], ["tile_rx", "sp", [3, 1, 1]], ["auto_unroll_max_step", "ot", 1500], ["unroll_explicit", "ot", 0]]}], "r": [[0.0014949873956386292], 0, 7.990874528884888, 1544143363.6551178], "v": 0.1}
{"i": ["cuda", "conv2d_no_batching", [1, 28, 28, 128, 256, 3, 3, [2, 2], [1, 1]], {}, ["conv2d_no_batching", 1, 28, 28, 128, 256, 3, 3, [2, 2], [1, 1]], {"i": 16131143, "t": "", "c": null, "e": [["tile_f", "sp", [4, 4, 8, 1]], ["tile_y", "sp", [1, 7, 1, 2]], ["tile_x", "sp", [7, 2, 1, 1]], ["tile_rc", "sp", [16, 1, 16]], ["tile_ry", "sp", [1, 1, 3]], ["tile_rx", "sp", [3, 1, 1]], ["auto_unroll_max_step", "ot", 512], ["unroll_explicit", "ot", 0]]}], "r": [[0.003877322236760125], 0, 10.333279371261597, 1544143405.1457305], "v": 0.1}
{"i": ["cuda", "conv2d_no_batching", [1, 28, 28, 128, 256, 3, 3, [2, 2], [1, 1]], {}, ["conv2d_no_batching", 1, 28, 28, 128, 256, 3, 3, [2, 2], [1, 1]], {"i": 65749160, "t": "", "c": null, "e": [["tile_f", "sp", [2, 2, 8, 4]], ["tile_y", "sp", [1, 7, 2, 1]], ["tile_x", "sp", [7, 1, 2, 1]], ["tile_rc", "sp", [16, 2, 8]], ["tile_ry", "sp", [1, 1, 3]], ["tile_rx", "sp", [3, 1, 1]], ["auto_unroll_max_step", "ot", 1500], ["unroll_explicit", "ot", 1]]}], "r": [[0.0005467736760124611], 0, 4.424703598022461, 1544143407.8881042], "v": 0.1}
{"i": ["cuda", "conv2d_no_batching", [1, 28, 28, 128, 256, 3, 3, [2, 2], [1, 1]], {}, ["conv2d_no_batching", 1, 28, 28, 128, 256, 3, 3, [2, 2], [1, 1]], {"i": 22250113, "t": "", "c": null, "e": [["tile_f", "sp", [2, 8, 2, 4]], ["tile_y", "sp", [7, 1, 1, 2]], ["tile_x", "sp", [7, 1, 2, 1]], ["tile_rc", "sp", [16, 16, 1]], ["tile_ry", "sp", [1, 3, 1]], ["tile_rx", "sp", [1, 1, 3]], ["auto_unroll_max_step", "ot", 512], ["unroll_explicit", "ot", 0]]}], "r": [[0.00750997031152648], 0, 9.221813201904297, 1544143417.275381], "v": 0.1}
{"i": ["cuda", "conv2d_no_batching", [1, 28, 28, 128, 256, 3, 3, [2, 2], [1, 1]], {}, ["conv2d_no_batching", 1, 28, 28, 128, 256, 3, 3, [2, 2], [1, 1]], {"i": 34909370, "t": "", "c": null, "e": [["tile_f", "sp", [8, 2, 4, 2]], ["tile_y", "sp", [1, 1, 1, 14]], ["tile_x", "sp", [1, 7, 2, 1]], ["tile_rc", "sp", [32, 4, 2]], ["tile_ry", "sp", [1, 3, 1]], ["tile_rx", "sp", [1, 1, 3]], ["auto_unroll_max_step", "ot", 1500], ["unroll_explicit", "ot", 0]]}], "r": [[0.010181739884735202], 0, 14.624571800231934, 1544143429.4282103], "v": 0.1}
{"i": ["cuda", "conv2d_no_batching", [1, 28, 28, 128, 256, 3, 3, [2, 2], [1, 1]], {}, ["conv2d_no_batching", 1, 28, 28, 128, 256, 3, 3, [2, 2], [1, 1]], {"i": 123817, "t": "", "c": null, "e": [["tile_f", "sp", [2, 1, 8, 8]], ["tile_y", "sp", [1, 2, 7, 1]], ["tile_x", "sp", [14, 1, 1, 1]], ["tile_rc", "sp", [16, 16, 1]], ["tile_ry", "sp", [3, 1, 1]], ["tile_rx", "sp", [3, 1, 1]], ["auto_unroll_max_step", "ot", 0], ["unroll_explicit", "ot", 0]]}], "r": [[0.0009836518255451714], 0, 2.5053133964538574, 1544143535.5647497], "v": 0.1}
{"i": ["cuda", "conv2d_no_batching", [1, 28, 28, 128, 256, 3, 3, [2, 2], [1, 1]], {}, ["conv2d_no_batching", 1, 28, 28, 128, 256, 3, 3, [2, 2], [1, 1]], {"i": 12565417, "t": "", "c": null, "e": [["tile_f", "sp", [2, 1, 8, 8]], ["tile_y", "sp", [1, 2, 7, 1]], ["tile_x", "sp", [14, 1, 1, 1]], ["tile_rc", "sp", [16, 16, 1]], ["tile_ry", "sp", [3, 1, 1]], ["tile_rx", "sp", [3, 1, 1]], ["auto_unroll_max_step", "ot", 512], ["unroll_explicit", "ot", 0]]}], "r": [[0.0006279715233644859], 0, 2.540194272994995, 1544143537.7023802], "v": 0.1}
{"i": ["cuda", "conv2d_no_batching", [1, 28, 28, 128, 256, 3, 3, [2, 2], [1, 1]], {}, ["conv2d_no_batching", 1, 28, 28, 128, 256, 3, 3, [2, 2], [1, 1]], {"i": 62331817, "t": "", "c": null, "e": [["tile_f", "sp", [2, 1, 8, 8]], ["tile_y", "sp", [1, 2, 7, 1]], ["tile_x", "sp", [14, 1, 1, 1]], ["tile_rc", "sp", [16, 16, 1]], ["tile_ry", "sp", [3, 1, 1]], ["tile_rx", "sp", [3, 1, 1]], ["auto_unroll_max_step", "ot", 1500], ["unroll_explicit", "ot", 1]]}], "r": [[0.0003990098504672897], 0, 2.9629549980163574, 1544143539.6210794], "v": 0.1}
{"i": ["cuda", "conv2d_no_batching", [1, 28, 28, 128, 256, 3, 3, [2, 2], [1, 1]], {}, ["conv2d_no_batching", 1, 28, 28, 128, 256, 3, 3, [2, 2], [1, 1]], {"i": 49890217, "t": "", "c": null, "e": [["tile_f", "sp", [2, 1, 8, 8]], ["tile_y", "sp", [1, 2, 7, 1]], ["tile_x", "sp", [14, 1, 1, 1]], ["tile_rc", "sp", [16, 16, 1]], ["tile_ry", "sp", [3, 1, 1]], ["tile_rx", "sp", [3, 1, 1]], ["auto_unroll_max_step", "ot", 512], ["unroll_explicit", "ot", 1]]}], "r": [[0.000538286984423676], 0, 2.4109458923339844, 1544143541.5461066], "v": 0.1}
{"i": ["cuda", "conv2d_no_batching", [1, 28, 28, 128, 256, 3, 3, [2, 2], [1, 1]], {}, ["conv2d_no_batching", 1, 28, 28, 128, 256, 3, 3, [2, 2], [1, 1]], {"i": 37448617, "t": "", "c": null, "e": [["tile_f", "sp", [2, 1, 8, 8]], ["tile_y", "sp", [1, 2, 7, 1]], ["tile_x", "sp", [14, 1, 1, 1]], ["tile_rc", "sp", [16, 16, 1]], ["tile_ry", "sp", [3, 1, 1]], ["tile_rx", "sp", [3, 1, 1]], ["auto_unroll_max_step", "ot", 0], ["unroll_explicit", "ot", 1]]}], "r": [[0.0009581485046728973], 0, 2.243065595626831, 1544143543.469642], "v": 0.1}
{"i": ["cuda", "conv2d_no_batching", [1, 28, 28, 128, 256, 3, 3, [2, 2], [1, 1]], {}, ["conv2d_no_batching", 1, 28, 28, 128, 256, 3, 3, [2, 2], [1, 1]], {"i": 25007017, "t": "", "c": null, "e": [["tile_f", "sp", [2, 1, 8, 8]], ["tile_y", "sp", [1, 2, 7, 1]], ["tile_x", "sp", [14, 1, 1, 1]], ["tile_rc", "sp", [16, 16, 1]], ["tile_ry", "sp", [3, 1, 1]], ["tile_rx", "sp", [3, 1, 1]], ["auto_unroll_max_step", "ot", 1500], ["unroll_explicit", "ot", 0]]}], "r": [[0.0007232770062305296], 0, 2.922579050064087, 1544143545.86017], "v": 0.1}
{"i": ["cuda", "conv2d_no_batching", [1, 28, 28, 128, 256, 3, 3, [2, 2], [1, 1]], {}, ["conv2d_no_batching", 1, 28, 28, 128, 256, 3, 3, [2, 2], [1, 1]], {"i": 49907480, "t": "", "c": null, "e": [["tile_f", "sp", [2, 2, 8, 4]], ["tile_y", "sp", [1, 2, 7, 1]], ["tile_x", "sp", [7, 1, 1, 2]], ["tile_rc", "sp", [16, 16, 1]], ["tile_ry", "sp", [3, 1, 1]], ["tile_rx", "sp", [3, 1, 1]], ["auto_unroll_max_step", "ot", 512], ["unroll_explicit", "ot", 1]]}], "r": [[0.0004010298411214954], 0, 1.9827523231506348, 1544143547.390188], "v": 0.1}
{"i": ["cuda", "conv2d_no_batching", [1, 28, 28, 128, 256, 3, 3, [2, 2], [1, 1]], {}, ["conv2d_no_batching", 1, 28, 28, 128, 256, 3, 3, [2, 2], [1, 1]], {"i": 62349080, "t": "", "c": null, "e": [["tile_f", "sp", [2, 2, 8, 4]], ["tile_y", "sp", [1, 2, 7, 1]], ["tile_x", "sp", [7, 1, 1, 2]], ["tile_rc", "sp", [16, 16, 1]], ["tile_ry", "sp", [3, 1, 1]], ["tile_rx", "sp", [3, 1, 1]], ["auto_unroll_max_step", "ot", 1500], ["unroll_explicit", "ot", 1]]}], "r": [[0.0004449655015576324], 0, 2.5107460021972656, 1544143549.202637], "v": 0.1}
{"i": ["cuda", "conv2d_no_batching", [1, 28, 28, 128, 256, 3, 3, [2, 2], [1, 1]], {}, ["conv2d_no_batching", 1, 28, 28, 128, 256, 3, 3, [2, 2], [1, 1]], {"i": 141080, "t": "", "c": null, "e": [["tile_f", "sp", [2, 2, 8, 4]], ["tile_y", "sp", [1, 2, 7, 1]], ["tile_x", "sp", [7, 1, 1, 2]], ["tile_rc", "sp", [16, 16, 1]], ["tile_ry", "sp", [3, 1, 1]], ["tile_rx", "sp", [3, 1, 1]], ["auto_unroll_max_step", "ot", 0], ["unroll_explicit", "ot", 0]]}], "r": [[0.0015473879750778816], 0, 2.839850664138794, 1544143551.7314038], "v": 0.1}
{"i": ["cuda", "conv2d_no_batching", [1, 28, 28, 128, 256, 3, 3, [2, 2], [1, 1]], {}, ["conv2d_no_batching", 1, 28, 28, 128, 256, 3, 3, [2, 2], [1, 1]], {"i": 37465880, "t": "", "c": null, "e": [["tile_f", "sp", [2, 2, 8, 4]], ["tile_y", "sp", [1, 2, 7, 1]], ["tile_x", "sp", [7, 1, 1, 2]], ["tile_rc", "sp", [16, 16, 1]], ["tile_ry", "sp", [3, 1, 1]], ["tile_rx", "sp", [3, 1, 1]], ["auto_unroll_max_step", "ot", 0], ["unroll_explicit", "ot", 1]]}], "r": [[0.0015470500031152649], 0, 2.8343441486358643, 1544143554.199672], "v": 0.1}
{"i": ["cuda", "conv2d_no_batching", [1, 28, 28, 128, 256, 3, 3, [2, 2], [1, 1]], {}, ["conv2d_no_batching", 1, 28, 28, 128, 256, 3, 3, [2, 2], [1, 1]], {"i": 25024280, "t": "", "c": null, "e": [["tile_f", "sp", [2, 2, 8, 4]], ["tile_y", "sp", [1, 2, 7, 1]], ["tile_x", "sp", [7, 1, 1, 2]], ["tile_rc", "sp", [16, 16, 1]], ["tile_ry", "sp", [3, 1, 1]], ["tile_rx", "sp", [3, 1, 1]], ["auto_unroll_max_step", "ot", 1500], ["unroll_explicit", "ot", 0]]}], "r": [[0.0010525211557632398], 0, 2.840512752532959, 1544143556.6213908], "v": 0.1}
{"i": ["cuda", "conv2d_no_batching", [1, 28, 28, 128, 256, 3, 3, [2, 2], [1, 1]], {}, ["conv2d_no_batching", 1, 28, 28, 128, 256, 3, 3, [2, 2], [1, 1]], {"i": 12582679, "t": "", "c": null, "e": [["tile_f", "sp", [4, 1, 8, 4]], ["tile_y", "sp", [1, 2, 7, 1]], ["tile_x", "sp", [7, 1, 1, 2]], ["tile_rc", "sp", [16, 16, 1]], ["tile_ry", "sp", [3, 1, 1]], ["tile_rx", "sp", [3, 1, 1]], ["auto_unroll_max_step", "ot", 512], ["unroll_explicit", "ot", 0]]}], "r": [[0.0007554052523364485], 0, 2.55769944190979, 1544143558.7956712], "v": 0.1}
{"i": ["cuda", "conv2d_no_batching", [1, 28, 28, 128, 256, 3, 3, [2, 2], [1, 1]], {}, ["conv2d_no_batching", 1, 28, 28, 128, 256, 3, 3, [2, 2], [1, 1]], {"i": 141079, "t": "", "c": null, "e": [["tile_f", "sp", [4, 1, 8, 4]], ["tile_y", "sp", [1, 2, 7, 1]], ["tile_x", "sp", [7, 1, 1, 2]], ["tile_rc", "sp", [16, 16, 1]], ["tile_ry", "sp", [3, 1, 1]], ["tile_rx", "sp", [3, 1, 1]], ["auto_unroll_max_step", "ot", 0], ["unroll_explicit", "ot", 0]]}], "r": [[0.0009351264018691588], 0, 2.305408000946045, 1544143560.7952945], "v": 0.1}
{"i": ["cuda", "conv2d_no_batching", [1, 28, 28, 128, 256, 3, 3, [2, 2], [1, 1]], {}, ["conv2d_no_batching", 1, 28, 28, 128, 256, 3, 3, [2, 2], [1, 1]], {"i": 25006897, "t": "", "c": null, "e": [["tile_f", "sp", [2, 1, 8, 8]], ["tile_y", "sp", [2, 1, 7, 1]], ["tile_x", "sp", [14, 1, 1, 1]], ["tile_rc", "sp", [16, 16, 1]], ["tile_ry", "sp", [3, 1, 1]], ["tile_rx", "sp", [3, 1, 1]], ["auto_unroll_max_step", "ot", 1500], ["unroll_explicit", "ot", 0]]}], "r": [[0.0006050451900311526], 0, 2.545802116394043, 1544143562.811148], "v": 0.1}
{"i": ["cuda", "conv2d_no_batching", [1, 28, 28, 128, 256, 3, 3, [2, 2], [1, 1]], {}, ["conv2d_no_batching", 1, 28, 28, 128, 256, 3, 3, [2, 2], [1, 1]], {"i": 49890097, "t": "", "c": null, "e": [["tile_f", "sp", [2, 1, 8, 8]], ["tile_y", "sp", [2, 1, 7, 1]], ["tile_x", "sp", [14, 1, 1, 1]], ["tile_rc", "sp", [16, 16, 1]], ["tile_ry", "sp", [3, 1, 1]], ["tile_rx", "sp", [3, 1, 1]], ["auto_unroll_max_step", "ot", 512], ["unroll_explicit", "ot", 1]]}], "r": [[0.0004697034984423676], 0, 2.2308363914489746, 1544143564.5751858], "v": 0.1}
{"i": ["cuda", "conv2d_no_batching", [1, 28, 28, 128, 256, 3, 3, [2, 2], [1, 1]], {}, ["conv2d_no_batching", 1, 28, 28, 128, 256, 3, 3, [2, 2], [1, 1]], {"i": 37448497, "t": "", "c": null, "e": [["tile_f", "sp", [2, 1, 8, 8]], ["tile_y", "sp", [2, 1, 7, 1]], ["tile_x", "sp", [14, 1, 1, 1]], ["tile_rc", "sp", [16, 16, 1]], ["tile_ry", "sp", [3, 1, 1]], ["tile_rx", "sp", [3, 1, 1]], ["auto_unroll_max_step", "ot", 0], ["unroll_explicit", "ot", 1]]}], "r": [[0.0008560503333333333], 0, 2.21420955657959, 1544143566.4581718], "v": 0.1}
{"i": ["cuda", "conv2d_no_batching", [1, 28, 28, 128, 256, 3, 3, [2, 2], [1, 1]], {}, ["conv2d_no_batching", 1, 28, 28, 128, 256, 3, 3, [2, 2], [1, 1]], {"i": 123697, "t": "", "c": null, "e": [["tile_f", "sp", [2, 1, 8, 8]], ["tile_y", "sp", [2, 1, 7, 1]], ["tile_x", "sp", [14, 1, 1, 1]], ["tile_rc", "sp", [16, 16, 1]], ["tile_ry", "sp", [3, 1, 1]], ["tile_rx", "sp", [3, 1, 1]], ["auto_unroll_max_step", "ot", 0], ["unroll_explicit", "ot", 0]]}], "r": [[0.0008579258224299066], 0, 2.116149663925171, 1544143568.3049266], "v": 0.1}
{"i": ["cuda", "conv2d_no_batching", [1, 28, 28, 128, 256, 3, 3, [2, 2], [1, 1]], {}, ["conv2d_no_batching", 1, 28, 28, 128, 256, 3, 3, [2, 2], [1, 1]], {"i": 62331697, "t": "", "c": null, "e": [["tile_f", "sp", [2, 1, 8, 8]], ["tile_y", "sp", [2, 1, 7, 1]], ["tile_x", "sp", [14, 1, 1, 1]], ["tile_rc", "sp", [16, 16, 1]], ["tile_ry", "sp", [3, 1, 1]], ["tile_rx", "sp", [3, 1, 1]], ["auto_unroll_max_step", "ot", 1500], ["unroll_explicit", "ot", 1]]}], "r": [[0.00038228919937694704], 0, 2.3046810626983643, 1544143569.9690788], "v": 0.1}
{"i": ["cuda", "conv2d_no_batching", [1, 28, 28, 128, 256, 3, 3, [2, 2], [1, 1]], {}, ["conv2d_no_batching", 1, 28, 28, 128, 256, 3, 3, [2, 2], [1, 1]], {"i": 12565297, "t": "", "c": null, "e": [["tile_f", "sp", [2, 1, 8, 8]], ["tile_y", "sp", [2, 1, 7, 1]], ["tile_x", "sp", [14, 1, 1, 1]], ["tile_rc", "sp", [16, 16, 1]], ["tile_ry", "sp", [3, 1, 1]], ["tile_rx", "sp", [3, 1, 1]], ["auto_unroll_max_step", "ot", 512], ["unroll_explicit", "ot", 0]]}], "r": [[0.0005708132149532711], 0, 2.277477979660034, 1544143571.8521628], "v": 0.1}
{"i": ["cuda", "conv2d_no_batching", [1, 28, 28, 128, 256, 3, 3, [2, 2], [1, 1]], {}, ["conv2d_no_batching", 1, 28, 28, 128, 256, 3, 3, [2, 2], [1, 1]], {"i": 50143537, "t": "", "c": null, "e": [["tile_f", "sp", [2, 1, 8, 8]], ["tile_y", "sp", [2, 1, 7, 1]], ["tile_x", "sp", [7, 1, 2, 1]], ["tile_rc", "sp", [16, 8, 2]], ["tile_ry", "sp", [3, 1, 1]], ["tile_rx", "sp", [3, 1, 1]], ["auto_unroll_max_step", "ot", 512], ["unroll_explicit", "ot", 1]]}], "r": [[0.00030232037473233405], 0, 1.8547022342681885, 1544143621.3398287], "v": 0.1}
{"i": ["cuda", "conv2d_no_batching", [1, 28, 28, 128, 256, 3, 3, [2, 2], [1, 1]], {}, ["conv2d_no_batching", 1, 28, 28, 128, 256, 3, 3, [2, 2], [1, 1]], {"i": 12818737, "t": "", "c": null, "e": [["tile_f", "sp", [2, 1, 8, 8]], ["tile_y", "sp", [2, 1, 7, 1]], ["tile_x", "sp", [7, 1, 2, 1]], ["tile_rc", "sp", [16, 8, 2]], ["tile_ry", "sp", [3, 1, 1]], ["tile_rx", "sp", [3, 1, 1]], ["auto_unroll_max_step", "ot", 512], ["unroll_explicit", "ot", 0]]}], "r": [[0.0004224402056074767], 0, 2.0760159492492676, 1544143575.027573], "v": 0.1}
{"i": ["cuda", "conv2d_no_batching", [1, 28, 28, 128, 256, 3, 3, [2, 2], [1, 1]], {}, ["conv2d_no_batching", 1, 28, 28, 128, 256, 3, 3, [2, 2], [1, 1]], {"i": 131375, "t": "", "c": null, "e": [["tile_f", "sp", [2, 2, 4, 8]], ["tile_y", "sp", [2, 1, 7, 1]], ["tile_x", "sp", [7, 1, 2, 1]], ["tile_rc", "sp", [16, 16, 1]], ["tile_ry", "sp", [3, 1, 1]], ["tile_rx", "sp", [3, 1, 1]], ["auto_unroll_max_step", "ot", 0], ["unroll_explicit", "ot", 0]]}], "r": [[0.0013916039937694705], 0, 2.7538704872131348, 1544143577.3626275], "v": 0.1}
{"i": ["cuda", "conv2d_no_batching", [1, 28, 28, 128, 256, 3, 3, [2, 2], [1, 1]], {}, ["conv2d_no_batching", 1, 28, 28, 128, 256, 3, 3, [2, 2], [1, 1]], {"i": 125617, "t": "", "c": null, "e": [["tile_f", "sp", [2, 1, 8, 8]], ["tile_y", "sp", [2, 1, 7, 1]], ["tile_x", "sp", [7, 2, 1, 1]], ["tile_rc", "sp", [16, 16, 1]], ["tile_ry", "sp", [3, 1, 1]], ["tile_rx", "sp", [3, 1, 1]], ["auto_unroll_max_step", "ot", 0], ["unroll_explicit", "ot", 0]]}], "r": [[0.001045049707165109], 0, 2.34026837348938, 1544143579.4247456], "v": 0.1}
{"i": ["cuda", "conv2d_no_batching", [1, 28, 28, 128, 256, 3, 3, [2, 2], [1, 1]], {}, ["conv2d_no_batching", 1, 28, 28, 128, 256, 3, 3, [2, 2], [1, 1]], {"i": 12567217, "t": "", "c": null, "e": [["tile_f", "sp", [2, 1, 8, 8]], ["tile_y", "sp", [2, 1, 7, 1]], ["tile_x", "sp", [7, 2, 1, 1]], ["tile_rc", "sp", [16, 16, 1]], ["tile_ry", "sp", [3, 1, 1]], ["tile_rx", "sp", [3, 1, 1]], ["auto_unroll_max_step", "ot", 512], ["unroll_explicit", "ot", 0]]}], "r": [[0.0006249036448598131], 0, 2.504157066345215, 1544143581.4754312], "v": 0.1}
{"i": ["cuda", "conv2d_no_batching", [1, 28, 28, 128, 256, 3, 3, [2, 2], [1, 1]], {}, ["conv2d_no_batching", 1, 28, 28, 128, 256, 3, 3, [2, 2], [1, 1]], {"i": 37450417, "t": "", "c": null, "e": [["tile_f", "sp", [2, 1, 8, 8]], ["tile_y", "sp", [2, 1, 7, 1]], ["tile_x", "sp", [7, 2, 1, 1]], ["tile_rc", "sp", [16, 16, 1]], ["tile_ry", "sp", [3, 1, 1]], ["tile_rx", "sp", [3, 1, 1]], ["auto_unroll_max_step", "ot", 0], ["unroll_explicit", "ot", 1]]}], "r": [[0.001044785398753894], 0, 2.3220269680023193, 1544143583.4575753], "v": 0.1}
{"i": ["cuda", "conv2d_no_batching", [1, 28, 28, 128, 256, 3, 3, [2, 2], [1, 1]], {}, ["conv2d_no_batching", 1, 28, 28, 128, 256, 3, 3, [2, 2], [1, 1]], {"i": 25008817, "t": "", "c": null, "e": [["tile_f", "sp", [2, 1, 8, 8]], ["tile_y", "sp", [2, 1, 7, 1]], ["tile_x", "sp", [7, 2, 1, 1]], ["tile_rc", "sp", [16, 16, 1]], ["tile_ry", "sp", [3, 1, 1]], ["tile_rx", "sp", [3, 1, 1]], ["auto_unroll_max_step", "ot", 1500], ["unroll_explicit", "ot", 0]]}], "r": [[0.0006551810342679127], 0, 2.828873634338379, 1544143585.769634], "v": 0.1}
{"i": ["cuda", "conv2d_no_batching", [1, 28, 28, 128, 256, 3, 3, [2, 2], [1, 1]], {}, ["conv2d_no_batching", 1, 28, 28, 128, 256, 3, 3, [2, 2], [1, 1]], {"i": 62333617, "t": "", "c": null, "e": [["tile_f", "sp", [2, 1, 8, 8]], ["tile_y", "sp", [2, 1, 7, 1]], ["tile_x", "sp", [7, 2, 1, 1]], ["tile_rc", "sp", [16, 16, 1]], ["tile_ry", "sp", [3, 1, 1]], ["tile_rx", "sp", [3, 1, 1]], ["auto_unroll_max_step", "ot", 1500], ["unroll_explicit", "ot", 1]]}], "r": [[0.00038673379127725856], 0, 2.894263505935669, 1544143587.5605464], "v": 0.1}
{"i": ["cuda", "conv2d_no_batching", [1, 28, 28, 128, 256, 3, 3, [2, 2], [1, 1]], {}, ["conv2d_no_batching", 1, 28, 28, 128, 256, 3, 3, [2, 2], [1, 1]], {"i": 49892017, "t": "", "c": null, "e": [["tile_f", "sp", [2, 1, 8, 8]], ["tile_y", "sp", [2, 1, 7, 1]], ["tile_x", "sp", [7, 2, 1, 1]], ["tile_rc", "sp", [16, 16, 1]], ["tile_ry", "sp", [3, 1, 1]], ["tile_rx", "sp", [3, 1, 1]], ["auto_unroll_max_step", "ot", 512], ["unroll_explicit", "ot", 1]]}], "r": [[0.0004378713115264798], 0, 2.288142442703247, 1544143589.4292068], "v": 0.1}
{"i": ["cuda", "conv2d_no_batching", [1, 28, 28, 128, 256, 3, 3, [2, 2], [1, 1]], {}, ["conv2d_no_batching", 1, 28, 28, 128, 256, 3, 3, [2, 2], [1, 1]], {"i": 45682054, "t": "", "c": null, "e": [["tile_f", "sp", [4, 1, 4, 8]], ["tile_y", "sp", [1, 1, 7, 2]], ["tile_x", "sp", [14, 1, 1, 1]], ["tile_rc", "sp", [64, 4, 1]], ["tile_ry", "sp", [3, 1, 1]], ["tile_rx", "sp", [1, 1, 3]], ["auto_unroll_max_step", "ot", 0], ["unroll_explicit", "ot", 1]]}], "r": [[0.0010071122274143303], 0, 2.423804998397827, 1544143591.4461215], "v": 0.1}
{"i": ["cuda", "conv2d_no_batching", [1, 28, 28, 128, 256, 3, 3, [2, 2], [1, 1]], {}, ["conv2d_no_batching", 1, 28, 28, 128, 256, 3, 3, [2, 2], [1, 1]], {"i": 8357254, "t": "", "c": null, "e": [["tile_f", "sp", [4, 1, 4, 8]], ["tile_y", "sp", [1, 1, 7, 2]], ["tile_x", "sp", [14, 1, 1, 1]], ["tile_rc", "sp", [64, 4, 1]], ["tile_ry", "sp", [3, 1, 1]], ["tile_rx", "sp", [1, 1, 3]], ["auto_unroll_max_step", "ot", 0], ["unroll_explicit", "ot", 0]]}], "r": [[0.001009375031152648], 0, 2.274571657180786, 1544143593.3947847], "v": 0.1}
{"i": ["cuda", "conv2d_no_batching", [1, 28, 28, 128, 256, 3, 3, [2, 2], [1, 1]], {}, ["conv2d_no_batching", 1, 28, 28, 128, 256, 3, 3, [2, 2], [1, 1]], {"i": 70565254, "t": "", "c": null, "e": [["tile_f", "sp", [4, 1, 4, 8]], ["tile_y", "sp", [1, 1, 7, 2]], ["tile_x", "sp", [14, 1, 1, 1]], ["tile_rc", "sp", [64, 4, 1]], ["tile_ry", "sp", [3, 1, 1]], ["tile_rx", "sp", [1, 1, 3]], ["auto_unroll_max_step", "ot", 1500], ["unroll_explicit", "ot", 1]]}], "r": [[0.00034428144236760126], 0, 2.2966010570526123, 1544143594.9525294], "v": 0.1}
{"i": ["cuda", "conv2d_no_batching", [1, 28, 28, 128, 256, 3, 3, [2, 2], [1, 1]], {}, ["conv2d_no_batching", 1, 28, 28, 128, 256, 3, 3, [2, 2], [1, 1]], {"i": 58123654, "t": "", "c": null, "e": [["tile_f", "sp", [4, 1, 4, 8]], ["tile_y", "sp", [1, 1, 7, 2]], ["tile_x", "sp", [14, 1, 1, 1]], ["tile_rc", "sp", [64, 4, 1]], ["tile_ry", "sp", [3, 1, 1]], ["tile_rx", "sp", [1, 1, 3]], ["auto_unroll_max_step", "ot", 512], ["unroll_explicit", "ot", 1]]}], "r": [[0.0003781463457943925], 0, 1.9311068058013916, 1544143596.5378058], "v": 0.1}
{"i": ["cuda", "conv2d_no_batching", [1, 28, 28, 128, 256, 3, 3, [2, 2], [1, 1]], {}, ["conv2d_no_batching", 1, 28, 28, 128, 256, 3, 3, [2, 2], [1, 1]], {"i": 25014577, "t": "", "c": null, "e": [["tile_f", "sp", [2, 1, 8, 8]], ["tile_y", "sp", [2, 1, 7, 1]], ["tile_x", "sp", [7, 1, 2, 1]], ["tile_rc", "sp", [16, 16, 1]], ["tile_ry", "sp", [3, 1, 1]], ["tile_rx", "sp", [3, 1, 1]], ["auto_unroll_max_step", "ot", 1500], ["unroll_explicit", "ot", 0]]}], "r": [[0.0003868492834890966], 0, 2.187704086303711, 1544143598.2887907], "v": 0.1}
{"i": ["cuda", "conv2d_no_batching", [1, 28, 28, 128, 256, 3, 3, [2, 2], [1, 1]], {}, ["conv2d_no_batching", 1, 28, 28, 128, 256, 3, 3, [2, 2], [1, 1]], {"i": 37456177, "t": "", "c": null, "e": [["tile_f", "sp", [2, 1, 8, 8]], ["tile_y", "sp", [2, 1, 7, 1]], ["tile_x", "sp", [7, 1, 2, 1]], ["tile_rc", "sp", [16, 16, 1]], ["tile_ry", "sp", [3, 1, 1]], ["tile_rx", "sp", [3, 1, 1]], ["auto_unroll_max_step", "ot", 0], ["unroll_explicit", "ot", 1]]}], "r": [[0.0003503434049844237], 0, 1.8132944107055664, 1544143599.7302177], "v": 0.1}
{"i": ["cuda", "conv2d_no_batching", [1, 28, 28, 128, 256, 3, 3, [2, 2], [1, 1]], {}, ["conv2d_no_batching", 1, 28, 28, 128, 256, 3, 3, [2, 2], [1, 1]], {"i": 12572977, "t": "", "c": null, "e": [["tile_f", "sp", [2, 1, 8, 8]], ["tile_y", "sp", [2, 1, 7, 1]], ["tile_x", "sp", [7, 1, 2, 1]], ["tile_rc", "sp", [16, 16, 1]], ["tile_ry", "sp", [3, 1, 1]], ["tile_rx", "sp", [3, 1, 1]], ["auto_unroll_max_step", "ot", 512], ["unroll_explicit", "ot", 0]]}], "r": [[0.0004229544672897196], 0, 2.073472023010254, 1544143601.3975804], "v": 0.1}
{"i": ["cuda", "conv2d_no_batching", [1, 28, 28, 128, 256, 3, 3, [2, 2], [1, 1]], {}, ["conv2d_no_batching", 1, 28, 28, 128, 256, 3, 3, [2, 2], [1, 1]], {"i": 131377, "t": "", "c": null, "e": [["tile_f", "sp", [2, 1, 8, 8]], ["tile_y", "sp", [2, 1, 7, 1]], ["tile_x", "sp", [7, 1, 2, 1]], ["tile_rc", "sp", [16, 16, 1]], ["tile_ry", "sp", [3, 1, 1]], ["tile_rx", "sp", [3, 1, 1]], ["auto_unroll_max_step", "ot", 0], ["unroll_explicit", "ot", 0]]}], "r": [[0.00035020007788161994], 0, 1.7614881992340088, 1544143602.789327], "v": 0.1}
{"i": ["cuda", "conv2d_no_batching", [1, 28, 28, 128, 256, 3, 3, [2, 2], [1, 1]], {}, ["conv2d_no_batching", 1, 28, 28, 128, 256, 3, 3, [2, 2], [1, 1]], {"i": 62339377, "t": "", "c": null, "e": [["tile_f", "sp", [2, 1, 8, 8]], ["tile_y", "sp", [2, 1, 7, 1]], ["tile_x", "sp", [7, 1, 2, 1]], ["tile_rc", "sp", [16, 16, 1]], ["tile_ry", "sp", [3, 1, 1]], ["tile_rx", "sp", [3, 1, 1]], ["auto_unroll_max_step", "ot", 1500], ["unroll_explicit", "ot", 1]]}], "r": [[0.00026013772591006423], 0, 2.10880708694458, 1544143622.8463042], "v": 0.1}
{"i": ["cuda", "conv2d_no_batching", [1, 28, 28, 128, 256, 3, 3, [2, 2], [1, 1]], {}, ["conv2d_no_batching", 1, 28, 28, 128, 256, 3, 3, [2, 2], [1, 1]], {"i": 49897777, "t": "", "c": null, "e": [["tile_f", "sp", [2, 1, 8, 8]], ["tile_y", "sp", [2, 1, 7, 1]], ["tile_x", "sp", [7, 1, 2, 1]], ["tile_rc", "sp", [16, 16, 1]], ["tile_ry", "sp", [3, 1, 1]], ["tile_rx", "sp", [3, 1, 1]], ["auto_unroll_max_step", "ot", 512], ["unroll_explicit", "ot", 1]]}], "r": [[0.00030234933618843683], 0, 1.8754799365997314, 1544143624.3132496], "v": 0.1}
{"i": ["cuda", "conv2d_no_batching", [1, 28, 28, 128, 256, 3, 3, [2, 2], [1, 1]], {}, ["conv2d_no_batching", 1, 28, 28, 128, 256, 3, 3, [2, 2], [1, 1]], {"i": 71037633, "t": "", "c": null, "e": [["tile_f", "sp", [2, 1, 64, 1]], ["tile_y", "sp", [2, 1, 1, 7]], ["tile_x", "sp", [2, 1, 7, 1]], ["tile_rc", "sp", [64, 1, 4]], ["tile_ry", "sp", [3, 1, 1]], ["tile_rx", "sp", [1, 1, 3]], ["auto_unroll_max_step", "ot", 1500], ["unroll_explicit", "ot", 1]]}], "r": [[0.00021735344753747322], 0, 1.8383772373199463, 1544143625.6633124], "v": 0.1}
{"i": ["cuda", "conv2d_no_batching", [1, 28, 28, 128, 256, 3, 3, [2, 2], [1, 1]], {}, ["conv2d_no_batching", 1, 28, 28, 128, 256, 3, 3, [2, 2], [1, 1]], {"i": 58596033, "t": "", "c": null, "e": [["tile_f", "sp", [2, 1, 64, 1]], ["tile_y", "sp", [2, 1, 1, 7]], ["tile_x", "sp", [2, 1, 7, 1]], ["tile_rc", "sp", [64, 1, 4]], ["tile_ry", "sp", [3, 1, 1]], ["tile_rx", "sp", [1, 1, 3]], ["auto_unroll_max_step", "ot", 512], ["unroll_explicit", "ot", 1]]}], "r": [[0.00021680408993576017], 0, 1.837681770324707, 1544143627.0346148], "v": 0.1}
{"i": ["cuda", "conv2d_no_batching", [1, 28, 28, 128, 256, 3, 3, [2, 2], [1, 1]], {}, ["conv2d_no_batching", 1, 28, 28, 128, 256, 3, 3, [2, 2], [1, 1]], {"i": 33712833, "t": "", "c": null, "e": [["tile_f", "sp", [2, 1, 64, 1]], ["tile_y", "sp", [2, 1, 1, 7]], ["tile_x", "sp", [2, 1, 7, 1]], ["tile_rc", "sp", [64, 1, 4]], ["tile_ry", "sp", [3, 1, 1]], ["tile_rx", "sp", [1, 1, 3]], ["auto_unroll_max_step", "ot", 1500], ["unroll_explicit", "ot", 0]]}], "r": [[0.00023105587580299786], 0, 1.7327394485473633, 1544143628.3914263], "v": 0.1}
{"i": ["cuda", "conv2d_no_batching", [1, 28, 28, 128, 256, 3, 3, [2, 2], [1, 1]], {}, ["conv2d_no_batching", 1, 28, 28, 128, 256, 3, 3, [2, 2], [1, 1]], {"i": 46154433, "t": "", "c": null, "e": [["tile_f", "sp", [2, 1, 64, 1]], ["tile_y", "sp", [2, 1, 1, 7]], ["tile_x", "sp", [2, 1, 7, 1]], ["tile_rc", "sp", [64, 1, 4]], ["tile_ry", "sp", [3, 1, 1]], ["tile_rx", "sp", [1, 1, 3]], ["auto_unroll_max_step", "ot", 0], ["unroll_explicit", "ot", 1]]}], "r": [[0.00023168933618843683], 0, 1.6307799816131592, 1544143629.7080424], "v": 0.1}
{"i": ["cuda", "conv2d_no_batching", [1, 28, 28, 128, 256, 3, 3, [2, 2], [1, 1]], {}, ["conv2d_no_batching", 1, 28, 28, 128, 256, 3, 3, [2, 2], [1, 1]], {"i": 123937, "t": "", "c": null, "e": [["tile_f", "sp", [2, 1, 8, 8]], ["tile_y", "sp", [1, 1, 14, 1]], ["tile_x", "sp", [14, 1, 1, 1]], ["tile_rc", "sp", [16, 16, 1]], ["tile_ry", "sp", [3, 1, 1]], ["tile_rx", "sp", [3, 1, 1]], ["auto_unroll_max_step", "ot", 0], ["unroll_explicit", "ot", 0]]}], "r": [[0.000281602113490364], 0, 1.7384731769561768, 1544143631.1335616], "v": 0.1}
{"i": ["cuda", "conv2d_no_batching", [1, 28, 28, 128, 256, 3, 3, [2, 2], [1, 1]], {}, ["conv2d_no_batching", 1, 28, 28, 128, 256, 3, 3, [2, 2], [1, 1]], {"i": 25007137, "t": "", "c": null, "e": [["tile_f", "sp", [2, 1, 8, 8]], ["tile_y", "sp", [1, 1, 14, 1]], ["tile_x", "sp", [14, 1, 1, 1]], ["tile_rc", "sp", [16, 16, 1]], ["tile_ry", "sp", [3, 1, 1]], ["tile_rx", "sp", [3, 1, 1]], ["auto_unroll_max_step", "ot", 1500], ["unroll_explicit", "ot", 0]]}], "r": [[0.00038358105919003116], 0, 2.1582329273223877, 1544143613.9448056], "v": 0.1}
{"i": ["cuda", "conv2d_no_batching", [1, 28, 28, 128, 256, 3, 3, [2, 2], [1, 1]], {}, ["conv2d_no_batching", 1, 28, 28, 128, 256, 3, 3, [2, 2], [1, 1]], {"i": 37448737, "t": "", "c": null, "e": [["tile_f", "sp", [2, 1, 8, 8]], ["tile_y", "sp", [1, 1, 14, 1]], ["tile_x", "sp", [14, 1, 1, 1]], ["tile_rc", "sp", [16, 16, 1]], ["tile_ry", "sp", [3, 1, 1]], ["tile_rx", "sp", [3, 1, 1]], ["auto_unroll_max_step", "ot", 0], ["unroll_explicit", "ot", 1]]}], "r": [[0.0002818723319057816], 0, 1.7677478790283203, 1544143632.5901775], "v": 0.1}
{"i": ["cuda", "conv2d_no_batching", [1, 28, 28, 128, 256, 3, 3, [2, 2], [1, 1]], {}, ["conv2d_no_batching", 1, 28, 28, 128, 256, 3, 3, [2, 2], [1, 1]], {"i": 62331937, "t": "", "c": null, "e": [["tile_f", "sp", [2, 1, 8, 8]], ["tile_y", "sp", [1, 1, 14, 1]], ["tile_x", "sp", [14, 1, 1, 1]], ["tile_rc", "sp", [16, 16, 1]], ["tile_ry", "sp", [3, 1, 1]], ["tile_rx", "sp", [3, 1, 1]], ["auto_unroll_max_step", "ot", 1500], ["unroll_explicit", "ot", 1]]}], "r": [[0.00023244624839400426], 0, 2.0294134616851807, 1544143633.9907978], "v": 0.1}
{"i": ["cuda", "conv2d_no_batching", [1, 28, 28, 128, 256, 3, 3, [2, 2], [1, 1]], {}, ["conv2d_no_batching", 1, 28, 28, 128, 256, 3, 3, [2, 2], [1, 1]], {"i": 12565537, "t": "", "c": null, "e": [["tile_f", "sp", [2, 1, 8, 8]], ["tile_y", "sp", [1, 1, 14, 1]], ["tile_x", "sp", [14, 1, 1, 1]], ["tile_rc", "sp", [16, 16, 1]], ["tile_ry", "sp", [3, 1, 1]], ["tile_rx", "sp", [3, 1, 1]], ["auto_unroll_max_step", "ot", 512], ["unroll_explicit", "ot", 0]]}], "r": [[0.000350101062305296], 0, 1.8895454406738281, 1544143618.3122494], "v": 0.1}
{"i": ["cuda", "conv2d_no_batching", [1, 28, 28, 128, 256, 3, 3, [2, 2], [1, 1]], {}, ["conv2d_no_batching", 1, 28, 28, 128, 256, 3, 3, [2, 2], [1, 1]], {"i": 49890337, "t": "", "c": null, "e": [["tile_f", "sp", [2, 1, 8, 8]], ["tile_y", "sp", [1, 1, 14, 1]], ["tile_x", "sp", [14, 1, 1, 1]], ["tile_rc", "sp", [16, 16, 1]], ["tile_ry", "sp", [3, 1, 1]], ["tile_rx", "sp", [3, 1, 1]], ["auto_unroll_max_step", "ot", 512], ["unroll_explicit", "ot", 1]]}], "r": [[0.00036114831152647973], 0, 1.9896583557128906, 1544143619.911353], "v": 0.1}
{"i": ["cuda", "conv2d_no_batching", [1, 28, 28, 128, 256, 3, 3, [2, 2], [1, 1]], {}, ["conv2d_no_batching", 1, 28, 28, 128, 256, 3, 3, [2, 2], [1, 1]], {"i": 71905953, "t": "", "c": null, "e": [["tile_f", "sp", [2, 1, 64, 1]], ["tile_y", "sp", [14, 1, 1, 1]], ["tile_x", "sp", [1, 1, 7, 2]], ["tile_rc", "sp", [256, 1, 1]], ["tile_ry", "sp", [1, 3, 1]], ["tile_rx", "sp", [1, 1, 3]], ["auto_unroll_max_step", "ot", 1500], ["unroll_explicit", "ot", 1]]}], "r": [[0.00016566775033921303], 0, 1.6018376350402832, 1544143754.2259874], "v": 0.1}
{"i": ["cuda", "conv2d_no_batching", [1, 28, 28, 128, 256, 3, 3, [2, 2], [1, 1]], {}, ["conv2d_no_batching", 1, 28, 28, 128, 256, 3, 3, [2, 2], [1, 1]], {"i": 59464353, "t": "", "c": null, "e": [["tile_f", "sp", [2, 1, 64, 1]], ["tile_y", "sp", [14, 1, 1, 1]], ["tile_x", "sp", [1, 1, 7, 2]], ["tile_rc", "sp", [256, 1, 1]], ["tile_ry", "sp", [1, 3, 1]], ["tile_rx", "sp", [1, 1, 3]], ["auto_unroll_max_step", "ot", 512], ["unroll_explicit", "ot", 1]]}], "r": [[0.00016505181139755767], 0, 1.6337189674377441, 1544143755.6070523], "v": 0.1}
{"i": ["cuda", "conv2d_no_batching", [1, 28, 28, 128, 256, 3, 3, [2, 2], [1, 1]], {}, ["conv2d_no_batching", 1, 28, 28, 128, 256, 3, 3, [2, 2], [1, 1]], {"i": 65258553, "t": "", "c": null, "e": [["tile_f", "sp", [2, 1, 64, 1]], ["tile_y", "sp", [1, 2, 1, 7]], ["tile_x", "sp", [7, 1, 2, 1]], ["tile_rc", "sp", [128, 1, 2]], ["tile_ry", "sp", [1, 1, 3]], ["tile_rx", "sp", [3, 1, 1]], ["auto_unroll_max_step", "ot", 1500], ["unroll_explicit", "ot", 1]]}], "r": [[0.00028893470663811567], 0, 2.012110948562622, 1544143701.5971692], "v": 0.1}
{"i": ["cuda", "conv2d_no_batching", [1, 28, 28, 128, 256, 3, 3, [2, 2], [1, 1]], {}, ["conv2d_no_batching", 1, 28, 28, 128, 256, 3, 3, [2, 2], [1, 1]], {"i": 65270463, "t": "", "c": null, "e": [["tile_f", "sp", [1, 1, 64, 2]], ["tile_y", "sp", [14, 1, 1, 1]], ["tile_x", "sp", [1, 1, 7, 2]], ["tile_rc", "sp", [128, 1, 2]], ["tile_ry", "sp", [1, 1, 3]], ["tile_rx", "sp", [3, 1, 1]], ["auto_unroll_max_step", "ot", 1500], ["unroll_explicit", "ot", 1]]}], "r": [[0.0002477645374732334], 0, 1.6508519649505615, 1544143703.3310645], "v": 0.1}
{"i": ["cuda", "conv2d_no_batching", [1, 28, 28, 128, 256, 3, 3, [2, 2], [1, 1]], {}, ["conv2d_no_batching", 1, 28, 28, 128, 256, 3, 3, [2, 2], [1, 1]], {"i": 71893381, "t": "", "c": null, "e": [["tile_f", "sp", [2, 1, 32, 2]], ["tile_y", "sp", [1, 2, 7, 1]], ["tile_x", "sp", [7, 1, 2, 1]], ["tile_rc", "sp", [256, 1, 1]], ["tile_ry", "sp", [1, 3, 1]], ["tile_rx", "sp", [1, 1, 3]], ["auto_unroll_max_step", "ot", 1500], ["unroll_explicit", "ot", 1]]}], "r": [[0.00022403038115631694], 0, 1.6776175498962402, 1544143704.7045715], "v": 0.1}
{"i": ["cuda", "conv2d_no_batching", [1, 28, 28, 128, 256, 3, 3, [2, 2], [1, 1]], {}, ["conv2d_no_batching", 1, 28, 28, 128, 256, 3, 3, [2, 2], [1, 1]], {"i": 71897433, "t": "", "c": null, "e": [["tile_f", "sp", [2, 1, 64, 1]], ["tile_y", "sp", [7, 1, 1, 2]], ["tile_x", "sp", [2, 1, 7, 1]], ["tile_rc", "sp", [256, 1, 1]], ["tile_ry", "sp", [1, 3, 1]], ["tile_rx", "sp", [1, 1, 3]], ["auto_unroll_max_step", "ot", 1500], ["unroll_explicit", "ot", 1]]}], "r": [[0.00015539958344640433], 0, 1.6197881698608398, 1544143756.949667], "v": 0.1}
{"i": ["cuda", "conv2d_no_batching", [1, 28, 28, 128, 256, 3, 3, [2, 2], [1, 1]], {}, ["conv2d_no_batching", 1, 28, 28, 128, 256, 3, 3, [2, 2], [1, 1]], {"i": 59456193, "t": "", "c": null, "e": [["tile_f", "sp", [2, 1, 64, 1]], ["tile_y", "sp", [2, 1, 1, 7]], ["tile_x", "sp", [2, 1, 7, 1]], ["tile_rc", "sp", [256, 1, 1]], ["tile_ry", "sp", [1, 3, 1]], ["tile_rx", "sp", [1, 1, 3]], ["auto_unroll_max_step", "ot", 512], ["unroll_explicit", "ot", 1]]}], "r": [[0.0002321229229122056], 0, 1.729283094406128, 1544143707.3839653], "v": 0.1}
{"i": ["cuda", "conv2d_no_batching", [1, 28, 28, 128, 256, 3, 3, [2, 2], [1, 1]], {}, ["conv2d_no_batching", 1, 28, 28, 128, 256, 3, 3, [2, 2], [1, 1]], {"i": 73288353, "t": "", "c": null, "e": [["tile_f", "sp", [2, 1, 64, 1]], ["tile_y", "sp", [14, 1, 1, 1]], ["tile_x", "sp", [1, 1, 7, 2]], ["tile_rc", "sp", [256, 1, 1]], ["tile_ry", "sp", [1, 1, 3]], ["tile_rx", "sp", [1, 1, 3]], ["auto_unroll_max_step", "ot", 1500], ["unroll_explicit", "ot", 1]]}], "r": [[0.00016375355223880597], 0, 1.660581111907959, 1544143758.3206224], "v": 0.1}
{"i": ["cuda", "conv2d_no_batching", [1, 28, 28, 128, 256, 3, 3, [2, 2], [1, 1]], {}, ["conv2d_no_batching", 1, 28, 28, 128, 256, 3, 3, [2, 2], [1, 1]], {"i": 71907033, "t": "", "c": null, "e": [["tile_f", "sp", [2, 1, 64, 1]], ["tile_y", "sp", [7, 1, 1, 2]], ["tile_x", "sp", [1, 1, 7, 2]], ["tile_rc", "sp", [256, 1, 1]], ["tile_ry", "sp", [1, 3, 1]], ["tile_rx", "sp", [1, 1, 3]], ["auto_unroll_max_step", "ot", 1500], ["unroll_explicit", "ot", 1]]}], "r": [[0.0001868253473541384], 0, 1.71549654006958, 1544143759.7738168], "v": 0.1}
{"i": ["cuda", "conv2d_no_batching", [1, 28, 28, 128, 256, 3, 3, [2, 2], [1, 1]], {}, ["conv2d_no_batching", 1, 28, 28, 128, 256, 3, 3, [2, 2], [1, 1]], {"i": 63888063, "t": "", "c": null, "e": [["tile_f", "sp", [1, 1, 64, 2]], ["tile_y", "sp", [14, 1, 1, 1]], ["tile_x", "sp", [1, 1, 7, 2]], ["tile_rc", "sp", [128, 1, 2]], ["tile_ry", "sp", [1, 3, 1]], ["tile_rx", "sp", [3, 1, 1]], ["auto_unroll_max_step", "ot", 1500], ["unroll_explicit", "ot", 1]]}], "r": [[0.00024883879229122056], 0, 1.7282590866088867, 1544143711.7087631], "v": 0.1}
{"i": ["cuda", "conv2d_no_batching", [1, 28, 28, 128, 256, 3, 3, [2, 2], [1, 1]], {}, ["conv2d_no_batching", 1, 28, 28, 128, 256, 3, 3, [2, 2], [1, 1]], {"i": 67758753, "t": "", "c": null, "e": [["tile_f", "sp", [2, 1, 64, 1]], ["tile_y", "sp", [14, 1, 1, 1]], ["tile_x", "sp", [1, 1, 7, 2]], ["tile_rc", "sp", [256, 1, 1]], ["tile_ry", "sp", [1, 3, 1]], ["tile_rx", "sp", [1, 3, 1]], ["auto_unroll_max_step", "ot", 1500], ["unroll_explicit", "ot", 1]]}], "r": [[0.00016408002578018995], 0, 1.635296106338501, 1544143761.1484036], "v": 0.1}
{"i": ["cuda", "conv2d_no_batching", [1, 28, 28, 128, 256, 3, 3, [2, 2], [1, 1]], {}, ["conv2d_no_batching", 1, 28, 28, 128, 256, 3, 3, [2, 2], [1, 1]], {"i": 69132633, "t": "", "c": null, "e": [["tile_f", "sp", [2, 1, 64, 1]], ["tile_y", "sp", [7, 1, 1, 2]], ["tile_x", "sp", [2, 1, 7, 1]], ["tile_rc", "sp", [256, 1, 1]], ["tile_ry", "sp", [1, 1, 3]], ["tile_rx", "sp", [1, 3, 1]], ["auto_unroll_max_step", "ot", 1500], ["unroll_explicit", "ot", 1]]}], "r": [[0.00015547562822252375], 0, 1.6188576221466064, 1544143762.4638708], "v": 0.1}
{"i": ["cuda", "conv2d_no_batching", [1, 28, 28, 128, 256, 3, 3, [2, 2], [1, 1]], {}, ["conv2d_no_batching", 1, 28, 28, 128, 256, 3, 3, [2, 2], [1, 1]], {"i": 63642273, "t": "", "c": null, "e": [["tile_f", "sp", [2, 1, 64, 1]], ["tile_y", "sp", [14, 1, 1, 1]], ["tile_x", "sp", [1, 1, 7, 2]], ["tile_rc", "sp", [128, 2, 1]], ["tile_ry", "sp", [1, 3, 1]], ["tile_rx", "sp", [3, 1, 1]], ["auto_unroll_max_step", "ot", 1500], ["unroll_explicit", "ot", 1]]}], "r": [[0.00021166750474898235], 0, 1.766678810119629, 1544143763.938724], "v": 0.1}
{"i": ["cuda", "conv2d_no_batching", [1, 28, 28, 128, 256, 3, 3, [2, 2], [1, 1]], {}, ["conv2d_no_batching", 1, 28, 28, 128, 256, 3, 3, [2, 2], [1, 1]], {"i": 71896353, "t": "", "c": null, "e": [["tile_f", "sp", [2, 1, 64, 1]], ["tile_y", "sp", [14, 1, 1, 1]], ["tile_x", "sp", [2, 1, 7, 1]], ["tile_rc", "sp", [256, 1, 1]], ["tile_ry", "sp", [1, 3, 1]], ["tile_rx", "sp", [1, 1, 3]], ["auto_unroll_max_step", "ot", 1500], ["unroll_explicit", "ot", 1]]}], "r": [[0.00016968957123473542], 0, 1.6666932106018066, 1544143765.3170052], "v": 0.1}
{"i": ["cuda", "conv2d_no_batching", [1, 28, 28, 128, 256, 3, 3, [2, 2], [1, 1]], {}, ["conv2d_no_batching", 1, 28, 28, 128, 256, 3, 3, [2, 2], [1, 1]], {"i": 71906073, "t": "", "c": null, "e": [["tile_f", "sp", [2, 1, 64, 1]], ["tile_y", "sp", [7, 2, 1, 1]], ["tile_x", "sp", [1, 1, 7, 2]], ["tile_rc", "sp", [256, 1, 1]], ["tile_ry", "sp", [1, 3, 1]], ["tile_rx", "sp", [1, 1, 3]], ["auto_unroll_max_step", "ot", 1500], ["unroll_explicit", "ot", 1]]}], "r": [[0.00018634592130257802], 0, 1.7233343124389648, 1544143766.7321222], "v": 0.1}
{"i": ["cuda", "conv2d_no_batching", [1, 28, 28, 128, 256, 3, 3, [2, 2], [1, 1]], {}, ["conv2d_no_batching", 1, 28, 28, 128, 256, 3, 3, [2, 2], [1, 1]], {"i": 59454753, "t": "", "c": null, "e": [["tile_f", "sp", [2, 1, 64, 1]], ["tile_y", "sp", [14, 1, 1, 1]], ["tile_x", "sp", [2, 1, 7, 1]], ["tile_rc", "sp", [256, 1, 1]], ["tile_ry", "sp", [1, 3, 1]], ["tile_rx", "sp", [1, 1, 3]], ["auto_unroll_max_step", "ot", 512], ["unroll_explicit", "ot", 1]]}], "r": [[0.00016997320488466758], 0, 1.7046597003936768, 1544143768.0698688], "v": 0.1}
{"i": ["cuda", "conv2d_no_batching", [1, 28, 28, 128, 256, 3, 3, [2, 2], [1, 1]], {}, ["conv2d_no_batching", 1, 28, 28, 128, 256, 3, 3, [2, 2], [1, 1]], {"i": 65024703, "t": "", "c": null, "e": [["tile_f", "sp", [1, 1, 64, 2]], ["tile_y", "sp", [14, 1, 1, 1]], ["tile_x", "sp", [1, 1, 7, 2]], ["tile_rc", "sp", [128, 2, 1]], ["tile_ry", "sp", [1, 1, 3]], ["tile_rx", "sp", [3, 1, 1]], ["auto_unroll_max_step", "ot", 1500], ["unroll_explicit", "ot", 1]]}], "r": [[0.0002478208137044968], 0, 1.6733062267303467, 1544143721.279476], "v": 0.1}
{"i": ["cuda", "conv2d_no_batching", [1, 28, 28, 128, 256, 3, 3, [2, 2], [1, 1]], {}, ["conv2d_no_batching", 1, 28, 28, 128, 256, 3, 3, [2, 2], [1, 1]], {"i": 65012793, "t": "", "c": null, "e": [["tile_f", "sp", [2, 1, 64, 1]], ["tile_y", "sp", [1, 2, 1, 7]], ["tile_x", "sp", [7, 1, 2, 1]], ["tile_rc", "sp", [128, 2, 1]], ["tile_ry", "sp", [1, 1, 3]], ["tile_rx", "sp", [3, 1, 1]], ["auto_unroll_max_step", "ot", 1500], ["unroll_explicit", "ot", 1]]}], "r": [[0.0002888286937901499], 0, 1.894566535949707, 1544143722.7555737], "v": 0.1}
{"i": ["cuda", "conv2d_no_batching", [1, 28, 28, 128, 256, 3, 3, [2, 2], [1, 1]], {}, ["conv2d_no_batching", 1, 28, 28, 128, 256, 3, 3, [2, 2], [1, 1]], {"i": 71893261, "t": "", "c": null, "e": [["tile_f", "sp", [2, 1, 32, 2]], ["tile_y", "sp", [2, 1, 7, 1]], ["tile_x", "sp", [7, 1, 2, 1]], ["tile_rc", "sp", [256, 1, 1]], ["tile_ry", "sp", [1, 3, 1]], ["tile_rx", "sp", [1, 1, 3]], ["auto_unroll_max_step", "ot", 1500], ["unroll_explicit", "ot", 1]]}], "r": [[0.00018236702170963367], 0, 1.7378127574920654, 1544143769.4788315], "v": 0.1}
{"i": ["cuda", "conv2d_no_batching", [1, 28, 28, 128, 256, 3, 3, [2, 2], [1, 1]], {}, ["conv2d_no_batching", 1, 28, 28, 128, 256, 3, 3, [2, 2], [1, 1]], {"i": 63919233, "t": "", "c": null, "e": [["tile_f", "sp", [2, 1, 64, 1]], ["tile_y", "sp", [7, 1, 2, 1]], ["tile_x", "sp", [1, 1, 7, 2]], ["tile_rc", "sp", [64, 2, 2]], ["tile_ry", "sp", [1, 3, 1]], ["tile_rx", "sp", [3, 1, 1]], ["auto_unroll_max_step", "ot", 1500], ["unroll_explicit", "ot", 1]]}], "r": [[0.0001598880854816825], 0, 1.6916158199310303, 1544143770.8430872], "v": 0.1}
{"i": ["cuda", "conv2d_no_batching", [1, 28, 28, 128, 256, 3, 3, [2, 2], [1, 1]], {}, ["conv2d_no_batching", 1, 28, 28, 128, 256, 3, 3, [2, 2], [1, 1]], {"i": 69128581, "t": "", "c": null, "e": [["tile_f", "sp", [2, 1, 32, 2]], ["tile_y", "sp", [1, 2, 7, 1]], ["tile_x", "sp", [7, 1, 2, 1]], ["tile_rc", "sp", [256, 1, 1]], ["tile_ry", "sp", [1, 1, 3]], ["tile_rx", "sp", [1, 3, 1]], ["auto_unroll_max_step", "ot", 1500], ["unroll_explicit", "ot", 1]]}], "r": [[0.00022419419057815847], 0, 1.6938598155975342, 1544143727.1492887], "v": 0.1}
{"i": ["cuda", "conv2d_no_batching", [1, 28, 28, 128, 256, 3, 3, [2, 2], [1, 1]], {}, ["conv2d_no_batching", 1, 28, 28, 128, 256, 3, 3, [2, 2], [1, 1]], {"i": 51200673, "t": "", "c": null, "e": [["tile_f", "sp", [2, 1, 64, 1]], ["tile_y", "sp", [14, 1, 1, 1]], ["tile_x", "sp", [1, 1, 7, 2]], ["tile_rc", "sp", [128, 2, 1]], ["tile_ry", "sp", [1, 3, 1]], ["tile_rx", "sp", [3, 1, 1]], ["auto_unroll_max_step", "ot", 512], ["unroll_explicit", "ot", 1]]}], "r": [[0.00021117606377204885], 0, 1.8301799297332764, 1544143772.3028522], "v": 0.1}
{"i": ["cuda", "conv2d_no_batching", [1, 28, 28, 128, 256, 3, 3, [2, 2], [1, 1]], {}, ["conv2d_no_batching", 1, 28, 28, 128, 256, 3, 3, [2, 2], [1, 1]], {"i": 64993981, "t": "", "c": null, "e": [["tile_f", "sp", [2, 1, 32, 2]], ["tile_y", "sp", [14, 1, 1, 1]], ["tile_x", "sp", [1, 1, 7, 2]], ["tile_rc", "sp", [256, 1, 1]], ["tile_ry", "sp", [1, 1, 3]], ["tile_rx", "sp", [3, 1, 1]], ["auto_unroll_max_step", "ot", 1500], ["unroll_explicit", "ot", 1]]}], "r": [[0.00033798189507494645], 0, 1.8387434482574463, 1544143730.3699737], "v": 0.1}
{"i": ["cuda", "conv2d_no_batching", [1, 28, 28, 128, 256, 3, 3, [2, 2], [1, 1]], {}, ["conv2d_no_batching", 1, 28, 28, 128, 256, 3, 3, [2, 2], [1, 1]], {"i": 70800063, "t": "", "c": null, "e": [["tile_f", "sp", [1, 1, 64, 2]], ["tile_y", "sp", [14, 1, 1, 1]], ["tile_x", "sp", [1, 1, 7, 2]], ["tile_rc", "sp", [128, 1, 2]], ["tile_ry", "sp", [3, 1, 1]], ["tile_rx", "sp", [1, 1, 3]], ["auto_unroll_max_step", "ot", 1500], ["unroll_explicit", "ot", 1]]}], "r": [[0.00024146996573875805], 0, 1.695704460144043, 1544143731.739336], "v": 0.1}
{"i": ["cuda", "conv2d_no_batching", [1, 28, 28, 128, 256, 3, 3, [2, 2], [1, 1]], {}, ["conv2d_no_batching", 1, 28, 28, 128, 256, 3, 3, [2, 2], [1, 1]], {"i": 73275781, "t": "", "c": null, "e": [["tile_f", "sp", [2, 1, 32, 2]], ["tile_y", "sp", [1, 2, 7, 1]], ["tile_x", "sp", [7, 1, 2, 1]], ["tile_rc", "sp", [256, 1, 1]], ["tile_ry", "sp", [1, 1, 3]], ["tile_rx", "sp", [1, 1, 3]], ["auto_unroll_max_step", "ot", 1500], ["unroll_explicit", "ot", 1]]}], "r": [[0.00022451770877944324], 0, 1.6261179447174072, 1544143733.0328796], "v": 0.1}
{"i": ["cuda", "conv2d_no_batching", [1, 28, 28, 128, 256, 3, 3, [2, 2], [1, 1]], {}, ["conv2d_no_batching", 1, 28, 28, 128, 256, 3, 3, [2, 2], [1, 1]], {"i": 70511553, "t": "", "c": null, "e": [["tile_f", "sp", [2, 1, 64, 1]], ["tile_y", "sp", [2, 1, 1, 7]], ["tile_x", "sp", [7, 1, 2, 1]], ["tile_rc", "sp", [256, 1, 1]], ["tile_ry", "sp", [3, 1, 1]], ["tile_rx", "sp", [1, 1, 3]], ["auto_unroll_max_step", "ot", 1500], ["unroll_explicit", "ot", 1]]}], "r": [[0.00026189580085653105], 0, 1.7830376625061035, 1544143734.4904742], "v": 0.1}
{"i": ["cuda", "conv2d_no_batching", [1, 28, 28, 128, 256, 3, 3, [2, 2], [1, 1]], {}, ["conv2d_no_batching", 1, 28, 28, 128, 256, 3, 3, [2, 2], [1, 1]], {"i": 52816953, "t": "", "c": null, "e": [["tile_f", "sp", [2, 1, 64, 1]], ["tile_y", "sp", [1, 2, 1, 7]], ["tile_x", "sp", [7, 1, 2, 1]], ["tile_rc", "sp", [128, 1, 2]], ["tile_ry", "sp", [1, 1, 3]], ["tile_rx", "sp", [3, 1, 1]], ["auto_unroll_max_step", "ot", 512], ["unroll_explicit", "ot", 1]]}], "r": [[0.00033270404068522485], 0, 1.8868262767791748, 1544143736.0425544], "v": 0.1}
{"i": ["cuda", "conv2d_no_batching", [1, 28, 28, 128, 256, 3, 3, [2, 2], [1, 1]], {}, ["conv2d_no_batching", 1, 28, 28, 128, 256, 3, 3, [2, 2], [1, 1]], {"i": 63888033, "t": "", "c": null, "e": [["tile_f", "sp", [2, 1, 64, 1]], ["tile_y", "sp", [14, 1, 1, 1]], ["tile_x", "sp", [1, 1, 7, 2]], ["tile_rc", "sp", [128, 1, 2]], ["tile_ry", "sp", [1, 3, 1]], ["tile_rx", "sp", [3, 1, 1]], ["auto_unroll_max_step", "ot", 1500], ["unroll_explicit", "ot", 1]]}], "r": [[0.00020854944776119405], 0, 1.7558856010437012, 1544143773.7266784], "v": 0.1}
{"i": ["cuda", "conv2d_no_batching", [1, 28, 28, 128, 256, 3, 3, [2, 2], [1, 1]], {}, ["conv2d_no_batching", 1, 28, 28, 128, 256, 3, 3, [2, 2], [1, 1]], {"i": 71897793, "t": "", "c": null, "e": [["tile_f", "sp", [2, 1, 64, 1]], ["tile_y", "sp", [2, 1, 1, 7]], ["tile_x", "sp", [2, 1, 7, 1]], ["tile_rc", "sp", [256, 1, 1]], ["tile_ry", "sp", [1, 3, 1]], ["tile_rx", "sp", [1, 1, 3]], ["auto_unroll_max_step", "ot", 1500], ["unroll_explicit", "ot", 1]]}], "r": [[0.00023214820985010705], 0, 1.6282100677490234, 1544143739.1137505], "v": 0.1}
{"i": ["cuda", "conv2d_no_batching", [1, 28, 28, 128, 256, 3, 3, [2, 2], [1, 1]], {}, ["conv2d_no_batching", 1, 28, 28, 128, 256, 3, 3, [2, 2], [1, 1]], {"i": 64125273, "t": "", "c": null, "e": [["tile_f", "sp", [2, 1, 64, 1]], ["tile_y", "sp", [7, 1, 1, 2]], ["tile_x", "sp", [2, 1, 7, 1]], ["tile_rc", "sp", [64, 1, 4]], ["tile_ry", "sp", [1, 3, 1]], ["tile_rx", "sp", [3, 1, 1]], ["auto_unroll_max_step", "ot", 1500], ["unroll_explicit", "ot", 1]]}], "r": [[0.0001411228670284939], 0, 1.7342994213104248, 1544143775.0662131], "v": 0.1}
{"i": ["cuda", "conv2d_no_batching", [1, 28, 28, 128, 256, 3, 3, [2, 2], [1, 1]], {}, ["conv2d_no_batching", 1, 28, 28, 128, 256, 3, 3, [2, 2], [1, 1]], {"i": 51446463, "t": "", "c": null, "e": [["tile_f", "sp", [1, 1, 64, 2]], ["tile_y", "sp", [14, 1, 1, 1]], ["tile_x", "sp", [1, 1, 7, 2]], ["tile_rc", "sp", [128, 1, 2]], ["tile_ry", "sp", [1, 3, 1]], ["tile_rx", "sp", [3, 1, 1]], ["auto_unroll_max_step", "ot", 512], ["unroll_explicit", "ot", 1]]}], "r": [[0.00024950943254817986], 0, 1.6265082359313965, 1544143741.7164688], "v": 0.1}
{"i": ["cuda", "conv2d_no_batching", [1, 28, 28, 128, 256, 3, 3, [2, 2], [1, 1]], {}, ["conv2d_no_batching", 1, 28, 28, 128, 256, 3, 3, [2, 2], [1, 1]], {"i": 70818033, "t": "", "c": null, "e": [["tile_f", "sp", [2, 1, 64, 1]], ["tile_y", "sp", [2, 1, 7, 1]], ["tile_x", "sp", [7, 1, 2, 1]], ["tile_rc", "sp", [64, 2, 2]], ["tile_ry", "sp", [3, 1, 1]], ["tile_rx", "sp", [1, 1, 3]], ["auto_unroll_max_step", "ot", 1500], ["unroll_explicit", "ot", 1]]}], "r": [[0.00015663157394843962], 0, 1.6776463985443115, 1544143776.385831], "v": 0.1}
{"i": ["cuda", "conv2d_no_batching", [1, 28, 28, 128, 256, 3, 3, [2, 2], [1, 1]], {}, ["conv2d_no_batching", 1, 28, 28, 128, 256, 3, 3, [2, 2], [1, 1]], {"i": 64985433, "t": "", "c": null, "e": [["tile_f", "sp", [2, 1, 64, 1]], ["tile_y", "sp", [7, 1, 1, 2]], ["tile_x", "sp", [2, 1, 7, 1]], ["tile_rc", "sp", [256, 1, 1]], ["tile_ry", "sp", [1, 1, 3]], ["tile_rx", "sp", [3, 1, 1]], ["auto_unroll_max_step", "ot", 1500], ["unroll_explicit", "ot", 1]]}], "r": [[0.00033948839186295505], 0, 1.7926416397094727, 1544143744.5595012], "v": 0.1}
{"i": ["cuda", "conv2d_no_batching", [1, 28, 28, 128, 256, 3, 3, [2, 2], [1, 1]], {}, ["conv2d_no_batching", 1, 28, 28, 128, 256, 3, 3, [2, 2], [1, 1]], {"i": 64128033, "t": "", "c": null, "e": [["tile_f", "sp", [2, 1, 64, 1]], ["tile_y", "sp", [14, 1, 1, 1]], ["tile_x", "sp", [1, 1, 14, 1]], ["tile_rc", "sp", [64, 1, 4]], ["tile_ry", "sp", [1, 3, 1]], ["tile_rx", "sp", [3, 1, 1]], ["auto_unroll_max_step", "ot", 1500], ["unroll_explicit", "ot", 1]]}], "r": [[0.00013572318860244234], 0, 1.5642743110656738, 1544143777.659294], "v": 0.1}
{"i": ["cuda", "conv2d_no_batching", [1, 28, 28, 128, 256, 3, 3, [2, 2], [1, 1]], {}, ["conv2d_no_batching", 1, 28, 28, 128, 256, 3, 3, [2, 2], [1, 1]], {"i": 59455833, "t": "", "c": null, "e": [["tile_f", "sp", [2, 1, 64, 1]], ["tile_y", "sp", [7, 1, 1, 2]], ["tile_x", "sp", [2, 1, 7, 1]], ["tile_rc", "sp", [256, 1, 1]], ["tile_ry", "sp", [1, 3, 1]], ["tile_rx", "sp", [1, 1, 3]], ["auto_unroll_max_step", "ot", 512], ["unroll_explicit", "ot", 1]]}], "r": [[0.00015546021166892808], 0, 1.6823327541351318, 1544143778.9832532], "v": 0.1}
{"i": ["cuda", "conv2d_no_batching", [1, 28, 28, 128, 256, 3, 3, [2, 2], [1, 1]], {}, ["conv2d_no_batching", 1, 28, 28, 128, 256, 3, 3, [2, 2], [1, 1]], {"i": 71885821, "t": "", "c": null, "e": [["tile_f", "sp", [2, 1, 32, 2]], ["tile_y", "sp", [1, 1, 14, 1]], ["tile_x", "sp", [14, 1, 1, 1]], ["tile_rc", "sp", [256, 1, 1]], ["tile_ry", "sp", [1, 3, 1]], ["tile_rx", "sp", [1, 1, 3]], ["auto_unroll_max_step", "ot", 1500], ["unroll_explicit", "ot", 1]]}], "r": [[0.00017555898236092264], 0, 1.714158535003662, 1544143780.3594027], "v": 0.1}
{"i": ["cuda", "conv2d_no_batching", [1, 28, 28, 128, 256, 3, 3, [2, 2], [1, 1]], {}, ["conv2d_no_batching", 1, 28, 28, 128, 256, 3, 3, [2, 2], [1, 1]], {"i": 51683673, "t": "", "c": null, "e": [["tile_f", "sp", [2, 1, 64, 1]], ["tile_y", "sp", [7, 1, 1, 2]], ["tile_x", "sp", [2, 1, 7, 1]], ["tile_rc", "sp", [64, 1, 4]], ["tile_ry", "sp", [1, 3, 1]], ["tile_rx", "sp", [3, 1, 1]], ["auto_unroll_max_step", "ot", 512], ["unroll_explicit", "ot", 1]]}], "r": [[0.00014123118181818184], 0, 1.6407363414764404, 1544143781.6886384], "v": 0.1}
{"i": ["cuda", "conv2d_no_batching", [1, 28, 28, 128, 256, 3, 3, [2, 2], [1, 1]], {}, ["conv2d_no_batching", 1, 28, 28, 128, 256, 3, 3, [2, 2], [1, 1]], {"i": 69142233, "t": "", "c": null, "e": [["tile_f", "sp", [2, 1, 64, 1]], ["tile_y", "sp", [7, 1, 1, 2]], ["tile_x", "sp", [1, 1, 7, 2]], ["tile_rc", "sp", [256, 1, 1]], ["tile_ry", "sp", [1, 1, 3]], ["tile_rx", "sp", [1, 3, 1]], ["auto_unroll_max_step", "ot", 1500], ["unroll_explicit", "ot", 1]]}], "r": [[0.00018929816824966077], 0, 1.6743814945220947, 1544143783.0982316], "v": 0.1}
{"i": ["cuda", "conv2d_no_batching", [1, 28, 28, 128, 256, 3, 3, [2, 2], [1, 1]], {}, ["conv2d_no_batching", 1, 28, 28, 128, 256, 3, 3, [2, 2], [1, 1]], {"i": 58069953, "t": "", "c": null, "e": [["tile_f", "sp", [2, 1, 64, 1]], ["tile_y", "sp", [2, 1, 1, 7]], ["tile_x", "sp", [7, 1, 2, 1]], ["tile_rc", "sp", [256, 1, 1]], ["tile_ry", "sp", [3, 1, 1]], ["tile_rx", "sp", [1, 1, 3]], ["auto_unroll_max_step", "ot", 512], ["unroll_explicit", "ot", 1]]}], "r": [[0.00026195695717344753], 0, 1.662092685699463, 1544143752.5029805], "v": 0.1}
{"i": ["cuda", "conv2d_no_batching", [1, 28, 28, 128, 256, 3, 3, [2, 2], [1, 1]], {}, ["conv2d_no_batching", 1, 28, 28, 128, 256, 3, 3, [2, 2], [1, 1]], {"i": 56691033, "t": "", "c": null, "e": [["tile_f", "sp", [2, 1, 64, 1]], ["tile_y", "sp", [7, 1, 1, 2]], ["tile_x", "sp", [2, 1, 7, 1]], ["tile_rc", "sp", [256, 1, 1]], ["tile_ry", "sp", [1, 1, 3]], ["tile_rx", "sp", [1, 3, 1]], ["auto_unroll_max_step", "ot", 512], ["unroll_explicit", "ot", 1]]}], "r": [[0.00015829509362279512], 0, 1.6886844635009766, 1544143832.659322], "v": 0.1}
{"i": ["cuda", "conv2d_no_batching", [1, 28, 28, 128, 256, 3, 3, [2, 2], [1, 1]], {}, ["conv2d_no_batching", 1, 28, 28, 128, 256, 3, 3, [2, 2], [1, 1]], {"i": 71930913, "t": "", "c": null, "e": [["tile_f", "sp", [2, 1, 64, 1]], ["tile_y", "sp", [14, 1, 1, 1]], ["tile_x", "sp", [1, 1, 14, 1]], ["tile_rc", "sp", [128, 2, 1]], ["tile_ry", "sp", [1, 3, 1]], ["tile_rx", "sp", [1, 1, 3]], ["auto_unroll_max_step", "ot", 1500], ["unroll_explicit", "ot", 1]]}], "r": [[0.00011729382631038026], 0, 1.6377723217010498, 1544143896.1127357], "v": 0.1}
{"i": ["cuda", "conv2d_no_batching", [1, 28, 28, 128, 256, 3, 3, [2, 2], [1, 1]], {}, ["conv2d_no_batching", 1, 28, 28, 128, 256, 3, 3, [2, 2], [1, 1]], {"i": 63910233, "t": "", "c": null, "e": [["tile_f", "sp", [2, 1, 64, 1]], ["tile_y", "sp", [7, 1, 1, 2]], ["tile_x", "sp", [2, 1, 7, 1]], ["tile_rc", "sp", [64, 2, 2]], ["tile_ry", "sp", [1, 3, 1]], ["tile_rx", "sp", [3, 1, 1]], ["auto_unroll_max_step", "ot", 1500], ["unroll_explicit", "ot", 1]]}], "r": [[0.00014076544640434193], 0, 1.6633331775665283, 1544143835.2703612], "v": 0.1}
{"i": ["cuda", "conv2d_no_batching", [1, 28, 28, 128, 256, 3, 3, [2, 2], [1, 1]], {}, ["conv2d_no_batching", 1, 28, 28, 128, 256, 3, 3, [2, 2], [1, 1]], {"i": 51686433, "t": "", "c": null, "e": [["tile_f", "sp", [2, 1, 64, 1]], ["tile_y", "sp", [14, 1, 1, 1]], ["tile_x", "sp", [1, 1, 14, 1]], ["tile_rc", "sp", [64, 1, 4]], ["tile_ry", "sp", [1, 3, 1]], ["tile_rx", "sp", [3, 1, 1]], ["auto_unroll_max_step", "ot", 512], ["unroll_explicit", "ot", 1]]}], "r": [[0.00013576275334018498], 0, 1.7013921737670898, 1544143897.4971423], "v": 0.1}
{"i": ["cuda", "conv2d_no_batching", [1, 28, 28, 128, 256, 3, 3, [2, 2], [1, 1]], {}, ["conv2d_no_batching", 1, 28, 28, 128, 256, 3, 3, [2, 2], [1, 1]], {"i": 34572633, "t": "", "c": null, "e": [["tile_f", "sp", [2, 1, 64, 1]], ["tile_y", "sp", [7, 1, 1, 2]], ["tile_x", "sp", [2, 1, 7, 1]], ["tile_rc", "sp", [256, 1, 1]], ["tile_ry", "sp", [1, 3, 1]], ["tile_rx", "sp", [1, 1, 3]], ["auto_unroll_max_step", "ot", 1500], ["unroll_explicit", "ot", 0]]}], "r": [[0.00015533841655359564], 0, 1.6636333465576172, 1544143837.8948934], "v": 0.1}
{"i": ["cuda", "conv2d_no_batching", [1, 28, 28, 128, 256, 3, 3, [2, 2], [1, 1]], {}, ["conv2d_no_batching", 1, 28, 28, 128, 256, 3, 3, [2, 2], [1, 1]], {"i": 44249433, "t": "", "c": null, "e": [["tile_f", "sp", [2, 1, 64, 1]], ["tile_y", "sp", [7, 1, 1, 2]], ["tile_x", "sp", [2, 1, 7, 1]], ["tile_rc", "sp", [256, 1, 1]], ["tile_ry", "sp", [1, 1, 3]], ["tile_rx", "sp", [1, 3, 1]], ["auto_unroll_max_step", "ot", 0], ["unroll_explicit", "ot", 1]]}], "r": [[0.0001552687869742198], 0, 1.718061923980713, 1544143839.277042], "v": 0.1}
{"i": ["cuda", "conv2d_no_batching", [1, 28, 28, 128, 256, 3, 3, [2, 2], [1, 1]], {}, ["conv2d_no_batching", 1, 28, 28, 128, 256, 3, 3, [2, 2], [1, 1]], {"i": 71930911, "t": "", "c": null, "e": [["tile_f", "sp", [2, 2, 32, 1]], ["tile_y", "sp", [14, 1, 1, 1]], ["tile_x", "sp", [1, 1, 14, 1]], ["tile_rc", "sp", [128, 2, 1]], ["tile_ry", "sp", [1, 3, 1]], ["tile_rx", "sp", [1, 1, 3]], ["auto_unroll_max_step", "ot", 1500], ["unroll_explicit", "ot", 1]]}], "r": [[0.00010296575642343268], 0, 1.5684518814086914, 1544143898.744723], "v": 0.1}
{"i": ["cuda", "conv2d_no_batching", [1, 28, 28, 128, 256, 3, 3, [2, 2], [1, 1]], {}, ["conv2d_no_batching", 1, 28, 28, 128, 256, 3, 3, [2, 2], [1, 1]], {"i": 51468633, "t": "", "c": null, "e": [["tile_f", "sp", [2, 1, 64, 1]], ["tile_y", "sp", [7, 1, 1, 2]], ["tile_x", "sp", [2, 1, 7, 1]], ["tile_rc", "sp", [64, 2, 2]], ["tile_ry", "sp", [1, 3, 1]], ["tile_rx", "sp", [3, 1, 1]], ["auto_unroll_max_step", "ot", 512], ["unroll_explicit", "ot", 1]]}], "r": [[0.0001406354450474898], 0, 1.648103952407837, 1544143841.8160777], "v": 0.1}
{"i": ["cuda", "conv2d_no_batching", [1, 28, 28, 128, 256, 3, 3, [2, 2], [1, 1]], {}, ["conv2d_no_batching", 1, 28, 28, 128, 256, 3, 3, [2, 2], [1, 1]], {"i": 26800473, "t": "", "c": null, "e": [["tile_f", "sp", [2, 1, 64, 1]], ["tile_y", "sp", [7, 1, 1, 2]], ["tile_x", "sp", [2, 1, 7, 1]], ["tile_rc", "sp", [64, 1, 4]], ["tile_ry", "sp", [1, 3, 1]], ["tile_rx", "sp", [3, 1, 1]], ["auto_unroll_max_step", "ot", 1500], ["unroll_explicit", "ot", 0]]}], "r": [[0.00014213573812754408], 0, 1.760526180267334, 1544143843.183072], "v": 0.1}
{"i": ["cuda", "conv2d_no_batching", [1, 28, 28, 128, 256, 3, 3, [2, 2], [1, 1]], {}, ["conv2d_no_batching", 1, 28, 28, 128, 256, 3, 3, [2, 2], [1, 1]], {"i": 71902833, "t": "", "c": null, "e": [["tile_f", "sp", [2, 1, 64, 1]], ["tile_y", "sp", [2, 1, 7, 1]], ["tile_x", "sp", [7, 1, 1, 2]], ["tile_rc", "sp", [256, 1, 1]], ["tile_ry", "sp", [1, 3, 1]], ["tile_rx", "sp", [1, 1, 3]], ["auto_unroll_max_step", "ot", 1500], ["unroll_explicit", "ot", 1]]}], "r": [[0.00015611178154681138], 0, 1.6716656684875488, 1544143844.5210595], "v": 0.1}
{"i": ["cuda", "conv2d_no_batching", [1, 28, 28, 128, 256, 3, 3, [2, 2], [1, 1]], {}, ["conv2d_no_batching", 1, 28, 28, 128, 256, 3, 3, [2, 2], [1, 1]], {"i": 71927553, "t": "", "c": null, "e": [["tile_f", "sp", [2, 1, 64, 1]], ["tile_y", "sp", [7, 1, 2, 1]], ["tile_x", "sp", [2, 1, 7, 1]], ["tile_rc", "sp", [128, 2, 1]], ["tile_ry", "sp", [1, 3, 1]], ["tile_rx", "sp", [1, 1, 3]], ["auto_unroll_max_step", "ot", 1500], ["unroll_explicit", "ot", 1]]}], "r": [[0.0001445697001356852], 0, 1.686716079711914, 1544143845.8701034], "v": 0.1}
{"i": ["cuda", "conv2d_no_batching", [1, 28, 28, 128, 256, 3, 3, [2, 2], [1, 1]], {}, ["conv2d_no_batching", 1, 28, 28, 128, 256, 3, 3, [2, 2], [1, 1]], {"i": 34581153, "t": "", "c": null, "e": [["tile_f", "sp", [2, 1, 64, 1]], ["tile_y", "sp", [14, 1, 1, 1]], ["tile_x", "sp", [1, 1, 7, 2]], ["tile_rc", "sp", [256, 1, 1]], ["tile_ry", "sp", [1, 3, 1]], ["tile_rx", "sp", [1, 1, 3]], ["auto_unroll_max_step", "ot", 1500], ["unroll_explicit", "ot", 0]]}], "r": [[0.0001655337381275441], 0, 1.7314176559448242, 1544143847.2545974], "v": 0.1}
