baseline/conv2d_c12_curve_n2000_2.log
{"i": ["cuda", "conv2d_no_batching", [1, 7, 7, 512, 512, 3, 3, [1, 1], [1, 1]], {}, ["conv2d_no_batching", 1, 7, 7, 512, 512, 3, 3, [1, 1], [1, 1]], {"i": 9303471, "t": "", "c": null, "e": [["tile_f", "sp", [8, 8, 2, 4]], ["tile_y", "sp", [7, 1, 1, 1]], ["tile_x", "sp", [7, 1, 1, 1]], ["tile_rc", "sp", [64, 8, 1]], ["tile_ry", "sp", [3, 1, 1]], ["tile_rx", "sp", [1, 3, 1]], ["auto_unroll_max_step", "ot", 1500], ["unroll_explicit", "ot", 1]]}], "r": [[0.0077771337734375], 0, 5.387788534164429, 1544137749.3169136], "v": 0.1}
{"i": ["cuda", "conv2d_no_batching", [1, 7, 7, 512, 512, 3, 3, [1, 1], [1, 1]], {}, ["conv2d_no_batching", 1, 7, 7, 512, 512, 3, 3, [1, 1], [1, 1]], {"i": 8449265, "t": "", "c": null, "e": [["tile_f", "sp", [16, 2, 1, 16]], ["tile_y", "sp", [1, 7, 1, 1]], ["tile_x", "sp", [1, 7, 1, 1]], ["tile_rc", "sp", [16, 2, 16]], ["tile_ry", "sp", [1, 3, 1]], ["tile_rx", "sp", [1, 1, 3]], ["auto_unroll_max_step", "ot", 512], ["unroll_explicit", "ot", 1]]}], "r": [[0.30921527625], 0, 5.7385594844818115, 1544137728.7991931], "v": 0.1}
{"i": ["cuda", "conv2d_no_batching", [1, 7, 7, 512, 512, 3, 3, [1, 1], [1, 1]], {}, ["conv2d_no_batching", 1, 7, 7, 512, 512, 3, 3, [1, 1], [1, 1]], {"i": 2145007, "t": "", "c": null, "e": [["tile_f", "sp", [4, 128, 1, 1]], ["tile_y", "sp", [1, 1, 7, 1]], ["tile_x", "sp", [1, 7, 1, 1]], ["tile_rc", "sp", [32, 16, 1]], ["tile_ry", "sp", [1, 1, 3]], ["tile_rx", "sp", [3, 1, 1]], ["auto_unroll_max_step", "ot", 512], ["unroll_explicit", "ot", 0]]}], "r": [[0.099181385], 0, 5.461604595184326, 1544137732.2001069], "v": 0.1}
{"i": ["cuda", "conv2d_no_batching", [1, 7, 7, 512, 512, 3, 3, [1, 1], [1, 1]], {}, ["conv2d_no_batching", 1, 7, 7, 512, 512, 3, 3, [1, 1], [1, 1]], {"i": 4169696, "t": "", "c": null, "e": [["tile_f", "sp", [8, 4, 16, 1]], ["tile_y", "sp", [1, 7, 1, 1]], ["tile_x", "sp", [1, 1, 7, 1]], ["tile_rc", "sp", [16, 4, 8]], ["tile_ry", "sp", [3, 1, 1]], ["tile_rx", "sp", [1, 3, 1]], ["auto_unroll_max_step", "ot", 1500], ["unroll_explicit", "ot", 0]]}], "r": [[0.0007846041796875], 0, 1.6664774417877197, 1544137750.5493963], "v": 0.1}
{"i": ["cuda", "conv2d_no_batching", [1, 7, 7, 512, 512, 3, 3, [1, 1], [1, 1]], {}, ["conv2d_no_batching", 1, 7, 7, 512, 512, 3, 3, [1, 1], [1, 1]], {"i": 6630249, "t": "", "c": null, "e": [["tile_f", "sp", [32, 2, 2, 4]], ["tile_y", "sp", [1, 7, 1, 1]], ["tile_x", "sp", [1, 1, 7, 1]], ["tile_rc", "sp", [32, 8, 2]], ["tile_ry", "sp", [1, 3, 1]], ["tile_rx", "sp", [1, 1, 3]], ["auto_unroll_max_step", "ot", 0], ["unroll_explicit", "ot", 1]]}], "r": [[0.00315703678125], 0, 2.237978458404541, 1544137752.4762557], "v": 0.1}
{"i": ["cuda", "conv2d_no_batching", [1, 7, 7, 512, 512, 3, 3, [1, 1], [1, 1]], {}, ["conv2d_no_batching", 1, 7, 7, 512, 512, 3, 3, [1, 1], [1, 1]], {"i": 4652672, "t": "", "c": null, "e": [["tile_f", "sp", [4, 16, 2, 4]], ["tile_y", "sp", [7, 1, 1, 1]], ["tile_x", "sp", [1, 1, 1, 7]], ["tile_rc", "sp", [256, 2, 1]], ["tile_ry", "sp", [3, 1, 1]], ["tile_rx", "sp", [1, 1, 3]], ["auto_unroll_max_step", "ot", 1500], ["unroll_explicit", "ot", 0]]}], "r": [[0.03237500125], 0, 2.9500186443328857, 1544137737.4676337], "v": 0.1}
{"i": ["cuda", "conv2d_no_batching", [1, 7, 7, 512, 512, 3, 3, [1, 1], [1, 1]], {}, ["conv2d_no_batching", 1, 7, 7, 512, 512, 3, 3, [1, 1], [1, 1]], {"i": 3192776, "t": "", "c": null, "e": [["tile_f", "sp", [64, 1, 1, 8]], ["tile_y", "sp", [7, 1, 1, 1]], ["tile_x", "sp", [7, 1, 1, 1]], ["tile_rc", "sp", [64, 1, 8]], ["tile_ry", "sp", [1, 3, 1]], ["tile_rx", "sp", [1, 1, 3]], ["auto_unroll_max_step", "ot", 512], ["unroll_explicit", "ot", 0]]}], "r": [[0.046337564], 0, 1.779254674911499, 1544137739.4233916], "v": 0.1}
{"i": ["cuda", "conv2d_no_batching", [1, 7, 7, 512, 512, 3, 3, [1, 1], [1, 1]], {}, ["conv2d_no_batching", 1, 7, 7, 512, 512, 3, 3, [1, 1], [1, 1]], {"i": 5655168, "t": "", "c": null, "e": [["tile_f", "sp", [8, 16, 2, 2]], ["tile_y", "sp", [1, 7, 1, 1]], ["tile_x", "sp", [1, 1, 7, 1]], ["tile_rc", "sp", [128, 2, 2]], ["tile_ry", "sp", [1, 1, 3]], ["tile_rx", "sp", [3, 1, 1]], ["auto_unroll_max_step", "ot", 0], ["unroll_explicit", "ot", 1]]}], "r": [[0.0231319611640625], 0, 10.182200193405151, 1544137762.1145864], "v": 0.1}
{"i": ["cuda", "conv2d_no_batching", [1, 7, 7, 512, 512, 3, 3, [1, 1], [1, 1]], {}, ["conv2d_no_batching", 1, 7, 7, 512, 512, 3, 3, [1, 1], [1, 1]], {"i": 7975804, "t": "", "c": null, "e": [["tile_f", "sp", [16, 2, 2, 8]], ["tile_y", "sp", [1, 7, 1, 1]], ["tile_x", "sp", [1, 1, 1, 7]], ["tile_rc", "sp", [256, 1, 2]], ["tile_ry", "sp", [1, 1, 3]], ["tile_rx", "sp", [1, 3, 1]], ["auto_unroll_max_step", "ot", 512], ["unroll_explicit", "ot", 1]]}], "r": [[0.03626694325], 0, 2.611104726791382, 1544137742.6134317], "v": 0.1}
{"i": ["cuda", "conv2d_no_batching", [1, 7, 7, 512, 512, 3, 3, [1, 1], [1, 1]], {}, ["conv2d_no_batching", 1, 7, 7, 512, 512, 3, 3, [1, 1], [1, 1]], {"i": 8278180, "t": "", "c": null, "e": [["tile_f", "sp", [64, 2, 4, 1]], ["tile_y", "sp", [7, 1, 1, 1]], ["tile_x", "sp", [1, 1, 1, 7]], ["tile_rc", "sp", [8, 2, 32]], ["tile_ry", "sp", [3, 1, 1]], ["tile_rx", "sp", [1, 1, 3]], ["auto_unroll_max_step", "ot", 512], ["unroll_explicit", "ot", 1]]}], "r": [[0.011796697296875], 0, 7.426106214523315, 1544137767.5160487], "v": 0.1}
{"i": ["cuda", "conv2d_no_batching", [1, 7, 7, 512, 512, 3, 3, [1, 1], [1, 1]], {}, ["conv2d_no_batching", 1, 7, 7, 512, 512, 3, 3, [1, 1], [1, 1]], {"i": 1356011, "t": "", "c": null, "e": [["tile_f", "sp", [4, 4, 4, 8]], ["tile_y", "sp", [1, 1, 1, 7]], ["tile_x", "sp", [7, 1, 1, 1]], ["tile_rc", "sp", [512, 1, 1]], ["tile_ry", "sp", [1, 3, 1]], ["tile_rx", "sp", [1, 1, 3]], ["auto_unroll_max_step", "ot", 0], ["unroll_explicit", "ot", 0]]}], "r": [[0.0179211328984375], 0, 8.215225219726562, 1544137775.1664937], "v": 0.1}
{"i": ["cuda", "conv2d_no_batching", [1, 7, 7, 512, 512, 3, 3, [1, 1], [1, 1]], {}, ["conv2d_no_batching", 1, 7, 7, 512, 512, 3, 3, [1, 1], [1, 1]], {"i": 3329019, "t": "", "c": null, "e": [["tile_f", "sp", [1, 1, 16, 32]], ["tile_y", "sp", [1, 1, 1, 7]], ["tile_x", "sp", [1, 1, 7, 1]], ["tile_rc", "sp", [256, 1, 2]], ["tile_ry", "sp", [1, 1, 3]], ["tile_rx", "sp", [1, 1, 3]], ["auto_unroll_max_step", "ot", 512], ["unroll_explicit", "ot", 0]]}], "r": [[0.0076739263984375], 0, 6.128206968307495, 1544137784.3289409], "v": 0.1}
{"i": ["cuda", "conv2d_no_batching", [1, 7, 7, 512, 512, 3, 3, [1, 1], [1, 1]], {}, ["conv2d_no_batching", 1, 7, 7, 512, 512, 3, 3, [1, 1], [1, 1]], {"i": 5391824, "t": "", "c": null, "e": [["tile_f", "sp", [128, 1, 2, 2]], ["tile_y", "sp", [7, 1, 1, 1]], ["tile_x", "sp", [1, 1, 1, 7]], ["tile_rc", "sp", [4, 2, 64]], ["tile_ry", "sp", [3, 1, 1]], ["tile_rx", "sp", [3, 1, 1]], ["auto_unroll_max_step", "ot", 0], ["unroll_explicit", "ot", 1]]}], "r": [[0.0199820814609375], 0, 9.1052725315094, 1544137793.065438], "v": 0.1}
{"i": ["cuda", "conv2d_no_batching", [1, 7, 7, 512, 512, 3, 3, [1, 1], [1, 1]], {}, ["conv2d_no_batching", 1, 7, 7, 512, 512, 3, 3, [1, 1], [1, 1]], {"i": 3720407, "t": "", "c": null, "e": [["tile_f", "sp", [2, 1, 4, 64]], ["tile_y", "sp", [1, 1, 7, 1]], ["tile_x", "sp", [1, 1, 1, 7]], ["tile_rc", "sp", [128, 2, 2]], ["tile_ry", "sp", [1, 3, 1]], ["tile_rx", "sp", [3, 1, 1]], ["auto_unroll_max_step", "ot", 1500], ["unroll_explicit", "ot", 0]]}], "r": [[0.0255289839765625], 0, 16.69437861442566, 1544137808.0129366], "v": 0.1}
{"i": ["cuda", "conv2d_no_batching", [1, 7, 7, 512, 512, 3, 3, [1, 1], [1, 1]], {}, ["conv2d_no_batching", 1, 7, 7, 512, 512, 3, 3, [1, 1], [1, 1]], {"i": 4134605, "t": "", "c": null, "e": [["tile_f", "sp", [8, 4, 2, 8]], ["tile_y", "sp", [1, 7, 1, 1]], ["tile_x", "sp", [1, 1, 7, 1]], ["tile_rc", "sp", [128, 1, 4]], ["tile_ry", "sp", [3, 1, 1]], ["tile_rx", "sp", [1, 3, 1]], ["auto_unroll_max_step", "ot", 1500], ["unroll_explicit", "ot", 0]]}], "r": [[0.0083908353984375], 0, 6.1535515785217285, 1544137876.2712824], "v": 0.1}
{"i": ["cuda", "conv2d_no_batching", [1, 7, 7, 512, 512, 3, 3, [1, 1], [1, 1]], {}, ["conv2d_no_batching", 1, 7, 7, 512, 512, 3, 3, [1, 1], [1, 1]], {"i": 10381461, "t": "", "c": null, "e": [["tile_f", "sp", [64, 2, 1, 4]], ["tile_y", "sp", [7, 1, 1, 1]], ["tile_x", "sp", [1, 7, 1, 1]], ["tile_rc", "sp", [32, 1, 16]], ["tile_ry", "sp", [1, 1, 3]], ["tile_rx", "sp", [1, 1, 3]], ["auto_unroll_max_step", "ot", 1500], ["unroll_explicit", "ot", 1]]}], "r": [[0.0296678069453125], 0, 17.26482915878296, 1544137921.1769636], "v": 0.1}
{"i": ["cuda", "conv2d_no_batching", [1, 7, 7, 512, 512, 3, 3, [1, 1], [1, 1]], {}, ["conv2d_no_batching", 1, 7, 7, 512, 512, 3, 3, [1, 1], [1, 1]], {"i": 6197104, "t": "", "c": null, "e": [["tile_f", "sp", [16, 2, 2, 8]], ["tile_y", "sp", [7, 1, 1, 1]], ["tile_x", "sp", [1, 1, 7, 1]], ["tile_rc", "sp", [512, 1, 1]], ["tile_ry", "sp", [1, 1, 3]], ["tile_rx", "sp", [1, 3, 1]], ["auto_unroll_max_step", "ot", 0], ["unroll_explicit", "ot", 1]]}], "r": [[0.0028535881171875], 0, 2.0828590393066406, 1544137923.0685947], "v": 0.1}
{"i": ["cuda", "conv2d_no_batching", [1, 7, 7, 512, 512, 3, 3, [1, 1], [1, 1]], {}, ["conv2d_no_batching", 1, 7, 7, 512, 512, 3, 3, [1, 1], [1, 1]], {"i": 1365667, "t": "", "c": null, "e": [["tile_f", "sp", [4, 2, 16, 4]], ["tile_y", "sp", [1, 1, 1, 7]], ["tile_x", "sp", [1, 1, 1, 7]], ["tile_rc", "sp", [128, 4, 1]], ["tile_ry", "sp", [1, 3, 1]], ["tile_rx", "sp", [1, 1, 3]], ["auto_unroll_max_step", "ot", 0], ["unroll_explicit", "ot", 0]]}], "r": [[0.06346276159375], 0, 25.899306297302246, 1544137948.4558923], "v": 0.1}
{"i": ["cuda", "conv2d_no_batching", [1, 7, 7, 512, 512, 3, 3, [1, 1], [1, 1]], {}, ["conv2d_no_batching", 1, 7, 7, 512, 512, 3, 3, [1, 1], [1, 1]], {"i": 9135919, "t": "", "c": null, "e": [["tile_f", "sp", [1, 1, 16, 32]], ["tile_y", "sp", [1, 1, 7, 1]], ["tile_x", "sp", [1, 7, 1, 1]], ["tile_rc", "sp", [256, 1, 2]], ["tile_ry", "sp", [1, 1, 3]], ["tile_rx", "sp", [3, 1, 1]], ["auto_unroll_max_step", "ot", 1500], ["unroll_explicit", "ot", 1]]}], "r": [[0.0068831230703125], 0, 5.954526901245117, 1544137952.6644642], "v": 0.1}
{"i": ["cuda", "conv2d_no_batching", [1, 7, 7, 512, 512, 3, 3, [1, 1], [1, 1]], {}, ["conv2d_no_batching", 1, 7, 7, 512, 512, 3, 3, [1, 1], [1, 1]], {"i": 7018301, "t": "", "c": null, "e": [["tile_f", "sp", [8, 4, 8, 2]], ["tile_y", "sp", [1, 7, 1, 1]], ["tile_x", "sp", [1, 1, 1, 7]], ["tile_rc", "sp", [32, 8, 2]], ["tile_ry", "sp", [3, 1, 1]], ["tile_rx", "sp", [3, 1, 1]], ["auto_unroll_max_step", "ot", 512], ["unroll_explicit", "ot", 1]]}], "r": [[0.0146795816328125], 0, 8.189206600189209, 1544137959.7634566], "v": 0.1}
{"i": ["cuda", "conv2d_no_batching", [1, 7, 7, 512, 512, 3, 3, [1, 1], [1, 1]], {}, ["conv2d_no_batching", 1, 7, 7, 512, 512, 3, 3, [1, 1], [1, 1]], {"i": 405825, "t": "", "c": null, "e": [["tile_f", "sp", [8, 4, 2, 8]], ["tile_y", "sp", [7, 1, 1, 1]], ["tile_x", "sp", [1, 7, 1, 1]], ["tile_rc", "sp", [16, 32, 1]], ["tile_ry", "sp", [1, 1, 3]], ["tile_rx", "sp", [3, 1, 1]], ["auto_unroll_max_step", "ot", 0], ["unroll_explicit", "ot", 0]]}], "r": [[0.01514397921875], 0, 7.391873359680176, 1544137966.7619975], "v": 0.1}
{"i": ["cuda", "conv2d_no_batching", [1, 7, 7, 512, 512, 3, 3, [1, 1], [1, 1]], {}, ["conv2d_no_batching", 1, 7, 7, 512, 512, 3, 3, [1, 1], [1, 1]], {"i": 511291, "t": "", "c": null, "e": [["tile_f", "sp", [128, 2, 2, 1]], ["tile_y", "sp", [7, 1, 1, 1]], ["tile_x", "sp", [1, 7, 1, 1]], ["tile_rc", "sp", [16, 2, 16]], ["tile_ry", "sp", [1, 1, 3]], ["tile_rx", "sp", [3, 1, 1]], ["auto_unroll_max_step", "ot", 0], ["unroll_explicit", "ot", 0]]}], "r": [[0.0379760541796875], 0, 16.141188859939575, 1544137982.4296334], "v": 0.1}
{"i": ["cuda", "conv2d_no_batching", [1, 7, 7, 512, 512, 3, 3, [1, 1], [1, 1]], {}, ["conv2d_no_batching", 1, 7, 7, 512, 512, 3, 3, [1, 1], [1, 1]], {"i": 5523387, "t": "", "c": null, "e": [["tile_f", "sp", [16, 8, 2, 2]], ["tile_y", "sp", [1, 1, 7, 1]], ["tile_x", "sp", [7, 1, 1, 1]], ["tile_rc", "sp", [16, 4, 8]], ["tile_ry", "sp", [1, 3, 1]], ["tile_rx", "sp", [3, 1, 1]], ["auto_unroll_max_step", "ot", 0], ["unroll_explicit", "ot", 1]]}], "r": [[0.0034829926953125], 0, 2.418682813644409, 1544137984.7468126], "v": 0.1}
{"i": ["cuda", "conv2d_no_batching", [1, 7, 7, 512, 512, 3, 3, [1, 1], [1, 1]], {}, ["conv2d_no_batching", 1, 7, 7, 512, 512, 3, 3, [1, 1], [1, 1]], {"i": 7006044, "t": "", "c": null, "e": [["tile_f", "sp", [16, 2, 2, 8]], ["tile_y", "sp", [1, 7, 1, 1]], ["tile_x", "sp", [1, 7, 1, 1]], ["tile_rc", "sp", [256, 1, 2]], ["tile_ry", "sp", [3, 1, 1]], ["tile_rx", "sp", [3, 1, 1]], ["auto_unroll_max_step", "ot", 512], ["unroll_explicit", "ot", 1]]}], "r": [[0.04300509115625], 0, 18.396559953689575, 1544138048.9157288], "v": 0.1}
{"i": ["cuda", "conv2d_no_batching", [1, 7, 7, 512, 512, 3, 3, [1, 1], [1, 1]], {}, ["conv2d_no_batching", 1, 7, 7, 512, 512, 3, 3, [1, 1], [1, 1]], {"i": 7203824, "t": "", "c": null, "e": [["tile_f", "sp", [16, 2, 2, 8]], ["tile_y", "sp", [7, 1, 1, 1]], ["tile_x", "sp", [1, 1, 7, 1]], ["tile_rc", "sp", [128, 2, 2]], ["tile_ry", "sp", [1, 3, 1]], ["tile_rx", "sp", [3, 1, 1]], ["auto_unroll_max_step", "ot", 512], ["unroll_explicit", "ot", 1]]}], "r": [[0.0006633778947368422], 0, 1.6226110458374023, 1544138220.7733133], "v": 0.1}
{"i": ["cuda", "conv2d_no_batching", [1, 7, 7, 512, 512, 3, 3, [1, 1], [1, 1]], {}, ["conv2d_no_batching", 1, 7, 7, 512, 512, 3, 3, [1, 1], [1, 1]], {"i": 7198984, "t": "", "c": null, "e": [["tile_f", "sp", [16, 2, 2, 8]], ["tile_y", "sp", [1, 1, 7, 1]], ["tile_x", "sp", [7, 1, 1, 1]], ["tile_rc", "sp", [256, 1, 2]], ["tile_ry", "sp", [1, 3, 1]], ["tile_rx", "sp", [3, 1, 1]], ["auto_unroll_max_step", "ot", 512], ["unroll_explicit", "ot", 1]]}], "r": [[0.0006575606210526316], 0, 1.465907096862793, 1544138221.841522], "v": 0.1}
{"i": ["cuda", "conv2d_no_batching", [1, 7, 7, 512, 512, 3, 3, [1, 1], [1, 1]], {}, ["conv2d_no_batching", 1, 7, 7, 512, 512, 3, 3, [1, 1], [1, 1]], {"i": 7200524, "t": "", "c": null, "e": [["tile_f", "sp", [16, 2, 2, 8]], ["tile_y", "sp", [1, 7, 1, 1]], ["tile_x", "sp", [1, 1, 7, 1]], ["tile_rc", "sp", [256, 1, 2]], ["tile_ry", "sp", [1, 3, 1]], ["tile_rx", "sp", [3, 1, 1]], ["auto_unroll_max_step", "ot", 512], ["unroll_explicit", "ot", 1]]}], "r": [[0.0007139388421052632], 0, 1.788120985031128, 1544138222.954527], "v": 0.1}
{"i": ["cuda", "conv2d_no_batching", [1, 7, 7, 512, 512, 3, 3, [1, 1], [1, 1]], {}, ["conv2d_no_batching", 1, 7, 7, 512, 512, 3, 3, [1, 1], [1, 1]], {"i": 7022984, "t": "", "c": null, "e": [["tile_f", "sp", [16, 2, 2, 8]], ["tile_y", "sp", [1, 1, 7, 1]], ["tile_x", "sp", [7, 1, 1, 1]], ["tile_rc", "sp", [8, 32, 2]], ["tile_ry", "sp", [3, 1, 1]], ["tile_rx", "sp", [3, 1, 1]], ["auto_unroll_max_step", "ot", 512], ["unroll_explicit", "ot", 1]]}], "r": [[0.0028784539453125], 0, 3.7832822799682617, 1544138054.71684], "v": 0.1}
{"i": ["cuda", "conv2d_no_batching", [1, 7, 7, 512, 512, 3, 3, [1, 1], [1, 1]], {}, ["conv2d_no_batching", 1, 7, 7, 512, 512, 3, 3, [1, 1], [1, 1]], {"i": 7199644, "t": "", "c": null, "e": [["tile_f", "sp", [16, 2, 2, 8]], ["tile_y", "sp", [1, 7, 1, 1]], ["tile_x", "sp", [1, 7, 1, 1]], ["tile_rc", "sp", [256, 1, 2]], ["tile_ry", "sp", [1, 3, 1]], ["tile_rx", "sp", [3, 1, 1]], ["auto_unroll_max_step", "ot", 512], ["unroll_explicit", "ot", 1]]}], "r": [[0.0411913659453125], 0, 17.8808913230896, 1544138071.4901862], "v": 0.1}
{"i": ["cuda", "conv2d_no_batching", [1, 7, 7, 512, 512, 3, 3, [1, 1], [1, 1]], {}, ["conv2d_no_batching", 1, 7, 7, 512, 512, 3, 3, [1, 1], [1, 1]], {"i": 7019904, "t": "", "c": null, "e": [["tile_f", "sp", [16, 2, 2, 8]], ["tile_y", "sp", [7, 1, 1, 1]], ["tile_x", "sp", [1, 7, 1, 1]], ["tile_rc", "sp", [16, 16, 2]], ["tile_ry", "sp", [3, 1, 1]], ["tile_rx", "sp", [3, 1, 1]], ["auto_unroll_max_step", "ot", 512], ["unroll_explicit", "ot", 1]]}], "r": [[0.00108017409375], 0, 3.279996395111084, 1544138072.893886], "v": 0.1}
{"i": ["cuda", "conv2d_no_batching", [1, 7, 7, 512, 512, 3, 3, [1, 1], [1, 1]], {}, ["conv2d_no_batching", 1, 7, 7, 512, 512, 3, 3, [1, 1], [1, 1]], {"i": 7010224, "t": "", "c": null, "e": [["tile_f", "sp", [16, 2, 2, 8]], ["tile_y", "sp", [7, 1, 1, 1]], ["tile_x", "sp", [1, 1, 7, 1]], ["tile_rc", "sp", [128, 2, 2]], ["tile_ry", "sp", [3, 1, 1]], ["tile_rx", "sp", [3, 1, 1]], ["auto_unroll_max_step", "ot", 512], ["unroll_explicit", "ot", 1]]}], "r": [[0.0005353839578947369], 0, 1.6541681289672852, 1544138223.9437318], "v": 0.1}
{"i": ["cuda", "conv2d_no_batching", [1, 7, 7, 512, 512, 3, 3, [1, 1], [1, 1]], {}, ["conv2d_no_batching", 1, 7, 7, 512, 512, 3, 3, [1, 1], [1, 1]], {"i": 7794524, "t": "", "c": null, "e": [["tile_f", "sp", [16, 2, 2, 8]], ["tile_y", "sp", [1, 7, 1, 1]], ["tile_x", "sp", [1, 7, 1, 1]], ["tile_rc", "sp", [16, 16, 2]], ["tile_ry", "sp", [1, 3, 1]], ["tile_rx", "sp", [1, 3, 1]], ["auto_unroll_max_step", "ot", 512], ["unroll_explicit", "ot", 1]]}], "r": [[0.0434514143515625], 0, 18.627999782562256, 1544138091.5971866], "v": 0.1}
{"i": ["cuda", "conv2d_no_batching", [1, 7, 7, 512, 512, 3, 3, [1, 1], [1, 1]], {}, ["conv2d_no_batching", 1, 7, 7, 512, 512, 3, 3, [1, 1], [1, 1]], {"i": 7587724, "t": "", "c": null, "e": [["tile_f", "sp", [16, 2, 2, 8]], ["tile_y", "sp", [1, 7, 1, 1]], ["tile_x", "sp", [1, 1, 7, 1]], ["tile_rc", "sp", [256, 1, 2]], ["tile_ry", "sp", [3, 1, 1]], ["tile_rx", "sp", [1, 3, 1]], ["auto_unroll_max_step", "ot", 512], ["unroll_explicit", "ot", 1]]}], "r": [[0.001304982140625], 0, 2.132737398147583, 1544138092.9570925], "v": 0.1}
{"i": ["cuda", "conv2d_no_batching", [1, 7, 7, 512, 512, 3, 3, [1, 1], [1, 1]], {}, ["conv2d_no_batching", 1, 7, 7, 512, 512, 3, 3, [1, 1], [1, 1]], {"i": 7780224, "t": "", "c": null, "e": [["tile_f", "sp", [16, 2, 2, 8]], ["tile_y", "sp", [7, 1, 1, 1]], ["tile_x", "sp", [1, 7, 1, 1]], ["tile_rc", "sp", [256, 1, 2]], ["tile_ry", "sp", [1, 3, 1]], ["tile_rx", "sp", [1, 3, 1]], ["auto_unroll_max_step", "ot", 512], ["unroll_explicit", "ot", 1]]}], "r": [[0.0016062964609375], 0, 2.4104785919189453, 1544138094.4637582], "v": 0.1}
{"i": ["cuda", "conv2d_no_batching", [1, 7, 7, 512, 512, 3, 3, [1, 1], [1, 1]], {}, ["conv2d_no_batching", 1, 7, 7, 512, 512, 3, 3, [1, 1], [1, 1]], {"i": 7586184, "t": "", "c": null, "e": [["tile_f", "sp", [16, 2, 2, 8]], ["tile_y", "sp", [1, 1, 7, 1]], ["tile_x", "sp", [7, 1, 1, 1]], ["tile_rc", "sp", [256, 1, 2]], ["tile_ry", "sp", [3, 1, 1]], ["tile_rx", "sp", [1, 3, 1]], ["auto_unroll_max_step", "ot", 512], ["unroll_explicit", "ot", 1]]}], "r": [[0.000710377994736842], 0, 1.5090975761413574, 1544138225.0428395], "v": 0.1}
{"i": ["cuda", "conv2d_no_batching", [1, 7, 7, 512, 512, 3, 3, [1, 1], [1, 1]], {}, ["conv2d_no_batching", 1, 7, 7, 512, 512, 3, 3, [1, 1], [1, 1]], {"i": 7586844, "t": "", "c": null, "e": [["tile_f", "sp", [16, 2, 2, 8]], ["tile_y", "sp", [1, 7, 1, 1]], ["tile_x", "sp", [1, 7, 1, 1]], ["tile_rc", "sp", [256, 1, 2]], ["tile_ry", "sp", [3, 1, 1]], ["tile_rx", "sp", [1, 3, 1]], ["auto_unroll_max_step", "ot", 512], ["unroll_explicit", "ot", 1]]}], "r": [[0.0378272218046875], 0, 16.508256912231445, 1544138110.9210863], "v": 0.1}
{"i": ["cuda", "conv2d_no_batching", [1, 7, 7, 512, 512, 3, 3, [1, 1], [1, 1]], {}, ["conv2d_no_batching", 1, 7, 7, 512, 512, 3, 3, [1, 1], [1, 1]], {"i": 7006704, "t": "", "c": null, "e": [["tile_f", "sp", [16, 2, 2, 8]], ["tile_y", "sp", [7, 1, 1, 1]], ["tile_x", "sp", [1, 1, 7, 1]], ["tile_rc", "sp", [256, 1, 2]], ["tile_ry", "sp", [3, 1, 1]], ["tile_rx", "sp", [3, 1, 1]], ["auto_unroll_max_step", "ot", 512], ["unroll_explicit", "ot", 1]]}], "r": [[0.0005624043315789474], 0, 1.3034236431121826, 1544138226.012288], "v": 0.1}
{"i": ["cuda", "conv2d_no_batching", [1, 7, 7, 512, 512, 3, 3, [1, 1], [1, 1]], {}, ["conv2d_no_batching", 1, 7, 7, 512, 512, 3, 3, [1, 1], [1, 1]], {"i": 7781104, "t": "", "c": null, "e": [["tile_f", "sp", [16, 2, 2, 8]], ["tile_y", "sp", [7, 1, 1, 1]], ["tile_x", "sp", [1, 1, 7, 1]], ["tile_rc", "sp", [256, 1, 2]], ["tile_ry", "sp", [1, 3, 1]], ["tile_rx", "sp", [1, 3, 1]], ["auto_unroll_max_step", "ot", 512], ["unroll_explicit", "ot", 1]]}], "r": [[0.0006120614789473684], 0, 1.5593767166137695, 1544138227.0157168], "v": 0.1}
{"i": ["cuda", "conv2d_no_batching", [1, 7, 7, 512, 512, 3, 3, [1, 1], [1, 1]], {}, ["conv2d_no_batching", 1, 7, 7, 512, 512, 3, 3, [1, 1], [1, 1]], {"i": 7779784, "t": "", "c": null, "e": [["tile_f", "sp", [16, 2, 2, 8]], ["tile_y", "sp", [1, 1, 7, 1]], ["tile_x", "sp", [7, 1, 1, 1]], ["tile_rc", "sp", [256, 1, 2]], ["tile_ry", "sp", [1, 3, 1]], ["tile_rx", "sp", [1, 3, 1]], ["auto_unroll_max_step", "ot", 512], ["unroll_explicit", "ot", 1]]}], "r": [[0.0006341286105263158], 0, 1.5658655166625977, 1544138228.057737], "v": 0.1}
{"i": ["cuda", "conv2d_no_batching", [1, 7, 7, 512, 512, 3, 3, [1, 1], [1, 1]], {}, ["conv2d_no_batching", 1, 7, 7, 512, 512, 3, 3, [1, 1], [1, 1]], {"i": 7780444, "t": "", "c": null, "e": [["tile_f", "sp", [16, 2, 2, 8]], ["tile_y", "sp", [1, 7, 1, 1]], ["tile_x", "sp", [1, 7, 1, 1]], ["tile_rc", "sp", [256, 1, 2]], ["tile_ry", "sp", [1, 3, 1]], ["tile_rx", "sp", [1, 3, 1]], ["auto_unroll_max_step", "ot", 512], ["unroll_explicit", "ot", 1]]}], "r": [[0.0354446744375], 0, 15.71720814704895, 1544138128.4875026], "v": 0.1}
{"i": ["cuda", "conv2d_no_batching", [1, 7, 7, 512, 512, 3, 3, [1, 1], [1, 1]], {}, ["conv2d_no_batching", 1, 7, 7, 512, 512, 3, 3, [1, 1], [1, 1]], {"i": 7005824, "t": "", "c": null, "e": [["tile_f", "sp", [16, 2, 2, 8]], ["tile_y", "sp", [7, 1, 1, 1]], ["tile_x", "sp", [1, 7, 1, 1]], ["tile_rc", "sp", [256, 1, 2]], ["tile_ry", "sp", [3, 1, 1]], ["tile_rx", "sp", [3, 1, 1]], ["auto_unroll_max_step", "ot", 512], ["unroll_explicit", "ot", 1]]}], "r": [[0.0017985432265625], 0, 2.270172119140625, 1544138130.0920997], "v": 0.1}
{"i": ["cuda", "conv2d_no_batching", [1, 7, 7, 512, 512, 3, 3, [1, 1], [1, 1]], {}, ["conv2d_no_batching", 1, 7, 7, 512, 512, 3, 3, [1, 1], [1, 1]], {"i": 7781324, "t": "", "c": null, "e": [["tile_f", "sp", [16, 2, 2, 8]], ["tile_y", "sp", [1, 7, 1, 1]], ["tile_x", "sp", [1, 1, 7, 1]], ["tile_rc", "sp", [256, 1, 2]], ["tile_ry", "sp", [1, 3, 1]], ["tile_rx", "sp", [1, 3, 1]], ["auto_unroll_max_step", "ot", 512], ["unroll_explicit", "ot", 1]]}], "r": [[0.0015304829296875], 0, 2.30525279045105, 1544138131.5863957], "v": 0.1}
{"i": ["cuda", "conv2d_no_batching", [1, 7, 7, 512, 512, 3, 3, [1, 1], [1, 1]], {}, ["conv2d_no_batching", 1, 7, 7, 512, 512, 3, 3, [1, 1], [1, 1]], {"i": 7020124, "t": "", "c": null, "e": [["tile_f", "sp", [16, 2, 2, 8]], ["tile_y", "sp", [1, 7, 1, 1]], ["tile_x", "sp", [1, 7, 1, 1]], ["tile_rc", "sp", [16, 16, 2]], ["tile_ry", "sp", [3, 1, 1]], ["tile_rx", "sp", [3, 1, 1]], ["auto_unroll_max_step", "ot", 512], ["unroll_explicit", "ot", 1]]}], "r": [[0.0536127306796875], 0, 23.58370542526245, 1544138153.2785313], "v": 0.1}
{"i": ["cuda", "conv2d_no_batching", [1, 7, 7, 512, 512, 3, 3, [1, 1], [1, 1]], {}, ["conv2d_no_batching", 1, 7, 7, 512, 512, 3, 3, [1, 1], [1, 1]], {"i": 7605104, "t": "", "c": null, "e": [["tile_f", "sp", [16, 2, 2, 8]], ["tile_y", "sp", [7, 1, 1, 1]], ["tile_x", "sp", [1, 1, 7, 1]], ["tile_rc", "sp", [8, 32, 2]], ["tile_ry", "sp", [3, 1, 1]], ["tile_rx", "sp", [1, 3, 1]], ["auto_unroll_max_step", "ot", 512], ["unroll_explicit", "ot", 1]]}], "r": [[0.005344978578125], 0, 15.017110824584961, 1544138162.6550124], "v": 0.1}
{"i": ["cuda", "conv2d_no_batching", [1, 7, 7, 512, 512, 3, 3, [1, 1], [1, 1]], {}, ["conv2d_no_batching", 1, 7, 7, 512, 512, 3, 3, [1, 1], [1, 1]], {"i": 7586624, "t": "", "c": null, "e": [["tile_f", "sp", [16, 2, 2, 8]], ["tile_y", "sp", [7, 1, 1, 1]], ["tile_x", "sp", [1, 7, 1, 1]], ["tile_rc", "sp", [256, 1, 2]], ["tile_ry", "sp", [3, 1, 1]], ["tile_rx", "sp", [1, 3, 1]], ["auto_unroll_max_step", "ot", 512], ["unroll_explicit", "ot", 1]]}], "r": [[0.0017976970546875], 0, 2.467332601547241, 1544138164.4680576], "v": 0.1}
{"i": ["cuda", "conv2d_no_batching", [1, 7, 7, 512, 512, 3, 3, [1, 1], [1, 1]], {}, ["conv2d_no_batching", 1, 7, 7, 512, 512, 3, 3, [1, 1], [1, 1]], {"i": 7218124, "t": "", "c": null, "e": [["tile_f", "sp", [16, 2, 2, 8]], ["tile_y", "sp", [1, 7, 1, 1]], ["tile_x", "sp", [1, 1, 7, 1]], ["tile_rc", "sp", [8, 32, 2]], ["tile_ry", "sp", [1, 3, 1]], ["tile_rx", "sp", [3, 1, 1]], ["auto_unroll_max_step", "ot", 512], ["unroll_explicit", "ot", 1]]}], "r": [[0.002223635453125], 0, 12.443302631378174, 1544138170.7296436], "v": 0.1}
{"i": ["cuda", "conv2d_no_batching", [1, 7, 7, 512, 512, 3, 3, [1, 1], [1, 1]], {}, ["conv2d_no_batching", 1, 7, 7, 512, 512, 3, 3, [1, 1], [1, 1]], {"i": 7587504, "t": "", "c": null, "e": [["tile_f", "sp", [16, 2, 2, 8]], ["tile_y", "sp", [7, 1, 1, 1]], ["tile_x", "sp", [1, 1, 7, 1]], ["tile_rc", "sp", [256, 1, 2]], ["tile_ry", "sp", [3, 1, 1]], ["tile_rx", "sp", [1, 3, 1]], ["auto_unroll_max_step", "ot", 512], ["unroll_explicit", "ot", 1]]}], "r": [[0.0007963118515625], 0, 1.5386192798614502, 1544138171.8595252], "v": 0.1}
{"i": ["cuda", "conv2d_no_batching", [1, 7, 7, 512, 512, 3, 3, [1, 1], [1, 1]], {}, ["conv2d_no_batching", 1, 7, 7, 512, 512, 3, 3, [1, 1], [1, 1]], {"i": 7200304, "t": "", "c": null, "e": [["tile_f", "sp", [16, 2, 2, 8]], ["tile_y", "sp", [7, 1, 1, 1]], ["tile_x", "sp", [1, 1, 7, 1]], ["tile_rc", "sp", [256, 1, 2]], ["tile_ry", "sp", [1, 3, 1]], ["tile_rx", "sp", [3, 1, 1]], ["auto_unroll_max_step", "ot", 512], ["unroll_explicit", "ot", 1]]}], "r": [[0.000810713765625], 0, 1.4939558506011963, 1544138173.0088365], "v": 0.1}
{"i": ["cuda", "conv2d_no_batching", [1, 7, 7, 512, 512, 3, 3, [1, 1], [1, 1]], {}, ["conv2d_no_batching", 1, 7, 7, 512, 512, 3, 3, [1, 1], [1, 1]], {"i": 7211084, "t": "", "c": null, "e": [["tile_f", "sp", [16, 2, 2, 8]], ["tile_y", "sp", [1, 7, 1, 1]], ["tile_x", "sp", [1, 1, 7, 1]], ["tile_rc", "sp", [32, 8, 2]], ["tile_ry", "sp", [1, 3, 1]], ["tile_rx", "sp", [3, 1, 1]], ["auto_unroll_max_step", "ot", 512], ["unroll_explicit", "ot", 1]]}], "r": [[0.0012947779765625], 0, 3.25789737701416, 1544138175.2164063], "v": 0.1}
{"i": ["cuda", "conv2d_no_batching", [1, 7, 7, 512, 512, 3, 3, [1, 1], [1, 1]], {}, ["conv2d_no_batching", 1, 7, 7, 512, 512, 3, 3, [1, 1], [1, 1]], {"i": 7199424, "t": "", "c": null, "e": [["tile_f", "sp", [16, 2, 2, 8]], ["tile_y", "sp", [7, 1, 1, 1]], ["tile_x", "sp", [1, 7, 1, 1]], ["tile_rc", "sp", [256, 1, 2]], ["tile_ry", "sp", [1, 3, 1]], ["tile_rx", "sp", [3, 1, 1]], ["auto_unroll_max_step", "ot", 512], ["unroll_explicit", "ot", 1]]}], "r": [[0.001225096015625], 0, 1.979924201965332, 1544138176.4735794], "v": 0.1}
{"i": ["cuda", "conv2d_no_batching", [1, 7, 7, 512, 512, 3, 3, [1, 1], [1, 1]], {}, ["conv2d_no_batching", 1, 7, 7, 512, 512, 3, 3, [1, 1], [1, 1]], {"i": 7213724, "t": "", "c": null, "e": [["tile_f", "sp", [16, 2, 2, 8]], ["tile_y", "sp", [1, 7, 1, 1]], ["tile_x", "sp", [1, 7, 1, 1]], ["tile_rc", "sp", [16, 16, 2]], ["tile_ry", "sp", [1, 3, 1]], ["tile_rx", "sp", [3, 1, 1]], ["auto_unroll_max_step", "ot", 512], ["unroll_explicit", "ot", 1]]}], "r": [[0.045416917703125], 0, 19.21087956428528, 1544138194.8441215], "v": 0.1}
{"i": ["cuda", "conv2d_no_batching", [1, 7, 7, 512, 512, 3, 3, [1, 1], [1, 1]], {}, ["conv2d_no_batching", 1, 7, 7, 512, 512, 3, 3, [1, 1], [1, 1]], {"i": 7023424, "t": "", "c": null, "e": [["tile_f", "sp", [16, 2, 2, 8]], ["tile_y", "sp", [7, 1, 1, 1]], ["tile_x", "sp", [1, 7, 1, 1]], ["tile_rc", "sp", [8, 32, 2]], ["tile_ry", "sp", [3, 1, 1]], ["tile_rx", "sp", [3, 1, 1]], ["auto_unroll_max_step", "ot", 512], ["unroll_explicit", "ot", 1]]}], "r": [[0.0028093336328125], 0, 3.11374831199646, 1544138196.832538], "v": 0.1}
{"i": ["cuda", "conv2d_no_batching", [1, 7, 7, 512, 512, 3, 3, [1, 1], [1, 1]], {}, ["conv2d_no_batching", 1, 7, 7, 512, 512, 3, 3, [1, 1], [1, 1]], {"i": 7204044, "t": "", "c": null, "e": [["tile_f", "sp", [16, 2, 2, 8]], ["tile_y", "sp", [1, 7, 1, 1]], ["tile_x", "sp", [1, 1, 7, 1]], ["tile_rc", "sp", [128, 2, 2]], ["tile_ry", "sp", [1, 3, 1]], ["tile_rx", "sp", [3, 1, 1]], ["auto_unroll_max_step", "ot", 512], ["unroll_explicit", "ot", 1]]}], "r": [[0.001350964765625], 0, 1.9821078777313232, 1544138198.1622713], "v": 0.1}
{"i": ["cuda", "conv2d_no_batching", [1, 7, 7, 512, 512, 3, 3, [1, 1], [1, 1]], {}, ["conv2d_no_batching", 1, 7, 7, 512, 512, 3, 3, [1, 1], [1, 1]], {"i": 7013969, "t": "", "c": null, "e": [["tile_f", "sp", [16, 1, 4, 8]], ["tile_y", "sp", [1, 7, 1, 1]], ["tile_x", "sp", [1, 1, 7, 1]], ["tile_rc", "sp", [64, 4, 2]], ["tile_ry", "sp", [3, 1, 1]], ["tile_rx", "sp", [3, 1, 1]], ["auto_unroll_max_step", "ot", 512], ["unroll_explicit", "ot", 1]]}], "r": [[0.0006063812315789473], 0, 1.4950039386749268, 1544138229.0980482], "v": 0.1}
{"i": ["cuda", "conv2d_no_batching", [1, 7, 7, 512, 512, 3, 3, [1, 1], [1, 1]], {}, ["conv2d_no_batching", 1, 7, 7, 512, 512, 3, 3, [1, 1], [1, 1]], {"i": 7022989, "t": "", "c": null, "e": [["tile_f", "sp", [16, 1, 4, 8]], ["tile_y", "sp", [1, 1, 7, 1]], ["tile_x", "sp", [7, 1, 1, 1]], ["tile_rc", "sp", [8, 32, 2]], ["tile_ry", "sp", [3, 1, 1]], ["tile_rx", "sp", [3, 1, 1]], ["auto_unroll_max_step", "ot", 512], ["unroll_explicit", "ot", 1]]}], "r": [[0.0010199632734375], 0, 2.0476226806640625, 1544138200.6168418], "v": 0.1}
{"i": ["cuda", "conv2d_no_batching", [1, 7, 7, 512, 512, 3, 3, [1, 1], [1, 1]], {}, ["conv2d_no_batching", 1, 7, 7, 512, 512, 3, 3, [1, 1], [1, 1]], {"i": 7027169, "t": "", "c": null, "e": [["tile_f", "sp", [16, 1, 4, 8]], ["tile_y", "sp", [1, 7, 1, 1]], ["tile_x", "sp", [1, 7, 1, 1]], ["tile_rc", "sp", [4, 64, 2]], ["tile_ry", "sp", [3, 1, 1]], ["tile_rx", "sp", [3, 1, 1]], ["auto_unroll_max_step", "ot", 512], ["unroll_explicit", "ot", 1]]}], "r": [[0.0289784009140625], 0, 13.419556856155396, 1544138212.8009748], "v": 0.1}
{"i": ["cuda", "conv2d_no_batching", [1, 7, 7, 512, 512, 3, 3, [1, 1], [1, 1]], {}, ["conv2d_no_batching", 1, 7, 7, 512, 512, 3, 3, [1, 1], [1, 1]], {"i": 7206469, "t": "", "c": null, "e": [["tile_f", "sp", [16, 1, 4, 8]], ["tile_y", "sp", [7, 1, 1, 1]], ["tile_x", "sp", [1, 7, 1, 1]], ["tile_rc", "sp", [64, 4, 2]], ["tile_ry", "sp", [1, 3, 1]], ["tile_rx", "sp", [3, 1, 1]], ["auto_unroll_max_step", "ot", 512], ["unroll_explicit", "ot", 1]]}], "r": [[0.0007655525578947369], 0, 1.913099765777588, 1544138230.2572505], "v": 0.1}
{"i": ["cuda", "conv2d_no_batching", [1, 7, 7, 512, 512, 3, 3, [1, 1], [1, 1]], {}, ["conv2d_no_batching", 1, 7, 7, 512, 512, 3, 3, [1, 1], [1, 1]], {"i": 7216589, "t": "", "c": null, "e": [["tile_f", "sp", [16, 1, 4, 8]], ["tile_y", "sp", [1, 1, 7, 1]], ["tile_x", "sp", [7, 1, 1, 1]], ["tile_rc", "sp", [8, 32, 2]], ["tile_ry", "sp", [1, 3, 1]], ["tile_rx", "sp", [3, 1, 1]], ["auto_unroll_max_step", "ot", 512], ["unroll_explicit", "ot", 1]]}], "r": [[0.00150304871875], 0, 4.690510988235474, 1544138216.848224], "v": 0.1}
{"i": ["cuda", "conv2d_no_batching", [1, 7, 7, 512, 512, 3, 3, [1, 1], [1, 1]], {}, ["conv2d_no_batching", 1, 7, 7, 512, 512, 3, 3, [1, 1], [1, 1]], {"i": 7594549, "t": "", "c": null, "e": [["tile_f", "sp", [16, 1, 4, 8]], ["tile_y", "sp", [7, 1, 1, 1]], ["tile_x", "sp", [1, 1, 7, 1]], ["tile_rc", "sp", [64, 4, 2]], ["tile_ry", "sp", [3, 1, 1]], ["tile_rx", "sp", [1, 3, 1]], ["auto_unroll_max_step", "ot", 512], ["unroll_explicit", "ot", 1]]}], "r": [[0.0005285341157894737], 0, 1.4714019298553467, 1544138231.288132], "v": 0.1}
{"i": ["cuda", "conv2d_no_batching", [1, 7, 7, 512, 512, 3, 3, [1, 1], [1, 1]], {}, ["conv2d_no_batching", 1, 7, 7, 512, 512, 3, 3, [1, 1], [1, 1]], {"i": 7586629, "t": "", "c": null, "e": [["tile_f", "sp", [16, 1, 4, 8]], ["tile_y", "sp", [7, 1, 1, 1]], ["tile_x", "sp", [1, 7, 1, 1]], ["tile_rc", "sp", [256, 1, 2]], ["tile_ry", "sp", [3, 1, 1]], ["tile_rx", "sp", [1, 3, 1]], ["auto_unroll_max_step", "ot", 512], ["unroll_explicit", "ot", 1]]}], "r": [[0.00165398003125], 0, 2.097548484802246, 1544138219.638037], "v": 0.1}
{"i": ["cuda", "conv2d_no_batching", [1, 7, 7, 512, 512, 3, 3, [1, 1], [1, 1]], {}, ["conv2d_no_batching", 1, 7, 7, 512, 512, 3, 3, [1, 1], [1, 1]], {"i": 8751261, "t": "", "c": null, "e": [["tile_f", "sp", [64, 2, 1, 4]], ["tile_y", "sp", [1, 1, 7, 1]], ["tile_x", "sp", [7, 1, 1, 1]], ["tile_rc", "sp", [128, 2, 2]], ["tile_ry", "sp", [3, 1, 1]], ["tile_rx", "sp", [3, 1, 1]], ["auto_unroll_max_step", "ot", 1500], ["unroll_explicit", "ot", 1]]}], "r": [[0.0008995585894736842], 0, 2.146059036254883, 1544138281.1729467], "v": 0.1}
{"i": ["cuda", "conv2d_no_batching", [1, 7, 7, 512, 512, 3, 3, [1, 1], [1, 1]], {}, ["conv2d_no_batching", 1, 7, 7, 512, 512, 3, 3, [1, 1], [1, 1]], {"i": 8754781, "t": "", "c": null, "e": [["tile_f", "sp", [64, 2, 1, 4]], ["tile_y", "sp", [1, 1, 7, 1]], ["tile_x", "sp", [7, 1, 1, 1]], ["tile_rc", "sp", [64, 4, 2]], ["tile_ry", "sp", [3, 1, 1]], ["tile_rx", "sp", [3, 1, 1]], ["auto_unroll_max_step", "ot", 1500], ["unroll_explicit", "ot", 1]]}], "r": [[0.0010495717894736844], 0, 3.0057077407836914, 1544138282.7732258], "v": 0.1}
{"i": ["cuda", "conv2d_no_batching", [1, 7, 7, 512, 512, 3, 3, [1, 1], [1, 1]], {}, ["conv2d_no_batching", 1, 7, 7, 512, 512, 3, 3, [1, 1], [1, 1]], {"i": 8763140, "t": "", "c": null, "e": [["tile_f", "sp", [128, 1, 1, 4]], ["tile_y", "sp", [7, 1, 1, 1]], ["tile_x", "sp", [1, 1, 7, 1]], ["tile_rc", "sp", [16, 16, 2]], ["tile_ry", "sp", [3, 1, 1]], ["tile_rx", "sp", [3, 1, 1]], ["auto_unroll_max_step", "ot", 1500], ["unroll_explicit", "ot", 1]]}], "r": [[0.0016333451999999999], 0, 3.3691318035125732, 1544138284.982943], "v": 0.1}
{"i": ["cuda", "conv2d_no_batching", [1, 7, 7, 512, 512, 3, 3, [1, 1], [1, 1]], {}, ["conv2d_no_batching", 1, 7, 7, 512, 512, 3, 3, [1, 1], [1, 1]], {"i": 8761820, "t": "", "c": null, "e": [["tile_f", "sp", [128, 1, 1, 4]], ["tile_y", "sp", [1, 1, 7, 1]], ["tile_x", "sp", [7, 1, 1, 1]], ["tile_rc", "sp", [16, 16, 2]], ["tile_ry", "sp", [3, 1, 1]], ["tile_rx", "sp", [3, 1, 1]], ["auto_unroll_max_step", "ot", 1500], ["unroll_explicit", "ot", 1]]}], "r": [[0.0017234998631578948], 0, 3.5622000694274902, 1544138287.2554622], "v": 0.1}
{"i": ["cuda", "conv2d_no_batching", [1, 7, 7, 512, 512, 3, 3, [1, 1], [1, 1]], {}, ["conv2d_no_batching", 1, 7, 7, 512, 512, 3, 3, [1, 1], [1, 1]], {"i": 8758961, "t": "", "c": null, "e": [["tile_f", "sp", [64, 2, 1, 4]], ["tile_y", "sp", [1, 7, 1, 1]], ["tile_x", "sp", [1, 7, 1, 1]], ["tile_rc", "sp", [32, 8, 2]], ["tile_ry", "sp", [3, 1, 1]], ["tile_rx", "sp", [3, 1, 1]], ["auto_unroll_max_step", "ot", 1500], ["unroll_explicit", "ot", 1]]}], "r": [[0.031149776889473683], 0, 23.675422430038452, 1544138306.5377555], "v": 0.1}
{"i": ["cuda", "conv2d_no_batching", [1, 7, 7, 512, 512, 3, 3, [1, 1], [1, 1]], {}, ["conv2d_no_batching", 1, 7, 7, 512, 512, 3, 3, [1, 1], [1, 1]], {"i": 8783380, "t": "", "c": null, "e": [["tile_f", "sp", [128, 1, 1, 4]], ["tile_y", "sp", [7, 1, 1, 1]], ["tile_x", "sp", [1, 7, 1, 1]], ["tile_rc", "sp", [64, 2, 4]], ["tile_ry", "sp", [3, 1, 1]], ["tile_rx", "sp", [3, 1, 1]], ["auto_unroll_max_step", "ot", 1500], ["unroll_explicit", "ot", 1]]}], "r": [[0.0027607408736842103], 0, 3.8748419284820557, 1544138309.0854316], "v": 0.1}
{"i": ["cuda", "conv2d_no_batching", [1, 7, 7, 512, 512, 3, 3, [1, 1], [1, 1]], {}, ["conv2d_no_batching", 1, 7, 7, 512, 512, 3, 3, [1, 1], [1, 1]], {"i": 8770181, "t": "", "c": null, "e": [["tile_f", "sp", [64, 2, 1, 4]], ["tile_y", "sp", [7, 1, 1, 1]], ["tile_x", "sp", [1, 1, 7, 1]], ["tile_rc", "sp", [4, 64, 2]], ["tile_ry", "sp", [3, 1, 1]], ["tile_rx", "sp", [3, 1, 1]], ["auto_unroll_max_step", "ot", 1500], ["unroll_explicit", "ot", 1]]}], "r": [[0.003449977731578947], 0, 6.188015699386597, 1544138312.9202588], "v": 0.1}
{"i": ["cuda", "conv2d_no_batching", [1, 7, 7, 512, 512, 3, 3, [1, 1], [1, 1]], {}, ["conv2d_no_batching", 1, 7, 7, 512, 512, 3, 3, [1, 1], [1, 1]], {"i": 9110080, "t": "", "c": null, "e": [["tile_f", "sp", [128, 1, 1, 4]], ["tile_y", "sp", [1, 7, 1, 1]], ["tile_x", "sp", [7, 1, 1, 1]], ["tile_rc", "sp", [64, 8, 1]], ["tile_ry", "sp", [1, 1, 3]], ["tile_rx", "sp", [3, 1, 1]], ["auto_unroll_max_step", "ot", 1500], ["unroll_explicit", "ot", 1]]}], "r": [[0.002661404536842105], 0, 3.853210926055908, 1544138315.4073548], "v": 0.1}
{"i": ["cuda", "conv2d_no_batching", [1, 7, 7, 512, 512, 3, 3, [1, 1], [1, 1]], {}, ["conv2d_no_batching", 1, 7, 7, 512, 512, 3, 3, [1, 1], [1, 1]], {"i": 8945300, "t": "", "c": null, "e": [["tile_f", "sp", [128, 1, 1, 4]], ["tile_y", "sp", [7, 1, 1, 1]], ["tile_x", "sp", [1, 7, 1, 1]], ["tile_rc", "sp", [128, 2, 2]], ["tile_ry", "sp", [1, 3, 1]], ["tile_rx", "sp", [3, 1, 1]], ["auto_unroll_max_step", "ot", 1500], ["unroll_explicit", "ot", 1]]}], "r": [[0.0014784769736842106], 0, 2.2493436336517334, 1544138317.0375292], "v": 0.1}
{"i": ["cuda", "conv2d_no_batching", [1, 7, 7, 512, 512, 3, 3, [1, 1], [1, 1]], {}, ["conv2d_no_batching", 1, 7, 7, 512, 512, 3, 3, [1, 1], [1, 1]], {"i": 8763360, "t": "", "c": null, "e": [["tile_f", "sp", [128, 1, 1, 4]], ["tile_y", "sp", [1, 7, 1, 1]], ["tile_x", "sp", [1, 1, 7, 1]], ["tile_rc", "sp", [16, 16, 2]], ["tile_ry", "sp", [3, 1, 1]], ["tile_rx", "sp", [3, 1, 1]], ["auto_unroll_max_step", "ot", 1500], ["unroll_explicit", "ot", 1]]}], "r": [[0.001129328452631579], 0, 3.9334394931793213, 1544138318.790157], "v": 0.1}
{"i": ["cuda", "conv2d_no_batching", [1, 7, 7, 512, 512, 3, 3, [1, 1], [1, 1]], {}, ["conv2d_no_batching", 1, 7, 7, 512, 512, 3, 3, [1, 1], [1, 1]], {"i": 8786900, "t": "", "c": null, "e": [["tile_f", "sp", [128, 1, 1, 4]], ["tile_y", "sp", [7, 1, 1, 1]], ["tile_x", "sp", [1, 7, 1, 1]], ["tile_rc", "sp", [32, 4, 4]], ["tile_ry", "sp", [3, 1, 1]], ["tile_rx", "sp", [3, 1, 1]], ["auto_unroll_max_step", "ot", 1500], ["unroll_explicit", "ot", 1]]}], "r": [[0.0019899213157894735], 0, 2.987600564956665, 1544138320.8540688], "v": 0.1}
{"i": ["cuda", "conv2d_no_batching", [1, 7, 7, 512, 512, 3, 3, [1, 1], [1, 1]], {}, ["conv2d_no_batching", 1, 7, 7, 512, 512, 3, 3, [1, 1], [1, 1]], {"i": 8966421, "t": "", "c": null, "e": [["tile_f", "sp", [64, 2, 1, 4]], ["tile_y", "sp", [7, 1, 1, 1]], ["tile_x", "sp", [1, 7, 1, 1]], ["tile_rc", "sp", [2, 128, 2]], ["tile_ry", "sp", [1, 3, 1]], ["tile_rx", "sp", [3, 1, 1]], ["auto_unroll_max_step", "ot", 1500], ["unroll_explicit", "ot", 1]]}], "r": [[0.021379760815789475], 0, 13.548853158950806, 1544138333.8205612], "v": 0.1}
{"i": ["cuda", "conv2d_no_batching", [1, 7, 7, 512, 512, 3, 3, [1, 1], [1, 1]], {}, ["conv2d_no_batching", 1, 7, 7, 512, 512, 3, 3, [1, 1], [1, 1]], {"i": 8953440, "t": "", "c": null, "e": [["tile_f", "sp", [128, 1, 1, 4]], ["tile_y", "sp", [1, 7, 1, 1]], ["tile_x", "sp", [1, 1, 7, 1]], ["tile_rc", "sp", [32, 8, 2]], ["tile_ry", "sp", [1, 3, 1]], ["tile_rx", "sp", [3, 1, 1]], ["auto_unroll_max_step", "ot", 1500], ["unroll_explicit", "ot", 1]]}], "r": [[0.0004540695990990991], 0, 2.315239191055298, 1544138431.8447874], "v": 0.1}
{"i": ["cuda", "conv2d_no_batching", [1, 7, 7, 512, 512, 3, 3, [1, 1], [1, 1]], {}, ["conv2d_no_batching", 1, 7, 7, 512, 512, 3, 3, [1, 1], [1, 1]], {"i": 9344161, "t": "", "c": null, "e": [["tile_f", "sp", [64, 2, 1, 4]], ["tile_y", "sp", [1, 7, 1, 1]], ["tile_x", "sp", [1, 1, 7, 1]], ["tile_rc", "sp", [16, 16, 2]], ["tile_ry", "sp", [3, 1, 1]], ["tile_rx", "sp", [1, 3, 1]], ["auto_unroll_max_step", "ot", 1500], ["unroll_explicit", "ot", 1]]}], "r": [[0.0036527045631578946], 0, 14.800068378448486, 1544138342.8921344], "v": 0.1}
{"i": ["cuda", "conv2d_no_batching", [1, 7, 7, 512, 512, 3, 3, [1, 1], [1, 1]], {}, ["conv2d_no_batching", 1, 7, 7, 512, 512, 3, 3, [1, 1], [1, 1]], {"i": 8962900, "t": "", "c": null, "e": [["tile_f", "sp", [128, 1, 1, 4]], ["tile_y", "sp", [7, 1, 1, 1]], ["tile_x", "sp", [1, 7, 1, 1]], ["tile_rc", "sp", [4, 64, 2]], ["tile_ry", "sp", [1, 3, 1]], ["tile_rx", "sp", [3, 1, 1]], ["auto_unroll_max_step", "ot", 1500], ["unroll_explicit", "ot", 1]]}], "r": [[0.006588896236842105], 0, 8.233690023422241, 1544138348.1848922], "v": 0.1}
{"i": ["cuda", "conv2d_no_batching", [1, 7, 7, 512, 512, 3, 3, [1, 1], [1, 1]], {}, ["conv2d_no_batching", 1, 7, 7, 512, 512, 3, 3, [1, 1], [1, 1]], {"i": 9365281, "t": "", "c": null, "e": [["tile_f", "sp", [64, 2, 1, 4]], ["tile_y", "sp", [1, 7, 1, 1]], ["tile_x", "sp", [1, 1, 7, 1]], ["tile_rc", "sp", [64, 2, 4]], ["tile_ry", "sp", [3, 1, 1]], ["tile_rx", "sp", [1, 3, 1]], ["auto_unroll_max_step", "ot", 1500], ["unroll_explicit", "ot", 1]]}], "r": [[0.0021979890578947368], 0, 4.7524144649505615, 1544138351.001227], "v": 0.1}
{"i": ["cuda", "conv2d_no_batching", [1, 7, 7, 512, 512, 3, 3, [1, 1], [1, 1]], {}, ["conv2d_no_batching", 1, 7, 7, 512, 512, 3, 3, [1, 1], [1, 1]], {"i": 8776341, "t": "", "c": null, "e": [["tile_f", "sp", [64, 2, 1, 4]], ["tile_y", "sp", [7, 1, 1, 1]], ["tile_x", "sp", [1, 7, 1, 1]], ["tile_rc", "sp", [1, 256, 2]], ["tile_ry", "sp", [3, 1, 1]], ["tile_rx", "sp", [3, 1, 1]], ["auto_unroll_max_step", "ot", 1500], ["unroll_explicit", "ot", 1]]}], "r": [[0.01397636387368421], 0, 9.326862812042236, 1544138359.8380187], "v": 0.1}
{"i": ["cuda", "conv2d_no_batching", [1, 7, 7, 512, 512, 3, 3, [1, 1], [1, 1]], {}, ["conv2d_no_batching", 1, 7, 7, 512, 512, 3, 3, [1, 1], [1, 1]], {"i": 8953220, "t": "", "c": null, "e": [["tile_f", "sp", [128, 1, 1, 4]], ["tile_y", "sp", [7, 1, 1, 1]], ["tile_x", "sp", [1, 1, 7, 1]], ["tile_rc", "sp", [32, 8, 2]], ["tile_ry", "sp", [1, 3, 1]], ["tile_rx", "sp", [3, 1, 1]], ["auto_unroll_max_step", "ot", 1500], ["unroll_explicit", "ot", 1]]}], "r": [[0.0006540826], 0, 3.141155958175659, 1544138361.382027], "v": 0.1}
{"i": ["cuda", "conv2d_no_batching", [1, 7, 7, 512, 512, 3, 3, [1, 1], [1, 1]], {}, ["conv2d_no_batching", 1, 7, 7, 512, 512, 3, 3, [1, 1], [1, 1]], {"i": 8955420, "t": "", "c": null, "e": [["tile_f", "sp", [128, 1, 1, 4]], ["tile_y", "sp", [1, 1, 7, 1]], ["tile_x", "sp", [7, 1, 1, 1]], ["tile_rc", "sp", [16, 16, 2]], ["tile_ry", "sp", [1, 3, 1]], ["tile_rx", "sp", [3, 1, 1]], ["auto_unroll_max_step", "ot", 1500], ["unroll_explicit", "ot", 1]]}], "r": [[0.0018019997263157895], 0, 4.060303449630737, 1544138364.067349], "v": 0.1}
{"i": ["cuda", "conv2d_no_batching", [1, 7, 7, 512, 512, 3, 3, [1, 1], [1, 1]], {}, ["conv2d_no_batching", 1, 7, 7, 512, 512, 3, 3, [1, 1], [1, 1]], {"i": 8963780, "t": "", "c": null, "e": [["tile_f", "sp", [128, 1, 1, 4]], ["tile_y", "sp", [7, 1, 1, 1]], ["tile_x", "sp", [1, 1, 7, 1]], ["tile_rc", "sp", [4, 64, 2]], ["tile_ry", "sp", [1, 3, 1]], ["tile_rx", "sp", [3, 1, 1]], ["auto_unroll_max_step", "ot", 1500], ["unroll_explicit", "ot", 1]]}], "r": [[0.004753133768421052], 0, 13.882530212402344, 1544138371.220349], "v": 0.1}
{"i": ["cuda", "conv2d_no_batching", [1, 7, 7, 512, 512, 3, 3, [1, 1], [1, 1]], {}, ["conv2d_no_batching", 1, 7, 7, 512, 512, 3, 3, [1, 1], [1, 1]], {"i": 9364180, "t": "", "c": null, "e": [["tile_f", "sp", [128, 1, 1, 4]], ["tile_y", "sp", [7, 1, 1, 1]], ["tile_x", "sp", [1, 7, 1, 1]], ["tile_rc", "sp", [64, 2, 4]], ["tile_ry", "sp", [3, 1, 1]], ["tile_rx", "sp", [1, 3, 1]], ["auto_unroll_max_step", "ot", 1500], ["unroll_explicit", "ot", 1]]}], "r": [[0.0022388997210526316], 0, 3.6952123641967773, 1544138373.483733], "v": 0.1}
{"i": ["cuda", "conv2d_no_batching", [1, 7, 7, 512, 512, 3, 3, [1, 1], [1, 1]], {}, ["conv2d_no_batching", 1, 7, 7, 512, 512, 3, 3, [1, 1], [1, 1]], {"i": 9364181, "t": "", "c": null, "e": [["tile_f", "sp", [64, 2, 1, 4]], ["tile_y", "sp", [7, 1, 1, 1]], ["tile_x", "sp", [1, 7, 1, 1]], ["tile_rc", "sp", [64, 2, 4]], ["tile_ry", "sp", [3, 1, 1]], ["tile_rx", "sp", [1, 3, 1]], ["auto_unroll_max_step", "ot", 1500], ["unroll_explicit", "ot", 1]]}], "r": [[0.0024057860157894735], 0, 4.049398183822632, 1544138375.9177623], "v": 0.1}
{"i": ["cuda", "conv2d_no_batching", [1, 7, 7, 512, 512, 3, 3, [1, 1], [1, 1]], {}, ["conv2d_no_batching", 1, 7, 7, 512, 512, 3, 3, [1, 1], [1, 1]], {"i": 8981600, "t": "", "c": null, "e": [["tile_f", "sp", [128, 1, 1, 4]], ["tile_y", "sp", [1, 7, 1, 1]], ["tile_x", "sp", [1, 1, 7, 1]], ["tile_rc", "sp", [32, 4, 4]], ["tile_ry", "sp", [1, 3, 1]], ["tile_rx", "sp", [3, 1, 1]], ["auto_unroll_max_step", "ot", 1500], ["unroll_explicit", "ot", 1]]}], "r": [[0.0004723817072072072], 0, 2.350660562515259, 1544138432.9342077], "v": 0.1}
{"i": ["cuda", "conv2d_no_batching", [1, 7, 7, 512, 512, 3, 3, [1, 1], [1, 1]], {}, ["conv2d_no_batching", 1, 7, 7, 512, 512, 3, 3, [1, 1], [1, 1]], {"i": 9339541, "t": "", "c": null, "e": [["tile_f", "sp", [64, 2, 1, 4]], ["tile_y", "sp", [7, 1, 1, 1]], ["tile_x", "sp", [1, 7, 1, 1]], ["tile_rc", "sp", [32, 8, 2]], ["tile_ry", "sp", [3, 1, 1]], ["tile_rx", "sp", [1, 3, 1]], ["auto_unroll_max_step", "ot", 1500], ["unroll_explicit", "ot", 1]]}], "r": [[0.0025759352157894736], 0, 4.814902305603027, 1544138379.9479358], "v": 0.1}
{"i": ["cuda", "conv2d_no_batching", [1, 7, 7, 512, 512, 3, 3, [1, 1], [1, 1]], {}, ["conv2d_no_batching", 1, 7, 7, 512, 512, 3, 3, [1, 1], [1, 1]], {"i": 9103040, "t": "", "c": null, "e": [["tile_f", "sp", [128, 1, 1, 4]], ["tile_y", "sp", [1, 7, 1, 1]], ["tile_x", "sp", [7, 1, 1, 1]], ["tile_rc", "sp", [256, 2, 1]], ["tile_ry", "sp", [1, 1, 3]], ["tile_rx", "sp", [3, 1, 1]], ["auto_unroll_max_step", "ot", 1500], ["unroll_explicit", "ot", 1]]}], "r": [[0.002714358494736842], 0, 3.2447266578674316, 1544138382.3834572], "v": 0.1}
{"i": ["cuda", "conv2d_no_batching", [1, 7, 7, 512, 512, 3, 3, [1, 1], [1, 1]], {}, ["conv2d_no_batching", 1, 7, 7, 512, 512, 3, 3, [1, 1], [1, 1]], {"i": 9342620, "t": "", "c": null, "e": [["tile_f", "sp", [128, 1, 1, 4]], ["tile_y", "sp", [1, 1, 7, 1]], ["tile_x", "sp", [7, 1, 1, 1]], ["tile_rc", "sp", [16, 16, 2]], ["tile_ry", "sp", [3, 1, 1]], ["tile_rx", "sp", [1, 3, 1]], ["auto_unroll_max_step", "ot", 1500], ["unroll_explicit", "ot", 1]]}], "r": [[0.002821249568421053], 0, 4.789647817611694, 1544138385.767114], "v": 0.1}
{"i": ["cuda", "conv2d_no_batching", [1, 7, 7, 512, 512, 3, 3, [1, 1], [1, 1]], {}, ["conv2d_no_batching", 1, 7, 7, 512, 512, 3, 3, [1, 1], [1, 1]], {"i": 9684060, "t": "", "c": null, "e": [["tile_f", "sp", [128, 1, 1, 4]], ["tile_y", "sp", [1, 1, 7, 1]], ["tile_x", "sp", [7, 1, 1, 1]], ["tile_rc", "sp", [256, 2, 1]], ["tile_ry", "sp", [1, 1, 3]], ["tile_rx", "sp", [1, 3, 1]], ["auto_unroll_max_step", "ot", 1500], ["unroll_explicit", "ot", 1]]}], "r": [[0.0006948891684210527], 0, 1.7440919876098633, 1544138386.9827425], "v": 0.1}
{"i": ["cuda", "conv2d_no_batching", [1, 7, 7, 512, 512, 3, 3, [1, 1], [1, 1]], {}, ["conv2d_no_batching", 1, 7, 7, 512, 512, 3, 3, [1, 1], [1, 1]], {"i": 9343060, "t": "", "c": null, "e": [["tile_f", "sp", [128, 1, 1, 4]], ["tile_y", "sp", [7, 1, 1, 1]], ["tile_x", "sp", [1, 7, 1, 1]], ["tile_rc", "sp", [16, 16, 2]], ["tile_ry", "sp", [3, 1, 1]], ["tile_rx", "sp", [1, 3, 1]], ["auto_unroll_max_step", "ot", 1500], ["unroll_explicit", "ot", 1]]}], "r": [[0.0036958037263157893], 0, 5.862680912017822, 1544138390.7028565], "v": 0.1}
{"i": ["cuda", "conv2d_no_batching", [1, 7, 7, 512, 512, 3, 3, [1, 1], [1, 1]], {}, ["conv2d_no_batching", 1, 7, 7, 512, 512, 3, 3, [1, 1], [1, 1]], {"i": 9557780, "t": "", "c": null, "e": [["tile_f", "sp", [128, 1, 1, 4]], ["tile_y", "sp", [7, 1, 1, 1]], ["tile_x", "sp", [1, 7, 1, 1]], ["tile_rc", "sp", [64, 2, 4]], ["tile_ry", "sp", [1, 3, 1]], ["tile_rx", "sp", [1, 3, 1]], ["auto_unroll_max_step", "ot", 1500], ["unroll_explicit", "ot", 1]]}], "r": [[0.0019014368210526318], 0, 4.191694736480713, 1544138392.9413137], "v": 0.1}
{"i": ["cuda", "conv2d_no_batching", [1, 7, 7, 512, 512, 3, 3, [1, 1], [1, 1]], {}, ["conv2d_no_batching", 1, 7, 7, 512, 512, 3, 3, [1, 1], [1, 1]], {"i": 9533360, "t": "", "c": null, "e": [["tile_f", "sp", [128, 1, 1, 4]], ["tile_y", "sp", [1, 7, 1, 1]], ["tile_x", "sp", [1, 7, 1, 1]], ["tile_rc", "sp", [32, 8, 2]], ["tile_ry", "sp", [1, 3, 1]], ["tile_rx", "sp", [1, 3, 1]], ["auto_unroll_max_step", "ot", 1500], ["unroll_explicit", "ot", 1]]}], "r": [[0.0027699344], 0, 8.230516910552979, 1544138396.1810257], "v": 0.1}
{"i": ["cuda", "conv2d_no_batching", [1, 7, 7, 512, 512, 3, 3, [1, 1], [1, 1]], {}, ["conv2d_no_batching", 1, 7, 7, 512, 512, 3, 3, [1, 1], [1, 1]], {"i": 9555141, "t": "", "c": null, "e": [["tile_f", "sp", [64, 2, 1, 4]], ["tile_y", "sp", [7, 1, 1, 1]], ["tile_x", "sp", [1, 1, 7, 1]], ["tile_rc", "sp", [128, 1, 4]], ["tile_ry", "sp", [1, 3, 1]], ["tile_rx", "sp", [1, 3, 1]], ["auto_unroll_max_step", "ot", 1500], ["unroll_explicit", "ot", 1]]}], "r": [[0.0010575794842105264], 0, 2.4083969593048096, 1544138397.727793], "v": 0.1}
{"i": ["cuda", "conv2d_no_batching", [1, 7, 7, 512, 512, 3, 3, [1, 1], [1, 1]], {}, ["conv2d_no_batching", 1, 7, 7, 512, 512, 3, 3, [1, 1], [1, 1]], {"i": 9361761, "t": "", "c": null, "e": [["tile_f", "sp", [64, 2, 1, 4]], ["tile_y", "sp", [1, 7, 1, 1]], ["tile_x", "sp", [1, 1, 7, 1]], ["tile_rc", "sp", [128, 1, 4]], ["tile_ry", "sp", [3, 1, 1]], ["tile_rx", "sp", [1, 3, 1]], ["auto_unroll_max_step", "ot", 1500], ["unroll_explicit", "ot", 1]]}], "r": [[0.002797884463157895], 0, 4.093749284744263, 1544138400.6780515], "v": 0.1}
{"i": ["cuda", "conv2d_no_batching", [1, 7, 7, 512, 512, 3, 3, [1, 1], [1, 1]], {}, ["conv2d_no_batching", 1, 7, 7, 512, 512, 3, 3, [1, 1], [1, 1]], {"i": 9884480, "t": "", "c": null, "e": [["tile_f", "sp", [128, 1, 1, 4]], ["tile_y", "sp", [1, 7, 1, 1]], ["tile_x", "sp", [7, 1, 1, 1]], ["tile_rc", "sp", [64, 8, 1]], ["tile_ry", "sp", [3, 1, 1]], ["tile_rx", "sp", [1, 1, 3]], ["auto_unroll_max_step", "ot", 1500], ["unroll_explicit", "ot", 1]]}], "r": [[0.0012838853210526315], 0, 2.6309618949890137, 1544138402.3102176], "v": 0.1}
{"i": ["cuda", "conv2d_no_batching", [1, 7, 7, 512, 512, 3, 3, [1, 1], [1, 1]], {}, ["conv2d_no_batching", 1, 7, 7, 512, 512, 3, 3, [1, 1], [1, 1]], {"i": 9523461, "t": "", "c": null, "e": [["tile_f", "sp", [64, 2, 1, 4]], ["tile_y", "sp", [7, 1, 1, 1]], ["tile_x", "sp", [1, 1, 7, 1]], ["tile_rc", "sp", [256, 1, 2]], ["tile_ry", "sp", [1, 3, 1]], ["tile_rx", "sp", [1, 3, 1]], ["auto_unroll_max_step", "ot", 1500], ["unroll_explicit", "ot", 1]]}], "r": [[0.000586599752631579], 0, 1.8120357990264893, 1544138403.4440958], "v": 0.1}
{"i": ["cuda", "conv2d_no_batching", [1, 7, 7, 512, 512, 3, 3, [1, 1], [1, 1]], {}, ["conv2d_no_batching", 1, 7, 7, 512, 512, 3, 3, [1, 1], [1, 1]], {"i": 9885140, "t": "", "c": null, "e": [["tile_f", "sp", [128, 1, 1, 4]], ["tile_y", "sp", [7, 1, 1, 1]], ["tile_x", "sp", [1, 7, 1, 1]], ["tile_rc", "sp", [64, 8, 1]], ["tile_ry", "sp", [3, 1, 1]], ["tile_rx", "sp", [1, 1, 3]], ["auto_unroll_max_step", "ot", 1500], ["unroll_explicit", "ot", 1]]}], "r": [[0.002039456110526316], 0, 3.405548334121704, 1544138405.6097672], "v": 0.1}
{"i": ["cuda", "conv2d_no_batching", [1, 7, 7, 512, 512, 3, 3, [1, 1], [1, 1]], {}, ["conv2d_no_batching", 1, 7, 7, 512, 512, 3, 3, [1, 1], [1, 1]], {"i": 9106560, "t": "", "c": null, "e": [["tile_f", "sp", [128, 1, 1, 4]], ["tile_y", "sp", [1, 7, 1, 1]], ["tile_x", "sp", [7, 1, 1, 1]], ["tile_rc", "sp", [128, 4, 1]], ["tile_ry", "sp", [1, 1, 3]], ["tile_rx", "sp", [3, 1, 1]], ["auto_unroll_max_step", "ot", 1500], ["unroll_explicit", "ot", 1]]}], "r": [[0.0024609978157894737], 0, 2.9496405124664307, 1544138407.8028958], "v": 0.1}
{"i": ["cuda", "conv2d_no_batching", [1, 7, 7, 512, 512, 3, 3, [1, 1], [1, 1]], {}, ["conv2d_no_batching", 1, 7, 7, 512, 512, 3, 3, [1, 1], [1, 1]], {"i": 8948381, "t": "", "c": null, "e": [["tile_f", "sp", [64, 2, 1, 4]], ["tile_y", "sp", [1, 1, 7, 1]], ["tile_x", "sp", [7, 1, 1, 1]], ["tile_rc", "sp", [64, 4, 2]], ["tile_ry", "sp", [1, 3, 1]], ["tile_rx", "sp", [3, 1, 1]], ["auto_unroll_max_step", "ot", 1500], ["unroll_explicit", "ot", 1]]}], "r": [[0.0008266444578947369], 0, 3.0133056640625, 1544138409.3970363], "v": 0.1}
{"i": ["cuda", "conv2d_no_batching", [1, 7, 7, 512, 512, 3, 3, [1, 1], [1, 1]], {}, ["conv2d_no_batching", 1, 7, 7, 512, 512, 3, 3, [1, 1], [1, 1]], {"i": 9895260, "t": "", "c": null, "e": [["tile_f", "sp", [128, 1, 1, 4]], ["tile_y", "sp", [1, 1, 7, 1]], ["tile_x", "sp", [7, 1, 1, 1]], ["tile_rc", "sp", [8, 64, 1]], ["tile_ry", "sp", [3, 1, 1]], ["tile_rx", "sp", [1, 1, 3]], ["auto_unroll_max_step", "ot", 1500], ["unroll_explicit", "ot", 1]]}], "r": [[0.007132315689473684], 0, 9.461378335952759, 1544138416.0925925], "v": 0.1}
{"i": ["cuda", "conv2d_no_batching", [1, 7, 7, 512, 512, 3, 3, [1, 1], [1, 1]], {}, ["conv2d_no_batching", 1, 7, 7, 512, 512, 3, 3, [1, 1], [1, 1]], {"i": 9332061, "t": "", "c": null, "e": [["tile_f", "sp", [64, 2, 1, 4]], ["tile_y", "sp", [1, 1, 7, 1]], ["tile_x", "sp", [7, 1, 1, 1]], ["tile_rc", "sp", [128, 2, 2]], ["tile_ry", "sp", [3, 1, 1]], ["tile_rx", "sp", [1, 3, 1]], ["auto_unroll_max_step", "ot", 1500], ["unroll_explicit", "ot", 1]]}], "r": [[0.0007094212315789474], 0, 2.1035938262939453, 1544138417.388518], "v": 0.1}
{"i": ["cuda", "conv2d_no_batching", [1, 7, 7, 512, 512, 3, 3, [1, 1], [1, 1]], {}, ["conv2d_no_batching", 1, 7, 7, 512, 512, 3, 3, [1, 1], [1, 1]], {"i": 9110300, "t": "", "c": null, "e": [["tile_f", "sp", [128, 1, 1, 4]], ["tile_y", "sp", [1, 1, 7, 1]], ["tile_x", "sp", [7, 1, 1, 1]], ["tile_rc", "sp", [64, 8, 1]], ["tile_ry", "sp", [1, 1, 3]], ["tile_rx", "sp", [3, 1, 1]], ["auto_unroll_max_step", "ot", 1500], ["unroll_explicit", "ot", 1]]}], "r": [[0.0008366316052631579], 0, 2.2425637245178223, 1544138418.8177214], "v": 0.1}
{"i": ["cuda", "conv2d_no_batching", [1, 7, 7, 512, 512, 3, 3, [1, 1], [1, 1]], {}, ["conv2d_no_batching", 1, 7, 7, 512, 512, 3, 3, [1, 1], [1, 1]], {"i": 9525661, "t": "", "c": null, "e": [["tile_f", "sp", [64, 2, 1, 4]], ["tile_y", "sp", [1, 1, 7, 1]], ["tile_x", "sp", [7, 1, 1, 1]], ["tile_rc", "sp", [128, 2, 2]], ["tile_ry", "sp", [1, 3, 1]], ["tile_rx", "sp", [1, 3, 1]], ["auto_unroll_max_step", "ot", 1500], ["unroll_explicit", "ot", 1]]}], "r": [[0.0007258971052631579], 0, 2.214613676071167, 1544138420.1921651], "v": 0.1}
{"i": ["cuda", "conv2d_no_batching", [1, 7, 7, 512, 512, 3, 3, [1, 1], [1, 1]], {}, ["conv2d_no_batching", 1, 7, 7, 512, 512, 3, 3, [1, 1], [1, 1]], {"i": 9367261, "t": "", "c": null, "e": [["tile_f", "sp", [64, 2, 1, 4]], ["tile_y", "sp", [1, 1, 7, 1]], ["tile_x", "sp", [7, 1, 1, 1]], ["tile_rc", "sp", [32, 4, 4]], ["tile_ry", "sp", [3, 1, 1]], ["tile_rx", "sp", [1, 3, 1]], ["auto_unroll_max_step", "ot", 1500], ["unroll_explicit", "ot", 1]]}], "r": [[0.0023475494], 0, 3.8412442207336426, 1544138423.0909011], "v": 0.1}
{"i": ["cuda", "conv2d_no_batching", [1, 7, 7, 512, 512, 3, 3, [1, 1], [1, 1]], {}, ["conv2d_no_batching", 1, 7, 7, 512, 512, 3, 3, [1, 1], [1, 1]], {"i": 10088860, "t": "", "c": null, "e": [["tile_f", "sp", [128, 1, 1, 4]], ["tile_y", "sp", [1, 1, 7, 1]], ["tile_x", "sp", [7, 1, 1, 1]], ["tile_rc", "sp", [8, 64, 1]], ["tile_ry", "sp", [1, 3, 1]], ["tile_rx", "sp", [1, 1, 3]], ["auto_unroll_max_step", "ot", 1500], ["unroll_explicit", "ot", 1]]}], "r": [[0.005668609447368421], 0, 16.631593704223633, 1544138430.761967], "v": 0.1}
{"i": ["cuda", "conv2d_no_batching", [1, 7, 7, 512, 512, 3, 3, [1, 1], [1, 1]], {}, ["conv2d_no_batching", 1, 7, 7, 512, 512, 3, 3, [1, 1], [1, 1]], {"i": 9106383, "t": "", "c": null, "e": [["tile_f", "sp", [32, 1, 2, 8]], ["tile_y", "sp", [7, 1, 1, 1]], ["tile_x", "sp", [7, 1, 1, 1]], ["tile_rc", "sp", [128, 4, 1]], ["tile_ry", "sp", [1, 1, 3]], ["tile_rx", "sp", [3, 1, 1]], ["auto_unroll_max_step", "ot", 1500], ["unroll_explicit", "ot", 1]]}], "r": [[0.003342501382882883], 0, 3.951326608657837, 1544138481.8406646], "v": 0.1}
{"i": ["cuda", "conv2d_no_batching", [1, 7, 7, 512, 512, 3, 3, [1, 1], [1, 1]], {}, ["conv2d_no_batching", 1, 7, 7, 512, 512, 3, 3, [1, 1], [1, 1]], {"i": 8339023, "t": "", "c": null, "e": [["tile_f", "sp", [32, 1, 2, 8]], ["tile_y", "sp", [7, 1, 1, 1]], ["tile_x", "sp", [7, 1, 1, 1]], ["tile_rc", "sp", [32, 16, 1]], ["tile_ry", "sp", [1, 3, 1]], ["tile_rx", "sp", [1, 1, 3]], ["auto_unroll_max_step", "ot", 512], ["unroll_explicit", "ot", 1]]}], "r": [[0.037124195513513515], 0, 26.11505436897278, 1544138507.3893044], "v": 0.1}
{"i": ["cuda", "conv2d_no_batching", [1, 7, 7, 512, 512, 3, 3, [1, 1], [1, 1]], {}, ["conv2d_no_batching", 1, 7, 7, 512, 512, 3, 3, [1, 1], [1, 1]], {"i": 9109903, "t": "", "c": null, "e": [["tile_f", "sp", [32, 1, 2, 8]], ["tile_y", "sp", [7, 1, 1, 1]], ["tile_x", "sp", [7, 1, 1, 1]], ["tile_rc", "sp", [64, 8, 1]], ["tile_ry", "sp", [1, 1, 3]], ["tile_rx", "sp", [3, 1, 1]], ["auto_unroll_max_step", "ot", 1500], ["unroll_explicit", "ot", 1]]}], "r": [[0.0031292207972972975], 0, 3.773221492767334, 1544138510.2766533], "v": 0.1}
{"i": ["cuda", "conv2d_no_batching", [1, 7, 7, 512, 512, 3, 3, [1, 1], [1, 1]], {}, ["conv2d_no_batching", 1, 7, 7, 512, 512, 3, 3, [1, 1], [1, 1]], {"i": 9116943, "t": "", "c": null, "e": [["tile_f", "sp", [32, 1, 2, 8]], ["tile_y", "sp", [7, 1, 1, 1]], ["tile_x", "sp", [7, 1, 1, 1]], ["tile_rc", "sp", [16, 32, 1]], ["tile_ry", "sp", [1, 1, 3]], ["tile_rx", "sp", [3, 1, 1]], ["auto_unroll_max_step", "ot", 1500], ["unroll_explicit", "ot", 1]]}], "r": [[0.00858211622972973], 0, 8.829050540924072, 1544138516.9544218], "v": 0.1}
{"i": ["cuda", "conv2d_no_batching", [1, 7, 7, 512, 512, 3, 3, [1, 1], [1, 1]], {}, ["conv2d_no_batching", 1, 7, 7, 512, 512, 3, 3, [1, 1], [1, 1]], {"i": 8145423, "t": "", "c": null, "e": [["tile_f", "sp", [32, 1, 2, 8]], ["tile_y", "sp", [7, 1, 1, 1]], ["tile_x", "sp", [7, 1, 1, 1]], ["tile_rc", "sp", [32, 16, 1]], ["tile_ry", "sp", [3, 1, 1]], ["tile_rx", "sp", [1, 1, 3]], ["auto_unroll_max_step", "ot", 512], ["unroll_explicit", "ot", 1]]}], "r": [[0.004798159243243243], 0, 4.967518091201782, 1544138521.0851076], "v": 0.1}
{"i": ["cuda", "conv2d_no_batching", [1, 7, 7, 512, 512, 3, 3, [1, 1], [1, 1]], {}, ["conv2d_no_batching", 1, 7, 7, 512, 512, 3, 3, [1, 1], [1, 1]], {"i": 10081423, "t": "", "c": null, "e": [["tile_f", "sp", [32, 1, 2, 8]], ["tile_y", "sp", [7, 1, 1, 1]], ["tile_x", "sp", [7, 1, 1, 1]], ["tile_rc", "sp", [32, 16, 1]], ["tile_ry", "sp", [1, 3, 1]], ["tile_rx", "sp", [1, 1, 3]], ["auto_unroll_max_step", "ot", 1500], ["unroll_explicit", "ot", 1]]}], "r": [[0.00547772681981982], 0, 7.512755632400513, 1544138525.926161], "v": 0.1}
{"i": ["cuda", "conv2d_no_batching", [1, 7, 7, 512, 512, 3, 3, [1, 1], [1, 1]], {}, ["conv2d_no_batching", 1, 7, 7, 512, 512, 3, 3, [1, 1], [1, 1]], {"i": 7421140, "t": "", "c": null, "e": [["tile_f", "sp", [128, 1, 1, 4]], ["tile_y", "sp", [7, 1, 1, 1]], ["tile_x", "sp", [1, 7, 1, 1]], ["tile_rc", "sp", [1, 256, 2]], ["tile_ry", "sp", [1, 1, 3]], ["tile_rx", "sp", [3, 1, 1]], ["auto_unroll_max_step", "ot", 512], ["unroll_explicit", "ot", 1]]}], "r": [[0.027900105184684682], 0, 19.92625331878662, 1544138545.4480267], "v": 0.1}
{"i": ["cuda", "conv2d_no_batching", [1, 7, 7, 512, 512, 3, 3, [1, 1], [1, 1]], {}, ["conv2d_no_batching", 1, 7, 7, 512, 512, 3, 3, [1, 1], [1, 1]], {"i": 8191360, "t": "", "c": null, "e": [["tile_f", "sp", [128, 1, 1, 4]], ["tile_y", "sp", [1, 7, 1, 1]], ["tile_x", "sp", [7, 1, 1, 1]], ["tile_rc", "sp", [2, 128, 2]], ["tile_ry", "sp", [3, 1, 1]], ["tile_rx", "sp", [1, 1, 3]], ["auto_unroll_max_step", "ot", 512], ["unroll_explicit", "ot", 1]]}], "r": [[0.013708534072072072], 0, 10.439561605453491, 1544138555.4080775], "v": 0.1}
{"i": ["cuda", "conv2d_no_batching", [1, 7, 7, 512, 512, 3, 3, [1, 1], [1, 1]], {}, ["conv2d_no_batching", 1, 7, 7, 512, 512, 3, 3, [1, 1], [1, 1]], {"i": 9924740, "t": "", "c": null, "e": [["tile_f", "sp", [128, 1, 1, 4]], ["tile_y", "sp", [7, 1, 1, 1]], ["tile_x", "sp", [1, 1, 7, 1]], ["tile_rc", "sp", [16, 16, 2]], ["tile_ry", "sp", [3, 1, 1]], ["tile_rx", "sp", [1, 1, 3]], ["auto_unroll_max_step", "ot", 1500], ["unroll_explicit", "ot", 1]]}], "r": [[0.0059383830270270275], 0, 7.981898546218872, 1544138561.7617536], "v": 0.1}
{"i": ["cuda", "conv2d_no_batching", [1, 7, 7, 512, 512, 3, 3, [1, 1], [1, 1]], {}, ["conv2d_no_batching", 1, 7, 7, 512, 512, 3, 3, [1, 1], [1, 1]], {"i": 9923200, "t": "", "c": null, "e": [["tile_f", "sp", [128, 1, 1, 4]], ["tile_y", "sp", [1, 7, 1, 1]], ["tile_x", "sp", [7, 1, 1, 1]], ["tile_rc", "sp", [16, 16, 2]], ["tile_ry", "sp", [3, 1, 1]], ["tile_rx", "sp", [1, 1, 3]], ["auto_unroll_max_step", "ot", 1500], ["unroll_explicit", "ot", 1]]}], "r": [[0.0013370698108108108], 0, 3.6052515506744385, 1544138563.7258122], "v": 0.1}
{"i": ["cuda", "conv2d_no_batching", [1, 7, 7, 512, 512, 3, 3, [1, 1], [1, 1]], {}, ["conv2d_no_batching", 1, 7, 7, 512, 512, 3, 3, [1, 1], [1, 1]], {"i": 9920340, "t": "", "c": null, "e": [["tile_f", "sp", [128, 1, 1, 4]], ["tile_y", "sp", [7, 1, 1, 1]], ["tile_x", "sp", [1, 7, 1, 1]], ["tile_rc", "sp", [32, 8, 2]], ["tile_ry", "sp", [3, 1, 1]], ["tile_rx", "sp", [1, 1, 3]], ["auto_unroll_max_step", "ot", 1500], ["unroll_explicit", "ot", 1]]}], "r": [[0.002228489774774775], 0, 3.9299230575561523, 1544138566.4031477], "v": 0.1}
{"i": ["cuda", "conv2d_no_batching", [1, 7, 7, 512, 512, 3, 3, [1, 1], [1, 1]], {}, ["conv2d_no_batching", 1, 7, 7, 512, 512, 3, 3, [1, 1], [1, 1]], {"i": 9726080, "t": "", "c": null, "e": [["tile_f", "sp", [128, 1, 1, 4]], ["tile_y", "sp", [1, 7, 1, 1]], ["tile_x", "sp", [7, 1, 1, 1]], ["tile_rc", "sp", [32, 8, 2]], ["tile_ry", "sp", [1, 1, 3]], ["tile_rx", "sp", [1, 3, 1]], ["auto_unroll_max_step", "ot", 1500], ["unroll_explicit", "ot", 1]]}], "r": [[0.0016850398513513513], 0, 4.334066152572632, 1544138568.8025153], "v": 0.1}
{"i": ["cuda", "conv2d_no_batching", [1, 7, 7, 512, 512, 3, 3, [1, 1], [1, 1]], {}, ["conv2d_no_batching", 1, 7, 7, 512, 512, 3, 3, [1, 1], [1, 1]], {"i": 9734660, "t": "", "c": null, "e": [["tile_f", "sp", [128, 1, 1, 4]], ["tile_y", "sp", [7, 1, 1, 1]], ["tile_x", "sp", [1, 1, 7, 1]], ["tile_rc", "sp", [8, 32, 2]], ["tile_ry", "sp", [1, 1, 3]], ["tile_rx", "sp", [1, 3, 1]], ["auto_unroll_max_step", "ot", 1500], ["unroll_explicit", "ot", 1]]}], "r": [[0.006160791536036036], 0, 18.93874430656433, 1544138578.8799057], "v": 0.1}
{"i": ["cuda", "conv2d_no_batching", [1, 7, 7, 512, 512, 3, 3, [1, 1], [1, 1]], {}, ["conv2d_no_batching", 1, 7, 7, 512, 512, 3, 3, [1, 1], [1, 1]], {"i": 8368020, "t": "", "c": null, "e": [["tile_f", "sp", [128, 1, 1, 4]], ["tile_y", "sp", [7, 1, 1, 1]], ["tile_x", "sp", [1, 7, 1, 1]], ["tile_rc", "sp", [64, 4, 2]], ["tile_ry", "sp", [1, 3, 1]], ["tile_rx", "sp", [1, 1, 3]], ["auto_unroll_max_step", "ot", 512], ["unroll_explicit", "ot", 1]]}], "r": [[0.0029526391396396397], 0, 4.174792289733887, 1544138581.8969285], "v": 0.1}
{"i": ["cuda", "conv2d_no_batching", [1, 7, 7, 512, 512, 3, 3, [1, 1], [1, 1]], {}, ["conv2d_no_batching", 1, 7, 7, 512, 512, 3, 3, [1, 1], [1, 1]], {"i": 9733780, "t": "", "c": null, "e": [["tile_f", "sp", [128, 1, 1, 4]], ["tile_y", "sp", [7, 1, 1, 1]], ["tile_x", "sp", [1, 7, 1, 1]], ["tile_rc", "sp", [8, 32, 2]], ["tile_ry", "sp", [1, 1, 3]], ["tile_rx", "sp", [1, 3, 1]], ["auto_unroll_max_step", "ot", 1500], ["unroll_explicit", "ot", 1]]}], "r": [[0.018656268054054053], 0, 14.044381856918335, 1544138595.2299104], "v": 0.1}
{"i": ["cuda", "conv2d_no_batching", [1, 7, 7, 512, 512, 3, 3, [1, 1], [1, 1]], {}, ["conv2d_no_batching", 1, 7, 7, 512, 512, 3, 3, [1, 1], [1, 1]], {"i": 9919680, "t": "", "c": null, "e": [["tile_f", "sp", [128, 1, 1, 4]], ["tile_y", "sp", [1, 7, 1, 1]], ["tile_x", "sp", [7, 1, 1, 1]], ["tile_rc", "sp", [32, 8, 2]], ["tile_ry", "sp", [3, 1, 1]], ["tile_rx", "sp", [1, 1, 3]], ["auto_unroll_max_step", "ot", 1500], ["unroll_explicit", "ot", 1]]}], "r": [[0.0013384333018018018], 0, 2.5100438594818115, 1544138596.9654896], "v": 0.1}
{"i": ["cuda", "conv2d_no_batching", [1, 7, 7, 512, 512, 3, 3, [1, 1], [1, 1]], {}, ["conv2d_no_batching", 1, 7, 7, 512, 512, 3, 3, [1, 1], [1, 1]], {"i": 10113940, "t": "", "c": null, "e": [["tile_f", "sp", [128, 1, 1, 4]], ["tile_y", "sp", [7, 1, 1, 1]], ["tile_x", "sp", [1, 7, 1, 1]], ["tile_rc", "sp", [32, 8, 2]], ["tile_ry", "sp", [1, 3, 1]], ["tile_rx", "sp", [1, 1, 3]], ["auto_unroll_max_step", "ot", 1500], ["unroll_explicit", "ot", 1]]}], "r": [[0.0021584104594594596], 0, 4.605471611022949, 1544138599.620377], "v": 0.1}
