baseline/conv2d_c12_knob_n2000_4.log
{"i": ["cuda", "conv2d_no_batching", [1, 7, 7, 512, 512, 3, 3, [1, 1], [1, 1]], {}, ["conv2d_no_batching", 1, 7, 7, 512, 512, 3, 3, [1, 1], [1, 1]], {"i": 2004565, "t": "", "c": null, "e": [["tile_f", "sp", [8, 4, 2, 8]], ["tile_y", "sp", [1, 1, 1, 7]], ["tile_x", "sp", [1, 7, 1, 1]], ["tile_rc", "sp", [128, 1, 4]], ["tile_ry", "sp", [1, 3, 1]], ["tile_rx", "sp", [3, 1, 1]], ["auto_unroll_max_step", "ot", 512], ["unroll_explicit", "ot", 0]]}], "r": [[0.047233917], 0, 3.436099052429199, 1544146993.0053275], "v": 0.1}
{"i": ["cuda", "conv2d_no_batching", [1, 7, 7, 512, 512, 3, 3, [1, 1], [1, 1]], {}, ["conv2d_no_batching", 1, 7, 7, 512, 512, 3, 3, [1, 1], [1, 1]], {"i": 8333191, "t": "", "c": null, "e": [["tile_f", "sp", [4, 16, 8, 1]], ["tile_y", "sp", [1, 1, 7, 1]], ["tile_x", "sp", [1, 7, 1, 1]], ["tile_rc", "sp", [128, 4, 1]], ["tile_ry", "sp", [1, 3, 1]], ["tile_rx", "sp", [1, 1, 3]], ["auto_unroll_max_step", "ot", 512], ["unroll_explicit", "ot", 1]]}], "r": [[0.0022527001], 0, 2.624844789505005, 1544147039.8449688], "v": 0.1}
{"i": ["cuda", "conv2d_no_batching", [1, 7, 7, 512, 512, 3, 3, [1, 1], [1, 1]], {}, ["conv2d_no_batching", 1, 7, 7, 512, 512, 3, 3, [1, 1], [1, 1]], {"i": 5491, "t": "", "c": null, "e": [["tile_f", "sp", [2, 2, 1, 128]], ["tile_y", "sp", [7, 1, 1, 1]], ["tile_x", "sp", [1, 1, 7, 1]], ["tile_rc", "sp", [256, 2, 1]], ["tile_ry", "sp", [3, 1, 1]], ["tile_rx", "sp", [3, 1, 1]], ["auto_unroll_max_step", "ot", 0], ["unroll_explicit", "ot", 0]]}], "r": [[0.063877174], 0, 2.0770111083984375, 1544146996.7031403], "v": 0.1}
{"i": ["cuda", "conv2d_no_batching", [1, 7, 7, 512, 512, 3, 3, [1, 1], [1, 1]], {}, ["conv2d_no_batching", 1, 7, 7, 512, 512, 3, 3, [1, 1], [1, 1]], {"i": 7315512, "t": "", "c": null, "e": [["tile_f", "sp", [64, 1, 4, 2]], ["tile_y", "sp", [7, 1, 1, 1]], ["tile_x", "sp", [1, 7, 1, 1]], ["tile_rc", "sp", [2, 8, 32]], ["tile_ry", "sp", [1, 3, 1]], ["tile_rx", "sp", [3, 1, 1]], ["auto_unroll_max_step", "ot", 512], ["unroll_explicit", "ot", 1]]}], "r": [[0.005921537364285714], 0, 3.852161169052124, 1544147043.0508618], "v": 0.1}
{"i": ["cuda", "conv2d_no_batching", [1, 7, 7, 512, 512, 3, 3, [1, 1], [1, 1]], {}, ["conv2d_no_batching", 1, 7, 7, 512, 512, 3, 3, [1, 1], [1, 1]], {"i": 587661, "t": "", "c": null, "e": [["tile_f", "sp", [8, 2, 32, 1]], ["tile_y", "sp", [1, 1, 1, 7]], ["tile_x", "sp", [1, 1, 1, 7]], ["tile_rc", "sp", [256, 2, 1]], ["tile_ry", "sp", [3, 1, 1]], ["tile_rx", "sp", [1, 3, 1]], ["auto_unroll_max_step", "ot", 0], ["unroll_explicit", "ot", 0]]}], "r": [[0.0018978192214285713], 0, 1.7651889324188232, 1544147044.5040324], "v": 0.1}
{"i": ["cuda", "conv2d_no_batching", [1, 7, 7, 512, 512, 3, 3, [1, 1], [1, 1]], {}, ["conv2d_no_batching", 1, 7, 7, 512, 512, 3, 3, [1, 1], [1, 1]], {"i": 3345861, "t": "", "c": null, "e": [["tile_f", "sp", [64, 2, 1, 4]], ["tile_y", "sp", [7, 1, 1, 1]], ["tile_x", "sp", [1, 1, 7, 1]], ["tile_rc", "sp", [8, 32, 2]], ["tile_ry", "sp", [1, 1, 3]], ["tile_rx", "sp", [1, 1, 3]], ["auto_unroll_max_step", "ot", 512], ["unroll_explicit", "ot", 0]]}], "r": [[0.0260135855], 0, 6.49765419960022, 1544147035.7920895], "v": 0.1}
{"i": ["cuda", "conv2d_no_batching", [1, 7, 7, 512, 512, 3, 3, [1, 1], [1, 1]], {}, ["conv2d_no_batching", 1, 7, 7, 512, 512, 3, 3, [1, 1], [1, 1]], {"i": 5911435, "t": "", "c": null, "e": [["tile_f", "sp", [16, 2, 16, 1]], ["tile_y", "sp", [1, 1, 7, 1]], ["tile_x", "sp", [1, 7, 1, 1]], ["tile_rc", "sp", [16, 4, 8]], ["tile_ry", "sp", [3, 1, 1]], ["tile_rx", "sp", [1, 3, 1]], ["auto_unroll_max_step", "ot", 0], ["unroll_explicit", "ot", 1]]}], "r": [[0.0006968218680555555], 0, 1.2717523574829102, 1544147051.8549142], "v": 0.1}
{"i": ["cuda", "conv2d_no_batching", [1, 7, 7, 512, 512, 3, 3, [1, 1], [1, 1]], {}, ["conv2d_no_batching", 1, 7, 7, 512, 512, 3, 3, [1, 1], [1, 1]], {"i": 47706, "t": "", "c": null, "e": [["tile_f", "sp", [8, 2, 1, 32]], ["tile_y", "sp", [7, 1, 1, 1]], ["tile_x", "sp", [1, 1, 7, 1]], ["tile_rc", "sp", [32, 8, 2]], ["tile_ry", "sp", [3, 1, 1]], ["tile_rx", "sp", [3, 1, 1]], ["auto_unroll_max_step", "ot", 0], ["unroll_explicit", "ot", 0]]}], "r": [[0.011160471407142858], 0, 5.670194149017334, 1544147050.8644567], "v": 0.1}
{"i": ["cuda", "conv2d_no_batching", [1, 7, 7, 512, 512, 3, 3, [1, 1], [1, 1]], {}, ["conv2d_no_batching", 1, 7, 7, 512, 512, 3, 3, [1, 1], [1, 1]], {"i": 1813880, "t": "", "c": null, "e": [["tile_f", "sp", [8, 1, 1, 64]], ["tile_y", "sp", [7, 1, 1, 1]], ["tile_x", "sp", [1, 7, 1, 1]], ["tile_rc", "sp", [64, 2, 4]], ["tile_ry", "sp", [3, 1, 1]], ["tile_rx", "sp", [3, 1, 1]], ["auto_unroll_max_step", "ot", 512], ["unroll_explicit", "ot", 0]]}], "r": [[0.06230310728472223], 0, 29.996585845947266, 1544147089.4858034], "v": 0.1}
{"i": ["cuda", "conv2d_no_batching", [1, 7, 7, 512, 512, 3, 3, [1, 1], [1, 1]], {}, ["conv2d_no_batching", 1, 7, 7, 512, 512, 3, 3, [1, 1], [1, 1]], {"i": 5862888, "t": "", "c": null, "e": [["tile_f", "sp", [64, 1, 2, 4]], ["tile_y", "sp", [1, 7, 1, 1]], ["tile_x", "sp", [1, 1, 7, 1]], ["tile_rc", "sp", [8, 32, 2]], ["tile_ry", "sp", [3, 1, 1]], ["tile_rx", "sp", [1, 3, 1]], ["auto_unroll_max_step", "ot", 0], ["unroll_explicit", "ot", 1]]}], "r": [[0.002378335263888889], 0, 2.1216325759887695, 1544147123.7572064], "v": 0.1}
{"i": ["cuda", "conv2d_no_batching", [1, 7, 7, 512, 512, 3, 3, [1, 1], [1, 1]], {}, ["conv2d_no_batching", 1, 7, 7, 512, 512, 3, 3, [1, 1], [1, 1]], {"i": 7818592, "t": "", "c": null, "e": [["tile_f", "sp", [64, 4, 2, 1]], ["tile_y", "sp", [1, 1, 1, 7]], ["tile_x", "sp", [7, 1, 1, 1]], ["tile_rc", "sp", [32, 4, 4]], ["tile_ry", "sp", [1, 3, 1]], ["tile_rx", "sp", [1, 3, 1]], ["auto_unroll_max_step", "ot", 512], ["unroll_explicit", "ot", 1]]}], "r": [[0.003404261479166667], 0, 3.0397844314575195, 1544147126.475907], "v": 0.1}
{"i": ["cuda", "conv2d_no_batching", [1, 7, 7, 512, 512, 3, 3, [1, 1], [1, 1]], {}, ["conv2d_no_batching", 1, 7, 7, 512, 512, 3, 3, [1, 1], [1, 1]], {"i": 7755074, "t": "", "c": null, "e": [["tile_f", "sp", [16, 4, 4, 2]], ["tile_y", "sp", [1, 1, 7, 1]], ["tile_x", "sp", [7, 1, 1, 1]], ["tile_rc", "sp", [64, 8, 1]], ["tile_ry", "sp", [1, 3, 1]], ["tile_rx", "sp", [1, 3, 1]], ["auto_unroll_max_step", "ot", 512], ["unroll_explicit", "ot", 1]]}], "r": [[0.0011589925416666666], 0, 2.6498167514801025, 1544147128.5250099], "v": 0.1}
{"i": ["cuda", "conv2d_no_batching", [1, 7, 7, 512, 512, 3, 3, [1, 1], [1, 1]], {}, ["conv2d_no_batching", 1, 7, 7, 512, 512, 3, 3, [1, 1], [1, 1]], {"i": 2765032, "t": "", "c": null, "e": [["tile_f", "sp", [64, 1, 4, 2]], ["tile_y", "sp", [7, 1, 1, 1]], ["tile_x", "sp", [1, 1, 7, 1]], ["tile_rc", "sp", [8, 32, 2]], ["tile_ry", "sp", [1, 1, 3]], ["tile_rx", "sp", [1, 3, 1]], ["auto_unroll_max_step", "ot", 512], ["unroll_explicit", "ot", 0]]}], "r": [[0.004984491687499999], 0, 5.3972766399383545, 1544147133.0198457], "v": 0.1}
{"i": ["cuda", "conv2d_no_batching", [1, 7, 7, 512, 512, 3, 3, [1, 1], [1, 1]], {}, ["conv2d_no_batching", 1, 7, 7, 512, 512, 3, 3, [1, 1], [1, 1]], {"i": 3388042, "t": "", "c": null, "e": [["tile_f", "sp", [4, 4, 32, 1]], ["tile_y", "sp", [7, 1, 1, 1]], ["tile_x", "sp", [1, 1, 7, 1]], ["tile_rc", "sp", [64, 1, 8]], ["tile_ry", "sp", [1, 1, 3]], ["tile_rx", "sp", [1, 1, 3]], ["auto_unroll_max_step", "ot", 512], ["unroll_explicit", "ot", 0]]}], "r": [[0.0004310235793991416], 0, 1.4478967189788818, 1544147217.955172], "v": 0.1}
{"i": ["cuda", "conv2d_no_batching", [1, 7, 7, 512, 512, 3, 3, [1, 1], [1, 1]], {}, ["conv2d_no_batching", 1, 7, 7, 512, 512, 3, 3, [1, 1], [1, 1]], {"i": 200327, "t": "", "c": null, "e": [["tile_f", "sp", [4, 2, 16, 4]], ["tile_y", "sp", [1, 1, 7, 1]], ["tile_x", "sp", [1, 1, 1, 7]], ["tile_rc", "sp", [256, 2, 1]], ["tile_ry", "sp", [1, 3, 1]], ["tile_rx", "sp", [3, 1, 1]], ["auto_unroll_max_step", "ot", 0], ["unroll_explicit", "ot", 0]]}], "r": [[0.0013192550833333334], 0, 1.7041258811950684, 1544147135.7583482], "v": 0.1}
{"i": ["cuda", "conv2d_no_batching", [1, 7, 7, 512, 512, 3, 3, [1, 1], [1, 1]], {}, ["conv2d_no_batching", 1, 7, 7, 512, 512, 3, 3, [1, 1], [1, 1]], {"i": 9013623, "t": "", "c": null, "e": [["tile_f", "sp", [64, 8, 1, 1]], ["tile_y", "sp", [1, 1, 1, 7]], ["tile_x", "sp", [1, 1, 7, 1]], ["tile_rc", "sp", [8, 8, 8]], ["tile_ry", "sp", [1, 3, 1]], ["tile_rx", "sp", [3, 1, 1]], ["auto_unroll_max_step", "ot", 1500], ["unroll_explicit", "ot", 1]]}], "r": [[0.002137121763888889], 0, 12.515594720840454, 1544147171.2518418], "v": 0.1}
{"i": ["cuda", "conv2d_no_batching", [1, 7, 7, 512, 512, 3, 3, [1, 1], [1, 1]], {}, ["conv2d_no_batching", 1, 7, 7, 512, 512, 3, 3, [1, 1], [1, 1]], {"i": 1064105, "t": "", "c": null, "e": [["tile_f", "sp", [16, 1, 1, 32]], ["tile_y", "sp", [7, 1, 1, 1]], ["tile_x", "sp", [1, 7, 1, 1]], ["tile_rc", "sp", [64, 1, 8]], ["tile_ry", "sp", [1, 1, 3]], ["tile_rx", "sp", [1, 3, 1]], ["auto_unroll_max_step", "ot", 0], ["unroll_explicit", "ot", 0]]}], "r": [[0.027470286291666667], 0, 13.151486873626709, 1544147215.7463932], "v": 0.1}
{"i": ["cuda", "conv2d_no_batching", [1, 7, 7, 512, 512, 3, 3, [1, 1], [1, 1]], {}, ["conv2d_no_batching", 1, 7, 7, 512, 512, 3, 3, [1, 1], [1, 1]], {"i": 2718179, "t": "", "c": null, "e": [["tile_f", "sp", [32, 1, 8, 2]], ["tile_y", "sp", [1, 1, 1, 7]], ["tile_x", "sp", [7, 1, 1, 1]], ["tile_rc", "sp", [128, 4, 1]], ["tile_ry", "sp", [1, 1, 3]], ["tile_rx", "sp", [1, 3, 1]], ["auto_unroll_max_step", "ot", 512], ["unroll_explicit", "ot", 0]]}], "r": [[0.0007034992500000001], 0, 1.43101167678833, 1544147216.8818872], "v": 0.1}
{"i": ["cuda", "conv2d_no_batching", [1, 7, 7, 512, 512, 3, 3, [1, 1], [1, 1]], {}, ["conv2d_no_batching", 1, 7, 7, 512, 512, 3, 3, [1, 1], [1, 1]], {"i": 7591349, "t": "", "c": null, "e": [["tile_f", "sp", [16, 4, 8, 1]], ["tile_y", "sp", [1, 1, 7, 1]], ["tile_x", "sp", [1, 1, 7, 1]], ["tile_rc", "sp", [128, 2, 2]], ["tile_ry", "sp", [3, 1, 1]], ["tile_rx", "sp", [1, 3, 1]], ["auto_unroll_max_step", "ot", 512], ["unroll_explicit", "ot", 1]]}], "r": [[0.00031075379639175255], 0, 1.3537545204162598, 1544147277.401724], "v": 0.1}
{"i": ["cuda", "conv2d_no_batching", [1, 7, 7, 512, 512, 3, 3, [1, 1], [1, 1]], {}, ["conv2d_no_batching", 1, 7, 7, 512, 512, 3, 3, [1, 1], [1, 1]], {"i": 7591347, "t": "", "c": null, "e": [["tile_f", "sp", [64, 1, 8, 1]], ["tile_y", "sp", [1, 1, 7, 1]], ["tile_x", "sp", [1, 1, 7, 1]], ["tile_rc", "sp", [128, 2, 2]], ["tile_ry", "sp", [3, 1, 1]], ["tile_rx", "sp", [1, 3, 1]], ["auto_unroll_max_step", "ot", 512], ["unroll_explicit", "ot", 1]]}], "r": [[0.00035247449226804124], 0, 1.2671828269958496, 1544147278.4669209], "v": 0.1}
{"i": ["cuda", "conv2d_no_batching", [1, 7, 7, 512, 512, 3, 3, [1, 1], [1, 1]], {}, ["conv2d_no_batching", 1, 7, 7, 512, 512, 3, 3, [1, 1], [1, 1]], {"i": 7010549, "t": "", "c": null, "e": [["tile_f", "sp", [16, 4, 8, 1]], ["tile_y", "sp", [1, 1, 7, 1]], ["tile_x", "sp", [1, 1, 7, 1]], ["tile_rc", "sp", [128, 2, 2]], ["tile_ry", "sp", [3, 1, 1]], ["tile_rx", "sp", [3, 1, 1]], ["auto_unroll_max_step", "ot", 512], ["unroll_explicit", "ot", 1]]}], "r": [[0.0005594069012875536], 0, 1.5229148864746094, 1544147229.1328561], "v": 0.1}
{"i": ["cuda", "conv2d_no_batching", [1, 7, 7, 512, 512, 3, 3, [1, 1], [1, 1]], {}, ["conv2d_no_batching", 1, 7, 7, 512, 512, 3, 3, [1, 1], [1, 1]], {"i": 7010547, "t": "", "c": null, "e": [["tile_f", "sp", [64, 1, 8, 1]], ["tile_y", "sp", [1, 1, 7, 1]], ["tile_x", "sp", [1, 1, 7, 1]], ["tile_rc", "sp", [128, 2, 2]], ["tile_ry", "sp", [3, 1, 1]], ["tile_rx", "sp", [3, 1, 1]], ["auto_unroll_max_step", "ot", 512], ["unroll_explicit", "ot", 1]]}], "r": [[0.0005516547210300429], 0, 1.4044933319091797, 1544147230.2299461], "v": 0.1}
{"i": ["cuda", "conv2d_no_batching", [1, 7, 7, 512, 512, 3, 3, [1, 1], [1, 1]], {}, ["conv2d_no_batching", 1, 7, 7, 512, 512, 3, 3, [1, 1], [1, 1]], {"i": 7591567, "t": "", "c": null, "e": [["tile_f", "sp", [64, 1, 8, 1]], ["tile_y", "sp", [1, 1, 1, 7]], ["tile_x", "sp", [1, 1, 7, 1]], ["tile_rc", "sp", [128, 2, 2]], ["tile_ry", "sp", [3, 1, 1]], ["tile_rx", "sp", [1, 3, 1]], ["auto_unroll_max_step", "ot", 512], ["unroll_explicit", "ot", 1]]}], "r": [[0.00044863619313304724], 0, 1.383657455444336, 1544147231.3136237], "v": 0.1}
{"i": ["cuda", "conv2d_no_batching", [1, 7, 7, 512, 512, 3, 3, [1, 1], [1, 1]], {}, ["conv2d_no_batching", 1, 7, 7, 512, 512, 3, 3, [1, 1], [1, 1]], {"i": 7559669, "t": "", "c": null, "e": [["tile_f", "sp", [16, 4, 8, 1]], ["tile_y", "sp", [1, 1, 7, 1]], ["tile_x", "sp", [1, 1, 7, 1]], ["tile_rc", "sp", [128, 4, 1]], ["tile_ry", "sp", [3, 1, 1]], ["tile_rx", "sp", [1, 3, 1]], ["auto_unroll_max_step", "ot", 512], ["unroll_explicit", "ot", 1]]}], "r": [[0.0003057186907216495], 0, 1.3248112201690674, 1544147279.5228822], "v": 0.1}
{"i": ["cuda", "conv2d_no_batching", [1, 7, 7, 512, 512, 3, 3, [1, 1], [1, 1]], {}, ["conv2d_no_batching", 1, 7, 7, 512, 512, 3, 3, [1, 1], [1, 1]], {"i": 7559667, "t": "", "c": null, "e": [["tile_f", "sp", [64, 1, 8, 1]], ["tile_y", "sp", [1, 1, 7, 1]], ["tile_x", "sp", [1, 1, 7, 1]], ["tile_rc", "sp", [128, 4, 1]], ["tile_ry", "sp", [3, 1, 1]], ["tile_rx", "sp", [1, 3, 1]], ["auto_unroll_max_step", "ot", 512], ["unroll_explicit", "ot", 1]]}], "r": [[0.0003093216701030928], 0, 1.3276691436767578, 1544147280.555013], "v": 0.1}
{"i": ["cuda", "conv2d_no_batching", [1, 7, 7, 512, 512, 3, 3, [1, 1], [1, 1]], {}, ["conv2d_no_batching", 1, 7, 7, 512, 512, 3, 3, [1, 1], [1, 1]], {"i": 7010767, "t": "", "c": null, "e": [["tile_f", "sp", [64, 1, 8, 1]], ["tile_y", "sp", [1, 1, 1, 7]], ["tile_x", "sp", [1, 1, 7, 1]], ["tile_rc", "sp", [128, 2, 2]], ["tile_ry", "sp", [3, 1, 1]], ["tile_rx", "sp", [3, 1, 1]], ["auto_unroll_max_step", "ot", 512], ["unroll_explicit", "ot", 1]]}], "r": [[0.000854304703862661], 0, 1.7471544742584229, 1544147234.588739], "v": 0.1}
{"i": ["cuda", "conv2d_no_batching", [1, 7, 7, 512, 512, 3, 3, [1, 1], [1, 1]], {}, ["conv2d_no_batching", 1, 7, 7, 512, 512, 3, 3, [1, 1], [1, 1]], {"i": 7591340, "t": "", "c": null, "e": [["tile_f", "sp", [64, 2, 4, 1]], ["tile_y", "sp", [1, 1, 7, 1]], ["tile_x", "sp", [1, 1, 7, 1]], ["tile_rc", "sp", [128, 2, 2]], ["tile_ry", "sp", [3, 1, 1]], ["tile_rx", "sp", [1, 3, 1]], ["auto_unroll_max_step", "ot", 512], ["unroll_explicit", "ot", 1]]}], "r": [[0.0002940729201030928], 0, 1.3588371276855469, 1544147281.575429], "v": 0.1}
{"i": ["cuda", "conv2d_no_batching", [1, 7, 7, 512, 512, 3, 3, [1, 1], [1, 1]], {}, ["conv2d_no_batching", 1, 7, 7, 512, 512, 3, 3, [1, 1], [1, 1]], {"i": 6978869, "t": "", "c": null, "e": [["tile_f", "sp", [16, 4, 8, 1]], ["tile_y", "sp", [1, 1, 7, 1]], ["tile_x", "sp", [1, 1, 7, 1]], ["tile_rc", "sp", [128, 4, 1]], ["tile_ry", "sp", [3, 1, 1]], ["tile_rx", "sp", [3, 1, 1]], ["auto_unroll_max_step", "ot", 512], ["unroll_explicit", "ot", 1]]}], "r": [[0.0005599792575107296], 0, 1.4629120826721191, 1544147236.604848], "v": 0.1}
{"i": ["cuda", "conv2d_no_batching", [1, 7, 7, 512, 512, 3, 3, [1, 1], [1, 1]], {}, ["conv2d_no_batching", 1, 7, 7, 512, 512, 3, 3, [1, 1], [1, 1]], {"i": 6978867, "t": "", "c": null, "e": [["tile_f", "sp", [64, 1, 8, 1]], ["tile_y", "sp", [1, 1, 7, 1]], ["tile_x", "sp", [1, 1, 7, 1]], ["tile_rc", "sp", [128, 4, 1]], ["tile_ry", "sp", [3, 1, 1]], ["tile_rx", "sp", [3, 1, 1]], ["auto_unroll_max_step", "ot", 512], ["unroll_explicit", "ot", 1]]}], "r": [[0.0005517094549356223], 0, 1.3695337772369385, 1544147237.64707], "v": 0.1}
{"i": ["cuda", "conv2d_no_batching", [1, 7, 7, 512, 512, 3, 3, [1, 1], [1, 1]], {}, ["conv2d_no_batching", 1, 7, 7, 512, 512, 3, 3, [1, 1], [1, 1]], {"i": 7010540, "t": "", "c": null, "e": [["tile_f", "sp", [64, 2, 4, 1]], ["tile_y", "sp", [1, 1, 7, 1]], ["tile_x", "sp", [1, 1, 7, 1]], ["tile_rc", "sp", [128, 2, 2]], ["tile_ry", "sp", [3, 1, 1]], ["tile_rx", "sp", [3, 1, 1]], ["auto_unroll_max_step", "ot", 512], ["unroll_explicit", "ot", 1]]}], "r": [[0.000258525030927835], 0, 1.2697911262512207, 1544147282.5478983], "v": 0.1}
{"i": ["cuda", "conv2d_no_batching", [1, 7, 7, 512, 512, 3, 3, [1, 1], [1, 1]], {}, ["conv2d_no_batching", 1, 7, 7, 512, 512, 3, 3, [1, 1], [1, 1]], {"i": 7591339, "t": "", "c": null, "e": [["tile_f", "sp", [128, 1, 4, 1]], ["tile_y", "sp", [1, 1, 7, 1]], ["tile_x", "sp", [1, 1, 7, 1]], ["tile_rc", "sp", [128, 2, 2]], ["tile_ry", "sp", [3, 1, 1]], ["tile_rx", "sp", [1, 3, 1]], ["auto_unroll_max_step", "ot", 512], ["unroll_explicit", "ot", 1]]}], "r": [[0.00032363678350515467], 0, 1.3441507816314697, 1544147283.6035118], "v": 0.1}
{"i": ["cuda", "conv2d_no_batching", [1, 7, 7, 512, 512, 3, 3, [1, 1], [1, 1]], {}, ["conv2d_no_batching", 1, 7, 7, 512, 512, 3, 3, [1, 1], [1, 1]], {"i": 7590907, "t": "", "c": null, "e": [["tile_f", "sp", [64, 1, 8, 1]], ["tile_y", "sp", [7, 1, 1, 1]], ["tile_x", "sp", [1, 1, 7, 1]], ["tile_rc", "sp", [128, 2, 2]], ["tile_ry", "sp", [3, 1, 1]], ["tile_rx", "sp", [1, 3, 1]], ["auto_unroll_max_step", "ot", 512], ["unroll_explicit", "ot", 1]]}], "r": [[0.0002881215206185567], 0, 1.3634998798370361, 1544147284.626274], "v": 0.1}
{"i": ["cuda", "conv2d_no_batching", [1, 7, 7, 512, 512, 3, 3, [1, 1], [1, 1]], {}, ["conv2d_no_batching", 1, 7, 7, 512, 512, 3, 3, [1, 1], [1, 1]], {"i": 7591569, "t": "", "c": null, "e": [["tile_f", "sp", [16, 4, 8, 1]], ["tile_y", "sp", [1, 1, 1, 7]], ["tile_x", "sp", [1, 1, 7, 1]], ["tile_rc", "sp", [128, 2, 2]], ["tile_ry", "sp", [3, 1, 1]], ["tile_rx", "sp", [1, 3, 1]], ["auto_unroll_max_step", "ot", 512], ["unroll_explicit", "ot", 1]]}], "r": [[0.0006864941587982833], 0, 1.8453888893127441, 1544147241.8058221], "v": 0.1}
{"i": ["cuda", "conv2d_no_batching", [1, 7, 7, 512, 512, 3, 3, [1, 1], [1, 1]], {}, ["conv2d_no_batching", 1, 7, 7, 512, 512, 3, 3, [1, 1], [1, 1]], {"i": 7594867, "t": "", "c": null, "e": [["tile_f", "sp", [64, 1, 8, 1]], ["tile_y", "sp", [1, 1, 7, 1]], ["tile_x", "sp", [1, 1, 7, 1]], ["tile_rc", "sp", [64, 4, 2]], ["tile_ry", "sp", [3, 1, 1]], ["tile_rx", "sp", [1, 3, 1]], ["auto_unroll_max_step", "ot", 512], ["unroll_explicit", "ot", 1]]}], "r": [[0.00029550369845360823], 0, 1.3538517951965332, 1544147285.6402938], "v": 0.1}
{"i": ["cuda", "conv2d_no_batching", [1, 7, 7, 512, 512, 3, 3, [1, 1], [1, 1]], {}, ["conv2d_no_batching", 1, 7, 7, 512, 512, 3, 3, [1, 1], [1, 1]], {"i": 7591341, "t": "", "c": null, "e": [["tile_f", "sp", [32, 4, 4, 1]], ["tile_y", "sp", [1, 1, 7, 1]], ["tile_x", "sp", [1, 1, 7, 1]], ["tile_rc", "sp", [128, 2, 2]], ["tile_ry", "sp", [3, 1, 1]], ["tile_rx", "sp", [1, 3, 1]], ["auto_unroll_max_step", "ot", 512], ["unroll_explicit", "ot", 1]]}], "r": [[0.0003247396340206186], 0, 1.3896093368530273, 1544147286.6844265], "v": 0.1}
{"i": ["cuda", "conv2d_no_batching", [1, 7, 7, 512, 512, 3, 3, [1, 1], [1, 1]], {}, ["conv2d_no_batching", 1, 7, 7, 512, 512, 3, 3, [1, 1], [1, 1]], {"i": 7010539, "t": "", "c": null, "e": [["tile_f", "sp", [128, 1, 4, 1]], ["tile_y", "sp", [1, 1, 7, 1]], ["tile_x", "sp", [1, 1, 7, 1]], ["tile_rc", "sp", [128, 2, 2]], ["tile_ry", "sp", [3, 1, 1]], ["tile_rx", "sp", [3, 1, 1]], ["auto_unroll_max_step", "ot", 512], ["unroll_explicit", "ot", 1]]}], "r": [[0.00030411126546391753], 0, 1.3363542556762695, 1544147287.7021272], "v": 0.1}
{"i": ["cuda", "conv2d_no_batching", [1, 7, 7, 512, 512, 3, 3, [1, 1], [1, 1]], {}, ["conv2d_no_batching", 1, 7, 7, 512, 512, 3, 3, [1, 1], [1, 1]], {"i": 7010107, "t": "", "c": null, "e": [["tile_f", "sp", [64, 1, 8, 1]], ["tile_y", "sp", [7, 1, 1, 1]], ["tile_x", "sp", [1, 1, 7, 1]], ["tile_rc", "sp", [128, 2, 2]], ["tile_ry", "sp", [3, 1, 1]], ["tile_rx", "sp", [3, 1, 1]], ["auto_unroll_max_step", "ot", 512], ["unroll_explicit", "ot", 1]]}], "r": [[0.00043832787982832615], 0, 1.2933263778686523, 1544147245.6643205], "v": 0.1}
{"i": ["cuda", "conv2d_no_batching", [1, 7, 7, 512, 512, 3, 3, [1, 1], [1, 1]], {}, ["conv2d_no_batching", 1, 7, 7, 512, 512, 3, 3, [1, 1], [1, 1]], {"i": 7010769, "t": "", "c": null, "e": [["tile_f", "sp", [16, 4, 8, 1]], ["tile_y", "sp", [1, 1, 1, 7]], ["tile_x", "sp", [1, 1, 7, 1]], ["tile_rc", "sp", [128, 2, 2]], ["tile_ry", "sp", [3, 1, 1]], ["tile_rx", "sp", [3, 1, 1]], ["auto_unroll_max_step", "ot", 512], ["unroll_explicit", "ot", 1]]}], "r": [[0.0011619817811158797], 0, 2.1115546226501465, 1544147247.3096259], "v": 0.1}
{"i": ["cuda", "conv2d_no_batching", [1, 7, 7, 512, 512, 3, 3, [1, 1], [1, 1]], {}, ["conv2d_no_batching", 1, 7, 7, 512, 512, 3, 3, [1, 1], [1, 1]], {"i": 7014067, "t": "", "c": null, "e": [["tile_f", "sp", [64, 1, 8, 1]], ["tile_y", "sp", [1, 1, 7, 1]], ["tile_x", "sp", [1, 1, 7, 1]], ["tile_rc", "sp", [64, 4, 2]], ["tile_ry", "sp", [3, 1, 1]], ["tile_rx", "sp", [3, 1, 1]], ["auto_unroll_max_step", "ot", 512], ["unroll_explicit", "ot", 1]]}], "r": [[0.000280187381443299], 0, 1.3108134269714355, 1544147288.7027507], "v": 0.1}
{"i": ["cuda", "conv2d_no_batching", [1, 7, 7, 512, 512, 3, 3, [1, 1], [1, 1]], {}, ["conv2d_no_batching", 1, 7, 7, 512, 512, 3, 3, [1, 1], [1, 1]], {"i": 7010541, "t": "", "c": null, "e": [["tile_f", "sp", [32, 4, 4, 1]], ["tile_y", "sp", [1, 1, 7, 1]], ["tile_x", "sp", [1, 1, 7, 1]], ["tile_rc", "sp", [128, 2, 2]], ["tile_ry", "sp", [3, 1, 1]], ["tile_rx", "sp", [3, 1, 1]], ["auto_unroll_max_step", "ot", 512], ["unroll_explicit", "ot", 1]]}], "r": [[0.0003301337242268041], 0, 1.418092966079712, 1544147289.7875528], "v": 0.1}
{"i": ["cuda", "conv2d_no_batching", [1, 7, 7, 512, 512, 3, 3, [1, 1], [1, 1]], {}, ["conv2d_no_batching", 1, 7, 7, 512, 512, 3, 3, [1, 1], [1, 1]], {"i": 7559887, "t": "", "c": null, "e": [["tile_f", "sp", [64, 1, 8, 1]], ["tile_y", "sp", [1, 1, 1, 7]], ["tile_x", "sp", [1, 1, 7, 1]], ["tile_rc", "sp", [128, 4, 1]], ["tile_ry", "sp", [3, 1, 1]], ["tile_rx", "sp", [1, 3, 1]], ["auto_unroll_max_step", "ot", 512], ["unroll_explicit", "ot", 1]]}], "r": [[0.0004063350360824742], 0, 1.512796401977539, 1544147290.9513829], "v": 0.1}
{"i": ["cuda", "conv2d_no_batching", [1, 7, 7, 512, 512, 3, 3, [1, 1], [1, 1]], {}, ["conv2d_no_batching", 1, 7, 7, 512, 512, 3, 3, [1, 1], [1, 1]], {"i": 7591560, "t": "", "c": null, "e": [["tile_f", "sp", [64, 2, 4, 1]], ["tile_y", "sp", [1, 1, 1, 7]], ["tile_x", "sp", [1, 1, 7, 1]], ["tile_rc", "sp", [128, 2, 2]], ["tile_ry", "sp", [3, 1, 1]], ["tile_rx", "sp", [1, 3, 1]], ["auto_unroll_max_step", "ot", 512], ["unroll_explicit", "ot", 1]]}], "r": [[0.0006442917296137339], 0, 1.6339612007141113, 1544147251.5478845], "v": 0.1}
{"i": ["cuda", "conv2d_no_batching", [1, 7, 7, 512, 512, 3, 3, [1, 1], [1, 1]], {}, ["conv2d_no_batching", 1, 7, 7, 512, 512, 3, 3, [1, 1], [1, 1]], {"i": 9333749, "t": "", "c": null, "e": [["tile_f", "sp", [16, 4, 8, 1]], ["tile_y", "sp", [1, 1, 7, 1]], ["tile_x", "sp", [1, 1, 7, 1]], ["tile_rc", "sp", [128, 2, 2]], ["tile_ry", "sp", [3, 1, 1]], ["tile_rx", "sp", [1, 3, 1]], ["auto_unroll_max_step", "ot", 1500], ["unroll_explicit", "ot", 1]]}], "r": [[0.0003115355077319588], 0, 1.3890414237976074, 1544147291.9982622], "v": 0.1}
{"i": ["cuda", "conv2d_no_batching", [1, 7, 7, 512, 512, 3, 3, [1, 1], [1, 1]], {}, ["conv2d_no_batching", 1, 7, 7, 512, 512, 3, 3, [1, 1], [1, 1]], {"i": 7590909, "t": "", "c": null, "e": [["tile_f", "sp", [16, 4, 8, 1]], ["tile_y", "sp", [7, 1, 1, 1]], ["tile_x", "sp", [1, 1, 7, 1]], ["tile_rc", "sp", [128, 2, 2]], ["tile_ry", "sp", [3, 1, 1]], ["tile_rx", "sp", [1, 3, 1]], ["auto_unroll_max_step", "ot", 512], ["unroll_explicit", "ot", 1]]}], "r": [[0.00032900038402061856], 0, 1.5233256816864014, 1544147293.089645], "v": 0.1}
{"i": ["cuda", "conv2d_no_batching", [1, 7, 7, 512, 512, 3, 3, [1, 1], [1, 1]], {}, ["conv2d_no_batching", 1, 7, 7, 512, 512, 3, 3, [1, 1], [1, 1]], {"i": 7556149, "t": "", "c": null, "e": [["tile_f", "sp", [16, 4, 8, 1]], ["tile_y", "sp", [1, 1, 7, 1]], ["tile_x", "sp", [1, 1, 7, 1]], ["tile_rc", "sp", [256, 2, 1]], ["tile_ry", "sp", [3, 1, 1]], ["tile_rx", "sp", [1, 3, 1]], ["auto_unroll_max_step", "ot", 512], ["unroll_explicit", "ot", 1]]}], "r": [[0.00047143763519313307], 0, 1.373720645904541, 1544147254.5150514], "v": 0.1}
{"i": ["cuda", "conv2d_no_batching", [1, 7, 7, 512, 512, 3, 3, [1, 1], [1, 1]], {}, ["conv2d_no_batching", 1, 7, 7, 512, 512, 3, 3, [1, 1], [1, 1]], {"i": 6979087, "t": "", "c": null, "e": [["tile_f", "sp", [64, 1, 8, 1]], ["tile_y", "sp", [1, 1, 1, 7]], ["tile_x", "sp", [1, 1, 7, 1]], ["tile_rc", "sp", [128, 4, 1]], ["tile_ry", "sp", [3, 1, 1]], ["tile_rx", "sp", [3, 1, 1]], ["auto_unroll_max_step", "ot", 512], ["unroll_explicit", "ot", 1]]}], "r": [[0.0008544101502145923], 0, 1.6047625541687012, 1544147255.8112867], "v": 0.1}
{"i": ["cuda", "conv2d_no_batching", [1, 7, 7, 512, 512, 3, 3, [1, 1], [1, 1]], {}, ["conv2d_no_batching", 1, 7, 7, 512, 512, 3, 3, [1, 1], [1, 1]], {"i": 9333747, "t": "", "c": null, "e": [["tile_f", "sp", [64, 1, 8, 1]], ["tile_y", "sp", [1, 1, 7, 1]], ["tile_x", "sp", [1, 1, 7, 1]], ["tile_rc", "sp", [128, 2, 2]], ["tile_ry", "sp", [3, 1, 1]], ["tile_rx", "sp", [1, 3, 1]], ["auto_unroll_max_step", "ot", 1500], ["unroll_explicit", "ot", 1]]}], "r": [[0.0003525989407216495], 0, 1.377333402633667, 1544147294.168787], "v": 0.1}
{"i": ["cuda", "conv2d_no_batching", [1, 7, 7, 512, 512, 3, 3, [1, 1], [1, 1]], {}, ["conv2d_no_batching", 1, 7, 7, 512, 512, 3, 3, [1, 1], [1, 1]], {"i": 7591348, "t": "", "c": null, "e": [["tile_f", "sp", [32, 2, 8, 1]], ["tile_y", "sp", [1, 1, 7, 1]], ["tile_x", "sp", [1, 1, 7, 1]], ["tile_rc", "sp", [128, 2, 2]], ["tile_ry", "sp", [3, 1, 1]], ["tile_rx", "sp", [1, 3, 1]], ["auto_unroll_max_step", "ot", 512], ["unroll_explicit", "ot", 1]]}], "r": [[0.00034446077835051543], 0, 1.4005498886108398, 1544147295.260338], "v": 0.1}
{"i": ["cuda", "conv2d_no_batching", [1, 7, 7, 512, 512, 3, 3, [1, 1], [1, 1]], {}, ["conv2d_no_batching", 1, 7, 7, 512, 512, 3, 3, [1, 1], [1, 1]], {"i": 7556147, "t": "", "c": null, "e": [["tile_f", "sp", [64, 1, 8, 1]], ["tile_y", "sp", [1, 1, 7, 1]], ["tile_x", "sp", [1, 1, 7, 1]], ["tile_rc", "sp", [256, 2, 1]], ["tile_ry", "sp", [3, 1, 1]], ["tile_rx", "sp", [1, 3, 1]], ["auto_unroll_max_step", "ot", 512], ["unroll_explicit", "ot", 1]]}], "r": [[0.0004705725364806867], 0, 1.33571195602417, 1544147258.665446], "v": 0.1}
{"i": ["cuda", "conv2d_no_batching", [1, 7, 7, 512, 512, 3, 3, [1, 1], [1, 1]], {}, ["conv2d_no_batching", 1, 7, 7, 512, 512, 3, 3, [1, 1], [1, 1]], {"i": 7559660, "t": "", "c": null, "e": [["tile_f", "sp", [64, 2, 4, 1]], ["tile_y", "sp", [1, 1, 7, 1]], ["tile_x", "sp", [1, 1, 7, 1]], ["tile_rc", "sp", [128, 4, 1]], ["tile_ry", "sp", [3, 1, 1]], ["tile_rx", "sp", [1, 3, 1]], ["auto_unroll_max_step", "ot", 512], ["unroll_explicit", "ot", 1]]}], "r": [[0.00033409013917525774], 0, 1.3654580116271973, 1544147296.3260362], "v": 0.1}
{"i": ["cuda", "conv2d_no_batching", [1, 7, 7, 512, 512, 3, 3, [1, 1], [1, 1]], {}, ["conv2d_no_batching", 1, 7, 7, 512, 512, 3, 3, [1, 1], [1, 1]], {"i": 7010760, "t": "", "c": null, "e": [["tile_f", "sp", [64, 2, 4, 1]], ["tile_y", "sp", [1, 1, 1, 7]], ["tile_x", "sp", [1, 1, 7, 1]], ["tile_rc", "sp", [128, 2, 2]], ["tile_ry", "sp", [3, 1, 1]], ["tile_rx", "sp", [3, 1, 1]], ["auto_unroll_max_step", "ot", 512], ["unroll_explicit", "ot", 1]]}], "r": [[0.00045008122746781115], 0, 1.4579496383666992, 1544147260.6688144], "v": 0.1}
{"i": ["cuda", "conv2d_no_batching", [1, 7, 7, 512, 512, 3, 3, [1, 1], [1, 1]], {}, ["conv2d_no_batching", 1, 7, 7, 512, 512, 3, 3, [1, 1], [1, 1]], {"i": 5848949, "t": "", "c": null, "e": [["tile_f", "sp", [16, 4, 8, 1]], ["tile_y", "sp", [1, 1, 7, 1]], ["tile_x", "sp", [1, 1, 7, 1]], ["tile_rc", "sp", [128, 2, 2]], ["tile_ry", "sp", [3, 1, 1]], ["tile_rx", "sp", [1, 3, 1]], ["auto_unroll_max_step", "ot", 0], ["unroll_explicit", "ot", 1]]}], "r": [[0.00033170106958762885], 0, 1.3434045314788818, 1544147297.37586], "v": 0.1}
{"i": ["cuda", "conv2d_no_batching", [1, 7, 7, 512, 512, 3, 3, [1, 1], [1, 1]], {}, ["conv2d_no_batching", 1, 7, 7, 512, 512, 3, 3, [1, 1], [1, 1]], {"i": 7591559, "t": "", "c": null, "e": [["tile_f", "sp", [128, 1, 4, 1]], ["tile_y", "sp", [1, 1, 1, 7]], ["tile_x", "sp", [1, 1, 7, 1]], ["tile_rc", "sp", [128, 2, 2]], ["tile_ry", "sp", [3, 1, 1]], ["tile_rx", "sp", [1, 3, 1]], ["auto_unroll_max_step", "ot", 512], ["unroll_explicit", "ot", 1]]}], "r": [[0.0004738311330472103], 0, 1.3949625492095947, 1544147262.7240877], "v": 0.1}
{"i": ["cuda", "conv2d_no_batching", [1, 7, 7, 512, 512, 3, 3, [1, 1], [1, 1]], {}, ["conv2d_no_batching", 1, 7, 7, 512, 512, 3, 3, [1, 1], [1, 1]], {"i": 8752949, "t": "", "c": null, "e": [["tile_f", "sp", [16, 4, 8, 1]], ["tile_y", "sp", [1, 1, 7, 1]], ["tile_x", "sp", [1, 1, 7, 1]], ["tile_rc", "sp", [128, 2, 2]], ["tile_ry", "sp", [3, 1, 1]], ["tile_rx", "sp", [3, 1, 1]], ["auto_unroll_max_step", "ot", 1500], ["unroll_explicit", "ot", 1]]}], "r": [[0.0005602382403433476], 0, 1.4650440216064453, 1544147263.8150697], "v": 0.1}
{"i": ["cuda", "conv2d_no_batching", [1, 7, 7, 512, 512, 3, 3, [1, 1], [1, 1]], {}, ["conv2d_no_batching", 1, 7, 7, 512, 512, 3, 3, [1, 1], [1, 1]], {"i": 7010109, "t": "", "c": null, "e": [["tile_f", "sp", [16, 4, 8, 1]], ["tile_y", "sp", [7, 1, 1, 1]], ["tile_x", "sp", [1, 1, 7, 1]], ["tile_rc", "sp", [128, 2, 2]], ["tile_ry", "sp", [3, 1, 1]], ["tile_rx", "sp", [3, 1, 1]], ["auto_unroll_max_step", "ot", 512], ["unroll_explicit", "ot", 1]]}], "r": [[0.00046189356223175963], 0, 1.4353001117706299, 1544147264.8870642], "v": 0.1}
{"i": ["cuda", "conv2d_no_batching", [1, 7, 7, 512, 512, 3, 3, [1, 1], [1, 1]], {}, ["conv2d_no_batching", 1, 7, 7, 512, 512, 3, 3, [1, 1], [1, 1]], {"i": 6975349, "t": "", "c": null, "e": [["tile_f", "sp", [16, 4, 8, 1]], ["tile_y", "sp", [1, 1, 7, 1]], ["tile_x", "sp", [1, 1, 7, 1]], ["tile_rc", "sp", [256, 2, 1]], ["tile_ry", "sp", [3, 1, 1]], ["tile_rx", "sp", [3, 1, 1]], ["auto_unroll_max_step", "ot", 512], ["unroll_explicit", "ot", 1]]}], "r": [[0.0009609351931330472], 0, 1.8944783210754395, 1544147266.4725611], "v": 0.1}
{"i": ["cuda", "conv2d_no_batching", [1, 7, 7, 512, 512, 3, 3, [1, 1], [1, 1]], {}, ["conv2d_no_batching", 1, 7, 7, 512, 512, 3, 3, [1, 1], [1, 1]], {"i": 5848947, "t": "", "c": null, "e": [["tile_f", "sp", [64, 1, 8, 1]], ["tile_y", "sp", [1, 1, 7, 1]], ["tile_x", "sp", [1, 1, 7, 1]], ["tile_rc", "sp", [128, 2, 2]], ["tile_ry", "sp", [3, 1, 1]], ["tile_rx", "sp", [1, 3, 1]], ["auto_unroll_max_step", "ot", 0], ["unroll_explicit", "ot", 1]]}], "r": [[0.00032232757731958766], 0, 1.3060898780822754, 1544147298.4174578], "v": 0.1}
{"i": ["cuda", "conv2d_no_batching", [1, 7, 7, 512, 512, 3, 3, [1, 1], [1, 1]], {}, ["conv2d_no_batching", 1, 7, 7, 512, 512, 3, 3, [1, 1], [1, 1]], {"i": 8752947, "t": "", "c": null, "e": [["tile_f", "sp", [64, 1, 8, 1]], ["tile_y", "sp", [1, 1, 7, 1]], ["tile_x", "sp", [1, 1, 7, 1]], ["tile_rc", "sp", [128, 2, 2]], ["tile_ry", "sp", [3, 1, 1]], ["tile_rx", "sp", [3, 1, 1]], ["auto_unroll_max_step", "ot", 1500], ["unroll_explicit", "ot", 1]]}], "r": [[0.0005517702832618026], 0, 1.3503820896148682, 1544147268.4306934], "v": 0.1}
{"i": ["cuda", "conv2d_no_batching", [1, 7, 7, 512, 512, 3, 3, [1, 1], [1, 1]], {}, ["conv2d_no_batching", 1, 7, 7, 512, 512, 3, 3, [1, 1], [1, 1]], {"i": 7595087, "t": "", "c": null, "e": [["tile_f", "sp", [64, 1, 8, 1]], ["tile_y", "sp", [1, 1, 1, 7]], ["tile_x", "sp", [1, 1, 7, 1]], ["tile_rc", "sp", [64, 4, 2]], ["tile_ry", "sp", [3, 1, 1]], ["tile_rx", "sp", [1, 3, 1]], ["auto_unroll_max_step", "ot", 512], ["unroll_explicit", "ot", 1]]}], "r": [[0.000336110868556701], 0, 1.4632015228271484, 1544147299.5120513], "v": 0.1}
{"i": ["cuda", "conv2d_no_batching", [1, 7, 7, 512, 512, 3, 3, [1, 1], [1, 1]], {}, ["conv2d_no_batching", 1, 7, 7, 512, 512, 3, 3, [1, 1], [1, 1]], {"i": 7010548, "t": "", "c": null, "e": [["tile_f", "sp", [32, 2, 8, 1]], ["tile_y", "sp", [1, 1, 7, 1]], ["tile_x", "sp", [1, 1, 7, 1]], ["tile_rc", "sp", [128, 2, 2]], ["tile_ry", "sp", [3, 1, 1]], ["tile_rx", "sp", [3, 1, 1]], ["auto_unroll_max_step", "ot", 512], ["unroll_explicit", "ot", 1]]}], "r": [[0.000543189330472103], 0, 1.4231700897216797, 1544147270.5990393], "v": 0.1}
{"i": ["cuda", "conv2d_no_batching", [1, 7, 7, 512, 512, 3, 3, [1, 1], [1, 1]], {}, ["conv2d_no_batching", 1, 7, 7, 512, 512, 3, 3, [1, 1], [1, 1]], {"i": 7563187, "t": "", "c": null, "e": [["tile_f", "sp", [64, 1, 8, 1]], ["tile_y", "sp", [1, 1, 7, 1]], ["tile_x", "sp", [1, 1, 7, 1]], ["tile_rc", "sp", [64, 8, 1]], ["tile_ry", "sp", [3, 1, 1]], ["tile_rx", "sp", [1, 3, 1]], ["auto_unroll_max_step", "ot", 512], ["unroll_explicit", "ot", 1]]}], "r": [[0.0002919841469072165], 0, 1.3124825954437256, 1544147300.5253572], "v": 0.1}
{"i": ["cuda", "conv2d_no_batching", [1, 7, 7, 512, 512, 3, 3, [1, 1], [1, 1]], {}, ["conv2d_no_batching", 1, 7, 7, 512, 512, 3, 3, [1, 1], [1, 1]], {"i": 7623027, "t": "", "c": null, "e": [["tile_f", "sp", [64, 1, 8, 1]], ["tile_y", "sp", [1, 1, 7, 1]], ["tile_x", "sp", [1, 1, 7, 1]], ["tile_rc", "sp", [64, 2, 4]], ["tile_ry", "sp", [3, 1, 1]], ["tile_rx", "sp", [1, 3, 1]], ["auto_unroll_max_step", "ot", 512], ["unroll_explicit", "ot", 1]]}], "r": [[0.0002876984742268041], 0, 1.3229460716247559, 1544147301.5504053], "v": 0.1}
{"i": ["cuda", "conv2d_no_batching", [1, 7, 7, 512, 512, 3, 3, [1, 1], [1, 1]], {}, ["conv2d_no_batching", 1, 7, 7, 512, 512, 3, 3, [1, 1], [1, 1]], {"i": 6978860, "t": "", "c": null, "e": [["tile_f", "sp", [64, 2, 4, 1]], ["tile_y", "sp", [1, 1, 7, 1]], ["tile_x", "sp", [1, 1, 7, 1]], ["tile_rc", "sp", [128, 4, 1]], ["tile_ry", "sp", [3, 1, 1]], ["tile_rx", "sp", [3, 1, 1]], ["auto_unroll_max_step", "ot", 512], ["unroll_explicit", "ot", 1]]}], "r": [[0.00025834137371134023], 0, 1.2345120906829834, 1544147302.511242], "v": 0.1}
{"i": ["cuda", "conv2d_no_batching", [1, 7, 7, 512, 512, 3, 3, [1, 1], [1, 1]], {}, ["conv2d_no_batching", 1, 7, 7, 512, 512, 3, 3, [1, 1], [1, 1]], {"i": 7594427, "t": "", "c": null, "e": [["tile_f", "sp", [64, 1, 8, 1]], ["tile_y", "sp", [7, 1, 1, 1]], ["tile_x", "sp", [1, 1, 7, 1]], ["tile_rc", "sp", [64, 4, 2]], ["tile_ry", "sp", [3, 1, 1]], ["tile_rx", "sp", [1, 3, 1]], ["auto_unroll_max_step", "ot", 512], ["unroll_explicit", "ot", 1]]}], "r": [[0.00026564212886597937], 0, 1.2924916744232178, 1544147303.5079691], "v": 0.1}
{"i": ["cuda", "conv2d_no_batching", [1, 7, 7, 512, 512, 3, 3, [1, 1], [1, 1]], {}, ["conv2d_no_batching", 1, 7, 7, 512, 512, 3, 3, [1, 1], [1, 1]], {"i": 5268149, "t": "", "c": null, "e": [["tile_f", "sp", [16, 4, 8, 1]], ["tile_y", "sp", [1, 1, 7, 1]], ["tile_x", "sp", [1, 1, 7, 1]], ["tile_rc", "sp", [128, 2, 2]], ["tile_ry", "sp", [3, 1, 1]], ["tile_rx", "sp", [3, 1, 1]], ["auto_unroll_max_step", "ot", 0], ["unroll_explicit", "ot", 1]]}], "r": [[0.0006114870386266094], 0, 1.3935701847076416, 1544147275.3801768], "v": 0.1}
{"i": ["cuda", "conv2d_no_batching", [1, 7, 7, 512, 512, 3, 3, [1, 1], [1, 1]], {}, ["conv2d_no_batching", 1, 7, 7, 512, 512, 3, 3, [1, 1], [1, 1]], {"i": 7559659, "t": "", "c": null, "e": [["tile_f", "sp", [128, 1, 4, 1]], ["tile_y", "sp", [1, 1, 7, 1]], ["tile_x", "sp", [1, 1, 7, 1]], ["tile_rc", "sp", [128, 4, 1]], ["tile_ry", "sp", [3, 1, 1]], ["tile_rx", "sp", [1, 3, 1]], ["auto_unroll_max_step", "ot", 512], ["unroll_explicit", "ot", 1]]}], "r": [[0.0003341188582474227], 0, 1.3261146545410156, 1544147304.5742257], "v": 0.1}
{"i": ["cuda", "conv2d_no_batching", [1, 7, 7, 512, 512, 3, 3, [1, 1], [1, 1]], {}, ["conv2d_no_batching", 1, 7, 7, 512, 512, 3, 3, [1, 1], [1, 1]], {"i": 2367667, "t": "", "c": null, "e": [["tile_f", "sp", [64, 1, 8, 1]], ["tile_y", "sp", [1, 1, 7, 1]], ["tile_x", "sp", [1, 1, 7, 1]], ["tile_rc", "sp", [64, 4, 2]], ["tile_ry", "sp", [3, 1, 1]], ["tile_rx", "sp", [1, 3, 1]], ["auto_unroll_max_step", "ot", 512], ["unroll_explicit", "ot", 0]]}], "r": [[0.0003544022603092784], 0, 1.4026706218719482, 1544147313.6342952], "v": 0.1}
{"i": ["cuda", "conv2d_no_batching", [1, 7, 7, 512, 512, 3, 3, [1, 1], [1, 1]], {}, ["conv2d_no_batching", 1, 7, 7, 512, 512, 3, 3, [1, 1], [1, 1]], {"i": 625267, "t": "", "c": null, "e": [["tile_f", "sp", [64, 1, 8, 1]], ["tile_y", "sp", [1, 1, 7, 1]], ["tile_x", "sp", [1, 1, 7, 1]], ["tile_rc", "sp", [64, 4, 2]], ["tile_ry", "sp", [3, 1, 1]], ["tile_rx", "sp", [1, 3, 1]], ["auto_unroll_max_step", "ot", 0], ["unroll_explicit", "ot", 0]]}], "r": [[0.0002937535824742268], 0, 1.348717451095581, 1544147314.7132123], "v": 0.1}
{"i": ["cuda", "conv2d_no_batching", [1, 7, 7, 512, 512, 3, 3, [1, 1], [1, 1]], {}, ["conv2d_no_batching", 1, 7, 7, 512, 512, 3, 3, [1, 1], [1, 1]], {"i": 5852467, "t": "", "c": null, "e": [["tile_f", "sp", [64, 1, 8, 1]], ["tile_y", "sp", [1, 1, 7, 1]], ["tile_x", "sp", [1, 1, 7, 1]], ["tile_rc", "sp", [64, 4, 2]], ["tile_ry", "sp", [3, 1, 1]], ["tile_rx", "sp", [1, 3, 1]], ["auto_unroll_max_step", "ot", 0], ["unroll_explicit", "ot", 1]]}], "r": [[0.0002876096855670103], 0, 1.2049775123596191, 1544147315.7215211], "v": 0.1}
{"i": ["cuda", "conv2d_no_batching", [1, 7, 7, 512, 512, 3, 3, [1, 1], [1, 1]], {}, ["conv2d_no_batching", 1, 7, 7, 512, 512, 3, 3, [1, 1], [1, 1]], {"i": 7594874, "t": "", "c": null, "e": [["tile_f", "sp", [32, 1, 16, 1]], ["tile_y", "sp", [1, 1, 7, 1]], ["tile_x", "sp", [1, 1, 7, 1]], ["tile_rc", "sp", [64, 4, 2]], ["tile_ry", "sp", [3, 1, 1]], ["tile_rx", "sp", [1, 3, 1]], ["auto_unroll_max_step", "ot", 512], ["unroll_explicit", "ot", 1]]}], "r": [[0.0003568163221649484], 0, 1.4231033325195312, 1544147316.8640046], "v": 0.1}
{"i": ["cuda", "conv2d_no_batching", [1, 7, 7, 512, 512, 3, 3, [1, 1], [1, 1]], {}, ["conv2d_no_batching", 1, 7, 7, 512, 512, 3, 3, [1, 1], [1, 1]], {"i": 2367674, "t": "", "c": null, "e": [["tile_f", "sp", [32, 1, 16, 1]], ["tile_y", "sp", [1, 1, 7, 1]], ["tile_x", "sp", [1, 1, 7, 1]], ["tile_rc", "sp", [64, 4, 2]], ["tile_ry", "sp", [3, 1, 1]], ["tile_rx", "sp", [1, 3, 1]], ["auto_unroll_max_step", "ot", 512], ["unroll_explicit", "ot", 0]]}], "r": [[0.0003779050206185567], 0, 1.4567956924438477, 1544147318.0447235], "v": 0.1}
{"i": ["cuda", "conv2d_no_batching", [1, 7, 7, 512, 512, 3, 3, [1, 1], [1, 1]], {}, ["conv2d_no_batching", 1, 7, 7, 512, 512, 3, 3, [1, 1], [1, 1]], {"i": 2364140, "t": "", "c": null, "e": [["tile_f", "sp", [64, 2, 4, 1]], ["tile_y", "sp", [1, 1, 7, 1]], ["tile_x", "sp", [1, 1, 7, 1]], ["tile_rc", "sp", [128, 2, 2]], ["tile_ry", "sp", [3, 1, 1]], ["tile_rx", "sp", [1, 3, 1]], ["auto_unroll_max_step", "ot", 512], ["unroll_explicit", "ot", 0]]}], "r": [[0.0002954095850515464], 0, 1.3353333473205566, 1544147319.1170402], "v": 0.1}
{"i": ["cuda", "conv2d_no_batching", [1, 7, 7, 512, 512, 3, 3, [1, 1], [1, 1]], {}, ["conv2d_no_batching", 1, 7, 7, 512, 512, 3, 3, [1, 1], [1, 1]], {"i": 621740, "t": "", "c": null, "e": [["tile_f", "sp", [64, 2, 4, 1]], ["tile_y", "sp", [1, 1, 7, 1]], ["tile_x", "sp", [1, 1, 7, 1]], ["tile_rc", "sp", [128, 2, 2]], ["tile_ry", "sp", [3, 1, 1]], ["tile_rx", "sp", [1, 3, 1]], ["auto_unroll_max_step", "ot", 0], ["unroll_explicit", "ot", 0]]}], "r": [[0.0003085539587628866], 0, 1.3163559436798096, 1544147320.2025514], "v": 0.1}
{"i": ["cuda", "conv2d_no_batching", [1, 7, 7, 512, 512, 3, 3, [1, 1], [1, 1]], {}, ["conv2d_no_batching", 1, 7, 7, 512, 512, 3, 3, [1, 1], [1, 1]], {"i": 5848940, "t": "", "c": null, "e": [["tile_f", "sp", [64, 2, 4, 1]], ["tile_y", "sp", [1, 1, 7, 1]], ["tile_x", "sp", [1, 1, 7, 1]], ["tile_rc", "sp", [128, 2, 2]], ["tile_ry", "sp", [3, 1, 1]], ["tile_rx", "sp", [1, 3, 1]], ["auto_unroll_max_step", "ot", 0], ["unroll_explicit", "ot", 1]]}], "r": [[0.0003078901675257732], 0, 1.2372350692749023, 1544147321.2230802], "v": 0.1}
{"i": ["cuda", "conv2d_no_batching", [1, 7, 7, 512, 512, 3, 3, [1, 1], [1, 1]], {}, ["conv2d_no_batching", 1, 7, 7, 512, 512, 3, 3, [1, 1], [1, 1]], {"i": 7619500, "t": "", "c": null, "e": [["tile_f", "sp", [64, 2, 4, 1]], ["tile_y", "sp", [1, 1, 7, 1]], ["tile_x", "sp", [1, 1, 7, 1]], ["tile_rc", "sp", [128, 1, 4]], ["tile_ry", "sp", [3, 1, 1]], ["tile_rx", "sp", [1, 3, 1]], ["auto_unroll_max_step", "ot", 512], ["unroll_explicit", "ot", 1]]}], "r": [[0.00028622522164948455], 0, 1.3205616474151611, 1544147322.2858434], "v": 0.1}
{"i": ["cuda", "conv2d_no_batching", [1, 7, 7, 512, 512, 3, 3, [1, 1], [1, 1]], {}, ["conv2d_no_batching", 1, 7, 7, 512, 512, 3, 3, [1, 1], [1, 1]], {"i": 2392300, "t": "", "c": null, "e": [["tile_f", "sp", [64, 2, 4, 1]], ["tile_y", "sp", [1, 1, 7, 1]], ["tile_x", "sp", [1, 1, 7, 1]], ["tile_rc", "sp", [128, 1, 4]], ["tile_ry", "sp", [3, 1, 1]], ["tile_rx", "sp", [1, 3, 1]], ["auto_unroll_max_step", "ot", 512], ["unroll_explicit", "ot", 0]]}], "r": [[0.0003005664175257732], 0, 1.3255703449249268, 1544147323.3838217], "v": 0.1}
{"i": ["cuda", "conv2d_no_batching", [1, 7, 7, 512, 512, 3, 3, [1, 1], [1, 1]], {}, ["conv2d_no_batching", 1, 7, 7, 512, 512, 3, 3, [1, 1], [1, 1]], {"i": 5877100, "t": "", "c": null, "e": [["tile_f", "sp", [64, 2, 4, 1]], ["tile_y", "sp", [1, 1, 7, 1]], ["tile_x", "sp", [1, 1, 7, 1]], ["tile_rc", "sp", [128, 1, 4]], ["tile_ry", "sp", [3, 1, 1]], ["tile_rx", "sp", [1, 3, 1]], ["auto_unroll_max_step", "ot", 0], ["unroll_explicit", "ot", 1]]}], "r": [[0.00030859454639175257], 0, 1.3297255039215088, 1544147324.6070492], "v": 0.1}
{"i": ["cuda", "conv2d_no_batching", [1, 7, 7, 512, 512, 3, 3, [1, 1], [1, 1]], {}, ["conv2d_no_batching", 1, 7, 7, 512, 512, 3, 3, [1, 1], [1, 1]], {"i": 649900, "t": "", "c": null, "e": [["tile_f", "sp", [64, 2, 4, 1]], ["tile_y", "sp", [1, 1, 7, 1]], ["tile_x", "sp", [1, 1, 7, 1]], ["tile_rc", "sp", [128, 1, 4]], ["tile_ry", "sp", [3, 1, 1]], ["tile_rx", "sp", [1, 3, 1]], ["auto_unroll_max_step", "ot", 0], ["unroll_explicit", "ot", 0]]}], "r": [[0.0003083932603092783], 0, 1.2794442176818848, 1544147325.637058], "v": 0.1}
{"i": ["cuda", "conv2d_no_batching", [1, 7, 7, 512, 512, 3, 3, [1, 1], [1, 1]], {}, ["conv2d_no_batching", 1, 7, 7, 512, 512, 3, 3, [1, 1], [1, 1]], {"i": 2332467, "t": "", "c": null, "e": [["tile_f", "sp", [64, 1, 8, 1]], ["tile_y", "sp", [1, 1, 7, 1]], ["tile_x", "sp", [1, 1, 7, 1]], ["tile_rc", "sp", [128, 4, 1]], ["tile_ry", "sp", [3, 1, 1]], ["tile_rx", "sp", [1, 3, 1]], ["auto_unroll_max_step", "ot", 512], ["unroll_explicit", "ot", 0]]}], "r": [[0.0003330933041237113], 0, 1.3567471504211426, 1544147326.748656], "v": 0.1}
{"i": ["cuda", "conv2d_no_batching", [1, 7, 7, 512, 512, 3, 3, [1, 1], [1, 1]], {}, ["conv2d_no_batching", 1, 7, 7, 512, 512, 3, 3, [1, 1], [1, 1]], {"i": 2367660, "t": "", "c": null, "e": [["tile_f", "sp", [64, 2, 4, 1]], ["tile_y", "sp", [1, 1, 7, 1]], ["tile_x", "sp", [1, 1, 7, 1]], ["tile_rc", "sp", [64, 4, 2]], ["tile_ry", "sp", [3, 1, 1]], ["tile_rx", "sp", [1, 3, 1]], ["auto_unroll_max_step", "ot", 512], ["unroll_explicit", "ot", 0]]}], "r": [[0.0002402562103004292], 0, 1.3578472137451172, 1544147363.5106454], "v": 0.1}
{"i": ["cuda", "conv2d_no_batching", [1, 7, 7, 512, 512, 3, 3, [1, 1], [1, 1]], {}, ["conv2d_no_batching", 1, 7, 7, 512, 512, 3, 3, [1, 1], [1, 1]], {"i": 7594860, "t": "", "c": null, "e": [["tile_f", "sp", [64, 2, 4, 1]], ["tile_y", "sp", [1, 1, 7, 1]], ["tile_x", "sp", [1, 1, 7, 1]], ["tile_rc", "sp", [64, 4, 2]], ["tile_ry", "sp", [3, 1, 1]], ["tile_rx", "sp", [1, 3, 1]], ["auto_unroll_max_step", "ot", 512], ["unroll_explicit", "ot", 1]]}], "r": [[0.00024020467811158798], 0, 1.4332361221313477, 1544147364.5508664], "v": 0.1}
{"i": ["cuda", "conv2d_no_batching", [1, 7, 7, 512, 512, 3, 3, [1, 1], [1, 1]], {}, ["conv2d_no_batching", 1, 7, 7, 512, 512, 3, 3, [1, 1], [1, 1]], {"i": 625274, "t": "", "c": null, "e": [["tile_f", "sp", [32, 1, 16, 1]], ["tile_y", "sp", [1, 1, 7, 1]], ["tile_x", "sp", [1, 1, 7, 1]], ["tile_rc", "sp", [64, 4, 2]], ["tile_ry", "sp", [3, 1, 1]], ["tile_rx", "sp", [1, 3, 1]], ["auto_unroll_max_step", "ot", 0], ["unroll_explicit", "ot", 0]]}], "r": [[0.0003656678144329897], 0, 1.369825839996338, 1544147329.9125223], "v": 0.1}
{"i": ["cuda", "conv2d_no_batching", [1, 7, 7, 512, 512, 3, 3, [1, 1], [1, 1]], {}, ["conv2d_no_batching", 1, 7, 7, 512, 512, 3, 3, [1, 1], [1, 1]], {"i": 5852474, "t": "", "c": null, "e": [["tile_f", "sp", [32, 1, 16, 1]], ["tile_y", "sp", [1, 1, 7, 1]], ["tile_x", "sp", [1, 1, 7, 1]], ["tile_rc", "sp", [64, 4, 2]], ["tile_ry", "sp", [3, 1, 1]], ["tile_rx", "sp", [1, 3, 1]], ["auto_unroll_max_step", "ot", 0], ["unroll_explicit", "ot", 1]]}], "r": [[0.0003655434639175258], 0, 1.3406927585601807, 1544147330.9996994], "v": 0.1}
{"i": ["cuda", "conv2d_no_batching", [1, 7, 7, 512, 512, 3, 3, [1, 1], [1, 1]], {}, ["conv2d_no_batching", 1, 7, 7, 512, 512, 3, 3, [1, 1], [1, 1]], {"i": 2367659, "t": "", "c": null, "e": [["tile_f", "sp", [128, 1, 4, 1]], ["tile_y", "sp", [1, 1, 7, 1]], ["tile_x", "sp", [1, 1, 7, 1]], ["tile_rc", "sp", [64, 4, 2]], ["tile_ry", "sp", [3, 1, 1]], ["tile_rx", "sp", [1, 3, 1]], ["auto_unroll_max_step", "ot", 512], ["unroll_explicit", "ot", 0]]}], "r": [[0.0002594693788659794], 0, 1.3522865772247314, 1544147332.0628548], "v": 0.1}
{"i": ["cuda", "conv2d_no_batching", [1, 7, 7, 512, 512, 3, 3, [1, 1], [1, 1]], {}, ["conv2d_no_batching", 1, 7, 7, 512, 512, 3, 3, [1, 1], [1, 1]], {"i": 7594859, "t": "", "c": null, "e": [["tile_f", "sp", [128, 1, 4, 1]], ["tile_y", "sp", [1, 1, 7, 1]], ["tile_x", "sp", [1, 1, 7, 1]], ["tile_rc", "sp", [64, 4, 2]], ["tile_ry", "sp", [3, 1, 1]], ["tile_rx", "sp", [1, 3, 1]], ["auto_unroll_max_step", "ot", 512], ["unroll_explicit", "ot", 1]]}], "r": [[0.0002266852381974249], 0, 1.3311262130737305, 1544147365.5495358], "v": 0.1}
{"i": ["cuda", "conv2d_no_batching", [1, 7, 7, 512, 512, 3, 3, [1, 1], [1, 1]], {}, ["conv2d_no_batching", 1, 7, 7, 512, 512, 3, 3, [1, 1], [1, 1]], {"i": 2395820, "t": "", "c": null, "e": [["tile_f", "sp", [64, 2, 4, 1]], ["tile_y", "sp", [1, 1, 7, 1]], ["tile_x", "sp", [1, 1, 7, 1]], ["tile_rc", "sp", [64, 2, 4]], ["tile_ry", "sp", [3, 1, 1]], ["tile_rx", "sp", [1, 3, 1]], ["auto_unroll_max_step", "ot", 512], ["unroll_explicit", "ot", 0]]}], "r": [[0.00024214957081545064], 0, 1.394742488861084, 1544147366.5948336], "v": 0.1}
{"i": ["cuda", "conv2d_no_batching", [1, 7, 7, 512, 512, 3, 3, [1, 1], [1, 1]], {}, ["conv2d_no_batching", 1, 7, 7, 512, 512, 3, 3, [1, 1], [1, 1]], {"i": 7623020, "t": "", "c": null, "e": [["tile_f", "sp", [64, 2, 4, 1]], ["tile_y", "sp", [1, 1, 7, 1]], ["tile_x", "sp", [1, 1, 7, 1]], ["tile_rc", "sp", [64, 2, 4]], ["tile_ry", "sp", [3, 1, 1]], ["tile_rx", "sp", [1, 3, 1]], ["auto_unroll_max_step", "ot", 512], ["unroll_explicit", "ot", 1]]}], "r": [[0.0002154013862660944], 0, 1.357600212097168, 1544147367.591478], "v": 0.1}
{"i": ["cuda", "conv2d_no_batching", [1, 7, 7, 512, 512, 3, 3, [1, 1], [1, 1]], {}, ["conv2d_no_batching", 1, 7, 7, 512, 512, 3, 3, [1, 1], [1, 1]], {"i": 2420460, "t": "", "c": null, "e": [["tile_f", "sp", [64, 2, 4, 1]], ["tile_y", "sp", [1, 1, 7, 1]], ["tile_x", "sp", [1, 1, 7, 1]], ["tile_rc", "sp", [64, 1, 8]], ["tile_ry", "sp", [3, 1, 1]], ["tile_rx", "sp", [1, 3, 1]], ["auto_unroll_max_step", "ot", 512], ["unroll_explicit", "ot", 0]]}], "r": [[0.00043030655412371136], 0, 1.5603420734405518, 1544147336.2957165], "v": 0.1}
{"i": ["cuda", "conv2d_no_batching", [1, 7, 7, 512, 512, 3, 3, [1, 1], [1, 1]], {}, ["conv2d_no_batching", 1, 7, 7, 512, 512, 3, 3, [1, 1], [1, 1]], {"i": 7647660, "t": "", "c": null, "e": [["tile_f", "sp", [64, 2, 4, 1]], ["tile_y", "sp", [1, 1, 7, 1]], ["tile_x", "sp", [1, 1, 7, 1]], ["tile_rc", "sp", [64, 1, 8]], ["tile_ry", "sp", [3, 1, 1]], ["tile_rx", "sp", [1, 3, 1]], ["auto_unroll_max_step", "ot", 512], ["unroll_explicit", "ot", 1]]}], "r": [[0.00021954581759656654], 0, 1.3105552196502686, 1544147368.5715694], "v": 0.1}
{"i": ["cuda", "conv2d_no_batching", [1, 7, 7, 512, 512, 3, 3, [1, 1], [1, 1]], {}, ["conv2d_no_batching", 1, 7, 7, 512, 512, 3, 3, [1, 1], [1, 1]], {"i": 625260, "t": "", "c": null, "e": [["tile_f", "sp", [64, 2, 4, 1]], ["tile_y", "sp", [1, 1, 7, 1]], ["tile_x", "sp", [1, 1, 7, 1]], ["tile_rc", "sp", [64, 4, 2]], ["tile_ry", "sp", [3, 1, 1]], ["tile_rx", "sp", [1, 3, 1]], ["auto_unroll_max_step", "ot", 0], ["unroll_explicit", "ot", 0]]}], "r": [[0.00023613098712446353], 0, 1.285393476486206, 1544147369.5706828], "v": 0.1}
{"i": ["cuda", "conv2d_no_batching", [1, 7, 7, 512, 512, 3, 3, [1, 1], [1, 1]], {}, ["conv2d_no_batching", 1, 7, 7, 512, 512, 3, 3, [1, 1], [1, 1]], {"i": 5852460, "t": "", "c": null, "e": [["tile_f", "sp", [64, 2, 4, 1]], ["tile_y", "sp", [1, 1, 7, 1]], ["tile_x", "sp", [1, 1, 7, 1]], ["tile_rc", "sp", [64, 4, 2]], ["tile_ry", "sp", [3, 1, 1]], ["tile_rx", "sp", [1, 3, 1]], ["auto_unroll_max_step", "ot", 0], ["unroll_explicit", "ot", 1]]}], "r": [[0.00023637798068669528], 0, 1.2296996116638184, 1544147370.573141], "v": 0.1}
{"i": ["cuda", "conv2d_no_batching", [1, 7, 7, 512, 512, 3, 3, [1, 1], [1, 1]], {}, ["conv2d_no_batching", 1, 7, 7, 512, 512, 3, 3, [1, 1], [1, 1]], {"i": 625259, "t": "", "c": null, "e": [["tile_f", "sp", [128, 1, 4, 1]], ["tile_y", "sp", [1, 1, 7, 1]], ["tile_x", "sp", [1, 1, 7, 1]], ["tile_rc", "sp", [64, 4, 2]], ["tile_ry", "sp", [3, 1, 1]], ["tile_rx", "sp", [1, 3, 1]], ["auto_unroll_max_step", "ot", 0], ["unroll_explicit", "ot", 0]]}], "r": [[0.000256507474248927], 0, 1.3260376453399658, 1544147371.5931964], "v": 0.1}
{"i": ["cuda", "conv2d_no_batching", [1, 7, 7, 512, 512, 3, 3, [1, 1], [1, 1]], {}, ["conv2d_no_batching", 1, 7, 7, 512, 512, 3, 3, [1, 1], [1, 1]], {"i": 5852459, "t": "", "c": null, "e": [["tile_f", "sp", [128, 1, 4, 1]], ["tile_y", "sp", [1, 1, 7, 1]], ["tile_x", "sp", [1, 1, 7, 1]], ["tile_rc", "sp", [64, 4, 2]], ["tile_ry", "sp", [3, 1, 1]], ["tile_rx", "sp", [1, 3, 1]], ["auto_unroll_max_step", "ot", 0], ["unroll_explicit", "ot", 1]]}], "r": [[0.00025667610300429184], 0, 1.2929134368896484, 1544147372.6135848], "v": 0.1}
{"i": ["cuda", "conv2d_no_batching", [1, 7, 7, 512, 512, 3, 3, [1, 1], [1, 1]], {}, ["conv2d_no_batching", 1, 7, 7, 512, 512, 3, 3, [1, 1], [1, 1]], {"i": 678060, "t": "", "c": null, "e": [["tile_f", "sp", [64, 2, 4, 1]], ["tile_y", "sp", [1, 1, 7, 1]], ["tile_x", "sp", [1, 1, 7, 1]], ["tile_rc", "sp", [64, 1, 8]], ["tile_ry", "sp", [3, 1, 1]], ["tile_rx", "sp", [1, 3, 1]], ["auto_unroll_max_step", "ot", 0], ["unroll_explicit", "ot", 0]]}], "r": [[0.0004327296417525773], 0, 1.5018889904022217, 1544147342.482773], "v": 0.1}
{"i": ["cuda", "conv2d_no_batching", [1, 7, 7, 512, 512, 3, 3, [1, 1], [1, 1]], {}, ["conv2d_no_batching", 1, 7, 7, 512, 512, 3, 3, [1, 1], [1, 1]], {"i": 5880620, "t": "", "c": null, "e": [["tile_f", "sp", [64, 2, 4, 1]], ["tile_y", "sp", [1, 1, 7, 1]], ["tile_x", "sp", [1, 1, 7, 1]], ["tile_rc", "sp", [64, 2, 4]], ["tile_ry", "sp", [3, 1, 1]], ["tile_rx", "sp", [1, 3, 1]], ["auto_unroll_max_step", "ot", 0], ["unroll_explicit", "ot", 1]]}], "r": [[0.00024064961587982832], 0, 1.2461340427398682, 1544147373.6296074], "v": 0.1}
{"i": ["cuda", "conv2d_no_batching", [1, 7, 7, 512, 512, 3, 3, [1, 1], [1, 1]], {}, ["conv2d_no_batching", 1, 7, 7, 512, 512, 3, 3, [1, 1], [1, 1]], {"i": 5905260, "t": "", "c": null, "e": [["tile_f", "sp", [64, 2, 4, 1]], ["tile_y", "sp", [1, 1, 7, 1]], ["tile_x", "sp", [1, 1, 7, 1]], ["tile_rc", "sp", [64, 1, 8]], ["tile_ry", "sp", [3, 1, 1]], ["tile_rx", "sp", [1, 3, 1]], ["auto_unroll_max_step", "ot", 0], ["unroll_explicit", "ot", 1]]}], "r": [[0.00043333783247422676], 0, 1.4480111598968506, 1544147344.6766894], "v": 0.1}
{"i": ["cuda", "conv2d_no_batching", [1, 7, 7, 512, 512, 3, 3, [1, 1], [1, 1]], {}, ["conv2d_no_batching", 1, 7, 7, 512, 512, 3, 3, [1, 1], [1, 1]], {"i": 653420, "t": "", "c": null, "e": [["tile_f", "sp", [64, 2, 4, 1]], ["tile_y", "sp", [1, 1, 7, 1]], ["tile_x", "sp", [1, 1, 7, 1]], ["tile_rc", "sp", [64, 2, 4]], ["tile_ry", "sp", [3, 1, 1]], ["tile_rx", "sp", [1, 3, 1]], ["auto_unroll_max_step", "ot", 0], ["unroll_explicit", "ot", 0]]}], "r": [[0.0002406870042918455], 0, 1.2917170524597168, 1544147374.6365607], "v": 0.1}
{"i": ["cuda", "conv2d_no_batching", [1, 7, 7, 512, 512, 3, 3, [1, 1], [1, 1]], {}, ["conv2d_no_batching", 1, 7, 7, 512, 512, 3, 3, [1, 1], [1, 1]], {"i": 5817267, "t": "", "c": null, "e": [["tile_f", "sp", [64, 1, 8, 1]], ["tile_y", "sp", [1, 1, 7, 1]], ["tile_x", "sp", [1, 1, 7, 1]], ["tile_rc", "sp", [128, 4, 1]], ["tile_ry", "sp", [3, 1, 1]], ["tile_rx", "sp", [1, 3, 1]], ["auto_unroll_max_step", "ot", 0], ["unroll_explicit", "ot", 1]]}], "r": [[0.00033374138402061856], 0, 1.345935583114624, 1544147346.705574], "v": 0.1}
{"i": ["cuda", "conv2d_no_batching", [1, 7, 7, 512, 512, 3, 3, [1, 1], [1, 1]], {}, ["conv2d_no_batching", 1, 7, 7, 512, 512, 3, 3, [1, 1], [1, 1]], {"i": 590067, "t": "", "c": null, "e": [["tile_f", "sp", [64, 1, 8, 1]], ["tile_y", "sp", [1, 1, 7, 1]], ["tile_x", "sp", [1, 1, 7, 1]], ["tile_rc", "sp", [128, 4, 1]], ["tile_ry", "sp", [3, 1, 1]], ["tile_rx", "sp", [1, 3, 1]], ["auto_unroll_max_step", "ot", 0], ["unroll_explicit", "ot", 0]]}], "r": [[0.00033364554639175257], 0, 1.286313772201538, 1544147347.7597427], "v": 0.1}
{"i": ["cuda", "conv2d_no_batching", [1, 7, 7, 512, 512, 3, 3, [1, 1], [1, 1]], {}, ["conv2d_no_batching", 1, 7, 7, 512, 512, 3, 3, [1, 1], [1, 1]], {"i": 2944940, "t": "", "c": null, "e": [["tile_f", "sp", [64, 2, 4, 1]], ["tile_y", "sp", [1, 1, 7, 1]], ["tile_x", "sp", [1, 1, 7, 1]], ["tile_rc", "sp", [128, 2, 2]], ["tile_ry", "sp", [3, 1, 1]], ["tile_rx", "sp", [1, 1, 3]], ["auto_unroll_max_step", "ot", 512], ["unroll_explicit", "ot", 0]]}], "r": [[0.0003014680128865979], 0, 1.3377878665924072, 1544147348.8491588], "v": 0.1}
{"i": ["cuda", "conv2d_no_batching", [1, 7, 7, 512, 512, 3, 3, [1, 1], [1, 1]], {}, ["conv2d_no_batching", 1, 7, 7, 512, 512, 3, 3, [1, 1], [1, 1]], {"i": 8172140, "t": "", "c": null, "e": [["tile_f", "sp", [64, 2, 4, 1]], ["tile_y", "sp", [1, 1, 7, 1]], ["tile_x", "sp", [1, 1, 7, 1]], ["tile_rc", "sp", [128, 2, 2]], ["tile_ry", "sp", [3, 1, 1]], ["tile_rx", "sp", [1, 1, 3]], ["auto_unroll_max_step", "ot", 512], ["unroll_explicit", "ot", 1]]}], "r": [[0.00033293336597938145], 0, 1.3507647514343262, 1544147349.9147403], "v": 0.1}
{"i": ["cuda", "conv2d_no_batching", [1, 7, 7, 512, 512, 3, 3, [1, 1], [1, 1]], {}, ["conv2d_no_batching", 1, 7, 7, 512, 512, 3, 3, [1, 1], [1, 1]], {"i": 2367668, "t": "", "c": null, "e": [["tile_f", "sp", [32, 2, 8, 1]], ["tile_y", "sp", [1, 1, 7, 1]], ["tile_x", "sp", [1, 1, 7, 1]], ["tile_rc", "sp", [64, 4, 2]], ["tile_ry", "sp", [3, 1, 1]], ["tile_rx", "sp", [1, 3, 1]], ["auto_unroll_max_step", "ot", 512], ["unroll_explicit", "ot", 0]]}], "r": [[0.00028004347164948455], 0, 1.3637974262237549, 1544147351.00218], "v": 0.1}
{"i": ["cuda", "conv2d_no_batching", [1, 7, 7, 512, 512, 3, 3, [1, 1], [1, 1]], {}, ["conv2d_no_batching", 1, 7, 7, 512, 512, 3, 3, [1, 1], [1, 1]], {"i": 7594868, "t": "", "c": null, "e": [["tile_f", "sp", [32, 2, 8, 1]], ["tile_y", "sp", [1, 1, 7, 1]], ["tile_x", "sp", [1, 1, 7, 1]], ["tile_rc", "sp", [64, 4, 2]], ["tile_ry", "sp", [3, 1, 1]], ["tile_rx", "sp", [1, 3, 1]], ["auto_unroll_max_step", "ot", 512], ["unroll_explicit", "ot", 1]]}], "r": [[0.000267456], 0, 1.3820254802703857, 1544147352.0782936], "v": 0.1}
{"i": ["cuda", "conv2d_no_batching", [1, 7, 7, 512, 512, 3, 3, [1, 1], [1, 1]], {}, ["conv2d_no_batching", 1, 7, 7, 512, 512, 3, 3, [1, 1], [1, 1]], {"i": 6429740, "t": "", "c": null, "e": [["tile_f", "sp", [64, 2, 4, 1]], ["tile_y", "sp", [1, 1, 7, 1]], ["tile_x", "sp", [1, 1, 7, 1]], ["tile_rc", "sp", [128, 2, 2]], ["tile_ry", "sp", [3, 1, 1]], ["tile_rx", "sp", [1, 1, 3]], ["auto_unroll_max_step", "ot", 0], ["unroll_explicit", "ot", 1]]}], "r": [[0.0003322204329896907], 0, 1.3373785018920898, 1544147353.2007964], "v": 0.1}
{"i": ["cuda", "conv2d_no_batching", [1, 7, 7, 512, 512, 3, 3, [1, 1], [1, 1]], {}, ["conv2d_no_batching", 1, 7, 7, 512, 512, 3, 3, [1, 1], [1, 1]], {"i": 1202540, "t": "", "c": null, "e": [["tile_f", "sp", [64, 2, 4, 1]], ["tile_y", "sp", [1, 1, 7, 1]], ["tile_x", "sp", [1, 1, 7, 1]], ["tile_rc", "sp", [128, 2, 2]], ["tile_ry", "sp", [3, 1, 1]], ["tile_rx", "sp", [1, 1, 3]], ["auto_unroll_max_step", "ot", 0], ["unroll_explicit", "ot", 0]]}], "r": [[0.0003321629510309278], 0, 1.289825677871704, 1544147354.255541], "v": 0.1}
{"i": ["cuda", "conv2d_no_batching", [1, 7, 7, 512, 512, 3, 3, [1, 1], [1, 1]], {}, ["conv2d_no_batching", 1, 7, 7, 512, 512, 3, 3, [1, 1], [1, 1]], {"i": 8200300, "t": "", "c": null, "e": [["tile_f", "sp", [64, 2, 4, 1]], ["tile_y", "sp", [1, 1, 7, 1]], ["tile_x", "sp", [1, 1, 7, 1]], ["tile_rc", "sp", [128, 1, 4]], ["tile_ry", "sp", [3, 1, 1]], ["tile_rx", "sp", [1, 1, 3]], ["auto_unroll_max_step", "ot", 512], ["unroll_explicit", "ot", 1]]}], "r": [[0.00033299328350515464], 0, 1.3212084770202637, 1544147355.2984302], "v": 0.1}
{"i": ["cuda", "conv2d_no_batching", [1, 7, 7, 512, 512, 3, 3, [1, 1], [1, 1]], {}, ["conv2d_no_batching", 1, 7, 7, 512, 512, 3, 3, [1, 1], [1, 1]], {"i": 2973100, "t": "", "c": null, "e": [["tile_f", "sp", [64, 2, 4, 1]], ["tile_y", "sp", [1, 1, 7, 1]], ["tile_x", "sp", [1, 1, 7, 1]], ["tile_rc", "sp", [128, 1, 4]], ["tile_ry", "sp", [3, 1, 1]], ["tile_rx", "sp", [1, 1, 3]], ["auto_unroll_max_step", "ot", 512], ["unroll_explicit", "ot", 0]]}], "r": [[0.0003015198144329897], 0, 1.310060977935791, 1544147356.3727963], "v": 0.1}
{"i": ["cuda", "conv2d_no_batching", [1, 7, 7, 512, 512, 3, 3, [1, 1], [1, 1]], {}, ["conv2d_no_batching", 1, 7, 7, 512, 512, 3, 3, [1, 1], [1, 1]], {"i": 7593994, "t": "", "c": null, "e": [["tile_f", "sp", [32, 1, 16, 1]], ["tile_y", "sp", [1, 1, 7, 1]], ["tile_x", "sp", [1, 7, 1, 1]], ["tile_rc", "sp", [64, 4, 2]], ["tile_ry", "sp", [3, 1, 1]], ["tile_rx", "sp", [1, 3, 1]], ["auto_unroll_max_step", "ot", 512], ["unroll_explicit", "ot", 1]]}], "r": [[0.0003601655257731959], 0, 1.6027555465698242, 1544147357.616022], "v": 0.1}
{"i": ["cuda", "conv2d_no_batching", [1, 7, 7, 512, 512, 3, 3, [1, 1], [1, 1]], {}, ["conv2d_no_batching", 1, 7, 7, 512, 512, 3, 3, [1, 1], [1, 1]], {"i": 2366794, "t": "", "c": null, "e": [["tile_f", "sp", [32, 1, 16, 1]], ["tile_y", "sp", [1, 1, 7, 1]], ["tile_x", "sp", [1, 7, 1, 1]], ["tile_rc", "sp", [64, 4, 2]], ["tile_ry", "sp", [3, 1, 1]], ["tile_rx", "sp", [1, 3, 1]], ["auto_unroll_max_step", "ot", 512], ["unroll_explicit", "ot", 0]]}], "r": [[0.0003474815798969072], 0, 1.5223305225372314, 1544147358.860884], "v": 0.1}
{"i": ["cuda", "conv2d_no_batching", [1, 7, 7, 512, 512, 3, 3, [1, 1], [1, 1]], {}, ["conv2d_no_batching", 1, 7, 7, 512, 512, 3, 3, [1, 1], [1, 1]], {"i": 2365907, "t": "", "c": null, "e": [["tile_f", "sp", [64, 1, 8, 1]], ["tile_y", "sp", [1, 1, 7, 1]], ["tile_x", "sp", [7, 1, 1, 1]], ["tile_rc", "sp", [64, 4, 2]], ["tile_ry", "sp", [3, 1, 1]], ["tile_rx", "sp", [1, 3, 1]], ["auto_unroll_max_step", "ot", 512], ["unroll_explicit", "ot", 0]]}], "r": [[0.00025806984278350513], 0, 1.2846739292144775, 1544147359.9276698], "v": 0.1}
{"i": ["cuda", "conv2d_no_batching", [1, 7, 7, 512, 512, 3, 3, [1, 1], [1, 1]], {}, ["conv2d_no_batching", 1, 7, 7, 512, 512, 3, 3, [1, 1], [1, 1]], {"i": 7595747, "t": "", "c": null, "e": [["tile_f", "sp", [64, 1, 8, 1]], ["tile_y", "sp", [1, 1, 7, 1]], ["tile_x", "sp", [1, 1, 1, 7]], ["tile_rc", "sp", [64, 4, 2]], ["tile_ry", "sp", [3, 1, 1]], ["tile_rx", "sp", [1, 3, 1]], ["auto_unroll_max_step", "ot", 512], ["unroll_explicit", "ot", 1]]}], "r": [[0.0004026715927835051], 0, 1.6302194595336914, 1544147361.2594657], "v": 0.1}
{"i": ["cuda", "conv2d_no_batching", [1, 7, 7, 512, 512, 3, 3, [1, 1], [1, 1]], {}, ["conv2d_no_batching", 1, 7, 7, 512, 512, 3, 3, [1, 1], [1, 1]], {"i": 7593987, "t": "", "c": null, "e": [["tile_f", "sp", [64, 1, 8, 1]], ["tile_y", "sp", [1, 1, 7, 1]], ["tile_x", "sp", [1, 7, 1, 1]], ["tile_rc", "sp", [64, 4, 2]], ["tile_ry", "sp", [3, 1, 1]], ["tile_rx", "sp", [1, 3, 1]], ["auto_unroll_max_step", "ot", 512], ["unroll_explicit", "ot", 1]]}], "r": [[0.000402668631443299], 0, 1.4902801513671875, 1544147362.4507987], "v": 0.1}
{"i": ["cuda", "conv2d_no_batching", [1, 7, 7, 512, 512, 3, 3, [1, 1], [1, 1]], {}, ["conv2d_no_batching", 1, 7, 7, 512, 512, 3, 3, [1, 1], [1, 1]], {"i": 7014060, "t": "", "c": null, "e": [["tile_f", "sp", [64, 2, 4, 1]], ["tile_y", "sp", [1, 1, 7, 1]], ["tile_x", "sp", [1, 1, 7, 1]], ["tile_rc", "sp", [64, 4, 2]], ["tile_ry", "sp", [3, 1, 1]], ["tile_rx", "sp", [3, 1, 1]], ["auto_unroll_max_step", "ot", 512], ["unroll_explicit", "ot", 1]]}], "r": [[0.0002567626845493562], 0, 1.383301019668579, 1544147381.2112806], "v": 0.1}
{"i": ["cuda", "conv2d_no_batching", [1, 7, 7, 512, 512, 3, 3, [1, 1], [1, 1]], {}, ["conv2d_no_batching", 1, 7, 7, 512, 512, 3, 3, [1, 1], [1, 1]], {"i": 7594841, "t": "", "c": null, "e": [["tile_f", "sp", [256, 2, 1, 1]], ["tile_y", "sp", [1, 1, 7, 1]], ["tile_x", "sp", [1, 1, 7, 1]], ["tile_rc", "sp", [64, 4, 2]], ["tile_ry", "sp", [3, 1, 1]], ["tile_rx", "sp", [1, 3, 1]], ["auto_unroll_max_step", "ot", 512], ["unroll_explicit", "ot", 1]]}], "r": [[0.00025779948068669527], 0, 1.636244297027588, 1544147382.3931582], "v": 0.1}
{"i": ["cuda", "conv2d_no_batching", [1, 7, 7, 512, 512, 3, 3, [1, 1], [1, 1]], {}, ["conv2d_no_batching", 1, 7, 7, 512, 512, 3, 3, [1, 1], [1, 1]], {"i": 7594851, "t": "", "c": null, "e": [["tile_f", "sp", [128, 2, 2, 1]], ["tile_y", "sp", [1, 1, 7, 1]], ["tile_x", "sp", [1, 1, 7, 1]], ["tile_rc", "sp", [64, 4, 2]], ["tile_ry", "sp", [3, 1, 1]], ["tile_rx", "sp", [1, 3, 1]], ["auto_unroll_max_step", "ot", 512], ["unroll_explicit", "ot", 1]]}], "r": [[0.00018426145488029466], 0, 1.4152185916900635, 1544147442.0203524], "v": 0.1}
{"i": ["cuda", "conv2d_no_batching", [1, 7, 7, 512, 512, 3, 3, [1, 1], [1, 1]], {}, ["conv2d_no_batching", 1, 7, 7, 512, 512, 3, 3, [1, 1], [1, 1]], {"i": 7594842, "t": "", "c": null, "e": [["tile_f", "sp", [128, 4, 1, 1]], ["tile_y", "sp", [1, 1, 7, 1]], ["tile_x", "sp", [1, 1, 7, 1]], ["tile_rc", "sp", [64, 4, 2]], ["tile_ry", "sp", [3, 1, 1]], ["tile_rx", "sp", [1, 3, 1]], ["auto_unroll_max_step", "ot", 512], ["unroll_explicit", "ot", 1]]}], "r": [[0.00036482061373390557], 0, 1.7235231399536133, 1544147384.8025913], "v": 0.1}
{"i": ["cuda", "conv2d_no_batching", [1, 7, 7, 512, 512, 3, 3, [1, 1], [1, 1]], {}, ["conv2d_no_batching", 1, 7, 7, 512, 512, 3, 3, [1, 1], [1, 1]], {"i": 7594852, "t": "", "c": null, "e": [["tile_f", "sp", [64, 4, 2, 1]], ["tile_y", "sp", [1, 1, 7, 1]], ["tile_x", "sp", [1, 1, 7, 1]], ["tile_rc", "sp", [64, 4, 2]], ["tile_ry", "sp", [3, 1, 1]], ["tile_rx", "sp", [1, 3, 1]], ["auto_unroll_max_step", "ot", 512], ["unroll_explicit", "ot", 1]]}], "r": [[0.00027885960085836914], 0, 1.5532431602478027, 1544147385.9957979], "v": 0.1}
{"i": ["cuda", "conv2d_no_batching", [1, 7, 7, 512, 512, 3, 3, [1, 1], [1, 1]], {}, ["conv2d_no_batching", 1, 7, 7, 512, 512, 3, 3, [1, 1], [1, 1]], {"i": 7623011, "t": "", "c": null, "e": [["tile_f", "sp", [128, 2, 2, 1]], ["tile_y", "sp", [1, 1, 7, 1]], ["tile_x", "sp", [1, 1, 7, 1]], ["tile_rc", "sp", [64, 2, 4]], ["tile_ry", "sp", [3, 1, 1]], ["tile_rx", "sp", [1, 3, 1]], ["auto_unroll_max_step", "ot", 512], ["unroll_explicit", "ot", 1]]}], "r": [[0.00018742541252302026], 0, 1.4463763236999512, 1544147443.0365932], "v": 0.1}
{"i": ["cuda", "conv2d_no_batching", [1, 7, 7, 512, 512, 3, 3, [1, 1], [1, 1]], {}, ["conv2d_no_batching", 1, 7, 7, 512, 512, 3, 3, [1, 1], [1, 1]], {"i": 7623001, "t": "", "c": null, "e": [["tile_f", "sp", [256, 2, 1, 1]], ["tile_y", "sp", [1, 1, 7, 1]], ["tile_x", "sp", [1, 1, 7, 1]], ["tile_rc", "sp", [64, 2, 4]], ["tile_ry", "sp", [3, 1, 1]], ["tile_rx", "sp", [1, 3, 1]], ["auto_unroll_max_step", "ot", 512], ["unroll_explicit", "ot", 1]]}], "r": [[0.0004080361974248927], 0, 1.9521863460540771, 1544147388.467181], "v": 0.1}
{"i": ["cuda", "conv2d_no_batching", [1, 7, 7, 512, 512, 3, 3, [1, 1], [1, 1]], {}, ["conv2d_no_batching", 1, 7, 7, 512, 512, 3, 3, [1, 1], [1, 1]], {"i": 7623002, "t": "", "c": null, "e": [["tile_f", "sp", [128, 4, 1, 1]], ["tile_y", "sp", [1, 1, 7, 1]], ["tile_x", "sp", [1, 1, 7, 1]], ["tile_rc", "sp", [64, 2, 4]], ["tile_ry", "sp", [3, 1, 1]], ["tile_rx", "sp", [1, 3, 1]], ["auto_unroll_max_step", "ot", 512], ["unroll_explicit", "ot", 1]]}], "r": [[0.0003753882875536481], 0, 1.6669690608978271, 1544147389.8020573], "v": 0.1}
