baseline/conv2d_c12_itervar_n2000_1.log
{"i": ["cuda", "conv2d_no_batching", [1, 7, 7, 512, 512, 3, 3, [1, 1], [1, 1]], {}, ["conv2d_no_batching", 1, 7, 7, 512, 512, 3, 3, [1, 1], [1, 1]], {"i": 821486, "t": "", "c": null, "e": [["tile_f", "sp", [8, 64, 1, 1]], ["tile_y", "sp", [1, 1, 7, 1]], ["tile_x", "sp", [1, 7, 1, 1]], ["tile_rc", "sp", [32, 8, 2]], ["tile_ry", "sp", [1, 3, 1]], ["tile_rx", "sp", [1, 3, 1]], ["auto_unroll_max_step", "ot", 0], ["unroll_explicit", "ot", 0]]}], "r": [[0.039643237], 0, 4.235278606414795, 1544119122.3335931], "v": 0.1}
{"i": ["cuda", "conv2d_no_batching", [1, 7, 7, 512, 512, 3, 3, [1, 1], [1, 1]], {}, ["conv2d_no_batching", 1, 7, 7, 512, 512, 3, 3, [1, 1], [1, 1]], {"i": 4548751, "t": "", "c": null, "e": [["tile_f", "sp", [4, 16, 8, 1]], ["tile_y", "sp", [7, 1, 1, 1]], ["tile_x", "sp", [1, 7, 1, 1]], ["tile_rc", "sp", [64, 1, 8]], ["tile_ry", "sp", [1, 1, 3]], ["tile_rx", "sp", [1, 3, 1]], ["auto_unroll_max_step", "ot", 1500], ["unroll_explicit", "ot", 0]]}], "r": [[0.0019522198666666664], 0, 5.39045262336731, 1544119157.82024], "v": 0.1}
{"i": ["cuda", "conv2d_no_batching", [1, 7, 7, 512, 512, 3, 3, [1, 1], [1, 1]], {}, ["conv2d_no_batching", 1, 7, 7, 512, 512, 3, 3, [1, 1], [1, 1]], {"i": 1974212, "t": "", "c": null, "e": [["tile_f", "sp", [2, 8, 4, 8]], ["tile_y", "sp", [1, 7, 1, 1]], ["tile_x", "sp", [1, 1, 1, 7]], ["tile_rc", "sp", [256, 1, 2]], ["tile_ry", "sp", [1, 3, 1]], ["tile_rx", "sp", [3, 1, 1]], ["auto_unroll_max_step", "ot", 512], ["unroll_explicit", "ot", 0]]}], "r": [[0.16262795625], 0, 7.23297381401062, 1544119131.6687183], "v": 0.1}
{"i": ["cuda", "conv2d_no_batching", [1, 7, 7, 512, 512, 3, 3, [1, 1], [1, 1]], {}, ["conv2d_no_batching", 1, 7, 7, 512, 512, 3, 3, [1, 1], [1, 1]], {"i": 9108749, "t": "", "c": null, "e": [["tile_f", "sp", [1, 16, 16, 2]], ["tile_y", "sp", [1, 1, 1, 7]], ["tile_x", "sp", [1, 1, 7, 1]], ["tile_rc", "sp", [128, 4, 1]], ["tile_ry", "sp", [1, 1, 3]], ["tile_rx", "sp", [3, 1, 1]], ["auto_unroll_max_step", "ot", 1500], ["unroll_explicit", "ot", 1]]}], "r": [[0.004141989854545455], 0, 4.306567907333374, 1544119160.8631737], "v": 0.1}
{"i": ["cuda", "conv2d_no_batching", [1, 7, 7, 512, 512, 3, 3, [1, 1], [1, 1]], {}, ["conv2d_no_batching", 1, 7, 7, 512, 512, 3, 3, [1, 1], [1, 1]], {"i": 9688477, "t": "", "c": null, "e": [["tile_f", "sp", [8, 4, 4, 4]], ["tile_y", "sp", [1, 1, 7, 1]], ["tile_x", "sp", [1, 7, 1, 1]], ["tile_rc", "sp", [128, 4, 1]], ["tile_ry", "sp", [1, 1, 3]], ["tile_rx", "sp", [1, 3, 1]], ["auto_unroll_max_step", "ot", 1500], ["unroll_explicit", "ot", 1]]}], "r": [[0.002716286496969697], 0, 4.458314657211304, 1544119163.330372], "v": 0.1}
{"i": ["cuda", "conv2d_no_batching", [1, 7, 7, 512, 512, 3, 3, [1, 1], [1, 1]], {}, ["conv2d_no_batching", 1, 7, 7, 512, 512, 3, 3, [1, 1], [1, 1]], {"i": 10068273, "t": "", "c": null, "e": [["tile_f", "sp", [1, 8, 2, 32]], ["tile_y", "sp", [7, 1, 1, 1]], ["tile_x", "sp", [1, 7, 1, 1]], ["tile_rc", "sp", [512, 1, 1]], ["tile_ry", "sp", [1, 3, 1]], ["tile_rx", "sp", [1, 1, 3]], ["auto_unroll_max_step", "ot", 1500], ["unroll_explicit", "ot", 1]]}], "r": [[0.28985057225], 0, 7.091564416885376, 1544119140.9380987], "v": 0.1}
{"i": ["cuda", "conv2d_no_batching", [1, 7, 7, 512, 512, 3, 3, [1, 1], [1, 1]], {}, ["conv2d_no_batching", 1, 7, 7, 512, 512, 3, 3, [1, 1], [1, 1]], {"i": 6702755, "t": "", "c": null, "e": [["tile_f", "sp", [8, 32, 2, 1]], ["tile_y", "sp", [1, 1, 1, 7]], ["tile_x", "sp", [7, 1, 1, 1]], ["tile_rc", "sp", [32, 1, 16]], ["tile_ry", "sp", [1, 3, 1]], ["tile_rx", "sp", [1, 1, 3]], ["auto_unroll_max_step", "ot", 0], ["unroll_explicit", "ot", 1]]}], "r": [[0.06983218425], 0, 2.580805778503418, 1544119143.9665902], "v": 0.1}
{"i": ["cuda", "conv2d_no_batching", [1, 7, 7, 512, 512, 3, 3, [1, 1], [1, 1]], {}, ["conv2d_no_batching", 1, 7, 7, 512, 512, 3, 3, [1, 1], [1, 1]], {"i": 7099220, "t": "", "c": null, "e": [["tile_f", "sp", [16, 1, 32, 1]], ["tile_y", "sp", [1, 7, 1, 1]], ["tile_x", "sp", [1, 1, 1, 7]], ["tile_rc", "sp", [8, 4, 16]], ["tile_ry", "sp", [3, 1, 1]], ["tile_rx", "sp", [3, 1, 1]], ["auto_unroll_max_step", "ot", 512], ["unroll_explicit", "ot", 1]]}], "r": [[0.007034275157575758], 0, 5.0192742347717285, 1544119167.687457], "v": 0.1}
{"i": ["cuda", "conv2d_no_batching", [1, 7, 7, 512, 512, 3, 3, [1, 1], [1, 1]], {}, ["conv2d_no_batching", 1, 7, 7, 512, 512, 3, 3, [1, 1], [1, 1]], {"i": 3888294, "t": "", "c": null, "e": [["tile_f", "sp", [16, 16, 2, 1]], ["tile_y", "sp", [1, 1, 7, 1]], ["tile_x", "sp", [1, 1, 7, 1]], ["tile_rc", "sp", [32, 16, 1]], ["tile_ry", "sp", [1, 1, 3]], ["tile_rx", "sp", [3, 1, 1]], ["auto_unroll_max_step", "ot", 1500], ["unroll_explicit", "ot", 0]]}], "r": [[0.0006162735515151514], 0, 1.8277122974395752, 1544119168.8790095], "v": 0.1}
{"i": ["cuda", "conv2d_no_batching", [1, 7, 7, 512, 512, 3, 3, [1, 1], [1, 1]], {}, ["conv2d_no_batching", 1, 7, 7, 512, 512, 3, 3, [1, 1], [1, 1]], {"i": 1361332, "t": "", "c": null, "e": [["tile_f", "sp", [2, 4, 2, 32]], ["tile_y", "sp", [1, 1, 1, 7]], ["tile_x", "sp", [1, 1, 7, 1]], ["tile_rc", "sp", [256, 2, 1]], ["tile_ry", "sp", [1, 3, 1]], ["tile_rx", "sp", [1, 1, 3]], ["auto_unroll_max_step", "ot", 0], ["unroll_explicit", "ot", 0]]}], "r": [[0.16459376425], 0, 3.5668418407440186, 1544119151.0291605], "v": 0.1}
{"i": ["cuda", "conv2d_no_batching", [1, 7, 7, 512, 512, 3, 3, [1, 1], [1, 1]], {}, ["conv2d_no_batching", 1, 7, 7, 512, 512, 3, 3, [1, 1], [1, 1]], {"i": 3798925, "t": "", "c": null, "e": [["tile_f", "sp", [16, 1, 1, 32]], ["tile_y", "sp", [1, 1, 1, 7]], ["tile_x", "sp", [7, 1, 1, 1]], ["tile_rc", "sp", [32, 1, 16]], ["tile_ry", "sp", [1, 3, 1]], ["tile_rx", "sp", [3, 1, 1]], ["auto_unroll_max_step", "ot", 1500], ["unroll_explicit", "ot", 0]]}], "r": [[0.03157447325], 0, 4.078948020935059, 1544119152.8551512], "v": 0.1}
{"i": ["cuda", "conv2d_no_batching", [1, 7, 7, 512, 512, 3, 3, [1, 1], [1, 1]], {}, ["conv2d_no_batching", 1, 7, 7, 512, 512, 3, 3, [1, 1], [1, 1]], {"i": 7813217, "t": "", "c": null, "e": [["tile_f", "sp", [32, 2, 1, 8]], ["tile_y", "sp", [1, 1, 7, 1]], ["tile_x", "sp", [1, 1, 7, 1]], ["tile_rc", "sp", [128, 1, 4]], ["tile_ry", "sp", [1, 3, 1]], ["tile_rx", "sp", [1, 3, 1]], ["auto_unroll_max_step", "ot", 512], ["unroll_explicit", "ot", 1]]}], "r": [[0.0008910023333333333], 0, 1.9366865158081055, 1544119170.2060304], "v": 0.1}
{"i": ["cuda", "conv2d_no_batching", [1, 7, 7, 512, 512, 3, 3, [1, 1], [1, 1]], {}, ["conv2d_no_batching", 1, 7, 7, 512, 512, 3, 3, [1, 1], [1, 1]], {"i": 80301, "t": "", "c": null, "e": [["tile_f", "sp", [256, 2, 1, 1]], ["tile_y", "sp", [1, 7, 1, 1]], ["tile_x", "sp", [1, 1, 1, 7]], ["tile_rc", "sp", [16, 8, 4]], ["tile_ry", "sp", [3, 1, 1]], ["tile_rx", "sp", [3, 1, 1]], ["auto_unroll_max_step", "ot", 0], ["unroll_explicit", "ot", 0]]}], "r": [[0.04498930324848485], 0, 23.848613739013672, 1544119200.7675424], "v": 0.1}
{"i": ["cuda", "conv2d_no_batching", [1, 7, 7, 512, 512, 3, 3, [1, 1], [1, 1]], {}, ["conv2d_no_batching", 1, 7, 7, 512, 512, 3, 3, [1, 1], [1, 1]], {"i": 4656650, "t": "", "c": null, "e": [["tile_f", "sp", [4, 1, 32, 4]], ["tile_y", "sp", [1, 1, 7, 1]], ["tile_x", "sp", [1, 1, 1, 7]], ["tile_rc", "sp", [128, 4, 1]], ["tile_ry", "sp", [3, 1, 1]], ["tile_rx", "sp", [1, 1, 3]], ["auto_unroll_max_step", "ot", 1500], ["unroll_explicit", "ot", 0]]}], "r": [[0.0006671517333333333], 0, 1.8415517807006836, 1544119235.223061], "v": 0.1}
{"i": ["cuda", "conv2d_no_batching", [1, 7, 7, 512, 512, 3, 3, [1, 1], [1, 1]], {}, ["conv2d_no_batching", 1, 7, 7, 512, 512, 3, 3, [1, 1], [1, 1]], {"i": 10068603, "t": "", "c": null, "e": [["tile_f", "sp", [2, 16, 8, 2]], ["tile_y", "sp", [1, 1, 7, 1]], ["tile_x", "sp", [1, 7, 1, 1]], ["tile_rc", "sp", [512, 1, 1]], ["tile_ry", "sp", [1, 3, 1]], ["tile_rx", "sp", [1, 1, 3]], ["auto_unroll_max_step", "ot", 1500], ["unroll_explicit", "ot", 1]]}], "r": [[0.004442490654545455], 0, 4.423534393310547, 1544119271.4530373], "v": 0.1}
{"i": ["cuda", "conv2d_no_batching", [1, 7, 7, 512, 512, 3, 3, [1, 1], [1, 1]], {}, ["conv2d_no_batching", 1, 7, 7, 512, 512, 3, 3, [1, 1], [1, 1]], {"i": 6619232, "t": "", "c": null, "e": [["tile_f", "sp", [2, 4, 32, 2]], ["tile_y", "sp", [1, 1, 1, 7]], ["tile_x", "sp", [1, 7, 1, 1]], ["tile_rc", "sp", [256, 1, 2]], ["tile_ry", "sp", [1, 3, 1]], ["tile_rx", "sp", [1, 1, 3]], ["auto_unroll_max_step", "ot", 0], ["unroll_explicit", "ot", 1]]}], "r": [[0.01650310227878788], 0, 10.454436302185059, 1544119281.4383793], "v": 0.1}
{"i": ["cuda", "conv2d_no_batching", [1, 7, 7, 512, 512, 3, 3, [1, 1], [1, 1]], {}, ["conv2d_no_batching", 1, 7, 7, 512, 512, 3, 3, [1, 1], [1, 1]], {"i": 2207080, "t": "", "c": null, "e": [["tile_f", "sp", [16, 1, 32, 1]], ["tile_y", "sp", [7, 1, 1, 1]], ["tile_x", "sp", [7, 1, 1, 1]], ["tile_rc", "sp", [16, 8, 4]], ["tile_ry", "sp", [1, 1, 3]], ["tile_rx", "sp", [3, 1, 1]], ["auto_unroll_max_step", "ot", 512], ["unroll_explicit", "ot", 0]]}], "r": [[0.001580288006060606], 0, 2.1153576374053955, 1544119317.6551538], "v": 0.1}
{"i": ["cuda", "conv2d_no_batching", [1, 7, 7, 512, 512, 3, 3, [1, 1], [1, 1]], {}, ["conv2d_no_batching", 1, 7, 7, 512, 512, 3, 3, [1, 1], [1, 1]], {"i": 2830605, "t": "", "c": null, "e": [["tile_f", "sp", [16, 1, 16, 2]], ["tile_y", "sp", [1, 1, 7, 1]], ["tile_x", "sp", [7, 1, 1, 1]], ["tile_rc", "sp", [32, 1, 16]], ["tile_ry", "sp", [1, 1, 3]], ["tile_rx", "sp", [1, 3, 1]], ["auto_unroll_max_step", "ot", 512], ["unroll_explicit", "ot", 0]]}], "r": [[0.0006735654848484849], 0, 1.7897851467132568, 1544119502.3637874], "v": 0.1}
{"i": ["cuda", "conv2d_no_batching", [1, 7, 7, 512, 512, 3, 3, [1, 1], [1, 1]], {}, ["conv2d_no_batching", 1, 7, 7, 512, 512, 3, 3, [1, 1], [1, 1]], {"i": 8057805, "t": "", "c": null, "e": [["tile_f", "sp", [16, 1, 16, 2]], ["tile_y", "sp", [1, 1, 7, 1]], ["tile_x", "sp", [7, 1, 1, 1]], ["tile_rc", "sp", [32, 1, 16]], ["tile_ry", "sp", [1, 1, 3]], ["tile_rx", "sp", [1, 3, 1]], ["auto_unroll_max_step", "ot", 512], ["unroll_explicit", "ot", 1]]}], "r": [[0.0005611806452762922], 0, 2.3700506687164307, 1544119568.785682], "v": 0.1}
{"i": ["cuda", "conv2d_no_batching", [1, 7, 7, 512, 512, 3, 3, [1, 1], [1, 1]], {}, ["conv2d_no_batching", 1, 7, 7, 512, 512, 3, 3, [1, 1], [1, 1]], {"i": 4573005, "t": "", "c": null, "e": [["tile_f", "sp", [16, 1, 16, 2]], ["tile_y", "sp", [1, 1, 7, 1]], ["tile_x", "sp", [7, 1, 1, 1]], ["tile_rc", "sp", [32, 1, 16]], ["tile_ry", "sp", [1, 1, 3]], ["tile_rx", "sp", [1, 3, 1]], ["auto_unroll_max_step", "ot", 1500], ["unroll_explicit", "ot", 0]]}], "r": [[0.0009685988848484848], 0, 2.0569674968719482, 1544119505.078322], "v": 0.1}
{"i": ["cuda", "conv2d_no_batching", [1, 7, 7, 512, 512, 3, 3, [1, 1], [1, 1]], {}, ["conv2d_no_batching", 1, 7, 7, 512, 512, 3, 3, [1, 1], [1, 1]], {"i": 6315405, "t": "", "c": null, "e": [["tile_f", "sp", [16, 1, 16, 2]], ["tile_y", "sp", [1, 1, 7, 1]], ["tile_x", "sp", [7, 1, 1, 1]], ["tile_rc", "sp", [32, 1, 16]], ["tile_ry", "sp", [1, 1, 3]], ["tile_rx", "sp", [1, 3, 1]], ["auto_unroll_max_step", "ot", 0], ["unroll_explicit", "ot", 1]]}], "r": [[0.0008682235636363636], 0, 1.7245733737945557, 1544119506.3557763], "v": 0.1}
{"i": ["cuda", "conv2d_no_batching", [1, 7, 7, 512, 512, 3, 3, [1, 1], [1, 1]], {}, ["conv2d_no_batching", 1, 7, 7, 512, 512, 3, 3, [1, 1], [1, 1]], {"i": 1088205, "t": "", "c": null, "e": [["tile_f", "sp", [16, 1, 16, 2]], ["tile_y", "sp", [1, 1, 7, 1]], ["tile_x", "sp", [7, 1, 1, 1]], ["tile_rc", "sp", [32, 1, 16]], ["tile_ry", "sp", [1, 1, 3]], ["tile_rx", "sp", [1, 3, 1]], ["auto_unroll_max_step", "ot", 0], ["unroll_explicit", "ot", 0]]}], "r": [[0.0009296629818181818], 0, 1.7717833518981934, 1544119507.6042125], "v": 0.1}
{"i": ["cuda", "conv2d_no_batching", [1, 7, 7, 512, 512, 3, 3, [1, 1], [1, 1]], {}, ["conv2d_no_batching", 1, 7, 7, 512, 512, 3, 3, [1, 1], [1, 1]], {"i": 4354801, "t": "", "c": null, "e": [["tile_f", "sp", [16, 1, 8, 4]], ["tile_y", "sp", [1, 1, 7, 1]], ["tile_x", "sp", [7, 1, 1, 1]], ["tile_rc", "sp", [64, 1, 8]], ["tile_ry", "sp", [1, 3, 1]], ["tile_rx", "sp", [1, 3, 1]], ["auto_unroll_max_step", "ot", 1500], ["unroll_explicit", "ot", 0]]}], "r": [[0.0010818536484848485], 0, 2.1917684078216553, 1544119509.1658359], "v": 0.1}
{"i": ["cuda", "conv2d_no_batching", [1, 7, 7, 512, 512, 3, 3, [1, 1], [1, 1]], {}, ["conv2d_no_batching", 1, 7, 7, 512, 512, 3, 3, [1, 1], [1, 1]], {"i": 6097201, "t": "", "c": null, "e": [["tile_f", "sp", [16, 1, 8, 4]], ["tile_y", "sp", [1, 1, 7, 1]], ["tile_x", "sp", [7, 1, 1, 1]], ["tile_rc", "sp", [64, 1, 8]], ["tile_ry", "sp", [1, 3, 1]], ["tile_rx", "sp", [1, 3, 1]], ["auto_unroll_max_step", "ot", 0], ["unroll_explicit", "ot", 1]]}], "r": [[0.0012437248727272727], 0, 1.9192354679107666, 1544119510.6587827], "v": 0.1}
{"i": ["cuda", "conv2d_no_batching", [1, 7, 7, 512, 512, 3, 3, [1, 1], [1, 1]], {}, ["conv2d_no_batching", 1, 7, 7, 512, 512, 3, 3, [1, 1], [1, 1]], {"i": 4548365, "t": "", "c": null, "e": [["tile_f", "sp", [16, 1, 16, 2]], ["tile_y", "sp", [1, 1, 7, 1]], ["tile_x", "sp", [7, 1, 1, 1]], ["tile_rc", "sp", [64, 1, 8]], ["tile_ry", "sp", [1, 1, 3]], ["tile_rx", "sp", [1, 3, 1]], ["auto_unroll_max_step", "ot", 1500], ["unroll_explicit", "ot", 0]]}], "r": [[0.0004482047237076649], 0, 2.053618907928467, 1544119570.3505924], "v": 0.1}
{"i": ["cuda", "conv2d_no_batching", [1, 7, 7, 512, 512, 3, 3, [1, 1], [1, 1]], {}, ["conv2d_no_batching", 1, 7, 7, 512, 512, 3, 3, [1, 1], [1, 1]], {"i": 2805965, "t": "", "c": null, "e": [["tile_f", "sp", [16, 1, 16, 2]], ["tile_y", "sp", [1, 1, 7, 1]], ["tile_x", "sp", [7, 1, 1, 1]], ["tile_rc", "sp", [64, 1, 8]], ["tile_ry", "sp", [1, 1, 3]], ["tile_rx", "sp", [1, 3, 1]], ["auto_unroll_max_step", "ot", 512], ["unroll_explicit", "ot", 0]]}], "r": [[0.00045454550802139036], 0, 2.0505783557891846, 1544119571.9333282], "v": 0.1}
{"i": ["cuda", "conv2d_no_batching", [1, 7, 7, 512, 512, 3, 3, [1, 1], [1, 1]], {}, ["conv2d_no_batching", 1, 7, 7, 512, 512, 3, 3, [1, 1], [1, 1]], {"i": 9775565, "t": "", "c": null, "e": [["tile_f", "sp", [16, 1, 16, 2]], ["tile_y", "sp", [1, 1, 7, 1]], ["tile_x", "sp", [7, 1, 1, 1]], ["tile_rc", "sp", [64, 1, 8]], ["tile_ry", "sp", [1, 1, 3]], ["tile_rx", "sp", [1, 3, 1]], ["auto_unroll_max_step", "ot", 1500], ["unroll_explicit", "ot", 1]]}], "r": [[0.0003139073190730838], 0, 1.8518986701965332, 1544119573.2794495], "v": 0.1}
{"i": ["cuda", "conv2d_no_batching", [1, 7, 7, 512, 512, 3, 3, [1, 1], [1, 1]], {}, ["conv2d_no_batching", 1, 7, 7, 512, 512, 3, 3, [1, 1], [1, 1]], {"i": 8033165, "t": "", "c": null, "e": [["tile_f", "sp", [16, 1, 16, 2]], ["tile_y", "sp", [1, 1, 7, 1]], ["tile_x", "sp", [7, 1, 1, 1]], ["tile_rc", "sp", [64, 1, 8]], ["tile_ry", "sp", [1, 1, 3]], ["tile_rx", "sp", [1, 3, 1]], ["auto_unroll_max_step", "ot", 512], ["unroll_explicit", "ot", 1]]}], "r": [[0.0003189853172905526], 0, 1.9364993572235107, 1544119574.6115072], "v": 0.1}
{"i": ["cuda", "conv2d_no_batching", [1, 7, 7, 512, 512, 3, 3, [1, 1], [1, 1]], {}, ["conv2d_no_batching", 1, 7, 7, 512, 512, 3, 3, [1, 1], [1, 1]], {"i": 870001, "t": "", "c": null, "e": [["tile_f", "sp", [16, 1, 8, 4]], ["tile_y", "sp", [1, 1, 7, 1]], ["tile_x", "sp", [7, 1, 1, 1]], ["tile_rc", "sp", [64, 1, 8]], ["tile_ry", "sp", [1, 3, 1]], ["tile_rx", "sp", [1, 3, 1]], ["auto_unroll_max_step", "ot", 0], ["unroll_explicit", "ot", 0]]}], "r": [[0.0011566409333333334], 0, 1.8054001331329346, 1544119516.189219], "v": 0.1}
{"i": ["cuda", "conv2d_no_batching", [1, 7, 7, 512, 512, 3, 3, [1, 1], [1, 1]], {}, ["conv2d_no_batching", 1, 7, 7, 512, 512, 3, 3, [1, 1], [1, 1]], {"i": 9582001, "t": "", "c": null, "e": [["tile_f", "sp", [16, 1, 8, 4]], ["tile_y", "sp", [1, 1, 7, 1]], ["tile_x", "sp", [7, 1, 1, 1]], ["tile_rc", "sp", [64, 1, 8]], ["tile_ry", "sp", [1, 3, 1]], ["tile_rx", "sp", [1, 3, 1]], ["auto_unroll_max_step", "ot", 1500], ["unroll_explicit", "ot", 1]]}], "r": [[0.000371391504456328], 0, 2.1985175609588623, 1544119576.0630062], "v": 0.1}
{"i": ["cuda", "conv2d_no_batching", [1, 7, 7, 512, 512, 3, 3, [1, 1], [1, 1]], {}, ["conv2d_no_batching", 1, 7, 7, 512, 512, 3, 3, [1, 1], [1, 1]], {"i": 6290765, "t": "", "c": null, "e": [["tile_f", "sp", [16, 1, 16, 2]], ["tile_y", "sp", [1, 1, 7, 1]], ["tile_x", "sp", [7, 1, 1, 1]], ["tile_rc", "sp", [64, 1, 8]], ["tile_ry", "sp", [1, 1, 3]], ["tile_rx", "sp", [1, 3, 1]], ["auto_unroll_max_step", "ot", 0], ["unroll_explicit", "ot", 1]]}], "r": [[0.0006363083818181818], 0, 1.623589277267456, 1544119518.4732702], "v": 0.1}
{"i": ["cuda", "conv2d_no_batching", [1, 7, 7, 512, 512, 3, 3, [1, 1], [1, 1]], {}, ["conv2d_no_batching", 1, 7, 7, 512, 512, 3, 3, [1, 1], [1, 1]], {"i": 1063565, "t": "", "c": null, "e": [["tile_f", "sp", [16, 1, 16, 2]], ["tile_y", "sp", [1, 1, 7, 1]], ["tile_x", "sp", [7, 1, 1, 1]], ["tile_rc", "sp", [64, 1, 8]], ["tile_ry", "sp", [1, 1, 3]], ["tile_rx", "sp", [1, 3, 1]], ["auto_unroll_max_step", "ot", 0], ["unroll_explicit", "ot", 0]]}], "r": [[0.0006716581212121212], 0, 1.59926438331604, 1544119519.5994997], "v": 0.1}
{"i": ["cuda", "conv2d_no_batching", [1, 7, 7, 512, 512, 3, 3, [1, 1], [1, 1]], {}, ["conv2d_no_batching", 1, 7, 7, 512, 512, 3, 3, [1, 1], [1, 1]], {"i": 8033107, "t": "", "c": null, "e": [["tile_f", "sp", [64, 1, 8, 1]], ["tile_y", "sp", [1, 1, 7, 1]], ["tile_x", "sp", [7, 1, 1, 1]], ["tile_rc", "sp", [64, 1, 8]], ["tile_ry", "sp", [1, 1, 3]], ["tile_rx", "sp", [1, 3, 1]], ["auto_unroll_max_step", "ot", 512], ["unroll_explicit", "ot", 1]]}], "r": [[0.00023508264527629234], 0, 1.6940045356750488, 1544119577.275711], "v": 0.1}
{"i": ["cuda", "conv2d_no_batching", [1, 7, 7, 512, 512, 3, 3, [1, 1], [1, 1]], {}, ["conv2d_no_batching", 1, 7, 7, 512, 512, 3, 3, [1, 1], [1, 1]], {"i": 2805907, "t": "", "c": null, "e": [["tile_f", "sp", [64, 1, 8, 1]], ["tile_y", "sp", [1, 1, 7, 1]], ["tile_x", "sp", [7, 1, 1, 1]], ["tile_rc", "sp", [64, 1, 8]], ["tile_ry", "sp", [1, 1, 3]], ["tile_rx", "sp", [1, 3, 1]], ["auto_unroll_max_step", "ot", 512], ["unroll_explicit", "ot", 0]]}], "r": [[0.0003995972192513369], 0, 2.0070090293884277, 1544119578.7609913], "v": 0.1}
{"i": ["cuda", "conv2d_no_batching", [1, 7, 7, 512, 512, 3, 3, [1, 1], [1, 1]], {}, ["conv2d_no_batching", 1, 7, 7, 512, 512, 3, 3, [1, 1], [1, 1]], {"i": 7476954, "t": "", "c": null, "e": [["tile_f", "sp", [32, 1, 16, 1]], ["tile_y", "sp", [1, 1, 7, 1]], ["tile_x", "sp", [7, 1, 1, 1]], ["tile_rc", "sp", [32, 1, 16]], ["tile_ry", "sp", [1, 1, 3]], ["tile_rx", "sp", [3, 1, 1]], ["auto_unroll_max_step", "ot", 512], ["unroll_explicit", "ot", 1]]}], "r": [[0.00030447113725490195], 0, 1.8649475574493408, 1544119580.07414], "v": 0.1}
{"i": ["cuda", "conv2d_no_batching", [1, 7, 7, 512, 512, 3, 3, [1, 1], [1, 1]], {}, ["conv2d_no_batching", 1, 7, 7, 512, 512, 3, 3, [1, 1], [1, 1]], {"i": 3992154, "t": "", "c": null, "e": [["tile_f", "sp", [32, 1, 16, 1]], ["tile_y", "sp", [1, 1, 7, 1]], ["tile_x", "sp", [7, 1, 1, 1]], ["tile_rc", "sp", [32, 1, 16]], ["tile_ry", "sp", [1, 1, 3]], ["tile_rx", "sp", [3, 1, 1]], ["auto_unroll_max_step", "ot", 1500], ["unroll_explicit", "ot", 0]]}], "r": [[0.0003982313618538324], 0, 1.9664230346679688, 1544119581.5385325], "v": 0.1}
{"i": ["cuda", "conv2d_no_batching", [1, 7, 7, 512, 512, 3, 3, [1, 1], [1, 1]], {}, ["conv2d_no_batching", 1, 7, 7, 512, 512, 3, 3, [1, 1], [1, 1]], {"i": 6290707, "t": "", "c": null, "e": [["tile_f", "sp", [64, 1, 8, 1]], ["tile_y", "sp", [1, 1, 7, 1]], ["tile_x", "sp", [7, 1, 1, 1]], ["tile_rc", "sp", [64, 1, 8]], ["tile_ry", "sp", [1, 1, 3]], ["tile_rx", "sp", [1, 3, 1]], ["auto_unroll_max_step", "ot", 0], ["unroll_explicit", "ot", 1]]}], "r": [[0.0004175972406417112], 0, 1.9774651527404785, 1544119583.0793865], "v": 0.1}
{"i": ["cuda", "conv2d_no_batching", [1, 7, 7, 512, 512, 3, 3, [1, 1], [1, 1]], {}, ["conv2d_no_batching", 1, 7, 7, 512, 512, 3, 3, [1, 1], [1, 1]], {"i": 1063507, "t": "", "c": null, "e": [["tile_f", "sp", [64, 1, 8, 1]], ["tile_y", "sp", [1, 1, 7, 1]], ["tile_x", "sp", [7, 1, 1, 1]], ["tile_rc", "sp", [64, 1, 8]], ["tile_ry", "sp", [1, 1, 3]], ["tile_rx", "sp", [1, 3, 1]], ["auto_unroll_max_step", "ot", 0], ["unroll_explicit", "ot", 0]]}], "r": [[0.0004130976559714795], 0, 1.9070277214050293, 1544119584.5520654], "v": 0.1}
{"i": ["cuda", "conv2d_no_batching", [1, 7, 7, 512, 512, 3, 3, [1, 1], [1, 1]], {}, ["conv2d_no_batching", 1, 7, 7, 512, 512, 3, 3, [1, 1], [1, 1]], {"i": 5734554, "t": "", "c": null, "e": [["tile_f", "sp", [32, 1, 16, 1]], ["tile_y", "sp", [1, 1, 7, 1]], ["tile_x", "sp", [7, 1, 1, 1]], ["tile_rc", "sp", [32, 1, 16]], ["tile_ry", "sp", [1, 1, 3]], ["tile_rx", "sp", [3, 1, 1]], ["auto_unroll_max_step", "ot", 0], ["unroll_explicit", "ot", 1]]}], "r": [[0.0002919886844919786], 0, 1.7731895446777344, 1544119585.822915], "v": 0.1}
{"i": ["cuda", "conv2d_no_batching", [1, 7, 7, 512, 512, 3, 3, [1, 1], [1, 1]], {}, ["conv2d_no_batching", 1, 7, 7, 512, 512, 3, 3, [1, 1], [1, 1]], {"i": 507354, "t": "", "c": null, "e": [["tile_f", "sp", [32, 1, 16, 1]], ["tile_y", "sp", [1, 1, 7, 1]], ["tile_x", "sp", [7, 1, 1, 1]], ["tile_rc", "sp", [32, 1, 16]], ["tile_ry", "sp", [1, 1, 3]], ["tile_rx", "sp", [3, 1, 1]], ["auto_unroll_max_step", "ot", 0], ["unroll_explicit", "ot", 0]]}], "r": [[0.00029264237076648844], 0, 1.671325922012329, 1544119587.1074567], "v": 0.1}
{"i": ["cuda", "conv2d_no_batching", [1, 7, 7, 512, 512, 3, 3, [1, 1], [1, 1]], {}, ["conv2d_no_batching", 1, 7, 7, 512, 512, 3, 3, [1, 1], [1, 1]], {"i": 9219354, "t": "", "c": null, "e": [["tile_f", "sp", [32, 1, 16, 1]], ["tile_y", "sp", [1, 1, 7, 1]], ["tile_x", "sp", [7, 1, 1, 1]], ["tile_rc", "sp", [32, 1, 16]], ["tile_ry", "sp", [1, 1, 3]], ["tile_rx", "sp", [3, 1, 1]], ["auto_unroll_max_step", "ot", 1500], ["unroll_explicit", "ot", 1]]}], "r": [[0.0003013799714795009], 0, 1.8302569389343262, 1544119588.4201436], "v": 0.1}
{"i": ["cuda", "conv2d_no_batching", [1, 7, 7, 512, 512, 3, 3, [1, 1], [1, 1]], {}, ["conv2d_no_batching", 1, 7, 7, 512, 512, 3, 3, [1, 1], [1, 1]], {"i": 2249754, "t": "", "c": null, "e": [["tile_f", "sp", [32, 1, 16, 1]], ["tile_y", "sp", [1, 1, 7, 1]], ["tile_x", "sp", [7, 1, 1, 1]], ["tile_rc", "sp", [32, 1, 16]], ["tile_ry", "sp", [1, 1, 3]], ["tile_rx", "sp", [3, 1, 1]], ["auto_unroll_max_step", "ot", 512], ["unroll_explicit", "ot", 0]]}], "r": [[0.0003978850392156863], 0, 1.9493932723999023, 1544119589.8874006], "v": 0.1}
{"i": ["cuda", "conv2d_no_batching", [1, 7, 7, 512, 512, 3, 3, [1, 1], [1, 1]], {}, ["conv2d_no_batching", 1, 7, 7, 512, 512, 3, 3, [1, 1], [1, 1]], {"i": 6290760, "t": "", "c": null, "e": [["tile_f", "sp", [16, 2, 8, 2]], ["tile_y", "sp", [1, 1, 7, 1]], ["tile_x", "sp", [7, 1, 1, 1]], ["tile_rc", "sp", [64, 1, 8]], ["tile_ry", "sp", [1, 1, 3]], ["tile_rx", "sp", [1, 3, 1]], ["auto_unroll_max_step", "ot", 0], ["unroll_explicit", "ot", 1]]}], "r": [[0.0010523350121212122], 0, 1.9117686748504639, 1544119531.3615267], "v": 0.1}
{"i": ["cuda", "conv2d_no_batching", [1, 7, 7, 512, 512, 3, 3, [1, 1], [1, 1]], {}, ["conv2d_no_batching", 1, 7, 7, 512, 512, 3, 3, [1, 1], [1, 1]], {"i": 9775560, "t": "", "c": null, "e": [["tile_f", "sp", [16, 2, 8, 2]], ["tile_y", "sp", [1, 1, 7, 1]], ["tile_x", "sp", [7, 1, 1, 1]], ["tile_rc", "sp", [64, 1, 8]], ["tile_ry", "sp", [1, 1, 3]], ["tile_rx", "sp", [1, 3, 1]], ["auto_unroll_max_step", "ot", 1500], ["unroll_explicit", "ot", 1]]}], "r": [[0.0003130332459893048], 0, 2.162015676498413, 1544119591.244137], "v": 0.1}
{"i": ["cuda", "conv2d_no_batching", [1, 7, 7, 512, 512, 3, 3, [1, 1], [1, 1]], {}, ["conv2d_no_batching", 1, 7, 7, 512, 512, 3, 3, [1, 1], [1, 1]], {"i": 1063560, "t": "", "c": null, "e": [["tile_f", "sp", [16, 2, 8, 2]], ["tile_y", "sp", [1, 1, 7, 1]], ["tile_x", "sp", [7, 1, 1, 1]], ["tile_rc", "sp", [64, 1, 8]], ["tile_ry", "sp", [1, 1, 3]], ["tile_rx", "sp", [1, 3, 1]], ["auto_unroll_max_step", "ot", 0], ["unroll_explicit", "ot", 0]]}], "r": [[0.0010456680727272728], 0, 1.862320899963379, 1544119533.8986266], "v": 0.1}
{"i": ["cuda", "conv2d_no_batching", [1, 7, 7, 512, 512, 3, 3, [1, 1], [1, 1]], {}, ["conv2d_no_batching", 1, 7, 7, 512, 512, 3, 3, [1, 1], [1, 1]], {"i": 4548360, "t": "", "c": null, "e": [["tile_f", "sp", [16, 2, 8, 2]], ["tile_y", "sp", [1, 1, 7, 1]], ["tile_x", "sp", [7, 1, 1, 1]], ["tile_rc", "sp", [64, 1, 8]], ["tile_ry", "sp", [1, 1, 3]], ["tile_rx", "sp", [1, 3, 1]], ["auto_unroll_max_step", "ot", 1500], ["unroll_explicit", "ot", 0]]}], "r": [[0.0009537112848484849], 0, 2.024325370788574, 1544119535.4052217], "v": 0.1}
{"i": ["cuda", "conv2d_no_batching", [1, 7, 7, 512, 512, 3, 3, [1, 1], [1, 1]], {}, ["conv2d_no_batching", 1, 7, 7, 512, 512, 3, 3, [1, 1], [1, 1]], {"i": 8033160, "t": "", "c": null, "e": [["tile_f", "sp", [16, 2, 8, 2]], ["tile_y", "sp", [1, 1, 7, 1]], ["tile_x", "sp", [7, 1, 1, 1]], ["tile_rc", "sp", [64, 1, 8]], ["tile_ry", "sp", [1, 1, 3]], ["tile_rx", "sp", [1, 3, 1]], ["auto_unroll_max_step", "ot", 512], ["unroll_explicit", "ot", 1]]}], "r": [[0.0005853307504456328], 0, 2.3717358112335205, 1544119593.032265], "v": 0.1}
{"i": ["cuda", "conv2d_no_batching", [1, 7, 7, 512, 512, 3, 3, [1, 1], [1, 1]], {}, ["conv2d_no_batching", 1, 7, 7, 512, 512, 3, 3, [1, 1], [1, 1]], {"i": 2805960, "t": "", "c": null, "e": [["tile_f", "sp", [16, 2, 8, 2]], ["tile_y", "sp", [1, 1, 7, 1]], ["tile_x", "sp", [7, 1, 1, 1]], ["tile_rc", "sp", [64, 1, 8]], ["tile_ry", "sp", [1, 1, 3]], ["tile_rx", "sp", [1, 3, 1]], ["auto_unroll_max_step", "ot", 512], ["unroll_explicit", "ot", 0]]}], "r": [[0.0005079092620320856], 0, 2.202575922012329, 1544119594.743233], "v": 0.1}
{"i": ["cuda", "conv2d_no_batching", [1, 7, 7, 512, 512, 3, 3, [1, 1], [1, 1]], {}, ["conv2d_no_batching", 1, 7, 7, 512, 512, 3, 3, [1, 1], [1, 1]], {"i": 2166434, "t": "", "c": null, "e": [["tile_f", "sp", [4, 1, 64, 2]], ["tile_y", "sp", [1, 1, 1, 7]], ["tile_x", "sp", [1, 7, 1, 1]], ["tile_rc", "sp", [256, 1, 2]], ["tile_ry", "sp", [1, 1, 3]], ["tile_rx", "sp", [3, 1, 1]], ["auto_unroll_max_step", "ot", 512], ["unroll_explicit", "ot", 0]]}], "r": [[0.005936579769696969], 0, 4.590649127960205, 1544119541.7051594], "v": 0.1}
{"i": ["cuda", "conv2d_no_batching", [1, 7, 7, 512, 512, 3, 3, [1, 1], [1, 1]], {}, ["conv2d_no_batching", 1, 7, 7, 512, 512, 3, 3, [1, 1], [1, 1]], {"i": 9136034, "t": "", "c": null, "e": [["tile_f", "sp", [4, 1, 64, 2]], ["tile_y", "sp", [1, 1, 1, 7]], ["tile_x", "sp", [1, 7, 1, 1]], ["tile_rc", "sp", [256, 1, 2]], ["tile_ry", "sp", [1, 1, 3]], ["tile_rx", "sp", [3, 1, 1]], ["auto_unroll_max_step", "ot", 1500], ["unroll_explicit", "ot", 1]]}], "r": [[0.0013777047515151515], 0, 2.4676620960235596, 1544119543.2801392], "v": 0.1}
{"i": ["cuda", "conv2d_no_batching", [1, 7, 7, 512, 512, 3, 3, [1, 1], [1, 1]], {}, ["conv2d_no_batching", 1, 7, 7, 512, 512, 3, 3, [1, 1], [1, 1]], {"i": 424034, "t": "", "c": null, "e": [["tile_f", "sp", [4, 1, 64, 2]], ["tile_y", "sp", [1, 1, 1, 7]], ["tile_x", "sp", [1, 7, 1, 1]], ["tile_rc", "sp", [256, 1, 2]], ["tile_ry", "sp", [1, 1, 3]], ["tile_rx", "sp", [3, 1, 1]], ["auto_unroll_max_step", "ot", 0], ["unroll_explicit", "ot", 0]]}], "r": [[0.0060590031999999995], 0, 6.5260162353515625, 1544119549.0955148], "v": 0.1}
{"i": ["cuda", "conv2d_no_batching", [1, 7, 7, 512, 512, 3, 3, [1, 1], [1, 1]], {}, ["conv2d_no_batching", 1, 7, 7, 512, 512, 3, 3, [1, 1], [1, 1]], {"i": 3908834, "t": "", "c": null, "e": [["tile_f", "sp", [4, 1, 64, 2]], ["tile_y", "sp", [1, 1, 1, 7]], ["tile_x", "sp", [1, 7, 1, 1]], ["tile_rc", "sp", [256, 1, 2]], ["tile_ry", "sp", [1, 1, 3]], ["tile_rx", "sp", [3, 1, 1]], ["auto_unroll_max_step", "ot", 1500], ["unroll_explicit", "ot", 0]]}], "r": [[0.0013207992545454545], 0, 2.169193744659424, 1544119550.6856666], "v": 0.1}
{"i": ["cuda", "conv2d_no_batching", [1, 7, 7, 512, 512, 3, 3, [1, 1], [1, 1]], {}, ["conv2d_no_batching", 1, 7, 7, 512, 512, 3, 3, [1, 1], [1, 1]], {"i": 7393634, "t": "", "c": null, "e": [["tile_f", "sp", [4, 1, 64, 2]], ["tile_y", "sp", [1, 1, 1, 7]], ["tile_x", "sp", [1, 7, 1, 1]], ["tile_rc", "sp", [256, 1, 2]], ["tile_ry", "sp", [1, 1, 3]], ["tile_rx", "sp", [3, 1, 1]], ["auto_unroll_max_step", "ot", 512], ["unroll_explicit", "ot", 1]]}], "r": [[0.005767258915151515], 0, 4.884286642074585, 1544119554.5491676], "v": 0.1}
{"i": ["cuda", "conv2d_no_batching", [1, 7, 7, 512, 512, 3, 3, [1, 1], [1, 1]], {}, ["conv2d_no_batching", 1, 7, 7, 512, 512, 3, 3, [1, 1], [1, 1]], {"i": 869965, "t": "", "c": null, "e": [["tile_f", "sp", [16, 1, 16, 2]], ["tile_y", "sp", [1, 1, 7, 1]], ["tile_x", "sp", [7, 1, 1, 1]], ["tile_rc", "sp", [64, 1, 8]], ["tile_ry", "sp", [1, 3, 1]], ["tile_rx", "sp", [1, 3, 1]], ["auto_unroll_max_step", "ot", 0], ["unroll_explicit", "ot", 0]]}], "r": [[0.0006712154242424242], 0, 1.6609270572662354, 1544119555.7710533], "v": 0.1}
{"i": ["cuda", "conv2d_no_batching", [1, 7, 7, 512, 512, 3, 3, [1, 1], [1, 1]], {}, ["conv2d_no_batching", 1, 7, 7, 512, 512, 3, 3, [1, 1], [1, 1]], {"i": 6097165, "t": "", "c": null, "e": [["tile_f", "sp", [16, 1, 16, 2]], ["tile_y", "sp", [1, 1, 7, 1]], ["tile_x", "sp", [7, 1, 1, 1]], ["tile_rc", "sp", [64, 1, 8]], ["tile_ry", "sp", [1, 3, 1]], ["tile_rx", "sp", [1, 3, 1]], ["auto_unroll_max_step", "ot", 0], ["unroll_explicit", "ot", 1]]}], "r": [[0.0006770270363636364], 0, 1.6736903190612793, 1544119556.9627154], "v": 0.1}
{"i": ["cuda", "conv2d_no_batching", [1, 7, 7, 512, 512, 3, 3, [1, 1], [1, 1]], {}, ["conv2d_no_batching", 1, 7, 7, 512, 512, 3, 3, [1, 1], [1, 1]], {"i": 9800154, "t": "", "c": null, "e": [["tile_f", "sp", [32, 1, 16, 1]], ["tile_y", "sp", [1, 1, 7, 1]], ["tile_x", "sp", [7, 1, 1, 1]], ["tile_rc", "sp", [32, 1, 16]], ["tile_ry", "sp", [1, 1, 3]], ["tile_rx", "sp", [1, 3, 1]], ["auto_unroll_max_step", "ot", 1500], ["unroll_explicit", "ot", 1]]}], "r": [[0.0003008214064171123], 0, 1.9419505596160889, 1544119596.045006], "v": 0.1}
{"i": ["cuda", "conv2d_no_batching", [1, 7, 7, 512, 512, 3, 3, [1, 1], [1, 1]], {}, ["conv2d_no_batching", 1, 7, 7, 512, 512, 3, 3, [1, 1], [1, 1]], {"i": 1088154, "t": "", "c": null, "e": [["tile_f", "sp", [32, 1, 16, 1]], ["tile_y", "sp", [1, 1, 7, 1]], ["tile_x", "sp", [7, 1, 1, 1]], ["tile_rc", "sp", [32, 1, 16]], ["tile_ry", "sp", [1, 1, 3]], ["tile_rx", "sp", [1, 3, 1]], ["auto_unroll_max_step", "ot", 0], ["unroll_explicit", "ot", 0]]}], "r": [[0.00046787209982174693], 0, 2.022209644317627, 1544119597.6134357], "v": 0.1}
{"i": ["cuda", "conv2d_no_batching", [1, 7, 7, 512, 512, 3, 3, [1, 1], [1, 1]], {}, ["conv2d_no_batching", 1, 7, 7, 512, 512, 3, 3, [1, 1], [1, 1]], {"i": 4572954, "t": "", "c": null, "e": [["tile_f", "sp", [32, 1, 16, 1]], ["tile_y", "sp", [1, 1, 7, 1]], ["tile_x", "sp", [7, 1, 1, 1]], ["tile_rc", "sp", [32, 1, 16]], ["tile_ry", "sp", [1, 1, 3]], ["tile_rx", "sp", [1, 3, 1]], ["auto_unroll_max_step", "ot", 1500], ["unroll_explicit", "ot", 0]]}], "r": [[0.0005489164634581105], 0, 2.3697750568389893, 1544119599.406719], "v": 0.1}
{"i": ["cuda", "conv2d_no_batching", [1, 7, 7, 512, 512, 3, 3, [1, 1], [1, 1]], {}, ["conv2d_no_batching", 1, 7, 7, 512, 512, 3, 3, [1, 1], [1, 1]], {"i": 2830554, "t": "", "c": null, "e": [["tile_f", "sp", [32, 1, 16, 1]], ["tile_y", "sp", [1, 1, 7, 1]], ["tile_x", "sp", [7, 1, 1, 1]], ["tile_rc", "sp", [32, 1, 16]], ["tile_ry", "sp", [1, 1, 3]], ["tile_rx", "sp", [1, 3, 1]], ["auto_unroll_max_step", "ot", 512], ["unroll_explicit", "ot", 0]]}], "r": [[0.0005501395222816399], 0, 2.331956386566162, 1544119601.1976984], "v": 0.1}
{"i": ["cuda", "conv2d_no_batching", [1, 7, 7, 512, 512, 3, 3, [1, 1], [1, 1]], {}, ["conv2d_no_batching", 1, 7, 7, 512, 512, 3, 3, [1, 1], [1, 1]], {"i": 2746960, "t": "", "c": null, "e": [["tile_f", "sp", [16, 1, 32, 1]], ["tile_y", "sp", [1, 1, 7, 1]], ["tile_x", "sp", [1, 7, 1, 1]], ["tile_rc", "sp", [256, 1, 2]], ["tile_ry", "sp", [1, 1, 3]], ["tile_rx", "sp", [1, 3, 1]], ["auto_unroll_max_step", "ot", 512], ["unroll_explicit", "ot", 0]]}], "r": [[0.0002723822798573975], 0, 1.7806789875030518, 1544119602.4788744], "v": 0.1}
{"i": ["cuda", "conv2d_no_batching", [1, 7, 7, 512, 512, 3, 3, [1, 1], [1, 1]], {}, ["conv2d_no_batching", 1, 7, 7, 512, 512, 3, 3, [1, 1], [1, 1]], {"i": 2778634, "t": "", "c": null, "e": [["tile_f", "sp", [32, 1, 16, 1]], ["tile_y", "sp", [1, 1, 7, 1]], ["tile_x", "sp", [1, 7, 1, 1]], ["tile_rc", "sp", [128, 1, 4]], ["tile_ry", "sp", [1, 1, 3]], ["tile_rx", "sp", [1, 3, 1]], ["auto_unroll_max_step", "ot", 512], ["unroll_explicit", "ot", 0]]}], "r": [[0.00019004612299465242], 0, 1.594916820526123, 1544119603.613133], "v": 0.1}
{"i": ["cuda", "conv2d_no_batching", [1, 7, 7, 512, 512, 3, 3, [1, 1], [1, 1]], {}, ["conv2d_no_batching", 1, 7, 7, 512, 512, 3, 3, [1, 1], [1, 1]], {"i": 8005834, "t": "", "c": null, "e": [["tile_f", "sp", [32, 1, 16, 1]], ["tile_y", "sp", [1, 1, 7, 1]], ["tile_x", "sp", [1, 7, 1, 1]], ["tile_rc", "sp", [128, 1, 4]], ["tile_ry", "sp", [1, 1, 3]], ["tile_rx", "sp", [1, 3, 1]], ["auto_unroll_max_step", "ot", 512], ["unroll_explicit", "ot", 1]]}], "r": [[0.00018696339572192512], 0, 1.628624677658081, 1544119604.8280053], "v": 0.1}
{"i": ["cuda", "conv2d_no_batching", [1, 7, 7, 512, 512, 3, 3, [1, 1], [1, 1]], {}, ["conv2d_no_batching", 1, 7, 7, 512, 512, 3, 3, [1, 1], [1, 1]], {"i": 1004560, "t": "", "c": null, "e": [["tile_f", "sp", [16, 1, 32, 1]], ["tile_y", "sp", [1, 1, 7, 1]], ["tile_x", "sp", [1, 7, 1, 1]], ["tile_rc", "sp", [256, 1, 2]], ["tile_ry", "sp", [1, 1, 3]], ["tile_rx", "sp", [1, 3, 1]], ["auto_unroll_max_step", "ot", 0], ["unroll_explicit", "ot", 0]]}], "r": [[0.0002779319982174688], 0, 1.6663563251495361, 1544119606.0788877], "v": 0.1}
{"i": ["cuda", "conv2d_no_batching", [1, 7, 7, 512, 512, 3, 3, [1, 1], [1, 1]], {}, ["conv2d_no_batching", 1, 7, 7, 512, 512, 3, 3, [1, 1], [1, 1]], {"i": 9716560, "t": "", "c": null, "e": [["tile_f", "sp", [16, 1, 32, 1]], ["tile_y", "sp", [1, 1, 7, 1]], ["tile_x", "sp", [1, 7, 1, 1]], ["tile_rc", "sp", [256, 1, 2]], ["tile_ry", "sp", [1, 1, 3]], ["tile_rx", "sp", [1, 3, 1]], ["auto_unroll_max_step", "ot", 1500], ["unroll_explicit", "ot", 1]]}], "r": [[0.0002752187379679144], 0, 1.7037055492401123, 1544119607.3730226], "v": 0.1}
{"i": ["cuda", "conv2d_no_batching", [1, 7, 7, 512, 512, 3, 3, [1, 1], [1, 1]], {}, ["conv2d_no_batching", 1, 7, 7, 512, 512, 3, 3, [1, 1], [1, 1]], {"i": 4521034, "t": "", "c": null, "e": [["tile_f", "sp", [32, 1, 16, 1]], ["tile_y", "sp", [1, 1, 7, 1]], ["tile_x", "sp", [1, 7, 1, 1]], ["tile_rc", "sp", [128, 1, 4]], ["tile_ry", "sp", [1, 1, 3]], ["tile_rx", "sp", [1, 3, 1]], ["auto_unroll_max_step", "ot", 1500], ["unroll_explicit", "ot", 0]]}], "r": [[0.00018144807308377895], 0, 1.5642385482788086, 1544119608.5026765], "v": 0.1}
{"i": ["cuda", "conv2d_no_batching", [1, 7, 7, 512, 512, 3, 3, [1, 1], [1, 1]], {}, ["conv2d_no_batching", 1, 7, 7, 512, 512, 3, 3, [1, 1], [1, 1]], {"i": 2750474, "t": "", "c": null, "e": [["tile_f", "sp", [32, 1, 16, 1]], ["tile_y", "sp", [1, 1, 7, 1]], ["tile_x", "sp", [1, 7, 1, 1]], ["tile_rc", "sp", [128, 2, 2]], ["tile_ry", "sp", [1, 1, 3]], ["tile_rx", "sp", [1, 3, 1]], ["auto_unroll_max_step", "ot", 512], ["unroll_explicit", "ot", 0]]}], "r": [[0.00021167947950089127], 0, 1.7264347076416016, 1544119770.5286586], "v": 0.1}
{"i": ["cuda", "conv2d_no_batching", [1, 7, 7, 512, 512, 3, 3, [1, 1], [1, 1]], {}, ["conv2d_no_batching", 1, 7, 7, 512, 512, 3, 3, [1, 1], [1, 1]], {"i": 7974154, "t": "", "c": null, "e": [["tile_f", "sp", [32, 1, 16, 1]], ["tile_y", "sp", [1, 1, 7, 1]], ["tile_x", "sp", [1, 7, 1, 1]], ["tile_rc", "sp", [256, 1, 2]], ["tile_ry", "sp", [1, 1, 3]], ["tile_rx", "sp", [1, 3, 1]], ["auto_unroll_max_step", "ot", 512], ["unroll_explicit", "ot", 1]]}], "r": [[0.0002778257308377897], 0, 1.839773416519165, 1544119771.9139876], "v": 0.1}
{"i": ["cuda", "conv2d_no_batching", [1, 7, 7, 512, 512, 3, 3, [1, 1], [1, 1]], {}, ["conv2d_no_batching", 1, 7, 7, 512, 512, 3, 3, [1, 1], [1, 1]], {"i": 7977674, "t": "", "c": null, "e": [["tile_f", "sp", [32, 1, 16, 1]], ["tile_y", "sp", [1, 1, 7, 1]], ["tile_x", "sp", [1, 7, 1, 1]], ["tile_rc", "sp", [128, 2, 2]], ["tile_ry", "sp", [1, 1, 3]], ["tile_rx", "sp", [1, 3, 1]], ["auto_unroll_max_step", "ot", 512], ["unroll_explicit", "ot", 1]]}], "r": [[0.0001622270048], 0, 1.657090187072754, 1544119832.668877], "v": 0.1}
{"i": ["cuda", "conv2d_no_batching", [1, 7, 7, 512, 512, 3, 3, [1, 1], [1, 1]], {}, ["conv2d_no_batching", 1, 7, 7, 512, 512, 3, 3, [1, 1], [1, 1]], {"i": 2746954, "t": "", "c": null, "e": [["tile_f", "sp", [32, 1, 16, 1]], ["tile_y", "sp", [1, 1, 7, 1]], ["tile_x", "sp", [1, 7, 1, 1]], ["tile_rc", "sp", [256, 1, 2]], ["tile_ry", "sp", [1, 1, 3]], ["tile_rx", "sp", [1, 3, 1]], ["auto_unroll_max_step", "ot", 512], ["unroll_explicit", "ot", 0]]}], "r": [[0.00027826877183600713], 0, 1.759873390197754, 1544119774.4922178], "v": 0.1}
{"i": ["cuda", "conv2d_no_batching", [1, 7, 7, 512, 512, 3, 3, [1, 1], [1, 1]], {}, ["conv2d_no_batching", 1, 7, 7, 512, 512, 3, 3, [1, 1], [1, 1]], {"i": 9748234, "t": "", "c": null, "e": [["tile_f", "sp", [32, 1, 16, 1]], ["tile_y", "sp", [1, 1, 7, 1]], ["tile_x", "sp", [1, 7, 1, 1]], ["tile_rc", "sp", [128, 1, 4]], ["tile_ry", "sp", [1, 1, 3]], ["tile_rx", "sp", [1, 3, 1]], ["auto_unroll_max_step", "ot", 1500], ["unroll_explicit", "ot", 1]]}], "r": [[0.000160385576], 0, 1.715146541595459, 1544119833.8597128], "v": 0.1}
{"i": ["cuda", "conv2d_no_batching", [1, 7, 7, 512, 512, 3, 3, [1, 1], [1, 1]], {}, ["conv2d_no_batching", 1, 7, 7, 512, 512, 3, 3, [1, 1], [1, 1]], {"i": 9716554, "t": "", "c": null, "e": [["tile_f", "sp", [32, 1, 16, 1]], ["tile_y", "sp", [1, 1, 7, 1]], ["tile_x", "sp", [1, 7, 1, 1]], ["tile_rc", "sp", [256, 1, 2]], ["tile_ry", "sp", [1, 1, 3]], ["tile_rx", "sp", [1, 3, 1]], ["auto_unroll_max_step", "ot", 1500], ["unroll_explicit", "ot", 1]]}], "r": [[0.0002830276844919786], 0, 1.7931764125823975, 1544119777.0253031], "v": 0.1}
{"i": ["cuda", "conv2d_no_batching", [1, 7, 7, 512, 512, 3, 3, [1, 1], [1, 1]], {}, ["conv2d_no_batching", 1, 7, 7, 512, 512, 3, 3, [1, 1], [1, 1]], {"i": 9720074, "t": "", "c": null, "e": [["tile_f", "sp", [32, 1, 16, 1]], ["tile_y", "sp", [1, 1, 7, 1]], ["tile_x", "sp", [1, 7, 1, 1]], ["tile_rc", "sp", [128, 2, 2]], ["tile_ry", "sp", [1, 1, 3]], ["tile_rx", "sp", [1, 3, 1]], ["auto_unroll_max_step", "ot", 1500], ["unroll_explicit", "ot", 1]]}], "r": [[0.00016377056], 0, 1.788383960723877, 1544119835.0561337], "v": 0.1}
{"i": ["cuda", "conv2d_no_batching", [1, 7, 7, 512, 512, 3, 3, [1, 1], [1, 1]], {}, ["conv2d_no_batching", 1, 7, 7, 512, 512, 3, 3, [1, 1], [1, 1]], {"i": 4492874, "t": "", "c": null, "e": [["tile_f", "sp", [32, 1, 16, 1]], ["tile_y", "sp", [1, 1, 7, 1]], ["tile_x", "sp", [1, 7, 1, 1]], ["tile_rc", "sp", [128, 2, 2]], ["tile_ry", "sp", [1, 1, 3]], ["tile_rx", "sp", [1, 3, 1]], ["auto_unroll_max_step", "ot", 1500], ["unroll_explicit", "ot", 0]]}], "r": [[0.00018269617290552585], 0, 1.6830830574035645, 1544119779.4749513], "v": 0.1}
{"i": ["cuda", "conv2d_no_batching", [1, 7, 7, 512, 512, 3, 3, [1, 1], [1, 1]], {}, ["conv2d_no_batching", 1, 7, 7, 512, 512, 3, 3, [1, 1], [1, 1]], {"i": 7974148, "t": "", "c": null, "e": [["tile_f", "sp", [32, 2, 8, 1]], ["tile_y", "sp", [1, 1, 7, 1]], ["tile_x", "sp", [1, 7, 1, 1]], ["tile_rc", "sp", [256, 1, 2]], ["tile_ry", "sp", [1, 1, 3]], ["tile_rx", "sp", [1, 3, 1]], ["auto_unroll_max_step", "ot", 512], ["unroll_explicit", "ot", 1]]}], "r": [[0.0002462372602495544], 0, 1.878561019897461, 1544119780.8316865], "v": 0.1}
{"i": ["cuda", "conv2d_no_batching", [1, 7, 7, 512, 512, 3, 3, [1, 1], [1, 1]], {}, ["conv2d_no_batching", 1, 7, 7, 512, 512, 3, 3, [1, 1], [1, 1]], {"i": 4489354, "t": "", "c": null, "e": [["tile_f", "sp", [32, 1, 16, 1]], ["tile_y", "sp", [1, 1, 7, 1]], ["tile_x", "sp", [1, 7, 1, 1]], ["tile_rc", "sp", [256, 1, 2]], ["tile_ry", "sp", [1, 1, 3]], ["tile_rx", "sp", [1, 3, 1]], ["auto_unroll_max_step", "ot", 1500], ["unroll_explicit", "ot", 0]]}], "r": [[0.00026350093048128345], 0, 1.7588322162628174, 1544119782.1701562], "v": 0.1}
{"i": ["cuda", "conv2d_no_batching", [1, 7, 7, 512, 512, 3, 3, [1, 1], [1, 1]], {}, ["conv2d_no_batching", 1, 7, 7, 512, 512, 3, 3, [1, 1], [1, 1]], {"i": 2718794, "t": "", "c": null, "e": [["tile_f", "sp", [32, 1, 16, 1]], ["tile_y", "sp", [1, 1, 7, 1]], ["tile_x", "sp", [1, 7, 1, 1]], ["tile_rc", "sp", [128, 4, 1]], ["tile_ry", "sp", [1, 1, 3]], ["tile_rx", "sp", [1, 3, 1]], ["auto_unroll_max_step", "ot", 512], ["unroll_explicit", "ot", 0]]}], "r": [[0.0001870440588235294], 0, 1.6233017444610596, 1544119783.352804], "v": 0.1}
{"i": ["cuda", "conv2d_no_batching", [1, 7, 7, 512, 512, 3, 3, [1, 1], [1, 1]], {}, ["conv2d_no_batching", 1, 7, 7, 512, 512, 3, 3, [1, 1], [1, 1]], {"i": 7945994, "t": "", "c": null, "e": [["tile_f", "sp", [32, 1, 16, 1]], ["tile_y", "sp", [1, 1, 7, 1]], ["tile_x", "sp", [1, 7, 1, 1]], ["tile_rc", "sp", [128, 4, 1]], ["tile_ry", "sp", [1, 1, 3]], ["tile_rx", "sp", [1, 3, 1]], ["auto_unroll_max_step", "ot", 512], ["unroll_explicit", "ot", 1]]}], "r": [[0.00021177311408199643], 0, 1.7746162414550781, 1544119784.627934], "v": 0.1}
{"i": ["cuda", "conv2d_no_batching", [1, 7, 7, 512, 512, 3, 3, [1, 1], [1, 1]], {}, ["conv2d_no_batching", 1, 7, 7, 512, 512, 3, 3, [1, 1], [1, 1]], {"i": 7974147, "t": "", "c": null, "e": [["tile_f", "sp", [64, 1, 8, 1]], ["tile_y", "sp", [1, 1, 7, 1]], ["tile_x", "sp", [1, 7, 1, 1]], ["tile_rc", "sp", [256, 1, 2]], ["tile_ry", "sp", [1, 1, 3]], ["tile_rx", "sp", [1, 3, 1]], ["auto_unroll_max_step", "ot", 512], ["unroll_explicit", "ot", 1]]}], "r": [[0.0002454131479500891], 0, 1.8035669326782227, 1544119785.9754498], "v": 0.1}
{"i": ["cuda", "conv2d_no_batching", [1, 7, 7, 512, 512, 3, 3, [1, 1], [1, 1]], {}, ["conv2d_no_batching", 1, 7, 7, 512, 512, 3, 3, [1, 1], [1, 1]], {"i": 9716548, "t": "", "c": null, "e": [["tile_f", "sp", [32, 2, 8, 1]], ["tile_y", "sp", [1, 1, 7, 1]], ["tile_x", "sp", [1, 7, 1, 1]], ["tile_rc", "sp", [256, 1, 2]], ["tile_ry", "sp", [1, 1, 3]], ["tile_rx", "sp", [1, 3, 1]], ["auto_unroll_max_step", "ot", 1500], ["unroll_explicit", "ot", 1]]}], "r": [[0.00024514016221033867], 0, 1.8205959796905518, 1544119787.241805], "v": 0.1}
{"i": ["cuda", "conv2d_no_batching", [1, 7, 7, 512, 512, 3, 3, [1, 1], [1, 1]], {}, ["conv2d_no_batching", 1, 7, 7, 512, 512, 3, 3, [1, 1], [1, 1]], {"i": 7973274, "t": "", "c": null, "e": [["tile_f", "sp", [32, 1, 16, 1]], ["tile_y", "sp", [1, 1, 7, 1]], ["tile_x", "sp", [7, 1, 1, 1]], ["tile_rc", "sp", [256, 1, 2]], ["tile_ry", "sp", [1, 1, 3]], ["tile_rx", "sp", [1, 3, 1]], ["auto_unroll_max_step", "ot", 512], ["unroll_explicit", "ot", 1]]}], "r": [[0.00022859387878787878], 0, 1.6870372295379639, 1544119788.5150056], "v": 0.1}
{"i": ["cuda", "conv2d_no_batching", [1, 7, 7, 512, 512, 3, 3, [1, 1], [1, 1]], {}, ["conv2d_no_batching", 1, 7, 7, 512, 512, 3, 3, [1, 1], [1, 1]], {"i": 2746948, "t": "", "c": null, "e": [["tile_f", "sp", [32, 2, 8, 1]], ["tile_y", "sp", [1, 1, 7, 1]], ["tile_x", "sp", [1, 7, 1, 1]], ["tile_rc", "sp", [256, 1, 2]], ["tile_ry", "sp", [1, 1, 3]], ["tile_rx", "sp", [1, 3, 1]], ["auto_unroll_max_step", "ot", 512], ["unroll_explicit", "ot", 0]]}], "r": [[0.00030107491978609627], 0, 1.9208614826202393, 1544119789.9789271], "v": 0.1}
{"i": ["cuda", "conv2d_no_batching", [1, 7, 7, 512, 512, 3, 3, [1, 1], [1, 1]], {}, ["conv2d_no_batching", 1, 7, 7, 512, 512, 3, 3, [1, 1], [1, 1]], {"i": 9688394, "t": "", "c": null, "e": [["tile_f", "sp", [32, 1, 16, 1]], ["tile_y", "sp", [1, 1, 7, 1]], ["tile_x", "sp", [1, 7, 1, 1]], ["tile_rc", "sp", [128, 4, 1]], ["tile_ry", "sp", [1, 1, 3]], ["tile_rx", "sp", [1, 3, 1]], ["auto_unroll_max_step", "ot", 1500], ["unroll_explicit", "ot", 1]]}], "r": [[0.0001738273376], 0, 1.8078052997589111, 1544119836.2933228], "v": 0.1}
{"i": ["cuda", "conv2d_no_batching", [1, 7, 7, 512, 512, 3, 3, [1, 1], [1, 1]], {}, ["conv2d_no_batching", 1, 7, 7, 512, 512, 3, 3, [1, 1], [1, 1]], {"i": 2778635, "t": "", "c": null, "e": [["tile_f", "sp", [16, 2, 16, 1]], ["tile_y", "sp", [1, 1, 7, 1]], ["tile_x", "sp", [1, 7, 1, 1]], ["tile_rc", "sp", [128, 1, 4]], ["tile_ry", "sp", [1, 1, 3]], ["tile_rx", "sp", [1, 3, 1]], ["auto_unroll_max_step", "ot", 512], ["unroll_explicit", "ot", 0]]}], "r": [[0.00023751882887700535], 0, 1.8742828369140625, 1544119792.5899875], "v": 0.1}
{"i": ["cuda", "conv2d_no_batching", [1, 7, 7, 512, 512, 3, 3, [1, 1], [1, 1]], {}, ["conv2d_no_batching", 1, 7, 7, 512, 512, 3, 3, [1, 1], [1, 1]], {"i": 9554634, "t": "", "c": null, "e": [["tile_f", "sp", [32, 1, 16, 1]], ["tile_y", "sp", [1, 1, 7, 1]], ["tile_x", "sp", [1, 7, 1, 1]], ["tile_rc", "sp", [128, 1, 4]], ["tile_ry", "sp", [1, 3, 1]], ["tile_rx", "sp", [1, 3, 1]], ["auto_unroll_max_step", "ot", 1500], ["unroll_explicit", "ot", 1]]}], "r": [[0.00023039210695187165], 0, 1.8821055889129639, 1544119793.8362517], "v": 0.1}
{"i": ["cuda", "conv2d_no_batching", [1, 7, 7, 512, 512, 3, 3, [1, 1], [1, 1]], {}, ["conv2d_no_batching", 1, 7, 7, 512, 512, 3, 3, [1, 1], [1, 1]], {"i": 2746947, "t": "", "c": null, "e": [["tile_f", "sp", [64, 1, 8, 1]], ["tile_y", "sp", [1, 1, 7, 1]], ["tile_x", "sp", [1, 7, 1, 1]], ["tile_rc", "sp", [256, 1, 2]], ["tile_ry", "sp", [1, 1, 3]], ["tile_rx", "sp", [1, 3, 1]], ["auto_unroll_max_step", "ot", 512], ["unroll_explicit", "ot", 0]]}], "r": [[0.0003360505846702317], 0, 1.9119873046875, 1544119795.2819424], "v": 0.1}
{"i": ["cuda", "conv2d_no_batching", [1, 7, 7, 512, 512, 3, 3, [1, 1], [1, 1]], {}, ["conv2d_no_batching", 1, 7, 7, 512, 512, 3, 3, [1, 1], [1, 1]], {"i": 8004954, "t": "", "c": null, "e": [["tile_f", "sp", [32, 1, 16, 1]], ["tile_y", "sp", [1, 1, 7, 1]], ["tile_x", "sp", [7, 1, 1, 1]], ["tile_rc", "sp", [128, 1, 4]], ["tile_ry", "sp", [1, 1, 3]], ["tile_rx", "sp", [1, 3, 1]], ["auto_unroll_max_step", "ot", 512], ["unroll_explicit", "ot", 1]]}], "r": [[0.0002236912834224599], 0, 1.748000144958496, 1544119796.5858428], "v": 0.1}
{"i": ["cuda", "conv2d_no_batching", [1, 7, 7, 512, 512, 3, 3, [1, 1], [1, 1]], {}, ["conv2d_no_batching", 1, 7, 7, 512, 512, 3, 3, [1, 1], [1, 1]], {"i": 7974160, "t": "", "c": null, "e": [["tile_f", "sp", [16, 1, 32, 1]], ["tile_y", "sp", [1, 1, 7, 1]], ["tile_x", "sp", [1, 7, 1, 1]], ["tile_rc", "sp", [256, 1, 2]], ["tile_ry", "sp", [1, 1, 3]], ["tile_rx", "sp", [1, 3, 1]], ["auto_unroll_max_step", "ot", 512], ["unroll_explicit", "ot", 1]]}], "r": [[0.000268026320855615], 0, 1.7623729705810547, 1544119797.8761196], "v": 0.1}
{"i": ["cuda", "conv2d_no_batching", [1, 7, 7, 512, 512, 3, 3, [1, 1], [1, 1]], {}, ["conv2d_no_batching", 1, 7, 7, 512, 512, 3, 3, [1, 1], [1, 1]], {"i": 4461194, "t": "", "c": null, "e": [["tile_f", "sp", [32, 1, 16, 1]], ["tile_y", "sp", [1, 1, 7, 1]], ["tile_x", "sp", [1, 7, 1, 1]], ["tile_rc", "sp", [128, 4, 1]], ["tile_ry", "sp", [1, 1, 3]], ["tile_rx", "sp", [1, 3, 1]], ["auto_unroll_max_step", "ot", 1500], ["unroll_explicit", "ot", 0]]}], "r": [[0.0002345477504456328], 0, 1.759591817855835, 1544119799.1074703], "v": 0.1}
{"i": ["cuda", "conv2d_no_batching", [1, 7, 7, 512, 512, 3, 3, [1, 1], [1, 1]], {}, ["conv2d_no_batching", 1, 7, 7, 512, 512, 3, 3, [1, 1], [1, 1]], {"i": 1036234, "t": "", "c": null, "e": [["tile_f", "sp", [32, 1, 16, 1]], ["tile_y", "sp", [1, 1, 7, 1]], ["tile_x", "sp", [1, 7, 1, 1]], ["tile_rc", "sp", [128, 1, 4]], ["tile_ry", "sp", [1, 1, 3]], ["tile_rx", "sp", [1, 3, 1]], ["auto_unroll_max_step", "ot", 0], ["unroll_explicit", "ot", 0]]}], "r": [[0.0001837848449197861], 0, 1.6558747291564941, 1544119800.2884064], "v": 0.1}
{"i": ["cuda", "conv2d_no_batching", [1, 7, 7, 512, 512, 3, 3, [1, 1], [1, 1]], {}, ["conv2d_no_batching", 1, 7, 7, 512, 512, 3, 3, [1, 1], [1, 1]], {"i": 9716547, "t": "", "c": null, "e": [["tile_f", "sp", [64, 1, 8, 1]], ["tile_y", "sp", [1, 1, 7, 1]], ["tile_x", "sp", [1, 7, 1, 1]], ["tile_rc", "sp", [256, 1, 2]], ["tile_ry", "sp", [1, 1, 3]], ["tile_rx", "sp", [1, 3, 1]], ["auto_unroll_max_step", "ot", 1500], ["unroll_explicit", "ot", 1]]}], "r": [[0.00024723462566844916], 0, 1.8109359741210938, 1544119801.5622106], "v": 0.1}
{"i": ["cuda", "conv2d_no_batching", [1, 7, 7, 512, 512, 3, 3, [1, 1], [1, 1]], {}, ["conv2d_no_batching", 1, 7, 7, 512, 512, 3, 3, [1, 1], [1, 1]], {"i": 9715674, "t": "", "c": null, "e": [["tile_f", "sp", [32, 1, 16, 1]], ["tile_y", "sp", [1, 1, 7, 1]], ["tile_x", "sp", [7, 1, 1, 1]], ["tile_rc", "sp", [256, 1, 2]], ["tile_ry", "sp", [1, 1, 3]], ["tile_rx", "sp", [1, 3, 1]], ["auto_unroll_max_step", "ot", 1500], ["unroll_explicit", "ot", 1]]}], "r": [[0.00023608156506238858], 0, 1.6297359466552734, 1544119802.7853658], "v": 0.1}
{"i": ["cuda", "conv2d_no_batching", [1, 7, 7, 512, 512, 3, 3, [1, 1], [1, 1]], {}, ["conv2d_no_batching", 1, 7, 7, 512, 512, 3, 3, [1, 1], [1, 1]], {"i": 4327434, "t": "", "c": null, "e": [["tile_f", "sp", [32, 1, 16, 1]], ["tile_y", "sp", [1, 1, 7, 1]], ["tile_x", "sp", [1, 7, 1, 1]], ["tile_rc", "sp", [128, 1, 4]], ["tile_ry", "sp", [1, 3, 1]], ["tile_rx", "sp", [1, 3, 1]], ["auto_unroll_max_step", "ot", 1500], ["unroll_explicit", "ot", 0]]}], "r": [[0.00021080296256684492], 0, 1.7376089096069336, 1544119804.0154283], "v": 0.1}
{"i": ["cuda", "conv2d_no_batching", [1, 7, 7, 512, 512, 3, 3, [1, 1], [1, 1]], {}, ["conv2d_no_batching", 1, 7, 7, 512, 512, 3, 3, [1, 1], [1, 1]], {"i": 8393034, "t": "", "c": null, "e": [["tile_f", "sp", [32, 1, 16, 1]], ["tile_y", "sp", [1, 1, 7, 1]], ["tile_x", "sp", [1, 7, 1, 1]], ["tile_rc", "sp", [128, 1, 4]], ["tile_ry", "sp", [1, 3, 1]], ["tile_rx", "sp", [1, 1, 3]], ["auto_unroll_max_step", "ot", 512], ["unroll_explicit", "ot", 1]]}], "r": [[0.00028758141889483063], 0, 1.8262510299682617, 1544119805.3887663], "v": 0.1}
{"i": ["cuda", "conv2d_no_batching", [1, 7, 7, 512, 512, 3, 3, [1, 1], [1, 1]], {}, ["conv2d_no_batching", 1, 7, 7, 512, 512, 3, 3, [1, 1], [1, 1]], {"i": 6263434, "t": "", "c": null, "e": [["tile_f", "sp", [32, 1, 16, 1]], ["tile_y", "sp", [1, 1, 7, 1]], ["tile_x", "sp", [1, 7, 1, 1]], ["tile_rc", "sp", [128, 1, 4]], ["tile_ry", "sp", [1, 1, 3]], ["tile_rx", "sp", [1, 3, 1]], ["auto_unroll_max_step", "ot", 0], ["unroll_explicit", "ot", 1]]}], "r": [[0.00019341545989304813], 0, 1.630094289779663, 1544119806.565222], "v": 0.1}
{"i": ["cuda", "conv2d_no_batching", [1, 7, 7, 512, 512, 3, 3, [1, 1], [1, 1]], {}, ["conv2d_no_batching", 1, 7, 7, 512, 512, 3, 3, [1, 1], [1, 1]], {"i": 2585034, "t": "", "c": null, "e": [["tile_f", "sp", [32, 1, 16, 1]], ["tile_y", "sp", [1, 1, 7, 1]], ["tile_x", "sp", [1, 7, 1, 1]], ["tile_rc", "sp", [128, 1, 4]], ["tile_ry", "sp", [1, 3, 1]], ["tile_rx", "sp", [1, 3, 1]], ["auto_unroll_max_step", "ot", 512], ["unroll_explicit", "ot", 0]]}], "r": [[0.00019457279144385027], 0, 1.7034757137298584, 1544119807.8162694], "v": 0.1}
{"i": ["cuda", "conv2d_no_batching", [1, 7, 7, 512, 512, 3, 3, [1, 1], [1, 1]], {}, ["conv2d_no_batching", 1, 7, 7, 512, 512, 3, 3, [1, 1], [1, 1]], {"i": 3165834, "t": "", "c": null, "e": [["tile_f", "sp", [32, 1, 16, 1]], ["tile_y", "sp", [1, 1, 7, 1]], ["tile_x", "sp", [1, 7, 1, 1]], ["tile_rc", "sp", [128, 1, 4]], ["tile_ry", "sp", [1, 3, 1]], ["tile_rx", "sp", [1, 1, 3]], ["auto_unroll_max_step", "ot", 512], ["unroll_explicit", "ot", 0]]}], "r": [[0.00026739876648841356], 0, 1.8718814849853516, 1544119809.174287], "v": 0.1}
{"i": ["cuda", "conv2d_no_batching", [1, 7, 7, 512, 512, 3, 3, [1, 1], [1, 1]], {}, ["conv2d_no_batching", 1, 7, 7, 512, 512, 3, 3, [1, 1], [1, 1]], {"i": 8005840, "t": "", "c": null, "e": [["tile_f", "sp", [16, 1, 32, 1]], ["tile_y", "sp", [1, 1, 7, 1]], ["tile_x", "sp", [1, 7, 1, 1]], ["tile_rc", "sp", [128, 1, 4]], ["tile_ry", "sp", [1, 1, 3]], ["tile_rx", "sp", [1, 3, 1]], ["auto_unroll_max_step", "ot", 512], ["unroll_explicit", "ot", 1]]}], "r": [[0.0002188735026737968], 0, 1.7434985637664795, 1544119810.4493678], "v": 0.1}
{"i": ["cuda", "conv2d_no_batching", [1, 7, 7, 512, 512, 3, 3, [1, 1], [1, 1]], {}, ["conv2d_no_batching", 1, 7, 7, 512, 512, 3, 3, [1, 1], [1, 1]], {"i": 10135434, "t": "", "c": null, "e": [["tile_f", "sp", [32, 1, 16, 1]], ["tile_y", "sp", [1, 1, 7, 1]], ["tile_x", "sp", [1, 7, 1, 1]], ["tile_rc", "sp", [128, 1, 4]], ["tile_ry", "sp", [1, 3, 1]], ["tile_rx", "sp", [1, 1, 3]], ["auto_unroll_max_step", "ot", 1500], ["unroll_explicit", "ot", 1]]}], "r": [[0.00020206487165775401], 0, 1.806697130203247, 1544119811.6590443], "v": 0.1}
{"i": ["cuda", "conv2d_no_batching", [1, 7, 7, 512, 512, 3, 3, [1, 1], [1, 1]], {}, ["conv2d_no_batching", 1, 7, 7, 512, 512, 3, 3, [1, 1], [1, 1]], {"i": 2746074, "t": "", "c": null, "e": [["tile_f", "sp", [32, 1, 16, 1]], ["tile_y", "sp", [1, 1, 7, 1]], ["tile_x", "sp", [7, 1, 1, 1]], ["tile_rc", "sp", [256, 1, 2]], ["tile_ry", "sp", [1, 1, 3]], ["tile_rx", "sp", [1, 3, 1]], ["auto_unroll_max_step", "ot", 512], ["unroll_explicit", "ot", 0]]}], "r": [[0.00022326899643493762], 0, 1.7399194240570068, 1544119812.9891915], "v": 0.1}
{"i": ["cuda", "conv2d_no_batching", [1, 7, 7, 512, 512, 3, 3, [1, 1], [1, 1]], {}, ["conv2d_no_batching", 1, 7, 7, 512, 512, 3, 3, [1, 1], [1, 1]], {"i": 4489348, "t": "", "c": null, "e": [["tile_f", "sp", [32, 2, 8, 1]], ["tile_y", "sp", [1, 1, 7, 1]], ["tile_x", "sp", [1, 7, 1, 1]], ["tile_rc", "sp", [256, 1, 2]], ["tile_ry", "sp", [1, 1, 3]], ["tile_rx", "sp", [1, 3, 1]], ["auto_unroll_max_step", "ot", 1500], ["unroll_explicit", "ot", 0]]}], "r": [[0.0002995448342245989], 0, 1.8686246871948242, 1544119814.3688035], "v": 0.1}
{"i": ["cuda", "conv2d_no_batching", [1, 7, 7, 512, 512, 3, 3, [1, 1], [1, 1]], {}, ["conv2d_no_batching", 1, 7, 7, 512, 512, 3, 3, [1, 1], [1, 1]], {"i": 7812234, "t": "", "c": null, "e": [["tile_f", "sp", [32, 1, 16, 1]], ["tile_y", "sp", [1, 1, 7, 1]], ["tile_x", "sp", [1, 7, 1, 1]], ["tile_rc", "sp", [128, 1, 4]], ["tile_ry", "sp", [1, 3, 1]], ["tile_rx", "sp", [1, 3, 1]], ["auto_unroll_max_step", "ot", 512], ["unroll_explicit", "ot", 1]]}], "r": [[0.00021391964705882354], 0, 1.7493133544921875, 1544119815.590755], "v": 0.1}
{"i": ["cuda", "conv2d_no_batching", [1, 7, 7, 512, 512, 3, 3, [1, 1], [1, 1]], {}, ["conv2d_no_batching", 1, 7, 7, 512, 512, 3, 3, [1, 1], [1, 1]], {"i": 2750475, "t": "", "c": null, "e": [["tile_f", "sp", [16, 2, 16, 1]], ["tile_y", "sp", [1, 1, 7, 1]], ["tile_x", "sp", [1, 7, 1, 1]], ["tile_rc", "sp", [128, 2, 2]], ["tile_ry", "sp", [1, 1, 3]], ["tile_rx", "sp", [1, 3, 1]], ["auto_unroll_max_step", "ot", 512], ["unroll_explicit", "ot", 0]]}], "r": [[0.0002372772085561497], 0, 1.8893094062805176, 1544119816.9752915], "v": 0.1}
{"i": ["cuda", "conv2d_no_batching", [1, 7, 7, 512, 512, 3, 3, [1, 1], [1, 1]], {}, ["conv2d_no_batching", 1, 7, 7, 512, 512, 3, 3, [1, 1], [1, 1]], {"i": 9747354, "t": "", "c": null, "e": [["tile_f", "sp", [32, 1, 16, 1]], ["tile_y", "sp", [1, 1, 7, 1]], ["tile_x", "sp", [7, 1, 1, 1]], ["tile_rc", "sp", [128, 1, 4]], ["tile_ry", "sp", [1, 1, 3]], ["tile_rx", "sp", [1, 3, 1]], ["auto_unroll_max_step", "ot", 1500], ["unroll_explicit", "ot", 1]]}], "r": [[0.00022100991800356505], 0, 1.6830964088439941, 1544119818.20402], "v": 0.1}
{"i": ["cuda", "conv2d_no_batching", [1, 7, 7, 512, 512, 3, 3, [1, 1], [1, 1]], {}, ["conv2d_no_batching", 1, 7, 7, 512, 512, 3, 3, [1, 1], [1, 1]], {"i": 2778640, "t": "", "c": null, "e": [["tile_f", "sp", [16, 1, 32, 1]], ["tile_y", "sp", [1, 1, 7, 1]], ["tile_x", "sp", [1, 7, 1, 1]], ["tile_rc", "sp", [128, 1, 4]], ["tile_ry", "sp", [1, 1, 3]], ["tile_rx", "sp", [1, 3, 1]], ["auto_unroll_max_step", "ot", 512], ["unroll_explicit", "ot", 0]]}], "r": [[0.0002156743796791444], 0, 1.7220778465270996, 1544119819.522422], "v": 0.1}
{"i": ["cuda", "conv2d_no_batching", [1, 7, 7, 512, 512, 3, 3, [1, 1], [1, 1]], {}, ["conv2d_no_batching", 1, 7, 7, 512, 512, 3, 3, [1, 1], [1, 1]], {"i": 7976794, "t": "", "c": null, "e": [["tile_f", "sp", [32, 1, 16, 1]], ["tile_y", "sp", [1, 1, 7, 1]], ["tile_x", "sp", [7, 1, 1, 1]], ["tile_rc", "sp", [128, 2, 2]], ["tile_ry", "sp", [1, 1, 3]], ["tile_rx", "sp", [1, 3, 1]], ["auto_unroll_max_step", "ot", 512], ["unroll_explicit", "ot", 1]]}], "r": [[0.00021814742245989305], 0, 1.7323949337005615, 1544119820.7779431], "v": 0.1}
{"i": ["cuda", "conv2d_no_batching", [1, 7, 7, 512, 512, 3, 3, [1, 1], [1, 1]], {}, ["conv2d_no_batching", 1, 7, 7, 512, 512, 3, 3, [1, 1], [1, 1]], {"i": 8558474, "t": "", "c": null, "e": [["tile_f", "sp", [32, 1, 16, 1]], ["tile_y", "sp", [1, 1, 7, 1]], ["tile_x", "sp", [1, 7, 1, 1]], ["tile_rc", "sp", [128, 2, 2]], ["tile_ry", "sp", [1, 1, 3]], ["tile_rx", "sp", [1, 1, 3]], ["auto_unroll_max_step", "ot", 512], ["unroll_explicit", "ot", 1]]}], "r": [[0.00020083835294117648], 0, 1.7672712802886963, 1544119822.0515027], "v": 0.1}
{"i": ["cuda", "conv2d_no_batching", [1, 7, 7, 512, 512, 3, 3, [1, 1], [1, 1]], {}, ["conv2d_no_batching", 1, 7, 7, 512, 512, 3, 3, [1, 1], [1, 1]], {"i": 8526794, "t": "", "c": null, "e": [["tile_f", "sp", [32, 1, 16, 1]], ["tile_y", "sp", [1, 1, 7, 1]], ["tile_x", "sp", [1, 7, 1, 1]], ["tile_rc", "sp", [128, 4, 1]], ["tile_ry", "sp", [1, 1, 3]], ["tile_rx", "sp", [1, 1, 3]], ["auto_unroll_max_step", "ot", 512], ["unroll_explicit", "ot", 1]]}], "r": [[0.00021234925490196078], 0, 1.7169063091278076, 1544119823.2494142], "v": 0.1}
{"i": ["cuda", "conv2d_no_batching", [1, 7, 7, 512, 512, 3, 3, [1, 1], [1, 1]], {}, ["conv2d_no_batching", 1, 7, 7, 512, 512, 3, 3, [1, 1], [1, 1]], {"i": 4521035, "t": "", "c": null, "e": [["tile_f", "sp", [16, 2, 16, 1]], ["tile_y", "sp", [1, 1, 7, 1]], ["tile_x", "sp", [1, 7, 1, 1]], ["tile_rc", "sp", [128, 1, 4]], ["tile_ry", "sp", [1, 1, 3]], ["tile_rx", "sp", [1, 3, 1]], ["auto_unroll_max_step", "ot", 1500], ["unroll_explicit", "ot", 0]]}], "r": [[0.0002649057878787879], 0, 2.007218599319458, 1544119824.747583], "v": 0.1}
{"i": ["cuda", "conv2d_no_batching", [1, 7, 7, 512, 512, 3, 3, [1, 1], [1, 1]], {}, ["conv2d_no_batching", 1, 7, 7, 512, 512, 3, 3, [1, 1], [1, 1]], {"i": 2746955, "t": "", "c": null, "e": [["tile_f", "sp", [16, 2, 16, 1]], ["tile_y", "sp", [1, 1, 7, 1]], ["tile_x", "sp", [1, 7, 1, 1]], ["tile_rc", "sp", [256, 1, 2]], ["tile_ry", "sp", [1, 1, 3]], ["tile_rx", "sp", [1, 3, 1]], ["auto_unroll_max_step", "ot", 512], ["unroll_explicit", "ot", 0]]}], "r": [[0.0003409515062388592], 0, 2.0339136123657227, 1544119826.2733264], "v": 0.1}
{"i": ["cuda", "conv2d_no_batching", [1, 7, 7, 512, 512, 3, 3, [1, 1], [1, 1]], {}, ["conv2d_no_batching", 1, 7, 7, 512, 512, 3, 3, [1, 1], [1, 1]], {"i": 1008074, "t": "", "c": null, "e": [["tile_f", "sp", [32, 1, 16, 1]], ["tile_y", "sp", [1, 1, 7, 1]], ["tile_x", "sp", [1, 7, 1, 1]], ["tile_rc", "sp", [128, 2, 2]], ["tile_ry", "sp", [1, 1, 3]], ["tile_rx", "sp", [1, 3, 1]], ["auto_unroll_max_step", "ot", 0], ["unroll_explicit", "ot", 0]]}], "r": [[0.00018589657219251338], 0, 1.6718592643737793, 1544119827.5406039], "v": 0.1}
{"i": ["cuda", "conv2d_no_batching", [1, 7, 7, 512, 512, 3, 3, [1, 1], [1, 1]], {}, ["conv2d_no_batching", 1, 7, 7, 512, 512, 3, 3, [1, 1], [1, 1]], {"i": 8361354, "t": "", "c": null, "e": [["tile_f", "sp", [32, 1, 16, 1]], ["tile_y", "sp", [1, 1, 7, 1]], ["tile_x", "sp", [1, 7, 1, 1]], ["tile_rc", "sp", [256, 1, 2]], ["tile_ry", "sp", [1, 3, 1]], ["tile_rx", "sp", [1, 1, 3]], ["auto_unroll_max_step", "ot", 512], ["unroll_explicit", "ot", 1]]}], "r": [[0.0003017020196078431], 0, 1.856123447418213, 1544119828.9486065], "v": 0.1}
{"i": ["cuda", "conv2d_no_batching", [1, 7, 7, 512, 512, 3, 3, [1, 1], [1, 1]], {}, ["conv2d_no_batching", 1, 7, 7, 512, 512, 3, 3, [1, 1], [1, 1]], {"i": 2777754, "t": "", "c": null, "e": [["tile_f", "sp", [32, 1, 16, 1]], ["tile_y", "sp", [1, 1, 7, 1]], ["tile_x", "sp", [7, 1, 1, 1]], ["tile_rc", "sp", [128, 1, 4]], ["tile_ry", "sp", [1, 1, 3]], ["tile_rx", "sp", [1, 3, 1]], ["auto_unroll_max_step", "ot", 512], ["unroll_explicit", "ot", 0]]}], "r": [[0.0002151325935828877], 0, 1.7143385410308838, 1544119830.2152648], "v": 0.1}
{"i": ["cuda", "conv2d_no_batching", [1, 7, 7, 512, 512, 3, 3, [1, 1], [1, 1]], {}, ["conv2d_no_batching", 1, 7, 7, 512, 512, 3, 3, [1, 1], [1, 1]], {"i": 8364874, "t": "", "c": null, "e": [["tile_f", "sp", [32, 1, 16, 1]], ["tile_y", "sp", [1, 1, 7, 1]], ["tile_x", "sp", [1, 7, 1, 1]], ["tile_rc", "sp", [128, 2, 2]], ["tile_ry", "sp", [1, 3, 1]], ["tile_rx", "sp", [1, 1, 3]], ["auto_unroll_max_step", "ot", 512], ["unroll_explicit", "ot", 1]]}], "r": [[0.00019624701604278074], 0, 1.7534286975860596, 1544119831.4990716], "v": 0.1}
{"i": ["cuda", "conv2d_no_batching", [1, 7, 7, 512, 512, 3, 3, [1, 1], [1, 1]], {}, ["conv2d_no_batching", 1, 7, 7, 512, 512, 3, 3, [1, 1], [1, 1]], {"i": 10269194, "t": "", "c": null, "e": [["tile_f", "sp", [32, 1, 16, 1]], ["tile_y", "sp", [1, 1, 7, 1]], ["tile_x", "sp", [1, 7, 1, 1]], ["tile_rc", "sp", [128, 4, 1]], ["tile_ry", "sp", [1, 1, 3]], ["tile_rx", "sp", [1, 1, 3]], ["auto_unroll_max_step", "ot", 1500], ["unroll_explicit", "ot", 1]]}], "r": [[0.0001886644048], 0, 1.8572051525115967, 1544119977.389505], "v": 0.1}
{"i": ["cuda", "conv2d_no_batching", [1, 7, 7, 512, 512, 3, 3, [1, 1], [1, 1]], {}, ["conv2d_no_batching", 1, 7, 7, 512, 512, 3, 3, [1, 1], [1, 1]], {"i": 5041994, "t": "", "c": null, "e": [["tile_f", "sp", [32, 1, 16, 1]], ["tile_y", "sp", [1, 1, 7, 1]], ["tile_x", "sp", [1, 7, 1, 1]], ["tile_rc", "sp", [128, 4, 1]], ["tile_ry", "sp", [1, 1, 3]], ["tile_rx", "sp", [1, 1, 3]], ["auto_unroll_max_step", "ot", 1500], ["unroll_explicit", "ot", 0]]}], "r": [[0.0002348724448], 0, 1.900242567062378, 1544119978.8212306], "v": 0.1}
{"i": ["cuda", "conv2d_no_batching", [1, 7, 7, 512, 512, 3, 3, [1, 1], [1, 1]], {}, ["conv2d_no_batching", 1, 7, 7, 512, 512, 3, 3, [1, 1], [1, 1]], {"i": 10300874, "t": "", "c": null, "e": [["tile_f", "sp", [32, 1, 16, 1]], ["tile_y", "sp", [1, 1, 7, 1]], ["tile_x", "sp", [1, 7, 1, 1]], ["tile_rc", "sp", [128, 2, 2]], ["tile_ry", "sp", [1, 1, 3]], ["tile_rx", "sp", [1, 1, 3]], ["auto_unroll_max_step", "ot", 1500], ["unroll_explicit", "ot", 1]]}], "r": [[0.00018141798719999998], 0, 1.8521020412445068, 1544119980.076516], "v": 0.1}
{"i": ["cuda", "conv2d_no_batching", [1, 7, 7, 512, 512, 3, 3, [1, 1], [1, 1]], {}, ["conv2d_no_batching", 1, 7, 7, 512, 512, 3, 3, [1, 1], [1, 1]], {"i": 6784394, "t": "", "c": null, "e": [["tile_f", "sp", [32, 1, 16, 1]], ["tile_y", "sp", [1, 1, 7, 1]], ["tile_x", "sp", [1, 7, 1, 1]], ["tile_rc", "sp", [128, 4, 1]], ["tile_ry", "sp", [1, 1, 3]], ["tile_rx", "sp", [1, 1, 3]], ["auto_unroll_max_step", "ot", 0], ["unroll_explicit", "ot", 1]]}], "r": [[0.0001881717392], 0, 1.6178724765777588, 1544119981.2758155], "v": 0.1}
{"i": ["cuda", "conv2d_no_batching", [1, 7, 7, 512, 512, 3, 3, [1, 1], [1, 1]], {}, ["conv2d_no_batching", 1, 7, 7, 512, 512, 3, 3, [1, 1], [1, 1]], {"i": 9748240, "t": "", "c": null, "e": [["tile_f", "sp", [16, 1, 32, 1]], ["tile_y", "sp", [1, 1, 7, 1]], ["tile_x", "sp", [1, 7, 1, 1]], ["tile_rc", "sp", [128, 1, 4]], ["tile_ry", "sp", [1, 1, 3]], ["tile_rx", "sp", [1, 3, 1]], ["auto_unroll_max_step", "ot", 1500], ["unroll_explicit", "ot", 1]]}], "r": [[0.0002093938592], 0, 1.9185032844543457, 1544119982.639446], "v": 0.1}
{"i": ["cuda", "conv2d_no_batching", [1, 7, 7, 512, 512, 3, 3, [1, 1], [1, 1]], {}, ["conv2d_no_batching", 1, 7, 7, 512, 512, 3, 3, [1, 1], [1, 1]], {"i": 9749114, "t": "", "c": null, "e": [["tile_f", "sp", [32, 1, 16, 1]], ["tile_y", "sp", [1, 1, 7, 1]], ["tile_x", "sp", [1, 1, 7, 1]], ["tile_rc", "sp", [128, 1, 4]], ["tile_ry", "sp", [1, 1, 3]], ["tile_rx", "sp", [1, 3, 1]], ["auto_unroll_max_step", "ot", 1500], ["unroll_explicit", "ot", 1]]}], "r": [[0.0005102151312], 0, 2.280773639678955, 1544119984.5173717], "v": 0.1}
{"i": ["cuda", "conv2d_no_batching", [1, 7, 7, 512, 512, 3, 3, [1, 1], [1, 1]], {}, ["conv2d_no_batching", 1, 7, 7, 512, 512, 3, 3, [1, 1], [1, 1]], {"i": 6235274, "t": "", "c": null, "e": [["tile_f", "sp", [32, 1, 16, 1]], ["tile_y", "sp", [1, 1, 7, 1]], ["tile_x", "sp", [1, 7, 1, 1]], ["tile_rc", "sp", [128, 2, 2]], ["tile_ry", "sp", [1, 1, 3]], ["tile_rx", "sp", [1, 3, 1]], ["auto_unroll_max_step", "ot", 0], ["unroll_explicit", "ot", 1]]}], "r": [[0.00019143396319999998], 0, 1.720923900604248, 1544119985.7556977], "v": 0.1}
