resnet18-ablation/tmp/resnet-18-curve.log
{"i": ["cuda -model=unknown", "topi_nn_conv2d", [["TENSOR", [1, 512, 7, 7], "float32"], ["TENSOR", [512, 512, 3, 3], "float32"], [1, 1], [1, 1], [1, 1], "NCHW", "float32"], {}, ["conv2d", [1, 512, 7, 7, "float32"], [512, 512, 3, 3, "float32"], [1, 1], [1, 1], [1, 1], "NCHW", "float32"], {"i": 264029, "t": "winograd", "c": null, "e": [["tile_b", "sp", [16, 1, 1, 1]], ["tile_y", "sp", [16, 4, 8, 1]], ["tile_x", "sp", [2, 2, 4, 1]], ["tile_rc", "sp", [32, 16]], ["auto_unroll_max_step", "ot", 0], ["unroll_explicit", "ot", 1]]}], "r": [[7.44831e-05], 0, 1.08998703956604, 1543885736.475417], "v": 0.1}
{"i": ["cuda -model=unknown", "topi_nn_conv2d", [["TENSOR", [1, 256, 14, 14], "float32"], ["TENSOR", [512, 256, 1, 1], "float32"], [2, 2], [0, 0], [1, 1], "NCHW", "float32"], {}, ["conv2d", [1, 256, 14, 14, "float32"], [512, 256, 1, 1, "float32"], [2, 2], [0, 0], [1, 1], "NCHW", "float32"], {"i": 107439, "t": "direct", "c": null, "e": [["tile_f", "sp", [32, 1, 8, 2]], ["tile_y", "sp", [7, 1, 1, 1]], ["tile_x", "sp", [1, 1, 7, 1]], ["tile_rc", "sp", [32, 8]], ["tile_ry", "sp", [1, 1]], ["tile_rx", "sp", [1, 1]], ["auto_unroll_max_step", "ot", 0], ["unroll_explicit", "ot", 1]]}], "r": [[1.63352e-05], 0, 0.8937311172485352, 1543887255.695872], "v": 0.1}
{"i": ["cuda -model=unknown", "topi_nn_conv2d", [["TENSOR", [1, 256, 14, 14], "float32"], ["TENSOR", [512, 256, 3, 3], "float32"], [2, 2], [1, 1], [1, 1], "NCHW", "float32"], {}, ["conv2d", [1, 256, 14, 14, "float32"], [512, 256, 3, 3, "float32"], [2, 2], [1, 1], [1, 1], "NCHW", "float32"], {"i": 737481, "t": "direct", "c": null, "e": [["tile_f", "sp", [8, 2, 32, 1]], ["tile_y", "sp", [7, 1, 1, 1]], ["tile_x", "sp", [1, 1, 7, 1]], ["tile_rc", "sp", [64, 4]], ["tile_ry", "sp", [1, 3]], ["tile_rx", "sp", [1, 3]], ["auto_unroll_max_step", "ot", 1500], ["unroll_explicit", "ot", 1]]}], "r": [[0.00010793129999999999], 0, 1.1943230628967285, 1543889480.7306414], "v": 0.1}
{"i": ["cuda -model=unknown", "topi_nn_conv2d", [["TENSOR", [1, 256, 14, 14], "float32"], ["TENSOR", [256, 256, 3, 3], "float32"], [1, 1], [1, 1], [1, 1], "NCHW", "float32"], {}, ["conv2d", [1, 256, 14, 14, "float32"], [256, 256, 3, 3, "float32"], [1, 1], [1, 1], [1, 1], "NCHW", "float32"], {"i": 50887, "t": "winograd", "c": null, "e": [["tile_b", "sp", [16, 1, 1, 1]], ["tile_y", "sp", [8, 2, 8, 2]], ["tile_x", "sp", [1, 1, 7, 7]], ["tile_rc", "sp", [32, 8]], ["auto_unroll_max_step", "ot", 0], ["unroll_explicit", "ot", 1]]}], "r": [[4.891645e-05], 0, 1.126673698425293, 1543891364.653872], "v": 0.1}
{"i": ["cuda -model=unknown", "topi_nn_conv2d", [["TENSOR", [1, 128, 28, 28], "float32"], ["TENSOR", [256, 128, 1, 1], "float32"], [2, 2], [0, 0], [1, 1], "NCHW", "float32"], {}, ["conv2d", [1, 128, 28, 28, "float32"], [256, 128, 1, 1, "float32"], [2, 2], [0, 0], [1, 1], "NCHW", "float32"], {"i": 485854, "t": "direct", "c": null, "e": [["tile_f", "sp", [16, 1, 4, 4]], ["tile_y", "sp", [14, 1, 1, 1]], ["tile_x", "sp", [1, 1, 14, 1]], ["tile_rc", "sp", [16, 8]], ["tile_ry", "sp", [1, 1]], ["tile_rx", "sp", [1, 1]], ["auto_unroll_max_step", "ot", 512], ["unroll_explicit", "ot", 0]]}], "r": [[1.13585e-05], 0, 0.942753791809082, 1543892185.5810006], "v": 0.1}
{"i": ["cuda -model=unknown", "topi_nn_conv2d", [["TENSOR", [1, 128, 28, 28], "float32"], ["TENSOR", [256, 128, 3, 3], "float32"], [2, 2], [1, 1], [1, 1], "NCHW", "float32"], {}, ["conv2d", [1, 128, 28, 28, "float32"], [256, 128, 3, 3, "float32"], [2, 2], [1, 1], [1, 1], "NCHW", "float32"], {"i": 7872706, "t": "direct", "c": null, "e": [["tile_f", "sp", [16, 2, 4, 2]], ["tile_y", "sp", [7, 2, 1, 1]], ["tile_x", "sp", [2, 1, 7, 1]], ["tile_rc", "sp", [32, 4]], ["tile_ry", "sp", [1, 3]], ["tile_rx", "sp", [1, 3]], ["auto_unroll_max_step", "ot", 1500], ["unroll_explicit", "ot", 1]]}], "r": [[5.688975e-05], 0, 1.3707482814788818, 1543895271.1121294], "v": 0.1}
{"i": ["cuda -model=unknown", "topi_nn_conv2d", [["TENSOR", [1, 128, 28, 28], "float32"], ["TENSOR", [128, 128, 3, 3], "float32"], [1, 1], [1, 1], [1, 1], "NCHW", "float32"], {}, ["conv2d", [1, 128, 28, 28, "float32"], [128, 128, 3, 3, "float32"], [1, 1], [1, 1], [1, 1], "NCHW", "float32"], {"i": 351555, "t": "winograd", "c": null, "e": [["tile_b", "sp", [16, 1, 1, 1]], ["tile_y", "sp", [8, 1, 4, 4]], ["tile_x", "sp", [1, 7, 28, 1]], ["tile_rc", "sp", [4, 32]], ["auto_unroll_max_step", "ot", 0], ["unroll_explicit", "ot", 1]]}], "r": [[4.3349799999999996e-05], 0, 1.147998571395874, 1543896161.9003737], "v": 0.1}
{"i": ["cuda -model=unknown", "topi_nn_conv2d", [["TENSOR", [1, 64, 56, 56], "float32"], ["TENSOR", [128, 64, 1, 1], "float32"], [2, 2], [0, 0], [1, 1], "NCHW", "float32"], {}, ["conv2d", [1, 64, 56, 56, "float32"], [128, 64, 1, 1, "float32"], [2, 2], [0, 0], [1, 1], "NCHW", "float32"], {"i": 4331902, "t": "direct", "c": null, "e": [["tile_f", "sp", [8, 2, 8, 1]], ["tile_y", "sp", [7, 2, 1, 2]], ["tile_x", "sp", [7, 1, 2, 2]], ["tile_rc", "sp", [32, 2]], ["tile_ry", "sp", [1, 1]], ["tile_rx", "sp", [1, 1]], ["auto_unroll_max_step", "ot", 0], ["unroll_explicit", "ot", 1]]}], "r": [[1.7824e-05], 0, 0.9624660015106201, 1543898022.816886], "v": 0.1}
{"i": ["cuda -model=unknown", "topi_nn_conv2d", [["TENSOR", [1, 64, 56, 56], "float32"], ["TENSOR", [128, 64, 3, 3], "float32"], [2, 2], [1, 1], [1, 1], "NCHW", "float32"], {}, ["conv2d", [1, 64, 56, 56, "float32"], [128, 64, 3, 3, "float32"], [2, 2], [1, 1], [1, 1], "NCHW", "float32"], {"i": 31152775, "t": "direct", "c": null, "e": [["tile_f", "sp", [4, 2, 8, 2]], ["tile_y", "sp", [14, 1, 2, 1]], ["tile_x", "sp", [7, 1, 4, 1]], ["tile_rc", "sp", [32, 2]], ["tile_ry", "sp", [1, 3]], ["tile_rx", "sp", [1, 3]], ["auto_unroll_max_step", "ot", 1500], ["unroll_explicit", "ot", 1]]}], "r": [[5.148885e-05], 0, 1.1200556755065918, 1543900545.0870702], "v": 0.1}
{"i": ["cuda -model=unknown", "topi_nn_conv2d", [["TENSOR", [1, 64, 56, 56], "float32"], ["TENSOR", [64, 64, 1, 1], "float32"], [1, 1], [0, 0], [1, 1], "NCHW", "float32"], {}, ["conv2d", [1, 64, 56, 56, "float32"], [64, 64, 1, 1, "float32"], [1, 1], [0, 0], [1, 1], "NCHW", "float32"], {"i": 4940481, "t": "direct", "c": null, "e": [["tile_f", "sp", [1, 8, 8, 1]], ["tile_y", "sp", [7, 2, 4, 1]], ["tile_x", "sp", [7, 2, 4, 1]], ["tile_rc", "sp", [16, 4]], ["tile_ry", "sp", [1, 1]], ["tile_rx", "sp", [1, 1]], ["auto_unroll_max_step", "ot", 512], ["unroll_explicit", "ot", 0]]}], "r": [[1.244225e-05], 0, 0.9802656173706055, 1543902141.9768252], "v": 0.1}
{"i": ["cuda -model=unknown", "topi_nn_conv2d", [["TENSOR", [1, 64, 56, 56], "float32"], ["TENSOR", [64, 64, 3, 3], "float32"], [1, 1], [1, 1], [1, 1], "NCHW", "float32"], {}, ["conv2d", [1, 64, 56, 56, "float32"], [64, 64, 3, 3, "float32"], [1, 1], [1, 1], [1, 1], "NCHW", "float32"], {"i": 263333, "t": "winograd", "c": null, "e": [["tile_b", "sp", [36, 1, 1, 1]], ["tile_y", "sp", [2, 1, 2, 16]], ["tile_x", "sp", [1, 2, 98, 1]], ["tile_rc", "sp", [8, 8]], ["auto_unroll_max_step", "ot", 128], ["unroll_explicit", "ot", 1]]}], "r": [[3.36736e-05], 0, 2.656053066253662, 1543903943.0540593], "v": 0.1}
{"i": ["cuda -model=unknown", "topi_nn_conv2d", [["TENSOR", [1, 3, 224, 224], "float32"], ["TENSOR", [64, 3, 7, 7], "float32"], [2, 2], [3, 3], [1, 1], "NCHW", "float32"], {}, ["conv2d", [1, 3, 224, 224, "float32"], [64, 3, 7, 7, "float32"], [2, 2], [3, 3], [1, 1], "NCHW", "float32"], {"i": 5103887, "t": "direct", "c": null, "e": [["tile_f", "sp", [1, 2, 16, 2]], ["tile_y", "sp", [112, 1, 1, 1]], ["tile_x", "sp", [7, 8, 2, 1]], ["tile_rc", "sp", [1, 3]], ["tile_ry", "sp", [1, 7]], ["tile_rx", "sp", [7, 1]], ["auto_unroll_max_step", "ot", 0], ["unroll_explicit", "ot", 0]]}], "r": [[8.160375e-05], 0, 1.096405029296875, 1543905957.570535], "v": 0.1}
