transfer-learning/final_results/conv2d_transfer_itervar_c12_c7.log
{"i": ["cuda", "conv2d_no_batching", [1, 28, 28, 128, 256, 3, 3, [2, 2], [1, 1]], {}, ["conv2d_no_batching", 1, 28, 28, 128, 256, 3, 3, [2, 2], [1, 1]], {"i": 55338742, "t": "", "c": null, "e": [["tile_f", "sp", [8, 2, 8, 1]], ["tile_y", "sp", [7, 1, 2, 1]], ["tile_x", "sp", [2, 1, 7, 1]], ["tile_rc", "sp", [128, 2, 1]], ["tile_ry", "sp", [1, 3, 1]], ["tile_rx", "sp", [1, 3, 1]], ["auto_unroll_max_step", "ot", 512], ["unroll_explicit", "ot", 1]]}], "r": [[0.00011306196535129933], 0, 1.265164852142334, 1544064726.978028], "v": 0.1}
{"i": ["cuda", "conv2d_no_batching", [1, 28, 28, 128, 256, 3, 3, [2, 2], [1, 1]], {}, ["conv2d_no_batching", 1, 28, 28, 128, 256, 3, 3, [2, 2], [1, 1]], {"i": 67780342, "t": "", "c": null, "e": [["tile_f", "sp", [8, 2, 8, 1]], ["tile_y", "sp", [7, 1, 2, 1]], ["tile_x", "sp", [2, 1, 7, 1]], ["tile_rc", "sp", [128, 2, 1]], ["tile_ry", "sp", [1, 3, 1]], ["tile_rx", "sp", [1, 3, 1]], ["auto_unroll_max_step", "ot", 1500], ["unroll_explicit", "ot", 1]]}], "r": [[9.775000866217518e-05], 0, 1.2060396671295166, 1544064727.9364138], "v": 0.1}
{"i": ["cuda", "conv2d_no_batching", [1, 28, 28, 128, 256, 3, 3, [2, 2], [1, 1]], {}, ["conv2d_no_batching", 1, 28, 28, 128, 256, 3, 3, [2, 2], [1, 1]], {"i": 67807461, "t": "", "c": null, "e": [["tile_f", "sp", [16, 1, 8, 1]], ["tile_y", "sp", [2, 1, 7, 1]], ["tile_x", "sp", [7, 1, 2, 1]], ["tile_rc", "sp", [64, 4, 1]], ["tile_ry", "sp", [1, 3, 1]], ["tile_rx", "sp", [1, 3, 1]], ["auto_unroll_max_step", "ot", 1500], ["unroll_explicit", "ot", 1]]}], "r": [[0.00011340376034648701], 0, 1.374281883239746, 1544064728.9515576], "v": 0.1}
{"i": ["cuda", "conv2d_no_batching", [1, 28, 28, 128, 256, 3, 3, [2, 2], [1, 1]], {}, ["conv2d_no_batching", 1, 28, 28, 128, 256, 3, 3, [2, 2], [1, 1]], {"i": 67780341, "t": "", "c": null, "e": [["tile_f", "sp", [16, 1, 8, 1]], ["tile_y", "sp", [7, 1, 2, 1]], ["tile_x", "sp", [2, 1, 7, 1]], ["tile_rc", "sp", [128, 2, 1]], ["tile_ry", "sp", [1, 3, 1]], ["tile_rx", "sp", [1, 3, 1]], ["auto_unroll_max_step", "ot", 1500], ["unroll_explicit", "ot", 1]]}], "r": [[0.00012430919538017324], 0, 1.3457520008087158, 1544064729.9892335], "v": 0.1}
{"i": ["cuda", "conv2d_no_batching", [1, 28, 28, 128, 256, 3, 3, [2, 2], [1, 1]], {}, ["conv2d_no_batching", 1, 28, 28, 128, 256, 3, 3, [2, 2], [1, 1]], {"i": 68026106, "t": "", "c": null, "e": [["tile_f", "sp", [8, 1, 16, 1]], ["tile_y", "sp", [7, 1, 2, 1]], ["tile_x", "sp", [2, 1, 7, 1]], ["tile_rc", "sp", [128, 1, 2]], ["tile_ry", "sp", [1, 3, 1]], ["tile_rx", "sp", [1, 3, 1]], ["auto_unroll_max_step", "ot", 1500], ["unroll_explicit", "ot", 1]]}], "r": [[0.00012316465351299325], 0, 1.2990145683288574, 1544064731.010842], "v": 0.1}
{"i": ["cuda", "conv2d_no_batching", [1, 28, 28, 128, 256, 3, 3, [2, 2], [1, 1]], {}, ["conv2d_no_batching", 1, 28, 28, 128, 256, 3, 3, [2, 2], [1, 1]], {"i": 67811061, "t": "", "c": null, "e": [["tile_f", "sp", [16, 1, 8, 1]], ["tile_y", "sp", [7, 1, 2, 1]], ["tile_x", "sp", [2, 1, 7, 1]], ["tile_rc", "sp", [64, 4, 1]], ["tile_ry", "sp", [1, 3, 1]], ["tile_rx", "sp", [1, 3, 1]], ["auto_unroll_max_step", "ot", 1500], ["unroll_explicit", "ot", 1]]}], "r": [[0.00011298103753609239], 0, 1.3371405601501465, 1544064732.0343943], "v": 0.1}
{"i": ["cuda", "conv2d_no_batching", [1, 28, 28, 128, 256, 3, 3, [2, 2], [1, 1]], {}, ["conv2d_no_batching", 1, 28, 28, 128, 256, 3, 3, [2, 2], [1, 1]], {"i": 67780346, "t": "", "c": null, "e": [["tile_f", "sp", [8, 1, 16, 1]], ["tile_y", "sp", [7, 1, 2, 1]], ["tile_x", "sp", [2, 1, 7, 1]], ["tile_rc", "sp", [128, 2, 1]], ["tile_ry", "sp", [1, 3, 1]], ["tile_rx", "sp", [1, 3, 1]], ["auto_unroll_max_step", "ot", 1500], ["unroll_explicit", "ot", 1]]}], "r": [[0.00012135632146294514], 0, 1.3445477485656738, 1544064733.0473442], "v": 0.1}
{"i": ["cuda", "conv2d_no_batching", [1, 28, 28, 128, 256, 3, 3, [2, 2], [1, 1]], {}, ["conv2d_no_batching", 1, 28, 28, 128, 256, 3, 3, [2, 2], [1, 1]], {"i": 55365861, "t": "", "c": null, "e": [["tile_f", "sp", [16, 1, 8, 1]], ["tile_y", "sp", [2, 1, 7, 1]], ["tile_x", "sp", [7, 1, 2, 1]], ["tile_rc", "sp", [64, 4, 1]], ["tile_ry", "sp", [1, 3, 1]], ["tile_rx", "sp", [1, 3, 1]], ["auto_unroll_max_step", "ot", 512], ["unroll_explicit", "ot", 1]]}], "r": [[0.00011343295380173244], 0, 1.3242013454437256, 1544064734.0542018], "v": 0.1}
{"i": ["cuda", "conv2d_no_batching", [1, 28, 28, 128, 256, 3, 3, [2, 2], [1, 1]], {}, ["conv2d_no_batching", 1, 28, 28, 128, 256, 3, 3, [2, 2], [1, 1]], {"i": 55338746, "t": "", "c": null, "e": [["tile_f", "sp", [8, 1, 16, 1]], ["tile_y", "sp", [7, 1, 2, 1]], ["tile_x", "sp", [2, 1, 7, 1]], ["tile_rc", "sp", [128, 2, 1]], ["tile_ry", "sp", [1, 3, 1]], ["tile_rx", "sp", [1, 3, 1]], ["auto_unroll_max_step", "ot", 512], ["unroll_explicit", "ot", 1]]}], "r": [[0.00012138058999037535], 0, 1.3110778331756592, 1544064735.081591], "v": 0.1}
{"i": ["cuda", "conv2d_no_batching", [1, 28, 28, 128, 256, 3, 3, [2, 2], [1, 1]], {}, ["conv2d_no_batching", 1, 28, 28, 128, 256, 3, 3, [2, 2], [1, 1]], {"i": 55584506, "t": "", "c": null, "e": [["tile_f", "sp", [8, 1, 16, 1]], ["tile_y", "sp", [7, 1, 2, 1]], ["tile_x", "sp", [2, 1, 7, 1]], ["tile_rc", "sp", [128, 1, 2]], ["tile_ry", "sp", [1, 3, 1]], ["tile_rx", "sp", [1, 3, 1]], ["auto_unroll_max_step", "ot", 512], ["unroll_explicit", "ot", 1]]}], "r": [[0.00012308118383060635], 0, 1.2866904735565186, 1544064736.110568], "v": 0.1}
{"i": ["cuda", "conv2d_no_batching", [1, 28, 28, 128, 256, 3, 3, [2, 2], [1, 1]], {}, ["conv2d_no_batching", 1, 28, 28, 128, 256, 3, 3, [2, 2], [1, 1]], {"i": 55338741, "t": "", "c": null, "e": [["tile_f", "sp", [16, 1, 8, 1]], ["tile_y", "sp", [7, 1, 2, 1]], ["tile_x", "sp", [2, 1, 7, 1]], ["tile_rc", "sp", [128, 2, 1]], ["tile_ry", "sp", [1, 3, 1]], ["tile_rx", "sp", [1, 3, 1]], ["auto_unroll_max_step", "ot", 512], ["unroll_explicit", "ot", 1]]}], "r": [[0.00012437236958614054], 0, 1.2696421146392822, 1544064737.1626928], "v": 0.1}
{"i": ["cuda", "conv2d_no_batching", [1, 28, 28, 128, 256, 3, 3, [2, 2], [1, 1]], {}, ["conv2d_no_batching", 1, 28, 28, 128, 256, 3, 3, [2, 2], [1, 1]], {"i": 55369461, "t": "", "c": null, "e": [["tile_f", "sp", [16, 1, 8, 1]], ["tile_y", "sp", [7, 1, 2, 1]], ["tile_x", "sp", [2, 1, 7, 1]], ["tile_rc", "sp", [64, 4, 1]], ["tile_ry", "sp", [1, 3, 1]], ["tile_rx", "sp", [1, 3, 1]], ["auto_unroll_max_step", "ot", 512], ["unroll_explicit", "ot", 1]]}], "r": [[0.00011295829740134746], 0, 1.2920136451721191, 1544064738.1605086], "v": 0.1}
{"i": ["cuda", "conv2d_no_batching", [1, 28, 28, 128, 256, 3, 3, [2, 2], [1, 1]], {}, ["conv2d_no_batching", 1, 28, 28, 128, 256, 3, 3, [2, 2], [1, 1]], {"i": 67801701, "t": "", "c": null, "e": [["tile_f", "sp", [16, 1, 8, 1]], ["tile_y", "sp", [2, 1, 7, 1]], ["tile_x", "sp", [7, 2, 1, 1]], ["tile_rc", "sp", [64, 4, 1]], ["tile_ry", "sp", [1, 3, 1]], ["tile_rx", "sp", [1, 3, 1]], ["auto_unroll_max_step", "ot", 1500], ["unroll_explicit", "ot", 1]]}], "r": [[0.0001311282521655438], 0, 1.4732122421264648, 1544064739.227626], "v": 0.1}
{"i": ["cuda", "conv2d_no_batching", [1, 28, 28, 128, 256, 3, 3, [2, 2], [1, 1]], {}, ["conv2d_no_batching", 1, 28, 28, 128, 256, 3, 3, [2, 2], [1, 1]], {"i": 18013942, "t": "", "c": null, "e": [["tile_f", "sp", [8, 2, 8, 1]], ["tile_y", "sp", [7, 1, 2, 1]], ["tile_x", "sp", [2, 1, 7, 1]], ["tile_rc", "sp", [128, 2, 1]], ["tile_ry", "sp", [1, 3, 1]], ["tile_rx", "sp", [1, 3, 1]], ["auto_unroll_max_step", "ot", 512], ["unroll_explicit", "ot", 0]]}], "r": [[0.00010462053416746873], 0, 1.206038236618042, 1544064740.205626], "v": 0.1}
{"i": ["cuda", "conv2d_no_batching", [1, 28, 28, 128, 256, 3, 3, [2, 2], [1, 1]], {}, ["conv2d_no_batching", 1, 28, 28, 128, 256, 3, 3, [2, 2], [1, 1]], {"i": 30455542, "t": "", "c": null, "e": [["tile_f", "sp", [8, 2, 8, 1]], ["tile_y", "sp", [7, 1, 2, 1]], ["tile_x", "sp", [2, 1, 7, 1]], ["tile_rc", "sp", [128, 2, 1]], ["tile_ry", "sp", [1, 3, 1]], ["tile_rx", "sp", [1, 3, 1]], ["auto_unroll_max_step", "ot", 1500], ["unroll_explicit", "ot", 0]]}], "r": [[0.00010464435611164581], 0, 1.2716271877288818, 1544064741.1812737], "v": 0.1}
{"i": ["cuda", "conv2d_no_batching", [1, 28, 28, 128, 256, 3, 3, [2, 2], [1, 1]], {}, ["conv2d_no_batching", 1, 28, 28, 128, 256, 3, 3, [2, 2], [1, 1]], {"i": 30455541, "t": "", "c": null, "e": [["tile_f", "sp", [16, 1, 8, 1]], ["tile_y", "sp", [7, 1, 2, 1]], ["tile_x", "sp", [2, 1, 7, 1]], ["tile_rc", "sp", [128, 2, 1]], ["tile_ry", "sp", [1, 3, 1]], ["tile_rx", "sp", [1, 3, 1]], ["auto_unroll_max_step", "ot", 1500], ["unroll_explicit", "ot", 0]]}], "r": [[0.00012412829355149183], 0, 1.327979564666748, 1544064742.227517], "v": 0.1}
{"i": ["cuda", "conv2d_no_batching", [1, 28, 28, 128, 256, 3, 3, [2, 2], [1, 1]], {}, ["conv2d_no_batching", 1, 28, 28, 128, 256, 3, 3, [2, 2], [1, 1]], {"i": 30482661, "t": "", "c": null, "e": [["tile_f", "sp", [16, 1, 8, 1]], ["tile_y", "sp", [2, 1, 7, 1]], ["tile_x", "sp", [7, 1, 2, 1]], ["tile_rc", "sp", [64, 4, 1]], ["tile_ry", "sp", [1, 3, 1]], ["tile_rx", "sp", [1, 3, 1]], ["auto_unroll_max_step", "ot", 1500], ["unroll_explicit", "ot", 0]]}], "r": [[0.00011467689220404235], 0, 1.2916302680969238, 1544064743.225195], "v": 0.1}
{"i": ["cuda", "conv2d_no_batching", [1, 28, 28, 128, 256, 3, 3, [2, 2], [1, 1]], {}, ["conv2d_no_batching", 1, 28, 28, 128, 256, 3, 3, [2, 2], [1, 1]], {"i": 67779986, "t": "", "c": null, "e": [["tile_f", "sp", [8, 1, 16, 1]], ["tile_y", "sp", [7, 2, 1, 1]], ["tile_x", "sp", [2, 1, 7, 1]], ["tile_rc", "sp", [128, 2, 1]], ["tile_ry", "sp", [1, 3, 1]], ["tile_rx", "sp", [1, 3, 1]], ["auto_unroll_max_step", "ot", 1500], ["unroll_explicit", "ot", 1]]}], "r": [[8.886602332580888e-05], 0, 1.2761292457580566, 1544064776.034982], "v": 0.1}
{"i": ["cuda", "conv2d_no_batching", [1, 28, 28, 128, 256, 3, 3, [2, 2], [1, 1]], {}, ["conv2d_no_batching", 1, 28, 28, 128, 256, 3, 3, [2, 2], [1, 1]], {"i": 30486261, "t": "", "c": null, "e": [["tile_f", "sp", [16, 1, 8, 1]], ["tile_y", "sp", [7, 1, 2, 1]], ["tile_x", "sp", [2, 1, 7, 1]], ["tile_rc", "sp", [64, 4, 1]], ["tile_ry", "sp", [1, 3, 1]], ["tile_rx", "sp", [1, 3, 1]], ["auto_unroll_max_step", "ot", 1500], ["unroll_explicit", "ot", 0]]}], "r": [[0.00011383504812319538], 0, 1.3372297286987305, 1544064745.1691878], "v": 0.1}
{"i": ["cuda", "conv2d_no_batching", [1, 28, 28, 128, 256, 3, 3, [2, 2], [1, 1]], {}, ["conv2d_no_batching", 1, 28, 28, 128, 256, 3, 3, [2, 2], [1, 1]], {"i": 67784175, "t": "", "c": null, "e": [["tile_f", "sp", [32, 1, 4, 1]], ["tile_y", "sp", [7, 1, 2, 1]], ["tile_x", "sp", [1, 1, 14, 1]], ["tile_rc", "sp", [128, 2, 1]], ["tile_ry", "sp", [1, 3, 1]], ["tile_rx", "sp", [1, 3, 1]], ["auto_unroll_max_step", "ot", 1500], ["unroll_explicit", "ot", 1]]}], "r": [[0.00012398180365736283], 0, 1.3184607028961182, 1544064746.2023857], "v": 0.1}
{"i": ["cuda", "conv2d_no_batching", [1, 28, 28, 128, 256, 3, 3, [2, 2], [1, 1]], {}, ["conv2d_no_batching", 1, 28, 28, 128, 256, 3, 3, [2, 2], [1, 1]], {"i": 18041061, "t": "", "c": null, "e": [["tile_f", "sp", [16, 1, 8, 1]], ["tile_y", "sp", [2, 1, 7, 1]], ["tile_x", "sp", [7, 1, 2, 1]], ["tile_rc", "sp", [64, 4, 1]], ["tile_ry", "sp", [1, 3, 1]], ["tile_rx", "sp", [1, 3, 1]], ["auto_unroll_max_step", "ot", 512], ["unroll_explicit", "ot", 0]]}], "r": [[0.00011466742733397497], 0, 1.3145558834075928, 1544064747.2182224], "v": 0.1}
{"i": ["cuda", "conv2d_no_batching", [1, 28, 28, 128, 256, 3, 3, [2, 2], [1, 1]], {}, ["conv2d_no_batching", 1, 28, 28, 128, 256, 3, 3, [2, 2], [1, 1]], {"i": 55338386, "t": "", "c": null, "e": [["tile_f", "sp", [8, 1, 16, 1]], ["tile_y", "sp", [7, 2, 1, 1]], ["tile_x", "sp", [2, 1, 7, 1]], ["tile_rc", "sp", [128, 2, 1]], ["tile_ry", "sp", [1, 3, 1]], ["tile_rx", "sp", [1, 3, 1]], ["auto_unroll_max_step", "ot", 512], ["unroll_explicit", "ot", 1]]}], "r": [[8.867349887133183e-05], 0, 1.3084282875061035, 1544064777.025443], "v": 0.1}
{"i": ["cuda", "conv2d_no_batching", [1, 28, 28, 128, 256, 3, 3, [2, 2], [1, 1]], {}, ["conv2d_no_batching", 1, 28, 28, 128, 256, 3, 3, [2, 2], [1, 1]], {"i": 55360101, "t": "", "c": null, "e": [["tile_f", "sp", [16, 1, 8, 1]], ["tile_y", "sp", [2, 1, 7, 1]], ["tile_x", "sp", [7, 2, 1, 1]], ["tile_rc", "sp", [64, 4, 1]], ["tile_ry", "sp", [1, 3, 1]], ["tile_rx", "sp", [1, 3, 1]], ["auto_unroll_max_step", "ot", 512], ["unroll_explicit", "ot", 1]]}], "r": [[0.00013216499711260826], 0, 1.4077866077423096, 1544064749.215439], "v": 0.1}
{"i": ["cuda", "conv2d_no_batching", [1, 28, 28, 128, 256, 3, 3, [2, 2], [1, 1]], {}, ["conv2d_no_batching", 1, 28, 28, 128, 256, 3, 3, [2, 2], [1, 1]], {"i": 67810702, "t": "", "c": null, "e": [["tile_f", "sp", [8, 2, 8, 1]], ["tile_y", "sp", [7, 2, 1, 1]], ["tile_x", "sp", [2, 1, 7, 1]], ["tile_rc", "sp", [64, 4, 1]], ["tile_ry", "sp", [1, 3, 1]], ["tile_rx", "sp", [1, 3, 1]], ["auto_unroll_max_step", "ot", 1500], ["unroll_explicit", "ot", 1]]}], "r": [[0.00012137637728585178], 0, 1.5340571403503418, 1544064750.3006303], "v": 0.1}
{"i": ["cuda", "conv2d_no_batching", [1, 28, 28, 128, 256, 3, 3, [2, 2], [1, 1]], {}, ["conv2d_no_batching", 1, 28, 28, 128, 256, 3, 3, [2, 2], [1, 1]], {"i": 30476901, "t": "", "c": null, "e": [["tile_f", "sp", [16, 1, 8, 1]], ["tile_y", "sp", [2, 1, 7, 1]], ["tile_x", "sp", [7, 2, 1, 1]], ["tile_rc", "sp", [64, 4, 1]], ["tile_ry", "sp", [1, 3, 1]], ["tile_rx", "sp", [1, 3, 1]], ["auto_unroll_max_step", "ot", 1500], ["unroll_explicit", "ot", 0]]}], "r": [[0.00014181628200192492], 0, 1.4149620532989502, 1544064751.444729], "v": 0.1}
{"i": ["cuda", "conv2d_no_batching", [1, 28, 28, 128, 256, 3, 3, [2, 2], [1, 1]], {}, ["conv2d_no_batching", 1, 28, 28, 128, 256, 3, 3, [2, 2], [1, 1]], {"i": 18013941, "t": "", "c": null, "e": [["tile_f", "sp", [16, 1, 8, 1]], ["tile_y", "sp", [7, 1, 2, 1]], ["tile_x", "sp", [2, 1, 7, 1]], ["tile_rc", "sp", [128, 2, 1]], ["tile_ry", "sp", [1, 3, 1]], ["tile_rx", "sp", [1, 3, 1]], ["auto_unroll_max_step", "ot", 512], ["unroll_explicit", "ot", 0]]}], "r": [[0.00012514179210779594], 0, 1.3247318267822266, 1544064752.4843194], "v": 0.1}
{"i": ["cuda", "conv2d_no_batching", [1, 28, 28, 128, 256, 3, 3, [2, 2], [1, 1]], {}, ["conv2d_no_batching", 1, 28, 28, 128, 256, 3, 3, [2, 2], [1, 1]], {"i": 67776741, "t": "", "c": null, "e": [["tile_f", "sp", [16, 1, 8, 1]], ["tile_y", "sp", [2, 1, 7, 1]], ["tile_x", "sp", [7, 1, 2, 1]], ["tile_rc", "sp", [128, 2, 1]], ["tile_ry", "sp", [1, 3, 1]], ["tile_rx", "sp", [1, 3, 1]], ["auto_unroll_max_step", "ot", 1500], ["unroll_explicit", "ot", 1]]}], "r": [[0.00014321322329162656], 0, 1.399237871170044, 1544064753.5852597], "v": 0.1}
{"i": ["cuda", "conv2d_no_batching", [1, 28, 28, 128, 256, 3, 3, [2, 2], [1, 1]], {}, ["conv2d_no_batching", 1, 28, 28, 128, 256, 3, 3, [2, 2], [1, 1]], {"i": 30701306, "t": "", "c": null, "e": [["tile_f", "sp", [8, 1, 16, 1]], ["tile_y", "sp", [7, 1, 2, 1]], ["tile_x", "sp", [2, 1, 7, 1]], ["tile_rc", "sp", [128, 1, 2]], ["tile_ry", "sp", [1, 3, 1]], ["tile_rx", "sp", [1, 3, 1]], ["auto_unroll_max_step", "ot", 1500], ["unroll_explicit", "ot", 0]]}], "r": [[0.00012439152261790182], 0, 1.2701115608215332, 1544064754.6156712], "v": 0.1}
{"i": ["cuda", "conv2d_no_batching", [1, 28, 28, 128, 256, 3, 3, [2, 2], [1, 1]], {}, ["conv2d_no_batching", 1, 28, 28, 128, 256, 3, 3, [2, 2], [1, 1]], {"i": 67799781, "t": "", "c": null, "e": [["tile_f", "sp", [16, 1, 8, 1]], ["tile_y", "sp", [2, 1, 7, 1]], ["tile_x", "sp", [14, 1, 1, 1]], ["tile_rc", "sp", [64, 4, 1]], ["tile_ry", "sp", [1, 3, 1]], ["tile_rx", "sp", [1, 3, 1]], ["auto_unroll_max_step", "ot", 1500], ["unroll_explicit", "ot", 1]]}], "r": [[0.00010919428103946103], 0, 1.307563066482544, 1544064755.6131687], "v": 0.1}
{"i": ["cuda", "conv2d_no_batching", [1, 28, 28, 128, 256, 3, 3, [2, 2], [1, 1]], {}, ["conv2d_no_batching", 1, 28, 28, 128, 256, 3, 3, [2, 2], [1, 1]], {"i": 55368986, "t": "", "c": null, "e": [["tile_f", "sp", [8, 1, 16, 1]], ["tile_y", "sp", [14, 1, 1, 1]], ["tile_x", "sp", [2, 1, 7, 1]], ["tile_rc", "sp", [64, 4, 1]], ["tile_ry", "sp", [1, 3, 1]], ["tile_rx", "sp", [1, 3, 1]], ["auto_unroll_max_step", "ot", 512], ["unroll_explicit", "ot", 1]]}], "r": [[0.0001000875948026949], 0, 1.2660269737243652, 1544064756.5646977], "v": 0.1}
{"i": ["cuda", "conv2d_no_batching", [1, 28, 28, 128, 256, 3, 3, [2, 2], [1, 1]], {}, ["conv2d_no_batching", 1, 28, 28, 128, 256, 3, 3, [2, 2], [1, 1]], {"i": 67779866, "t": "", "c": null, "e": [["tile_f", "sp", [8, 1, 16, 1]], ["tile_y", "sp", [14, 1, 1, 1]], ["tile_x", "sp", [2, 1, 7, 1]], ["tile_rc", "sp", [128, 2, 1]], ["tile_ry", "sp", [1, 3, 1]], ["tile_rx", "sp", [1, 3, 1]], ["auto_unroll_max_step", "ot", 1500], ["unroll_explicit", "ot", 1]]}], "r": [[9.86783676612127e-05], 0, 1.1835765838623047, 1544064757.4990668], "v": 0.1}
{"i": ["cuda", "conv2d_no_batching", [1, 28, 28, 128, 256, 3, 3, [2, 2], [1, 1]], {}, ["conv2d_no_batching", 1, 28, 28, 128, 256, 3, 3, [2, 2], [1, 1]], {"i": 55342102, "t": "", "c": null, "e": [["tile_f", "sp", [8, 2, 8, 1]], ["tile_y", "sp", [14, 1, 1, 1]], ["tile_x", "sp", [1, 1, 14, 1]], ["tile_rc", "sp", [128, 2, 1]], ["tile_ry", "sp", [1, 3, 1]], ["tile_rx", "sp", [1, 3, 1]], ["auto_unroll_max_step", "ot", 512], ["unroll_explicit", "ot", 1]]}], "r": [[7.581542889390519e-05], 0, 1.248610496520996, 1544064777.9688666], "v": 0.1}
{"i": ["cuda", "conv2d_no_batching", [1, 28, 28, 128, 256, 3, 3, [2, 2], [1, 1]], {}, ["conv2d_no_batching", 1, 28, 28, 128, 256, 3, 3, [2, 2], [1, 1]], {"i": 55308021, "t": "", "c": null, "e": [["tile_f", "sp", [16, 1, 8, 1]], ["tile_y", "sp", [7, 1, 2, 1]], ["tile_x", "sp", [2, 1, 7, 1]], ["tile_rc", "sp", [256, 1, 1]], ["tile_ry", "sp", [1, 3, 1]], ["tile_rx", "sp", [1, 3, 1]], ["auto_unroll_max_step", "ot", 512], ["unroll_explicit", "ot", 1]]}], "r": [[0.0001541812175168431], 0, 1.3978209495544434, 1544064759.503903], "v": 0.1}
{"i": ["cuda", "conv2d_no_batching", [1, 28, 28, 128, 256, 3, 3, [2, 2], [1, 1]], {}, ["conv2d_no_batching", 1, 28, 28, 128, 256, 3, 3, [2, 2], [1, 1]], {"i": 30455546, "t": "", "c": null, "e": [["tile_f", "sp", [8, 1, 16, 1]], ["tile_y", "sp", [7, 1, 2, 1]], ["tile_x", "sp", [2, 1, 7, 1]], ["tile_rc", "sp", [128, 2, 1]], ["tile_ry", "sp", [1, 3, 1]], ["tile_rx", "sp", [1, 3, 1]], ["auto_unroll_max_step", "ot", 1500], ["unroll_explicit", "ot", 0]]}], "r": [[0.00012236957651588066], 0, 1.2732079029083252, 1544064760.5406287], "v": 0.1}
{"i": ["cuda", "conv2d_no_batching", [1, 28, 28, 128, 256, 3, 3, [2, 2], [1, 1]], {}, ["conv2d_no_batching", 1, 28, 28, 128, 256, 3, 3, [2, 2], [1, 1]], {"i": 55369102, "t": "", "c": null, "e": [["tile_f", "sp", [8, 2, 8, 1]], ["tile_y", "sp", [7, 2, 1, 1]], ["tile_x", "sp", [2, 1, 7, 1]], ["tile_rc", "sp", [64, 4, 1]], ["tile_ry", "sp", [1, 3, 1]], ["tile_rx", "sp", [1, 3, 1]], ["auto_unroll_max_step", "ot", 512], ["unroll_explicit", "ot", 1]]}], "r": [[0.0001217119230028874], 0, 1.5039939880371094, 1544064761.6221275], "v": 0.1}
{"i": ["cuda", "conv2d_no_batching", [1, 28, 28, 128, 256, 3, 3, [2, 2], [1, 1]], {}, ["conv2d_no_batching", 1, 28, 28, 128, 256, 3, 3, [2, 2], [1, 1]], {"i": 55338778, "t": "", "c": null, "e": [["tile_f", "sp", [4, 1, 16, 2]], ["tile_y", "sp", [7, 1, 2, 1]], ["tile_x", "sp", [2, 1, 7, 1]], ["tile_rc", "sp", [128, 2, 1]], ["tile_ry", "sp", [1, 3, 1]], ["tile_rx", "sp", [1, 3, 1]], ["auto_unroll_max_step", "ot", 512], ["unroll_explicit", "ot", 1]]}], "r": [[0.00011056954475457171], 0, 1.3121721744537354, 1544064762.6093566], "v": 0.1}
{"i": ["cuda", "conv2d_no_batching", [1, 28, 28, 128, 256, 3, 3, [2, 2], [1, 1]], {}, ["conv2d_no_batching", 1, 28, 28, 128, 256, 3, 3, [2, 2], [1, 1]], {"i": 55342575, "t": "", "c": null, "e": [["tile_f", "sp", [32, 1, 4, 1]], ["tile_y", "sp", [7, 1, 2, 1]], ["tile_x", "sp", [1, 1, 14, 1]], ["tile_rc", "sp", [128, 2, 1]], ["tile_ry", "sp", [1, 3, 1]], ["tile_rx", "sp", [1, 3, 1]], ["auto_unroll_max_step", "ot", 512], ["unroll_explicit", "ot", 1]]}], "r": [[0.0001240003811357074], 0, 1.2880189418792725, 1544064763.6382833], "v": 0.1}
{"i": ["cuda", "conv2d_no_batching", [1, 28, 28, 128, 256, 3, 3, [2, 2], [1, 1]], {}, ["conv2d_no_batching", 1, 28, 28, 128, 256, 3, 3, [2, 2], [1, 1]], {"i": 18044661, "t": "", "c": null, "e": [["tile_f", "sp", [16, 1, 8, 1]], ["tile_y", "sp", [7, 1, 2, 1]], ["tile_x", "sp", [2, 1, 7, 1]], ["tile_rc", "sp", [64, 4, 1]], ["tile_ry", "sp", [1, 3, 1]], ["tile_rx", "sp", [1, 3, 1]], ["auto_unroll_max_step", "ot", 512], ["unroll_explicit", "ot", 0]]}], "r": [[0.00011432410490856592], 0, 1.3072383403778076, 1544064764.6523046], "v": 0.1}
{"i": ["cuda", "conv2d_no_batching", [1, 28, 28, 128, 256, 3, 3, [2, 2], [1, 1]], {}, ["conv2d_no_batching", 1, 28, 28, 128, 256, 3, 3, [2, 2], [1, 1]], {"i": 18013946, "t": "", "c": null, "e": [["tile_f", "sp", [8, 1, 16, 1]], ["tile_y", "sp", [7, 1, 2, 1]], ["tile_x", "sp", [2, 1, 7, 1]], ["tile_rc", "sp", [128, 2, 1]], ["tile_ry", "sp", [1, 3, 1]], ["tile_rx", "sp", [1, 3, 1]], ["auto_unroll_max_step", "ot", 512], ["unroll_explicit", "ot", 0]]}], "r": [[0.0001229275928777671], 0, 1.2729215621948242, 1544064765.6897979], "v": 0.1}
{"i": ["cuda", "conv2d_no_batching", [1, 28, 28, 128, 256, 3, 3, [2, 2], [1, 1]], {}, ["conv2d_no_batching", 1, 28, 28, 128, 256, 3, 3, [2, 2], [1, 1]], {"i": 67783702, "t": "", "c": null, "e": [["tile_f", "sp", [8, 2, 8, 1]], ["tile_y", "sp", [14, 1, 1, 1]], ["tile_x", "sp", [1, 1, 14, 1]], ["tile_rc", "sp", [128, 2, 1]], ["tile_ry", "sp", [1, 3, 1]], ["tile_rx", "sp", [1, 3, 1]], ["auto_unroll_max_step", "ot", 1500], ["unroll_explicit", "ot", 1]]}], "r": [[7.568247780285929e-05], 0, 1.2083663940429688, 1544064778.9158115], "v": 0.1}
{"i": ["cuda", "conv2d_no_batching", [1, 28, 28, 128, 256, 3, 3, [2, 2], [1, 1]], {}, ["conv2d_no_batching", 1, 28, 28, 128, 256, 3, 3, [2, 2], [1, 1]], {"i": 18259706, "t": "", "c": null, "e": [["tile_f", "sp", [8, 1, 16, 1]], ["tile_y", "sp", [7, 1, 2, 1]], ["tile_x", "sp", [2, 1, 7, 1]], ["tile_rc", "sp", [128, 1, 2]], ["tile_ry", "sp", [1, 3, 1]], ["tile_rx", "sp", [1, 3, 1]], ["auto_unroll_max_step", "ot", 512], ["unroll_explicit", "ot", 0]]}], "r": [[0.00012473316746871994], 0, 1.3032097816467285, 1544064767.6172233], "v": 0.1}
{"i": ["cuda", "conv2d_no_batching", [1, 28, 28, 128, 256, 3, 3, [2, 2], [1, 1]], {}, ["conv2d_no_batching", 1, 28, 28, 128, 256, 3, 3, [2, 2], [1, 1]], {"i": 67749621, "t": "", "c": null, "e": [["tile_f", "sp", [16, 1, 8, 1]], ["tile_y", "sp", [7, 1, 2, 1]], ["tile_x", "sp", [2, 1, 7, 1]], ["tile_rc", "sp", [256, 1, 1]], ["tile_ry", "sp", [1, 3, 1]], ["tile_rx", "sp", [1, 3, 1]], ["auto_unroll_max_step", "ot", 1500], ["unroll_explicit", "ot", 1]]}], "r": [[0.00015456438787295475], 0, 1.382796287536621, 1544064768.755145], "v": 0.1}
{"i": ["cuda", "conv2d_no_batching", [1, 28, 28, 128, 256, 3, 3, [2, 2], [1, 1]], {}, ["conv2d_no_batching", 1, 28, 28, 128, 256, 3, 3, [2, 2], [1, 1]], {"i": 67810701, "t": "", "c": null, "e": [["tile_f", "sp", [16, 1, 8, 1]], ["tile_y", "sp", [7, 2, 1, 1]], ["tile_x", "sp", [2, 1, 7, 1]], ["tile_rc", "sp", [64, 4, 1]], ["tile_ry", "sp", [1, 3, 1]], ["tile_rx", "sp", [1, 3, 1]], ["auto_unroll_max_step", "ot", 1500], ["unroll_explicit", "ot", 1]]}], "r": [[0.000126651239653513], 0, 1.3473575115203857, 1544064769.8198555], "v": 0.1}
{"i": ["cuda", "conv2d_no_batching", [1, 28, 28, 128, 256, 3, 3, [2, 2], [1, 1]], {}, ["conv2d_no_batching", 1, 28, 28, 128, 256, 3, 3, [2, 2], [1, 1]], {"i": 55338382, "t": "", "c": null, "e": [["tile_f", "sp", [8, 2, 8, 1]], ["tile_y", "sp", [7, 2, 1, 1]], ["tile_x", "sp", [2, 1, 7, 1]], ["tile_rc", "sp", [128, 2, 1]], ["tile_ry", "sp", [1, 3, 1]], ["tile_rx", "sp", [1, 3, 1]], ["auto_unroll_max_step", "ot", 512], ["unroll_explicit", "ot", 1]]}], "r": [[0.00012626481231953803], 0, 1.383103847503662, 1544064770.8932917], "v": 0.1}
{"i": ["cuda", "conv2d_no_batching", [1, 28, 28, 128, 256, 3, 3, [2, 2], [1, 1]], {}, ["conv2d_no_batching", 1, 28, 28, 128, 256, 3, 3, [2, 2], [1, 1]], {"i": 55358181, "t": "", "c": null, "e": [["tile_f", "sp", [16, 1, 8, 1]], ["tile_y", "sp", [2, 1, 7, 1]], ["tile_x", "sp", [14, 1, 1, 1]], ["tile_rc", "sp", [64, 4, 1]], ["tile_ry", "sp", [1, 3, 1]], ["tile_rx", "sp", [1, 3, 1]], ["auto_unroll_max_step", "ot", 512], ["unroll_explicit", "ot", 1]]}], "r": [[0.00010958192781520693], 0, 1.2753798961639404, 1544064771.9048672], "v": 0.1}
{"i": ["cuda", "conv2d_no_batching", [1, 28, 28, 128, 256, 3, 3, [2, 2], [1, 1]], {}, ["conv2d_no_batching", 1, 28, 28, 128, 256, 3, 3, [2, 2], [1, 1]], {"i": 67779982, "t": "", "c": null, "e": [["tile_f", "sp", [8, 2, 8, 1]], ["tile_y", "sp", [7, 2, 1, 1]], ["tile_x", "sp", [2, 1, 7, 1]], ["tile_rc", "sp", [128, 2, 1]], ["tile_ry", "sp", [1, 3, 1]], ["tile_rx", "sp", [1, 3, 1]], ["auto_unroll_max_step", "ot", 1500], ["unroll_explicit", "ot", 1]]}], "r": [[0.00012511146198267565], 0, 1.3126096725463867, 1544064772.9399238], "v": 0.1}
{"i": ["cuda", "conv2d_no_batching", [1, 28, 28, 128, 256, 3, 3, [2, 2], [1, 1]], {}, ["conv2d_no_batching", 1, 28, 28, 128, 256, 3, 3, [2, 2], [1, 1]], {"i": 67780378, "t": "", "c": null, "e": [["tile_f", "sp", [4, 1, 16, 2]], ["tile_y", "sp", [7, 1, 2, 1]], ["tile_x", "sp", [2, 1, 7, 1]], ["tile_rc", "sp", [128, 2, 1]], ["tile_ry", "sp", [1, 3, 1]], ["tile_rx", "sp", [1, 3, 1]], ["auto_unroll_max_step", "ot", 1500], ["unroll_explicit", "ot", 1]]}], "r": [[0.00011098900192492782], 0, 1.25433349609375, 1544064773.923692], "v": 0.1}
{"i": ["cuda", "conv2d_no_batching", [1, 28, 28, 128, 256, 3, 3, [2, 2], [1, 1]], {}, ["conv2d_no_batching", 1, 28, 28, 128, 256, 3, 3, [2, 2], [1, 1]], {"i": 67780335, "t": "", "c": null, "e": [["tile_f", "sp", [32, 1, 4, 1]], ["tile_y", "sp", [7, 1, 2, 1]], ["tile_x", "sp", [2, 1, 7, 1]], ["tile_rc", "sp", [128, 2, 1]], ["tile_ry", "sp", [1, 3, 1]], ["tile_rx", "sp", [1, 3, 1]], ["auto_unroll_max_step", "ot", 1500], ["unroll_explicit", "ot", 1]]}], "r": [[0.00015379971799807507], 0, 1.3781404495239258, 1544064775.0352747], "v": 0.1}
{"i": ["cuda", "conv2d_no_batching", [1, 28, 28, 128, 256, 3, 3, [2, 2], [1, 1]], {}, ["conv2d_no_batching", 1, 28, 28, 128, 256, 3, 3, [2, 2], [1, 1]], {"i": 17983221, "t": "", "c": null, "e": [["tile_f", "sp", [16, 1, 8, 1]], ["tile_y", "sp", [7, 1, 2, 1]], ["tile_x", "sp", [2, 1, 7, 1]], ["tile_rc", "sp", [256, 1, 1]], ["tile_ry", "sp", [1, 3, 1]], ["tile_rx", "sp", [1, 3, 1]], ["auto_unroll_max_step", "ot", 512], ["unroll_explicit", "ot", 0]]}], "r": [[0.00016009676297968397], 0, 1.6084017753601074, 1544064784.0953584], "v": 0.1}
{"i": ["cuda", "conv2d_no_batching", [1, 28, 28, 128, 256, 3, 3, [2, 2], [1, 1]], {}, ["conv2d_no_batching", 1, 28, 28, 128, 256, 3, 3, [2, 2], [1, 1]], {"i": 55338266, "t": "", "c": null, "e": [["tile_f", "sp", [8, 1, 16, 1]], ["tile_y", "sp", [14, 1, 1, 1]], ["tile_x", "sp", [2, 1, 7, 1]], ["tile_rc", "sp", [128, 2, 1]], ["tile_ry", "sp", [1, 3, 1]], ["tile_rx", "sp", [1, 3, 1]], ["auto_unroll_max_step", "ot", 512], ["unroll_explicit", "ot", 1]]}], "r": [[9.905721745673438e-05], 0, 1.2977240085601807, 1544064785.1234248], "v": 0.1}
{"i": ["cuda", "conv2d_no_batching", [1, 28, 28, 128, 256, 3, 3, [2, 2], [1, 1]], {}, ["conv2d_no_batching", 1, 28, 28, 128, 256, 3, 3, [2, 2], [1, 1]], {"i": 68056821, "t": "", "c": null, "e": [["tile_f", "sp", [16, 1, 8, 1]], ["tile_y", "sp", [7, 1, 2, 1]], ["tile_x", "sp", [2, 1, 7, 1]], ["tile_rc", "sp", [64, 2, 2]], ["tile_ry", "sp", [1, 3, 1]], ["tile_rx", "sp", [1, 3, 1]], ["auto_unroll_max_step", "ot", 1500], ["unroll_explicit", "ot", 1]]}], "r": [[0.00012639090293453724], 0, 1.5685787200927734, 1544064786.3356433], "v": 0.1}
{"i": ["cuda", "conv2d_no_batching", [1, 28, 28, 128, 256, 3, 3, [2, 2], [1, 1]], {}, ["conv2d_no_batching", 1, 28, 28, 128, 256, 3, 3, [2, 2], [1, 1]], {"i": 55309935, "t": "", "c": null, "e": [["tile_f", "sp", [32, 1, 4, 1]], ["tile_y", "sp", [7, 1, 2, 1]], ["tile_x", "sp", [1, 2, 7, 1]], ["tile_rc", "sp", [256, 1, 1]], ["tile_ry", "sp", [1, 3, 1]], ["tile_rx", "sp", [1, 3, 1]], ["auto_unroll_max_step", "ot", 512], ["unroll_explicit", "ot", 1]]}], "r": [[0.00022233922422874343], 0, 1.869889736175537, 1544064787.9377837], "v": 0.1}
{"i": ["cuda", "conv2d_no_batching", [1, 28, 28, 128, 256, 3, 3, [2, 2], [1, 1]], {}, ["conv2d_no_batching", 1, 28, 28, 128, 256, 3, 3, [2, 2], [1, 1]], {"i": 67782255, "t": "", "c": null, "e": [["tile_f", "sp", [32, 1, 4, 1]], ["tile_y", "sp", [7, 1, 2, 1]], ["tile_x", "sp", [1, 2, 7, 1]], ["tile_rc", "sp", [128, 2, 1]], ["tile_ry", "sp", [1, 3, 1]], ["tile_rx", "sp", [1, 3, 1]], ["auto_unroll_max_step", "ot", 1500], ["unroll_explicit", "ot", 1]]}], "r": [[0.00018658348908954101], 0, 1.8222551345825195, 1544064789.41485], "v": 0.1}
{"i": ["cuda", "conv2d_no_batching", [1, 28, 28, 128, 256, 3, 3, [2, 2], [1, 1]], {}, ["conv2d_no_batching", 1, 28, 28, 128, 256, 3, 3, [2, 2], [1, 1]], {"i": 67799786, "t": "", "c": null, "e": [["tile_f", "sp", [8, 1, 16, 1]], ["tile_y", "sp", [2, 1, 7, 1]], ["tile_x", "sp", [14, 1, 1, 1]], ["tile_rc", "sp", [64, 4, 1]], ["tile_ry", "sp", [1, 3, 1]], ["tile_rx", "sp", [1, 3, 1]], ["auto_unroll_max_step", "ot", 1500], ["unroll_explicit", "ot", 1]]}], "r": [[0.00010077295560571858], 0, 1.4234857559204102, 1544064790.5096357], "v": 0.1}
{"i": ["cuda", "conv2d_no_batching", [1, 28, 28, 128, 256, 3, 3, [2, 2], [1, 1]], {}, ["conv2d_no_batching", 1, 28, 28, 128, 256, 3, 3, [2, 2], [1, 1]], {"i": 55369462, "t": "", "c": null, "e": [["tile_f", "sp", [8, 2, 8, 1]], ["tile_y", "sp", [7, 1, 2, 1]], ["tile_x", "sp", [2, 1, 7, 1]], ["tile_rc", "sp", [64, 4, 1]], ["tile_ry", "sp", [1, 3, 1]], ["tile_rx", "sp", [1, 3, 1]], ["auto_unroll_max_step", "ot", 512], ["unroll_explicit", "ot", 1]]}], "r": [[9.311480210684725e-05], 0, 1.4647061824798584, 1544064791.6234157], "v": 0.1}
{"i": ["cuda", "conv2d_no_batching", [1, 28, 28, 128, 256, 3, 3, [2, 2], [1, 1]], {}, ["conv2d_no_batching", 1, 28, 28, 128, 256, 3, 3, [2, 2], [1, 1]], {"i": 67811062, "t": "", "c": null, "e": [["tile_f", "sp", [8, 2, 8, 1]], ["tile_y", "sp", [7, 1, 2, 1]], ["tile_x", "sp", [2, 1, 7, 1]], ["tile_rc", "sp", [64, 4, 1]], ["tile_ry", "sp", [1, 3, 1]], ["tile_rx", "sp", [1, 3, 1]], ["auto_unroll_max_step", "ot", 1500], ["unroll_explicit", "ot", 1]]}], "r": [[9.31704762979684e-05], 0, 1.365119218826294, 1544064792.648326], "v": 0.1}
{"i": ["cuda", "conv2d_no_batching", [1, 28, 28, 128, 256, 3, 3, [2, 2], [1, 1]], {}, ["conv2d_no_batching", 1, 28, 28, 128, 256, 3, 3, [2, 2], [1, 1]], {"i": 30424821, "t": "", "c": null, "e": [["tile_f", "sp", [16, 1, 8, 1]], ["tile_y", "sp", [7, 1, 2, 1]], ["tile_x", "sp", [2, 1, 7, 1]], ["tile_rc", "sp", [256, 1, 1]], ["tile_ry", "sp", [1, 3, 1]], ["tile_rx", "sp", [1, 3, 1]], ["auto_unroll_max_step", "ot", 1500], ["unroll_explicit", "ot", 0]]}], "r": [[0.00015289408878856284], 0, 1.518540859222412, 1544064793.9012518], "v": 0.1}
{"i": ["cuda", "conv2d_no_batching", [1, 28, 28, 128, 256, 3, 3, [2, 2], [1, 1]], {}, ["conv2d_no_batching", 1, 28, 28, 128, 256, 3, 3, [2, 2], [1, 1]], {"i": 55338735, "t": "", "c": null, "e": [["tile_f", "sp", [32, 1, 4, 1]], ["tile_y", "sp", [7, 1, 2, 1]], ["tile_x", "sp", [2, 1, 7, 1]], ["tile_rc", "sp", [128, 2, 1]], ["tile_ry", "sp", [1, 3, 1]], ["tile_rx", "sp", [1, 3, 1]], ["auto_unroll_max_step", "ot", 512], ["unroll_explicit", "ot", 1]]}], "r": [[0.0001528581595184349], 0, 1.6129319667816162, 1544064795.156963], "v": 0.1}
{"i": ["cuda", "conv2d_no_batching", [1, 28, 28, 128, 256, 3, 3, [2, 2], [1, 1]], {}, ["conv2d_no_batching", 1, 28, 28, 128, 256, 3, 3, [2, 2], [1, 1]], {"i": 30455186, "t": "", "c": null, "e": [["tile_f", "sp", [8, 1, 16, 1]], ["tile_y", "sp", [7, 2, 1, 1]], ["tile_x", "sp", [2, 1, 7, 1]], ["tile_rc", "sp", [128, 2, 1]], ["tile_ry", "sp", [1, 3, 1]], ["tile_rx", "sp", [1, 3, 1]], ["auto_unroll_max_step", "ot", 1500], ["unroll_explicit", "ot", 0]]}], "r": [[0.00010254754477050413], 0, 1.4360690116882324, 1544064796.2752163], "v": 0.1}
{"i": ["cuda", "conv2d_no_batching", [1, 28, 28, 128, 256, 3, 3, [2, 2], [1, 1]], {}, ["conv2d_no_batching", 1, 28, 28, 128, 256, 3, 3, [2, 2], [1, 1]], {"i": 55584538, "t": "", "c": null, "e": [["tile_f", "sp", [4, 1, 16, 2]], ["tile_y", "sp", [7, 1, 2, 1]], ["tile_x", "sp", [2, 1, 7, 1]], ["tile_rc", "sp", [128, 1, 2]], ["tile_ry", "sp", [1, 3, 1]], ["tile_rx", "sp", [1, 3, 1]], ["auto_unroll_max_step", "ot", 512], ["unroll_explicit", "ot", 1]]}], "r": [[0.00011111580812641082], 0, 1.4225780963897705, 1544064797.394673], "v": 0.1}
{"i": ["cuda", "conv2d_no_batching", [1, 28, 28, 128, 256, 3, 3, [2, 2], [1, 1]], {}, ["conv2d_no_batching", 1, 28, 28, 128, 256, 3, 3, [2, 2], [1, 1]], {"i": 63663861, "t": "", "c": null, "e": [["tile_f", "sp", [16, 1, 8, 1]], ["tile_y", "sp", [7, 1, 2, 1]], ["tile_x", "sp", [2, 1, 7, 1]], ["tile_rc", "sp", [64, 4, 1]], ["tile_ry", "sp", [1, 3, 1]], ["tile_rx", "sp", [3, 1, 1]], ["auto_unroll_max_step", "ot", 1500], ["unroll_explicit", "ot", 1]]}], "r": [[0.00014142167569601205], 0, 1.6335394382476807, 1544064798.6648734], "v": 0.1}
{"i": ["cuda", "conv2d_no_batching", [1, 28, 28, 128, 256, 3, 3, [2, 2], [1, 1]], {}, ["conv2d_no_batching", 1, 28, 28, 128, 256, 3, 3, [2, 2], [1, 1]], {"i": 50125458, "t": "", "c": null, "e": [["tile_f", "sp", [4, 8, 4, 1]], ["tile_y", "sp", [14, 1, 1, 1]], ["tile_x", "sp", [1, 1, 7, 2]], ["tile_rc", "sp", [32, 4, 2]], ["tile_ry", "sp", [3, 1, 1]], ["tile_rx", "sp", [3, 1, 1]], ["auto_unroll_max_step", "ot", 512], ["unroll_explicit", "ot", 1]]}], "r": [[0.00034188330248306997], 0, 2.700305938720703, 1544064801.066781], "v": 0.1}
{"i": ["cuda", "conv2d_no_batching", [1, 28, 28, 128, 256, 3, 3, [2, 2], [1, 1]], {}, ["conv2d_no_batching", 1, 28, 28, 128, 256, 3, 3, [2, 2], [1, 1]], {"i": 69751689, "t": "", "c": null, "e": [["tile_f", "sp", [32, 2, 2, 1]], ["tile_y", "sp", [14, 1, 1, 1]], ["tile_x", "sp", [7, 1, 1, 2]], ["tile_rc", "sp", [8, 8, 4]], ["tile_ry", "sp", [1, 1, 3]], ["tile_rx", "sp", [1, 3, 1]], ["auto_unroll_max_step", "ot", 1500], ["unroll_explicit", "ot", 1]]}], "r": [[0.0011255045101580135], 0, 7.196129322052002, 1544064838.3560283], "v": 0.1}
{"i": ["cuda", "conv2d_no_batching", [1, 28, 28, 128, 256, 3, 3, [2, 2], [1, 1]], {}, ["conv2d_no_batching", 1, 28, 28, 128, 256, 3, 3, [2, 2], [1, 1]], {"i": 66673134, "t": "", "c": null, "e": [["tile_f", "sp", [8, 1, 8, 2]], ["tile_y", "sp", [7, 1, 1, 2]], ["tile_x", "sp", [1, 7, 2, 1]], ["tile_rc", "sp", [64, 2, 2]], ["tile_ry", "sp", [3, 1, 1]], ["tile_rx", "sp", [1, 3, 1]], ["auto_unroll_max_step", "ot", 1500], ["unroll_explicit", "ot", 1]]}], "r": [[0.0005240892264860798], 0, 4.003746032714844, 1544064904.709973], "v": 0.1}
{"i": ["cuda", "conv2d_no_batching", [1, 28, 28, 128, 256, 3, 3, [2, 2], [1, 1]], {}, ["conv2d_no_batching", 1, 28, 28, 128, 256, 3, 3, [2, 2], [1, 1]], {"i": 63679443, "t": "", "c": null, "e": [["tile_f", "sp", [16, 8, 1, 1]], ["tile_y", "sp", [2, 1, 7, 1]], ["tile_x", "sp", [1, 1, 2, 7]], ["tile_rc", "sp", [64, 4, 1]], ["tile_ry", "sp", [1, 3, 1]], ["tile_rx", "sp", [3, 1, 1]], ["auto_unroll_max_step", "ot", 1500], ["unroll_explicit", "ot", 1]]}], "r": [[0.002720600082016554], 0, 16.38568377494812, 1544064918.4568124], "v": 0.1}
{"i": ["cuda", "conv2d_no_batching", [1, 28, 28, 128, 256, 3, 3, [2, 2], [1, 1]], {}, ["conv2d_no_batching", 1, 28, 28, 128, 256, 3, 3, [2, 2], [1, 1]], {"i": 17340890, "t": "", "c": null, "e": [["tile_f", "sp", [8, 2, 4, 2]], ["tile_y", "sp", [1, 1, 7, 2]], ["tile_x", "sp", [1, 2, 7, 1]], ["tile_rc", "sp", [32, 1, 8]], ["tile_ry", "sp", [3, 1, 1]], ["tile_rx", "sp", [1, 3, 1]], ["auto_unroll_max_step", "ot", 512], ["unroll_explicit", "ot", 0]]}], "r": [[0.0006306215553047404], 0, 4.358229160308838, 1544064922.2951903], "v": 0.1}
{"i": ["cuda", "conv2d_no_batching", [1, 28, 28, 128, 256, 3, 3, [2, 2], [1, 1]], {}, ["conv2d_no_batching", 1, 28, 28, 128, 256, 3, 3, [2, 2], [1, 1]], {"i": 55653191, "t": "", "c": null, "e": [["tile_f", "sp", [8, 2, 2, 4]], ["tile_y", "sp", [14, 1, 1, 1]], ["tile_x", "sp", [1, 7, 1, 2]], ["tile_rc", "sp", [32, 4, 2]], ["tile_ry", "sp", [1, 3, 1]], ["tile_rx", "sp", [1, 3, 1]], ["auto_unroll_max_step", "ot", 512], ["unroll_explicit", "ot", 1]]}], "r": [[0.001668108632054176], 0, 8.846174478530884, 1544064930.5880578], "v": 0.1}
{"i": ["cuda", "conv2d_no_batching", [1, 28, 28, 128, 256, 3, 3, [2, 2], [1, 1]], {}, ["conv2d_no_batching", 1, 28, 28, 128, 256, 3, 3, [2, 2], [1, 1]], {"i": 70828950, "t": "", "c": null, "e": [["tile_f", "sp", [4, 1, 32, 1]], ["tile_y", "sp", [7, 2, 1, 1]], ["tile_x", "sp", [1, 7, 1, 2]], ["tile_rc", "sp", [64, 2, 2]], ["tile_ry", "sp", [3, 1, 1]], ["tile_rx", "sp", [1, 1, 3]], ["auto_unroll_max_step", "ot", 1500], ["unroll_explicit", "ot", 1]]}], "r": [[0.0004665034341610233], 0, 3.5895345211029053, 1544064964.955096], "v": 0.1}
{"i": ["cuda", "conv2d_no_batching", [1, 28, 28, 128, 256, 3, 3, [2, 2], [1, 1]], {}, ["conv2d_no_batching", 1, 28, 28, 128, 256, 3, 3, [2, 2], [1, 1]], {"i": 46378422, "t": "", "c": null, "e": [["tile_f", "sp", [2, 4, 1, 16]], ["tile_y", "sp", [2, 1, 7, 1]], ["tile_x", "sp", [1, 1, 7, 2]], ["tile_rc", "sp", [32, 1, 8]], ["tile_ry", "sp", [3, 1, 1]], ["tile_rx", "sp", [1, 1, 3]], ["auto_unroll_max_step", "ot", 0], ["unroll_explicit", "ot", 1]]}], "r": [[0.004643643573363432], 0, 19.87764024734497, 1544064984.5639257], "v": 0.1}
{"i": ["cuda", "conv2d_no_batching", [1, 28, 28, 128, 256, 3, 3, [2, 2], [1, 1]], {}, ["conv2d_no_batching", 1, 28, 28, 128, 256, 3, 3, [2, 2], [1, 1]], {"i": 62843664, "t": "", "c": null, "e": [["tile_f", "sp", [2, 8, 8, 1]], ["tile_y", "sp", [7, 2, 1, 1]], ["tile_x", "sp", [1, 1, 7, 2]], ["tile_rc", "sp", [8, 8, 4]], ["tile_ry", "sp", [3, 1, 1]], ["tile_rx", "sp", [3, 1, 1]], ["auto_unroll_max_step", "ot", 1500], ["unroll_explicit", "ot", 1]]}], "r": [[0.0015552953957863054], 0, 9.99567198753357, 1544064992.8901181], "v": 0.1}
{"i": ["cuda", "conv2d_no_batching", [1, 28, 28, 128, 256, 3, 3, [2, 2], [1, 1]], {}, ["conv2d_no_batching", 1, 28, 28, 128, 256, 3, 3, [2, 2], [1, 1]], {"i": 67840156, "t": "", "c": null, "e": [["tile_f", "sp", [4, 2, 4, 4]], ["tile_y", "sp", [2, 1, 7, 1]], ["tile_x", "sp", [1, 7, 2, 1]], ["tile_rc", "sp", [32, 8, 1]], ["tile_ry", "sp", [1, 3, 1]], ["tile_rx", "sp", [1, 3, 1]], ["auto_unroll_max_step", "ot", 1500], ["unroll_explicit", "ot", 1]]}], "r": [[0.0007133364070729873], 0, 7.602306365966797, 1544064999.292425], "v": 0.1}
{"i": ["cuda", "conv2d_no_batching", [1, 28, 28, 128, 256, 3, 3, [2, 2], [1, 1]], {}, ["conv2d_no_batching", 1, 28, 28, 128, 256, 3, 3, [2, 2], [1, 1]], {"i": 30458902, "t": "", "c": null, "e": [["tile_f", "sp", [8, 2, 8, 1]], ["tile_y", "sp", [14, 1, 1, 1]], ["tile_x", "sp", [1, 1, 14, 1]], ["tile_rc", "sp", [128, 2, 1]], ["tile_ry", "sp", [1, 3, 1]], ["tile_rx", "sp", [1, 3, 1]], ["auto_unroll_max_step", "ot", 1500], ["unroll_explicit", "ot", 0]]}], "r": [[0.0001039826862302483], 0, 1.3448727130889893, 1544065095.5693755], "v": 0.1}
{"i": ["cuda", "conv2d_no_batching", [1, 28, 28, 128, 256, 3, 3, [2, 2], [1, 1]], {}, ["conv2d_no_batching", 1, 28, 28, 128, 256, 3, 3, [2, 2], [1, 1]], {"i": 67810590, "t": "", "c": null, "e": [["tile_f", "sp", [4, 1, 32, 1]], ["tile_y", "sp", [14, 1, 1, 1]], ["tile_x", "sp", [2, 1, 7, 1]], ["tile_rc", "sp", [64, 4, 1]], ["tile_ry", "sp", [1, 3, 1]], ["tile_rx", "sp", [1, 3, 1]], ["auto_unroll_max_step", "ot", 1500], ["unroll_explicit", "ot", 1]]}], "r": [[9.500056358164033e-05], 0, 1.3048145771026611, 1544065096.6885083], "v": 0.1}
{"i": ["cuda", "conv2d_no_batching", [1, 28, 28, 128, 256, 3, 3, [2, 2], [1, 1]], {}, ["conv2d_no_batching", 1, 28, 28, 128, 256, 3, 3, [2, 2], [1, 1]], {"i": 55358186, "t": "", "c": null, "e": [["tile_f", "sp", [8, 1, 16, 1]], ["tile_y", "sp", [2, 1, 7, 1]], ["tile_x", "sp", [14, 1, 1, 1]], ["tile_rc", "sp", [64, 4, 1]], ["tile_ry", "sp", [1, 3, 1]], ["tile_rx", "sp", [1, 3, 1]], ["auto_unroll_max_step", "ot", 512], ["unroll_explicit", "ot", 1]]}], "r": [[0.00010078213694507149], 0, 1.3038177490234375, 1544065097.7483988], "v": 0.1}
{"i": ["cuda", "conv2d_no_batching", [1, 28, 28, 128, 256, 3, 3, [2, 2], [1, 1]], {}, ["conv2d_no_batching", 1, 28, 28, 128, 256, 3, 3, [2, 2], [1, 1]], {"i": 30474986, "t": "", "c": null, "e": [["tile_f", "sp", [8, 1, 16, 1]], ["tile_y", "sp", [2, 1, 7, 1]], ["tile_x", "sp", [14, 1, 1, 1]], ["tile_rc", "sp", [64, 4, 1]], ["tile_ry", "sp", [1, 3, 1]], ["tile_rx", "sp", [1, 3, 1]], ["auto_unroll_max_step", "ot", 1500], ["unroll_explicit", "ot", 0]]}], "r": [[0.00010371784048156509], 0, 1.3450310230255127, 1544065098.912314], "v": 0.1}
{"i": ["cuda", "conv2d_no_batching", [1, 28, 28, 128, 256, 3, 3, [2, 2], [1, 1]], {}, ["conv2d_no_batching", 1, 28, 28, 128, 256, 3, 3, [2, 2], [1, 1]], {"i": 67810586, "t": "", "c": null, "e": [["tile_f", "sp", [8, 1, 16, 1]], ["tile_y", "sp", [14, 1, 1, 1]], ["tile_x", "sp", [2, 1, 7, 1]], ["tile_rc", "sp", [64, 4, 1]], ["tile_ry", "sp", [1, 3, 1]], ["tile_rx", "sp", [1, 3, 1]], ["auto_unroll_max_step", "ot", 1500], ["unroll_explicit", "ot", 1]]}], "r": [[0.00010054989240030097], 0, 1.3610572814941406, 1544065099.9865832], "v": 0.1}
{"i": ["cuda", "conv2d_no_batching", [1, 28, 28, 128, 256, 3, 3, [2, 2], [1, 1]], {}, ["conv2d_no_batching", 1, 28, 28, 128, 256, 3, 3, [2, 2], [1, 1]], {"i": 42916586, "t": "", "c": null, "e": [["tile_f", "sp", [8, 1, 16, 1]], ["tile_y", "sp", [2, 1, 7, 1]], ["tile_x", "sp", [14, 1, 1, 1]], ["tile_rc", "sp", [64, 4, 1]], ["tile_ry", "sp", [1, 3, 1]], ["tile_rx", "sp", [1, 3, 1]], ["auto_unroll_max_step", "ot", 0], ["unroll_explicit", "ot", 1]]}], "r": [[0.00010395459969902183], 0, 1.3199172019958496, 1544065101.0910954], "v": 0.1}
{"i": ["cuda", "conv2d_no_batching", [1, 28, 28, 128, 256, 3, 3, [2, 2], [1, 1]], {}, ["conv2d_no_batching", 1, 28, 28, 128, 256, 3, 3, [2, 2], [1, 1]], {"i": 67769186, "t": "", "c": null, "e": [["tile_f", "sp", [8, 1, 16, 1]], ["tile_y", "sp", [1, 2, 7, 1]], ["tile_x", "sp", [14, 1, 1, 1]], ["tile_rc", "sp", [128, 2, 1]], ["tile_ry", "sp", [1, 3, 1]], ["tile_rx", "sp", [1, 3, 1]], ["auto_unroll_max_step", "ot", 1500], ["unroll_explicit", "ot", 1]]}], "r": [[0.00010648912415349886], 0, 1.3482849597930908, 1544065102.241157], "v": 0.1}
{"i": ["cuda", "conv2d_no_batching", [1, 28, 28, 128, 256, 3, 3, [2, 2], [1, 1]], {}, ["conv2d_no_batching", 1, 28, 28, 128, 256, 3, 3, [2, 2], [1, 1]], {"i": 67811066, "t": "", "c": null, "e": [["tile_f", "sp", [8, 1, 16, 1]], ["tile_y", "sp", [7, 1, 2, 1]], ["tile_x", "sp", [2, 1, 7, 1]], ["tile_rc", "sp", [64, 4, 1]], ["tile_ry", "sp", [1, 3, 1]], ["tile_rx", "sp", [1, 3, 1]], ["auto_unroll_max_step", "ot", 1500], ["unroll_explicit", "ot", 1]]}], "r": [[0.00011453835063957863], 0, 1.4155359268188477, 1544065103.4317064], "v": 0.1}
{"i": ["cuda", "conv2d_no_batching", [1, 28, 28, 128, 256, 3, 3, [2, 2], [1, 1]], {}, ["conv2d_no_batching", 1, 28, 28, 128, 256, 3, 3, [2, 2], [1, 1]], {"i": 67799787, "t": "", "c": null, "e": [["tile_f", "sp", [4, 2, 16, 1]], ["tile_y", "sp", [2, 1, 7, 1]], ["tile_x", "sp", [14, 1, 1, 1]], ["tile_rc", "sp", [64, 4, 1]], ["tile_ry", "sp", [1, 3, 1]], ["tile_rx", "sp", [1, 3, 1]], ["auto_unroll_max_step", "ot", 1500], ["unroll_explicit", "ot", 1]]}], "r": [[8.787832580887886e-05], 0, 1.5425834655761719, 1544065104.548473], "v": 0.1}
{"i": ["cuda", "conv2d_no_batching", [1, 28, 28, 128, 256, 3, 3, [2, 2], [1, 1]], {}, ["conv2d_no_batching", 1, 28, 28, 128, 256, 3, 3, [2, 2], [1, 1]], {"i": 67799790, "t": "", "c": null, "e": [["tile_f", "sp", [4, 1, 32, 1]], ["tile_y", "sp", [2, 1, 7, 1]], ["tile_x", "sp", [14, 1, 1, 1]], ["tile_rc", "sp", [64, 4, 1]], ["tile_ry", "sp", [1, 3, 1]], ["tile_rx", "sp", [1, 3, 1]], ["auto_unroll_max_step", "ot", 1500], ["unroll_explicit", "ot", 1]]}], "r": [[9.689547479307751e-05], 0, 1.4184446334838867, 1544065105.6596212], "v": 0.1}
{"i": ["cuda", "conv2d_no_batching", [1, 28, 28, 128, 256, 3, 3, [2, 2], [1, 1]], {}, ["conv2d_no_batching", 1, 28, 28, 128, 256, 3, 3, [2, 2], [1, 1]], {"i": 30486262, "t": "", "c": null, "e": [["tile_f", "sp", [8, 2, 8, 1]], ["tile_y", "sp", [7, 1, 2, 1]], ["tile_x", "sp", [2, 1, 7, 1]], ["tile_rc", "sp", [64, 4, 1]], ["tile_ry", "sp", [1, 3, 1]], ["tile_rx", "sp", [1, 3, 1]], ["auto_unroll_max_step", "ot", 1500], ["unroll_explicit", "ot", 0]]}], "r": [[0.00010023729420617006], 0, 1.4181883335113525, 1544065106.8071043], "v": 0.1}
{"i": ["cuda", "conv2d_no_batching", [1, 28, 28, 128, 256, 3, 3, [2, 2], [1, 1]], {}, ["conv2d_no_batching", 1, 28, 28, 128, 256, 3, 3, [2, 2], [1, 1]], {"i": 67810706, "t": "", "c": null, "e": [["tile_f", "sp", [8, 1, 16, 1]], ["tile_y", "sp", [7, 2, 1, 1]], ["tile_x", "sp", [2, 1, 7, 1]], ["tile_rc", "sp", [64, 4, 1]], ["tile_ry", "sp", [1, 3, 1]], ["tile_rx", "sp", [1, 3, 1]], ["auto_unroll_max_step", "ot", 1500], ["unroll_explicit", "ot", 1]]}], "r": [[9.998404213694507e-05], 0, 1.4323618412017822, 1544065107.9398801], "v": 0.1}
{"i": ["cuda", "conv2d_no_batching", [1, 28, 28, 128, 256, 3, 3, [2, 2], [1, 1]], {}, ["conv2d_no_batching", 1, 28, 28, 128, 256, 3, 3, [2, 2], [1, 1]], {"i": 67783822, "t": "", "c": null, "e": [["tile_f", "sp", [8, 2, 8, 1]], ["tile_y", "sp", [7, 2, 1, 1]], ["tile_x", "sp", [1, 1, 14, 1]], ["tile_rc", "sp", [128, 2, 1]], ["tile_ry", "sp", [1, 3, 1]], ["tile_rx", "sp", [1, 3, 1]], ["auto_unroll_max_step", "ot", 1500], ["unroll_explicit", "ot", 1]]}], "r": [[9.994345598194131e-05], 0, 1.3708522319793701, 1544065109.075385], "v": 0.1}
{"i": ["cuda", "conv2d_no_batching", [1, 28, 28, 128, 256, 3, 3, [2, 2], [1, 1]], {}, ["conv2d_no_batching", 1, 28, 28, 128, 256, 3, 3, [2, 2], [1, 1]], {"i": 42900502, "t": "", "c": null, "e": [["tile_f", "sp", [8, 2, 8, 1]], ["tile_y", "sp", [14, 1, 1, 1]], ["tile_x", "sp", [1, 1, 14, 1]], ["tile_rc", "sp", [128, 2, 1]], ["tile_ry", "sp", [1, 3, 1]], ["tile_rx", "sp", [1, 3, 1]], ["auto_unroll_max_step", "ot", 0], ["unroll_explicit", "ot", 1]]}], "r": [[9.299418058690745e-05], 0, 1.26810622215271, 1544065110.1084728], "v": 0.1}
{"i": ["cuda", "conv2d_no_batching", [1, 28, 28, 128, 256, 3, 3, [2, 2], [1, 1]], {}, ["conv2d_no_batching", 1, 28, 28, 128, 256, 3, 3, [2, 2], [1, 1]], {"i": 30455066, "t": "", "c": null, "e": [["tile_f", "sp", [8, 1, 16, 1]], ["tile_y", "sp", [14, 1, 1, 1]], ["tile_x", "sp", [2, 1, 7, 1]], ["tile_rc", "sp", [128, 2, 1]], ["tile_ry", "sp", [1, 3, 1]], ["tile_rx", "sp", [1, 3, 1]], ["auto_unroll_max_step", "ot", 1500], ["unroll_explicit", "ot", 0]]}], "r": [[9.811889390519188e-05], 0, 1.3361763954162598, 1544065111.1869407], "v": 0.1}
{"i": ["cuda", "conv2d_no_batching", [1, 28, 28, 128, 256, 3, 3, [2, 2], [1, 1]], {}, ["conv2d_no_batching", 1, 28, 28, 128, 256, 3, 3, [2, 2], [1, 1]], {"i": 67769066, "t": "", "c": null, "e": [["tile_f", "sp", [8, 1, 16, 1]], ["tile_y", "sp", [2, 1, 7, 1]], ["tile_x", "sp", [14, 1, 1, 1]], ["tile_rc", "sp", [128, 2, 1]], ["tile_ry", "sp", [1, 3, 1]], ["tile_rx", "sp", [1, 3, 1]], ["auto_unroll_max_step", "ot", 1500], ["unroll_explicit", "ot", 1]]}], "r": [[0.00010155206546275394], 0, 1.3117928504943848, 1544065112.2935655], "v": 0.1}
{"i": ["cuda", "conv2d_no_batching", [1, 28, 28, 128, 256, 3, 3, [2, 2], [1, 1]], {}, ["conv2d_no_batching", 1, 28, 28, 128, 256, 3, 3, [2, 2], [1, 1]], {"i": 18017302, "t": "", "c": null, "e": [["tile_f", "sp", [8, 2, 8, 1]], ["tile_y", "sp", [14, 1, 1, 1]], ["tile_x", "sp", [1, 1, 14, 1]], ["tile_rc", "sp", [128, 2, 1]], ["tile_ry", "sp", [1, 3, 1]], ["tile_rx", "sp", [1, 3, 1]], ["auto_unroll_max_step", "ot", 512], ["unroll_explicit", "ot", 0]]}], "r": [[9.290121820917983e-05], 0, 1.2944939136505127, 1544065113.334139], "v": 0.1}
{"i": ["cuda", "conv2d_no_batching", [1, 28, 28, 128, 256, 3, 3, [2, 2], [1, 1]], {}, ["conv2d_no_batching", 1, 28, 28, 128, 256, 3, 3, [2, 2], [1, 1]], {"i": 30485786, "t": "", "c": null, "e": [["tile_f", "sp", [8, 1, 16, 1]], ["tile_y", "sp", [14, 1, 1, 1]], ["tile_x", "sp", [2, 1, 7, 1]], ["tile_rc", "sp", [64, 4, 1]], ["tile_ry", "sp", [1, 3, 1]], ["tile_rx", "sp", [1, 3, 1]], ["auto_unroll_max_step", "ot", 1500], ["unroll_explicit", "ot", 0]]}], "r": [[0.00010113057562076748], 0, 1.3784193992614746, 1544065114.4758606], "v": 0.1}
{"i": ["cuda", "conv2d_no_batching", [1, 28, 28, 128, 256, 3, 3, [2, 2], [1, 1]], {}, ["conv2d_no_batching", 1, 28, 28, 128, 256, 3, 3, [2, 2], [1, 1]], {"i": 67810587, "t": "", "c": null, "e": [["tile_f", "sp", [4, 2, 16, 1]], ["tile_y", "sp", [14, 1, 1, 1]], ["tile_x", "sp", [2, 1, 7, 1]], ["tile_rc", "sp", [64, 4, 1]], ["tile_ry", "sp", [1, 3, 1]], ["tile_rx", "sp", [1, 3, 1]], ["auto_unroll_max_step", "ot", 1500], ["unroll_explicit", "ot", 1]]}], "r": [[0.00010650145447705041], 0, 1.4973344802856445, 1544065115.6832478], "v": 0.1}
{"i": ["cuda", "conv2d_no_batching", [1, 28, 28, 128, 256, 3, 3, [2, 2], [1, 1]], {}, ["conv2d_no_batching", 1, 28, 28, 128, 256, 3, 3, [2, 2], [1, 1]], {"i": 67814426, "t": "", "c": null, "e": [["tile_f", "sp", [8, 1, 16, 1]], ["tile_y", "sp", [14, 1, 1, 1]], ["tile_x", "sp", [1, 1, 14, 1]], ["tile_rc", "sp", [64, 4, 1]], ["tile_ry", "sp", [1, 3, 1]], ["tile_rx", "sp", [1, 3, 1]], ["auto_unroll_max_step", "ot", 1500], ["unroll_explicit", "ot", 1]]}], "r": [[7.641843792325056e-05], 0, 1.2798242568969727, 1544065116.7123225], "v": 0.1}
{"i": ["cuda", "conv2d_no_batching", [1, 28, 28, 128, 256, 3, 3, [2, 2], [1, 1]], {}, ["conv2d_no_batching", 1, 28, 28, 128, 256, 3, 3, [2, 2], [1, 1]], {"i": 68029467, "t": "", "c": null, "e": [["tile_f", "sp", [4, 2, 16, 1]], ["tile_y", "sp", [14, 1, 1, 1]], ["tile_x", "sp", [1, 1, 14, 1]], ["tile_rc", "sp", [128, 1, 2]], ["tile_ry", "sp", [1, 3, 1]], ["tile_rx", "sp", [1, 3, 1]], ["auto_unroll_max_step", "ot", 1500], ["unroll_explicit", "ot", 1]]}], "r": [[9.312247855530474e-05], 0, 1.3578386306762695, 1544065117.8000383], "v": 0.1}
{"i": ["cuda", "conv2d_no_batching", [1, 28, 28, 128, 256, 3, 3, [2, 2], [1, 1]], {}, ["conv2d_no_batching", 1, 28, 28, 128, 256, 3, 3, [2, 2], [1, 1]], {"i": 67784177, "t": "", "c": null, "e": [["tile_f", "sp", [8, 4, 4, 1]], ["tile_y", "sp", [7, 1, 2, 1]], ["tile_x", "sp", [1, 1, 14, 1]], ["tile_rc", "sp", [128, 2, 1]], ["tile_ry", "sp", [1, 3, 1]], ["tile_rx", "sp", [1, 3, 1]], ["auto_unroll_max_step", "ot", 1500], ["unroll_explicit", "ot", 1]]}], "r": [[0.00013758167870579383], 0, 1.5831258296966553, 1544065119.087668], "v": 0.1}
{"i": ["cuda", "conv2d_no_batching", [1, 28, 28, 128, 256, 3, 3, [2, 2], [1, 1]], {}, ["conv2d_no_batching", 1, 28, 28, 128, 256, 3, 3, [2, 2], [1, 1]], {"i": 30485790, "t": "", "c": null, "e": [["tile_f", "sp", [4, 1, 32, 1]], ["tile_y", "sp", [14, 1, 1, 1]], ["tile_x", "sp", [2, 1, 7, 1]], ["tile_rc", "sp", [64, 4, 1]], ["tile_ry", "sp", [1, 3, 1]], ["tile_rx", "sp", [1, 3, 1]], ["auto_unroll_max_step", "ot", 1500], ["unroll_explicit", "ot", 0]]}], "r": [[8.792309405568096e-05], 0, 1.3207378387451172, 1544065120.1581314], "v": 0.1}
{"i": ["cuda", "conv2d_no_batching", [1, 28, 28, 128, 256, 3, 3, [2, 2], [1, 1]], {}, ["conv2d_no_batching", 1, 28, 28, 128, 256, 3, 3, [2, 2], [1, 1]], {"i": 18033386, "t": "", "c": null, "e": [["tile_f", "sp", [8, 1, 16, 1]], ["tile_y", "sp", [2, 1, 7, 1]], ["tile_x", "sp", [14, 1, 1, 1]], ["tile_rc", "sp", [64, 4, 1]], ["tile_ry", "sp", [1, 3, 1]], ["tile_rx", "sp", [1, 3, 1]], ["auto_unroll_max_step", "ot", 512], ["unroll_explicit", "ot", 0]]}], "r": [[0.00010403998946576374], 0, 1.3224828243255615, 1544065121.227183], "v": 0.1}
{"i": ["cuda", "conv2d_no_batching", [1, 28, 28, 128, 256, 3, 3, [2, 2], [1, 1]], {}, ["conv2d_no_batching", 1, 28, 28, 128, 256, 3, 3, [2, 2], [1, 1]], {"i": 42896786, "t": "", "c": null, "e": [["tile_f", "sp", [8, 1, 16, 1]], ["tile_y", "sp", [7, 2, 1, 1]], ["tile_x", "sp", [2, 1, 7, 1]], ["tile_rc", "sp", [128, 2, 1]], ["tile_ry", "sp", [1, 3, 1]], ["tile_rx", "sp", [1, 3, 1]], ["auto_unroll_max_step", "ot", 0], ["unroll_explicit", "ot", 1]]}], "r": [[0.00010266952746425885], 0, 1.3111770153045654, 1544065122.3049848], "v": 0.1}
{"i": ["cuda", "conv2d_no_batching", [1, 28, 28, 128, 256, 3, 3, [2, 2], [1, 1]], {}, ["conv2d_no_batching", 1, 28, 28, 128, 256, 3, 3, [2, 2], [1, 1]], {"i": 68056350, "t": "", "c": null, "e": [["tile_f", "sp", [4, 1, 32, 1]], ["tile_y", "sp", [14, 1, 1, 1]], ["tile_x", "sp", [2, 1, 7, 1]], ["tile_rc", "sp", [64, 2, 2]], ["tile_ry", "sp", [1, 3, 1]], ["tile_rx", "sp", [1, 3, 1]], ["auto_unroll_max_step", "ot", 1500], ["unroll_explicit", "ot", 1]]}], "r": [[0.00010395725658389768], 0, 1.4028406143188477, 1544065123.439501], "v": 0.1}
{"i": ["cuda", "conv2d_no_batching", [1, 28, 28, 128, 256, 3, 3, [2, 2], [1, 1]], {}, ["conv2d_no_batching", 1, 28, 28, 128, 256, 3, 3, [2, 2], [1, 1]], {"i": 67807462, "t": "", "c": null, "e": [["tile_f", "sp", [8, 2, 8, 1]], ["tile_y", "sp", [2, 1, 7, 1]], ["tile_x", "sp", [7, 1, 2, 1]], ["tile_rc", "sp", [64, 4, 1]], ["tile_ry", "sp", [1, 3, 1]], ["tile_rx", "sp", [1, 3, 1]], ["auto_unroll_max_step", "ot", 1500], ["unroll_explicit", "ot", 1]]}], "r": [[0.00010110890895410082], 0, 1.495419979095459, 1544065124.6073616], "v": 0.1}
{"i": ["cuda", "conv2d_no_batching", [1, 28, 28, 128, 256, 3, 3, [2, 2], [1, 1]], {}, ["conv2d_no_batching", 1, 28, 28, 128, 256, 3, 3, [2, 2], [1, 1]], {"i": 5575702, "t": "", "c": null, "e": [["tile_f", "sp", [8, 2, 8, 1]], ["tile_y", "sp", [14, 1, 1, 1]], ["tile_x", "sp", [1, 1, 14, 1]], ["tile_rc", "sp", [128, 2, 1]], ["tile_ry", "sp", [1, 3, 1]], ["tile_rx", "sp", [1, 3, 1]], ["auto_unroll_max_step", "ot", 0], ["unroll_explicit", "ot", 0]]}], "r": [[9.296543340857788e-05], 0, 1.291227102279663, 1544065125.6315956], "v": 0.1}
{"i": ["cuda", "conv2d_no_batching", [1, 28, 28, 128, 256, 3, 3, [2, 2], [1, 1]], {}, ["conv2d_no_batching", 1, 28, 28, 128, 256, 3, 3, [2, 2], [1, 1]], {"i": 30486266, "t": "", "c": null, "e": [["tile_f", "sp", [8, 1, 16, 1]], ["tile_y", "sp", [7, 1, 2, 1]], ["tile_x", "sp", [2, 1, 7, 1]], ["tile_rc", "sp", [64, 4, 1]], ["tile_ry", "sp", [1, 3, 1]], ["tile_rx", "sp", [1, 3, 1]], ["auto_unroll_max_step", "ot", 1500], ["unroll_explicit", "ot", 0]]}], "r": [[0.00010850459894657638], 0, 1.3908650875091553, 1544065126.7761762], "v": 0.1}
{"i": ["cuda", "conv2d_no_batching", [1, 28, 28, 128, 256, 3, 3, [2, 2], [1, 1]], {}, ["conv2d_no_batching", 1, 28, 28, 128, 256, 3, 3, [2, 2], [1, 1]], {"i": 67814422, "t": "", "c": null, "e": [["tile_f", "sp", [8, 2, 8, 1]], ["tile_y", "sp", [14, 1, 1, 1]], ["tile_x", "sp", [1, 1, 14, 1]], ["tile_rc", "sp", [64, 4, 1]], ["tile_ry", "sp", [1, 3, 1]], ["tile_rx", "sp", [1, 3, 1]], ["auto_unroll_max_step", "ot", 1500], ["unroll_explicit", "ot", 1]]}], "r": [[6.420749423815621e-05], 0, 1.2950925827026367, 1544065149.1109347], "v": 0.1}
{"i": ["cuda", "conv2d_no_batching", [1, 28, 28, 128, 256, 3, 3, [2, 2], [1, 1]], {}, ["conv2d_no_batching", 1, 28, 28, 128, 256, 3, 3, [2, 2], [1, 1]], {"i": 42927862, "t": "", "c": null, "e": [["tile_f", "sp", [8, 2, 8, 1]], ["tile_y", "sp", [7, 1, 2, 1]], ["tile_x", "sp", [2, 1, 7, 1]], ["tile_rc", "sp", [64, 4, 1]], ["tile_ry", "sp", [1, 3, 1]], ["tile_rx", "sp", [1, 3, 1]], ["auto_unroll_max_step", "ot", 0], ["unroll_explicit", "ot", 1]]}], "r": [[9.854328818660648e-05], 0, 1.4426360130310059, 1544065128.9123383], "v": 0.1}
{"i": ["cuda", "conv2d_no_batching", [1, 28, 28, 128, 256, 3, 3, [2, 2], [1, 1]], {}, ["conv2d_no_batching", 1, 28, 28, 128, 256, 3, 3, [2, 2], [1, 1]], {"i": 67814546, "t": "", "c": null, "e": [["tile_f", "sp", [8, 1, 16, 1]], ["tile_y", "sp", [7, 2, 1, 1]], ["tile_x", "sp", [1, 1, 14, 1]], ["tile_rc", "sp", [64, 4, 1]], ["tile_ry", "sp", [1, 3, 1]], ["tile_rx", "sp", [1, 3, 1]], ["auto_unroll_max_step", "ot", 1500], ["unroll_explicit", "ot", 1]]}], "r": [[8.560687133182843e-05], 0, 1.3814833164215088, 1544065130.0005972], "v": 0.1}
{"i": ["cuda", "conv2d_no_batching", [1, 28, 28, 128, 256, 3, 3, [2, 2], [1, 1]], {}, ["conv2d_no_batching", 1, 28, 28, 128, 256, 3, 3, [2, 2], [1, 1]], {"i": 30459022, "t": "", "c": null, "e": [["tile_f", "sp", [8, 2, 8, 1]], ["tile_y", "sp", [7, 2, 1, 1]], ["tile_x", "sp", [1, 1, 14, 1]], ["tile_rc", "sp", [128, 2, 1]], ["tile_ry", "sp", [1, 3, 1]], ["tile_rx", "sp", [1, 3, 1]], ["auto_unroll_max_step", "ot", 1500], ["unroll_explicit", "ot", 0]]}], "r": [[0.00010371572310007524], 0, 1.407606601715088, 1544065131.1428692], "v": 0.1}
{"i": ["cuda", "conv2d_no_batching", [1, 28, 28, 128, 256, 3, 3, [2, 2], [1, 1]], {}, ["conv2d_no_batching", 1, 28, 28, 128, 256, 3, 3, [2, 2], [1, 1]], {"i": 67780950, "t": "", "c": null, "e": [["tile_f", "sp", [4, 1, 32, 1]], ["tile_y", "sp", [7, 1, 1, 2]], ["tile_x", "sp", [2, 1, 7, 1]], ["tile_rc", "sp", [128, 2, 1]], ["tile_ry", "sp", [1, 3, 1]], ["tile_rx", "sp", [1, 3, 1]], ["auto_unroll_max_step", "ot", 1500], ["unroll_explicit", "ot", 1]]}], "r": [[0.00010691073137697517], 0, 1.444767713546753, 1544065132.289892], "v": 0.1}
{"i": ["cuda", "conv2d_no_batching", [1, 28, 28, 128, 256, 3, 3, [2, 2], [1, 1]], {}, ["conv2d_no_batching", 1, 28, 28, 128, 256, 3, 3, [2, 2], [1, 1]], {"i": 55327586, "t": "", "c": null, "e": [["tile_f", "sp", [8, 1, 16, 1]], ["tile_y", "sp", [1, 2, 7, 1]], ["tile_x", "sp", [14, 1, 1, 1]], ["tile_rc", "sp", [128, 2, 1]], ["tile_ry", "sp", [1, 3, 1]], ["tile_rx", "sp", [1, 3, 1]], ["auto_unroll_max_step", "ot", 512], ["unroll_explicit", "ot", 1]]}], "r": [[0.00010659281715575621], 0, 1.3774564266204834, 1544065133.3863542], "v": 0.1}
{"i": ["cuda", "conv2d_no_batching", [1, 28, 28, 128, 256, 3, 3, [2, 2], [1, 1]], {}, ["conv2d_no_batching", 1, 28, 28, 128, 256, 3, 3, [2, 2], [1, 1]], {"i": 67807466, "t": "", "c": null, "e": [["tile_f", "sp", [8, 1, 16, 1]], ["tile_y", "sp", [2, 1, 7, 1]], ["tile_x", "sp", [7, 1, 2, 1]], ["tile_rc", "sp", [64, 4, 1]], ["tile_ry", "sp", [1, 3, 1]], ["tile_rx", "sp", [1, 3, 1]], ["auto_unroll_max_step", "ot", 1500], ["unroll_explicit", "ot", 1]]}], "r": [[0.00011840131000752446], 0, 1.4220867156982422, 1544065134.577295], "v": 0.1}
{"i": ["cuda", "conv2d_no_batching", [1, 28, 28, 128, 256, 3, 3, [2, 2], [1, 1]], {}, ["conv2d_no_batching", 1, 28, 28, 128, 256, 3, 3, [2, 2], [1, 1]], {"i": 30459377, "t": "", "c": null, "e": [["tile_f", "sp", [8, 4, 4, 1]], ["tile_y", "sp", [7, 1, 2, 1]], ["tile_x", "sp", [1, 1, 14, 1]], ["tile_rc", "sp", [128, 2, 1]], ["tile_ry", "sp", [1, 3, 1]], ["tile_rx", "sp", [1, 3, 1]], ["auto_unroll_max_step", "ot", 1500], ["unroll_explicit", "ot", 0]]}], "r": [[0.00013581099322799097], 0, 1.557079792022705, 1544065135.8688989], "v": 0.1}
{"i": ["cuda", "conv2d_no_batching", [1, 28, 28, 128, 256, 3, 3, [2, 2], [1, 1]], {}, ["conv2d_no_batching", 1, 28, 28, 128, 256, 3, 3, [2, 2], [1, 1]], {"i": 67781786, "t": "", "c": null, "e": [["tile_f", "sp", [8, 1, 16, 1]], ["tile_y", "sp", [14, 1, 1, 1]], ["tile_x", "sp", [1, 2, 7, 1]], ["tile_rc", "sp", [128, 2, 1]], ["tile_ry", "sp", [1, 3, 1]], ["tile_rx", "sp", [1, 3, 1]], ["auto_unroll_max_step", "ot", 1500], ["unroll_explicit", "ot", 1]]}], "r": [[9.588269826937548e-05], 0, 1.4006011486053467, 1544065136.9877067], "v": 0.1}
{"i": ["cuda", "conv2d_no_batching", [1, 28, 28, 128, 256, 3, 3, [2, 2], [1, 1]], {}, ["conv2d_no_batching", 1, 28, 28, 128, 256, 3, 3, [2, 2], [1, 1]], {"i": 55369106, "t": "", "c": null, "e": [["tile_f", "sp", [8, 1, 16, 1]], ["tile_y", "sp", [7, 2, 1, 1]], ["tile_x", "sp", [2, 1, 7, 1]], ["tile_rc", "sp", [64, 4, 1]], ["tile_ry", "sp", [1, 3, 1]], ["tile_rx", "sp", [1, 3, 1]], ["auto_unroll_max_step", "ot", 512], ["unroll_explicit", "ot", 1]]}], "r": [[0.00010007931677953347], 0, 1.4021034240722656, 1544065138.0611134], "v": 0.1}
{"i": ["cuda", "conv2d_no_batching", [1, 28, 28, 128, 256, 3, 3, [2, 2], [1, 1]], {}, ["conv2d_no_batching", 1, 28, 28, 128, 256, 3, 3, [2, 2], [1, 1]], {"i": 42885986, "t": "", "c": null, "e": [["tile_f", "sp", [8, 1, 16, 1]], ["tile_y", "sp", [1, 2, 7, 1]], ["tile_x", "sp", [14, 1, 1, 1]], ["tile_rc", "sp", [128, 2, 1]], ["tile_ry", "sp", [1, 3, 1]], ["tile_rx", "sp", [1, 3, 1]], ["auto_unroll_max_step", "ot", 0], ["unroll_explicit", "ot", 1]]}], "r": [[0.00010603768171557562], 0, 1.3842260837554932, 1544065139.1801064], "v": 0.1}
{"i": ["cuda", "conv2d_no_batching", [1, 28, 28, 128, 256, 3, 3, [2, 2], [1, 1]], {}, ["conv2d_no_batching", 1, 28, 28, 128, 256, 3, 3, [2, 2], [1, 1]], {"i": 30444386, "t": "", "c": null, "e": [["tile_f", "sp", [8, 1, 16, 1]], ["tile_y", "sp", [1, 2, 7, 1]], ["tile_x", "sp", [14, 1, 1, 1]], ["tile_rc", "sp", [128, 2, 1]], ["tile_ry", "sp", [1, 3, 1]], ["tile_rx", "sp", [1, 3, 1]], ["auto_unroll_max_step", "ot", 1500], ["unroll_explicit", "ot", 0]]}], "r": [[0.00010592650865312265], 0, 1.3595197200775146, 1544065140.2825387], "v": 0.1}
{"i": ["cuda", "conv2d_no_batching", [1, 28, 28, 128, 256, 3, 3, [2, 2], [1, 1]], {}, ["conv2d_no_batching", 1, 28, 28, 128, 256, 3, 3, [2, 2], [1, 1]], {"i": 67776742, "t": "", "c": null, "e": [["tile_f", "sp", [8, 2, 8, 1]], ["tile_y", "sp", [2, 1, 7, 1]], ["tile_x", "sp", [7, 1, 2, 1]], ["tile_rc", "sp", [128, 2, 1]], ["tile_ry", "sp", [1, 3, 1]], ["tile_rx", "sp", [1, 3, 1]], ["auto_unroll_max_step", "ot", 1500], ["unroll_explicit", "ot", 1]]}], "r": [[0.00010554491121143716], 0, 1.406083583831787, 1544065141.4280849], "v": 0.1}
{"i": ["cuda", "conv2d_no_batching", [1, 28, 28, 128, 256, 3, 3, [2, 2], [1, 1]], {}, ["conv2d_no_batching", 1, 28, 28, 128, 256, 3, 3, [2, 2], [1, 1]], {"i": 67841786, "t": "", "c": null, "e": [["tile_f", "sp", [8, 1, 16, 1]], ["tile_y", "sp", [7, 1, 2, 1]], ["tile_x", "sp", [2, 1, 7, 1]], ["tile_rc", "sp", [32, 8, 1]], ["tile_ry", "sp", [1, 3, 1]], ["tile_rx", "sp", [1, 3, 1]], ["auto_unroll_max_step", "ot", 1500], ["unroll_explicit", "ot", 1]]}], "r": [[0.00011280112641083523], 0, 1.5303843021392822, 1544065142.6302226], "v": 0.1}
{"i": ["cuda", "conv2d_no_batching", [1, 28, 28, 128, 256, 3, 3, [2, 2], [1, 1]], {}, ["conv2d_no_batching", 1, 28, 28, 128, 256, 3, 3, [2, 2], [1, 1]], {"i": 30704667, "t": "", "c": null, "e": [["tile_f", "sp", [4, 2, 16, 1]], ["tile_y", "sp", [14, 1, 1, 1]], ["tile_x", "sp", [1, 1, 14, 1]], ["tile_rc", "sp", [128, 1, 2]], ["tile_ry", "sp", [1, 3, 1]], ["tile_rx", "sp", [1, 3, 1]], ["auto_unroll_max_step", "ot", 1500], ["unroll_explicit", "ot", 0]]}], "r": [[9.440258088788563e-05], 0, 1.3611299991607666, 1544065143.7213473], "v": 0.1}
{"i": ["cuda", "conv2d_no_batching", [1, 28, 28, 128, 256, 3, 3, [2, 2], [1, 1]], {}, ["conv2d_no_batching", 1, 28, 28, 128, 256, 3, 3, [2, 2], [1, 1]], {"i": 68060190, "t": "", "c": null, "e": [["tile_f", "sp", [4, 1, 32, 1]], ["tile_y", "sp", [14, 1, 1, 1]], ["tile_x", "sp", [1, 1, 14, 1]], ["tile_rc", "sp", [64, 2, 2]], ["tile_ry", "sp", [1, 3, 1]], ["tile_rx", "sp", [1, 3, 1]], ["auto_unroll_max_step", "ot", 1500], ["unroll_explicit", "ot", 1]]}], "r": [[8.438157938299474e-05], 0, 1.296736717224121, 1544065144.7606988], "v": 0.1}
{"i": ["cuda", "conv2d_no_batching", [1, 28, 28, 128, 256, 3, 3, [2, 2], [1, 1]], {}, ["conv2d_no_batching", 1, 28, 28, 128, 256, 3, 3, [2, 2], [1, 1]], {"i": 67800026, "t": "", "c": null, "e": [["tile_f", "sp", [8, 1, 16, 1]], ["tile_y", "sp", [1, 1, 14, 1]], ["tile_x", "sp", [14, 1, 1, 1]], ["tile_rc", "sp", [64, 4, 1]], ["tile_ry", "sp", [1, 3, 1]], ["tile_rx", "sp", [1, 3, 1]], ["auto_unroll_max_step", "ot", 1500], ["unroll_explicit", "ot", 1]]}], "r": [[8.063521595184349e-05], 0, 1.3289804458618164, 1544065145.8162947], "v": 0.1}
{"i": ["cuda", "conv2d_no_batching", [1, 28, 28, 128, 256, 3, 3, [2, 2], [1, 1]], {}, ["conv2d_no_batching", 1, 28, 28, 128, 256, 3, 3, [2, 2], [1, 1]], {"i": 67783738, "t": "", "c": null, "e": [["tile_f", "sp", [4, 1, 16, 2]], ["tile_y", "sp", [14, 1, 1, 1]], ["tile_x", "sp", [1, 1, 14, 1]], ["tile_rc", "sp", [128, 2, 1]], ["tile_ry", "sp", [1, 3, 1]], ["tile_rx", "sp", [1, 3, 1]], ["auto_unroll_max_step", "ot", 1500], ["unroll_explicit", "ot", 1]]}], "r": [[9.42943754702784e-05], 0, 1.3451461791992188, 1544065146.8978486], "v": 0.1}
